subreddit,post_id,comment_id,comment_content,comment_score,comment_created_at,comment_author
travel,1k4jz2l,moaqztz,"I've seen some blogs that recommend vegan-friendly resorts. I just search for ""vegan friendly resort"" and usually come up with quite a few options.

For local restaurants and options, the HappyCow app does a pretty good job. If a destination has a lot of options, I figure the area is pretty vegan-friendly and it won't be too hard to find things to eat. If HappyCow doesn't show many local eateries, I assume it's a probably a vegan desert and I'll be shopping at the grocery store and buying my own food.

Whenever I'm dreaming up plans for a future trip, literally the second thing I do after throwing darts at the map is to check HappyCow for that location to see if there are at least a few places I'll be able to eat. Some places are great and have a ton of options. Some places I've had to cross off my list because it was pretty clear I'd be living off bread and fruit the entire time.",1,2025-04-21 18:35:26,-Chemist-
travel,1k4hdf6,mo9ze2e,No trains but local buses run regularly. You can check the timetable at: https://arriva.si/en/international_transfers/koper-trst-trieste-from-1-7-2024-on/ - fare (unless it has changed) is €4.40.,2,2025-04-21 16:21:24,skifans
travel,1k4hdf6,moa19t4,You have regular connections by buses but none the Sunday. Easy to use them.,2,2025-04-21 16:30:58,newmvbergen
travel,1k4fdvv,mo9oga0,There's plenty of shows and rides you can do with your kids at Disney which sounds perfect for what you are looking for. There are a ton of things geared towards little kids. Transportation is included and there are tons of restaurants. Also there's a first aid in all of the parks staffed by nurses and they have their own EMTs and ambulance services if your son should need it in the parks,3,2025-04-21 15:13:00,fluffy_bunny22
travel,1k4fdvv,moapdo9,Legoland. It's designed for younger kids. It's colorful without being overstimulating and the park isn't huge. There's a connected hotel.,1,2025-04-21 18:27:29,rK91tb
travel,1k4fdvv,moaupbf,What about somewhere like [BlackBerry Farm](https://www.blackberryfarm.com/experiences/activities/family-and-kids)?,1,2025-04-21 18:53:40,Comfortable-Nature37
travel,1k4fdvv,moazyjm,"Give this a look:

https://tylerplace.com/",1,2025-04-21 19:19:39,Purlz1st
travel,1k4d5u5,mo922m9,"**Notice:** Are you asking for travel advice about Italy?

Read what redditors had to say in the **[weekly destination thread for Italy](https://redd.it/304ym7)** 

You may also enjoy our topic: **[Italy off the tourist trail](https://redd.it/8nigg3)**

*I am a bot, and this action was performed automatically. Please [contact the moderators of this subreddit](/message/compose/?to=/r/travel) if you have any questions or concerns.*",1,2025-04-21 13:11:29,AutoModerator
travel,1k3yuo1,mo6znx7,"The full Inca trail takes 4 days/3 nights to hike, and you’re hiking in the backcountry for the entire duration. There are only a few places where you can actually join the trail, and logistically a 3 day/2 night trek does not make any sense. So the shorter option (2D/1N) is basically joining the trail near Aguas Calientes, hiking for 5-6 hours along the tail end of the trail, then either camping or going back down into town to stay at a hotel. Then the next morning you take a bus up to Machu Picchu and explore that. So it really just depends on how much hiking you want to do and how much of your trip you want to devote to that versus doing other things in the area. In either case, you’ll take the train at least from Aguas Calientes to Ollantaytambo (it’s the only way to get between them). 

I would say that only two days in Cusco (plus the Sacred Valley, which is at a lower altitude) is only barely enough time to acclimatize if you plan to do the full 4 day trek. It’s probably fine if you just do the shorter option. It also doesn’t *really* make sense to visit Ollantaytambo/Sacred Valley as a day trip, return to Cusco, and then immediately retrace your steps to go back towards Machu Picchu",2,2025-04-21 02:29:28,ggrnw27
travel,1k3yuo1,mo60718,"**Notice:** Are you asking for travel advice about Peru?

Read what redditors had to say in the **[weekly destination thread for Peru](http://redd.it/2o1sti)** 

*I am a bot, and this action was performed automatically. Please [contact the moderators of this subreddit](/message/compose/?to=/r/travel) if you have any questions or concerns.*",1,2025-04-20 22:57:20,AutoModerator
travel,1k3yuo1,mo7a9aw,I'd say you only need one day for rainbow mountain!,1,2025-04-21 03:38:48,1234drop
travel,1k3yuo1,mo7cbbw,"I’m a little confused by your queries regarding a “tour of Machu Picchu for 4D” and “hiking + train.”  Are you looking to hike to MP.  Or are you looking to take a train and hike around a bit while out there. 

If the former, there are “two-day hikes” to MP. Basically, the train takes you like 90% of the way to Aguas Calientes, you get off the train at like km 104, and you hike the rest of the way with your guide. This needs to be planned because you literally just get off the train in the middle of nowhere.  

If the latter, I don’t recall that there were hikes in Ollantaytambo. There are “hikes” as part of some circuits at MP.

As for some of your requests for recommendations:

-Hotel in Cusco:  we stayed at Casa Clara. It’s a new-ish boutique hotel by Annanay Hotels near the Belmont and Inkaterra.  If you’re into walking, it’s just about at the start of the road leading to Sacsaywaman.  We really liked this hotel because it was smaller and the staff was so welcoming.  And it was right next door to the art museum which was open late. 

-Hotel in Ollantaytambo:  we stayed at El Albergue at the train station.  It was pretty cool just needing to walk outside to catch the train. And they watch your luggage while you are at MP.

-Tour Companies:  we went with cuscolocalfriend.com for most things.  They were really great to work with (but, admittedly, maybe a little slow with emails while we were trying to schedule things).  No complaints though. They even helped us create more bespoke plans.",1,2025-04-21 03:53:50,Serious_Method138
travel,1k3yuo1,mo7ddf2,Hey yea this was a bit confusing. I  meant part train part hike which from my research and the comments here seems like the 2D/1N hike does that (90% as you said). As for planning we would probably go with a tour company so I assume the planning would be done for us. Appreciate the tour company recs and hotel recs will definitely look into this!,1,2025-04-21 04:01:46,HalWhite5
travel,1k3yuo1,mo7vkv4,There really isn’t anything to do in Aguas Calientes. We did a 2 day 1 night stay but we arrived to AC on the latest train and instantly went to our room. Then did Huayna Picchu at 7am and MP at 12pm and still was able to catch the 4pm train out to Cusco. 2 nights for me would be too many nights there.,1,2025-04-21 06:51:14,averagegolfer921
travel,1k3yuo1,mo9f6z0,"I reckon you're not seeing enough of Peru. I missed the Nazca Lines but otherwise spent 8 nights:

1, 2. Arequipa (Mummy Juanita) 3.,4. Cabanaconde (Colca Canyon) 5. Puno (Lake Titicaca) 6. Macchu Picchu (incl Huayna Picchu) 7. Cusco 8. Lima Airport",1,2025-04-21 14:26:00,BS-75_actual
travel,1k3y9b9,mo5vfvv,"**Notice:** Are you asking for travel advice about Brazil?

Read what redditors had to say in the **[weekly destination thread for Brazil](https://redd.it/45k3jv)**

You may also enjoy our topic: **[Brazil off the tourist trail](https://redd.it/905ojq)**

*I am a bot, and this action was performed automatically. Please [contact the moderators of this subreddit](/message/compose/?to=/r/travel) if you have any questions or concerns.*",1,2025-04-20 22:28:02,AutoModerator
travel,1k3y633,mo68trz,"- It’s strenuous, no way around that. I might’ve done more difficult single day hikes elsewhere, but the combination of 4 days in a row of hiking plus the altitude makes it difficult. But not impossible if you’re in good shape, just challenging. Day 1 is a bit tough while you’re getting used to the trail, day 2 is by far the hardest, days 3 and 4 are easier
- Most hotels in Cusco will store it for you at no charge, especially if you stay there again after the hike
- No power, bring a battery pack and/or solar charger and keep your phone off or in airplane mode to save battery
- It’s backcountry camping. I’d recommend paying extra for an air mattress pad (the porters carry it for you). There’s a cold shower available at one of the later campsites, I think night 3",3,2025-04-20 23:49:10,ggrnw27
travel,1k3y633,mo8rqjz,Two common rookie errors: (1)  arriving in MP too exhausted to enjoy the site and (2) failing to book access to Huayna Picchu and being too tired to climb it anyway,2,2025-04-21 12:02:37,BS-75_actual
travel,1k3y633,mo7hl4r,"I read up enough about it, that I realised I would hate it. I’m not fit enough, I never was and it took up too much time. Plus the altitude. 

I saved the energy and money for Macchu Picchu x 2 mountains instead.",2,2025-04-21 04:35:41,Cheeseoholics
travel,1k3y633,mo9ao9e,"Hi OP!

The four day Inca Trail was one of the best experiences of my life; I'd say that the trail is almost a greater 'destination' than Machu Picchu itself.

The two day 'Inca Trail' is an access track installed by the Peruvian government which effectively skips the Trail that was built by the Inca.

My two cents are you should either walk the four day trail or just take the train directly to Machu Picchu.

The altitude is no joke but a few days in Cuzco make a big difference in getting you acclimatised.

Porters are mandatory; the groups are all pretty similar. They put us all to shame with the loads they carry and the food they prepare was incredible.

Good luck and happy planning!",1,2025-04-21 14:01:50,two_atara
travel,1k3tlux,mo4t0jb,"Hi /u/tangierprops, Thank you for your submission. The mods have been notified and it will be checked in due course - there's no need to message them.

In the meantime please **ensure it has the country in the title** and follows the image posting title and content guidelines in the [FAQ](https://www.reddit.com/r/travel/wiki/faq#wiki_.22here_are_my_holiday_photos.21.22) otherwise it will be removed without further explanation. **If your images span a number of locations or attractions within a country or city explain where each of them were taken and what we are looking at**. Whilst waiting, please add a comment and captions telling us something interesting about the trip. If you can't add anything interesting please use a dedicated photography subreddit.


*I am a bot, and this action was performed automatically. Please [contact the moderators of this subreddit](/message/compose/?to=/r/travel) if you have any questions or concerns.*",1,2025-04-20 18:49:52,AutoModerator
travel,1k3rdfk,mo7v61d,I would consider this a bit too much driving. Keep in mind that on these road your average speed will not go above 60 km/h.,2,2025-04-21 06:46:55,Redstear
travel,1k3rdfk,mo4a7xm,"**Notice:** Are you asking for travel advice about Norway?

Read what redditors had to say in the **[weekly destination thread for Norway](http://redd.it/3ebvsa)**  

*I am a bot, and this action was performed automatically. Please [contact the moderators of this subreddit](/message/compose/?to=/r/travel) if you have any questions or concerns.*",1,2025-04-20 17:11:24,AutoModerator
travel,1k3rdfk,mo76us5,Sounds horrible.,1,2025-04-21 03:14:58,Oftenwrongs
travel,1k3oajj,mo3lrfy,"What a lovely sentiment! You would know better if that is enough heads up for him to take time or/make necessary arrangements. However, sooner is better to avoid having to re-arrange plans later. You also don't have to say everything, could just say your gift is a trip, you need X-Y days off, and the rest will be a surprise :)",6,2025-04-20 15:00:27,PathstoTravel
travel,1k3oajj,mo3ztzt,"Get him something for Christmas that he can use on a future surprise  trip (an underwater camera? a stylish suitcase? a nice pair of sandals?) and tell him the dates he needs to accommodate - could be a fun way to keep him guessing, and it's on theme.",2,2025-04-20 16:16:23,isotaco
travel,1k3oajj,mo4ea4q,"Or just say hey, can you take these dates off work? I'm planning something",1,2025-04-20 17:32:14,PM_ME_YOUR_KINKAJUS
travel,1k379mx,mnztxod,"The easiest way is to make an appointment at an office. You need to show proof of travel within two weeks. 


You'll get your passport same day or next day, depending on the office.",212,2025-04-19 21:53:32,Environmental-Bar847
travel,1k379mx,mnzu1yj,Show you have international travel in 14 days and get a same day passport.,26,2025-04-19 21:54:15,ommmyyyy
travel,1k379mx,mnzu3nz,I did it online and did not have to send in my passport. They will invalidate your current passport as part of the process. On normal processing it took 13 days from submitting to sending it in. That’s not guaranteed. Your other option is to go to a passport office and do same day. ,28,2025-04-19 21:54:31,Fresh_Mountain_Snow
travel,1k379mx,mo0rpfb,"Request a second passport. Use the form letter found on https://travel.state.gov/content/dam/passports/content-page-resources/Sample%20Statement%20for%20a%20Second%20Passport_2021.docx

 It’s straightforward. 2nd passport is good for 4 years, as opposed to 10 years for regular passport",8,2025-04-20 01:15:29,Lumpy-Ad-2830
travel,1k379mx,mnzziey,The online renewal has a turnaround of like a week.,11,2025-04-19 22:25:55,Lunar_BriseSoleil
travel,1k379mx,mnzzob2,Go to a passport office and pay the fee for the fastest turn around time. I think it's around 5-7 days for renewals.,5,2025-04-19 22:26:52,spiforever
travel,1k379mx,mo09x3f,"My wife and I just did online renewal ahead of a trip to France (didn't know you needed 6 months validity left on the passport).

The tracker said 4 to 6 weeks but we were literally accepted the next day, processed the day after, and had our replacements in hand within the week. 

We did not have to send in the old one, but note that the old one is invalid for travel as soon as the application is accepted.",6,2025-04-19 23:26:36,avidal
travel,1k379mx,mnzuvxg,"Can't help for the US specifically, but in my company, executives who travel *a lot* have two passports (from the same country) that they use at the same time. One passport gets sent to embassies for visas, while the other one gets used to travel that week, and then they alternate. Probably it's not possible everywhere, though.",12,2025-04-19 21:59:03,GoldenPei
travel,1k379mx,mo12v94,Don’t. Wait. Get this done ASAP,3,2025-04-20 02:25:51,Sharontoo
travel,1k379mx,mo1w4qo,"Book agency appointment. Go to agency in morning, show proof you have a ticket that night, pick up at 2 pm",3,2025-04-20 06:22:51,Old_Confection_1935
travel,1k371zp,mnzso81,"Yes, sometimes aggregators and search engines (incl. Google Flights, ITA Matrix) can show fares and constructions that the airline's own website can (purposely) omit but can still be purchased if clicked through an API.

A lot of times, airlines own websites may choose to omit ""less desirable"" itineraries from being displayed despite being a valid routing.

e.g. I wanted to book YYC-YYZ-YOW-YUL-YQM-YUL-YYC on Air Canada which was only possible through a Google Flights API fare construction. A few others come to mind on AC and UA but I won't list them all here.",8,2025-04-19 21:46:18,protox88
travel,1k371zp,mnztbu3,"Not sure why this happened but the same thing happened for me when searching for a flight on Skyscanner. Took me to United's website and I booked through them. Had 2 flights with United and then 1 with Swiss. Could NOT find the flight at all on United's website even though there were plenty of seats available but I had zero issues 

Would love to know why this is also!",1,2025-04-19 21:50:02,Dhoinegirl
travel,1k371zp,mo25uv2,"No idea but same with me on a airasia flight from singapore to nepal. It was legit though, bags went though straight to nepal",1,2025-04-20 08:02:10,yellowsuprrcar
travel,1k2z395,mnydvjb,"Look up Gasthof Schonau. I stayed there a few years ago. Highly recommend it. Located near where “Otzi” was found. I was going to stay one night and stayed four. Walked all over the place!  Family run. Good restaurant. Everyone was very friendly. Also if you are on a time constraint, rent a car. No sense wasting a minute of your trip waiting around for a bus or a train!",3,2025-04-19 17:09:10,Covered4me
travel,1k2z395,mo5bc45,"The Dolomites are going to be jam packed with tourists in July, but you'll love it regardless. It is so beautiful there.",2,2025-04-20 20:31:44,tgsgirl
travel,1k2t0iv,mnwkwn5,"**Notice:** Are you asking for travel advice about Bosnia?

Read what redditors had to say in the **[weekly destination thread for Bosnia](https://redd.it/4zv8ti)**  


*I am a bot, and this action was performed automatically. Please [contact the moderators of this subreddit](/message/compose/?to=/r/travel) if you have any questions or concerns.*",1,2025-04-19 10:11:08,AutoModerator
travel,1k2t0iv,mnww7ja,"Is your bus stopping at the istocno Sarajevo bus station? This isn't the eastern bus terminal but the bus station for the town of eastern Sarajevo (a result of the war in the 90s). I would be very surprised if you found a bus company that only stops there and does not continue to Sarajevo proper. Your best bet would be to ask the bus driver if the bus you are on also stops at Sarajevo proper and pay the fare difference. You can also ask at the Belgrade bus station if the bus you will take will also stop at Sarajevo. 

If you do get out at istocno Sarajevo then the Dobrinja terminal city bus stop is near and from there you can catch a local bus to the city center. The Bingo Centar Istočno Sarajevo is a local Shopping center that isn't too far from the bus station and Google Maps says that you can find ATMs there. You could also ask in a local shop if they would be willing to exchange a small Euro amount for bosnian marks, they might be willing to help. This small amount should be enough to cover the bus fare.",1,2025-04-19 11:55:12,EmbarrassedBadger922
travel,1k2fpew,mntpety,"**Notice:** Are you asking for travel advice about Nicaragua?

Read what redditors had to say in the **[weekly destination thread for Nicaragua](https://redd.it/4nmc2c)**  

*I am a bot, and this action was performed automatically. Please [contact the moderators of this subreddit](/message/compose/?to=/r/travel) if you have any questions or concerns.*",1,2025-04-18 21:08:26,AutoModerator
travel,1k2bwck,mnt2dgk,Worked in Yellowstone. Without a car forget it. ,76,2025-04-18 19:06:34,AmphibianBasic8883
travel,1k2bwck,mnsusxj,"If you don't have a car rental, Yellowstone is a bad choice.

Florida is Florida, so skip that one.

Seattle and Portland have lots to do and you can get around via a mixture of mass transit and Ubers.  I'd pick that one.",252,2025-04-18 18:27:27,baeb66
travel,1k2bwck,mnt5c9b,"You can do outdoors stuff and also enjoy a wide variety of amazing urban delight in Seattle/Portland.  
Seattle: take a ferry over to Bainbridge Island (walk on), check out the Bloedel Reserve, eat at Ba Sa (seriously, you must do this).  Enjoy Eagle Harbor books, get a snack at Blackbird Bakery.

If you want to continue on, you could rent a car and explore Hurricane Ridge [Hoh Rain Forest Area Brochure - Olympic National Park (U.S. National Park Service)](https://www.nps.gov/olym/planyourvisit/hoh-rain-forest-area-brochure.htm) (currently open, check status before driving up there and if you do go, get your park pass in advance). Absolutely amazing views and stunning scenery.

In Seattle itself, there's a ton to do. Olympic Sculpture Park, newly completed waterfront ([Seattle Waterfront - Food, Fun & Attractions on 20 Piers](https://seattlewaterfront.org/)). If you have good weather, you'll see Mt Tahoma (Rainier).  If you happen to have a car, you could do Chuckanut Drive (what a name, but seriously gorgeous: [Chuckanut Drive Scenic Byway](https://www.scenicwa.com/chuckanut-drive)).

If you go to Portland, you could take Amtrak or bus it, but once you get to Portland, park your car in any SmartPark garage ([SmartPark Garages | Portland.gov](https://www.portland.gov/transportation/parking/smartpark)) and use MAX, which can take you all over. Check out the International Rose Gardens, the gorgeous Japanese Gardens, great views of Mt. Hood. Portland still has a strong food truck scene ([Food Cart Pods | The Official Guide to Portland](https://www.travelportland.com/food-carts/pods/)). If you love books, a lot at least 1-2 hours for Powells City of Books (new and used, [The World's Largest Independent Bookstore | Powell's Books](https://www.powells.com/)). There is no shortage of fantastic food in Portland, but for reliably good and affordable fare, seek out [Pubs, Breweries and Historic Hotels in Oregon and Washington - McMenamins](https://www.mcmenamins.com/), which also has inns and hotels. If you want to venture further west, check out McMinnville with wineries and the Evergreen Aviation Museum. If you want to head east, you can drive the gorgeous Columbia Gorge ([Mt. Hood & The Columbia River Gorge | Things to See & Do](https://traveloregon.com/places-to-go/regions/mt-hood-columbia-river-gorge/?utm_actcampaign=521178873&msclkid=b3a26122b16912c0302f09201759da1c&utm_source=bing&utm_medium=cpc&utm_campaign=**LP%20-%20Tier%205&utm_term=Columbia%20River%20Gorge%20Travel&utm_content=Columbia%20River%20Gorge%20Travel)) which has some lovely waterfalls and hiking.

Enjoy your trip OP!",24,2025-04-18 19:22:19,SarcasticServal
travel,1k2bwck,mnsvduz,Seattle and Portland for sure! I did that in May a couple years ago and it was great. Both cities have great food and public transit (including directly from the airport). You can take an Amtrak train between the two cities too.,44,2025-04-18 18:30:27,interstatesntents
travel,1k2bwck,mnt35o3,I recommend Seattle and the San Juan Islands!,21,2025-04-18 19:10:45,mashel2811
travel,1k2bwck,mntz4lk,"Go to San Francisco, explore the city and then book a tour to Napa Valley!",10,2025-04-18 22:02:31,The_Great_Beyond2021
travel,1k2bwck,mnsvqm3,"There is no such thing as public transportation in Florida. You have to drive/uber everywhere. There’s also no scenic views other than flat beaches surrounded by high rise buildings and what’s remaining of the Everglades which you need a car to get to. The only culture you can find in Florida is the Cuban culture in Miami. Everywhere else the culture is old retired MAGA white people. 

Seattle would be your best option. You don’t need to drive almost anywhere. You can explore the city and surrounding islands without a car. 

Yellowstone is amazing if you’re fine doing a group tour. Group tours in the US are typically made up of elderly people, so you shouldn’t have to worry about it being rushed or tiring.",38,2025-04-18 18:32:17,munnexdio
travel,1k2bwck,mntlgl3,"Florida will be hard without a car unless you’re staying at the resorts and using their buses to do everything Disney. You could take the bright line train to Miami, however, early May is the Miami Grand Prix and everything will be super expensive and crazy busy.  

I would go to San Fran. There’s so many beautiful parks and neighborhoods to walk around in the city, and a bus tour can get you to Muir Woods. No car needed.",7,2025-04-18 20:47:36,boneydog22
travel,1k2bwck,mnsycyf,"Have you been to New Orleans in recent years? The restaurant scene is amazing. The WW2 museum is world-class. And then there’s the music! Lots of neighborhoods are walkable (Bywater, Marigny especially). The $2 Canal Street ferry to Algiers Point takes you to another walkable neighborhood, and it runs every half hour.",6,2025-04-18 18:45:43,livemusicisbest
travel,1k2bwck,mnt7hau,"If you won’t have a car Seattle and Portland are the only real options on this list. 

Don’t give your money to Florida.",14,2025-04-18 19:33:48,sgtapone87
travel,1k2a6d8,mnsfnea,"**Notice:** Are you asking for travel advice about Munich?

You may enjoy this **[extensive user review of daytrips](https://redd.it/b13vlv/)** from Munich.


*I am a bot, and this action was performed automatically. Please [contact the moderators of this subreddit](/message/compose/?to=/r/travel) if you have any questions or concerns.*",1,2025-04-18 17:12:30,AutoModerator
travel,1k2a6d8,mnsod22,"story2go München, Komoot, Locco, Rausgegangen, Findeling. Hope that helps ",1,2025-04-18 17:54:56,More_Storage6801
travel,1k261ls,mnrolxn,"I did both (not an overnight, longer trips) last year. If memory serves, it's quite a bit easier in Dublin to pop into town for a pint or three from an airport hotel, or stay downtown and still have good access to the airport. Getting in at 16:30 would give you a decent evening out.


FCO <> Termini isn't terrible, and you could hit a couple of spots very early (Spanish Steps, Trevi), like before the sun rises, and beat the crowds,but you wouldn't really have time to do much else before you'd want to head out. ",5,2025-04-18 14:57:23,Ruffshots
travel,1k261ls,mnrx5c6,I’d rather have a full evening out in Dublin than a few morning hours in Rome. I’d also rather do immigration pre clearance in Dublin.,5,2025-04-18 15:39:50,haysu-christo
travel,1k261ls,mnrgxn0,"**Notice:** Are you asking for travel advice about Italy?

Read what redditors had to say in the **[weekly destination thread for Italy](https://redd.it/304ym7)** 

You may also enjoy our topic: **[Italy off the tourist trail](https://redd.it/8nigg3)**

*I am a bot, and this action was performed automatically. Please [contact the moderators of this subreddit](/message/compose/?to=/r/travel) if you have any questions or concerns.*",1,2025-04-18 14:18:12,AutoModerator
