subreddit,post_id,comment_id,comment_content,comment_score,comment_created_at,comment_author
worldnews,1k3bxgk,mo0zxt3,"Putin wants to temporary stop playing Russian roulette with Ukraine, so he can take the revolver and just shoot Zelsky with it. Don't believe a word of his promises.",5,2025-04-20 02:07:22,Exact_Patience_9767
worldnews,1k3bxgk,mo5j0us,Never trust a Putin.,1,2025-04-20 21:14:39,petwalker12
worldnews,1k1n8jh,mnnetca,"Users often report submissions from this site for sensationalized articles. Readers have a responsibility to be skeptical, check sources, and comment on any flaws.

You can help improve this thread by linking to media that verifies or questions this article's claims. Your link could help readers better understand this issue.

*I am a bot, and this action was performed automatically. Please [contact the moderators of this subreddit](/message/compose/?to=/r/worldnews) if you have any questions or concerns.*",1,2025-04-17 20:44:58,AutoModerator
worldnews,1k1n8jh,mnnfckw,"what ""activists"". Call them what they are. Murderers. A person got killed. If you want to trash the place, at least let the poor sobs who got paid minimum wage working long hours get out first.",402,2025-04-17 20:47:34,NyriasNeo
worldnews,1k1n8jh,mnnvrob,So what exactly is the connection between KFC and Israel? I don't think anyone ever would think that Colonel Sanders was a Jew.,114,2025-04-17 22:12:18,YogiBarelyThere
worldnews,1k1n8jh,mnngdlt,">An employee of American fast-food chain KFC was killed in an attack carried out by members of the radical Islamist group Tehreek-i-Labbaik Pakistan (TLP) during an anti-Israel demonstration in Pakistan’s Punjab province, police said on Tuesday.

In some places today, even the weakest perceived affiliation with Israel is enough to put your life at risk.",179,2025-04-17 20:52:35,-Cohen_Commentary-
worldnews,1k1n8jh,mno915r,There is no place in the 21st century for Islamic rule nor any theocracy. The worlds governments should respect all religious belief but not be subject to it. State engineered fanaticism and abuse is always the end result when they are.,93,2025-04-17 23:28:21,monkeywithgun
worldnews,1k1n8jh,mnrdc2z,"All religions suck, but Islam is by far the worst.",26,2025-04-18 13:58:54,Screamin_Toast
worldnews,1k1n8jh,mno3usv,I guess the reporter was too busy to type out the whole country's name,21,2025-04-17 22:58:28,peepee_poopoo_fetish
worldnews,1k1n8jh,mnqhhzz,"An employee of American fast-food chain KFC was killed in an attack on the restaurant on Tuesday by a radical Islamist party during an anti-Israel protest in Punjab province, police said. . The news article is very misleading. This is called Murder",10,2025-04-18 10:15:07,TXswingTRADER
worldnews,1k1n8jh,mno7kil,Activist…Terrorist..it’s a fine line!,13,2025-04-17 23:19:55,CalmRelease2816
worldnews,1k1n8jh,mnr38ad,What a culture that routinely produces this.,6,2025-04-18 13:00:28,Cicada-4A
worldnews,1jlp303,mk5b7av,"It's Trump calling Canada the ""51st state"" and threats of annexation that has angered Canadians more than the tarrifs, in my opinion.",138,2025-03-28 07:11:10,HelFJandinn
worldnews,1jlp303,mk5c0gq,"Ultimate winner out of all of this chaos will be china. What will suck is this impact on repairs, car insurance, and general national security. Unfortunate that the US standing is diminishing and less reliable as an ally but sadly that is was some people voted for.",33,2025-03-28 07:20:00,KazeNilrem
worldnews,1jlp303,mk59ti5,How many Russian spies work in the Trump administration?,27,2025-03-28 06:56:17,Positive_Owl_2024
worldnews,1jlp303,mk61rjg,Shame on all ppl who voted for the orange orangutan. ,8,2025-03-28 11:37:10,Quirky_Discipline346
worldnews,1jlp303,mk5ml5m,When will Great Depression II start in the USA? Those Americans who voted for Trump need to be punished severely.,13,2025-03-28 09:17:02,AmericanSahara
worldnews,1jlp303,mk6s46a,"Carney has the right approach, don’t give in to tRump, ignore him and continue with new trade partners. You can’t make any deal with him that he won’t break in his next rant. We would not deal with any other country that threatened to annex us, why should we make a deal with this orange turd.",4,2025-03-28 14:18:05,wtf1970
worldnews,1jlp303,mk75br1,"The US is a prescription drug nation. Mostly, all of our drugs are made elsewhere, China, India etc. Many of the large pharmas are not located in the USA. Wouldn't it be best for these countries to tariff drugs. Let's get real. Hit tRumps version of America where it really hurts.",4,2025-03-28 15:24:11,Sea_Comedian_3941
worldnews,1jlp303,mk74yah,if you’re wondering why all the hostility towards Canada…there’s a simple explanation. Leon’s grandfather…living in Canada in the 1930’s and 1940’s…was jailed by Canada’s 🇨🇦 government for apparently being a Nazi sympathizer and trying to overthrow not only the Canadian government but…also the US government. Upon release from jail he attempted to do the same again …and was forced to flee….ending up in Apartheid South Africa…in 1950…closest thing to the Nazi Regime…Leon was born in 1971. Seems Leon….is trying to finish the job….his Grandfather…couldn’t. Now you know why the 🍊 slime ball has started a “war” against Canada….and you also know who the real ….president is!!!! We is fukked!!😂😂😂🍊enjoy…the destruction…80 years in the making!!!😂🍊😂🍊😂🍊,4,2025-03-28 15:22:21,Kuloman25Viascam
worldnews,1jlp303,mk793o0,"I think this all remains to be seen. No one is going to eat Canada, that much is clear. But the auto industry in particular? That’s going to be hugely damaging. ",2,2025-03-28 15:42:32,N/A
worldnews,1jlp303,mk6cacl,"One can only hope trump gets out of office asap and America can get back to normal. Just as he did in his first term, the orange buffoon is Embarassing our country.",1,2025-03-28 12:49:02,Automattics
worldnews,1jiz5wc,mjj2d7w,Not adding their own for Americans which is what I assumed from the title.,31,2025-03-24 19:21:29,Sideshift1427
worldnews,1jiz5wc,mjk7fzu,"Just Canada telling people what then US updated policy is, nothing to see here. It’s not retaliation or anything, it’s litterally the US wants people in there country longer than 30 days to give fingerprints, used to not apply to people from Canada, but now it does.",31,2025-03-24 22:46:02,crimxxx
worldnews,1jiz5wc,mjlkjb2,I miss the days where a valid drivers license was enough to cross the border,9,2025-03-25 03:30:06,JLR-
worldnews,1jiz5wc,mjl0km3,Remember these poorly educated republicans were saying Biden and Harris would make America worse and here we are with the convicted felon weaking and making America a joke to the entire world lol,8,2025-03-25 01:25:11,N/A
worldnews,1jiz5wc,mjkr7sl,"Interesting to note that Canadians who were previously given an I-94 are already in the system and no further action is required. Also, Canadians are (at least for now) exempt from the fingerprinting.

""If it appears that you are required to register, USCIS will review your Form G-325R to determine if you are required to appear for a biometric services appointment. If you are not required to appear for a biometric services appointment (for example, Canadian visitors and aliens under 14 years of age), USCIS will provide you with evidence of registration."" Source: [https://www.uscis.gov/alienregistration](https://www.uscis.gov/alienregistration)",5,2025-03-25 00:30:51,Deferian
worldnews,1jiz5wc,mjlvyjd,"Next, trump will want any American traveling to Canada or any other ex-friendly country,, must register with the state department when leaving and entering back into this country.",2,2025-03-25 05:00:10,OldHippie54
worldnews,1k043v6,mnc0hrs,"Literally everyone should be warned against traveling to the United States.  

Even its own citizens.",46,2025-04-16 01:05:12,TheThirdStrike
worldnews,1k043v6,mnbacjs,I plan to never set foot on US soil ever again.,61,2025-04-15 22:34:39,Lost_my_loser_name
worldnews,1k043v6,mnc8prp,Yeah I'm okay not going to the US for a loooooong time,8,2025-04-16 01:54:42,ms_grumpy
worldnews,1k043v6,mncu8b6,My school asked if was interested in joining a trip to New York this week. it would have been all paid for. I said under no circumstances and I don't think the kids should go either. I felt the same about trips to North Korea when I lived in Seoul. It was possible at the time but why risk it and why give even a penny to an authoritarian regime that is hostile towards my country? I won't.,7,2025-04-16 04:18:31,InternationalWin6623
worldnews,1k043v6,mnb4jw7,Our country is wild af. The US needs to leave these popr people alone.,15,2025-04-15 22:02:04,RetardoVazquez
worldnews,1k043v6,mnb2qlv,[deleted],15,2025-04-15 21:52:16,N/A
worldnews,1k043v6,mnbpgsm,I know some that should definitely think twice anytime. Self righteous with big mouths.,-23,2025-04-16 00:00:30,forty83
worldnews,1k043v6,mnbwt05,I had planned to RV across the US next year for 6 months. Fuck that. Off to Asia instead,26,2025-04-16 00:43:18,SnuffleWarrior
worldnews,1k043v6,mnc7j5x,[deleted],-1,2025-04-16 01:47:34,N/A
worldnews,1k043v6,mnce9n3,Surely they know this already?,1,2025-04-16 02:28:50,tooshpright
worldnews,1jip606,mjgrvv2,"Users often report submissions from this site for sensationalized articles. Readers have a responsibility to be skeptical, check sources, and comment on any flaws.

You can help improve this thread by linking to media that verifies or questions this article's claims. Your link could help readers better understand this issue.

*I am a bot, and this action was performed automatically. Please [contact the moderators of this subreddit](/message/compose/?to=/r/worldnews) if you have any questions or concerns.*",1,2025-03-24 12:12:22,AutoModerator
worldnews,1jip606,mjgywh3,"The article states: 

""Canada's government now requires citizens staying in the U.S. for more than 30 days to register with U.S. authorities, warning that failure to do so could result in fines or misdemeanor charges. The new measure appears to align with a broader shift by the U.S. to more strictly monitor foreign nationals residing within its borders.""

That wording is misleading.
Canada's government has not put requirements on their citizens to register with the US government. That is a false statement. The requirements are a result of US policy. Not Canadian policy. It is US policy

In fact, this article is bullshit. 

This is the official Canadian government site and the travel advisory for the US is green: take normal security precautions

https://travel.gc.ca/travelling/advisories",772,2025-03-24 13:00:12,orphan1256
worldnews,1jip606,mjgz4ax,"This is non-news. USA enacted a new policy requiring visitors of longer than 30 days to check in and to have fingerprints on file - Canadian advice is just reflecting this change.


We of course have had unofficial travel advice from the government urging us to travel at home and avoid giving tourist dollars to the states, but that isn't any sort of official policy.",76,2025-03-24 13:01:35,somebunnyasked
worldnews,1jip606,mjh0b2v,As a Canadian you couldn’t pay me to go to the USA now.,50,2025-03-24 13:09:05,gleokunjie
worldnews,1jip606,mjgsciy,Good travel advice might be to travel somewhere else,105,2025-03-24 12:15:45,Ambitioso
worldnews,1jip606,mjgt8ig,"My blood starts to boil all over again every time I hear about Trump saying that ""Canada is not a real country"" (quoted by Carney, video).  It's like another slap in the face every time.  The man is just so without honor and respect and dignity... he's so gauche and offensive.",61,2025-03-24 12:22:08,parfaythole
worldnews,1jip606,mjgtgcv,This is just a formality.  Canadians don't go to the US anymore.,36,2025-03-24 12:23:41,Much-Creme1362
worldnews,1jip606,mjh4ttf,[deleted],25,2025-03-24 13:36:24,N/A
worldnews,1jip606,mjgufsq,Destination America no longer exists for many Canadians.,18,2025-03-24 12:30:37,over_correct_ion
worldnews,1jip606,mjh8099,"What a shitty article! The US put restrictions on travel, not Canada. The 30 day stay fingerprinting is a US initiative, not from the Canadian side! There is, in fact, no current travel warning from Canada to the US.",15,2025-03-24 13:54:32,ThisIsTheNewSleeve
worldnews,1jsvara,mlpgvve,[deleted],94,2025-04-06 14:52:28,N/A
worldnews,1jsvara,mlpgzpw,Picture seams like old video game from the 90' like Myst 😅,33,2025-04-06 14:53:03,EstaticNollan
worldnews,1jsvara,mlq7yfv,"""Yay""",22,2025-04-06 17:18:58,TheyStillLive69
worldnews,1jsvara,mlpwbnb,Trump is gonna tariff the crap out of the supersonic missiles.,17,2025-04-06 16:16:36,Ytrewq9000
worldnews,1jsvara,mlr2nst,Yay let's die faster,13,2025-04-06 20:02:05,theredditmange
worldnews,1jsvara,mlpfc35,"When are the cretinous American military going to be kicked out of the UK?
Send them packing with Farage as their wee mascot.
FU USA.",-18,2025-04-06 14:43:54,Fun_Activity3503
worldnews,1jsvara,mlpkfi2,"Instead of focusing on climate change/housing/rising costs, we invest unimaginable amounts into how we can kill each other better.",-22,2025-04-06 15:11:39,Cannabis_carlitos89
worldnews,1jsvara,mlq33hf,Haven’t the Russians had this shit for years??,-33,2025-04-06 16:53:21,AmeliaMaggie
worldnews,1k0n2hu,mnfa4xo,Around 1300 km in 13 days strait. 80 of them.,28,2025-04-16 15:31:01,Past-Smell5567
worldnews,1k0n2hu,mnhbu6j,This is still not correct. The Council of Europe is their goal and not the European Union.,7,2025-04-16 21:36:13,toolkitxx
worldnews,1k0n2hu,mnf9p3l,Damn ! They are so impressive,16,2025-04-16 15:28:51,No-Community-
worldnews,1k0n2hu,mnhbkoe,"""Take their grievances to the EU""

What are they supposed to do, their not members of the EU. Something to do with corruption.",2,2025-04-16 21:34:48,Responsible-Side4347
worldnews,1k0n2hu,mnfgrxo,That's pretty weird considering Serbia is not even in the EU,-9,2025-04-16 16:03:36,Academic-Image-6097
worldnews,1jkf5g0,mjv0n7e,"And just like that, Brazil shows they have a stronger democracy than the US.",59,2025-03-26 16:54:49,cerevant
worldnews,1jkf5g0,mjupsfa,"Brazil’s Supreme Court has unanimously voted to put former President Jair Bolsonaro and seven allies on trial for their alleged roles in the 2022 attempted coup. The charges, filed by the Prosecutor General’s Office, accuse them of leading a ""criminal organization"" aimed at overthrowing democracy.",40,2025-03-26 16:02:13,Designer_Holiday3284
worldnews,1jkf5g0,mjuzh7f,"A great day for us Brazilians, or as we say here, ""abre a cerveja que hoje é festa!"".",20,2025-03-26 16:49:17,Mean_Joke_7360
worldnews,1jkf5g0,mjv17ul,"Watch and learn, USA.",19,2025-03-26 16:57:30,mittelwerk
worldnews,1jkf5g0,mjwqx9w,So when is he running to America?,4,2025-03-26 21:51:23,SpaceTruckinIX
worldnews,1jkf5g0,mjv10td,"Let's hope for similar with the current u.s. administration in the future, if the u.s. survives. Accountability will be the only way forward, if the u.s. ever hopes to rebuild ties to non-dictator aligned world powers.",5,2025-03-26 16:56:34,Blckmgk
worldnews,1jkf5g0,mjxjqiq,Trump next,2,2025-03-27 00:26:05,Available_Finish4387
worldnews,1jkf5g0,mjv6gnw,Trumps future!,3,2025-03-26 17:22:08,Extension_Whole_5234
worldnews,1jkf5g0,mjyy7yx,"**Should stand trial in a kangaroo court run by a Lula appointee*** 

I'd say welcome to Bostil, but the left's love for lawfare is international.",-7,2025-03-27 06:22:32,NamelessForce
worldnews,1jo59kz,mkp41mz,"USA needs to investigate Jared Kushner and Trump, too.",66,2025-03-31 15:13:43,OK_Roamer
worldnews,1jo59kz,mkp6wf2,Bibi is corrupt as hell. He should rot in jail.,32,2025-03-31 15:28:05,GlobalTravelR
worldnews,1jo59kz,mkql059,Woah!! A Middle East politician is tied up with dirty money!!! Who knew 😱🤯😱🤯😱🤯😱,9,2025-03-31 19:37:17,CardiologistSolid663
worldnews,1jo59kz,mkrlorh,"Ironic. Being a genocidal war criminal doesnt get him in to any real trouble, but this would?",-1,2025-03-31 22:49:11,ResortMain780
worldnews,1jo59kz,mkq7w5d,Now do him!?!11,1,2025-03-31 18:31:40,Philypnodon
worldnews,1k3j4nt,mo2jh0z,You cant trust them,18,2025-04-20 10:28:58,charliewaffles2412
worldnews,1k3j4nt,mo2zv2z,Only idiots believe Russia ,10,2025-04-20 12:48:13,PoopTransplant
worldnews,1k3j4nt,mo2t1hu,"At 18:30, ruZZian troops fired at a residential building in Kherson. Half an hour after the ""ceasefire"" began. Another proof of many hundreds of other proofs over 11 years that the ruZZians cannot be trusted. As soon as they open their mouths, they immediately lie.",5,2025-04-20 11:56:10,Long_Effect7868
worldnews,1jnpaee,mkljsn0,"Users often report submissions from this site for sensationalized articles. Readers have a responsibility to be skeptical, check sources, and comment on any flaws.

You can help improve this thread by linking to media that verifies or questions this article's claims. Your link could help readers better understand this issue.

*I am a bot, and this action was performed automatically. Please [contact the moderators of this subreddit](/message/compose/?to=/r/worldnews) if you have any questions or concerns.*",1,2025-03-30 23:08:11,AutoModerator
worldnews,1jnpaee,mkloxpv,"Smart on the part of Iran.  With Trump, trying to deal with him face-to-face will be a waste of time.  Better to have someone else deal with his inevitable BS that will follow.",82,2025-03-30 23:38:08,macross1984
worldnews,1jnpaee,mklmb4r,Trump isn't a man of his word.  I don't understand what the point of negotiating with him is.,68,2025-03-30 23:22:40,Ancient_Wisdom_Yall
worldnews,1jnpaee,mklkd2g,Cant blame them I wouldn't want to sit in a room with him either. He would be licking the windows in no time.,45,2025-03-30 23:11:26,Mallyix
worldnews,1jnpaee,mklvb5u,"The same Trump who cancelled the initial nuclear deal and can’t be trusted from one day to the next?

Probably fair.",8,2025-03-31 00:16:38,mrlahhh
worldnews,1jnpaee,mkltpyz,"Jokes on them, even direct talks with trump are indirect because he's a feckin moron.",10,2025-03-31 00:06:50,drinkduffdry
worldnews,1jnpaee,mklwq19,"Iran: That Trump dude is so extra and crazy, I can't even",4,2025-03-31 00:25:24,Candygramformrmongo
worldnews,1jnpaee,mkls9mu,"The mullah regime in Iran should never obtain nuclear capabilities. The regime has to change as soon as possible. Time is running out. The regime of the orange madman in the US should fall too, but first things first.",7,2025-03-30 23:57:55,ComfortableLost6722
worldnews,1jnpaee,mklnwva,There’s a good chance the US military is gonna drop bombs on Iran. And the fact that they are refusing to talk directly with US officials is concerning. I wonder if Iran has refined enough uranium for a nuke.,3,2025-03-30 23:32:07,PeenStretch
worldnews,1jnpaee,mkloda9,"Although most here don't like Trump, I can't argue against Iran not getting bombed to hell because they have been asking for it for decades now.

Then there's the nukes, they can't get nukes period. They are just too unstable and a threat to the region.",-3,2025-03-30 23:34:48,StoneCrabClaws
worldnews,1jljmdd,mk41sxu,Conservative premier supporting the liberal Prime Minister. Americans can learn what a functioning government looks like from these two.,367,2025-03-28 01:30:00,ishtar_the_move
worldnews,1jljmdd,mk47tcd,County over party,142,2025-03-28 02:04:33,Upstairs_Owl_1669
worldnews,1jljmdd,mk4ivrr,"Makes sense. We've been scrambling around responding to things for two months now and everything changes by the moment with that Orange chowder head.

Let's see what April 2 brings, take a couple of days, and then bring the hammer down exactly as much as warranted.

Reap what you sow, FAFO, all that...",42,2025-03-28 03:11:37,GStewartcwhite
worldnews,1jljmdd,mk42cbr,"Oh please, flick the power on and off.  Do it to the rhythm of ""Oh Canada""!",64,2025-03-28 01:33:09,N/A
worldnews,1jljmdd,mk4kb1a,💪🇨🇦Proud of this leadership💪🇨🇦,26,2025-03-28 03:20:55,Mediocre-Brick-4268
worldnews,1jljmdd,mk4swee,This is smart. Announcing counter measures or doing anything to justify a worse response not necessary until they actually take effect. He can wake up tomorrow and change his mind again.,6,2025-03-28 04:21:06,azad_ninja
worldnews,1jljmdd,mk6dtzj,"I was thinking ""why wait that damn long?!"" Then I realized that is 5 days from now, carry on Canada.",1,2025-03-28 12:58:21,MessageMePuppies
worldnews,1jv5ev6,mm7n87v,"So both China, the EU, and Canada.. all coming down from the top ropes",54,2025-04-09 13:54:35,justbecauseyoumademe
worldnews,1jv5ev6,mm7gcn8,"Huh, they didn’t go down with my first punch.",28,2025-04-09 13:16:40,KidKilobyte
worldnews,1jv5ev6,mm7l9r5,"Trump is instigating a Trade war, in a means justify enacting the Insurrection Act of 1807.  The escalating tariffs from other countries will be seen as an attack on their union.  I hope everyone sees this.  He will make Americans poorer with this crash to help secure his power and his rich donors.  Everything he is doing is with utter disregard to any consequences, every lie, every misdirection, every stupid formula.  

The right wing media is aligned on the messaging.  They blamed Biden for the economy under Covid, but yet these anti-vaxxers are all ready to take their 'medicine' for trade equality?  Give me a break.  

This is going to happen.  [https://www.independent.co.uk/news/world/americas/us-politics/insurrection-act-of-1807-trump-southern-border-b2729694.html](https://www.independent.co.uk/news/world/americas/us-politics/insurrection-act-of-1807-trump-southern-border-b2729694.html)",23,2025-04-09 13:44:13,WkndCake
worldnews,1jv5ev6,mm9rf5t,I ordered a new cadillac CT5 last month.  Cancelled it last week.  No way I am every buying American car again.,9,2025-04-09 20:06:06,photon1701d
worldnews,1jv5ev6,mm8c4ih,"When are 100% tarrifs going to be applied to Tesla in all countries ? Kick Musk in the nuts already. Oh and while they are at it, tariff Starlink everywhere except Ukraine.",8,2025-04-09 15:58:41,LordofDarkChocolate
worldnews,1jv5ev6,mm7h125,I can't help feeling this will end in tears,6,2025-04-09 13:20:31,elcolonel666
worldnews,1jv5ev6,mm9edqv,I love that the BBC call it the CUSMA,3,2025-04-09 19:02:40,azraels_ghost
worldnews,1jv5ev6,mm97sej, Bits and pieces from Mexico are ok?  How are border services sorting this out?  Tax a doorknob?,1,2025-04-09 18:30:34,jdf135
worldnews,1jv5ev6,mm7fzx8,[removed],-12,2025-04-09 13:14:38,N/A
worldnews,1jv5ev6,mm7hscu,"If the trade war keeps on going, bad move from Canada. Canada's too tied to US, and in the long run US got more ammo",-83,2025-04-09 13:24:49,rierrium
worldnews,1jp5o9a,mky3z5n,Fuck.  Can't decide who the bad guy is here.,36,2025-04-02 00:25:38,Sweatpants19
worldnews,1jp5o9a,mkx43ku,How is Turkey going to collect?,8,2025-04-01 20:58:56,edfitz83
worldnews,1jp5o9a,mkx5p1x,"

Any corporate fine that is $ is meaningless.

Only fines that are % have any teeth.",18,2025-04-01 21:07:20,supercyberlurker
worldnews,1jp5o9a,mky6a9e,Does Meta even have offices in Turkey?,1,2025-04-02 00:40:10,dce42
worldnews,1jp5o9a,ml2gj6c,"Zuck shits money, he doesn’t care about fines.",1,2025-04-02 18:39:44,BenTramer
worldnews,1jp5o9a,mkxfvq8,“Gag me harder Erdy baby”- zuck the fuck probably,1,2025-04-01 22:03:22,fuck-nazi
worldnews,1jp5o9a,mkx6bup,Türkiye,-17,2025-04-01 21:10:42,nomadcoffee
worldnews,1jj1uq1,mjk2yiq,"For context: The WHO European Region includes also the Caucasus Region and Central Asia.

The countries with the highest number of new TB cases in the WHO European Region are  Russia, Ukraine, Uzbekistan and Kazakhstan. When it comes to EU member states, the worst affected countries are Romania and Poland.

As the article says, the rise in detected cases might be due to increased testing because of refugees who flee Ukraine and are being tested when they are entering other countries. The increase was in the 2023 figures compared to the 2022 figures.",58,2025-03-24 22:22:10,green_flash
worldnews,1jj1uq1,mjjo1mj,[deleted],18,2025-03-24 21:04:09,N/A
worldnews,1jj1uq1,mjk1yz8,Good thing Trump pulled us out of WHO so we don't have to worry about this. /s,8,2025-03-24 22:16:57,Think-Werewolf-4521
worldnews,1jj1uq1,mjl77g3,I heard the outcome is TB determined,-5,2025-03-25 02:04:11,Franklin_le_Tanklin
worldnews,1jyuv1b,mn1c78t,"He won't. He's probably afraid of Russia committing another ""mistake"" while he's there.",34,2025-04-14 09:59:48,GabettiXCV
worldnews,1jyuv1b,mn1elxs,">“Please, before any kind of decisions, any kind of forms of negotiations, come to see people, civilians, warriors, hospitals, churches, children destroyed or dead,” Zelensky said in an interview for CBS's 60 Minutes programme.

It's really heartbreaking, really... the scale of the devastation, you see it in the news, but nothing truly prepares you for witnessing it firsthand. It's sickening that this even needs to be said, honestly, and it's just shocking that a leader would need to plead for basic humanity, that's truly awful. The sheer number of people affected is just staggering, Sunday's double missile strike in Sumy, the deadliest attack of its kind this year, killed so many, and it just emphasizes how important it is for Trump to see the complete picture before even considering any agreements. To be honest, he needs to understand this now, before it's too late... it's just awful.",13,2025-04-14 10:23:40,avid-learner-bot
worldnews,1jyuv1b,mn2f22u,"Just to let everyone know, Reddit removed the option to report misinformation after their chat with Elon Musk.",4,2025-04-14 14:30:45,rrha
