subreddit,post_id,comment_id,comment_content,comment_score,comment_created_at,comment_author
travel,1jonsbh,ml2ykbv,"So… getting to see the northern lights properly requires a bit of knowledge as to the prime conditions more than location. Think of it as akin to Tornado Hunting. If you’ve ever watched any show documenting storm chasers, you’ll understand how important conditions are…

Essentially you’re chasing three important conditions:

1.) Solar Activity
2.) Sky Cover (Clouds)
3. Bortle Scale (how dark the Sky is)

Alaska Fairbanks University has a website that forecasts Solar Activity. They describe the activity using a scale: KP. 

[Aurora Forecast](https://www.gi.alaska.edu/monitors/aurora-forecast)

KP 1 - 9. 1 being “very low activity”, 9 being “holy shit turn your electronics off solar storm.”

Anything KP 6+ is worth your time. 

As with any forecast, things change as we get closer to the event. So even a great forecast can turn out to be a dud.

The key is to align great forecasts with minimum sky cover (30% or less) at a dependable dark site.

[Light Pollution](https://www.lightpollutionmap.info/#zoom=10.78&lat=47.8964&lon=-90.0268&state=eyJiYXNlbWFwIjoiTGF5ZXJCaW5nUm9hZCIsIm92ZXJsYXkiOiJ3YV8yMDE1Iiwib3ZlcmxheWNvbG9yIjpmYWxzZSwib3ZlcmxheW9wYWNpdHkiOiI2MCIsImZlYXR1cmVzb3BhY2l0eSI6Ijg1In0=)

I live in Minnesota, and I have three dark sites that I monitor for cloud cover on nights that are forecasted to be high activity.

You can monitor cloud cover on your phone of course, or you can use NOAA. I’ve found the latter to be more reliable.

[NOAA](https://digital.weather.gov/)

I would recommend finding a handful of sites you can reasonably access within two or three hours drive.


I say all this because I, too, have been tempted to travel to places like Reykjavik to see the lights. But regardless of how much you pay out how far you go, if conditions aren’t optimal, you won’t be successful.

I hope this helps!",1,2025-04-02 20:07:09,Best-Professor8163
travel,1jolhci,mkspl75,Ask VS for the SK PNR. It might be different because they might operate on distant systems.,1,2025-04-01 02:52:14,protox88
travel,1jo68g5,mkpa903,"Shit happens. Get to your nearest embassy ASAP and ask them for help, that's what they're there for. You should be able to get an emergency travel document of some kind. ",15,2025-03-31 15:45:01,Confused_Firefly
travel,1jo68g5,mkpgabr,"Man, I feel for you. 

This happened to two of our friends while we were in Costa Rica. They had to visit the embassy for an emergency passport. Took about half the day to acquire.",3,2025-03-31 16:14:52,Dennis_R0dman
travel,1jo68g5,mkpif5w,"I lost mine in Canada once, called and then went to the Consulate and they gave me an emergency US passport. Plan on it taking a few hours or more.",2,2025-03-31 16:25:33,Quesabirria
travel,1jo68g5,mkpazye,Have you tried talking to the collective staff at the station in Pisac?,2,2025-03-31 15:48:44,Xboxben
travel,1jo68g5,mkp9sdm,"**Notice:** Are you asking for travel advice about Peru?

Read what redditors had to say in the **[weekly destination thread for Peru](http://redd.it/2o1sti)** 

*I am a bot, and this action was performed automatically. Please [contact the moderators of this subreddit](/message/compose/?to=/r/travel) if you have any questions or concerns.*",1,2025-03-31 15:42:43,AutoModerator
travel,1jnkn9j,mkqs37z,"Looks like a great trip! Not many people go out to Kinosaki, I haven't heard it mentioned in a while.

Some minor comments:

Shibuya is right next to Harajuku and Yoyogi. Like 5 minutes walk. So I'd change your evening sightseeing around: 

- day 2 - 9 may: Tokyo - Senso-Ji and Sumida River + Skytree, **visit Tokyo tower**

- day 4 - 11 may: Tokyo - Meiji Jingu shrine, Yoyogi park, Harajuku, **evening in Shibuya**

As for the day trips, I don't think you have too many. Day trips are great and help you get to know different sides of the country. Uji might be more of a half day, it's probably the least interesting of the ones on your list. But if you like tea, maybe start early and go out to Wazuka tea fields, then some of Uji on your way back up in the afternoon.

Have a great trip!",2,2025-03-31 20:12:04,NotACaterpillar
travel,1jnkn9j,mkzxjos,"It's a matter of personal preference, but I think you want to maybe blend in a little more rest time. If you're not city people, Tokyo may seem like a lot, because, my guy, it's fuck tons of city. Lovely, crazy, invigorating city, but city none the less. I would heavily recommend the yokochos in various neighborhoods, which are frenetic gatherings of bars that also can seem quite intimate, especially those in Ebisu and Shenganjaya. 


Also, I think you're giving Kanazawa short shrift. It's amazing. Medium city, phenomenal food, and a walkable core. Be forewarned though that the samurai district/geisha districts you could literally see in 15 minutes. Build a day around the river walk, canals and bakeries, and omicha market instead. 


You'll have an amazing time. My wife and I are LITERALLY in the airport on our way home from our first Japan and Asia at this exact moment after lots of European travel, and we've had possibly the best trip of our lives so far. Learn some Japanese if you can, just a smattering, and try it out. It's an amazing country full of kind people, so come in ready to soak it up. The food is unbelievable. 


Safe travels.",2,2025-04-02 09:37:31,Outrageous-Table6524
travel,1jnkn9j,mkymczh,[deleted],1,2025-04-02 02:21:00,N/A
travel,1jnjuvg,mkkclp2,Singapore is on the equator so it’s consistently humid and hot. I was there late June and it was perfection,4,2025-03-30 19:13:28,Beachbaby17
travel,1jnjuvg,mkkyic1,Singapore has the same weather all year round given it's on the equator. Another good place to travel in SEA  in the summer is Malaysia for exactly the same reason.,3,2025-03-30 21:06:52,emaddxx
travel,1jnjuvg,mklxxo4,"As for the edit: 5-6 nights is a bit much for just Singapore, but there are more local side trips you can make. I'd personally probably go to Singapore and Malaysia (bus to Melaka or fly to Penang), and save South Korea for another year when you can do a different season.

On the other hand, you should look into haze season in Singapore--there's usually a month or two a year when you can hardly breathe because of forest fires in Indonesia.",3,2025-03-31 00:33:00,harpsichorddude
travel,1jnjuvg,mkkb2ej,"**Notice:** Are you asking for travel advice about South Korea?

Read what redditors had to say in the **[weekly destination thread for South Korea](https://redd.it/4iavte)**  

*I am a bot, and this action was performed automatically. Please [contact the moderators of this subreddit](/message/compose/?to=/r/travel) if you have any questions or concerns.*",1,2025-03-30 19:05:38,AutoModerator
travel,1jnjuvg,mkkb2hw,"**Notice:** Are you asking for travel advice about Singapore?

Read what redditors had to say in the **[weekly destination thread for Singapore](https://redd.it/4kejpp)**  

*I am a bot, and this action was performed automatically. Please [contact the moderators of this subreddit](/message/compose/?to=/r/travel) if you have any questions or concerns.*",1,2025-03-30 19:05:39,AutoModerator
travel,1jnjuvg,mkkb2lq,"**Notice:** Are you asking for travel advice about Seoul?

Read what redditors had to say in the **[weekly destination thread for Seoul](https://redd.it/75yecy)**.


*I am a bot, and this action was performed automatically. Please [contact the moderators of this subreddit](/message/compose/?to=/r/travel) if you have any questions or concerns.*",1,2025-03-30 19:05:40,AutoModerator
travel,1jnitxl,mknyk8g,"Saigon sucks. Worst noise pollution I've ever experienced. Absolutely insane traffic, everywhere, all the time. Have you considered Taipei or Tokyo instead?",2,2025-03-31 10:54:20,Magicalishan
travel,1jnitxl,mkk2djq,"**Notice:** Are you asking for travel advice about Saigon / Ho Chi Minh City?

Read what redditors had to say in the **[weekly destination thread for Saigon / Ho Chi Minh City](https://redd.it/731hoe)**.


*I am a bot, and this action was performed automatically. Please [contact the moderators of this subreddit](/message/compose/?to=/r/travel) if you have any questions or concerns.*",1,2025-03-30 18:21:32,AutoModerator
travel,1jnitxl,mkk2dkn,"**Notice:** Are you asking for travel advice about Bangkok?

Read what redditors had to say in the **[weekly destination thread for Bangkok](https://redd.it/78wz3r)**.

*I am a bot, and this action was performed automatically. Please [contact the moderators of this subreddit](/message/compose/?to=/r/travel) if you have any questions or concerns.*",1,2025-03-30 18:21:32,AutoModerator
travel,1jnitxl,mkm2y6c,Saigon hasn't existed for 80 years.  That is reality.,1,2025-03-31 01:04:40,Oftenwrongs
travel,1jnitxl,mkry2xq,"Saigon. Incredible food, great people, way cheaper than Thailand",1,2025-04-01 00:00:41,realsamseaborn
travel,1jnitxl,mkk3loe,Device?,0,2025-03-30 18:27:49,MrSincerao
travel,1jnitxl,mkniu8k,Saigon is better than Bangkok.,-1,2025-03-31 08:11:03,Spiritual-Slide5518
travel,1jneq87,mklob0j,"The Sunshine Coast is really nice, but it is also very quiet and isolated. Personally, I'd probably get a bit bored staying for a whole week in somewhere like Gibsons or Sechelt.

Also, have you considered Victoria? It is a bit bigger, but it's definitely feels more like a smaller city, and I'd say it's a nicer place to stay than Nanaimo or Campbell River.",2,2025-03-30 23:34:27,Canadave
travel,1jneq87,mkj5pwu,Kelowna is OK. We liked Coquitlam better. Not far from Vancouver in case you want to visit. Beautiful area. Great food and nature options.,1,2025-03-30 15:34:40,1dad1kid
travel,1jneq87,mkkc2kk,"Campbell River is a run down place of no particular distinction-ditto Nanaimo.

Cowichan Bay would suit you much better.",1,2025-03-30 19:10:45,Curried_Orca
travel,1jneq87,ml8zl16,"If you don't mind the drive, Tofino (small town on the west coast of Vancouver Island) is really beautiful.

Victoria would be a lot easier for you to reach (I'm assuming you're driving from Portland?). It's a small city and the provincial capital. It's very walkable with lots of fantastic restaurants, but I'm not sure I'd stay a full week there. You could actually do both Victoria and Tofino in a week.

The whole area around Kelowna is really nice. You could also go to Penticton (south of Kelowna) or some of the small towns very close to Penticton like Naramata. Lots of wineries around there if that's your thing.

Nanaimo is a bit run-down. Don't think I'd ever go there as a vacation.",1,2025-04-03 19:06:53,VanhamCanuckspurs
travel,1jmp1tg,mkf67ey,"For Iceland:

\- Reynisfjara is right before you get to Vik so do it on 9/24

\- Jokulsarlon Lagoon is on the way to Hofn so do it on 9/25

\- 9/26 check out puffins at Bodarfjordur, Studlagil Canyon, Studlafoss before staying at Egilsstadir

\- 9/27 Dettifoss, Selfoss, Krafla, Myvatn area

\- 9/28 Godafoss, Aldeyjafoss, Hrafnabjargafoss, Husavik, before going to Akureyri (there's a 16USD  toll tunnel on highway 1 before entering Akureyri, pay 24hrs before or after you cross or there'll be a hefty fine later ... or just take the free road around the mountain if the weather is good)

\- 9/29 Long drive to Borganes, check out Kolugljúfur Canyon, Grabrok

\- 9/30 Explore Snæfellsnes peninsula before heading to Reykjavík",3,2025-03-29 21:40:27,haysu-christo
travel,1jmp1tg,mkeke4a,The westfjords and Snæfellsnes are pretty much the best 2 areas in Iceland.  Don't use fake ai.  Use your own brain.,2,2025-03-29 19:39:53,Oftenwrongs
travel,1jmp1tg,mkhbxhx,"We did Iceland ring road in 8 days but we did it in July when days were longer.

We arrived at godafoss at 12 am and sun was still setting over there. It was beautiful!",2,2025-03-30 06:30:36,Ghorardim71
travel,1jmp1tg,mkjy2le,"You can do Snæfellsness in that timeframe but it’ll be a bit rushed and daylight isn’t quite as long as when I was there. If you have a way to add maybe 2 more days to your ring road trip I would do so. Skipping the westfjords is likely necessary due to time even with a couple extra days. 

No issues with the sparse populations other than being aware that hotel rooms can be limited so book well in advance especially on the south coast area (Vík, Höfn) which is most popular for tourists if you want to stay right in town and at a more reasonable/affordable price. Also restaurants outside of Reykjavik may close a bit earlier than in larger population places so be sure to allow time to get dinner in the evening before restaurants close (if you are doing restaurants rather than grocery shopping)",2,2025-03-30 17:59:42,saras415
travel,1jmp1tg,mkjytix,"I visited Lofoten Norway last summer and loved it! A few tips/ideas for your trip:

1) You likely know this, but just to be sure, you are planning A LOT of driving, particularly in Lofoten. The weather there seems to change about every 15 minutes and in October, there is a chance of snow which can make driving more difficult. Normally, the weather can get very windy as well. Just want to caution that driving there seemed to take longer than Google maps advertised depending on weather and traffic. 

2) Transportation - If you fly to Bodø first and then take a ferry, the main ferry for your itinerary is [Torghatten](https://www.torghatten.no/en/our-routes/18-782?tab=info). Route A goes from Bodø to Moskenes. You can check the schedules online. 

3) Hikes in Lofoten - Read about the hikes in advance and you might want to have a few different ones on your itinerary. You likely know this already too, but just to be sure, the hiking in Lofoten is difficult and we found the local descriptions of difficulty to be underrated. For context and not to brag, we are a very active mid 30s adults who regularly run/bike/lift and run sub 3 hour marathons. The ""Moderate/Medium"" hikes were pretty hard, think climbing 2,000 ft elevation in 1 mile with no stairs. We didn't get as far down in Reine since we were mainly in northern Lofoten and Vesteralen, but Reinebringen hike is one of the ones you see online the most but can be very busy (maybe not in Oct) and dangerous depending on your ability (check out news stories on deaths there). I would consider checking out Munken hike in Sørvågen near Reine, supposed to be less busy and better views. Near Henningsvaer, check out Mannen hike which we did. It's not too long and has gorgeous views of Haukland Beach. Also, beware of hiking on rainy days or right after it's rained -- the trails can get very muddy and slippery. 

Those are my tips, hope you enjoy the trip and happy to answer any questions!",2,2025-03-30 18:03:25,gk615
travel,1jmp1tg,mklb85a,"Try to ensure your trip coincides with moonless nights. Assuming few or no clouds, 20-24 September 2025 would be optimal for viewing the Northern Lights.",2,2025-03-30 22:17:53,Ribbitor123
travel,1jmp1tg,mkft1kq,"I flew to Evenes, from there it is a two hour drive to Svolvaer (Lofoten). It's mindblowingly beautiful there.",1,2025-03-29 23:53:08,tgsgirl
travel,1jmp1tg,mkvcc9f,"I'll just post a link to my comments in your other thread, in case it's useful for others: [https://www.reddit.com/r/NorwayTravelAdvice/comments/1jmp75v/comment/mkoaav8/](https://www.reddit.com/r/NorwayTravelAdvice/comments/1jmp75v/comment/mkoaav8/)",1,2025-04-01 15:33:44,Lillevik_Lofoten
travel,1jmntjd,mkd50l1,"Yes you can do that. Most tavernas (not more upscale restaurants, mind you) will happily grill or fry your fish, provided that you have them ready and cleaned. They might deny you if they are super busy, so it's best to go early to make arrangements.

Some tavernas will charge you an amount for the cooking (relatively low), some will do it for free as long as you order enough of their food. You just ask them.

But before you go fishing make sure to contact the local port authorities to get an update of what/where is legal regarding fishing. Take extra care if you do spearfishing.",7,2025-03-29 15:02:23,jaoldb
travel,1jmmsgi,mkcwf0j,[removed],3,2025-03-29 14:13:32,N/A
travel,1jmmsgi,mkh4rmm,"Some tips if you visit Philly:

- I recommend an Independence Hall (and surrounding buildings) tour. Reserve tickets in advance.

- If there's a line for the Liberty Bell, you can just look through the glass on the bell side of the building to save time.

- The cheesesteak situation is way overblown. Do not spend extra time going to certain cheesesteak spots or waiting in line for a cheesesteak.

- If you like food, Reading Terminal Market is kind of iconic and has some great stuff—just do a Reddit search to get people's specific recommendations on that.

- You couuuuuld do the Art Museum, orrrrr you could do smaller/more niche stuff like the Rodin Museum or Eastern State Penitentiary. Tailor your visit to your personal vibes and interests, not the things ""everyone"" does.",3,2025-03-30 05:19:52,Classic_Reply_703
travel,1jmmsgi,mkcwozq,"Charleston is worth it. I have never been to Savannah. 

  
If you have never been to DC, please go! It is a very underrated city. The Outer Banks are wonderful, but they are probably a 4-5 hour diversion just from the main highways you will be taking.",2,2025-03-29 14:15:09,Evening-Car9649
travel,1jmmsgi,mkcxtws,"I would definitely visit Charleston and Savannah.  In my opinion much better than Phili.  Also, if you had time, hiking on Cumberland Island with the wild horses is very beautiful, but too hot in summer.",2,2025-03-29 14:21:50,ladeedah1988
travel,1jmmsgi,mkq8g0p,"Did a drive from Jacksonville to Charleston in early December 2024, with a stop in Savannah along the way. Both cities are very walkable, lots of cool old colonial history and architecture. And while driving between, the coasts of Southern SC and Northern GA offer some great state parks with lots of opportunities for beach walks, birding, etc.",1,2025-03-31 18:34:28,AdministrationSure70
travel,1jmkvq5,mkg5yzt,"I've head the same problems with their website in the past. Different browsers and devices, nothing worked. I think they banned my IP. Ultimately I made different plans so I never figured out a fix.",3,2025-03-30 01:10:49,AppleWrench
travel,1jmkvq5,mkd65qc,There is a new version to the app called Volaris 2.0 is that the version youre using?,2,2025-03-29 15:08:39,elgrito1810
travel,1jmkvq5,mkce606,"**Notice:** Are you asking for flight or airfare help?

Read the **[Guide to airfare search engines](http://www.reddit.com/r/travel/wiki/airfare)** in the wiki

Please make sure you have included the **cities, airports, flight numbers, airlines**, and **dates of travel**.

Visa and Passport Questions: **State your country of citizenship / country of passport**

*I am a bot, and this action was performed automatically. Please [contact the moderators of this subreddit](/message/compose/?to=/r/travel) if you have any questions or concerns.*",1,2025-03-29 12:09:42,AutoModerator
travel,1jmkq1b,mkcve4u,"San Remo. 

You know they are right by each other so there isn’t a big difference and you can see both.  I too live in the south of France so it’s a place I have visited often, especially for the bike race in spring.",3,2025-03-29 14:07:29,82away
travel,1jmgk5r,mkbkiab,"I would do Bali to Singapore to  Hanoi no question.  You don't have a very long window for travel and side tracking to Manila will eat into your trip.   The Singapore accom will be your biggest cost but if you can stay in a smaller place/hostel the trains and hawker center food is not expensive, and the Gardens by the Bay night time show is free.  You don't need to bring much clothing at all, bring light things you can either launder or wash out in the sink and can mix and match.",9,2025-03-29 06:58:05,kulukster
travel,1jmgk5r,mkbl458,"On the cheaper end of the accommodation spectrum, you should expect to spend about S$80-100 for one night in Singapore (about 4,000 pesos). Food varies considerably; expect to pay about $10 per meal - more if you get drinks or eat in a restaurant, less if you have a small appetite in a hawker centre or coffee shop.

Transport from the airport to the city: $30 by taxi, or about $2.50 by train/bus. One day of public transit will probably cost no more than $10-12 unless you decide to take taxis or Grab. You can use your foreign Visa or Mastercard debit or credit card; there is a small service fee, but it will be cheaper than buying an EZ-Link card.

Cost of activities is going to depend tremendously. Zoo? Mahal na. But some of the public libraries are very Instagrammable and free to enter. The Singapore City Gallery (near Maxwell Food Centre and Chinatown) is also free entry and worth checking out. Even Gardens By the Bay has a reasonably large free outdoor area - if you are on a budget, don't bother forking out (about $70) for the air-conditioned Flower Dome gardens.

Hope this helps!",3,2025-03-29 07:04:44,ShakespeherianRag
travel,1jmgk5r,mkbmrv7,"Make a table and write down the cost and things you want to do. Singapore is fun but also expensive compared to Manila and Hanoi. It is also more artificial. 
    
There is no free sleeping pods and even if there are you don’t want to stay there. It will be overcrowded and uncomfortable.   
   
Personally I would take option 1. Go home, unpack, rest, pack fresh and fly to Hanoi. 
   
Singapore in 1-2 days is just rushing to X spot to take picture. The food ain’t great for the price unless you eat at Hawker centres. Cost of activities all depends on you. Some are free some are cheap and some are expensive. Write down what you want to do.   
     
Hanoi is great. Old vibes but fun to explore the city. Way more than Singapore. You won’t find super modern stuff though but the city gives you authentic experience. You can easily find hotels or bnb for 500k. The food is also way better and cheaper. People are friendly and welcoming.",2,2025-03-29 07:22:51,FIGJAM17
travel,1jmgk5r,mkbz3ed,"Have not been to Manila, but Singapore and Hanoi are awesome. Singapore is a bit expensive (accommodation cost mainly) but Hanoi is super cheap. Very beautiful and culturally rich city as well. Give it a couple more days if you can.",2,2025-03-29 09:43:07,jaoldb
travel,1jmgk5r,mkcgsg3,Bali-MNL,1,2025-03-29 12:30:02,N/A
travel,1jmgk5r,mkbjye0,"**Notice:** Are you asking for travel advice about Indonesia?

Read what redditors had to say in the **[weekly destination thread for Indonesia](http://redd.it/2h8fdb)** 

You may also enjoy our topic: **[Indonesia off the tourist trail](https://redd.it/8wdr51)**


*I am a bot, and this action was performed automatically. Please [contact the moderators of this subreddit](/message/compose/?to=/r/travel) if you have any questions or concerns.*",0,2025-03-29 06:52:12,AutoModerator
travel,1jmgk5r,mkbjyex,"**Notice:** Are you asking for travel advice about Singapore?

Read what redditors had to say in the **[weekly destination thread for Singapore](https://redd.it/4kejpp)**  

*I am a bot, and this action was performed automatically. Please [contact the moderators of this subreddit](/message/compose/?to=/r/travel) if you have any questions or concerns.*",0,2025-03-29 06:52:12,AutoModerator
travel,1jmanpd,mka92qc,"**Notice:** Are you asking for travel advice about Mexico?

Read what redditors had to say in the **[weekly destination thread for Mexico](http://redd.it/2ph1bn)**

You may also enjoy our topic: **[Mexico off the tourist trail](https://redd.it/8r1w2l)** or **[our page about Mexico City](https://redd.it/400xtl)**.


*I am a bot, and this action was performed automatically. Please [contact the moderators of this subreddit](/message/compose/?to=/r/travel) if you have any questions or concerns.*",3,2025-03-29 00:59:29,AutoModerator
travel,1jmanpd,mkb31ka,I love Antigua. It’s Guatemala’s colonial city.,2,2025-03-29 04:14:56,Sharontoo
travel,1jmanpd,mkar6hy,"Antigua is special, I was only able to spend one night there but everyone was nice and the surrounding volcanoes are beautiful. Food was also great. Stumbled into a brewery to escape a downpour, and they were doing ""country music night"" and it was a treat. It's only an hour and a half shuttle from Guatemala City that's pretty cheap.",1,2025-03-29 02:50:41,Zach9810
travel,1jmanpd,mkbzk2o,Skip Antigua and go to lake atitlan instead.,1,2025-03-29 09:48:15,CanadianRedneck69
travel,1jmanpd,mkrtund,"I loved Mexico City and can't wait to go back again and explore more after just a 4 day visit the first time. I stayed in Condesa and loved being able to rent the bici bikes and go all over on mostly protected bike lanes. The streets are tree lined and gorgeous. As promised, the food is incredible. My favorite thing was actually the Anthropology museum and taking a tour with a local History student from Mexico was fascinating - would not have been as cool without him. I've also been to Antigua for 2 days many years ago and remember it being very interesting and beautiful, but quite small with not as much to do.",1,2025-03-31 23:35:51,gk615
travel,1jmanpd,mkar41u,"Where is Latina America?

There is not much to do in Antigua.  CdM for sure.",1,2025-03-29 02:50:15,IDownVoteCanaduh
travel,1jlzjoz,mk7qblu,Our Lord in the Attic museum in Amsterdam is a hidden delight. The 9 streets area for wandering around. And a slice of warm appelkoek (cross between pie and cake) to re-energise.,3,2025-03-28 17:05:57,paper_truck
travel,1jlzjoz,mk7mgor,"**Notice:** Are you asking for travel advice about Amsterdam?

Read what redditors had to say in the **[weekly destination thread for Amsterdam](https://redd.it/77fsz1)**.

*I am a bot, and this action was performed automatically. Please [contact the moderators of this subreddit](/message/compose/?to=/r/travel) if you have any questions or concerns.*",2,2025-03-28 16:47:43,AutoModerator
