subreddit,post_id,comment_id,comment_content,comment_score,comment_created_at,comment_author
travel,1jq6ezf,ml4wxbb,"I can't speak for Angola, but Namibia to Jhb is an easy flight and shouldn't have any issues. Just check your visa requirements, obviously. Namibia is a fantastic place to visit in my opinion, I think it will be well worth the side trip.",8,2025-04-03 02:30:26,Outrageous_Ad9917
travel,1jq6ezf,ml5oozd,Skip Angola and focus your limited time to Namibia who is really huge.,2,2025-04-03 06:04:01,newmvbergen
travel,1jq6ezf,ml5w2ho,"Just a word of warning - Luanda airport and TAAG Airlines are both the absolute worst I've ever used. We flew from Johannesburg to Sao Paulo and back via Luanda around Christmas 2022. It was absolutely awful.

The airport was total chaos. There was no toilet paper or soap in the bathrooms. The only open shop was one expensive Duty Free store. There was one café with horrible food and the worst coffee on earth. 

The signs showed information that was hours out of date so finding the right gate was essentially guesswork- walking up to other passengers and asking ""is this the gate for the Sao Paulo flight?"" until we found it. Once we found the right gate and they checked our documents, they let us through to a smaller area to wait for a bus to the plane. We sat there for over an hour with no information about what was happening and couldn't get back out to get water or snacks. Then suddenly the bus showed up and we went to the plane without any kind of explanation of why we were so delayed.

The ridiculousness continued on the plane. Many of the seats were broken - permanently reclined, broken armrests, missing seat cushions etc. The in-flight entertainment system didn't work at all and the remotes had been ripped off several seats and bare wires were sticking out. When I tried to activate my reading light in the aisle seat, my daughter's reading light in the window seat turned on instead, because they'd been wired up wrong. It's genuinely the only time I've been concerned that I might die because the plane was in such poor condition - if they couldn't even wire the lights correctly, what else had they got wrong?! 

The return journey was the same. The only slight positive is that the plane was almost empty so each of us had a whole row to ourselves and could try to lie down and sleep. I say try, because the arm rests didn't fold up all the way in the middle seats so you had to wedge yourself in under them.

If there is a way to get to your destination without using this airline and airport I would strongly advise you to do so.

(Edited again to change the year back to 2022 because my husband pointed out that Christmas 2021 we all had covid and were stuck at home)",2,2025-04-03 07:17:53,Adorable_Misfit
travel,1jq6ezf,ml5y2q4,"Namibia is great but the distances will make it limiting, roads aren’t great, you can easily spend long hours in a car. Check how far are things you want to see and then look for the official maps stating driving times (not google), then you’ll get an idea.",2,2025-04-03 07:39:28,that_outdoor_chick
travel,1jq6ezf,ml51egm,"While in Namibia, venture into Botswana for a safari in Okavango. Also, try not to land border cross from Angola to Namibia, better you fly.

Read - Peter Allison's - Whatever you do, do not run.


Btw, I recently visited Pantanal in Brazil. Amazing experience.",1,2025-04-03 02:59:37,MavenVoyager
travel,1jq6ezf,ml54etp,"There is not much to do in Luanda, and it's a very expensive city, so maybe reduce the days. I think Angola is worth while, but just have a clear plan.",1,2025-04-03 03:19:54,shitdayinafrica
travel,1jq6ezf,ml5o0j3,"On Reddit, everything is always doable, don't worry.",1,2025-04-03 05:57:31,newmvbergen
travel,1jq6ezf,ml8py9s,I spent 3 weeks in namibia and still had to cut plenty from my trip.,1,2025-04-03 18:18:48,Oftenwrongs
travel,1jppaq2,ml10u8k,I went through this a few months ago. Try Furkot.,2,2025-04-02 14:26:57,Qeltar_
travel,1joyfa7,mkvc5a6,Lisbon is really quite lovely,4,2025-04-01 15:32:42,KanyeDeOuest
travel,1joyfa7,mkvg19b,The whole point of independent travel is to tailor any trip to exactly what gives you the most pleasure and best experience. Your choice when based on your own interests can never be wrong. There is absolutely no point in wasting time and money on things that don't interest you just because others have done it.,2,2025-04-01 15:52:32,friendly_checkingirl
travel,1joyfa7,mkvbegm,"**Notice:** Are you asking for travel advice about Lisbon?

Read what redditors had to say in the **[weekly destination thread for Lisbon](https://redd.it/74hcxf)**.


*I am a bot, and this action was performed automatically. Please [contact the moderators of this subreddit](/message/compose/?to=/r/travel) if you have any questions or concerns.*",1,2025-04-01 15:28:49,AutoModerator
travel,1joyfa7,mkvc5o8,"If you're coming internationally you'll most likely get better flight options into Lisbon, so it's up to you if you want to move on immediately.

It's a great city but if you don't like cities, then you've sort of answered your own question.",1,2025-04-01 15:32:45,BulkyAccident
travel,1joyfa7,mkve3zn,"You don't have to do the average thing. And the typical thing of only going to just Lisbon and Porto is a waste, the Azores are amazing as are Portugal's smaller cities, towns, and countryside.",1,2025-04-01 15:42:47,rocketwikkit
travel,1joyfa7,mkw975z,"We stayed in albufeiria and it was all drunk Brits, karaoke and crap food. Be careful you don’t get that if you don’t want it.",1,2025-04-01 18:21:04,BedditTedditReddit
travel,1joyfa7,ml4y39o,"As someone else mentioned the flights are cheaper into Lisbon. You can take the train out  and stay in Cascais or any of the smaller places like Parede or Carcavelos (all beach towns) if you don't want to be in Lisbon. Or go to Sintra (gorgeous) or take the bus out to Ericiera. along the west coast. I will actually be in Lisbon in Sept, I've been there a few times. It is a nice city even if you aren't into cities you can get out pretty easily.  If you go to the Algarve, going to Lagos or Tavira  would be nicer IMO than Albufiera (which is tourism haven)",1,2025-04-03 02:37:54,Uare_ok_Iam_ok
travel,1jov3e3,mkuqx33,"1. All you have to do to view the Black Madonna is head to the church and hop in the queue off to the side of main church entrance. When I went (August), I'd guess it took about 30-40 min. to progress through the queue and then you'll go through the Madonna ""tour"" over another 20-30 min. You won't have an issue seeing the Madonna and that portion of the Monastery is open all day (or close to it). I believe you can just go in/out of the church itself via the main entrance as you please.
2. Probably a few hours without any rushing required, it just depends on your pace. It looks like guided tours take 5-7 hours (incl. travel to/from Barcelona), so that's probably about as reliable a source as there is.
3. You'll have plenty of time for it, so you might as well
4. It's hard to say when you've only been there once, but I was there during the high season and while there were plenty of visitors that day it never felt especially crowded. There's enough space and enough different things to do or see for the Monastery to accommodate *a lot* of visitors at one time. I didn't do the funicular, but saw the Madonna around lunch time, and the wait wasn't bad at all, as indicated above.
5. Only ate at the cafeteria, so I'm not much help.",2,2025-04-01 13:37:48,portugamerifinn
travel,1jov3e3,mkuli9m,"**Notice:** Are you asking for flight or airfare help?

Read the **[Guide to airfare search engines](http://www.reddit.com/r/travel/wiki/airfare)** in the wiki

Please make sure you have included the **cities, airports, flight numbers, airlines**, and **dates of travel**.

Visa and Passport Questions: **State your country of citizenship / country of passport**

*I am a bot, and this action was performed automatically. Please [contact the moderators of this subreddit](/message/compose/?to=/r/travel) if you have any questions or concerns.*",1,2025-04-01 13:04:41,AutoModerator
travel,1joakpl,mkqam7s,"It's doable sure, and if this is a once in a lifetime trip and you want to see as much as possible then go for it. But that's a lot of travel days even for a 5 week trip. I'd probably cut half of it but I like to fully take in each place I visit.",109,2025-03-31 18:45:21,WhaleCharmer
travel,1joakpl,mkqablj,Out of my own ignorance: why 2 days at Ambleteuse? What’s there?,38,2025-03-31 18:43:53,giYRW18voCJ0dYPfz21V
travel,1joakpl,mkqh6q7,This crazy itinerary seems less like vacation and more like torture. I would cut the trip down to 6-7 places max and take your time in each place.,30,2025-03-31 19:18:04,BungeeGump
travel,1joakpl,mkqarzw,"Why is ‘flight to Amsterdam’ the only transport factored into your itinerary?

E.g. Getting from London to Edinburgh will take the best part of a day by train. Even if you’re flying it’ll take 5-6 hours including time spent travelling to/at airports. It’s the same from Amsterdam to Berlin.

Figure out how much time you will actually have in each place and then have a think about whether spending so much of your time in Europe on trains and planes is worth it.",53,2025-03-31 18:46:10,Life_Fishing999
travel,1joakpl,mkqgzla,"This is just city after city after city. 3 weeks into the trip you'll get bored of another square, cathedral, museum, shopping street regardless as to how much fun these things are individually. You need more variety on a 5 week trip.",43,2025-03-31 19:17:04,RNRS001
travel,1joakpl,mkqc9tt,Be sure to factor in ~1 “down” day for every ~10 days of travel.  Otherwise you might get burned out. Allow yourself a day or two to just sleep-in/watch tv/sauna without any judgement/FOMO. Traveling like that can almost be like a job - make sure to give yourself “weekends” if that makes sense.,18,2025-03-31 18:53:40,RatticusGloom
travel,1joakpl,mkqcxvl,A bit too rushed for my taste. You're spending just enough time in each place to not really get the feel of the place. For example Paris needs at least a week to really take in the city.,18,2025-03-31 18:56:57,noappendix
travel,1joakpl,mkqdf8d,Way too rushed. You should cut 2-4 places.,16,2025-03-31 18:59:19,MagicalBadgers
travel,1joakpl,mkqnyj6,"It looks like you'll spend more time in European planes, trains and buses than actual cities. You do realize 3 days for each city include travel, right? That means you won't have full 3 days, you'll have 2,5 days if you're lucky. And for cities like Paris or London, twice that time would not be enough for most people.

I mean if you won't really visit Europe again and/or actually want to make it a race, sure, it is doable. But I personally would be done after a week. I'm exhausted just looking at the itinerary.",11,2025-03-31 19:51:51,Heidi739
travel,1joakpl,mkqav2g,"Too much stuff. I'd take out Scotland, add in one more day in London and give yourself more breathing room in Europe.",32,2025-03-31 18:46:36,BulkyAccident
travel,1jo3xex,mkoripg,"Booking by yourself is always cheaper, as you pay for what you need without fees for someone else doing it for you or paying for something you don’t need anyway (like a gym included in the hotel stay when you’re not gonna use it).

The only problem is the hassle of doing everything for yourself. Some people are better with that and others don’t know how or don’t want to invest time in doing it",6,2025-03-31 14:09:21,PRS617
travel,1jo3xex,mkorkun,"Yo, not even going to bash you, just speak.


That is not a bad deal, they are obviously making money or they would not offer it; and it is fine if you do not want to plan.


There are so many ways to make it cheaper though, I'll get back to you if no one fills you in, as I am making my breakfast.


I car camped around the island for around a month, and it was not to expensive.  Just not sure on your details, so if you want to drop some Qs I will get back to you in awhile!",2,2025-03-31 14:09:40,Fritzkreig
travel,1jo3xex,mkpav6f,[removed],2,2025-03-31 15:48:05,N/A
travel,1jo3xex,mkpnkb0,"e.g. ticket from amsteradm to Reyckjavik = 223 Euro (with extra luggage maybe  300 euro)

Rental car (Toyota Aygo)		 =459 euro

Accomodation..quick calculation 	= 120 Euro/night

Thats \~2200 Euro instead of 4400 for 2 persons

Every extra trip isn't in the price included. I  don't understand the high price!

I spend 2015 roundabout 1000 euro. The only difference was that i used a tent.",2,2025-03-31 16:51:34,MSkade
travel,1jo3xex,mkoqb7f,"**Notice:** Are you asking for travel advice about Iceland?

Read what redditors had to say in the **[weekly destination thread for Iceland](http://redd.it/2j7z1k)** 


*I am a bot, and this action was performed automatically. Please [contact the moderators of this subreddit](/message/compose/?to=/r/travel) if you have any questions or concerns.*",1,2025-03-31 14:02:48,AutoModerator
travel,1jnghqr,mkjk3pb,"It's not really a museum or exhibition centric city, but there are a few. What are you after? There's a modern art museum in the west, or history museums about the country.",1,2025-03-30 16:49:39,rirez
travel,1jnghqr,mkjpqu5,"There is not much art installation in Jakarta, but you may take a look at ""ImersifA Museum Nasional"" and ""Museum Macan"". Ticket can be purchased through Traveloka app.",1,2025-03-30 17:18:13,naripan
travel,1jneicz,mkj17zl,"**Notice:** Are you asking for travel advice about Istanbul?

Read what redditors had to say in the **[weekly destination thread for Istanbul](https://redd.it/7i7vkg)**.


*I am a bot, and this action was performed automatically. Please [contact the moderators of this subreddit](/message/compose/?to=/r/travel) if you have any questions or concerns.*",2,2025-03-30 15:10:52,AutoModerator
travel,1jneicz,mkjsh6b,"I did this in November, met a friend at Istanbul Airport, flew into one and flew out from the other, we did look at driving but the shuttle was a long time and we weren't going for a long time. I didn't organise it but it wasn't crazy expensive, we organised it through our hotel, I imagine most hotels would have similar set ups where they've an agreement with a company in the area

As for the tours we used get your guide and tripadvisor, we did the red one I think (the one without goreme) through them and then went with someone the friend knew for the other, both were good, not crazy expensive or anything, though depends on how many people are going, I think it wasn't a much as 220 but they are half remembered prices from months ago tbf",2,2025-03-30 17:32:03,GarethGore
travel,1jneicz,mkjtqx3,"Hey, currently in Cappadocia. 
1. Take a flight from Istanbul to Kayseri (ASR) and get a taxi/shuttle service to Cappadocia/Goreme. It is a very touristy sign and not much is local. 
2. Did Hot Balloon with Royal Balloons. They have good ratings and they are very safe. On time and excellent service. 
3. Did Red Tour and will be doing Green Tour tomorrow. Can let u know then. Red Tour did not consist of much walking. Just be cautious because Tour companies will take you to ""original outlets"" for pottery, leather, etc. They are a rip off. Do not buy when on Tour, but rather walk around the Goreme town and you will find some authentic stuff for cheaper price. I will not recommend the company I used, so won't even recommend it. Cappadociahotairballoonair.com is what I used. 
4. Food most places are so so. I did like Topdeck and Red Red Wine house. Excellent service and good food. Many Indian restaurants that are good.",2,2025-03-30 17:38:24,I-wonder-why2022
travel,1jn0ctc,mkgavbp,"I’ve only been to Paros and we adore that island, so highly recommend and I think ticks most boxes for you. My in-laws have been to kefalonia, but were very bored there. They have been to Crete, Santorini, Mykonos, and this was their least favorite spot in Greece.",3,2025-03-30 01:41:08,Slkreger
travel,1jn0ctc,mkhv1s7,"I’ve been to quite a few Greek islands including Rhodes and Kefalonia (but not Paros) and I think Kefalonia is the most beautiful island of them all. I’ve been back a few times now as I loved it so much. It’s so green and there are so many amazing beaches. A lot of other greek islands are quite dry and dusty but Kef has so much flora and fauna on account of the fresh water running through cracks in the rocks under the island and filtering out to the sea. The sea is like a turquoise jewel and the people are friendly. It’s a very mountainous so you’d need a car to make the most of it - the views when driving are insane as the roads are all high on the mountain sides. Everyone drives slowly too as the roads are pretty winding so very chill overall. I cannot recommend it enough - it is an absolute gem of an island. If you want total chill, stay in Assos and hire a car so that you can see the North of the island. Myrtos, Emplisi, Alaties, and Fiskardo are part of a perfect Greek experience. Last time we went we returned from Assos to the airport over the mountains in the centre of the island and it was breathtaking.",3,2025-03-30 09:59:53,Prole1979
travel,1jn0ctc,mkggbl5,"I think 10 days in Paros is a very long time. It’s pretty relaxed and quiet. Maybe split time between Paros and another island? 

I would do a full 10 days in Crete if you didn’t want to split time traveling between islands.",2,2025-03-30 02:15:06,Any_Sheepherder6963
travel,1jn0ctc,mkfy3b5,"**Notice:** Are you asking for travel advice about Greece?

Read what redditors had to say in the **[weekly destination thread for Greece](http://redd.it/3colog)**

You may also enjoy our topic: **[Greece off the tourist trail](https://redd.it/99m40k)**

*I am a bot, and this action was performed automatically. Please [contact the moderators of this subreddit](/message/compose/?to=/r/travel) if you have any questions or concerns.*",1,2025-03-30 00:23:09,AutoModerator
travel,1jn0ctc,mkjvvbn,"Kefalonia is great but there isn’t a ton to do there. I could see a couple days but I wouldn’t spend 10 days there

It’s also on the opposite side from the majority of the islands people tend to visit for a first trip, so it’s harder to combine with other options (although we combined with Zakynthos which was also on that side and great - blue caves, shipwreck beach, options to see sea turtles etc) 

Have not been to Paros or Rhodes so cannot comment on those. Have visited Santorini (stunning, though pricier) and Mykonos as well. Will note that it’s easy to avoid the clubby night life in Mykonos as well if you prefer something else as the island is reasonably large and has a lot of other options also",1,2025-03-30 17:48:56,saras415
travel,1jn0ctc,mm0oaqz,10 days is the best for Kefalonia . I’m from there and 25 years now I haven’t see it all . This is 100% the best choise. If you need any help for house or any info you can send me !!,1,2025-04-08 11:42:22,Correct_Word_4551
travel,1jmy0v4,mkfh4t2,"Choose one area. On a map, everything is easy. On the ground, you will see you need to have a realistic itinerary.",4,2025-03-29 22:44:15,newmvbergen
travel,1jmy0v4,mkfi3zc,"For 5/6 days by car (required) you must choose for a corner of the island, which is way too big! I made a 6 days holidays 3 years ago! I started from Catania airport (skipped Catania) to go to siracusa and spent 1 night there. I moved to avola for a bit of beach and visit noto (1 night in avola because cheaper). 3rd day I moved from avola to Marzamemi and tonnara di Marzamemi with half beach day and went to Ragusa for the end of the day. 4th day visiting modica. 5th day visiting Ragusa, Ragusa Ibla and a fast stop in Scicli. 6th day Just to go to comiso airport! Hope it helps!",1,2025-03-29 22:49:56,mitch66612
travel,1jmy0v4,mkhp86p,"One area for sure, it's too big to try and see the whole island in that timeframe.

You need a car if you want to stay in the countryside or very small places.If you are more interested in cities,no... there is reasonable public transport (train and bus).",1,2025-03-30 08:56:24,lucapal1
travel,1jmy0v4,mkjwmbb,"We did 2 days in Taormina and 4 days in San Vito Lo Capo. Also took one of the SVLC days to go down to Agrigento and a boat ride at the Turkish Steps. Wished we had a bit more time in Taormina. The drive between the two was LONG but doable. Just depends how fast paced you want your trip to be

I think you could do just Taormina area with or without a car but make sure to do a day at Etna with some of the wineries etc (we did as a tour so we could enjoy the wine without worrying about having to drive)",1,2025-03-30 17:52:36,saras415
travel,1jmtsl3,mkeh994,"The answer for us is always Seville. The streets for wandering with great cafes and bars makes it a perfect fit for what we love to do

However if you want museums and more of a metropolitan feel then more Madrid. 

If you want party and nightlife Barcelona",72,2025-03-29 19:22:16,celtic1888
travel,1jmtsl3,mkfhkxx,This is mental.  Load up Google Maps to see how far apart they all are.,48,2025-03-29 22:46:52,FancyMigrant
travel,1jmtsl3,mkfcbqd,"You’re underestimating travel time. Even if you think you’ll have the energy, flights can be delayed, traffic can delay arrival time, plus flight check ins and getting to the airport can be a pita. 1 night in Madrid just isn’t worth it and could be far better used in one of the other cities.

Personally I recommend Sevilla and checking out Cordoba and Grenada. Still a lot but at least those cities are close by and can do a bus/train/tour/check out the countryside instead of a flight. If you insist on Barcelona it’s fab, but Madrid for a single night simply isn’t worth it. Come back or stay longer are other options for Madrid.",18,2025-03-29 22:15:42,Finest_Mediocrity
travel,1jmtsl3,mkfcy4e,Seville all day long,12,2025-03-29 22:19:24,Weird-Weakness-3191
travel,1jmtsl3,mkehg8l,"I don't understand why you picked those cities and think it's necessary to do so much traveling when Cordóba, Seville, Malaga and Granada are all close by and more fun than Madrid and Barcelona are.",50,2025-03-29 19:23:21,RNRS001
travel,1jmtsl3,mkegu9c,My suggestion would be to skip Madrid this time around. The additional travel time and hassle just for one night there isn't worth it.,30,2025-03-29 19:19:57,no-soy-de-escocia
travel,1jmtsl3,mkelq4r,I would stay all those days in Madrid and do day trips to Segovia and Toledo.,15,2025-03-29 19:47:22,dnb_4eva
travel,1jmtsl3,mkfe8dj,2D Seville/3D Madrid or 5D Barcelona. You don't have time for all three.,10,2025-03-29 22:26:57,Zealousideal_Owl9621
travel,1jmtsl3,mkfsqpx,"Seville, definitely. My favourite city in Spain.",3,2025-03-29 23:51:24,Cautious_Ghost
travel,1jmtsl3,mkelw8m,That’s a lot of transport time for 3 cities in 5 days. This is the kind of question that’s really hard to answer without knowing what you like. Art? Architecture? Food? Nightlife?,8,2025-03-29 19:48:18,Design-31415
travel,1jmpl9s,mkdgiz7,"**Notice:** Are you asking for travel advice about France?

Read what redditors had to say in the **[weekly destination thread for France](http://redd.it/33ezzh)**  

You may also enjoy our topic: **[France off the tourist trail](https://redd.it/9223b0)**


*I am a bot, and this action was performed automatically. Please [contact the moderators of this subreddit](/message/compose/?to=/r/travel) if you have any questions or concerns.*",1,2025-03-29 16:05:43,AutoModerator
travel,1jmpl9s,mkh0uh1,Congratulations,1,2025-03-30 04:45:40,VirtualCouple1
travel,1jmfmz5,mkbopzj,"Do whatever works... they won't check it, either way.",13,2025-03-29 07:44:43,lucapal1
travel,1jmfmz5,mkc597b,">If I do it the wrong way round, it works. 

So do it the ""wrong"" way round, simple as that. I don't really see a problem here.",5,2025-03-29 10:49:09,DaveB44
travel,1jmfmz5,mkbrm9v,Germany has the house number after the street name whereas it's the other way around in English speaking countries. Do it the way the application form requests it even though it seems strange.,12,2025-03-29 08:17:37,friendly_checkingirl
travel,1jmfmz5,mkbzddg,"that is weird. 

I didnt have a problem with my street address, I use the normal format (Streetname + House number) 

I assume you didnt use ß?",3,2025-03-29 09:46:10,juicycrispypata
travel,1jmfmz5,mkcctbk,"One of the few people still going to the US. Report back after your return!

I'd just do the American format if the Esta wants me to. You can bring a screenshot of the error message in case crazy border agents doing their crazy American thing because of the street and house number being in the American order.",3,2025-03-29 11:58:43,knightriderin
travel,1jmfmz5,mkbud33,"In America, house numbers come before the street name

(Unrelated soapbox, but I do think it’s rich that Europeans give Americans shit for doing month day year and then do street house city)",6,2025-03-29 08:49:39,elijha
travel,1jm2an4,mk8ci04,"Honestly, I hate group tours and prefer to go at my own pace (or not).

But excursions/tours do have their place like a snorkeling tour, The Vatican (skip the line and with a qualified guide), things like that.  Sometimes when you want to do activities like this, this is what makes sense.  I have also skipped out on tours after I completed the activity I wanted to do and wasn't in interested in the other things.",15,2025-03-28 18:53:07,catgirlnz
travel,1jm2an4,mk8aywq,"Like you said depends where you’re visiting 

If I’m doing an excursion though it’s often for safety reasons",14,2025-03-28 18:45:37,pulisick38
