subreddit,post_id,comment_id,comment_content,comment_score,comment_created_at,comment_author
travel,1k0rs2g,mngswuc,"I really liked the Khao Lak area. You can do day trips to these super neat islands called the Surin Islands with amazing coral reefs, and Khao Lak town has a sea turtle rescue center, bamboo rafting, and a neat waterfall hike. It is also a gateway to Khao Sok National Park.",1,2025-04-16 20:00:36,queen_charmander
travel,1k0mj3x,mnf495x,"Immigration didn't take long, don't know if you are waiting for bags or not, though.

Traffic can be bad in the city, so that could be a factor at rush hour.

Could you? Sure, but is it worth the stress?",2,2025-04-16 15:01:52,defroach84
travel,1k0mj3x,mnf6cup,Will your flight be on time?  You're good to go!  Will the flight be delayed?  Might not make that shuttle.  So...90+% likely?,1,2025-04-16 15:12:18,__crl
travel,1k0ehcv,mnhtpl2,"As another redditor mentioned, Eguisheim is very small and would only take half a day at maximum, and I also feel that is the case with Riquewihr (not sure about Ribeauville, as I've never been there). I might suggest looking at route maps provided by bike tour companies in the area, and see if one of their itineraries would give you some inspiration. I've checked out [alsa cyclo tours before](https://colmarbiketours.com/fr/guided_tours), and if you look at each of their tour options, it shows a map of points of interest that they take you to during the tour. 

As far as other suggestions for the area are concerned: 

I would suggest maybe spending one of those days in Strasbourg, as it's only a 30 minute train ride from Colmar, and just a wonderful place. I'm absolutely enamoured with that city, and will be returning for a visit myself in the beginning of May.

A good half day option would be to go to Selestat (20ish minutes by train from Colmar) and take the bus to visit the Chateau-Haut Kronenbourg for a couple of hours, which has magnificent views of the villages and valleys below.",2,2025-04-16 23:16:11,Frog_In_Pot
travel,1k0ehcv,mndfixq,"Cycling will be fine (the worst part of that would be getting out/into Colmar itself).

> Eguisheim (1 day)

Is this in addition to something like vineyards or things in Colmar? Eguisheim is tiny and only a relaxed 30 minute or less ride from Colmar so it won't take long in itself.",1,2025-04-16 07:33:47,travel_ali
travel,1k0ehcv,mndvo2b,"Rent e-bikes from outside of the station, and cycle along the wonderful route du vin.

It's lovely",1,2025-04-16 10:24:06,DrCrazyFishMan1
travel,1k08i1a,mnc79ch,"If nobody here has an answer for you, you can also try posting on r/travelchina",3,2025-04-16 01:45:55,busylilmissy
travel,1k08i1a,mnd56u4,[deleted],3,2025-04-16 05:49:38,N/A
travel,1k0719n,mnbqc1l,"**Notice:** Are you asking for travel advice about Georgia?

Read what redditors had to say in the **[weekly destination thread for Georgia](https://redd.it/4yq4z1)**  

*I am a bot, and this action was performed automatically. Please [contact the moderators of this subreddit](/message/compose/?to=/r/travel) if you have any questions or concerns.*",1,2025-04-16 00:05:32,AutoModerator
travel,1k0719n,mnbx84l,You might want to look up Little River Canyon in Alabama. It's not bad.,1,2025-04-16 00:45:43,bradkwells
travel,1k0719n,mncivs1,"https://www.roadsideamerica.com/
https://www.atlasobscura.com/

Both of these websites are great for finding interesting stuff to do/see anywhere in the country. My other strategy for planning road trips is simply searching for ""attractions"" ""museums"" or ""parks"" on Google Maps. Just a quick search shows that there's a military museum, a nice looking art museum, and a civil war naval museum in the town of Columbus just north of the canyon. A bit more digging and I bet you could put together a pretty good weekend trip!",2,2025-04-16 02:57:49,Tochie44
travel,1k01msh,mnajp1d,"Ha, we’ll see you in CDMX!!",4,2025-04-15 20:15:17,revengeofthebiscuit
travel,1k01msh,mnaty8y,"Puebla, fantastic alters in the zocalo",5,2025-04-15 21:06:03,120steve
travel,1k01msh,mnbekd6,"You're not really going to get a Halloween vibe. It's a very different type of celebration. Generally, though, Patzcuaro and Oaxaca are probably the bigger and more involved celebrations. CDMX can be fun. We really enjoyed Puebla.",5,2025-04-15 22:58:35,1dad1kid
travel,1k01msh,mndhpx3,Day of the Dead is NOT the same as Halloween!,4,2025-04-16 07:57:16,Sea-Aerie-7
travel,1k01msh,mnaummp,Oaxaca or Michoacan have the biggest “events” on day of the dead.,3,2025-04-15 21:09:33,N/A
travel,1k01msh,mnala8h,"I’ve only been to Guanajuato for Dia de Muertos, so I can’t compare it to other places, but I had a great time. The old tunnels under the city center were especially cool, since they close them to vehicles during the holiday in order to set up markets, food stalls and even a Halloween haunted house style walkthrough scare maze.",2,2025-04-15 20:23:07,Landwarrior5150
travel,1k01msh,mnb1eqo,"I've spent the holiday in both CDMX and Oaxaca. I definitely enjoyed Oaxaca more. The events felt more cultural in a traditional and also authentic sense, and there were a lot of celebrations and energy in the streets; whereas, CDMX the events planned by the city felt less traditional/authentic/lively. But fully recognizing that could've just been my own experience. BUT CDMX as a city is amazing. I definitely recommend spending 3-5 days there since there's plenty to do and see. In comparison, I felt like I had seen Oaxaca in 4 days and was ready to move on, even with the holiday.",2,2025-04-15 21:45:07,emar101
travel,1k01msh,mnaj9nb,Senor Frogs,2,2025-04-15 20:13:09,Dylan_Goddesmann
travel,1k01msh,mnahn9w,"**Notice:** Are you asking for travel advice about Mexico?

Read what redditors had to say in the **[weekly destination thread for Mexico](http://redd.it/2ph1bn)**

You may also enjoy our topic: **[Mexico off the tourist trail](https://redd.it/8r1w2l)** or **[our page about Mexico City](https://redd.it/400xtl)**.


*I am a bot, and this action was performed automatically. Please [contact the moderators of this subreddit](/message/compose/?to=/r/travel) if you have any questions or concerns.*",1,2025-04-15 20:05:03,AutoModerator
travel,1k01msh,mnat2d1,"I’ve been to CDMX for Day of the Dead. From my experience it isn’t a huge thing in the city. They decorate and had a parade, but I don’t think most average people really celebrate?

Honestly, I saw more trick or treating than Day of the Dead festivities. Still a ton of fun, but if you’re looking for a more “authentic” day of the dead experience, maybe try Oaxaca or a smaller city?",1,2025-04-15 21:01:32,CountChoculasGhost
travel,1jzztl9,mnarrpa,No but Komoot will have all the hiking information you need,5,2025-04-15 20:55:12,BrilliantUnlucky4592
travel,1jzztl9,mna6vta,"I went on this hike last year - https://canionul7scari.ro/7-scari/?lang=en. Very easy and beautiful scenery. 

This is not a hike or a restaurant, but this museum is amazing in Sibiu (and I'm not a museum person) - https://muzeulastra.ro/en/

In Timisoara this restaurant was amazing - https://www.beraria700.ro/

In Sibiu, this was my favourite restaurant  - https://jacobgrillhouse.ro/",3,2025-04-15 19:11:19,kovdom992
travel,1jzztl9,mna2vhp,"**Notice:** Are you asking for travel advice about Romania?

Read what redditors had to say in the **[weekly destination thread for Romania](https://redd.it/4wgu0q)**  

*I am a bot, and this action was performed automatically. Please [contact the moderators of this subreddit](/message/compose/?to=/r/travel) if you have any questions or concerns.*",1,2025-04-15 18:51:14,AutoModerator
travel,1jzztl9,mna5nuy,"Near Brașov, hike to Piatra Craiului Ridge or  Mount Tampa for epic views. Between Timișoara and Sibiu, check out Retezat National Park, wild, stunning, and perfect for an overnight stay.",1,2025-04-15 19:05:01,bittlecruit
travel,1jzztl9,mnaxu7e,"The main local hiking resource is [Muntii Nostri](https://muntii-nostri.ro/en/routes)

Also try asking on r/roHiking",1,2025-04-15 21:26:18,tolanescu
travel,1jzztl9,mna3xjc,"Poenari Castle is famous for being 1000 steps up a hill. A friend and I tried to do it and made it about half way before someone coming down said that we were too late and it was closed.

Bit of a judgement call as to whether slogging up a hill counts as a hike.",1,2025-04-15 18:56:25,rocketwikkit
travel,1jzrr8y,mn8a2hq,"> Do I need to bring a printout or digital copy of my travel authorization to the airport?

> No. DHS will be able to communicate a traveler's ESTA status to the carriers. However, DHS recommends that travelers print out the travel authorization application response in order to maintain a record of their traveler authorization application number and to have confirmation of their ESTA status.

> U.S. regulation does NOT require a Visa Waiver Program (VWP) traveler to present a printed copy of the ESTA authorization page in order to travel. However, it is recommended that you print a copy for your records. If you did not receive or cannot locate your application number, you may retrieve the application through the ESTA website by entering your passport number, country of citizenship, passport issuance date, passport expiration date, and date of birth.

https://esta.cbp.dhs.gov/faq?lang=en&focusedTopic=About%20ESTA%20and%20The%20Visa%20Waiver%20Program&answerToDisplay=When%20should%20I%20submit%20an%20application%20through%20ESTA%3F

So a classic government answer, no but it wouldn't hurt.",9,2025-04-15 13:24:19,rocketwikkit
travel,1jzrr8y,mn8a1ny,"It's electronically attached to your passport. But I always print these things along with my tickets and everything else, as a backup.",5,2025-04-15 13:24:11,RB30DETT
travel,1jzrr8y,mn8c9fz,"I’ve seen gate agents ask for it before boarding (yes it’s very dumb since you cant check-in without). Even though CBP says you don’t need it.

I sure as hell would print it.",4,2025-04-15 13:36:57,Terrible-Capybara
travel,1jzrr8y,mna2tmp,I’ve always carried the printed copy (with my other travel documents) just in case. But so far I’ve never been asked for it. If you don’t want a printed copy I’m sure a screenshot would be ok.,3,2025-04-15 18:50:58,deadpan_ann
travel,1jzrr8y,mn9ipps,"An ESTA is electronically linked to your passport, so there's no need to carry a printout of the confirmation email. . .

. . . until you come across the check-in agent who doesn't know the system! Having encountered that, as we had printouts it was much easier to just show ""proof"" of our ESTAs than try to explain why we didn't need it!",2,2025-04-15 17:11:49,DaveB44
travel,1jzrr8y,mn8euxn,"I just have it on my phone, been asked for it once or twice and phone is fine",1,2025-04-15 13:51:21,New-Establishment827
travel,1jzrr8y,mna47om,"I'm paranoid about this things and i like to have redundancy. So for me will be phone+paper+cloud. If my phone has no battery there is the paper, if i loose the paper i have the phone etc",1,2025-04-15 18:57:48,Jacopo86
travel,1jzrr8y,mnal471,"You shouldn't need it, but it actually depends on the port of entry and the mood of the workers at immigration.

We always printed it out, never needed it and then the very first time we didn't have it with us, they wanted to see it and my husband was taken to a separate room to be interrogated. Took about 30 minutes before he was returned to me. It was especially bad, because I do all the planning and he couldn't even tell them, where we were headed. Obviously that wasn't a good look. Lesson learned, we always print out the ESTA and we don't ever let them separate us.

Just print it out.",1,2025-04-15 20:22:17,salian93
travel,1jzrr8y,mnbnyyn,"For US immigration, no. It’s linked to your passport.

When you’re checking in though, the airline will likely ask to see it, so save screenshot for that. I have never physically printed it,",1,2025-04-15 23:51:52,mcwobby
travel,1jzmxv8,mn7eeaz,"If you’re interested in water sports and outdoor activities, and up for a bit longer of a road trip, look into Door County, Wisconsin. There are a few towns to choose from as your base, just do some research to figure out which one suits your interests. There’s a ton of info online. They all have that classic Americana vibe that your family might enjoy, and are very kid friendly. I would recommend spending at least 3 nights up there. Book soon because it’s very popular in the summer, especially on weekends.",8,2025-04-15 09:16:54,beerouttaplasticcups
travel,1jzmxv8,mn7fzm1,"I would recommend looking up county fairs and see if there will be one near you during your dates. They're, in my experience, pretty unique american experiences. Eat all the shitty fair food, ride some rides, maybe grab a concert or watch a tractor pull or similar. I used to love going to the county fair every summer when I was a kid. https://www.wifairs.com/events/fairs

I'd also look at neighborhood events in chicago. Chicago is full of pretty individual neighborhoods and they can put on some great food, art, culture events throughout the year.",3,2025-04-15 09:34:08,wanderingdev
travel,1jzmxv8,mn7o79r,"I’m biased because I live in the Chicago area, but I think we have the best summers anywhere in the world- great choice to visit! Cars are pretty much necessary to do anything with any sort of efficiency here- will you have a rental?

First off, the person that recommended all the Milwaukee stuff is spot on. It’s a great town that offers a ton of things to do and food to eat without being overrun by people. 

If you happen to be here July 21-27, one of the world’s largest air shows takes place in Oshkosh, Wisconsin. It’s an experience! Housing costs are ridiculous, but it’s drivable from Milwaukee if you’re going for the day. 

All of the places you’ve mentioned a good- the Dells is overwhelmingly touristy, but if you want a water park, it’s a good option. I’d also recommend looking into Michigan’s west coast on Lake Michigan. In 2-3 hours you can be to places like South Haven, Holland, Grand Haven, and Saugatuck. They’re all cute towns with nice beaches. Or, if you want to get crazy- go to Milwaukee and then take the SS Badger from Manitowoc, Wisconsin to Ludington, Michigan. It’s a ferry and can be a fun adventure. 

In Illinois, Starved Rock State Park is great for a day out in nature. It’s fairly large and has a bunch of trails to walk/hike. It’s a couple of hours west of Chicago. While you’re in Chicago, definitely go to a Cubs game- it’s an experience.",5,2025-04-15 10:54:28,arsenalgooner77
travel,1jzmxv8,mn7f36m,"This is going to be a wonderful trip for you. Illinois and Wisconsin are fantastic in July.  

I recommend spending at least one day in Milwaukee. Condé Nast ranked it the third best big city to travel to in the US after Chicago and San Diego.
https://www.cntraveler.com/story/where-to-eat-stay-and-play-in-milwaukee 

Milwaukee also made National Geographic’s Best of the World list in 2023.

It is only a short train ride north from Chicago (or a quick drive if you rent a car).

If you come July 3-5, you can attend the last weekend of Summerfest, which is one of the largest music festivals in the world that takes place on the shore of Lake Michigan.
https://www.summerfest.com/

Additionally, the Milwaukee Air & Water Show is July 19-20 also on the shore of Lake Michigan. 

You can rent kayaks and kayak up and down the river and into Lake Michigan, stopping at bars and restaurants along the way. You can take a fishing charter on the lake as well. Like Chicago, there are lots of events and festivals in Milwaukee during the summer, though they are generally less crowded and more affordable than those in Chicago. There is a well regarded art museum near the lake, and for the kids there is a downtown science museum called Discovery World.

For sports, you could attend a Milwaukee Brewers baseball game and tailgate beforehand (grill out in the parking lot while the kids play catch). Tailgate parties before the baseball game are popular in Milwaukee and there is a distinct ‘murica vibe to it that you may enjoy.

There are excellent restaurants, a large beach, and many other things to do. This website is a good starting point.
https://www.visitmilwaukee.org/

I hope you and your family enjoy your summer trip to the Midwest.",3,2025-04-15 09:24:24,theavocadoenthusiast
travel,1jzmxv8,mn8544u,"I like Madison Wisconsin for a chill college town.  Lots of REALLY good food there and it's close to the Dells and House On The Rock, which is a very unusual tourist attraction.",3,2025-04-15 12:54:39,meatwhisper
travel,1jzmxv8,mn9ann3,"Those are all good ideas, depending on what you're looking for. 

Galena might be boring for the kids. It's mostly antique and boutique shopping, breweries, wineries. 

Wisconsin Dells is a huge tourist trap, but it's full of water parks and amusement parks and go-karts and other things kids love. 

If you like the outdoors, other ideas are Indiana Dunes and Starved Rock. 

Milwaukee is a fun little city. Check the Summerfest schedule for the time you're in the area.",2,2025-04-15 16:32:26,Rogue_Apostle
travel,1jzmxv8,mn9ppk9,"Definitely Milwaukee for a couple of days. I’d personally go around to one of Michigan beach towns instead of Wisconsin. The towns/beaches are way better. Grand Haven, Saugatuck, New Buffalo.",2,2025-04-15 17:45:24,wicked56789
travel,1jzmxv8,mnf8n8x,"Skip Galena. 

Hiking near the Dells is great - Devils Lake, Spirit Lake and I'm sure there are other trails in the area.",1,2025-04-16 15:23:40,PassageUnlikely3336
travel,1jzg8uv,mn60p84,"The train from Oslo to Bergen is a must do. I did it straight through, but this website breaks down spots in between on the line [https://www.visitnorway.com/plan-your-trip/getting-around/by-train/the-bergen-railway/](https://www.visitnorway.com/plan-your-trip/getting-around/by-train/the-bergen-railway/)

That said, I don't know if there's much to \*do\* for more than a day at either of these stops unless only hiking, so I'd base yourself in the two cities and do day trips from there.

I love Stockholm but 3 cities in 7 days in way too much, you'll hardly see anything at all.

ETA: there is a direct flight between Bergen and Stockholm that is easy. Oslo is only so-so, especially compared to Stockholm, so you could choose to only visit Stockholm and Bergen if you wanted.",8,2025-04-15 02:00:21,Hefty_Ring_5859
travel,1jzg8uv,mn5zvzv,"**Notice:** Are you asking for travel advice about Norway?

Read what redditors had to say in the **[weekly destination thread for Norway](http://redd.it/3ebvsa)**  

*I am a bot, and this action was performed automatically. Please [contact the moderators of this subreddit](/message/compose/?to=/r/travel) if you have any questions or concerns.*",2,2025-04-15 01:55:20,AutoModerator
travel,1jzg8uv,mn7fijc,"There was the Norway in A Nutshell train/bus/ferry/train trip. Oslo to Bergen. It was a pass that you had X days on and off; we went straight through. 

I say “was” because it was a while back, but highly worth it, so check into it!",1,2025-04-15 09:28:57,secondlogin
travel,1jzg8uv,mnj7qv1,"I'll be taking the train from Stockholm to Oslo next week! I'll report back. 

When I was in Norway many years ago I stay for a few days in Fjaerland which was easy to reach by boat, stayed in the historic Fjaerland Fjordstove Hotel, and borrowed bikes for a day that included hiking and climbing to the Boyabreen Glacier. The town is now a 'Book Town' and is probably easier to reach. It felt like the real Norway, and if I could I'd go again this time. 

#",1,2025-04-17 04:36:13,StrawberryMule
travel,1jzewyr,mn5rr4u,"Some things to think about:

\- depending on where you're coming from, Sept 19 may be a dead day, tired from the flight and/or jet lagged

\- Sep 22 and Sep 25 are travel days, 5-6 hours on the train, plus packing up, getting ready, checkinginto a hotel, trying to get your bearings, etc., so you're not likely to see/do much those days.

\- so that gives you 2 days Berlin (with one day at the marathon) and 2 in Prague. Both of those cities are worth more time.

\- Both Salzburg and Innsbruck are good for a day, and easy to access from Munich.

\- I did the MUC-FRA train in October, catching a flight out of FRA. Generally you'd leave first thing the the AM for an afternoon flight.",3,2025-04-15 01:05:52,Quesabirria
travel,1jzewyr,mn6fy8p,"It does seem a tad bit rushed. I get the urge to see as much as possible in a short period of time but if you’re rushing from one city to the next you may end up missing out on stuff. Make a list of the essential things you want to see/do/eat per city and then a list of maybes so you can focus on the stuff that’s important to you. 

I did 2 months through Europe last year and made a rule to do 3-4 nights minimum per big city and 1-2 per small city. I only did 1 night at a few cities where I was able to book an overnight train or bus to my next stop. That way I was able to enjoy the city for 2 full days. Left my baggage at my hotel for a small fee, there’s also company’s/apps that will store your baggage for a small fee.

I’ve been to Prague and Munich and they both fell in the 3-4 nights type of cities for me. I did 3 in Prague and 4 in Munich, I also did a half day tour to see the famous “Disney” castle for my partner and took a train ride to Salzburg for the day and enjoyed some night life in Munich after. 

If I were you I’d extend Munich and see more of that city, potentially do a half day trip to whatever interests you. I used viator to book tours, but logged in through rakuten to take advantage of 6-10% cash back. 

Or instead of extending Munich perhaps go stay in or around the Black Forest or even Strasbourg for 1-2 nights before heading to Lucerne/Frankfurt.",2,2025-04-15 03:42:22,Skittlepreet
travel,1jzewyr,mn5oqnu,"**Notice:** Are you asking for travel advice about Germany?

Read what redditors had to say in the **[weekly destination thread for Germany](http://redd.it/2un357)**

You may also enjoy our topic: **[Germany off the tourist trail](https://redd.it/8k4pwa)**

*I am a bot, and this action was performed automatically. Please [contact the moderators of this subreddit](/message/compose/?to=/r/travel) if you have any questions or concerns.*",1,2025-04-15 00:47:55,AutoModerator
travel,1jzewyr,mn5oqp2,"**Notice:** Are you asking for travel advice about Switzerland?

Read what redditors had to say in the **[weekly destination thread for Switzerland](https://redd.it/3hq5em)**  

You may also enjoy this **[extensive user review](https://redd.it/5nkv4j)** of the country.

*I am a bot, and this action was performed automatically. Please [contact the moderators of this subreddit](/message/compose/?to=/r/travel) if you have any questions or concerns.*",0,2025-04-15 00:47:55,AutoModerator
travel,1jzewyr,mn5oqq1,"**Notice:** Are you asking for travel advice about Austria?

Read what redditors had to say in the **[weekly destination thread for Austria](https://redd.it/4929vl)**  

*I am a bot, and this action was performed automatically. Please [contact the moderators of this subreddit](/message/compose/?to=/r/travel) if you have any questions or concerns.*",0,2025-04-15 00:47:55,AutoModerator
travel,1jzewyr,mn5oqqx,"**Notice:** Are you asking for travel advice about the Czech Republic?

Read what redditors had to say in the **[weekly destination thread for the Czech Republic](https://redd.it/4e140k)**  

*I am a bot, and this action was performed automatically. Please [contact the moderators of this subreddit](/message/compose/?to=/r/travel) if you have any questions or concerns.*",0,2025-04-15 00:47:55,AutoModerator
travel,1jz4n68,mn3nage,"1. The number is enough, they just want an ID so the ticket is under a real person's name. They rarely ask for identification unless you're trying to make changes. Just have your passport handy in case they ask (they do this if they're bored).

2. Yes, you'll have to show your ticket to actual people. In Barcelona: twice, once before going through security and one to get onto the actual train. Maybe later in Madrid before boarding your train. However, you will not miss these people because they will be in the middle of the your way as you proceed. 

3. Perfectly fine to print in B/W, or to show on your phone. Make sure it's high quality though, as sometimes the scans are unfriendly.

4. Not difficult. When you get off the train, find a staff member and they will tell you either the platform your second train departs from (in that case you can board the train directly, sometimes they even accompany you), or they'll ask you to go to the waiting lounge with big screens (it will depend on the time you have for the change, then you'll have to show your ticket again to board the train).",6,2025-04-14 18:10:59,hydr0dynamics
travel,1jz4n68,mn3ngnr,"1. It's not important: they only want an ID number to avoid changes
2. Yes. Before go down to your platform they will check and validate your ticket
3. No. You only need the QR code
4. It depends on your ticket. Generally, there are direct services between Barcelona and Seville (same train). Otherwise, you might need to change to your new train platform (few minutes). If any doubt, you can ask any attendant on the train.

Happy journey!",3,2025-04-14 18:11:49,MorningBloodyMary
travel,1jz4n68,mn3epko,"**Notice:** Are you asking for travel advice about Spain?

Read what redditors had to say in the **[weekly destination thread for Spain](http://redd.it/2xshof)** 

You may also enjoy our topic: **[Spain off the tourist trail](https://redd.it/8ujqud)**.

*I am a bot, and this action was performed automatically. Please [contact the moderators of this subreddit](/message/compose/?to=/r/travel) if you have any questions or concerns.*",1,2025-04-14 17:29:40,AutoModerator
