subreddit,post_id,comment_id,comment_content,comment_score,comment_created_at,comment_author
worldnews,1jyiynn,mn09dyj,"At this point, how hard would it really be for the EU to pay off a bunch of people inside Russia to just start turning off infrastructure.

> Hey, we'll give you 50 grand and a passport in some other country if you go to work and feed a bunch of sand into the gas turbines.

It's hard to wage a war in the dark.",7,2025-04-14 03:40:38,nik282000
worldnews,1jyiynn,mn0uira,War is when there's a response. Does Europe respond?,3,2025-04-14 06:50:26,dread_deimos
worldnews,1jyiynn,mn1xq70,"Time to make the Russian ships and submarines activate the permanent dive function. Always in the bottom, not moving anymore.",1,2025-04-14 12:51:05,HijikataX
worldnews,1jyiynn,mmyx9x4,If Russia has been doing it for a few years now is it new?,1,2025-04-13 22:27:47,SubstantialIncome555
worldnews,1jyiynn,mmzao7j,You have to blame someone,-9,2025-04-13 23:48:32,LadyZoe1
worldnews,1jpcbsp,mkyl1ng,Thanks. That will cure my insomnia,231,2025-04-02 02:12:40,Projectionist76
worldnews,1jpcbsp,mkydzpz,[deleted],61,2025-04-02 01:28:43,N/A
worldnews,1jpcbsp,mkycs9a,How accurate are the smart/fitness watches at gauging deep sleep? Cause according to my forerunner 265 I get basically no deep sleep ever.,79,2025-04-02 01:21:01,Hep_C_for_me
worldnews,1jpcbsp,mkyjzjz,If you're having sleep problems get a sleep study.  It changed my life.  It turns out I had severe sleep apnea.  Once I started using a CPAP machine it changed everything.  Suddenly I had energy throughout the day and didn't get tired as easily as before.  It made me feel 10 years younger.,30,2025-04-02 02:06:00,Killerrrrrabbit
worldnews,1jpcbsp,mkydcij,Well less space vulnerable to alzhaimer means less chances of getting it. Checkmate scientists,31,2025-04-02 01:24:37,evasive-manouver69
worldnews,1jpcbsp,mkyqb89,"if I read it right, this is about an associative relationship, not a causative one. It is possible then that individuals with smaller brains have less deep and REM sleep, because their brains are smaller.",16,2025-04-02 02:46:40,catlessinKaiuma
worldnews,1jpcbsp,mkycwk3,It *shrinks*?,14,2025-04-02 01:21:48,emilliolongwood
worldnews,1jpcbsp,mkyczq6,I will never be old.,11,2025-04-02 01:22:21,The_Patocrator_5586
worldnews,1jpcbsp,mkz4ym5,Oh no. 3 generations of Alzheimer’s and my Apple Health saying I average 33 minutes of deep sleep per night.,5,2025-04-02 04:37:28,Vynaca
worldnews,1jpcbsp,mkz5vsm,Sweet. Like I didn’t already have insomnia and anxiety.,7,2025-04-02 04:45:05,ItsMRslash
worldnews,1k4rrbk,mocagxy,Does he mean the kidnapped child “migrants” they stole from Ukraine?,262,2025-04-21 23:22:48,RttnAttorney
worldnews,1k4rrbk,mocbzu4,Who the hell’s emigrating to Russia of all places right now?,154,2025-04-21 23:31:22,Equipmunk
worldnews,1k4rrbk,mocr4lf,Maybe if they hadn't sent their male population to die…,15,2025-04-22 00:58:29,skisandpoles
worldnews,1k4rrbk,mocigaq,Yet they’re offering citizenship to foreigners to die in Ukraine 🤔🤔🤔🤔🤔,23,2025-04-22 00:08:02,machopsychologist
worldnews,1k4rrbk,mocv0ct,"The Russian Orthodox Church is about as corrupt as churches go worldwide, second only to American Evangelicals and Pentacostals.",7,2025-04-22 01:20:52,ozmartian
worldnews,1k4rrbk,mocaq1x,[removed],47,2025-04-21 23:24:13,N/A
worldnews,1k4rrbk,mock7r2,"Is he referring to the tens of thousands of indentured soldiers from poverty stricken regions and hotspots like North Korea who were promised bountiful lives of plenty in glorious Russia (should they survive)? 

Otherwise known as \`Decree No. 690 on Admission to Citizenship of the Russian Federation in a Simplified Manner for Foreign Citizens and Stateless Persons Who Have Entered into Contracts for Military Service\`.",9,2025-04-22 00:18:15,CatalyticDragon
worldnews,1k4rrbk,moceizi,"Ah yes, I remember that story Jesus told ...",8,2025-04-21 23:45:37,OutrageousBanana8424
worldnews,1k4rrbk,moci8l5,"Maybe don't abduct people and bring them to Russia if you wanted a ""Russia for the Russians"" then",8,2025-04-22 00:06:48,Hellstorm901
worldnews,1k4rrbk,mocivpk,I hope they do. Maybe they'll actually protest against your government.,6,2025-04-22 00:10:31,chi823
worldnews,1jnb69q,mkid3fc,"Russia has no negotiating position. It invaded a country without reason, they’re just 100% in the wrong.",166,2025-03-30 12:43:40,rallumerlesetoiles61
worldnews,1jnb69q,mkjj9rk,"People need to understand: for Putin, it’s not about peace and saving your own country, it’s about presenting a win to the citizens of Russia to avoid getting shamed and possibly hung for being the worst president that ever existed.

If it costs millions of Russian lives to save himself from that embarrassing situation, that’s a risk he’s willing to take.",20,2025-03-30 16:45:21,anything1265
worldnews,1jnb69q,mkir74m,They must be absolutely scraping the bottom of the barrel on equipment and men by now aren’t they?,22,2025-03-30 14:15:04,lt12765
worldnews,1jnb69q,mkiwrwd,"Ein kaiserschlact, you say?",2,2025-03-30 14:46:37,pickleparty16
worldnews,1jnb69q,mkibwcj,Rashist generals are doing rashist things. Beatings will continue until morale is improved.,3,2025-03-30 12:34:41,Assine1
worldnews,1jnb69q,mkj0ona,they have a couple donkeys left ,1,2025-03-30 15:07:58,N/A
worldnews,1jnb69q,mkjgaj2,"Finish your first offensive, then you can eat the second - Putins mother probably :-D",1,2025-03-30 16:29:42,koyaniskatzi
worldnews,1jnb69q,mkjy873,"Russia will be left in an even weaker position, with fewer troops, less equipment, less money and not much to show for all that sacrifice.",1,2025-03-30 18:00:28,Killerrrrrabbit
worldnews,1jnb69q,mkka5pu,"""What have you done to asian people, all these years? List them all.""",1,2025-03-30 19:01:00,sonostreet
worldnews,1jnb69q,mkkoebm,Presumably Trump will freeze aid and intelligence sharing just before it starts,1,2025-03-30 20:14:22,coachhunter2
worldnews,1jul6j9,mm2ww2b,How do you find shipping loopholes through uninhabited islands. They are uninhabited.,301,2025-04-08 18:47:43,Bornee35
worldnews,1jul6j9,mm2zucf,But Russia doesn't get tariffs because why again?,66,2025-04-08 19:02:21,Prestigious_Beat6310
worldnews,1jul6j9,mm30rki,They literally cannot admit fault on anything,41,2025-04-08 19:07:02,hdiggyh
worldnews,1jul6j9,mm2x3qj,Yeah like it wouldn’t be obvious if you send goods through an unoccupied territory. Lmao “damn Marshall Islands are really performing this quarter for manufactured goods. Weird they don’t have people “,113,2025-04-08 18:48:46,iMaximilianRS
worldnews,1jul6j9,mm2xy7p,"Trump administration DAF hires doubling down on stupidity by offering more stupid made up shit. Other countries would get around tariffs by shipping feom those countries? Um...those are Australian territories, dipshits, and if the penguins ship anything, it would be coming from Australia, legally.",39,2025-04-08 18:53:00,Pladohs_Ghost
worldnews,1jul6j9,mm2zk00,"Yeah,tell me it's not a cult! 🤢",13,2025-04-08 19:00:55,N/A
worldnews,1jul6j9,mm32dqp,"this is such a lousy argument. if ppl are cheating on their custom papers, the authorities should just arrest ppl or detain the goods. the US federal gov't has direct control of the borders and all ports of entry. they are at liberty to demand information about the goods however they like.

in fact, Amazon is littered with vendors who break customs and import rules, especially trying to dodge tariffs. there are established legal solutions to this. and you can certainly hold Amazon accountable for the tariffs not collected, which is what many other countries actually do - holding the platforms liable.",12,2025-04-08 19:15:06,SQQQ
worldnews,1jul6j9,mm2y2lz,"I am honestly no longer sure if they actually think people are dumb enough to buy these very obvious lies, or they just stopped caring/trying.",36,2025-04-08 18:53:36,amiexpress
worldnews,1jul6j9,mm30ibg,"Geez, when you have to defend this nonsense, you know you dun fucked up A-A-ron.",9,2025-04-08 19:05:43,FrostyParking
worldnews,1jul6j9,mm32p5a,ngl i’m with Trump on this. The Penguin Empire is trying to establish relationships with the Emus and the Eagle Kingdom. The last thing I want is for them to rebel. I propose an Infinity Tariff to save our country!,7,2025-04-08 19:16:41,MentionWeird7065
worldnews,1jislzr,mjhoz9e,"Their renewable push is interesting. They bought a British renewable technology company to build gravity trains.


Their iron ore mines are inland at elevation. They load the trains in the mountains and charge their batteries on the descent to the coast. The empty trains travel back to the mines on electric power.


They eliminate most diesel emissions and expense.",167,2025-03-24 15:22:55,DeathByMachete
worldnews,1jislzr,mjhthyu,"At some point, when companies got too big, they stopped caring about what the customer wanted. They only care about cost cutting and share holders. We as consumers don’t really have a choice anymore aside from learning to grown our own food, make our own wine and clothing (if we have the space) otherwise, we HAVE to buy from a very select few mega corporations who own ever “small” brand on the planet with products made by children and slaves",38,2025-03-24 15:45:22,N/A
worldnews,1jislzr,mjjid0a,"It's not big oil that's actually the issue, it's big oil investors. The ones with stable state investors or completely inactive investors have historically gone towards renewable energy.",2,2025-03-24 20:37:26,warriorscot
worldnews,1jislzr,mjleccn,"I kinda feel like if you're in the business of ripping apart the earth for resources, for major profits.. You can't really call out another industry on their practices...",2,2025-03-25 02:48:25,Garbage_Billy_Goat
worldnews,1jislzr,mjhkxpc,[deleted],1,2025-03-24 15:02:37,N/A
worldnews,1jislzr,mjim328,"With all the oil being wasted by the conflicts all over the world. Im not too confident in the longevity of fossil fuels.

Joonny nicebody",1,2025-03-24 18:02:55,Man_under_Bridge420
worldnews,1jislzr,mjj2erd,Money will solve the problem as soon as they decide it's worth it.,1,2025-03-24 19:21:41,Promethia
worldnews,1jislzr,mjjx93s,"""Thanks Satan.""",1,2025-03-24 21:52:17,TemperateStone
worldnews,1jislzr,mjkamvt,Big oil know this.  They’re just buying time.,1,2025-03-24 23:02:38,N/A
worldnews,1jislzr,mjkva0q,Says the billionaire who has pushed renewables as long as it is financed by taxpayers money.,1,2025-03-25 00:54:19,Maximum-Shallot-2447
worldnews,1jv753h,mm7ufzc,I thought everyone was kissing trumps ass? Don’t tell me he’s lying again.,74,2025-04-09 14:31:33,The-cultured-swine39
worldnews,1jv753h,mm7vdsd,"“Everybody in Washington, whether they want to admit it or not, knows that this president is right when it comes to tariffs and when it comes to trade,” White House press secretary Karoline Leavitt. 

EUs $23 billion was signed with XOXO.",30,2025-04-09 14:36:15,cdistefa
worldnews,1jv753h,mm89hhn,"Hello! Don't forget about Canada, we have resources, goods and services you might need, and vice-versa! And we don't have tarriffs.",24,2025-04-09 15:45:50,Rhannmah
worldnews,1jv753h,mm83mt6,Don't eat most of US food. Its trash full of chemicals and gmos. They are forcing US citizens to eat this garbage. Its why most americans look like they are pregnant.,20,2025-04-09 15:16:56,car23975
worldnews,1jv753h,mmawv52,I can’t keep up with the tariff news. I’m pretty sure I have whiplash at this point.,3,2025-04-09 23:47:57,thederlinwall
worldnews,1k18fnw,mnk0mbc,"> The Radio Frequency Directed Energy Weapon (RFDEW) development system can detect, track and engage a range of threats across land, air and sea.  

> RFDEWs are capable of neutralising targets up to 1km away with near instant effect and at an estimated cost of 10p per shot fired, providing a cost-effective complement to traditional missile-base air defence systems.  

> The RFDEW is different from Laser Directed Energy Weapons – such as DragonFire - because it uses a radio frequency to disrupt hostile threats, rather than a laser beam of light energy.   

> The weapon uses high frequency waves to disrupt or damage critical electronic components inside devices such as drones, causing them to be immobilised or fall out of the sky. It can also be used against threats on land and at sea.   

> The British Army successfully trialed a demonstrator version of the RFDEW.",81,2025-04-17 09:18:34,Bloke22
worldnews,1k18fnw,mnkhwuv,"'British soldiers have successfully trialled for the first time a game-changing weapon that can take down a swarm of drones using radio waves for less than the cost of a pack of mince pies.' 

Just seems rather odd that it compares it against the cost of mince pies, even though the press release was issued in December,",23,2025-04-17 11:47:42,hardboard
worldnews,1k18fnw,mnk4nv1,Deploy them in Ukraine ASAP for actual field testing.,46,2025-04-17 09:59:11,Romanopapa
worldnews,1k18fnw,mnk73rs,"10p per shot plus r&d, labor, equipment and deployment. However, this could be a game changer with long term very acceptable costs.",10,2025-04-17 10:22:19,roller_coaster325
worldnews,1k18fnw,mnkuh5p,I wonder what damage this does to a human.,6,2025-04-17 13:07:17,UnarmedRobonaut
worldnews,1k18fnw,mnm7w82,Aldi or Marks and Spencer?,3,2025-04-17 17:14:26,EssBen
worldnews,1k18fnw,mnkpp04,For the first time? I dunnoo,0,2025-04-17 12:38:45,squatting_bull1
worldnews,1k18fnw,mnombh5,Back to artillery. Never goes out of style.,0,2025-04-18 00:47:59,Fun-Interest3122
worldnews,1k18fnw,mnk9ypo,"If anyone is wondering, this won’t defeat any targets with very light protection against it. A small faraday cage around critical components and this thing is doing nothing at all. Great against commercial drones though.",-22,2025-04-17 10:47:19,Hogglespock
worldnews,1k18fnw,mnkvfud,not new but okay,-2,2025-04-17 13:12:53,thr0wnb0ne
worldnews,1k32y8j,mnyw69c,Poutine is lieing,146,2025-04-19 18:44:27,wjames0394
worldnews,1k32y8j,mnz0u6e,Whilst the drones targeted Ukraine,55,2025-04-19 19:10:15,thehermit14
worldnews,1k32y8j,mnyytzi,"I heard from local media (Czechia) it's around 24h or 30h ""truce""

That's nonsense. Almost like if it was mean to by only political move towards US..? ""We want peace Ukraine not"" of a kind?",39,2025-04-19 18:59:03,Vedagi_
worldnews,1k32y8j,mnytw9x,Lets see who breaks it first,66,2025-04-19 18:32:09,VitrioPsych
worldnews,1k32y8j,mo10lqu,Yet Putin didn't get the memo apparently.,3,2025-04-20 02:11:28,invalidpassword
worldnews,1k32y8j,mo288rr,Putin did this to keep the Trump capitulations rolling,3,2025-04-20 08:27:24,Bicwidus
worldnews,1k32y8j,mnyvrwx,"The issue is, Russians would claim Ukranians violated ceasefire first, Ukranians would claim Russian. 


I just hope the troops on either side get a moments relief, albeit short.",-56,2025-04-19 18:42:17,Hrit33
worldnews,1k32y8j,mo0h51r,Ukraine is fighting a lost war. Russia could crush all of Europe if it wanted. Stop sending Ukrainians to die for nothing. Surrender now before every last Ukrainian man is gone.,-81,2025-04-20 00:09:39,Straight_Cat2591
worldnews,1jym1tw,mn035n1,"Looks like it's mutual

>Vietnam's party chief wants enhanced defence, security, connectivity with China

https://www.reuters.com/world/asia-pacific/vietnams-party-chief-wants-enhanced-defence-security-connectivity-with-china-2025-04-14/",45,2025-04-14 02:54:37,AeroRandie
worldnews,1jym1tw,mmzhwks,Trump about to unify the entire South East Asia.,191,2025-04-14 00:34:14,TheMoorNextDoor
worldnews,1jym1tw,mmzvd0w,"Xi is already visiting Malaysia on the 15th, we're heading towards a very possible SEA union if US keeps up its batshit insanity",36,2025-04-14 02:01:33,GlibGlobC137
worldnews,1jym1tw,mmzrfhk,"It's sad to see the trillions America has spent to gain soft power around the world, only to see it thrown away.


But when all you understand is ""might is right"", these things happen and adversaries seize the opportunity.",43,2025-04-14 01:35:49,Zubon102
worldnews,1jym1tw,mn17kcz,The only problem is the disputed islands. China wants them and Vietnam doesn't want to give them up to China. That's one of the reasons why Vietnam has moved closer to the US for defense and economic reasons. Trump's political agenda is so bad that Vietnam prefers to make friends with one of its oldest enemies. ,5,2025-04-14 09:10:26,Satyriasis457
worldnews,1jym1tw,mmzvsy8,"the challenge here is that Vietnam has became so dependent on China lately that any more dependence will turn them close to a puppet state.

Vietnam now depends on China to supply electricity to keep their factories running. (although with Trump, those factories might not be running right now)",14,2025-04-14 02:04:29,SQQQ
worldnews,1jym1tw,mn1b8xq,"**U.S. goods trade with Vietnam totaled an estimated $149.6 billion in 2024**. U.S. goods exports to Vietnam in 2024 were $13.1 billion, up 32.9 percent ($3.2 billion) from 2023. U.S. goods imports from Vietnam totaled $136.6 billion in 2024, up 19.3 percent ($22.1 billion) from 2023.",1,2025-04-14 09:50:07,TXswingTRADER
worldnews,1jym1tw,mn2gxgr,"Trump only scope si to make money for him and his friends and by playing tariff game, is like taking candy from a baby.",1,2025-04-14 14:40:33,vrajealamarii
worldnews,1jym1tw,mmzqg3a,"Colonize ya, yeah, lemme colonize ya",-8,2025-04-14 01:29:22,Old_Bluecheese
worldnews,1jym1tw,mmzjhnb,[deleted],-35,2025-04-14 00:44:18,N/A
worldnews,1jlv7vy,mk6k6vg,"Users often report submissions from this site for sensationalized articles. Readers have a responsibility to be skeptical, check sources, and comment on any flaws.

You can help improve this thread by linking to media that verifies or questions this article's claims. Your link could help readers better understand this issue.

*I am a bot, and this action was performed automatically. Please [contact the moderators of this subreddit](/message/compose/?to=/r/worldnews) if you have any questions or concerns.*",1,2025-03-28 13:35:35,AutoModerator
worldnews,1jlv7vy,mk6kyna,"""We will not allow encroachments on the sovereignty of our country and will reliably protect our national interests,” Putin said.

Must have missed the note that Greenland is now also Russian territory.",427,2025-03-28 13:39:57,Doc_Chopper
worldnews,1jlv7vy,mk6ngny,This doesn't make any sense.  Greenland is already part of a NATO country.,118,2025-03-28 13:53:43,gamerprincess1179
worldnews,1jlv7vy,mk6q7xg,"Ah yes the 'Trumps totally not working with us I swear' play, ain't no-one gunna believe that",41,2025-03-28 14:08:18,alisru
worldnews,1jlv7vy,mk6o1rm,"Oh, come on now Vlad. We all know you've worked out a deal with Krasnov to share the spoils.",42,2025-03-28 13:56:49,Jabber-Wockie
worldnews,1jlv7vy,mk6qv4y,Putting on a show for the world to pretend they aren’t lovers.  ,18,2025-03-28 14:11:38,buchlabum
worldnews,1jlv7vy,mk7c7rx,It's all theater. Putin is giving Trump cover for his Greenland rhetoric. The real reason for the Greenland acquisition is to weaking our NATO and EU relationship.,17,2025-03-28 15:57:33,grandpohbah
worldnews,1jlv7vy,mk6q91a,They’ve discussed this amongst themselves multiple times during the past couple of years. This is performative,14,2025-03-28 14:08:28,SuperRat10
worldnews,1jlv7vy,mk6r9yy,"Here's what Putin is telling Trump to make happen

>The Russian president, however, claimed he was open to compromise, with the Kremlin calling on the US to join it in dividing up the natural resources for the two nations to share.

The Arctic is melting and fossil fuel deposits await. Russia's economy depends on them. And Trump was kept out of jail by fossil fuel company $ and power.",12,2025-03-28 14:13:44,samuel-dunstan
worldnews,1jlv7vy,mk6sgga,I get Hitler / Stalin vibes from these two.,11,2025-03-28 14:19:51,Responsible_Bee_939
worldnews,1jj3h3r,mjk2nym,"No, dictatorships are evil. Locking up political opponents is a sign of dictatorships.",208,2025-03-24 22:20:37,sayleanenlarge
worldnews,1jj3h3r,mjk1bdy,"Erdoğan is horrible. Over 1,100 people have been arrested. Imamoglu is in jail.",124,2025-03-24 22:13:31,ChiefFun
worldnews,1jj3h3r,mjk8un8,How do we stop narcissists from getting power and holding on to it? It’s like a curse on humanity,66,2025-03-24 22:53:23,Projectionist76
worldnews,1jj3h3r,mjknmpa,Kind of funny Erdogan claiming protest as evil when he is the one who initiated it with illegal arrest of his political opponent.,44,2025-03-25 00:10:05,macross1984
worldnews,1jj3h3r,mjk17zq,Miror mirror on the wall...,21,2025-03-24 22:13:02,rocenante
worldnews,1jj3h3r,mjkfj2t,Tyrants love to project.,5,2025-03-24 23:28:31,Killerrrrrabbit
worldnews,1jj3h3r,mjl57ie,"I see black is white in Turkey,too.",6,2025-03-25 01:52:22,tqualks
worldnews,1jj3h3r,mjm7bva,"Big shocker, the tyrant dictator doesnt like when his slaves Rebell 😱",4,2025-03-25 06:53:42,themiddleguy09
worldnews,1jj3h3r,mjkauri,Let’s respect the dictator who had American protesters beaten on American soil and the fascist leader who allowed it,8,2025-03-24 23:03:47,happyslappypappydee
worldnews,1jj3h3r,mjm54f8,Coming to America in 2028,3,2025-03-25 06:30:08,Fncivueen
worldnews,1jsii3e,mln01yu,Why did they bury the ambulances?,209,2025-04-06 02:26:46,Rondont
worldnews,1jsii3e,mlnuze0,So will this be racked up as another war crime for the future tribunal?,70,2025-04-06 06:36:15,Carl_Clegg
worldnews,1jsii3e,mlp8049,"I’m sure their investigation will be swift, thorough, and will find no evidence of wrongdoing because they’re not interested in the truth.",11,2025-04-06 14:02:06,Detlef_Schrempf
worldnews,1jsii3e,mlpqvev,What Israel learned from this was they'll search the bodies of innocent civilians they murder for hidden cameras before dumping them in mass graves,24,2025-04-06 15:46:54,Resident_Function280
worldnews,1jsii3e,mlmopag,.... I am sure they will find nothing and no one will be punished as usual smh,225,2025-04-06 01:10:11,Vanilla_Either
worldnews,1jsii3e,mlmr04b,"The 15 aid workers and the UN staff member who were killed were actually searching for *other colleagues who had been killed* by the IDF.

First, the Red Cross and UN coordinated with the IDF, announcing the timing and route of their convoy. When the clearly-marked ambulances and first responders arrived at the pre-designated site with blaring lights and high-vis jackets, they were gunned down. Some of them tried to flee and, over the course of an hour, they were subsequently tracked down and murdered.

The IDF then buried all the bodies, in their uniforms, and buried their ambulance trucks, too, just to be sure, I suppose.

Naturally, the Israeli government claimed they were Hamas infiltrators in blacked out vans. As new evidence emerged contradicting their version of events, the IDF simply adjusted their claim, as needed.

""Cover up"" would be appropriate, after all... they buried the fucking ambulances. But then again, the Israeli government seems to be very comfortable lying to the world, in spite of the evidence our eyes can plainly see. Whether we believe their lies or not, they don't seem to really care.

This is unfortunately routine.

More than 408 first responders—people who volunteer, without pay, to walk into this fucked up morass and save lives—have been killed, including 280 UNRWA staff. More than 1050 health workers have been killed in total by IDF soldiers.",152,2025-04-06 01:25:41,Tom-Rath
worldnews,1jsii3e,mlo36aa,"They’ll investigate zilch. Someone will get chewed out for leaving the phone as evidence. Nothing more. Moral army, remember?",13,2025-04-06 07:57:59,SirGrumpsalot2009
worldnews,1jsii3e,mlmrvlx,We have investigated ourselves and found nothing wrong.,69,2025-04-06 01:31:35,braumbles
