subreddit,post_id,comment_id,comment_content,comment_score,comment_created_at,comment_author
worldnews,1jskvvv,mlo08pc,Killing 15 emergency workers in 4 ambulances and then destroying the ambulances and burying the ambulances and the medics inside under the sand in mass graves to hide their crimes is what we call a ‘mistake’ these days?,361,2025-04-06 07:27:07,Uncle_Beanpole
worldnews,1jskvvv,mlnhus8,Yeah - oops - we murdered them and buried them and the ambulance they came in.  We missed a word or two and had a comma in the wrong last time.,220,2025-04-06 04:39:01,cswigert
worldnews,1jskvvv,mlncux0,They buried them with bulldozers and earth moving equipment after saying they were terrorists. This is just a war crime that they tried to cover up.,309,2025-04-06 03:59:51,ManicParroT
worldnews,1jskvvv,mlohah0,“Next time we’ll destroy all recording devices and bury our ‘mistakes’ deeper.  We’re sorry.” -IDF probably,101,2025-04-06 10:30:31,TamashiiNu
worldnews,1jskvvv,mlnq7w2,"“Partly mistaken” is a really weird way of saying “completely fabricated to cover our asses”

And the fact that they would have kept asserting (and the world keep accepting) the false results of their self-“investigation” had it not been for that poor man’s cell phone having recorded his own murder and somehow preserved the burial. 

How many other extremely obvious war crimes have not been videotaped? 

Israel’s record slaughter of palestinian journalists and their forbidding of foreign journalists from entering the strip is making a lot more sense when you realize the damage the truth can do

Meanwhile Congress is sending another several billion in weapons to keep doing this monstrosity",134,2025-04-06 05:51:43,blurghh
worldnews,1jskvvv,mlndyzx,Partly? You got caught. You still do the same thing tomorrow.,189,2025-04-06 04:08:06,thiscantbereal4200
worldnews,1jskvvv,mloc12e,"Whoopsies 🤷🏻‍♂️

This is like the time I accidentally bought whole canned tomatoes when I actually wanted chopped tomatoes. So silly haha.

Anyway, what do you mean it’s a war crime?",68,2025-04-06 09:34:11,wynnduffyisking
worldnews,1jskvvv,mlnms71,"Jesus Christ, this is a blatant war crime",100,2025-04-06 05:20:48,Early-Rise987
worldnews,1jskvvv,mlojm2s,"When things like this happen once, you can believe it was a mistake. When they happen repeatedly over many years, it's clear they either don't care or are actively targeting the aid workers.",48,2025-04-06 10:54:24,bigdammit
worldnews,1jskvvv,mlpadlf,Tell that to the families.,20,2025-04-06 14:16:05,Chocolat-Pralin
worldnews,1jubzii,mm0unyt,Wednesday is going to be a fun day in the markets…,99,2025-04-08 12:27:05,Solentiname_90
worldnews,1jubzii,mm0xfw7,"I'm pretty sure Xi knows what he's doing, whereas our cartoon president does not.",138,2025-04-08 12:45:04,ExoticEmployment8558
worldnews,1jubzii,mm0w3kl,"Keep in mind that China can afford to take a long-term view, unlike Trump who is doing this as a misguided vanity-fueled power trip. And they know the people are not behind Trump, and the narrative is not at all controllable. 

  
And don't forget that the CCP would look at this as a threat to their power domestically as a tail-end risk. They really would fight 'til the end - IE their end.",70,2025-04-08 12:36:33,steve_ample
worldnews,1jubzii,mm191a2,"Trump is living in a full alternate reality right now

>In a post a few moments ago on his Truth Social platform, US President Donald Trump says he believes China will strike a deal on the possible 104% tariffs the US has threatened to impose.

>He writes: ""China also wants to make a deal, badly, but they don’t know how to get it started. We are waiting for their call. It will happen!""",25,2025-04-08 13:53:25,ersentenza
worldnews,1jubzii,mm0xrui,"The funny part, China doesn't even need to fight. US will crumble by itself.",71,2025-04-08 12:47:09,Jiteye
worldnews,1jubzii,mm2ld3m,"\[punching myself in the face\]

This'll show you!",9,2025-04-08 17:52:15,BMCarbaugh
worldnews,1jubzii,mm0yct1,"Oh wow ... I am shocked China would not bend the knee.  

In other news the sky is blue....

As a Canadian, I would be happy to I crease trade with The EU, China and pretty much anywhere else.  It makes it way easier to tune out the stupidity to the south of us.",13,2025-04-08 12:50:47,PreacherCoach
worldnews,1jubzii,mm1ooxo,I really fucking hate this timeline,5,2025-04-08 15:13:45,DontBeADramaLlama
worldnews,1jubzii,mm2uzh4,Yamtits thinks everyone wants to make a deal with him but he's too stupid to realize nobody wants to deal with him because he simply can't be trusted.,3,2025-04-08 18:38:26,Bubbaganewsh
worldnews,1jubzii,mm29tvm,"These are Trump Tariffs. He chose to do this. He needs to take the responsibility for the consequences and step down from power if this causes a massive recession and economic hard times.


I understand he will not do this and will blame the (insert scapegoat here) ",2,2025-04-08 16:58:06,fedaykin909
worldnews,1k33vqb,mnz30zj,"Mark my words: we will be seeing a battle between Zelenskyy and Putin in showing Trump who has the higher level of desire to end end war, meanwhile Trump says the war is not ready for peace since Ukraine has not agreed to a minerals deal.",130,2025-04-19 19:22:32,Dramatic_Mammoth3804
worldnews,1k33vqb,mnz572k,"We all know that 1. Putin will break it immediately (if the truce even gets accepted) and 2. When the truce breaks, orange man is somehow gonna find a way to blame it on Ukraine like he always does.",45,2025-04-19 19:34:45,Average_NPC_Viewer
worldnews,1k33vqb,mo0que6,Theyre still being hit with ordinance despite the ceasefire,5,2025-04-20 01:10:02,Society-Into-Ashes
worldnews,1k33vqb,mo13wio,"What truce? There hasn't been a truce whatsoever since Russia kept bombing them after it was called.

Is Ukraine just going to sit down and twiddle their thumbs just because a truce would be nice?",4,2025-04-20 02:32:47,ThereIsNoResponse
worldnews,1k33vqb,mnz2uqy,As if Putin can even go a single day,10,2025-04-19 19:21:33,Lnsatiabie
worldnews,1k33vqb,mnzheng,Smart political move by Zelensky.,6,2025-04-19 20:42:19,natalie_merchant_fan
worldnews,1k33vqb,mo108gf,Putin's not even abiding by it now.,2,2025-04-20 02:09:12,invalidpassword
worldnews,1k33vqb,mnzq4cr,"There was ""truce"", sure.  And Russia launch missile attack against civilians (as usual).",5,2025-04-19 21:31:27,macross1984
worldnews,1k33vqb,mnznuxk,"It seems dangerous and even a little naive to even be having talks about truce anymore.

We already know Putin will break it so it just sets Ukranians up to be taken advantage of. These are human lives being played with, the only way a truce will work is through unconditional Russian DEFEAT.",0,2025-04-19 21:18:26,Sopomfabulous
worldnews,1k33vqb,mo1lx16,"Such a strange world. Where people can tell you that you can take a break from trying to kill others, and possibly being killed for a day. In the name of a fictional guy who got killed to save us…. But he got better so he’s not dead anymore.  
Read all of that again. Slowly. All the words. What the fuck are we doing to each other?!",1,2025-04-20 04:47:33,Wactout
worldnews,1jylezd,mmzi5gk,Sounds like the start of a Lebanese resurgence!,76,2025-04-14 00:35:48,N/A
worldnews,1jylezd,mmzhyvb,That's good.,57,2025-04-14 00:34:39,hhaattrriicckk
worldnews,1jylezd,mmzj07l,"As long as Hezbollah has a presence, Lebanon cannot prosper",206,2025-04-14 00:41:13,No_Environments
worldnews,1jylezd,mmzn8vl,power to the lebanese people,44,2025-04-14 01:08:26,bennybar
worldnews,1jylezd,mmzdz79,I hope so much that this is the definite implementation of UN resolution 1701 but I fear that the Lebanese army is weak. Is there someone who has a closer view on the situation?,61,2025-04-14 00:09:17,ComfortableLost6722
worldnews,1jylezd,mmzd2qb,Step in the right direction,63,2025-04-14 00:03:34,Booksnart124
worldnews,1jylezd,mn03cfd,"It is a good sign Lebanese army is taking over Hezbollah bases.  With Iran unable to resume support like in the past, hopefully Lebanon can disarm it completely.",19,2025-04-14 02:55:56,macross1984
worldnews,1jylezd,mmzzosl,About fuckin time,13,2025-04-14 02:30:32,POGsarehatedbyGod
worldnews,1jylezd,mmzqki1,"Now go all the way.  Outlaw Hezbollah, arrest everyone in it, hand them over to Israel.",27,2025-04-14 01:30:11,Dr_OttoOctavius
worldnews,1jylezd,mn1vcxp,"Very, very good news !

It's awesome how, finally, the Hamas attack is bringing a very good change in Middle East geopolitics. 

We can or cannot agreed with Israel politics, but they are doing an excellent work targeting and destroying ennemies that are not so easy to take off..",2,2025-04-14 12:35:32,Caramail_Mou
worldnews,1jz2my6,mn3g192,"Dear Japanese, we Italians are trying to beat you as the worst country regarding birth rate and median age",457,2025-04-14 17:36:04,Dystopics_IT
worldnews,1jz2my6,mn540er,"Ironically, Japan still holds the title of the highest birth rate in East Asia.",107,2025-04-14 22:46:50,sig_figs_2718
worldnews,1jz2my6,mn46qaz,"There's a population decline paradox occurring in much of the world. As the labor force declines, the demand for each individual would increase. This results in an overworked and underpaid workforce, which does not have the time nor money to raise children. 

There is a solution to this problem but it will not happen. Why? Because the old will outnumber the young and government policy will protect the larger older voter base. We are in an irreversible death spiral.",485,2025-04-14 19:49:37,Toasted_Sugar_Crunch
worldnews,1jz2my6,mn375pz,They are disappointing Shinzo Abe sama :(,134,2025-04-14 16:52:49,Rough_Shelter4136
worldnews,1jz2my6,mn3w338,"Economic collapse is easier survived than environmental collapse, no? Takes less time to repopulate the earth than regenerate. I suspect we had a solution to this problem 50 years ago but a handful of powerful people decided to take this planet a different direction.",77,2025-04-14 18:55:04,FoxPuzzled4969
worldnews,1jz2my6,mn61u17,"At that rate, they’ll only be around for another 246 years. Then it’s up for grabs!",4,2025-04-15 02:07:20,new_jill_city
worldnews,1jz2my6,mn5eyul,All this bad economic coverage about Japan lately yet Berkshire Hathaway is gearing up to start buying Japanese companies - typically that means you will wish you had done the same or at least bought more BRK.,6,2025-04-14 23:50:01,Suitable-Ratio
worldnews,1jz2my6,mn7erkm,"I grew up with this...

https://en.wikipedia.org/wiki/The_Population_Bomb",3,2025-04-15 09:20:56,violenthectarez
worldnews,1jz2my6,mn33f1f,It’s almost as if people see how the rich live and are pissed they can’t have the same even though people swear if you just put in the labor you’ll be rewarded.,52,2025-04-14 16:34:06,Due-Dragonfruit-1303
worldnews,1jz2my6,mn4oo9s,"Living in Japan as a women is an absolute hell. The amount of misogyny and the amount of fetishizing teenager girls are still rampant. There is a rabbit hole of women or teenagers live-streaming themselves committing suicide by jumping off the building. One woman in her early 20s livestreamed herself talking about how she was excessively abused by her ex and dumped her, she has no place to go back, and been homeless. She then takes off her shoes, stands on top of the rail of 15 story tall building, waves at the camera, says “Bye bye” and just jumps without hesitation. Then the scream from the bottom.
Another horrible live-stream was 2 teenage girls who were rape victim by this male streamer. The streamer groomed them with him fame and then raped both 15 years old girls, even got one pregnant. In Japan, there is horrible stigma being raped and it’s basically a social suicide if someone finds out. Both teenage girls unable to find support, found each other, went on top of the building, hugged each other, and both jumped off. And that streamer? Never faced consequence for his action.
Japan is still decades away when it comes helping those with mental health and proper women right support. It is very common to see teenage girls just sitting on the sidewalk in the middle of Kabakucho or Shinjuku and spend the night like that. So you have to wonder why women avoids wanting to marry.",49,2025-04-14 21:20:29,DeepSleepr
worldnews,1k13x5i,mnpfhvz,[New post can be found here](/r/worldnews/comments/1k1w02v/rworldnews_live_thread_russian_invasion_of/),1,2025-04-18 04:02:55,WorldNewsMods
worldnews,1k13x5i,mnjqacj,"Hope everyone is doing well, and thank you to all of you Live Thread veterans o7",144,2025-04-17 07:29:27,dieyoufool3
worldnews,1k13x5i,mnjk0nz,"* approximately 937,440 **(+1,230)** military personnel;
* 10,654 **(+16)** tanks;
* 22,217 **(+54)** armoured combat vehicles;
* 26,442 **(+65)** artillery systems;
* 1,366 **(+2)** multiple-launch rocket systems;
* 1,135 **(+3)** air defence systems;
* 370 (+0) fixed-wing aircraft;
* 335 (+0) helicopters;
* 32,925 **(+88)** tactical and strategic UAVs;
* 3,145 (+0) cruise missiles;
* 28 (+0) ships/boats;
* 1 (+0) submarine;
* 44,642 **(+170)** vehicles and fuel tankers;
* 3,807 **(+3)** special vehicles and other equipment.",82,2025-04-17 06:26:07,grimmalkin
worldnews,1k13x5i,mnltnky,"[The US voted against a UN resolution condemning Russia’s aggression against Ukraine. The resolution focused on UN–Council of Europe cooperation, but Washington opposed the paragraph on Ukraine — claiming such language “does not help achieve peace.”](https://liveuamap.com/en/2025/17-april-12-the-us-voted-against-a-un-resolution-condemning)

Only 9 countries voted against: North Korea, Nicaragua, Niger, Russia, Belarus, Mali, Eritrea, Sudan, and the US

Another surprise is that countries like Hungary, Slovakia, Myanmar, Laos, Libya, Qatar, and even Georgia and Armenia voted for",56,2025-04-17 16:05:38,Glavurdan
worldnews,1k13x5i,mnma72f,"[Ukraine says it has intelligence which shows China is supplying artillery and gunpowder to Russia](https://liveuamap.com/en/2025/17-april-16-ukraine-says-it-has-intelligence-which-shows). Zelenskyy: ""We believe that Chinese representatives are engaged in the production of some weapons on the territory of Russia""",59,2025-04-17 17:25:18,Glavurdan
worldnews,1k13x5i,mnma4py,"[“Witkoff has adopted the strategy of the Russian side. He consciously or unconsciously repeats Russian narratives. This is harmful”, — Zelensky](https://liveuamap.com/en/2025/17-april-16-witkoff-has-adopted-the-strategy-of-the-russian). ""We are discussing an unconditional ceasefire, we are not discussing territories. I do not see his \[Witkoff\] mandate to discuss Ukrainian territories, because these are our territories, so I do not understand what he is talking about",54,2025-04-17 17:25:01,Glavurdan
worldnews,1k13x5i,mnj73tx,"Please consider donating to Ukrainian government's United24 initiative: https://u24.gov.ua/

Also, /r/ukraine subreddit has a list of vetted charities and organizations:

https://www.reddit.com/r/ukraine/wiki/charities

Thank you! Glory to the Heroes! 🇺🇦✌️",39,2025-04-17 04:31:07,Marha01
worldnews,1k13x5i,mnkqdhp,"[Czechia independent of Russian oil for first time in history | Kyiv Independent](https://kyivindependent.com/czechia-independent-of-russian-oil-for-first-time-in-history/)

Czechia is now completely independent of Russian oil, Czech Prime Minister Petr Fiala and other officials announced on April 17, marking the first time in history no Russian pipeline oil flows to the country.

Prague is receiving no supplies through Russia's Druzhba oil pipeline for the first time in over 60 years, securing alternative supplies thanks to the expansion of the western Transalpine Pipeline (TAL), running through Italy, Austria, and Germany. The move underscores Europe's efforts to end its reliance on Russian fossil fuels in response to Moscow's all-out invasion of Ukraine. In May, the EU is expected to present a plan for a full phase-out of Russian fossil fuels by 2027.

""We completed another step toward our energy independence,"" Fiala told journalists at the central oil storage facility near Prague alongside Finance Minister Zbynek Stanjura and Jaroslav Pantucek, director of the state-run oil transit company MERO.

Officials said Czechia has not been receiving Druzhba oil for several weeks. In recent years, Russian oil covered roughly half of the country's demand.

Prague expects up to 8 million metric tons of oil from the western pipeline per year, which should be sufficient to cover its needs. While the EU banned Russian pipeline oil imports in 2022, Czechia, Slovakia, and Hungary received a waiver from the ban due to the lack of viable alternatives.

Already in November 2022, the Czech government decided to launch the TAL-PLUS project to secure an alternative oil supply. Technical work on the project began in May 2024, and the same year, Prague said it would not seek an exemption from the ban on Russian oil.

The Druzhba pipeline, running from Russia through Ukraine and Belarus to EU countries, was first launched in then-Czechoslovakia in 1962.",42,2025-04-17 12:42:53,Well-Sourced
worldnews,1k13x5i,mnl99pf,"**The estimated total combat losses of the enemy from 24.02.22 to 17.04.25:**

personnel: about 937 440 (+1 230) persons     
tanks: 10 654 (+16)          
troop-carrying AFVs: 22 217 (+54)       
artillery systems: 26 442 (+65)         
MLRS: 1 366 (+2)   
anti-aircraft systems: 1 135 (+3)        
aircraft: 370 (+0)  
helicopters: 335 (+0)  
UAVs operational-tactical level: 32 925 (+88)  
cruise missiles:3 145(+0)  
warships/boats: 28 (+0)  
submarines: 1 (+0)  
vehicles and fuel tanks: 44 642 (+170)       
special equipment: 3 807 (+3)

Data are being updated.  
Fight the invader! Together we will win! 

Source  [https://mod.gov.ua/en/news/the-estimated-combat-losses-of-russians-over-the-last-day-1-230-persons-88-ua-vs-and-65-artillery-systems](https://mod.gov.ua/en/news/the-estimated-combat-losses-of-russians-over-the-last-day-1-230-persons-88-ua-vs-and-65-artillery-systems) 

Slava Ukraini!",42,2025-04-17 14:26:44,Nurnmurmer
worldnews,1k13x5i,mnnjst7,"[Ceasefire in Ukraine ""at this stage"" is unrealistic, says Russia's Permanent Representative to the UN Nebenzya](https://liveuamap.com/en/2025/17-april-21-ceasefire-in-ukraine-at-this-stage-is-unrealistic)

From the horse's mouth",45,2025-04-17 21:09:43,Glavurdan
worldnews,1ju4szu,mm5oji5,[New post can be found here](/r/worldnews/comments/1jux00h/rworldnews_live_thread_russian_invasion_of/),1,2025-04-09 04:02:43,WorldNewsMods
worldnews,1ju4szu,mm0ivm4,">...Earlier, it was reported that a 16-year-old Ukrainian teenager had been abducted by Russian forces from Kherson and sent to a so-called ""re-education camp"". The boy openly resisted and at one point took down the Russian flag from a flagpole and replaced it with his underwear.

https://www.pravda.com.ua/eng/news/2025/04/8/7506551/",77,2025-04-08 10:59:22,NotHallamHope
worldnews,1ju4szu,mm09ira,"Look's like Russia is panicking about falling oil prices at the moment.

[https://www.theguardian.com/business/live/2025/apr/08/stock-markets-nikkei-dow-ftse-100-asian-market-today-trump-china-tariffs-threat-business-news-live-latest-updates?CMP=share\_btn\_url&page=with%3Ablock-67f4df9b8f08405e93a163b2#block-67f4df9b8f08405e93a163b2](https://www.theguardian.com/business/live/2025/apr/08/stock-markets-nikkei-dow-ftse-100-asian-market-today-trump-china-tariffs-threat-business-news-live-latest-updates?CMP=share_btn_url&page=with%3Ablock-67f4df9b8f08405e93a163b2#block-67f4df9b8f08405e93a163b2)

Goldman Sachs is predicting oil pricing could fall fairly significantly if there is a global slowdown from the effects of the Trump tariffs which is likely.

$70 per barrel was the average Urals price Russia has based its entire 2025 budget on, which was already at a large deficit (and increasing) due to soaring government spending on the war. That's if you actually believe their numbers in the first place which knowing them I would not.

Their economy is still massively dependent on oil and anything below this at the $40 - $55 per barrel predicted could be a disaster for them.

It's ironic that Trump might actually hurt Russia more than they ever would have thought, purely by his incompetence on tariffs potentially causing a global recession and crashing oil prices.

Unless Trump ends the trade wars / sanctions on Russia or gets involved in some sort of conflict in Iran (spiking oil prices), Russia certainly could have some major economic issues in the near future if the war continues.",64,2025-04-08 09:29:01,TheLowBro
worldnews,1ju4szu,mlzqkq0,"> ‪A must read on Russian logistics companies. ... trucks started exiting the market in Autumn 2024 ... In Q1 2025 20% had stopped working.

The translation is weird but basically I think truckers were forced to accept low prices so Russia could keep inflation down. But that can't work forever, so either the government bails them out, logistics get rationed, or prices go up.

The industry is only asking for 19 billion roubles though, which isn't a lot. Still it looks promising.

https://bsky.app/profile/delfoo.bsky.social/post/3lmbn5lcy4k2j",46,2025-04-08 06:09:45,TurbulentRadish8113
worldnews,1ju4szu,mlzfhvc,"Please consider donating to Ukrainian government's United24 initiative: https://u24.gov.ua/

Also, /r/ukraine subreddit has a list of vetted charities and organizations:

https://www.reddit.com/r/ukraine/wiki/charities

Thank you! Glory to the Heroes! 🇺🇦✌️",38,2025-04-08 04:30:16,Marha01
worldnews,1ju4szu,mm0ao6v,"""Pentagon considering proposal to cut thousands of troops from Europe, officials say""

https://www.nbcnews.com/politics/national-security/pentagon-considering-proposal-cut-thousands-troops-europe-officials-sa-rcna199603",34,2025-04-08 09:41:22,M795
worldnews,1ju4szu,mm3og8k,"From a few days ago.

> Russian finance ministry to switch to FX sales in coming month

> The move will increase the state's overall net forex sales to 10.46 billion roubles a day from 5.96 billion roubles a day in the previous month, ...

Low oil prices= Russia could burn what's left of the wealth fund this year.

https://www . tradingview.com/news/reuters.com,2025:newsml_S8N3Q70E:0-russian-finance-ministry-to-switch-to-fx-sales-in-coming-month/",37,2025-04-08 21:00:37,TurbulentRadish8113
worldnews,1ju4szu,mlzhaoq,"Russian losses 08/04/2025 reported by the Ukrainian General Staff



1290 KWIA 

5 Tanks 

14 APVs 

43 Artillery systems 

3 MLRS 

2 Anti-Aircraft Systems

43 UAVs 

107 Vehicles & Fuel tanks 

2 Special equipment 



Slava Ukraini !",61,2025-04-08 04:45:14,belaki
worldnews,1ju4szu,mm2ikob,"Crude oil actually went under $60 today. The longer it stays there, the more it's going to hurt.",31,2025-04-08 17:39:33,HawkeyedHuntress
worldnews,1ju4szu,mm3bcch,About 15 explosions just occurred in Kharkiv. Numerous Shaheds. Reports say more are still coming.,31,2025-04-08 19:58:49,invisibleman127
worldnews,1jjunws,mjr0i8o,China is literally filling the vacuum of power and influence the US is willingly let sail out. They are burning all the bridges they can.,61,2025-03-26 00:01:51,Top-Cheddah
worldnews,1jjunws,mjqk62h,You should import china EVs with a 20% tariff that will wipe Tesla out,145,2025-03-25 22:35:42,Bucuresti69
worldnews,1jjunws,mjrm1lp,"Canada is the only nation in the G7 that has free trade agreements with all other members of the G7. We've never really taken advantage of this, though, because the US market was the obvious choice given proximity (and still is if we ignore the political mess). Canada has a lot to trade. We should open up talks with Beijing too, to work on building/ further these trade relationships.",16,2025-03-26 02:04:18,ominous-canadian
worldnews,1jjunws,mjq73ml,"Well, you know, if one kid doesn’t want to play ball, find another kid to play with",77,2025-03-25 21:28:05,Icariwator
worldnews,1jjunws,mjqx1fu,Sure. We should increase trade to China in some areas where Canada stands to benefit. But let's be real. China is no friend of Canada and we should tread carefully.,57,2025-03-25 23:42:59,on_glue_2000
worldnews,1jjunws,mjrblwk,Lesser of two evils?  I'm not so sure.,6,2025-03-26 01:04:11,Mantaur4HOF
worldnews,1jjunws,mjq77hy,Funny way of asking after also implementing tariffs on Canada.,24,2025-03-25 21:28:37,WashuOtaku
worldnews,1jjunws,mjqnj0u,We are gonna see the feds reduce tariffs on China products soon i think.,2,2025-03-25 22:53:18,N/A
worldnews,1jjunws,mjq6ich,I think we need to make peace with China. They can replace all usa trade.,12,2025-03-25 21:25:05,LateDifficulty4213
worldnews,1jjunws,mjq6kpu,Stop executing our citizens and stop interfering in our democracy. Then maybe we will talk.,9,2025-03-25 21:25:25,waldo--pepper
worldnews,1jtglap,mlzc25l,[New post can be found here](/r/worldnews/comments/1ju4szu/rworldnews_live_thread_russian_invasion_of/),1,2025-04-08 04:03:06,WorldNewsMods
worldnews,1jtglap,mlv28i4,"Russian soldiers are reported to be causing chaos in military hospitals, threatening to blow themselves up with grenades, attacking and attempting to rape other patients, robbing patients, drinking, starting fights and calling prostitutes to their wards.

[https://bsky.app/profile/chriso-wiki.bsky.social/post/3lm5ynyjxr42s](https://bsky.app/profile/chriso-wiki.bsky.social/post/3lm5ynyjxr42s)

Whenever the war ends, Russian society will have to deal with hundreds of thousands of men going home with severe PTSD, in addition to the Russian soldiers who were total shitheads and criminals to begin with.",68,2025-04-07 13:48:53,barney-panofsky
worldnews,1jtglap,mlv5cni,The fall in oil prices is going to be catastrophic for Russia.,55,2025-04-07 14:06:13,Acceptable-Pin2939
