subreddit,post_id,title,content,score,upvote_ratio,num_comments,created_at,url,author
worldnews,1jwkbyx,"EU to Trump on tariffs: We’ll retaliate when we’re ready, not when you tweet",,16656,0.98,428,2025-04-11 07:40:48,https://www.politico.eu/article/eu-to-trump-on-tariffs-well-retaliate-when-were-ready-not-when-you-tweet/,doopityWoop22
worldnews,1k2x6ow,"Putin declares Easter truce, will halt all military operations in Ukraine until Monday",,16633,0.91,1407,2025-04-19 14:13:22,https://news.sky.com/story/ukraine-war-latest-putin-declares-easter-truce-and-says-russia-will-cease-all-military-operations-until-monday-12541713,Technical_Ostrich_47
worldnews,1jo9lus,"Zelenskiy says Russia has committed over 183,000 war crimes in Ukraine",,16145,0.98,210,2025-03-31 18:00:42,https://www.yahoo.com/news/zelenskiy-says-russia-committed-over-174653948.html,yahoonews
worldnews,1jrb46x,"Ukraine still holds land in Russia and is actually expanding, top US general says",,16103,0.98,202,2025-04-04 12:51:40,https://www.politico.eu/article/ukrainians-still-hold-part-kursk-expanded-nearby-belgorod-eucom-commander-said/,eaglemaxie
worldnews,1jjxtni,Vance to accompany wife to Greenland amid backlash,,15882,0.93,2352,2025-03-25 23:32:59,https://thehill.com/homenews/administration/5213452-vance-travels-greenland,SmoothOperator604
worldnews,1jjjumd,"Russia abducting Ukrainian kids to ‘turn them into Russians,’ says report",,15725,0.96,273,2025-03-25 13:52:21,https://tvpworld.com/85797256/russia-abducting-ukrainian-children-to-forcibly-turn-them-into-russians-says-report,KrzyHooy
worldnews,1jqkc5w,France’s Macron Urges Companies to Pause US Investments,,15703,0.98,270,2025-04-03 14:45:39,https://www.bloomberg.com/news/articles/2025-04-03/france-s-macron-urges-companies-to-pause-us-investments,bloomberg
worldnews,1jl6ea9,Trump Threatens More Tariffs If EU 'Works With' Canada,,15656,0.95,1697,2025-03-27 15:20:02,https://www.forbes.com/sites/siladityaray/2025/03/27/trump-threatens-more-tariffs-if-eu-works-with-canada-to-cause-economic-harm-to-us/,AnonymousTimewaster
worldnews,1jkir26,"Canadian travel to the U.S. drops over 70% for summer 2025, according to OAG",,15577,0.98,842,2025-03-26 18:23:24,https://www.oag.com/blog/canada-us-airline-capacity-aviation-market,erg99
worldnews,1k3lo8a,EU considers stripping Hungary of voting rights over Ukraine obstruction,,15585,0.98,437,2025-04-20 12:40:37,https://euromaidanpress.com/2025/04/20/eu-considers-stripping-hungary-of-voting-rights-over-ukraine-obstruction/,inspirationalpink
worldnews,1jmun6n,Ukraine launches new incursion into Russia’s Belgorod region,,15051,0.97,585,2025-03-29 19:52:27,https://www.cnn.com/2025/03/29/europe/ukraine-russia-war-belgorod-intl/index.html,VictorEmmanuelIV
worldnews,1jnf8ji,Erdogan in Eid al-Fitr holiday greeting: 'May Allah destroy Israel',,15005,0.92,1075,2025-03-30 15:43:42,https://www.ynetnews.com/article/sk3y7cupkl,DatDudeOverThere
worldnews,1jlbvcw,Putin warns of Arctic war if US takes Greenland as Britain and France to send 'reassurance force' to Ukraine,,14378,0.98,1099,2025-03-27 19:24:10,https://www.lbc.co.uk/world-news/putin-greenland-trump-nato-ukraine-ceasefire-starmer-zelenskyy-russia/,nohup_me
worldnews,1jjttnp,"Russia ""managed to influence"" people in White House—Zelensky",,14335,0.98,207,2025-03-25 20:44:19,https://www.newsweek.com/russia-managed-influence-people-white-housezelensky-2050205,Old_General_6741
worldnews,1jnw4px,"Ukraine won't sign minerals deal with US if it threatens EU membership, Zelensky says",,14327,0.98,413,2025-03-31 05:32:42,https://kyivindependent.com/ukraine-wont-sign-minerals-deal-with-us-if-it-threatens-eu-membership-zelensky-says/,eaglemaxie
worldnews,1js5qhs,"US embassy's response to Russia's Kryvyi Rih attack 'unpleasantly surprising,' Zelensky says.",,14001,0.98,225,2025-04-05 15:16:41,https://kyivindependent.com/us-embassys-response-to-russias-kryvyi-rih-attack-unpleasantly-surprising-zelensky-says/,N/A
worldnews,1jn6zgd,"South Korea, China, Japan agree to promote regional trade as Trump tariffs loom",,13752,0.98,384,2025-03-30 07:06:28,https://www.reuters.com/world/asia-pacific/south-korea-china-japan-agree-promote-regional-trade-trump-tariffs-loom-2025-03-30/,Advanced_Drink_8536
worldnews,1jzoqo0,US to demand EU pulls away from China in return for cutting tariffs,,13695,0.95,1574,2025-04-15 10:46:37,https://www.irishtimes.com/politics/2025/04/15/briefings-suggest-eu-faces-choice-between-us-and-china/,EdgarNeverPoo
worldnews,1jubmtw,Brussels police arrest US State Secretary Rubio's bodyguard,,13644,0.98,499,2025-04-08 11:51:05,https://www.brusselstimes.com/brussels/1526014/brussels-police-arrest-us-state-secretary-rubios-bodyguard-tbtb,EUstrongerthanUS
worldnews,1jji34i,"Netherlands tightens U.S. travel warning, especially for LGBTQ visitors",,13547,0.96,402,2025-03-25 12:24:03,https://nltimes.nl/2025/03/25/netherlands-tightens-us-travel-warning-especially-lgbtq-visitors,MC_Transparent
worldnews,1jvsg2a,Nato warned over internet blackouts in wake of subsea cable attacks,,13334,0.97,407,2025-04-10 07:49:47,https://www.telegraph.co.uk/business/2025/04/10/nato-warned-over-internet-blackouts-in-wake-of-subsea-cable/,TheTelegraph
worldnews,1jvzxzz,Britain backs Nuremberg-style trials of Russia despite Trump opposition,,13335,0.98,308,2025-04-10 14:57:02,https://www.telegraph.co.uk/politics/2025/04/10/britain-backs-nuremberg-style-russia-trial-trump-opposition/,TheTelegraph
worldnews,1jloenb,Donald Trump pushes for near-total control of Ukraine’s minerals and energy in huge increase on earlier demands,,13265,0.95,1587,2025-03-28 06:00:27,https://www.lbc.co.uk/world-news/donald-trump-control-ukraine-critical-minerals-energy/,Aks_2497
worldnews,1k0v3d6,"Nearly 900,000 fewer people went to the U.S. from Canada in March as cross-border travel plummets",,12967,0.97,969,2025-04-16 20:50:23,https://www.cbc.ca/news/politics/cross-border-trips-us-900-thousand-1.7511090,BreakfastTop6899
worldnews,1k4c882,Kremlin satisfied with US statements that Ukraine will not join NATO,,12964,0.94,837,2025-04-21 12:25:11,https://www.pravda.com.ua/eng/news/2025/04/21/7508502/,Creol6969
worldnews,1jo3lcf,Sweden announces more Ukraine military aid worth $1.6 billion (biggest one yet),,12896,0.99,178,2025-03-31 13:47:37,https://www.reuters.com/world/europe/sweden-announces-new-military-aid-package-worth-16-bln-ukraine-2025-03-31/,Sufficient_Arm_4681
worldnews,1jvakio,China orders its banks to reduce US dollar purchases.,,12842,0.98,361,2025-04-09 16:50:35,https://www.reuters.com/world/china/chinas-central-bank-asks-state-lenders-reduce-dollar-purchases-sources-say-2025-04-09/,Aakash7aak
worldnews,1jj2his,Putin gifted a portrait of Trump to the U.S. president,,12761,0.96,1029,2025-03-24 21:27:40,https://www.ctvnews.ca/world/article/putin-gifted-a-portrait-of-trump-to-the-us-president/?taid=67e1abe8142e3e00010ce40a&utm_campaign=trueAnthem%3A+Trending+Content&utm_medium=trueAnthem&utm_source=twitter,Which-Dot4244
worldnews,1jlxa5h,Putin threatens Arctic war ahead of US VP Vance's visit to Greenland,,12743,0.96,1322,2025-03-28 15:09:12,https://www.dailymail.co.uk/news/article-14544213/Putin-threatens-Arctic-WAR-says-United-States-taking-Greenland-NATO-seen-possible-foothold-long-time.html,IcyElk42
worldnews,1jrsdyh,"Video Shows Aid Workers Killed in Gaza Under Gunfire Barrage, With Ambulance Lights On",,12621,0.9,744,2025-04-05 01:39:52,https://www.nytimes.com/2025/04/04/world/middleeast/gaza-israel-aid-workers-deaths-video.html?smid=tw-share,keezmaster
worldnews,1jp9807,"Leaders of Canada, Mexico discuss plan to fight trade actions by US",,12471,0.98,390,2025-04-01 22:45:55,https://www.reuters.com/world/americas/leaders-canada-mexico-discuss-plan-fight-trade-actions-by-us-2025-04-01/,RiverCartwright
worldnews,1k3y6as,El Salvador proposes sending US-deported Venezuelans to Venezuela,,12455,0.97,512,2025-04-20 22:23:58,https://www.reuters.com/world/americas/el-salvador-proposes-sending-us-deported-venezuelans-venezuela-2025-04-20/,hawlc
worldnews,1js2abn,China says 'market has spoken' after Trump tariffs spark global stocks rout,,12266,0.98,363,2025-04-05 12:25:45,https://www.cnbc.com/2025/04/05/china-says-market-has-spoken-after-trump-tariffs-spark-stocks-rout.html,Logical_Welder3467
worldnews,1jrsng6,Canada updates travel advice to warn of U.S. border officers' power to search electronic devices,,12133,0.97,515,2025-04-05 01:54:28,https://www.cbc.ca/news/canada/canada-us-border-phone-search-1.7502829,Historical_Bottle557
worldnews,1jjp4ak,Ukraine has handed over a list of objects that cannot be struck - Zelensky,,12134,0.98,353,2025-03-25 17:34:29,https://unn.ua/en/news/ukraine-has-handed-over-a-list-of-objects-that-cannot-be-struck-zelensky,EsperaDeus
worldnews,1jt82uc,US warns EU against excluding American companies from € 150 billion defense initiative which can supply Ukraine with weapons,,12075,0.94,2229,2025-04-06 23:57:32,https://euromaidanpress.com/2025/04/06/us-warns-eu-against-excluding-american-companies-from-e-150-billion-defense-initiative-which-can-supply-ukraine-with-weapons/,eaglemaxie
worldnews,1jmw2yw,Protests hit Tesla dealerships across the world in challenge to Elon Musk,,11857,0.97,279,2025-03-29 20:58:11,https://www.theguardian.com/world/2025/mar/29/tesla-protests-elon-musk-doge,jackytheblade
worldnews,1jx063a,'We never negotiate at gunpoint': India after Donald Trump hits 90-day pause on tariffs,,11478,0.98,259,2025-04-11 20:46:07,https://timesofindia.indiatimes.com/india/we-never-negotiate-at-gunpoint-india-after-donald-trump-hits-90-day-pause-on-tariffs/articleshow/120206018.cms,lerkstar
worldnews,1jyuayw,"Japan rules out big Trump concessions, must understand ""emotional"" views",,11460,0.98,357,2025-04-14 08:59:17,https://www.newsweek.com/japan-trump-tariffs-trade-concessions-emotional-2059341,newsweek
worldnews,1jkf2ca,EU says 'unconditional withdrawal' of Russia from Ukraine is a precondition to amend sanctions,,11438,0.99,157,2025-03-26 15:53:29,https://www.yahoo.com/news/eu-says-unconditional-withdrawal-russia-121445409.html,HydrolicKrane
worldnews,1jl9dnm,Putin Says US Plan To Take Over Greenland 'Serious',,11321,0.95,1743,2025-03-27 17:24:30,https://www.barrons.com/news/putin-says-us-plan-to-take-over-greenland-serious-c5499a73,Puginator
worldnews,1jk8q5g,Japan high court rules same-sex marriage ban unconstitutional,,11299,0.98,100,2025-03-26 10:37:07,https://www.straitstimes.com/asia/east-asia/japan-high-court-rules-same-sex-marriage-ban-unconstitutional,Ofajus
worldnews,1jlthxs,Sweden unveils historical military rearmament plan,,11248,0.99,613,2025-03-28 12:06:06,https://www.thebarentsobserver.com/security/sweden-unveils-historical-military-rearmament-plan/427418,TheArcticBeyond
worldnews,1jx04tc,"Trump demands Russia ""get moving"" to end war in Ukraine",,10836,0.96,1100,2025-04-11 20:44:32,https://www.pravda.com.ua/eng/news/2025/04/11/7507180/,Creol6969
worldnews,1jxr0e2,UK takes control of British Steel under emergency powers,,10771,0.98,892,2025-04-12 20:47:38,https://www.bbc.co.uk/news/articles/ckg17g39x41o,Norn-Iron
worldnews,1jxje5o,Reuters: Chinese military officers have been present behind Russian lines with Beijing’s approval,,10748,0.96,394,2025-04-12 15:07:49,https://kyivindependent.com/reuters-chinese-military-officers-have-been-present-behind-russian-lines-with-beijings-approval/,splagy
worldnews,1k0yeph,Astronomers Detect a Signature of Life on a Distant Planet,,10705,0.95,917,2025-04-16 23:16:25,https://www.nytimes.com/2025/04/16/science/astronomy-exoplanets-habitable-k218b.html,tiff_seattle
worldnews,1jrypkn,"Russian Markets Reel from Trump Tariffs, Oil Price Collapse",,10655,0.97,667,2025-04-05 08:17:15,https://www.themoscowtimes.com/2025/04/05/russian-markets-reel-from-trump-tariffs-oil-price-collapse-a88618,Silly-avocatoe
worldnews,1jstwr0,"‘We will win,’ Carney says of Trump’s trade war with Canada",,10315,0.95,644,2025-04-06 13:17:40,https://www.ctvnews.ca/federal-election-2025/article/carney-outlines-liberal-plan-to-boost-skilled-trades-workforce-increase-mobility/,Hyhopes
worldnews,1jk4ssq,"Russia has ‘seized the upper hand’ in Ukraine war, intel community warns",,10317,0.93,1058,2025-03-26 05:41:43,https://www.politico.com/news/2025/03/25/russia-has-seized-the-upper-hand-in-ukraine-war-intel-community-warns-00247753,pacman2081
worldnews,1k234zo,‘This is a murder’ – Zelensky rebukes Trump for calling deadly Sumy strike a mistake,,10274,0.98,120,2025-04-18 11:57:03,https://kyivindependent.com/this-is-a-murder-zelensky-rebukes-trump-for-calling-deadly-sumy-strike-a-mistake/,AdSpecialist6598
worldnews,1k4rct4,Carney urges Canadian doctors in the U.S. to come home,,10303,0.95,914,2025-04-21 23:02:26,https://nowtoronto.com/news/carney-urges-canadian-doctors-in-the-u-s-to-come-home/,Old_General_6741
worldnews,1k00ugd,"Avoid U.S. or take burner devices, Canadian executives tell staff",,10136,0.98,263,2025-04-15 19:32:38,https://www.bnnbloomberg.ca/business/politics/2025/04/15/avoid-us-or-take-burner-devices-canadian-executives-tell-staff/,dtta8
worldnews,1jzr13o,EU to ban Serbia if president joins Putin’s victory parade,,10110,0.97,521,2025-04-15 12:47:34,https://www.telegraph.co.uk/world-news/2025/04/15/eu-ban-serbia-if-president-joins-putin-victory-parade/,TheTelegraph
worldnews,1jivbez,‘I was defending the dignity of Ukraine’: Zelenskyy addresses bust-up with Trump and Vance,,10082,0.98,241,2025-03-24 16:46:32,https://www.politico.eu/article/ukraine-russia-us-donald-trump-volodymyr-zelenskyy-white-house/,Beo1217
worldnews,1jq72mx,"China urges U.S. to 'immediately' cancel reciprocal tariffs, vows counter-measures",,10073,0.98,743,2025-04-03 02:33:09,https://www.cnbc.com/2025/04/03/china-pledges-countermeasures-against-sweeping-us-tariffs-donald-trump.html,Puginator
worldnews,1jm94on,"Canadians pull back on U.S. trips, threatening to widen United States' $50 billion travel deficit",,10064,0.98,694,2025-03-28 23:43:49,https://www.cnbc.com/2025/03/28/canada-united-states-travel.html,Force_Hammer
worldnews,1jpv3zp,U.S. Lifts Sanctions on Wife of Russian Billionaire and close Putin friend Rotenberg,,10031,0.97,256,2025-04-02 17:55:36,https://www.themoscowtimes.com/2025/04/02/us-lifts-sanctions-on-wife-of-russian-billionaire-rotenberg-a88587,madbutcher
worldnews,1k5eejd,US Treasury secretary says trade war with China is not 'sustainable',,12908,0.97,579,2025-04-22 18:57:53,https://apnews.com/article/tariffs-trade-taxes-trump-china-bessent-treasury-66668fa26957ece530a250fa8ea19faa,Aggravating_Money992
worldnews,1jjq2hz,UK spies fears intelligence leaks after Trump team blunder: UK intelligence sources say higher restrictions are now likely to be placed on intelligence material sent to US counterparts as a growing distrust clouds the 'special relationship',,9863,0.99,328,2025-03-25 18:12:59,https://inews.co.uk/news/uk-spies-intelligence-leaks-trump-blunder-3604544,OkayButFoRealz
worldnews,1jog97d,"The time has come to punish Orbán, Germany’s next government says",,9865,0.98,149,2025-03-31 22:34:19,https://www.politico.eu/article/germany-next-coalition-vows-punish-hungary-viktor-orban-friedrich-merz/,PrestigiousZombie726
worldnews,1jqm406,"Canada to impose 25% tariffs on US autos that are non-compliant with USMCA, says Carney",,9821,0.98,262,2025-04-03 15:54:56,https://www.reuters.com/world/americas/canada-impose-25-tariffs-us-autos-that-are-non-compliant-with-usmca-says-carney-2025-04-03/,mvanigan
worldnews,1ju9u5f,South Korea fires warning shots after North Korean soldiers cross border,,9803,0.99,128,2025-04-08 09:57:25,https://www.newsweek.com/south-korea-fires-warning-shots-after-north-korean-soldiers-cross-border-2056710,newsweek
worldnews,1k1lkcm,Ukraine has evidence of China supplying Russia with weapons: Zelensky,,9728,0.97,323,2025-04-17 19:34:09,https://www.scmp.com/news/world/russia-central-asia/article/3306986/ukraine-has-evidence-china-supplying-russia-weapons-zelensky-says,ThatTallLankyGuy
worldnews,1jkbaiq,NATO leader warns Russia to expect a 'devastating' reaction if it ever attacks Poland,,9626,0.98,409,2025-03-26 13:04:46,https://apnews.com/article/poland-nato-rutte-russia-ukraine-49fa0ce0763926f3c57f6783457ec0e6,DomesticErrorist22
worldnews,1jpzhw4,European Tourists Start Avoiding US as ‘Unknown Territory’,,9614,0.98,428,2025-04-02 20:51:40,https://www.bloomberg.com/news/articles/2025-04-01/european-tourists-start-avoiding-the-us-as-unknown-territory?leadSource=reddit_wall,Old_General_6741
worldnews,1jlewmq,King Charles hospitalised after experiencing side effects from cancer treatment.,,9550,0.97,246,2025-03-27 21:54:09,https://www.hindustantimes.com/world-news/king-charles-hospitalized-after-experiencing-side-effects-from-cancer-treatment-cancels-engagements-101743110510328.html,PrestigiousZombie726
worldnews,1k0fk5v,Putin building infrastructure to station troops along Finland border,,9474,0.98,639,2025-04-16 08:38:33,https://www.dailymail.co.uk/news/article-14614745/Russia-building-new-infrastructure-station-troops-border-Finland-deliberately-testing-NATO-alliance-trigger-Article-5-army-chief-warns.html,jackytheblade
worldnews,1jqo2ji,Macron calls on EU companies to freeze investments in US,,9423,0.99,200,2025-04-03 17:10:03,https://www.politico.eu/article/macron-eu-companies-should-freeze-investment-in-the-u-s-until-trump-calms-down/,Beo1217
worldnews,1jjfllw,Canadian intelligence reports India backed Poilievre’s Conservative leadership bid,,9408,0.96,578,2025-03-25 09:44:37,https://www.theglobeandmail.com/politics/article-india-alleged-foreign-interference-pierre-poilievre-conservative/,milkplantation
worldnews,1jr8kig,"Russia ignores ceasefire agreement for 22 days, showing no will for peace – UK at OSCE",,9287,0.98,162,2025-04-04 10:23:10,https://www.pravda.com.ua/eng/news/2025/04/4/7505956/,Creol6969
worldnews,1jszax9,British Comic Creator R.E. Burke Banned From Visiting USA For 10 Years,,9221,0.96,682,2025-04-06 17:21:45,https://bleedingcool.com/comics/british-comic-creator-r-e-burke-banned-from-visiting-usa-for-10-years/,jrl_iblogalot
worldnews,1jo5l3s,"Netherlands pledges over $2 billion for Ukraine in 2025, including $540 million for drones",,9210,0.99,71,2025-03-31 15:15:05,https://kyivindependent.com/netherlands-pledges-2-billion-for-ukraine/,N/A
worldnews,1jyepqe,China Halts Critical Rare Earth Exports as Trade War Intensifies,,9164,0.98,356,2025-04-13 18:41:03,https://www.nytimes.com/2025/04/13/business/china-rare-earths-exports.html?smid=nytcore-ios-share&referringSource=articleShare,snowcow
worldnews,1jtghqb,China Just Turned Off U.S. Supplies Of Minerals Critical For Defense & Cleantech - CleanTechnica,,9052,0.98,294,2025-04-07 08:36:59,https://cleantechnica.com/2025/04/05/china-just-turned-off-u-s-supplies-of-minerals-critical-for-defense-cleantech/,broken-ego
worldnews,1jqif6o,Euro jumps over 2% against dollar after hefty US tariffs announced,,8970,0.99,279,2025-04-03 13:27:07,https://www.reuters.com/markets/currencies/dollar-slides-traders-rush-into-safe-havens-after-us-tariffs-2025-04-03/,elliothahah
worldnews,1jmbkoa,Ukraine won’t accept retroactive debt for Biden-era US aid — Zelenskyy,,8844,0.99,195,2025-03-29 01:46:27,https://english.nv.ua/nation/ukraine-won-t-accept-retroactive-debt-for-biden-era-us-aid-zelenskyy-50501857.html,TheRealMykola
worldnews,1joafbk,"China, Japan, South Korea will jointly respond to US tariffs, Chinese state media says",,8765,0.98,380,2025-03-31 18:33:26,https://www.reuters.com/world/china-japan-south-korea-will-jointly-respond-us-tariffs-chinese-state-media-says-2025-03-31/,professorbrainiac
worldnews,1jux0tr,"Trump’s massive ‘reciprocal’ tariffs are now in place, upending global trade",,8761,0.97,897,2025-04-09 04:03:51,https://www.cnn.com/2025/04/09/business/recession-effects-trump-reciprocal-tariffs-hnk-intl?cid=ios_app,N/A
worldnews,1jx6kq2,Australian beef demand surges as US trade with China grinds to a halt,,8714,0.98,544,2025-04-12 01:59:01,https://www.abc.net.au/news/2025-04-12/us-tariffs-war-with-china-australian-beef-exports-up/105166632?utm_source=abc_news_app&utm_medium=content_shared&utm_campaign=abc_news_app&utm_content=other,StopTheGregSign
worldnews,1jla9l8,"'Should be reaction from US' — Russian attack on Kherson breaks energy ceasefire terms, Zelensky says",,8680,0.99,179,2025-03-27 18:01:38,https://kyivindependent.com/russian-attack-on-energy/,petty_brief
worldnews,1jo5m8r,Marine Le Pen’s allies in Russia and Hungary lash out at guilty verdict,,8655,0.97,428,2025-03-31 15:16:28,https://www.politico.eu/article/marine-le-pen-allies-russia-hungary-lash-out-guilty-verdict/,PrestigiousZombie726
worldnews,1jp8nrq,Mexico bans junk food sales in schools in an attempt to reduce child obesity,,8621,0.99,162,2025-04-01 22:21:17,https://www.eleconomista.com.mx/politica/entra-vigor-prohibicion-venta-comida-chatarra-escuelas-20250328-752553.html,DatWiseGuuy
worldnews,1jjp96s,Hundreds of Gazans march in rare anti-Hamas protest,,8623,0.95,552,2025-03-25 17:40:14,https://www.jpost.com/middle-east/article-847577,barsik_
worldnews,1jmps14,Verified Russian Deaths in Ukraine War Exceed 100K,,8440,0.98,423,2025-03-29 16:14:24,https://www.themoscowtimes.com/2025/03/28/verified-russian-deaths-in-ukraine-war-exceed-100k-a88529,Booksnart124
worldnews,1jx74yh,Canadians required to register with U.S. government if in country at least 30 days,,8436,0.96,744,2025-04-12 02:30:25,https://www.cbc.ca/news/world/us-visitor-registration-requirement-1.7507764,wizardofthefuture
worldnews,1jv4ib8,Goldman Sachs warns that oil could crash under $40 in an 'extreme' scenario,,8416,0.98,660,2025-04-09 12:25:48,https://www.businessinsider.com/oil-price-crash-outlook-forecast-goldman-sachs-trump-tariffs-opec-2025-4,panzerfan
worldnews,1k236xf,Trump no longer expected to visit Scotland to meet King,,8276,0.95,419,2025-04-18 12:00:04,https://www.heraldscotland.com/news/25100140.trump-no-longer-expected-visit-scotland-meet-king-charles/,mrjohnnymac18
worldnews,1jy3ugf,Russia missile strike kills more than 20 civilians in Ukraine's Sumy,,8224,0.97,209,2025-04-13 09:28:51,https://newsukraine.rbc.ua/news/russia-strikes-sumy-on-palm-sunday-amid-ballistic-1744531582.html,Tish1n
worldnews,1jptwzh,Israel announces intention to seize large areas of Gaza Strip in major escalation,,8223,0.94,1009,2025-04-02 17:09:46,https://www.theguardian.com/world/2025/apr/02/israel-announces-intention-seize-large-areas-gaza-strip,Ecstatic-Medium-6320
worldnews,1jqm3zc,Taiwan calls Trump's 32% tariff 'deeply unreasonable',,8169,0.99,280,2025-04-03 15:54:54,https://focustaiwan.tw/politics/202504030008,Saltedline
worldnews,1jvfa2o,"Receiving a universal basic income makes people happier without causing a drop in employment, according to the results of a long-term study presented in Berlin on Wednesday.",,8073,0.96,455,2025-04-09 20:02:01,https://today.rtl.lu/news/business-and-tech/a/2292950.html,green_flash
worldnews,1jurx7n,Mexico warns against potential U.S. drone strikes on cartels,,7854,0.97,1116,2025-04-08 23:36:02,https://www.latimes.com/world-nation/story/2025-04-08/mexico-warns-against-potential-u-s-drone-strikes-on-cartels,Logical_Welder3467
worldnews,1jizozu,Russia arrests priest for decade-old photo showing him with Ukrainian flag,,7822,0.98,150,2025-03-24 19:37:42,https://tvpworld.com/85778664/russia-arrests-priest-for-decade-old-photo-showing-him-with-ukrainian-flag,KrzyHooy
worldnews,1jshj4v,US revokes all South Sudan visas over failure to repatriate citizens,,7712,0.97,428,2025-04-06 00:12:37,https://www.reuters.com/world/us-revokes-all-south-sudan-visas-over-failure-accept-repatriation-citizens-2025-04-05/,Logical_Welder3467
worldnews,1jl6ifd,"Denmark To Draft Women Into the Military Amid Greenland, Russia Tensions",,7675,0.98,384,2025-03-27 15:24:57,https://www.newsweek.com/denmark-draft-women-military-amid-greenland-russia-tensions-2051366,sweatycat
worldnews,1jnjrb3,Trump threatens to bomb Iran if nuclear deal can’t be reached,,7676,0.96,1051,2025-03-30 19:01:29,https://www.politico.com/news/2025/03/30/trump-threatens-bomb-iran-00259786,doopityWoop22
