subreddit,post_id,title,content,score,upvote_ratio,num_comments,created_at,url,author
VietNam,1jwszcc,"AirBnb Experience in Vietnam, Customer Support accused me of breaking their non-discriminatory policy, and suspended my account after dealing with a scam host","Our host in Nha Trang Vietnam asked for additional cash payments for the monthly property maintenance fees, garbage removal, security, internet service, water, and electricity. We booked her apartment more than a month in advance, and she had many weeks to inform us but chose not to.

We refused, and if we canceled, the payment for the booking was non-refundable. #AirBnb supported us in not having to pay any extra fees, as this was a scam, and it was against/broke their policy.

When the host did not get her scam payments \[btw she stopped by the apartment many times with different people demanding cash payments throughout our stay which made it very hard to relax there\] she wrote some disgusting statements about myself and my family in a message, and in retaliation, I replied with a F++K you scamming B++ch \[I was upset reading her insults and after dealing with her behavior\].

My account was then suspended, and I was sent an email from AirBnb customer support, a statement to inform me of this, along with scathing feedback posted about us on AirBnb by the scammer host regarding our character and us in a very personal targeted way.

How is it possible to have this public posted feedback out us by a host that was unsuccessful in scamming their guest even allowed to be there?

Forget letting future guests know about a bad experience, best to keep it to yourself, and forget using AirBNB at all. Too many better more protected, ethical options available.

Is this a regular experience for others using AirBnb in Vietnam? Do my fellow Reddit peeps have any good things to say about AirBnb customer protection for the guest? or only for the hosts? 

Much appreciated. ",16,0.74,51,2025-04-11 15:43:34,https://www.reddit.com/r/VietNam/comments/1jwszcc/airbnb_experience_in_vietnam_customer_support/,Collector72
VietNam,1jv5v9d,I wrote every street and road name in Hanoi as far as I could find (Urban districts only),"This took about 2 months, including memorizing my local area, interrogating all my classmates, searching on the web and more. Nonetheless, I present my proudest work yet. If you have any questions, suggestions and/or corrections, feel free to tell them! I'm going to remake this and make an errorless version some time soon.

https://preview.redd.it/bbdcy0cfatte1.jpg?width=3024&format=pjpg&auto=webp&s=025f9b0d4eb553a868251700ff71c6d7dddcf55a

https://preview.redd.it/yb3185cfatte1.jpg?width=3024&format=pjpg&auto=webp&s=5e173d57cd513fc1195cf814cef78a13d9c41f05

https://preview.redd.it/cfsaszbfatte1.jpg?width=3024&format=pjpg&auto=webp&s=f222434a93fabd9989c0629f2961150fd959626c

https://preview.redd.it/q46mf5cfatte1.jpg?width=3024&format=pjpg&auto=webp&s=56411e10cb73603a8bb2a9a2ab390ad9904c640b

https://preview.redd.it/nz9u00cfatte1.jpg?width=3024&format=pjpg&auto=webp&s=4b8299d82e6de98efa271f49a8c8d5be8f58fa8d

https://preview.redd.it/q0666zbfatte1.jpg?width=3024&format=pjpg&auto=webp&s=6a6df4afdc1bc0e26cd91ec59ffff62b106ced68

https://preview.redd.it/vp5895cfatte1.jpg?width=3024&format=pjpg&auto=webp&s=506b2372f481b080858d29a96861cfc0f055e1b6

https://preview.redd.it/sdxud1cfatte1.jpg?width=3024&format=pjpg&auto=webp&s=c4c083e1a1b7f1a5917a3c1fc1e09b398f516680

https://preview.redd.it/an7lu8cfatte1.jpg?width=3024&format=pjpg&auto=webp&s=54ca3726b88206f7180dabb49d5dfaa554fdb21c

https://preview.redd.it/el3obpefatte1.jpg?width=3024&format=pjpg&auto=webp&s=a3f42b96b51ab7e449ac330fbe20a6b91cfc17e7

https://preview.redd.it/sldqzzbfatte1.jpg?width=3024&format=pjpg&auto=webp&s=80de0bc3a6700e1c6d8d3ee35c1966592c078a06

https://preview.redd.it/ofi8joefatte1.jpg?width=3024&format=pjpg&auto=webp&s=5351edc6a80115e2da3d20c50d9e3a398045ff91

",17,0.95,7,2025-04-09 13:32:06,https://www.reddit.com/r/VietNam/comments/1jv5v9d/i_wrote_every_street_and_road_name_in_hanoi_as/,Imarobloxuser
VietNam,1ju6wvf,Ngô Quyền: The General Who Ended a Millennium of Domination,"“Ngô Quyền (898 - 944) là một vị tướng. Năm 938 ông cầm quân đánh tan quân xâm lược Nam Hán tại sông Bạch Đằng, kết thúc 1000 năm Bắc thuộc Việt Nam. Năm 939 xưng vương là Ngô Vương.”

Ngô Quyền (898–944) pulled off one of the most legendary military upsets in Vietnamese history. In 938, he lured the Southern Han fleet into the Bach Dang River and annihilated them using hidden wooden stakes—ending 1,000 years of Chinese rule. A year later, he crowned himself king, kicking off a new chapter of Vietnamese self-rule.

—
""Where does Ngô Quyền rank among the greatest military tacticians in Asian history?""",16,0.81,1,2025-04-08 06:18:32,https://i.redd.it/sp5yebi90kte1.jpeg,signsofheroes
VietNam,1jrbz13,The Vast Majority of Vietnamese Timber Products Sidestep Trump’s Tariffs — For Now,"The vast majority of timber products – including rough and surfaced lumber, plywood, MDF and other wood-based panels – will be exempt from Donald Trump’s ‘liberation tariffs’ introduced yesterday. However, these products – along with automobiles, pharmaceutical goods and semiconductors – will be subject to a national security investigation, with findings provided to Donald Trump within weeks.",15,0.95,1,2025-04-04 13:32:24,https://woodcentral.com.au/the-vast-majority-of-timber-products-sidestep-trumps-tariffs-for-now/,ChangeNarrow5633
VietNam,1jqxmr4,If you couldn’t visit the “big six” – where would you go instead?,"Hey all! Planning a trip to Vietnam 🇻🇳 and we’ve already done (or have to skip) the big hitters: HCMC, Da Nang, Hoi An, Ha Long Bay, Hanoi, and the Ha Giang Loop.

Curious to hear – if you were planning a return trip and had to avoid those popular spots, what lesser-known or underrated place would be top of your list? Looking for beautiful nature, culture, or just a chill vibe. Thanks!",16,0.86,48,2025-04-03 23:29:39,https://www.reddit.com/r/VietNam/comments/1jqxmr4/if_you_couldnt_visit_the_big_six_where_would_you/,ZTemp
VietNam,1k31ko1,Anyone from India traveling to Vietnam soon? Need a small favor!,"Hi everyone,

My family and I recently visited Vietnam and completely fell in love with Trung Nguyen Sang Tao (Creative) coffee — especially the Sang Tao 1 variant. Unfortunately, we didn’t buy enough packets to bring back, and now we’re seriously missing that amazing flavor!

If anyone from India is planning a trip to Vietnam and wouldn’t mind bringing back a few packs (they’re lightweight and easy to carry), we’d be so grateful! We’ll, of course, cover the cost of the coffee and any additional charges (or even send payment in advance via UPI or any method that works for you).

Please DM me if you’re willing to help out. Thank you so much in advance!",16,0.83,8,2025-04-19 17:29:11,https://i.redd.it/4nrc4blustve1.jpeg,Airecho123
VietNam,1k2pfom,Trip to Long Hai,"Recent peaceful trip to Long Hai. Stayed at the Fluer De Lys. Their pool is being renovated, but great place to stay. They allow you to access another pool, plus you have the whole beach. Like every place, there’s good things and bad things, but mostly good though to say. The whole trip with a private driver to take me to and from Saigon was below $500, this total includes food and three night stay. We ordered room service a few times as well. Went to a vegetarian restaurant down the street. We also had two hours of spa service. The room we stayed in had the private balcony. We had a private patio with an okay jacuzzi. Was not Hawaii, but also did not pay  Hawaii prices. Would do it again. Great peaceful spot with beach access. A nice place to get away from the city for a few days. I used the stay for writing and taking photos, as it was quiet. Awesome for relaxing. ",15,0.84,9,2025-04-19 05:53:12,https://www.reddit.com/gallery/1k2pfom,chubrock420
VietNam,1k1t2kt,"Heads up, the YouTube channel for the singer behind 2 Phut Hon has been compromised",,13,0.69,4,2025-04-18 01:21:48,https://i.redd.it/haxhh3mfwhve1.jpeg,ahrienby
VietNam,1k0ho6t,Luggage didn't pass through security check,"So I and my wife flew from Hanoi to Danang via Veitjet airways. 

Upon arrival my wife's luggage didn't come. We checked in the lost and found area and they mentioned it didn't pass through some security check. So they asked us to fill a form to authorize them to remove the item and send it either tomorrow or tonight. So no worries. 

But I'm just curious, we checked in like 3h before the flight time and they had plenty of time to let us know in Hanoi itself if the security check was not successful fortheb luggage. We could have removed the offending item and resolved the issue right there. 

Just wondering if this is how it goes? Or is the airline supposed to inform us at Hanoi itself. ",15,0.83,41,2025-04-16 11:04:09,https://www.reddit.com/r/VietNam/comments/1k0ho6t/luggage_didnt_pass_through_security_check/,coltainesCrows
VietNam,1jvwqgu,"Nguoi Viet Nam, could I get some feedback on my pronunciation?","I'm building a YouTube channel for English learning resources. But to make it interesting, I'm also gonna be posting some behind-the-scenes stuff related to my own language journey. Shorts mostly. 

[https://www.youtube.com/shorts/FMcDiL5N4jU](https://www.youtube.com/shorts/FMcDiL5N4jU)

So this is me trying to speak Vietnamese. If you've got a minute, could you give me some feedback and advice? It would be super helpful. 

Thanks a million! ",15,0.94,43,2025-04-10 12:31:30,https://www.reddit.com/r/VietNam/comments/1jvwqgu/nguoi_viet_nam_could_i_get_some_feedback_on_my/,SBCopywriter
VietNam,1jsot4j,Does anybody in Hanoi receive this China propaganda newspaper?,"Im working at a hotel in the Old Quarter, morning shift said a person just gave it to him randomly, i scanned quickly and it is full of China propaganda. How can this happen in the middle of the capital?",14,0.62,46,2025-04-06 07:39:06,https://i.redd.it/m3jstw8t46te1.jpeg,Key_Profession_9170
VietNam,1jon8g8,the moving company is asking double the price.,"i am moving today and i hired a vietnamese company for relocation, we agreed on the price to 4.3million. it isbquite short distance in same district. but after packing up things into the truck, they are demanding me to pay double or they won't move. what should i do? ",14,0.9,40,2025-04-01 04:28:36,https://www.reddit.com/r/VietNam/comments/1jon8g8/the_moving_company_is_asking_double_the_price/,Deven1003
VietNam,1k4o0os,The level of vagueness in the news is insane,"This is something that has been bothering me a lot recently.

Remember the fake milk powder case? That news was covered a lot these days but have you noticed that NONE OF THE FAKE BRANDS were named? My mother was asking me if the milk she bought was indeed one of them? Of course, I couldn’t know because they did not say it publicly on TV. Why did they leave out such a vital piece of information.

This is not the only case. The other day, they broadcast news on unsafe food served on the street. They came to the storage, examined the original packages. And guess what, none of the packages were named, either. The location of the food stalls were not mentioned, either. 

Today, the news talked about the drugs/food that are not on the MOH’s list. Again, none was named. Then they talked about a pre-school facility that violently abused some kids. Guess what, that preschool was not named. How am I supposed to avoid and boycott it if I don’t even know its name? This should be the first information to show.

This level of vagueness is alarming. This is why school abuses and food poisoning have been going on undetected and unsolved for years. The news informed us but nothing is valuable to us. There was nothing named, we don’t know what and where to avoid anymore. There was nothing specific so we thought to ourselves “Oh, I guess we are safe, the problems are being suffered by someone else” and then ignored them entirely over time.",13,0.65,26,2025-04-21 20:39:39,https://www.reddit.com/r/VietNam/comments/1k4o0os/the_level_of_vagueness_in_the_news_is_insane/,brevity142
VietNam,1jrxap2,Vietnamese people in Texas,"Hi, if there are any Americans or Việt kiều here who have lived in Texas, could you tell me a little about the attitude towards Vietnamese people and ""asiatics"" in general there? 

My VN partner is going to work out there for a few months starting this summer, I just wondered what kind of attitudes she could expect.
",14,0.76,39,2025-04-05 06:36:31,https://www.reddit.com/r/VietNam/comments/1jrxap2/vietnamese_people_in_texas/,v00n
VietNam,1jrgkty,Is there something that you will buy from US? Can’t think of any,"Local sellers have cheaper clothes, shoes, groceries than anything imported from US.",14,0.71,97,2025-04-04 16:47:49,https://www.reddit.com/r/VietNam/comments/1jrgkty/is_there_something_that_you_will_buy_from_us_cant/,IamOkei
VietNam,1k5buyj,Im contempleting moving to Ha Noi from Saigon...smh,"Hi all. I have been living in Saigon for the past 3 years. I have enjoyed every single aspect of living in Vietnam except for 2 things, the weird exchanged happening at elevators where people enter the already full elevator before the people inside get out, and then ofcourse the constant heat battle in Ho Chi Minh City. 

I do not see myself as a picky person when it comes to conditions and overall experiences. I am quite laid back. I am, however, extremely impacted and negatively influenced by the heat that constantly consumes me here in the lovely Saigon. So much so, that I am seriously thinking about moving up to the North. 

I have heard that the summers there are brutal, which I am willing to suffer through if I know atleast I have a bit of winter around the corner. 

Am I the only person feeling this way? Is this a crazy reason to move? I would love to hear your take on it. 

I am in the position now where I need to go renew my passport in my country, my lease is up, and my current employment contract finishes right before I fly home. All of this is happening in July, which makes it even more tempting as that will be such a great time to move and try it out. 

I mean I guess if it doesnt work out I can always come back...",19,0.85,68,2025-04-22 17:17:19,https://www.reddit.com/r/VietNam/comments/1k5buyj/im_contempleting_moving_to_ha_noi_from_saigonsmh/,Majestic_Fig_796
VietNam,1k06kqk,Nguyễn Trãi: Vietnam’s National Hero and Cultural Icon,"“Nguyễn Trãi (1380 - 1442) hiệu Ức Trai, là anh hùng dân tộc Việt Nam, danh nhân văn hóa Thế giới. “Bình Ngô đại cáo” do ông viết, được xem là bản tuyên ngôn độc lập thứ hai của Việt Nam - đời vua Lê Thái Tổ.”

Direct English Translation:
“Nguyễn Trãi (1380–1442), known as Ức Trai, was a national hero and world cultural figure. His work “Bình Ngô Đại Cáo” is regarded as the second declaration of independence in Vietnam during the reign of King Lê Thái Tổ.”

—

Nguyễn Trãi, known by the pen name Ức Trai, was one of Vietnam’s most important historical figures. His role as a strategist during the Lam Sơn Uprising and his authorship of “Bình Ngô Đại Cáo,” considered Vietnam’s second declaration of independence, cemented his legacy as both a national hero and a cultural icon.

Nguyễn Trãi was more than a military leader. His works, including “Quân trung từ mệnh tập,” “Ức Trai thi tập,” and “Dư địa chí,” demonstrate a profound understanding of Vietnamese politics, culture, and geography. These writings reveal his vision of a just and independent Vietnam, blending Confucian, Buddhist, and Taoist philosophies to promote a humane and equitable society.

Despite his contributions, Nguyễn Trãi faced tragedy in the Lệ Chi Viên incident, where he was wrongfully accused of regicide, leading to his family’s execution. Years later, King Lê Thánh Tông posthumously exonerated him, recognizing his invaluable service to the nation.

Nguyễn Trãi’s influence endures not only through his literature and political philosophy but also as a symbol of patriotism, resilience, and intellect. His works and legacy remain a cornerstone of Vietnamese cultural and national identity.

—
“What other historical figures do you think deserve recognition as cultural icons in your country?”",12,0.84,1,2025-04-15 23:43:36,https://i.redd.it/l3s3vhe353ve1.jpeg,signsofheroes
VietNam,1jxx2wa,Is VietJet as bad as they say? Is Vietnam Airlines better?,"Ok I’m going from Hanoi to Hue, I actually thought Vietnam Airlines even in business class was well priced…but I happen to like the earlier times from VietJet better for my travel date. However, once researching then I read nightmares and stuff about them always being delayed especially domestically. Is this really true? Should I just stick to Vietnam airlines? Thanks babes <3 ",13,0.76,86,2025-04-13 01:59:33,https://www.reddit.com/r/VietNam/comments/1jxx2wa/is_vietjet_as_bad_as_they_say_is_vietnam_airlines/,Delicious_Novel_4400
VietNam,1jwvzud,Vietnamese OC,"Hello! I am a 15 year old girl from Finland. I’m also an artist, and currently creating a vietnamese character. I was thinking, are there some things I should take into consideration while creating this oc (original character)? Some physical or personality traits I should add?

So far this is what I have: he is around 20 years old, slightly brown, slanted eyes, medium (?) height, he has a girlfriend, his family has moved from Vietnam to somewhere in Europe but he is connected to his culture due to visits and family, he is alternative and enjoys rock music.

Are vietnamese people religious? What religion do most vietnamese people believe in? Any advice and help would be appreciated, I want to be respectful and connect my oc to his culture 🫶 I have no pictures/drawings of him yet, since he’s not ready. ",12,0.73,42,2025-04-11 17:49:20,https://www.reddit.com/r/VietNam/comments/1jwvzud/vietnamese_oc/,iippaah
VietNam,1jqmlvp,Could't try this place in my country... Why not here then 🙂,,13,0.78,9,2025-04-03 16:13:55,https://www.reddit.com/gallery/1jqmlvp,IllustriousTie657
VietNam,1jpe1ta,Lê Lợi: The Hero Who Drove Out the Ming,"“Lê Lợi (1385 - 1433), tức Lê Thái Tổ. Là người khởi xướng khởi nghĩa Lam Sơn, chiến thắng Quân Minh, trở thành vị vua đầu tiên của thời Hậu Lê.”

Lê Lợi (1385–1433) is one of Vietnam’s most celebrated national heroes. Leading the Lam Sơn uprising against the Ming occupation, he waged a decade-long resistance that ultimately reclaimed Vietnamese independence in 1428. As the first emperor of the Later Lê Dynasty, he implemented reforms that strengthened the nation and solidified its sovereignty. His leadership and determination remain legendary in Vietnamese history.

—
“What do you think was Lê Lợi’s most important contribution—his military victories or his reforms as emperor?”",13,0.82,1,2025-04-02 02:30:59,https://i.redd.it/5e0wa4w62cse1.jpeg,signsofheroes
VietNam,1jnpne3,Would this be allowed on roads in bigger cities?,"And if yes, under what classification and what kind of licensing? For info, its top speed can be limited to whatever is legal, but unlimited it can go 120km/h, 1.40m long, 63kg, max load 150kg. I might be moving in a few years, and since I absolutely need to take it with me (I'm deeply attached to it 😅) I need to know if it's allowed in cities or if I could get into trouble. (I ma not asking about dangers and such, so please only if it's allowed, if there are already some on the road etc)

Thanks a lot 😊",12,0.81,21,2025-03-30 23:25:45,https://i.redd.it/a8qtz2ghuwre1.jpeg,Eli_85_
VietNam,1k4a59d,Pope Francis has passed away. How do Vietnamese people view him?,"Pope Francis made some significant efforts to rebuild relationships and said that he wanted to visit Vietnam. How do Vietnamese, non-Catholics and Catholics, view him?",14,0.59,92,2025-04-21 10:21:48,https://www.reddit.com/r/VietNam/comments/1k4a59d/pope_francis_has_passed_away_how_do_vietnamese/,Separate-Ad-9633
VietNam,1k1w6vr,Paying fine upfront for Ha Giang Loop without correct license,"I’m travelling from Australia to North Vietnam to do the Ha Giang loop.

I have an international driving license and AU license but the tour companies are telling it’s still illegal to drive with those. I need a 1969IDO and Australia uses a 1949IDO.

So they suggest either I pay 2 million Vietnamese dong upfront and they will bribe the police for me and no further costs. Or I should use an easy rider.

What what I’ve read on forums usually the police accept a much lower bribe / fine. Around 20USD or 500k dong.

The tour company states the fines have increased  since 2025 up to 7-8 million. Does anyone have any recent experience? Is 2 million a reasonable amount or if the company make a nice profit here? Has anyone else just paid upfront to avoid fees?

Thank you.",12,0.7,91,2025-04-18 04:13:40,https://www.reddit.com/r/VietNam/comments/1k1w6vr/paying_fine_upfront_for_ha_giang_loop_without/,EstablishmentAgile33
VietNam,1k05olq,Off to Nam!,"Hi everyone!
Just wanted to pop in and say a big hello!
I’m super excited because… Vietnam, here I come!

I’ll be landing in Hanoi, heading off to an overnight cruise in Ha Long Bay on Syrena, soaking up some vibes in Da Nang, grabbing an evening in Hoi An, and wrapping it all up in Ho Chi Minh City.

Yes, it’s a packed itinerary—but hey, this beautiful country has so much to offer, I’m all in for making the most of it!",12,0.72,21,2025-04-15 23:01:09,https://www.reddit.com/r/VietNam/comments/1k05olq/off_to_nam/,Drbeautiful
VietNam,1jvn4aj,Is 4.5M VND enough?,"I am an international student and I am planning to apply for a scholarship at a university  in Ho Chi Min city, Vietnam. The scholarship provides 4.5M VND for living expenses. I am wondering how long I will last with 4.5 VND as a minimalist.",12,0.78,64,2025-04-10 02:12:02,https://www.reddit.com/r/VietNam/comments/1jvn4aj/is_45m_vnd_enough/,No_Neighborhood505
VietNam,1jv9kor,Is outdoors running in Hanoi harmful with how polluted the air is?,"I live in Hanoi and like to go running at the local park 2-3 times a week. But with how polluted the air seems to be now, is this bad for my health? I'd rather not get my cardio on a treadmill, is there any way to minimize the health risks running outside?",13,0.93,35,2025-04-09 16:09:48,https://www.reddit.com/r/VietNam/comments/1jv9kor/is_outdoors_running_in_hanoi_harmful_with_how/,safegermanywin
VietNam,1jtiqzp,What do locals think about the popularity of the Ha Giang Loop?,"I have just finished the Ha Giang Loop and I am in awe of all the beauty I was lucky enough to witness there. It felt like an out of body experience spending my days surrounded by immense greenery, amazing people while snaking down winding roads. We passed a lot of villages and smaller settlements where, naturally, there were Vietnamese people going on with their normal lives.
Now, what has the impact of the Ha Giang Loop been on these communities? With the hundreds of tourists passing every day, I would imagine the atmosphere of these areas changes dramatically, which could create some resentment. Considering the high number of locals employed as drivers, what has the economic impact of this been?",12,0.84,11,2025-04-07 11:15:12,https://www.reddit.com/r/VietNam/comments/1jtiqzp/what_do_locals_think_about_the_popularity_of_the/,MushofPixels
VietNam,1jt6d0k,A Kind Soul at Hoa Lu Festival: Our Nighttime Rescue by Quy Nguyen,"We were at the Hoa Lu Festival 2025 in Ninh Binh, and the day was filled with emotions, surrounded by thousands of people celebrating. That same afternoon, Quy Nguyen, who we met through Tam Coc Queen’s Travel, had brought us to our hotel, which was about 15 minutes from the city. Before leaving, he handed us his card with a warm smile—a small gesture that, at the time, seemed like nothing more than a kind formality. Little did we know how much it would mean later on.
By around 11 p.m., with the festival still in full swing, there wasn’t a single taxi available to take us back to the hotel. Running out of options, I decided to text Quy, even though I knew he was likely resting after a long day. To our surprise, he replied almost immediately and, without hesitation, came to pick us up. Seeing him arrive, with the same calm and kindness he’d shown earlier, brought us such a sense of relief. He drove us back to the hotel, charging only the regular fare, as if it were the most natural thing in the world.
That moment really touched us. On such a hectic day, coming across someone like Quy, who went out of his way to help with so much generosity and humanity, even late at night, was something truly special. It’s such a blessing that there are still people like him out there, who, with simple acts of kindness, remind us of the value of caring for others. We feel so lucky to have crossed paths with Quy, and this experience will always be one of the most beautiful memories from our trip.",11,0.93,1,2025-04-06 22:31:53,https://www.reddit.com/r/VietNam/comments/1jt6d0k/a_kind_soul_at_hoa_lu_festival_our_nighttime/,ricarv_PT
