subreddit,post_id,title,content,score,upvote_ratio,num_comments,created_at,url,author
VietNam,1k1jwfq,Poland vs Russia on Facebook: Who’s rewriting WWII history?,"

I came across a Facebook post where the Polish Embassy and Russian Embassy are going at it over WWII history. 

Link here if you’re curious:https://www.facebook.com/share/v/1Chzgz4obU/?mibextid=wwXIfr


(*) Poland claims the USSR helped Nazi Germany secretly rebuild its military after WWI—citing joint training centers for tanks and aircraft in Soviet cities like Kazan and Lipetsk, all starting with the 1922 Treaty of Rapallo. They say Russia now uses ""fighting Nazism"" to justify the war in Ukraine.


(*) Russia fired back, saying those programs ended in 1933, and that Poland actually signed a pact with Hitler in 1934—implying Poland was no less cooperative with Nazi Germany.


I’m no history expert, but a few things stood out:

- Poland’s post feels like they could do better in listing the facts and examples. From the museums and research I've read, there are more solid facts for them to prove their points. The one from this post seems a little bit weak.


- Most Vietnamese commenters sided with Russia and called Poland the traitor.


- A lot of arguments of Vietnamese people in comment section came from school textbooks, which feels a bit one-sided. History, especially war history, needs more than just one narrative.
-> That's is the reason for this question.


- I’ve talked to some European friends into history, and they said Russia’s been playing the aggressor card in the region for a long time—even pre-WWII.

-> It suggests that Russia has never been a reliable ally, and that’s why neighboring countries have always felt the need to band together—like joining NATO today—to protect themselves from its influence

=> So here’s my question to people who study history or just know their stuff:
- What’s your take on Russia and Poland’s roles before WWII?
- How were you taught this part of history—especially if you grew up in Vietnam or outside the West?

Genuinely curious how the narrative shifts depending on where you’re from. Again, I am not a history savvy, enlighten me with your knowledge.",2,0.55,37,2025-04-17 18:24:06,https://www.reddit.com/r/VietNam/comments/1k1jwfq/poland_vs_russia_on_facebook_whos_rewriting_wwii/,Significant-Pick4526
VietNam,1k1it1b,"Where can I find info about Banh Mi festival, what others are there food wise or fun festivals?","I saw a banh mi festival on youtube and another food one, an anime one.  Where can I find them?",2,0.75,2,2025-04-17 17:39:45,https://www.reddit.com/r/VietNam/comments/1k1it1b/where_can_i_find_info_about_banh_mi_festival_what/,moldyjellybean
VietNam,1k1gqly,Does anyone know if there is a shipping forwader service to mexico ?,"Hey, im trying to buy a magazine from a vietnam site but does not offer worldwide shipping international, is there a way or a service that can send me the magazine to my country which is mexico? thank you in advance",2,1.0,0,2025-04-17 16:15:19,https://www.reddit.com/r/VietNam/comments/1k1gqly/does_anyone_know_if_there_is_a_shipping_forwader/,mattatabi
VietNam,1k0zapg,Vionic shoe store in Vietnam,Traveling to Vietnam next month. Is there any vionic shoe store in HCMC or Hanoi? Thank you!,2,1.0,1,2025-04-16 23:59:35,https://www.reddit.com/r/VietNam/comments/1k0zapg/vionic_shoe_store_in_vietnam/,Independent_Being516
VietNam,1k0ppc9,Anyone know of any backgammon tournaments in Vietnam coming up ?,,1,0.57,0,2025-04-16 17:10:27,https://www.reddit.com/r/VietNam/comments/1k0ppc9/anyone_know_of_any_backgammon_tournaments_in/,Some-Introduction814
VietNam,1k0p6td,Nha Trang boutique hotel.,"Could anyone please recommend a small, quality boutique hotel in Nha Trang.

I am looking to spend a week there as a part of a trip and could do with a sound suggestion.

Thank you in advance ",2,0.67,1,2025-04-16 16:50:24,https://www.reddit.com/r/VietNam/comments/1k0p6td/nha_trang_boutique_hotel/,jondixo
VietNam,1k0gtmu,Lantern making class outside Hoi An?,"Had the best time in Hoi An and only thought to take a lantern making class right at the end of our trip, to which we unfortunately ran out of time and couldn’t make.

I was wondering if any other places are known for this type of tradition? I’ll be going to Ninh Binh, Sapa and Hanoi.

Thanks!",2,1.0,1,2025-04-16 10:09:23,https://www.reddit.com/r/VietNam/comments/1k0gtmu/lantern_making_class_outside_hoi_an/,hoaxcoast
VietNam,1jzykua,reddit doesnt work again??,i use FPT and even google dns yet i can't still access reddit,2,0.75,2,2025-04-15 18:01:19,https://www.reddit.com/r/VietNam/comments/1jzykua/reddit_doesnt_work_again/,No-Committee-6832
VietNam,1jznyry,GBP exchange,"Do the jewellery stores in Hanoi exchange £GBP for a better rate or should I stick to using monzo cash withdrawals? 

If so do they take £20s or only £50?

Thinking of taking £1000 in cash to exchange.
",2,1.0,4,2025-04-15 09:55:25,https://www.reddit.com/r/VietNam/comments/1jznyry/gbp_exchange/,Queasy-Shape-9333
VietNam,1jzbj2a,Looking for online Áo dài stores,"I'm looking for somewhere to buy an Áo dài online, specifically for a 3-4 year old boy but I'm having trouble find proper Vietnamese sellers.

My son is half Vietnamese, we have no contact with his father but I'd still like him to have something from Vietnam to connect him.

Any other suggestions for things I could buy for him would be appreciated too",2,1.0,4,2025-04-14 22:11:16,https://www.reddit.com/r/VietNam/comments/1jzbj2a/looking_for_online_áo_dài_stores/,PivikInuk
VietNam,1jz830e,Soy sauce recommendations?,"Can't see this anywhere else, what are some Vietnamese soy sauce recommendations? Currently using Kikkoman and wondering if using a Vietnamese one would taste better...

Thanks.",2,1.0,5,2025-04-14 19:46:48,https://www.reddit.com/r/VietNam/comments/1jz830e/soy_sauce_recommendations/,ronstig22
VietNam,1jz78e1,First time traveller to Vietnam,"Visiting Ho Chi Minh City and Hanoi for 9 days in the next month.
Do’s and Don’ts for a first time traveller to Vietnam.
Especially for trying out new foods and places.
Additionally, are there any health hazards I should be concerned with while travelling?",3,0.71,19,2025-04-14 19:12:15,https://www.reddit.com/r/VietNam/comments/1jz78e1/first_time_traveller_to_vietnam/,Arch_Nemesis99
VietNam,1jz2qq3,Tips on how to avoid offloaded?,"Good Day! I'm a student from Ph. Me and my foreign bf have been planning to travel to vietnam this upcoming May for a week but, he's the one sponsoring for this trip.Btw we're already living together under the same roof for almost 7 months. What are the requirements should I prepare aside from passport, ITR, Bank statement and return ticket? Any tips on what should I do? Or what are the usual questions ask by the immigration?",2,0.67,7,2025-04-14 16:11:45,https://www.reddit.com/r/VietNam/comments/1jz2qq3/tips_on_how_to_avoid_offloaded/,Every_Willingness_18
VietNam,1jz0zbc,Brands recommendations like giansaigon or Maverik Studios,Hey everyone! Just recently discovered local Vietnamese brands and would love some recommendations of brands similar to the ones I mentioned in the title. Thanks guys! ,2,1.0,0,2025-04-14 15:00:10,https://www.reddit.com/r/VietNam/comments/1jz0zbc/brands_recommendations_like_giansaigon_or_maverik/,SadGenguMain
VietNam,1jyqvct,Suggestions for an appropriate gift?,"Hi all! I’m currently in Huê, Vietnam, and decided to extend my stay after discovering an incredible acupuncture clinic that has made a world of difference in my shoulder pain. We communicate mostly through Google Translate, but everyone on the staff has been incredibly kind, gentle, and attentive. 

On my last day, I would love to give them a token of appreciation. I’m thinking a card, where I’ll write down my thanks (first translated!), but also something that would convey my thanks. Is there any appropriate or traditional gift that I can give them? Flowers, or sweets, or…? 

  
TIA :)",2,1.0,3,2025-04-14 04:52:45,https://www.reddit.com/r/VietNam/comments/1jyqvct/suggestions_for_an_appropriate_gift/,monicabyrne13
VietNam,1jyn9fz,Recommendations for Women’s Tailor in HCMC,"hi!! will be heading to HCMC late may/early june and wanted to get a few customised dresses/tops/skirts. does anyone have any recommendations for good quality tailors? 

am also interested in embellished/embroidered items and was wondering if anyone knows good tailors that can do that


thank you!! 🙏 ",2,1.0,1,2025-04-14 01:24:58,https://www.reddit.com/r/VietNam/comments/1jyn9fz/recommendations_for_womens_tailor_in_hcmc/,Longjumping_Self9497
VietNam,1jykdd6,Best resort for families Hoi An,"Hey all, looking at going to Hoi An in late January, wedding in Krabi then thinking of heading over to Vietnam as we have done Thailand 5+ times.   
Just looking for a great family resort in Hoi An, kids are 8 and 5, so ideally something with plenty of activities for them, being able to walk into town would be great but not necessary, biggest focus is for the kids to have tons of stuff to do.

Thanks in advance.",2,1.0,4,2025-04-13 22:54:25,https://www.reddit.com/r/VietNam/comments/1jykdd6/best_resort_for_families_hoi_an/,DrPoopyBreath
VietNam,1jyf1h3,Tips for Vacation,"Hello! My parents and I will be visiting for a trip in June (Hanoi>Halong>Da Nang>HCMC). It is a packed trip (only 10 days, sadly). 

I know June will be hot, but I'm hoping that since I'm coming from an equally hot and humid country it won't be so bad. 

I would love some suggestions on local places and things to do and some do nots. 
",2,1.0,6,2025-04-13 18:54:59,https://www.reddit.com/r/VietNam/comments/1jyf1h3/tips_for_vacation/,Embarrassed-Rest7110
VietNam,1jydx7p,Fast track service Hanoi and Saigon (HCMC),"Hi all! I'm traveling to Vietnam soon and had a couple of questions about the fast track services at the airports. 

**Arriving in Hanoi**

I booked fast track service through Klook for my arrival at Hanoi (Noi Bai) Airport. For anyone who’s used this before—should I expect to be contacted by the guide ahead of time? If so, how far in advance do they usually reach out?

**Domestic flights within Vietnam**

Flying from Hanoi to Da Nang then from Da Nang to HCMC throughout the middle of the trip. Are fast track services necessary? How early do you recommend we arrive at these airports ahead of boarding?

**Departing from HCMC**

I’ll be departing from Saigon (Tan Son Nhat Airport) on May 2nd, which falls right after the Reunification Day holiday. Given how busy that weekend might be, would you recommend getting fast track service for departure as well?

Any personal experiences or tips would be appreciated. Thanks in advance!",2,1.0,3,2025-04-13 18:07:31,https://www.reddit.com/r/VietNam/comments/1jydx7p/fast_track_service_hanoi_and_saigon_hcmc/,poooooooootato
VietNam,1jy6t76,Hotel Recommendations Hanoi,"Hello, first time travelling to Vietnam - me, my wife and out 12 yr old daughter. We want to find a really nice hotel for our first 2 nights after we land in Hanoi. We aren’t too budget conscious and would like to be able to really relax at the beginning of our trip.

We will be following the tourist trail to Ho Chi Minh so if anyone had any recommendations/advice etc we’d be really pleased to hear them. We envisage staying in a mixture of hotels and Airbnbs.

Thanks! ",2,0.75,12,2025-04-13 12:44:47,https://www.reddit.com/r/VietNam/comments/1jy6t76/hotel_recommendations_hanoi/,Visible-Selection935
VietNam,1jy1c1y,"Easy, cheap & lean high protein snacks?","In Thailand it was easy. If I wanted to top up on protein I’d walk into seven-eleven and grab either some hard boiled eggs or a high protein yoghurt. 

Are there any similar options in Vietnam? I know some delicious Banh mi’s are available on the side of the road for cheap, but they come with eating an entire piece of bread. 

Any suggestions?",3,0.64,16,2025-04-13 06:26:06,https://www.reddit.com/r/VietNam/comments/1jy1c1y/easy_cheap_lean_high_protein_snacks/,TRR_32929
VietNam,1jy06u6,Travelling to Vietnam in August 2025,"Xin chào! Hi everyone. Fellow SEA-asian here, from Malaysia. My fam and I will be travelling to Vietnam in August for 5 days 4 nights. Honestly, not sure where we are planning to go, most definitely will go to Ho Chi Minh City. I want to ask the locals here for some advice : 

1) My family plans to get a tour guide, but I don’t think its necessary, what do you all suggest ? 
2) We plan on getting custom made clothes, I know Vietnam is famous for tailoring clothes. Can you guys suggest places to get clothes tailored for a good & affordable price ? What is the price range for dresses/tops or suits ?
3) What places do you suggest we visit ? 

Thanks in advance guys! :)",2,1.0,6,2025-04-13 05:08:43,https://www.reddit.com/r/VietNam/comments/1jy06u6/travelling_to_vietnam_in_august_2025/,AdditionFluid2974
VietNam,1jxxnwu,What to buy as tourists in Vietnam?,"Hi folks, what to buy in Vietnam when visiting? For adults, kids, food items, souvenirs, etc?",2,1.0,14,2025-04-13 02:32:31,https://www.reddit.com/r/VietNam/comments/1jxxnwu/what_to_buy_as_tourists_in_vietnam/,waaasupla
VietNam,1jxxnhn,Confusion on Instructions,"I made these delightful noodles tonight, but I'm confused on the instructions of storage. I see that it says to put the noodles in a plastic bag and store it in the fridge, but does that mean noodles that have been cooked? Or does it mean the dry noodles? Sorry if this is obvious, but I have Autism, and I just get really confused sometimes. ",2,0.75,4,2025-04-13 02:31:47,https://i.redd.it/ug1i93cdkiue1.jpeg,ConfusedCactusDraws
VietNam,1jxqfzv,What is vietjet like?,"Im planning to use them to fly from da nang to ho chi minh city and then from ho chi minh city to tokyo? 

I’ve seen posts they are unreliable, is this really the case? Shall I not use them? My flight to tokyo will be in the night, are they less likely to be delayed?🤷‍♂️",2,0.6,42,2025-04-12 20:21:03,https://www.reddit.com/r/VietNam/comments/1jxqfzv/what_is_vietjet_like/,DodoDoriano
VietNam,1jxhoxd,Dong Ho Art in Elementary,"Hi! I'm a 4th grade teacher in California, and I'm planning a unit on Dong Ho art, but I'm wondering how students could make their own with limited supplies (or very cheap!) Any advice would be super appreciated!",2,1.0,1,2025-04-12 13:47:45,https://www.reddit.com/r/VietNam/comments/1jxhoxd/dong_ho_art_in_elementary/,hillariousue5
VietNam,1jxf53z,Im travelling Vietnam in august. does anyone know local festivals/concerts?,"Hiii so i just got my ticket and im so excited. Im flying in august and planning on staying for like a month. My question is is someone familiar with festivals/concerts/live shows happening by international artists ? 


this things are pretty hard to look for online, thanks !",2,0.75,4,2025-04-12 11:26:48,https://www.reddit.com/r/VietNam/comments/1jxf53z/im_travelling_vietnam_in_august_does_anyone_know/,DemocracyforLunch
VietNam,1jxdb0r,Vietjet dilemma,My husband and I are currently in Da Nang and have to leave Vietnam tomorrow from Ho Chi Minh City via 8:55 PM flight. Our flight out of Da Nang to Ho chi Minh from Vietjet was originally supposed to reach HCM at 6PM but they have delayed the flight and now it's reaching at 7.  That means we will reach Ho Chi Minh airport hardly 2 hours before our international flight back home. We tried all possible routes to book a different flight out of Da Nang (or Hue) to reach earlier but last minute tickets are proving to be too expensive and there are no refunds available on the original booking. Would it be wise to take a chance on the current flights or should we just book an earlier flight from Da Nang and let go of the entire amount we spent on the earlier tickets?,2,0.75,30,2025-04-12 09:17:06,https://www.reddit.com/r/VietNam/comments/1jxdb0r/vietjet_dilemma/,tubelight_embryo
VietNam,1jx8s1b,Viettel SD vs 5G Packages,"Hi everyone

Does anyone know the difference between the SDxxx and 5Gxxx packages for Viettel’s prepaid SIM?

From the website I reviewed, it looks like the 5G package provides much greater value for the same price—more data, faster speeds, and extra services. However, all the ""tourist guides"" recommend purchasing the SD package.

https://viettel5g.net/Cac-goi-data-5G-Viettel/5G150-va-SD150-Viettel.html

This doesn’t quite add up for me. Can someone explain?",2,1.0,3,2025-04-12 04:06:03,https://www.reddit.com/r/VietNam/comments/1jx8s1b/viettel_sd_vs_5g_packages/,Furri_HK
VietNam,1jws8l7,Re: Fast Track Lane Service at Noi Bai Airport,Hi! Just wanted to know if it's recommended to avail the fast track lane service if we will be arriving at the airport at 1AM? ,2,1.0,5,2025-04-11 15:11:52,https://www.reddit.com/r/VietNam/comments/1jws8l7/re_fast_track_lane_service_at_noi_bai_airport/,needhelpphahaha
VietNam,1jwp1lq,Cost of Notarisation,"I plan to leave for Vietnam from the UK in August, and to spend a few months in Vietnam / other SEA places, using proper visas etc. I then plan to get a teaching job in HCMC with my CELTA (I'm from the UK, which means notarisation can't be done in Vietnam). 

My question about the costs of notarisation is to see if I should pre notarise the original documents in the UK, send the originals back from Vietnam myself via DHL courier or something similar, or keep the originals at home and have a parent sort the notarisation for me and send them to me in Vietnam.

  
I would hesitate to do it before I leave, as I may end up not getting a job before the 6 months validity is expired. This could be my own doing as I want to continue the travelling, or maybe I just flunk some interviews. And then the other two is a matter of cost I imagine.

I'm not intent on doing the process the cheapest way possible, just the easiest (if budget options are also available that's great).

  
Appreciate any help.

",2,1.0,3,2025-04-11 12:48:58,https://www.reddit.com/r/VietNam/comments/1jwp1lq/cost_of_notarisation/,Danbesua
VietNam,1jwm9x9,Vietnam worth visiting in early October?,"I am considering going to North Vietnam(Ha Giang, Sapa, Ninh Binh, Ha Long) in early October. How is this month compared to April? Will I be able to see green rice fields/terraces in Sapa and Ninh Binh or have they been harvested by that time? Some say it's the perfect time to see golden rice fields while others say they are being harvested in September.   
I really want to go in October and combine it with Japan but at the same time I want to go to Vietnam when it's the most beautiful. What are your thoughts?",2,0.75,3,2025-04-11 10:06:00,https://www.reddit.com/r/VietNam/comments/1jwm9x9/vietnam_worth_visiting_in_early_october/,Ok_Log_2503
VietNam,1jwkjsk,"Am I tripping or Radar Love's legendary guitar intro riff always sounds like ""dramatic section"" of Cai Luong?",,2,1.0,6,2025-04-11 07:57:54,https://www.youtube.com/watch?v=aRlSHG5hRY4,CeeRiL7
VietNam,1jwhcry,Need advice on travel between Hanoi/Halong Bay to Danang,"We are planning to do a family of 4 trip to Vietnam in May for the first time.   We fly into Hanoi to spend a couple of days, then want to go do Halong Bay for a 2day/1night cruise.   After we are done with the cruise, is it better to go back to Hanoi and fly out to Danang…or it is better to  fly out of Cat Bi airport to Danang?  Flight prices are about the same, but didn’t know if it’s better to not have to drive so far back to Hanoi to fly out and risk fewer options out of Cat Bi airport incase of delays/cancellations.

Also, if you have any Halong Bay cruise recommendations, please share.   We were interested in Doria, Dora, and Doris because the seem to be a good value.    Anyone have feedback on those cruises?

Thank you in advance!",2,1.0,2,2025-04-11 04:16:43,https://www.reddit.com/r/VietNam/comments/1jwhcry/need_advice_on_travel_between_hanoihalong_bay_to/,bnguyen75036
VietNam,1jvzqm6,Need help translating these billboards (ANOTHER ONE)😭,"
Hi, I’m currently making an analysis paper on the advertising placements and strategies through print ads of C2. However these are some of the few that I can gather and I can’t seem to translate the text on these billboards. Pls help me😭 (I was not able to post this one for I was kinda panicking for this assignment)",2,0.75,6,2025-04-10 14:48:16,https://i.redd.it/h1e0acz0t0ue1.jpeg,JedieIzReady
VietNam,1jvvunp,Is there a way to learn how to make clothes (in person classes) in Vietnam for foreigners who don’t speak Vietnamese?,"I tried searching online and found some university classes that lead to a fashion or art-related degree. Instead of university courses, I just want to learn how to make clothes, create patterns, and related knowledge for making clothes. Is there a way to learn in Vietnam without knowing any Vietnamese language? If you are a local and know something about this topic, please reply, I’d love to learn more. :) ",2,1.0,1,2025-04-10 11:43:17,https://www.reddit.com/r/VietNam/comments/1jvvunp/is_there_a_way_to_learn_how_to_make_clothes_in/,mortymin-n
VietNam,1jvrk0f,Re-check luggage Vietnam Airlines?,"Hi everyone,

I have a question about a flight I booked with Vietnam Airlines. The flight is from Delhi to Tokyo, with a 2 hour 55 minute layover in Noi Bai airport. I was wondering if I have to pick up and re-check my luggage in Noi Bai airport. It's all booked under the same booking reference number. I couldn't find a clear answer to it online so I'm hoping someone can tell me for sure. Thank you in advance! ",2,1.0,2,2025-04-10 06:44:06,https://www.reddit.com/r/VietNam/comments/1jvrk0f/recheck_luggage_vietnam_airlines/,stazysus
VietNam,1jvozcb,Da Lat recommendation,"hi !! i'll be staying at Cherry House Da Lat (with my senior parents) from June 9 to 11 but will travel at 2pm (June 11) back to ho chi minh to catch a flight. 

List of itineraries (haven't booked yet, indecisive atm):
1. Samten Hills

2. Valley of Love

3. Dalat Flower Highland + Greenline Luge

4. Datanla New Alpine Coaster

5. Robin Hill Cable Car

6. Da Lat Countryside Day Tour

Questions:
1. Which of these itineraries will be more interesting to go to? 
2. Will it be easy to book a GrabCar at mentioned places?
3. Can you recommend me places to go to at night? more on sightseeing and food trips that my parents and i can enjoy. Thanks !!",2,1.0,9,2025-04-10 03:55:35,https://www.reddit.com/r/VietNam/comments/1jvozcb/da_lat_recommendation/,nabicheoreom00
VietNam,1jvou3h,Weekend/Day Trips from Hanoi,"Hello!

I will be spending a few weeks in Hanoi soon, and I am looking to decide on a few weekends or days away since I would otherwise be spending quite a long time in just the city.

I want to go to places that are quiet, slower-paced and a bit more rural/in nature, with the possibility of doing some hikes. I want to avoid places that are overly touristy - nothing wrong with that, since I'm a tourist myself but I've been finding that big crowds and pushy sellers take away a lot of the enjoyment for me.

So far, I think I want to go to Ninh Binh, Sa Pa, Cat Ba + Lan Ha Bay. I know that I almost certainly don't want to do the Ha Giang loop.

I'd really appreciate any other suggestions of what people have enjoyed, or things I should consider with the places I'm already planning to visit.

Thank you!",2,1.0,0,2025-04-10 03:47:04,https://www.reddit.com/r/VietNam/comments/1jvou3h/weekendday_trips_from_hanoi/,risingsigncaprisun
VietNam,1jvom8a,Extra data on Vietnamobile app,"I bought a prepaid SIM via a bus company a while ago. The data/time limit has run out so I've purchased some add ons (30gb until 7th May). The add on shows in my account under ""promotion account"" and I have several texts showing I purchased the data and that it would expire in May. 

The data I bought initially with the bus company has now expired and the add on has not kicked in or activated, so I don't have data now. I have tried activating by sending DK ""package name"" to 123 but it says the message is wrong. 

Can anyone help and tell me how to activate the data I've bought? Thank you!",2,1.0,3,2025-04-10 03:34:37,https://www.reddit.com/gallery/1jvom8a,RoRoXip
VietNam,1jv6cl0,New slangs?,"I’m Viet in US. I haven’t been in the Vietnamese circle for a bit, what are some new lingo y’all can teach me so I can stay up to date?",2,1.0,9,2025-04-09 13:54:13,https://www.reddit.com/r/VietNam/comments/1jv6cl0/new_slangs/,rock-coaches
VietNam,1jv5ijl,Ha Giang Loop Research,"I’m thinking to do the Ha Giang Loop in mid/late June this year. I’m looking for advice and recommendations for me to have the best time. 

First some things about me, I’m solo travelling for this loop, from Australia and will be 21 years old.

So far in my research I’m leaning towards Bong for the 4 day tour. I’m looking for a tour group which will be smaller in the day (less than 15 ideally) but at night I’ll have the opportunity to socialise with more people. I do drink and can foresee myself enjoying the larger group party culture but not so much during travel and/or the sleeping arrangements. I’d value being able to see as much of the scenery as I can.

In terms of weather, what will it be like in June? Should I buy jackets before the loop? Or will it not be so cold? 

Should I take the bus in the morning to Ha Giang or the night bus? Anything else to keep in mind? ",2,1.0,0,2025-04-09 13:15:50,https://www.reddit.com/r/VietNam/comments/1jv5ijl/ha_giang_loop_research/,missile-s
