subreddit,post_id,title,content,score,upvote_ratio,num_comments,created_at,url,author
worldnews,1jkf7m7,Ireland issues travel warning for US,,65884,0.91,1515,2025-03-26 15:59:35,https://www.newsweek.com/ireland-issues-travel-warning-us-2050890,newsweek
worldnews,1jtpljw,Germany looking to withdraw its gold from the US,,60940,0.94,2515,2025-04-07 16:33:03,https://www.mining.com/germany-may-look-to-withdraw-its-gold-from-us-vaults/,Gammanomics
worldnews,1jv35mw,China slaps retaliatory tariffs of 84% on U.S. goods in response to Trump,,59869,0.95,4365,2025-04-09 11:10:30,https://www.cnbc.com/2025/04/09/china-slaps-retaliatory-tariffs-of-84percent-on-us-goods-in-response-to-trump.html,Puginator
worldnews,1jqknd8,U.S. companies say Canadian retailers are turning away products,,59705,0.94,3529,2025-04-03 14:58:13,https://globalnews.ca/news/11106170/buy-canadian-us-companies-impact-canada-retailers/,j1ggy
worldnews,1ju9u98,China lashes out at JD Vance for calling Chinese people ‘peasants’,,55682,0.94,2552,2025-04-08 09:57:39,https://edition.cnn.com/2025/04/08/china/china-slams-vance-peasants-remarks-intl-hnk/index.html?utm_medium=social&utm_source=blueskyCNN&utm_content=2025-04-08T09%3A43%3A00,DomesticErrorist22
worldnews,1jmthxn,"Le boycott: French customers shun McDonald’s, Coca Cola and Tesla to protest against Trump",,54020,0.94,1296,2025-03-29 18:59:55,https://www.theguardian.com/world/2025/mar/29/boycott-french-customers-mcdonalds-coca-cola-trump-tesla,Miserable-Lizard
worldnews,1k0tfzb,El Salvador denies senator visit with mistakenly deported man: Van Hollen,,52822,0.94,2856,2025-04-16 19:42:00,https://www.axios.com/2025/04/16/el-salvador-senator-mistakenly-deported-man,squeakycheetah
worldnews,1k484c0,"Pope Francis has died, the Vatican camerlengo, announces",,52653,0.93,2637,2025-04-21 08:00:11,https://apnews.com/article/vatican-pope-francis-dead-01ca7d73c3c48d25fd1504ba076e2e2a,MrNewVegas2077
worldnews,1k1d5uc,China calls bluff on 245% US tariff: 'Meaningless',,50756,0.95,2411,2025-04-17 13:45:12,https://www.newsweek.com/china-responds-us-tariffs-245-percent-trump-trade-war-2060875,newsweek
worldnews,1jv4gat,China calls for world to unite against Trump's 'trade tyranny',,49389,0.95,2242,2025-04-09 12:22:55,https://www.bbc.com/news/articles/c7vnn6y6g82o,HentaiUwu_6969
worldnews,1jov6bw,Russia 'Cannot Accept' Trump's Ukraine Peace Plans,,48662,0.94,3333,2025-04-01 13:08:54,https://www.newsweek.com/russia-cannot-accept-trump-ukraine-peace-plans-2053585,sweatycat
worldnews,1jw5lvh,Japan says it wants to join a NATO command for the support of Ukraine,,48651,0.96,1026,2025-04-10 18:52:33,https://apnews.com/article/japan-defense-nato-rutte-china-15de39e226c57a893fbf9755f600dcdb,nohup_me
worldnews,1jjtx3r,"Ottawa freezes Tesla’s $43-million rebate payments, bars it from future rebates because of tariffs",,48005,0.96,851,2025-03-25 20:48:16,https://www.thestar.com/news/canada/ottawa-freezes-tesla-s-43-million-rebate-payments-bars-it-from-future-rebates-because-of/article_d93ae97a-944c-41c6-bae0-63e905050d87.html,Old_General_6741
worldnews,1juihj8,Tariff tensions escalate as White House hits China with 104% hike,,47949,0.95,4687,2025-04-08 16:56:50,https://www.thestreet.com/crypto/policy/tariff-tensions-escalate-as-white-house-hits-china-with-104-hike,Force_Hammer
worldnews,1jrfq93,China strikes back at Trump with 34 percent tariff — bans rare earth exports to the U.S.,,47196,0.96,2733,2025-04-04 16:12:35,https://www.tomshardware.com/tech-industry/china-strikes-back-on-trump-tariffs-bans-rare-earth-exports-to-the-u-s,Significant-Colour
worldnews,1k2h913,Japan to provide Ukraine with $ 3 bn from Russian assets - Euromaidan Press,,46070,0.96,469,2025-04-18 22:18:23,https://euromaidanpress.com/2025/04/18/japan-to-provide-ukraine-with-3-bn-from-russian-assets/,StealthCuttlefish
worldnews,1jqw84k,Elon Musk’s platform X faces over $1 billion fine from EU regulators,,44830,0.96,855,2025-04-03 22:27:25,https://www.investing.com/news/stock-market-news/elon-musks-platform-x-faces-over-1-billion-fine-from-eu-regulators--nyt-93CH-3966645,RoyalChris
worldnews,1jwkpea,China Raises Tariffs on US Goods to 125% in Retaliation,,42936,0.96,2864,2025-04-11 08:09:29,https://www.bloomberg.com/news/articles/2025-04-11/china-raises-tariffs-on-us-goods-to-125-in-retaliation,imtheoscarmike
worldnews,1jnyyz8,Marine Le Pen found guilty in EU funding embezzlement case,,42726,0.96,1296,2025-03-31 09:10:33,https://www.bbc.com/news/articles/cwyq40yz70qo,Astroblemes
worldnews,1jv6w2v,China Issues Travel Warning For US,,42207,0.95,964,2025-04-09 14:17:44,https://www.newsweek.com/china-travel-warning-us-2057449,sweatycat
worldnews,1jvbiy2,Trump pauses reciprocal tariffs for 90 days for everyone but China,,41953,0.94,4085,2025-04-09 17:29:27,https://www.axios.com/2025/04/09/trump-tariffs-pause-china-stocks-recession,joe4942
worldnews,1jt1ygq,Zelensky says ‘no Response’ from US after Putin Rejected Truce,,41690,0.95,1055,2025-04-06 19:14:24,https://www.kyivpost.com/post/50276,TheRealMykola
worldnews,1jipb8z,Greenland condemns planned visits by Usha Vance and Trump adviser,,41145,0.94,2136,2025-03-24 12:20:38,https://www.bbc.com/news/articles/c4g0718g3jwo?xtor=AL-71-%5Bpartner%5D-%5Bbbc.news.twitter%5D-%5Bheadline%5D-%5Bnews%5D-%5Bbizdev%5D-%5Bisapi%5D&at_medium=social&at_link_id=DDA11C78-08A6-11F0-9109-9DB5C646837B&at_campaign_type=owned&at_format=link&at_campaign=Social_Flow&at_bbc_team=editorial&at_ptr_name=twitter&at_link_type=web_link&at_link_origin=BBCWorld,sh0tgunben
worldnews,1jnmm6b,'We stand by your side': Germany's Scholz condemns Trump's attacks on Canada,,40611,0.95,1129,2025-03-30 21:04:54,https://nationalpost.com/news/canada/germany-scholz-canada-trump,sovalente
worldnews,1jxr8pf,Trump extends Biden's sanctions against Russia,,39859,0.95,1800,2025-04-12 20:58:19,https://www.pravda.com.ua/eng/news/2025/04/12/7507317/,Creol6969
worldnews,1jm6mer,Zelenskyy: Ukraine will not recognise US military aid as debt under minerals deal,,39738,0.96,1113,2025-03-28 21:48:57,https://www.pravda.com.ua/eng/news/2025/03/28/7505048/,Objective-Agent-8270
worldnews,1juv9ei,"EU slaps tariffs on US trucks, cigarettes and ice cream to target Trump’s red states",,38073,0.95,1773,2025-04-09 02:26:12,https://www.politico.eu/article/eu-tariffs-trade-war-donald-trump-republican-states/?utm_source=RSS_Feed&utm_medium=RSS&utm_campaign=RSS_Syndication,teamfairies
worldnews,1k3kx9g,"'Evil may have its hour, but God will have his day': Zelenskyy's Easter message after accusing Russia of ceasefire violations",,38215,0.96,424,2025-04-20 11:56:46,https://timesofindia.indiatimes.com/world/europe/evil-may-have-its-hour-but-god-will-have-his-day-zelenskyys-easter-message-after-accusing-russia-of-ceasefire-violations/articleshow/120451289.cms,BreakfastTop6899
worldnews,1jlc7hf,Canada’s ‘old relationship’ with U.S. ‘is over’ amid Trump tariffs: Carney,,36951,0.94,2156,2025-03-27 20:04:35,https://globalnews.ca/news/11100883/donald-trump-tariffs-auto-canada-response/,joe4942
worldnews,1jlsu4m,Putin vows to 'finish off' Ukraine and mocks size of British army after 'reassurance force' announced,,36545,0.95,2403,2025-03-28 11:26:36,https://www.lbc.co.uk/world-news/putin-finish-off-ukraine-mocks-size-british-army/,Aks_2497
worldnews,1jso3db,Russian spy sensors found hidden in UK waters,,36367,0.96,1000,2025-04-06 06:49:16,https://www.telegraph.co.uk/news/2025/04/06/russian-spy-sensors-hidden-uk-waters/,TheTelegraph
worldnews,1jw0ezn,U.S. slaps 145% tariff on China in sharpest trade escalation yet,,35763,0.95,3373,2025-04-10 15:17:03,https://www.thestreet.com/crypto/policy/u-s-slaps-145-tariff-on-china-in-sharpest-trade-escalation-yet,Force_Hammer
worldnews,1k0muuw,"Trump refused Ukraine in Patriot systems, despite its readiness to pay $50 billion - Media",,35733,0.94,1861,2025-04-16 15:13:17,https://unn.ua/en/amp/trump-refused-ukraine-in-patriot-systems-despite-its-readiness-to-pay-dollar50-billion-media,sweatycat
worldnews,1jmi544,US warns French companies they must comply with Trump's diversity ban,,35548,0.91,3647,2025-03-29 08:54:11,https://www.reuters.com/world/us-warns-french-companies-they-must-comply-with-trumps-diversity-ban-2025-03-29/,cyberpunk6066
worldnews,1jm3wvp,"Political leaders in Greenland have agreed to form a broad four-party government ""to face the heavy pressure"" from the United States",,35531,0.97,1147,2025-03-28 19:51:11,https://www.thelocal.dk/20250328/greenland-to-get-new-government-as-parties-agree-on-coalition,nohup_me
worldnews,1jo72rx,"Putin to conscript 160,000 more Russians for war with Ukraine",,34400,0.91,2213,2025-03-31 16:17:35,https://www.politico.eu/article/vladimir-putin-ordered-conscript-160000-more-russians-army-spring/,ChiefFun
worldnews,1jqbahu,"Russia, Belarus excluded from Trump's sweeping tariffs list due to existing sanctions, White House says",,34195,0.95,1275,2025-04-03 06:30:03,https://kyivindependent.com/russia-missing-from-trumps-sweeping-tariffs-list-as-its-already-sanctioned-white-house-confirms/,MothersMiIk
worldnews,1jy87vm,'Correct mistakes': China calls on US to 'completely cancel' reciprocal tariffs,,33407,0.95,1238,2025-04-13 13:56:09,https://timesofindia.indiatimes.com/world/china/correct-mistakes-china-calls-on-us-to-completely-cancel-reciprocal-tariffs/articleshow/120254355.cms,doopityWoop22
worldnews,1jkjtzo,"Greenland tourism business accepts, then declines Usha Vance visit",,33088,0.96,989,2025-03-26 19:07:39,https://www.newsweek.com/greenland-tourism-business-revokes-invitation-usha-vance-visit-jd-vance-2050745,ubcstaffer123
worldnews,1js1k9r,"Russian attack on Zelensky’s home city kills 19 people, including 9 children, one of the deadliest attacks this year",,32784,0.95,556,2025-04-05 11:42:16,https://edition.cnn.com/2025/04/04/americas/ukraine-strike-zelensky-russia-latam-intl/index.html,kaufmann_i_am_too
worldnews,1jijmqb,Three European nations have asked the Trump administration for their unspent USAID contributions to be refunded.,,32654,0.96,678,2025-03-24 05:32:54,https://www.abc.net.au/news/2025-03-24/americas-european-allies-want-unspent-usaid-money-back/105088146,ElectricTrouserSnack
worldnews,1jjghku,"The United States puts unacceptable pressure on Greenland, Denmark says",,32157,0.95,1078,2025-03-25 10:46:31,https://www.reuters.com/world/united-states-is-putting-unacceptable-pressure-greenland-danish-pm-says-2025-03-25/,professorbrainiac
worldnews,1jpkate,"Denmark, Netherlands react to Trump's DEI ultimatum",,32096,0.92,2900,2025-04-02 09:14:22,https://www.newsweek.com/denmark-netherlands-react-trump-dei-ultimatum-2054062,newsweek
worldnews,1jkf611,Trump Says US Must Have Greenland as Vance Heads Over on Trip,,31814,0.9,6261,2025-03-26 15:57:48,https://www.bloomberg.com/news/articles/2025-03-26/trump-says-us-must-have-greenland-as-vance-heads-over-on-trip,JRMiel
worldnews,1jj17w4,P.E.I. says Teslas no longer eligible for electric vehicle rebate,,31244,0.96,463,2025-03-24 20:36:47,https://www.ctvnews.ca/atlantic/prince-edward-island/article/pei-says-teslas-no-longer-eligible-for-electric-vehicle-rebate/?cid=sm%3Atrueanthem%3Actvnews%3Atwittermanualpost&taid=67e1b2ca5b3aba00015397e8&utm_campaign=trueAnthem%3A+New+Content+%28Feed%29&utm_medium=trueAnthem&utm_source=twitter,TheFactory100
worldnews,1jlnvdo,"Ukraine's officials call US minerals deal ""robbery"" as Washington expands demands",,31242,0.96,1190,2025-03-28 05:24:16,https://euromaidanpress.com/2025/03/28/ft-ukraines-officials-call-us-minerals-deal-robbery-as-washington-expands-demands/,EdgarNeverPoo
worldnews,1jmknoh,Zelenskyy says no to any US minerals deal that might risk Ukraine’s EU bid,,31009,0.97,547,2025-03-29 11:56:10,https://www.politico.eu/article/ukraine-volodymyr-zelenskyy-no-us-minerals-deal-eu-bid-kyiv-putin-war-defense-rare-earth/,sweatycat
worldnews,1jtou3p,"Elon Musk's zero-tariff proposal with Europe is a sign of weakness and fear, German economy minister says",,30246,0.94,1327,2025-04-07 16:02:00,https://www.businessinsider.com/elon-musks-zero-tariff-proposal-europe-weakness-german-economy-minister-2025-4?utm_source=reddit&utm_medium=social&utm_campaign=insider-worldnews-sub-post,thisisinsider
worldnews,1jorwug,Germany launches permanent troop deployment on NATO’s eastern flank,,30191,0.97,657,2025-04-01 10:01:20,https://www.politico.eu/article/germany-launch-permanent-troop-deployment-lithuania-nato-eastern-flank-russia-ukraine/,DomesticErrorist22
worldnews,1jkuamp,France announces $2 billion military aid package for Ukraine,,30178,0.97,800,2025-03-27 02:59:58,https://kyivindependent.com/france-announces-2-billion-military-aid-package-for-ukraine/,N/A
worldnews,1jy5jx4,Zelenskyy on Russian attack on Sumy: 'Only scum can act like this',,30145,0.96,545,2025-04-13 11:29:11,https://newsukraine.rbc.ua/news/zelenskyy-on-russian-attack-on-sumy-only-1744537427.html,sweatycat
worldnews,1jmoybz,"After Vance visit, Denmark tells US: Stop treating us like dirt",,29983,0.96,936,2025-03-29 15:36:47,https://www.politico.com/news/2025/03/28/vance-visit-denmark-tells-us-stop-treating-us-like-dirt-00259248,doopityWoop22
worldnews,1jmbp26,Russia prepares for war with NATO – German intelligence,,28950,0.95,2782,2025-03-29 01:52:49,https://www.pravda.com.ua/eng/news/2025/03/28/7505015/,TheRealMykola
worldnews,1jzvp3f,"EU gives staff 'burner phones, laptops' for US visits",,28462,0.97,784,2025-04-15 16:05:48,https://www.theregister.com/2025/04/15/ec_burner_devices/,RGV_KJ
worldnews,1k1lgwr,Zelensky says US envoy Witkoff is spreading 'Russian narratives',,27946,0.96,354,2025-04-17 19:30:11,https://www.bbc.com/news/articles/c4g7wdw9jvno?xtor=AL-71-%5Bpartner%5D-%5Bbbc.news.twitter%5D-%5Bheadline%5D-%5Bnews%5D-%5Bbizdev%5D-%5Bisapi%5D&at_link_origin=BBCWorld&at_medium=social&at_link_type=web_link&at_ptr_name=twitter&at_campaign=Social_Flow&at_bbc_team=editorial&at_link_id=4A0D504C-1BC2-11F0-AD0A-DD45595878B7&at_format=link&at_campaign_type=owned,mvanigan
worldnews,1jr15gx,President Yoon Suk Yeol impeached,,27905,0.97,868,2025-04-04 02:23:55,https://www.koreatimes.co.kr/southkorea/politics/20250404/s-koreas-president-yoon-suk-yeol-impeached,Kyunseo
worldnews,1jiwk25,Denmark's defense committee head said he regrets choosing the F-35: 'We must avoid American weapons if at all possible',,27399,0.96,1008,2025-03-24 17:35:22,https://www.businessinsider.com/denmark-f35-regret-choosing-defense-committee-chairman-tensions-us-greenland-2025-3?utm_source=reddit&utm_medium=social&utm_campaign=insider-worldnews-sub-post,thisisinsider
worldnews,1jzbc4z,"Trump blames Zelenskyy, Biden and Putin for war",,26987,0.93,1403,2025-04-14 22:02:48,https://www.pravda.com.ua/eng/news/2025/04/14/7507560/,Creol6969
worldnews,1jk9io0,"Netherlands issues US travel warning, Belgium set to follow",,26908,0.95,881,2025-03-26 11:28:25,https://www.newsweek.com/netherlands-issues-us-travel-warning-belgium-set-follow-2050630,newsweek
worldnews,1jiz77m,Two women who spied for Russia tracked down and named by BBC,,26485,0.98,312,2025-03-24 19:18:11,https://www.bbc.com/news/articles/cqx0v599wqvo,Rc72
worldnews,1k120fd,The Economist: Trump administration ''fed up'' with Europe's efforts to strengthen Ukraine,,25444,0.95,1361,2025-04-17 02:17:48,https://www.pravda.com.ua/eng/news/2025/04/16/7507847/,Dapper-Material5930
worldnews,1jjlww7,"Trump Unveils Black Sea Deal With Russia, Ukraine",,25346,0.93,1864,2025-03-25 15:22:45,https://www.newsweek.com/trump-unveils-black-sea-deal-russia-ukraine-2049953,sweatycat
worldnews,1jyy9ft,Zelenskyy Says JD Vance Is ‘Somehow Justifying’ Putin’s War In Ukraine,,25278,0.96,421,2025-04-14 12:59:50,https://www.huffpost.com/entry/volodymyr-zelenskyy-calls-out-vance_n_67fcd5a9e4b0b88ef3cc54e4/amp,Aggravating_Money992
worldnews,1k1uwf0,‘No quick wins’: China has the world’s first operational thorium nuclear reactor,,25038,0.96,1212,2025-04-18 03:00:31,https://amp.scmp.com/news/china/science/article/3306933/no-quick-wins-china-has-worlds-first-operational-thorium-nuclear-reactor,jfy
worldnews,1k3nu0n,Chinese ambassador warns US not to repeat tariff mistakes of the Great Depression era,,25110,0.96,493,2025-04-20 14:31:55,https://www.scmp.com/news/china/diplomacy/article/3307223/chinese-ambassador-warns-us-not-repeat-tariff-mistakes-great-depression-era?module=top_story&pgtype=homepage,Saltedline
worldnews,1k5at0a,State of Emergency Declared as Huge Explosion Rocks Russia’s Vladimir Region,,29008,0.96,1196,2025-04-22 16:34:54,https://www.themoscowtimes.com/2025/04/22/state-of-emergency-declared-as-huge-explosion-rocks-russias-vladimir-region-a88833,juniperblossomss
worldnews,1jsao12,"Zelenskyy: We need to put pressure on Russia, not waste time in empty talk",,24833,0.97,271,2025-04-05 18:53:40,https://www.pravda.com.ua/eng/news/2025/04/5/7506216/,Yveliad
worldnews,1jzlccx,"Russia forces aren’t as strong as they claim, say captured Chinese fighters",,24669,0.95,765,2025-04-15 06:51:21,https://www.telegraph.co.uk/world-news/2025/04/14/russias-forces-not-strong-claim-captured-chinese-fighters/,TheTelegraph
worldnews,1jtc7ow,"Russia excluded from US tariff list due to ongoing ceasefire negotiations, White House says",,24582,0.94,1204,2025-04-07 03:42:14,https://kyivindependent.com/russia-excluded-from-us-tariff-list-due-to-ongoing-ceasefire-negotiations-white-house-says/,StealthCuttlefish
worldnews,1jq5cpt,No explanation from White House why tiny Aussie island's tariffs are nearly triple the rest of Australia's,,24549,0.97,1222,2025-04-03 01:10:12,https://www.9news.com.au/national/donald-trump-tariffs-norfolk-island-australia-export-tariffs-stock-market-finance-news/be1d5184-f7a2-492b-a6e0-77f10b02665d,superegz
worldnews,1jypk5u,"'Please Come To Ukraine, See War Devastation': Zelensky To Trump",,24503,0.95,786,2025-04-14 03:33:13,https://www.ndtv.com/world-news/please-come-to-ukraine-see-war-devastation-zelensky-to-trump-8158575,IlustriousCoffee
worldnews,1jz37nb,El Salvador President Nayib Bukele says he won't return Abrego Garcia to U.S.,,24455,0.95,2074,2025-04-14 16:30:58,https://www.cnbc.com/2025/04/14/abrego-garcia-el-salvador-trump-nayib-bukele.html,Puginator
worldnews,1jnc6g1,"Hamas begins brutal crackdown on Gaza protests with torture, executions",,24464,0.8,2628,2025-03-30 13:16:33,https://www.ynetnews.com/article/sjl5xnua1x,BluePineapx2le
worldnews,1jk12qq,"US war plans leak shows Five Eyes allies must ‘look out for ourselves’, says Mark Carney",,23787,0.97,619,2025-03-26 02:07:54,https://www.theguardian.com/us-news/2025/mar/25/trump-signal-leak-reaction-canada-five-eyes,AndroidOne1
worldnews,1jzsd9n,"China won’t talk if U.S. doesn’t show respect, ex-official says",,23464,0.96,1057,2025-04-15 13:49:53,https://www.bnnbloomberg.ca/tariffs/2025/04/15/china-wont-talk-if-us-doesnt-show-respect-ex-official-says/,subarunoaria
worldnews,1jtmrya,EU offers Trump removal of all industrial tariffs,,23350,0.95,2034,2025-04-07 14:36:51,https://www.politico.eu/article/eu-offers-trump-removal-of-all-tariffs/,sweatycat
worldnews,1jv5zpf,EU to impose 25% tariffs on USA,,22936,0.97,710,2025-04-09 13:37:59,https://www.news.com.au/world/north-america/us-politics/us-politics-live/live-coverage/93dcffec636fb562510e7c90b578c9eb?amp,GeneIll3179
worldnews,1jljj7c,Trump says US will 'go as far as we have to' to get control of Greenland,,22813,0.92,3721,2025-03-28 01:24:43,https://abcnews.go.com/International/trump-us-control-greenland/story?id=120208823,EUstrongerthanUS
worldnews,1ju1piv,"China 'resolutely opposes' Trump's 50% tariff threat, vows retaliation",,22575,0.97,1523,2025-04-08 01:17:16,https://www.cnbc.com/2025/04/08/china-resolutely-opposes-trumps-50percent-tariff-threat-vows-retaliation.html,Puginator
worldnews,1k09fwh,Hong Kong suspends postal service to the US after Trump’s tariff hikes,,22549,0.98,838,2025-04-16 02:09:35,https://www.cnn.com/2025/04/15/business/hong-kong-suspends-postal-service-to-us-intl-hnk?cid=ios_app,N/A
worldnews,1jkovtc,Canada launches ‘tariffs are a tax’ ads in U.S. to push back on Trump - National | Globalnews.ca,,22126,0.97,545,2025-03-26 22:39:57,https://globalnews.ca/news/11092457/canada-donald-trump-tariffs-ad-campaign-us/,Miserable-Lizard
worldnews,1jl2u6o,Germany says it 'will not give in' as Trump announces 25% car tariffs,,22011,0.97,954,2025-03-27 12:33:39,https://www.bbc.com/news/articles/cy4vjwzv22eo,HelFJandinn
worldnews,1jv27ar,We'll Pass Trump Tariffs Back as Higher Prices for Americans: German Firm,,21884,0.97,621,2025-04-09 10:08:48,https://www.newsweek.com/trump-tariffs-higher-prices-deutz-germany-2057290,Economy_Elephant6200
worldnews,1k2zdrq,Mexico's Sheinbaum Counters Trump Deportations With Tens of Thousands of Jobs for Returned Citizens,,21692,0.96,739,2025-04-19 15:52:17,https://www.latintimes.com/mexicos-sheinbaum-counters-trump-deportations-tens-thousands-jobs-returned-citizens-580902,Crossstoney
worldnews,1jlr53p,Portugal Issues Travel Warning For US,,21549,0.96,440,2025-03-28 09:30:06,https://www.newsweek.com/portugal-issues-travel-warning-us-2051891,sweatycat
worldnews,1k21ogz,Trade war: China ‘completely’ stops buying liquefied gas from the US,,21246,0.97,931,2025-04-18 10:28:52,https://tribuneonlineng.com/trade-war-china-completely-stops-buying-liquefied-gas-from-the-us/,ImDoubleB
worldnews,1jwz4ki,"Witkoff suggested that Trump ""allow"" Russia to take four regions of Ukraine",,21134,0.93,1196,2025-04-11 20:01:40,https://unn.ua/en/news/witkoff-suggested-that-trump-allow-russia-to-take-four-regions-of-ukraine-media,EsperaDeus
worldnews,1k01l8n,"Trump still wants Canada to be the 51st U.S. state, White House says",,20752,0.9,2722,2025-04-15 20:03:16,https://globalnews.ca/news/11132975/donald-trump-canada-51st-state-white-house-election/,IAmThePla9ue
worldnews,1jpuxi7,"Russian strategic bomber crashes in Siberia, one person dead, governor says",,20027,0.97,491,2025-04-02 17:48:38,https://www.reuters.com/world/europe/russian-strategic-bomber-crashes-siberia-one-person-dead-agencies-report-2025-04-02/,kate500
worldnews,1jq06rb,"Trump unveils his double-digit 'Liberation Day' reciprocal tariffs on China, Taiwan, and a slew of other key trading partners",,19415,0.95,2039,2025-04-02 21:20:04,https://www.businessinsider.com/trump-liberation-day-reciprocal-tariffs-speech-2025-4?utm_source=reddit&utm_medium=social&utm_campaign=insider-worldnews-sub-post,thisisinsider
worldnews,1jyr8hi,"Trump reacts to Russian strike on Sumy: It was terrible, they made a mistake",,19315,0.95,841,2025-04-14 05:16:31,https://www.pravda.com.ua/eng/news/2025/04/14/7507460/,HydrolicKrane
worldnews,1jj9qrf,"Papua New Guinea shuts down Facebook in test to stop 'pornography, misinformation, hate speech'",,18533,0.98,437,2025-03-25 03:01:03,https://www.abc.net.au/news/2025-03-25/facebook-shut-down-in-papua-new-guinea-in-test/105092564?utm_source=abc_news_app&utm_medium=content_shared&utm_campaign=abc_news_app&utm_content=link,Expensive-Horse5538
worldnews,1k4wzsg,"US Imposes Tariffs Up to 3,521% on Southeast Asia Solar Imports",,18761,0.95,1440,2025-04-22 03:43:51,https://www.bloomberg.com/news/articles/2025-04-21/us-imposes-new-duties-on-solar-imports-from-southeast-asia?embedded-checkout=true&leadSource=reddit_wall,cryptodoggie26
worldnews,1jkkkt2,Europe working on plan to replace US in NATO in five to 10 years: Report.,,18330,0.98,1274,2025-03-26 19:38:26,https://www.aljazeera.com/news/2025/3/21/europe-working-on-plan-to-replace-us-in-nato-in-five-to-10-years-report,PrestigiousZombie726
worldnews,1jxk0zf,Snowbird selloff: Canadians are parting ways with U.S. properties,,18272,0.96,974,2025-04-12 15:36:26,https://globalnews.ca/news/11126170/canadians-selling-u-s-properties/,naqi11
worldnews,1jtgnal,Ukraine gets approval to export eggs to Canada,,18150,0.98,299,2025-04-07 08:48:50,https://farmersforum.com/ukraine-gets-approval-to-export-eggs-to-canada/,panzerfan
worldnews,1jok4s7,'Not a hope in hell': Irish politicians roundly reject Conor McGregor's presidential bid,,18104,0.97,570,2025-04-01 01:40:22,https://news.sky.com/story/not-a-hope-in-hell-irish-politicians-roundly-reject-conor-mcgregors-presidential-bid-13337260,Majano57
worldnews,1k4odvp,Venezuela accuses El Salvador of human trafficking as prisoners caught in row between authoritarians,,18014,0.97,291,2025-04-21 20:54:39,https://www.theguardian.com/world/2025/apr/21/venezuela-el-salvador-bukele-maduro-prisoners,Aggravating_Money992
worldnews,1k0q3vn,"Putin praises Elon Musk, compares him to father of Soviet space program",,17892,0.95,614,2025-04-16 17:26:10,https://www.reuters.com/world/europe/putin-praises-elon-musk-compares-him-father-soviet-space-program-2025-04-16/,BreakfastTop6899
worldnews,1jnsouw,Russia has depleted its tank stocks: the industry is not covering combat losses,,17510,0.98,1213,2025-03-31 02:06:29,https://militarnyi.com/en/news/russia-has-depleted-its-tank-stocks-the-industry-is-not-covering-combat-losses/,TheRealMykola
worldnews,1jvbhuw,"Trump: Raising China Tariffs to 125%, Effective Immediately",,17269,0.97,1411,2025-04-09 17:28:16,https://www.streetinsider.com/Economic+Data/Trump%3A+Raising+China+Tariffs+to+125%25%2C+Effective+Immediately/24620165.html,Party_Judgment5780
worldnews,1jrkmcb,Kremlin says “no plans” for Putin-Trump call as White House warns patience is limited,,16909,0.96,504,2025-04-04 19:37:54,https://euromaidanpress.com/2025/04/04/kremlin-says-no-plans-for-putin-trump-call-as-white-house-warns-patience-is-limited/,MothersMiIk
worldnews,1jqcxr8,"White House explains why new tariffs do not apply to Russia, North Korea",,16896,0.97,838,2025-04-03 08:20:33,https://global.espreso.tv/russia-ukraine-war-white-house-explains-why-new-tariffs-do-not-apply-to-russia-and-north-korea,Commercial-Claim-490
