subreddit,post_id,title,content,score,upvote_ratio,num_comments,created_at,url,author
VietNam,1jnvgvw,Marriage in Vietnam as a foreigner experience,"So I was preparing to get married in Vietnam and was trying to get the paperwork ready in the US. I made a huge mistake and wasted a lot of time and money, so don't make the same mistake as me. I was initially following this [list of requirements](https://vn.usembassy.gov/marriage/). I thought I could get each of those requirements like Affidavit of Single Status, Record of no marriage myself in the US first. I made the mistake of trying to get these papers notarized and translated by a public notary in the US. Don't do this! I came to Vietnam with these papers and they said it was useless and to throw it away and had to rush to make a real appointment for the real documents, with the aid of some lawyers based in the US but had staff physically in Vietnam to help. Luckily everything turned out okay.

So what you need to do is, online, make an appointment to go to the U.S. Consulate, Đại sứ quán, in Saigon or Hanoi for a marriage application. Once there, you can have someone wait outside to hold your stuff for you, there is highland coffee next to the consulate in saigon. What you need to bring inside is your passport and the printed form for the Affidavit of Single Status, Độc Thân and the form for the certified copy of the foreigner's passport, and some money. These are the only two you need to get notarized and each document costs $50 so $100 in total. I recommend bringing cash, like a clean $100 but I believe they also accept debit cards. When entering the consulate, you will pass through security where you leave your phone in a locked box and go into a few rooms with other people waiting for their appointments, such as trying to get their lost passport replaced, interview for entering the US and other marriage applicants. 

Once they call your name, you tell them the purpose of what you are doing there, and you give them the forms and your passport and pay the fee. Wait a bit and then they will come back with documents with the official red stamp and seal. Once that is done, they will ask if you are planning to use this document in Vietnam or outside. Since I was getting married in Vietnam, I said in Vietnam. Then they gave some instructions to go to another government building nearby to authorize the signature. However, I did not do this part personally, because I had a vietnamese lawyer (name of the tax/immigration office was “TOAN VU” from Oakland california).  helped us and they took care of that for us. And they also printed out the forms for us (after we emailed them all our scanned documents) and told us what to sign. And the staff waited outside for me. Their service was $200, which seems fair as they took care of all the paperwork for us. And since I messed up right before, I had to make sure everything was 100% correctly done this time. Unless you are good at Vietnamese law, I’d recommend just paying an expert to do the paperwork and make the appointments for you. Then I waited a day, this staff person came to our hotel and dropped off the documents once the signature authorization was done. So in summary, the two papers that you need notarized with the red stamp at the US embassy/consulate in SGN or HN are the single status paper and the certified copy of passport. Since the form is already in Vietnamese and English, it doesn't need to be translated.

After you have those two documents, go back to your spouse's home province. Make sure you get a photo printout 3x4 cm of your photograph and your spouses’, there are a lot of places that do copy and photographs, they also photoshop to make the photos look professional. The final document you need is the mental health exam. This has to be done at the local hospital, not a big international hospital like vinmec or anything. You don’t need to make appointments, just show up, just that they close on weekends I believe. You can tell that the hospital offers this service since the hospital often has a big board that lists the medical services and marriage mental health exam should be one of them. I read online of someone's experience that they make you put probes and electrical sensors on your brain and take urine tests. We were not subjected to that extent but all we had to do was just take an IQ test, which was the Raven's Progressive Matrices for pattern recognition. You and your spouse go into different rooms and the staff steps out to let you work on the test. Tbh, I finished pretty quickly but my wife was slow at taking the test and so just went into my room and copied my answers, I guess no one noticed or cared 😂. They check your answers to the IQ test, then you go over to the psychologist office where the psychologist reviews your information and asks some basic questions. For example, they asked me, “What is the capital of the US?”, to which I replied quickly, Washington D.C., to make sure I know why I’m there and I’m not dumb. After that, they sign the doctor’s note that you mentally well and not being coerced or anything, attach the face pictures to the paper, and they stamp it and you're good to go.

After you have those 3 documents, go to the People’s district committee, huyện ủy in your spouse’s home province/town. Before you enter the building, make sure you wear pants, same with the US consulate, because they won’t let you in if you wear shorts and flip flops. Then there will be someone that will help you do the marriage application. Once they have everything they will process the marriage application. Normally, for foreigners it takes 3 weeks to get it back, but I was in a rush and needed it done in 3 days before I leave. So my wife asked if it could be done faster, which I thought involved paying bribe money, but tbh, the staff was understanding and didn’t request extra money besides the standard application fee of around 1 million. After they give the completed marriage application back, which is an official government document with red paper, you will get a chance to sign it. I recommend recording it as a lot of people seem to do it on social media. After that you are all set and officially married and that marriage is also legal and recognized in the US also. The whole process is quite cumbersome for a foreigner, at least compared to two local vietnamese marrying, as you have to go to the capital or SG and take some hospital tests. But besides that, if you have external help, and native spouse, the marriage process is pretty straightforward.",37,0.85,43,2025-03-31 04:48:55,https://www.reddit.com/r/VietNam/comments/1jnvgvw/marriage_in_vietnam_as_a_foreigner_experience/,kirsion
VietNam,1k4sjlg,"Vietnam ""may be"" set to purchase F-16 jets...(and probably the latest model/block production).","Whoa, this is huge [news](https://www.newsweek.com/vietnam-us-f-16-sale-china-xi-jinping-2061991) if it materializes.

Vietnam may get a very dynamic jet fighter with air-to-air and air-to-ground capabilities in the same package.  AESA radar and a host of high-end ordinances.

""The F-16 Fighting Falcon is widely considered one of the best fighter jets, particularly in terms of its maneuverability and combat capabilities. It's known for its versatility, agility, and powerful performance, making it a highly effective multi-role fighter."" -Google",36,0.65,63,2025-04-21 23:57:23,https://i.redd.it/pvy6ek7uz9we1.jpeg,recce22
VietNam,1k4392z,Would I be criminalised for not attending mandatory military service?,"I left Vietnam when I was 16 (2019). Now I want to go back to Vietnam as i got citizenship in different nation and want to change my ID as my cmnd got expired quite ago or became useless, im not sure. Will they arrest me on spot? 
Fyi, i have myopia and astigmatism",35,0.89,31,2025-04-21 02:45:26,https://www.reddit.com/r/VietNam/comments/1k4392z/would_i_be_criminalised_for_not_attending/,fivethreefish
VietNam,1jsuykm,view of  the new Long Thanh International Airport - 20250405,,35,0.97,6,2025-04-06 14:09:30,https://i.redd.it/z2eicnx828te1.jpeg,that_guy_on_tv
VietNam,1jrxe61,The Hanoi BRT was a missed opportunity,,35,0.97,36,2025-04-05 06:43:06,https://i.redd.it/0d2pawhwpyse1.jpeg,NatterHi
VietNam,1jpoof2,"United Airlines Add 4 New Flights to Bangkok, Ho Chi Minh City, Adelaide and Manila",,35,0.99,6,2025-04-02 13:34:26,https://aviationa2z.com/index.php/2025/04/02/united-airlines-add-4-new-flights-in-asia-pacific/,aviator1819
VietNam,1jo449j,Đây là thịt gì?,,36,0.93,31,2025-03-31 14:11:08,https://i.redd.it/mq1ju8ga91se1.jpeg,sername_generic
VietNam,1k2sejp,Sea flies at Da Nang beach,"I spent like maybe 30 minutes late at night sitting on the beach in Da Nang and I would highly advise against doing this LOL. It sucks because I usually wear long pants everywhere in Vietnam because of bugs but just so happened to be wearing shorts this night. I’ve never experienced sand flies before so I didn’t know this could happen and wanted to warn others! 

(Also if anyone can confirm these are sand fly bites and not sand fleas id appreciate it!)",33,0.95,11,2025-04-19 09:25:45,https://i.redd.it/uzppaimofrve1.jpeg,lethatshitgo
VietNam,1k0fa6b,Tan Son Nhat Airport’s new terminal T3,"**The new domestic passenger terminal at Tan Son Nhat International Airport which costs approximately VND11 trillion is ready for its first flights from April 19 after more than two years of construction.**

Terminal T3 will be officially put into operation on April 19 in celebration of the 50th anniversary of the Liberation of the South and National Reunification Day.",33,0.93,12,2025-04-16 08:17:25,https://vietbao.vn/panoramic-view-of-vnd11-trillion-tan-son-nhat-airport-s-new-terminal-537935.html,aweirdmugglename
VietNam,1jtk0hv,Fake clothes,Where to buy obviously fake clothes in hcm. We searched everywhere but we can only find regular fake clothes. ,32,0.91,14,2025-04-07 12:27:21,https://i.redd.it/4ebj1gl5pete1.jpeg,wezleyd
VietNam,1k2ozfd,"Le dynasty art, when were these made?","Are these recreations or were they actually made during the Le dynasty (1428–1527, 1533–1789)?

1. ""*Tam quốc chí đồ* (三國志圖) at Độc Lôi Temple, Nghệ An""

2. ""Painting of Imperial guard of the Lê dynasty""

3. ""Painting of a Diêm Vương and a scene of the Underworld""",30,0.96,2,2025-04-19 05:23:40,https://www.reddit.com/gallery/1k2ozfd,hamach1
VietNam,1jx8ckd,Guess who’s not over Vietnam?,"Bought this baggie of calamansi from a local. Some of them are kinda weird looking, but that’s okay. It’s hard to grow stuff in Australia.

Made a tea out of them. Not bad, very sour and has the right flavour, but worth using a premium honey (like Mekong delta or Mudgee, not Capilano).",32,0.88,7,2025-04-12 03:40:06,https://www.reddit.com/gallery/1jx8ckd,pwnkage
VietNam,1judb2p,Letters to My Younger Self,"
Final version of the minimalist tribute poster: The Vietnamese Alphabet.

Big thanks to everyone here who gave feedback over the past month. From critiques to deeper conversations about language and identity—it shaped the final piece more than you know.

Context:
Growing up Viet Kiều, I never formally learned the Vietnamese language—just picked it up at home. At the same time, I was drawn to Swiss & Dutch design. I remember seeing an iconic IKEA poster back in ’99 featuring the Swedish alphabet and wondering: what if that was the Viet alphabet?

Years later, I finally made it. This started as a design exercise, but became something more—a bridge between language, history, and identity. A personal project turned poster, made for my younger self and others who grew up between cultures.

Let me know what you think—and thank you again for being part of the process.",33,0.88,11,2025-04-08 13:16:30,https://i.redd.it/n22q2c2u2mte1.jpeg,Toko12AM
VietNam,1jt8tt9,Proposal to eliminate the death penalty for certain crimes. A step forward or not?,[\[Infographic\] 8 crimes proposed to abolish the death penalty](https://nhandan.vn/infographic-8-toi-danh-duoc-de-xuat-bo-phat-tu-hinh-post870408.html),29,0.73,147,2025-04-07 00:36:05,https://i.redd.it/0aq6wd216bte1.png,usernameisben
VietNam,1jmr3mi,"I met this vilionist at Starlight Crescent Bride, Ho Chi Minh City",,33,0.97,0,2025-03-29 17:13:09,https://v.redd.it/eoopmg0tvnre1,Legitimate-Mushroom8
VietNam,1jl8blx,Tipping tour guides,"Me and my parents had a tour guide in Danang for 2 days. At the end of it, we gave him 25 USD in an envelope as a tip. Later that night, we got a call from him saying it was too little. What is the appropriate amount and is it really necessary to tip when the service wasn't anything out of the ordinary?
We have already paid $1200 to the tour company for 7 days, for 3 people.
The whole demanding a tip culture her has left our family feeling uncomfortable.
We're from India, not the US and can't tip a lot in dollars as even 1 dollar is a lot in both indian and vietnamese currency.
Edit - we spent a total of 7days in vietnam for which we paid 1200$, the 25$ tip was for the tour guide specific to danang where we spent 2 days, along with an additional 10$ tip to the driver in danang.",30,0.74,157,2025-03-27 16:41:16,https://www.reddit.com/r/VietNam/comments/1jl8blx/tipping_tour_guides/,SweetRamen123
VietNam,1k1cbeg,The Publications (& party) of Vietnam,"I visited the Book streets in Hanoi and Ho Chi Minh City to look at some of the Books that Communist party have published and few of the popular books across Vietnam. I realised apart from some of the classics and populist books, there are very few books that have acquired taste of Vietnamese people over the period.
I also appreciated the fast publications undertook by communist party not only to release their propaganda speeches and resolutions but also made some of the people involved in Vietnam war to write their memoir. Unfortunately, large part of it was only available in Vietnamese and could not be translated to English. 
I am very interested to know what do Vietnamese people think of their literature and how does communist party has shaped it?  ",31,0.88,28,2025-04-17 13:06:09,https://i.redd.it/p9c6mmu69eve1.jpeg,DramaRemarkable9102
VietNam,1jwkdoq,Guess who went to Vietnam and hasn’t gotten over it?,"Anyway, if anyone could point me to the right bbq cooker thingy for Vietnamese skewers/bun cha that would be amazing.

Currently looking at this one off Taobao.

Should I go larger? I’m hoping to be able to move it in and out of my garage, so portable. And I don’t have much space for storage. And I’ll just be cooking for 2 people anyway.

Also should I be using charcoal or these flammable blocks you can get from bbq section? 

Don’t ask me what this says, I can’t read Chinese. If you have a better bbq, lease link, don’t say you know of a better bbq, that’s evil. No American style bbqs thanks, those are too large and expensive.",31,0.87,15,2025-04-11 07:44:41,https://i.redd.it/334x9uadu5ue1.jpeg,pwnkage
VietNam,1jjo7c6,I just had super weird experience - am i overreacting?,"edit- its not clear from post, im a guy. 
So im currently at Phu Quoc - close to Cang Bai Vong. today at around 3pm after i checked in i went for a walk and 2 local guys at bike stoped if i want ride, i said yes why not and we went for ride. then one guy left and i stayed with older one, he took me to some random local restaurant here, he was super friendly i felt super safe all the time. he asked if i want to hangout later i said yes, he took me to my hotel i just swaped clothes and we went like 15km to Duong Dong. i know area i just come from there today to stay here for 2 nights and take ferry to Ha Tien. So in duong dong we go to a place for a cafe and previous friend join us, i asked if i can pay because he payed for food before, he strictily said no. that whole time we chat trough translator and having good time, after that we go to another restaurant and foot massage, he is paying everything for me and other guy. we then go to a bar - which was my idea but i dont drink so i wouldnt mind. during massage im starting to have toughts like why is this happening why is he paying everything etc, i start to feel uneasy. in the bar we come in and straight away theres girls at our table touching me etc, beers everywhere staff drinking aswell with us, they push all of us to drink drink so much. at this point i feel like its scam and they charge me at some point. druing the whole time this guy is tipping everyone 200k and 500k like nothing. indrink only water but i felt super bad so i tell them, we stay little bit more but we go, bill comes he pays and tips, he left there probably like 12m in 50-60mins. had few beers and took me back to my hotel which is middle of nowhere. im pretty sure it was just some random weird experience, during way to my hotel there were roads without trace of people so if anything bad would happen, it would already be done i think haha. im just writing this from my hotel room now, still feeling super weird, they know my location and that i am alone, but they were super friendly all the time and didnt push me to anything. in bar staff gave me beer like 3 times and guy pushed it away told them i only drink water. idk what to think about this all. first time in vietnam",31,0.86,73,2025-03-25 16:57:40,https://www.reddit.com/r/VietNam/comments/1jjo7c6/i_just_had_super_weird_experience_am_i/,Adamo47
VietNam,1k1lcb7,This is a September afternoon in Hanoi Capital of Vietnam,Do you see the world is increasingly lost?,31,0.97,0,2025-04-17 19:24:53,https://www.reddit.com/gallery/1k1lcb7,Dear-Chain8507
VietNam,1k1f1i0,Hỏi thật lòng về cách người Việt trong nước nhìn Việt Kiều,"Mình là Việt Kiều sống ở Đức. Mỗi lần về Việt Nam, mình cảm giác như người ngoài trong chính gia đình mình. Họ thường nghĩ tụi mình “không biết gì”, hay nói chuyện với nhau bằng tiếng Việt tưởng tụi mình không hiểu, rồi nói xấu sau lưng. Có lúc mình còn nghe họ bảo tụi mình “ngu” chỉ vì không quen với cuộc sống ở Việt Nam hoặc nói tiếng Việt không chuẩn.

Mình cũng cảm giác họ nghĩ tụi mình giàu lắm, như kiểu sống ở phương Tây là có “money glitch” vậy, nên đôi khi họ cư xử rất khác – kiểu vừa xa cách vừa kỳ vọng.

Mình không biết là cảm giác của mình có đúng không? Có phải nhiều người Việt trong nước thật sự nghĩ như vậy về Việt Kiều không? Hay chỉ là do mình nhạy cảm quá?

Mình muốn nghe suy nghĩ thật lòng của mọi người, đặc biệt là từ góc nhìn của người Việt sống ở Việt Nam. Mong được chia sẻ chân thành.


",31,0.94,21,2025-04-17 15:05:00,https://www.reddit.com/r/VietNam/comments/1k1f1i0/hỏi_thật_lòng_về_cách_người_việt_trong_nước_nhìn/,StatusAlfalfa1128
VietNam,1jvvpq0,Anybody else find Nha Trang to be pretty good?,"My girlfriend booked Nha Trang and after I read the threads on here, I was dreading coming. We are not party people at all, and I thought this was going to be a Benidorm for Russians. However, having gotten here I’m pleasantly surprised that it is pretty safe, not much garbage (no more than other places we have visited in Vietnam), not overly busy etc.
I wanted to post to see if anyone else found Nha Trang to be decent and also to put a good review out there for any other lurkers who use these threads to influence their decision making.

 ",30,0.88,40,2025-04-10 11:35:17,https://www.reddit.com/r/VietNam/comments/1jvvpq0/anybody_else_find_nha_trang_to_be_pretty_good/,CrunchBall69
VietNam,1jxihst,"My game ""Vietnam War"" is releasing on Steam soon, and I could use some help with voices","Greetings Vietnam!

If some of you would be interested in recording some basic Vietnamese voices lines for standard combat situations, please let me know. At the moment I haven't got any money to pay for it, but hopefully I will after the release. The current ones in game are just old sound clips from a documentary, and don't really make sense. And it´s a bit hard finding some that shout like in real combat.

It is an open world FPS with focus on your squad and a lot of vehicles. VC/NVA are playable too.

I hope to get a lot of players from Vietnam so I set price there to be about 75% cheaper there than in USA.

I hope this post doesn't break guidelines, but I figured some of you might find it interesting...

Thank you!",29,0.77,60,2025-04-12 14:25:53,https://www.reddit.com/r/VietNam/comments/1jxihst/my_game_vietnam_war_is_releasing_on_steam_soon/,ThoriumGameLab
VietNam,1jwlpik,"I have this original vietnam pith helmet that I just want to show. There is a name i think, (Sinh) is it girls or boys name?😅",,28,0.87,16,2025-04-11 09:25:54,https://www.reddit.com/gallery/1jwlpik,ChampionshipHairy597
VietNam,1k5cb35,Quy Nhon welcoming summer,,58,0.99,1,2025-04-22 17:35:15,https://i.redd.it/iq8ulyer9fwe1.jpeg,Classic-Rutabaga-613
VietNam,1jz4s1q,"China, Vietnam sign deals as Xi visits Hanoi amid US tariff tensions",,27,0.94,9,2025-04-14 17:35:07,https://www.reuters.com/world/asia-pacific/chinas-xi-meet-vietnam-leaders-kick-off-southeast-asia-tour-amid-us-tariffs-2025-04-14/,brevity142
VietNam,1jv173c,"The leaflet from the Republic of Vietnam (South Vietnam) regarding the dispersal of herbicide (containing dioxin), code HQ-19-67","https://i.imgur.com/XLflHd0.jpeg

""Eliminating mosquitoes to protect public health is a humanitarian effort by the government. The chemicals dispersed from aircraft are only intended to kill mosquitoes. This substance is not harmful to the people, crops, or livestock.""",27,0.94,9,2025-04-09 08:55:57,https://www.reddit.com/r/VietNam/comments/1jv173c/the_leaflet_from_the_republic_of_vietnam_south/,SkeppyMini
VietNam,1jsmxa2,Lý Thái Tổ: The visionary king who moved Vietnam's capital to Hanoi,"""Lý Công Uẩn, còn gọi là Lý Thái Tổ (974 - 1028). Ông là vị vua đầu tiên (1010 - 1028) của triều đại nhà Lý trong lịch sử Việt Nam. Ông là người quyết định dời kinh đô Hoa Lư về La Thành - nay là Hà Nội""

Lý Công Uẩn, known as Lý Thái Tổ, founded the Lý Dynasty and ruled from 1010 to 1028. His most enduring decision was to move the capital from Hoa Lư to La Thành, which he renamed Thăng Long—now known as Hanoi. This move marked a pivotal moment in Vietnamese history, shifting the country's political and cultural center to a location that would foster growth and prosperity for centuries to come.

His reign laid the foundation for one of Vietnam's most prosperous dynasties.

—
""What other capital city relocations have had a lasting impact on a nation's identity?""",28,0.86,3,2025-04-06 05:27:24,https://i.redd.it/hsvk6zfbh5te1.jpeg,signsofheroes
VietNam,1jq9tyk,My stock portfolio went downhill this morning,,27,0.81,8,2025-04-03 05:00:41,https://i.redd.it/deb5huetxjse1.jpeg,Thin_Distance_5581
VietNam,1jnbjcs,Any idea what this fruit is? Found in the mountains of Vietnam.,,27,0.97,16,2025-03-30 12:39:42,https://i.redd.it/soyjt8kwntre1.jpeg,DonTorpedo333
VietNam,1jprgko,"3 weeks booked, what now?","Hello fellow Vietnam travellers! 🇻🇳

My girlfriend and I have bought a plane ticket but are lacking a plan of sorts…
Beside my Reddit research that Hoi An is very touristy I hope you can help shape a wonderful backpacking experience.

We have only ever been at Ho Chi Minh City for 3 days so we are coming back for more!

Does this plan make sense? 
Do we need more/less time the various places?
Where to book sleeper busses? 
Any most see recommendations are also appreciated 🙏

 ",28,0.8,74,2025-04-02 15:30:11,https://www.reddit.com/gallery/1jprgko,Mikki2456
VietNam,1jkeh6o,"Vietnam’s attractiveness as an investment destination, helping the country move up the value chain in manufacturing, tech, and green industries.","Singapore's Prime Minister Lawrence Wong's visit to Vietnam strengthens economic ties between the two nations, bringing several benefits to Vietnam’s economy:

1. Increased Foreign Investment – The expansion of Vietnam-Singapore Industrial Parks (VSIP), including the new VSIP in Thai Binh, signals continued Singaporean investment in Vietnam’s industrial sector. This means more FDI inflows, job creation, and technology transfer.

2. Boost in Trade and Digital Economy – Agreements signed during the visit aim to enhance trade, green economy, and digital transformation, helping Vietnam integrate further into global supply chains and modernize industries.

3. Stronger Regional Partnerships – Singapore is a key economic partner within ASEAN. Strengthening ties with Singapore enhances Vietnam’s economic resilience, particularly in sectors like logistics, financial services, and smart infrastructure.

4. Long-Term Growth Opportunities – The 2025-2030 action plan provides a framework for deeper cooperation, ensuring sustainable growth in areas like renewable energy, technology, and innovation.
 

",29,0.87,12,2025-03-26 15:28:40,https://www.reddit.com/gallery/1jkeh6o,Temporary-Aioli5866
VietNam,1jts1hm,Sapa station,,25,0.94,3,2025-04-07 18:11:40,https://i.redd.it/32tik1ukegte1.png,thetravellerboy1996
VietNam,1jnqr6d,Vietnamese wife sent me this can someone translate it for me. She is just laughing.,"Vietnamese wife sent me this can someone translate it for me.  

https://www.facebook.com/share/r/15ttHokwd8/",25,0.86,34,2025-03-31 00:22:04,https://www.reddit.com/r/VietNam/comments/1jnqr6d/vietnamese_wife_sent_me_this_can_someone/,sdp1981
VietNam,1js7eso,Hanoi Old Quarter,Some pictures I took while strolling around Hanoi Old Quarter,25,0.96,2,2025-04-05 16:32:15,https://www.reddit.com/gallery/1js7eso,thetravellerboy1996
