subreddit,post_id,title,content,score,upvote_ratio,num_comments,created_at,url,author
VietNam,1jlmad4,Help me plan - North Vietnam,"We (2 adults) are traveling to North Vietnam in mid-May and will have 11 full days to travel. Mid-range travel with but we're ok spending more if there's a reason to do so. We love food (I eat fish but no meat/chicken/pork, etc.; boyfriend eats everything), the outdoors, meeting locals, off the beaten path type travel. 

We'll fly in and out of Hanoi. We have 3 nights booked at the Meritel Hotel in Hanoi and will wander the city. 

We plan for a 2 night cruise in Halong/Lan Ha/Bai Tu Long Bay (I welcome tour operator recommendations!!). 

Then we'll head to Ninh Bihn, probably staying in Tam Coc for 2 nights. 

We'll head back to Hanoi and fly to Danang, but stay in Hoi An. We'll day trip to Danang and/or the Cham Islands.

I think we'll wrap up with a final afternoon/night in Hanoi before catching our flight.

What are we missing? Where should we visit within our current trip plan? Thanks so much! ",2,1.0,5,2025-03-28 03:48:15,https://www.reddit.com/r/VietNam/comments/1jlmad4/help_me_plan_north_vietnam/,Leading-Lettuce-2047
VietNam,1jlj2qk,Good tailor places in Hoi An?,"Did anyone here got suit/tailored clothes in Hoi An? If yes, please give me some recommendations!! TIA",2,0.75,1,2025-03-28 01:02:09,https://www.reddit.com/r/VietNam/comments/1jlj2qk/good_tailor_places_in_hoi_an/,Curious_Chain_4162
VietNam,1jled2a,Coffee vs Tea,"In your opinion, what do most Vietnamese drink more, coffee or tea?
I've seen that most people associate Vietnam with coffee, saying there's a coffee shop every block, that Vietnamese drink coffee morning to night everyday. 

But from my experience, we usually only drink coffee in the morning, after that we drink tea. There are also free cold tea stations for drivers on the roads in HCMC. So why is tea not as equally associated to Vietnam as coffee? 

Vietnamese drink tea for centuries, possibly even longer than China. They still do, and also have many tea brands like Phúc Long and Katinat. Why aren't they as popular as Vietnamese coffee?",2,0.75,11,2025-03-27 21:32:06,https://www.reddit.com/r/VietNam/comments/1jled2a/coffee_vs_tea/,YensidTim
VietNam,1jld09r,Visiting in first week of May,"
Hey! I’m traveling to the hang doing cave system in early May as a graduation present to myself for college. How bad is the rain partition early May and around that area? ",2,1.0,1,2025-03-27 20:38:07,https://www.reddit.com/r/VietNam/comments/1jld09r/visiting_in_first_week_of_may/,Beneficial-Till-3796
VietNam,1jlcv41,Best language exchange apps?,I wanna learn vietnamese but I atleast want to make friends with some vietnamese people and know about their daily life. I know of hellotalk but sometimes the servers aren't very active ~~~,2,1.0,1,2025-03-27 20:32:29,https://www.reddit.com/r/VietNam/comments/1jlcv41/best_language_exchange_apps/,Individual-Month633
VietNam,1jl4cht,Phòng Khám Quốc Tế Mega Gangnam - Is it good ?,"Hey everyone,

Sorry to put it under travel but I couldn't find skincare.

I’m helping my mom look into some non-surgical facial treatments and we came across *Phòng Khám Quốc Tế Mega Gangnam* in Vietnam. Has anyone here heard of them or been there?

She’s particularly interested in:

* Face massage treatments that lift and tighten the skin
* Eyebag reduction without surgery

Just wondering how legit the clinic is — like, what’s their reputation? Are the treatments effective? And is it worth the price?

Would really appreciate any honest reviews or personal experiences. Thanks so much!",2,1.0,0,2025-03-27 13:49:49,https://www.reddit.com/r/VietNam/comments/1jl4cht/phòng_khám_quốc_tế_mega_gangnam_is_it_good/,Admirable-War-9041
VietNam,1jkziph,Food Stalls and Restaurant Recommendation with seating,"Hi Guys, 

  
I will be going to Hanoi and Ho Chi Minh city soon, and I wanted to know if you had good cheap eats with actual chairs and not the small plastic stools. My mum has back problems and is on the larger side (75kg or 165 lbs) ",2,0.75,15,2025-03-27 08:53:20,https://www.reddit.com/r/VietNam/comments/1jkziph/food_stalls_and_restaurant_recommendation_with/,Naive_Garden9862
VietNam,1jkynr2,How bad is the rainy season in Ho Chi Minh during June?,"Hi all, i’m planning to visit Ho Chi Minh mid June this year and i’ve read that it’s rainy season May - November. 

However, the main activities i’m planning to do is just shopping and eating - so i’m wondering if the rain will be very disruptive? To the extent of storms/floods? 

Would you recommend me to totally avoid going in June?",2,1.0,7,2025-03-27 07:44:10,https://www.reddit.com/r/VietNam/comments/1jkynr2/how_bad_is_the_rainy_season_in_ho_chi_minh_during/,Altruistic-Result345
VietNam,1jkycx6,Public Transport in HCMC (Tourist - Inquiries),"Hello, I am a tourist heading to Ho Chi Minh City in a few weeks. I would like to know what the public transportation is like and if there are any essential apps that I can use during my stay.",2,1.0,4,2025-03-27 07:21:18,https://www.reddit.com/r/VietNam/comments/1jkycx6/public_transport_in_hcmc_tourist_inquiries/,Falvarius
VietNam,1jkwbax,Fighter jets and helicopter?,"Been living in Saigon for about 8 months. During that time, I don't think I have heard one plane or helicopter where I live. But this morning, I heard a helicopter and then jets flying around overhead for about an hour or two. I assume they were fighter jets based on the sound.

I have no visual evidence of any of this. Just sounds I heard while in my apartment. 

Does any of this make sense? Military exercises over Ho Dhi Minh City?",2,1.0,11,2025-03-27 04:56:00,https://www.reddit.com/r/VietNam/comments/1jkwbax/fighter_jets_and_helicopter/,RealisticRelief6637
VietNam,1jko31s,How is Hanoi doing?,Is the city okey?,2,0.63,4,2025-03-26 22:04:38,https://i.redd.it/p6xojvf7x3re1.jpeg,Samueladonbalee
VietNam,1jk5ik5,Grab food and bike (car) payment method,"Hello, I'm going back to Vietnam after years. I want to ask if grab food and bike still accept cash as primary payment type, or do I have to have some sort of online payments  ?

Thank you. ",2,0.75,6,2025-03-26 06:33:58,https://www.reddit.com/r/VietNam/comments/1jk5ik5/grab_food_and_bike_car_payment_method/,moodblanket
VietNam,1jk54k4,Overnight Train Ninh Binh to Hue - alternative to Lotus (booked out),"Hi,
I read about the rather disgusting, not to say horrible, train experiences, but it seemed Lotus was a positive exception. 
Unfortunately, the day I am planning on travelling, Lotus is sold out.
Does anyone have experience with alternative companies such as 
- Damitrans
- New Livitrans
- Violette Express

I cannot really find anything but reviews for Violette Express on 12Go.

Note: want to book a VIP sleeper cabin",2,1.0,1,2025-03-26 06:05:00,https://www.reddit.com/r/VietNam/comments/1jk54k4/overnight_train_ninh_binh_to_hue_alternative_to/,tischhaxn
VietNam,1jk46pb,What are the best webbsties/facebook groups to find rental apartments in da-nang?,What are the best webbsties/facebook groups to find rental apartments in da-nang?,2,0.75,0,2025-03-26 05:00:52,https://www.reddit.com/r/VietNam/comments/1jk46pb/what_are_the_best_webbstiesfacebook_groups_to/,FrostFireAnna
VietNam,1jk1c25,Hoi An/Da Nang,"Hi, 

I’m heading to Hoi An/Da Nang for 3.5 days — I need suggestions on things to do.  I’m going with a coworker since it’s a stop over before a work trip - he wants to get some suits made so we are staying in Hoi An — but we would like to do other things too that’s not super touristy. 

Open to any of the following topics: 
-food
-shopping
-hotel
-things to do
-tours

Thank you in advance! ",2,1.0,8,2025-03-26 02:20:34,https://www.reddit.com/r/VietNam/comments/1jk1c25/hoi_anda_nang/,tlhoang418
VietNam,1jk10k4,Are there any non-obvious ways to get a MoMo/ZaloPay as a visiting expat?,Am not planning to open a bank account; are there any gift card options or similar that maybe just require a local cell number to get access to MoMo/ZaloPay in the long run to use it for Netflix etc?,2,0.75,6,2025-03-26 02:04:57,https://www.reddit.com/r/VietNam/comments/1jk10k4/are_there_any_nonobvious_ways_to_get_a/,kodridrocl
VietNam,1jjxdpo,Vt-Cmb Recomms,"Hi All, 

I love travelling to Asia and it’s my first time going to Vietnam this weekend. My bad as I booked in the Saigon airport and realized it was too far in Hanoi and Sapa(which is what I originally wanted to visit). Since I’ll be staying there for 8 days, I decided to use the time to travel the nearby places for convenience. 

Can you guys be kind and check the agenda I made? Keep in mind the hotels are booked already so I can’t change the place but if you have spots you can recommend in these areas, I’d appreciate it! ",2,1.0,3,2025-03-25 23:13:28,https://i.redd.it/y08bojqk4xqe1.jpeg,ronrayts19
VietNam,1jjv35o,Health insurance for traveling to the US,"Hi all, my grandfather (over 80 YOA)from Vietnam is traveling to the US to visit my family for 30 days. I’d like to purchase health insurance for him just in case. Can anyone please recommend any insurance agencies that sell travel health insurance?",2,1.0,1,2025-03-25 21:36:11,https://www.reddit.com/r/VietNam/comments/1jjv35o/health_insurance_for_traveling_to_the_us/,Potential_Program196
VietNam,1jjmeib,Vietnam in June,"Hello! Me and my bf (22) going to Vietnam for a month in June
I know it’s not considered the best month for Vietnam but it is what it is and I would like to make the most out of it!
I would love for some recommendations for areas or activities or even things not to do in June 
(We don’t have specific places and we are very flexible on what to do)",2,1.0,4,2025-03-25 15:42:56,https://www.reddit.com/r/VietNam/comments/1jjmeib/vietnam_in_june/,embarrassed_lass
VietNam,1jjkjl9,VietJet air website - help?,"Can't seem to pay online with any of my cards?

I am a UK national if that helps, so all my debit and credit cards are foreign, must've tried like 3 of them and none let me pay for my booking.

Trying to book a flight from HCM to Da Lat for 31st March to save spending all day on a shitty bus, as Da Lat has a long rail journey too. I would like to just take a quick flight since it is only 40-50 USD even with my big bag. ",2,1.0,7,2025-03-25 14:23:10,https://www.reddit.com/r/VietNam/comments/1jjkjl9/vietjet_air_website_help/,Argyl1
VietNam,1jjjeoo,Sun World Vietnam,Which Sunworld to visit in Vietnam..... the ba na hills or at phu quoc?,2,1.0,0,2025-03-25 13:31:04,https://www.reddit.com/r/VietNam/comments/1jjjeoo/sun_world_vietnam/,Rushabh_ganatra
VietNam,1jjj0du,Looking for Ha Giang loop tour recommendations,"I’m planning on doing the loop in a few weeks with my wife, we obviously don’t want a jam packed touristy experience, but we’re both very social people and aren’t looking for a super private experience either.

We’re interested in making fast friends, having a few drinks at night, enjoying an epic/relaxing ride and happy to pay a premium if that’s the best experience.

Any thoughts/recommendations?

P.s I’ve also seen a lot of Bibi spam on here, so if you’ve never posted about anything else and have no karma, I’m probably not gonna take you seriously.
",2,1.0,8,2025-03-25 13:11:29,https://www.reddit.com/r/VietNam/comments/1jjj0du/looking_for_ha_giang_loop_tour_recommendations/,Karma_Circus
VietNam,1jjcncd,Looking for recommendations for a neighborhood/district in HCM to stay in,"I live next door in Cambodia and I'm planning to take a trip to Ho Chi Minh city for a week very soon. I've been once before and stayed around Calmette in district 1 but I'm looking to stay somewhere a bit quieter with a lot of street food/markets. I will be renting a scooter so walkability is nice but not the biggest concern. 

  
Thanks in advance!",2,0.76,7,2025-03-25 05:57:41,https://www.reddit.com/r/VietNam/comments/1jjcncd/looking_for_recommendations_for_a/,charmanderaznable
VietNam,1jjbsmf,What is the best water park in Ho Chi Minh?,Especially in terms of which water park has the most rides/attractions. Also wondering how to buy tickets. Thanks,2,1.0,3,2025-03-25 04:59:17,https://www.reddit.com/r/VietNam/comments/1jjbsmf/what_is_the_best_water_park_in_ho_chi_minh/,dtaidh
VietNam,1jjbhfp,Moped recs for people on the short side/under 5 feet,"Hi,

I'm (4 foot 10 inches) and am struggling to find a moped that I can use comfortably. Most mopeds I've tried using my feet can't touch the ground which is uncomfortable as a first time moped driver, as I try to learn how to drive a moped.

  
Does anyone have any recommendations?",2,1.0,4,2025-03-25 04:39:39,https://www.reddit.com/r/VietNam/comments/1jjbhfp/moped_recs_for_people_on_the_short_sideunder_5/,Independent-Job7400
VietNam,1jj9b19,Ha Giang like new automatic scooters (2023-2024),"Hello, Where can I rent like new automatic scooters (2023-2024) in Ha Giang? Seems most of the renting companies have old ones. I'm willing to pay more for a low mileage scooter for up to 160Cc. Like PCX 160cc. Thank you",2,1.0,1,2025-03-25 02:37:31,https://www.reddit.com/r/VietNam/comments/1jj9b19/ha_giang_like_new_automatic_scooters_20232024/,Successful_Oil9219
VietNam,1jiyfyw,Can I visit my old public school for for touring purposes?,"I’m 23 years old, and I have been living far from home for the awhile…

This August, i’m bringing my American friend back to Sài Gòn to experience our culture. And visiting my old public school - trường trung học cơ sở/ trung học phổ thông Lê Quý Đôn, quận 3 is on the to-do list.

   do y’all think the security will let us respectfully tour around the school?

   “chú ơi, vài năm trước con học trường mình, năm nay con dắc bạn nước ngoài về tham quan trường, chú cho tụi con xin phép vào được không chú?” is a good enough way to ask?

  Since we going roughly mid to late August… Will that also be a factor that leads to their decision of letting us in?

   thank you, if yall have any suggestion where to take my American friend to experience, let me know!",2,1.0,15,2025-03-24 18:48:34,https://www.reddit.com/r/VietNam/comments/1jiyfyw/can_i_visit_my_old_public_school_for_for_touring/,Stephano1804
VietNam,1jik04c,Where can i but samoan rum in Hoi an ?,Do i have to go to the distillerie for getting old rum of those ? ,2,1.0,2,2025-03-24 06:00:03,https://www.reddit.com/r/VietNam/comments/1jik04c/where_can_i_but_samoan_rum_in_hoi_an/,Helpful-Wolf8292
VietNam,1k5mpow,"Rivergate in HCMC, yes or no?","It's right on the river in district 4 across from district 1, I'm looking to stay for 7 days. 

Have you stayed here and if so, please share your  experience, thank you. 


 https://g.co/kgs/EFCHAJS",1,1.0,2,2025-04-23 01:01:37,https://www.reddit.com/r/VietNam/comments/1k5mpow/rivergate_in_hcmc_yes_or_no/,Enough_Memory4918
VietNam,1k5kxds,"Hotels, rental condos with actual hot tubs","Every time I filter for hot tubs it’s just a tub.  Are there any hotels, condos, rentals with hot tubs on the facility?",1,1.0,3,2025-04-22 23:33:57,https://www.reddit.com/r/VietNam/comments/1k5kxds/hotels_rental_condos_with_actual_hot_tubs/,moldyjellybean
VietNam,1k5kdyf,Tattoos in Hanoi,"Hey guys, just wondering if there is any good tattoo artists in Hanoi. I’m looking to get my whole leg done and possibly my arm. How much do they cost?",1,1.0,2,2025-04-22 23:08:32,https://www.reddit.com/r/VietNam/comments/1k5kdyf/tattoos_in_hanoi/,Uno_Deck
VietNam,1k5k9q2,Are 1 Day Trips to Ninh Binh and Ha Long Bay worth it?,"I want to do at least one of them, ideally both but not sure if its worth it logistically when considering the travel time

Btw - im scared but just how hot is it in Vietnam rn",1,1.0,5,2025-04-22 23:03:07,https://www.reddit.com/r/VietNam/comments/1k5k9q2/are_1_day_trips_to_ninh_binh_and_ha_long_bay/,deadassynwa
VietNam,1k5j9cr,Luxury goods manufacturing,Is anyone aware of any manufactures in vietnam that specializes in making replica designer brand bags?,0,0.5,0,2025-04-22 22:17:28,https://www.reddit.com/r/VietNam/comments/1k5j9cr/luxury_goods_manufacturing/,Terrible_Credit8306
VietNam,1k5djlz,Sleeping tablets,"Are there any good and generally safe sleeping tablets available over the counter in Vietnam?

Thanks for any suggestions 😊",1,0.67,9,2025-04-22 18:24:14,https://www.reddit.com/r/VietNam/comments/1k5djlz/sleeping_tablets/,Weary-Elevator9266
VietNam,1k5c8am,[Travel Advice] Vietnam Trip Late April–May – Where to Be for the Holidays (April 30 & May 1)?,"Hi everyone!

I’m traveling to Vietnam from the end of April until May 13th, and I’m looking for some itinerary advice.

So far, I’ve booked a hotel in Ho Chi Minh City for the first 3 nights, then I’ll be flying to Da Nang on April 28th. From there, I haven’t planned anything yet—open to suggestions!

I’m especially curious about where to be for the April 30th (Reunification Day) and May 1st (Labour Day) holidays. I know these are big national holidays, and I’d love to be somewhere with either unique local celebrations or just a good vibe—whether that’s fireworks, festivals, or even somewhere more chill to avoid the big crowds.

Would it make sense to stay around Da Nang/Hoi An for the holidays, or should I try to be somewhere else (Hue? Hanoi? Somewhere more off-the-beaten-path)? After that, I’ll have around 2 weeks to explore more of the country—north or south, I’m open!

For context, I’m into nature, culture, food, a bit of history, and scenic spots. Not really into clubbing or party scenes, but open to cool local events or experiences.

Any recommendations or travel tips would be really appreciated!

Thanks in advance!",1,1.0,3,2025-04-22 17:32:07,https://www.reddit.com/r/VietNam/comments/1k5c8am/travel_advice_vietnam_trip_late_aprilmay_where_to/,juan_pala
VietNam,1k5bxtq,Tìm bác sĩ tâm lý ở HCM,"Có những nơi/văn phòng/website/bệnh viện nào có chuyên viên bác sĩ tâm lý làm về IFS, EMDR, somatic therapy(thôi miên), person-centered therapy, EFT, trauma-focused therapy,… không ạ. 

Mình bị PTSD, hypervigilance(cơ chế phòng về cao khiến mình luôn có những hành vi phòng thủ quá mức), khó mở lòng, cảm xúc mạnh. Mình đang tính chuyển bác sĩ vì cách làm việc ko phù hợp ạ, mình k hợp với CBT. 

B nào đi bs r cho mình xin đánh giá từng chỗ và chỗ nào hợp với trường hợp mình hiện tại k ạ",1,1.0,0,2025-04-22 17:20:28,https://www.reddit.com/r/VietNam/comments/1k5bxtq/tìm_bác_sĩ_tâm_lý_ở_hcm/,IntroductionDry8187
VietNam,1k5b829,"Vegetarian/Vegan Translation Help Beyond ""tôi ăn chay""","Hi! I'm about to travel to Vietnam and have been looking up the best ways to get around as a vegetarian. I found so many helpful tips on this subreddit that I'm super grateful for. 

For situations where I can't find a vegetarian restaurant, I wanted to have a bit more robust way to explain what I can/cannot eat. 

**I was wondering if anyone could help me translate the following:** 

* Was this made with fish sauce, shrimp paste, animal fat, or a broth made with meat or seafood? 

* I cannot eat anything cooked with a fat, stock, or sauce made from fish, shellfish, chicken, beef, pork, lamb, goat, or anything with eyes 😬 

*(bonus for vegans who find this thread: it may be helpful to add honey, dairy, and eggs to the lists above)*

* Does this have shellfish in it? I am allergic to shellfish. *(for my husband, who does eat meat)*. 

Maybe it's a bit much, but as a lifelong vegetarian, I can definitely see being in a situation where I say ""tôi ăn chay"" and they think picking chicken out of the soup will be enough for me to eat it. 

I've struggled to communicate this even without a language barrier, so I feel like it would be super helpful to have these translations.

Thank you SOO much! <3 

  


**I'm positive Google translate is wrong, but this is what I got there:** 

* Món này được làm bằng nước mắm, mắm tôm, mỡ động vật hay nước dùng nấu từ thịt hoặc hải sản?

* Tôi không thể ăn bất cứ thứ gì được nấu bằng mỡ, nước dùng hoặc nước sốt làm từ cá, động vật có vỏ, gà, bò, lợn, cừu, dê hoặc bất cứ thứ gì có mắt.

* Trong này có chứa động vật có vỏ không? Tôi bị dị ứng với động vật có vỏ.",0,0.45,9,2025-04-22 16:51:48,https://www.reddit.com/r/VietNam/comments/1k5b829/vegetarianvegan_translation_help_beyond_tôi_ăn/,SomeLAgirl
VietNam,1k5awzv,Phạm Thanh Thế: Secretary of Mỹ Tho City Party Committee,"**Vietnamese Text on the Sign:**  
""Phạm Thanh Thế (1923 - 2006) là Bí thư Thành ủy Mỹ Tho từ năm 1974 đến năm 1982.""

**Direct English Translation:**  
""Phạm Thanh Thế (1923–2006) served as the Secretary of the Mỹ Tho City Party Committee from 1974 to 1982.""

Phạm Thanh Thế (1923–2006) was a prominent politician in Vietnamese history, particularly during the post-war period. As Secretary of the Mỹ Tho City Party Committee from 1974 to 1982, he played a key role in the city’s recovery and development. His tenure was marked by efforts to improve living standards, promote education and healthcare, and strengthen unity among citizens. He is remembered for his leadership during a pivotal time in the nation’s reconstruction, leaving a legacy of social and economic growth in Mỹ Tho City.

**—**  
""What other post-war leaders made a lasting impact in your region?""",0,0.5,1,2025-04-22 16:39:26,https://i.redd.it/xb216dqszewe1.jpeg,signsofheroes
VietNam,1k55ns4,Ha Giang loop by car with kids,"Hi all, we are traveling with our 2 kids to northern Vietnam next week, and are doubting whether or not to do the Ha Giang loop.

We are traveling with a 8 and 10 yo, so driving a motorcycle is not an option, also not with an easy rider.

Would doing it by car be worth it? I'd like to see the scenery, but I'm afraid we will just be driving a lot and it will be boring for the kids.

Has anybody done the loop by car with kids and what was your experience?",1,1.0,5,2025-04-22 12:58:28,https://www.reddit.com/r/VietNam/comments/1k55ns4/ha_giang_loop_by_car_with_kids/,Alive-Primary9210
VietNam,1k54qko,Hue to Danang/Hoi An via Hai Van Pass?,"Hi, as the title suggests I am currently looking for options to go from Hue to Danang (or Hoi An) via the Hai Can Pass in a (half) daytrip. I heard about easyrider and came across some ""tours"" with vans. Not sure if it's worth it (it seems to be a service well paid, but fair enough if it is all well organized and safe) and what to expect. How does it work with the luggage by the way if we do the tour on the bikes? Any advice and recommendations are much appreciated!",1,1.0,6,2025-04-22 12:11:25,https://www.reddit.com/r/VietNam/comments/1k54qko/hue_to_dananghoi_an_via_hai_van_pass/,SafetyCutRopeAxtMan
VietNam,1k51dbz,Ha Giang Loop Socialising,"My girlfriend and I (both 23) are planning on doing the Ha Giang loop soon. I have seen that it is better using smaller companies that have smaller groups. We are keen to socialise and meet people but don’t want the big party vibe. 

Do people still socialise in evenings in smaller tours/do small groups of tours meet each over at the hostels or if your group is 4 people is it just 4 people for every part?",1,1.0,3,2025-04-22 08:33:36,https://www.reddit.com/r/VietNam/comments/1k51dbz/ha_giang_loop_socialising/,Glittering-Rest-1621
VietNam,1k514es,Few extra solo travel days in/around Danang - recommendations on how to spend it?,"I’ll find some time in the next few days to dig a bit deeper into this and adjacent subreddits, but I appreciate any two cents or direction here. 

I’m doing the Ha Giang loop with some friends before heading to Danang. That friend group is leaving and my girlfriend is considering a flight out a few days later to Danang. If we go through with that follow-on plan, I’d have 5 free days to find something to do. I’m not opposed to spending some money but I also love spending very little money (very novel of me, I know). I tend to be more of an outdoorsy person when I travel. I have a scooter license from Taiwan I was able to use on my last visit to Vietnam, so renting a scooter is definitely viable.  

I’m thinking along the lines of scooter/bus/train-ride-way smaller cities or spots worth visiting. Any recommendations here? Again, I appreciate any advice! 

",1,1.0,3,2025-04-22 08:15:04,https://www.reddit.com/r/VietNam/comments/1k514es/few_extra_solo_travel_days_inaround_danang/,Aggravating_Ad7276
VietNam,1k50stj,Advice on Vietnam.,"So I will be flying to Vietnam (Hanoi) from the Philippines want to ask a few things:

1.) Can I withdraw money in Hanoi airport? What is the best bank?

2.) Can I get a sim card in Hanoi airport and what is the best sim card to use?




",2,1.0,6,2025-04-22 07:51:23,https://www.reddit.com/r/VietNam/comments/1k50stj/advice_on_vietnam/,Ok_Garden_4874
