subreddit,post_id,title,content,score,upvote_ratio,num_comments,created_at,url,author
VietNam,1k4v14u,Looking for a tattoo artist in HCMC (or Hanoi) who specializes in Japanese-style black & grey work,"I’ll be in Vietnam for a month and I’m hoping to find a tattoo artist in Ho Chi Minh City (open to Hanoi too) who specializes in traditional Japanese-style sleeves—particularly black and grey work with waves, clouds, and lotus/peony flowers. Similar to the works in the photo. 

This would be my first tattoo, and I’m planning to get a sleeve. I’m female with fairly small arms, so if that affects how long the process might take or how many sessions I’d need, I’d love to hear your thoughts.

If anyone has artist recommendations (IG handles/facebook page preferred) and a rough idea of what something like this might cost or how many sessions it could take, I’d really appreciate it.

Thanks so much!
",2,1.0,2,2025-04-22 02:01:17,https://www.reddit.com/gallery/1k4v14u,kht521
VietNam,1k4ryku,What are they doing with the Jellyfish?,"So I’m at Da Nang beach at 6am walking along by the sea when ahead of me I see a group of people standing around. As I approach them, I literally see a guy who seems to be dissecting or breaking up a jellyfish into smaller chunks with his bear hands. After watching in amusement for a minute, I proceed to continue walking, only a minute later to find a small group putting a large (this time thankfully not dissected) jellyfish into a plastic bag and enthusiastically carrying it up the beach. 

My question: what is going on here?",2,1.0,21,2025-04-21 23:30:01,https://www.reddit.com/r/VietNam/comments/1k4ryku/what_are_they_doing_with_the_jellyfish/,TRR_32929
VietNam,1k4p3en,"2 Weeks - June, July, August or early Sep? Can't decide.","Looking to visit Vietnam this year, due to leave constraints can only be in June, July, August and early September. Looking to preferably visit HCMC, Hoi An, Hue, Cat Ba and Hanoi. Would love anyone's thoughts on the best time.",2,1.0,2,2025-04-21 21:24:03,https://www.reddit.com/r/VietNam/comments/1k4p3en/2_weeks_june_july_august_or_early_sep_cant_decide/,BobbyMonsta
VietNam,1k4isxz,Wedding gift idea from Vietnam?,"Xin chào gang. My partner's sister is getting married this June, which I will be unfortunately missing due to a planned month-long solo trip to Vietnam. They planned their wedding after I planned this trip so they understand and are excited for me to go, but I would like to get them something nice from Vietnam just to sweeten the pot a bit. 

My trip is pretty loose but right now its fly into Hanoi fly out of HCMC a month later, with plans to see Sapa/Ha Giang (doing the moto loop), camp in Khe Sang, stay with family friends in Hue, and see a silk factory in Hoi An. I am thinking there will hopefully be something in those towns or in between that call to me, but just wondering if anybody has any specific ideas for a wedding present from Vietnam that would be fitting. For context if it helps:

* Both are mid twenties
* She is a yoga instructor who is interested in holistic medicine
* He is very outdoorsy, into motorcycles and offroading and spends most of the Winter skiing and  summers in the mountains 
* Both very active and spiritual (Christian)

Thanks y'all!",2,1.0,0,2025-04-21 17:12:24,https://www.reddit.com/r/VietNam/comments/1k4isxz/wedding_gift_idea_from_vietnam/,cheeseboysupreme
VietNam,1k4esef,Desperate Students Survey! Foreigners Help Wanted!,"A few years ago, when I first started university, I posted a question just like this. Fast forward to the present and I'm now in one of my final courses, working with my group on a study about waste management in Vietnam, and we’re so close to the finish line (hopefully on time! 🎓).

And now, I need YOUR help 🫵yes, you, the awesome person reading this post! Your support means the world to us ♥️.  
🕒 The survey will only take about 2 minutes of your time ⌚super quick but incredibly valuable! 🌟

If you have any issues or questions, please leave them below and I will get back to you ASAP.",1,0.57,6,2025-04-21 14:24:08,https://forms.gle/YDaFcm4ziBSvmdkz7,HansNoFlammewerfer
VietNam,1k48jmw,15kg luggage limit on bus ( 12go dot asia ),"EDIT FOR FUTURE REFERENCE: they did not check or seem to care.

TL;DR do they actually check this?   
  
Hi all! Right now im looking at booking a bus to travel from Hanoi to different city. While booking i read the following on the site: 

""Your luggage should not exceed 15 kg weight for bus trips and 10 kg for van trips. If you carry a large bag or suitcase we recommend to buy an additional seat in the van.""

I have a large travel backpack as well as a normal one, with a combined weight thats over 15kg (probably not by a lot but still). I guess this won't matter a lot but just wanted to double check here since its the first time ill be using this way of transportation. The backpack i want to keep with me at any time but obviously the big bag can go in the storage area.

thanks in advance :) ",2,1.0,11,2025-04-21 08:30:09,https://www.reddit.com/r/VietNam/comments/1k48jmw/15kg_luggage_limit_on_bus_12go_dot_asia/,daanblom
VietNam,1k48anb,Tiền điện Hcm,"Cho mình hỏi mọi người trả bao nhiêu tiền điện mỗi tháng vậy ạ.
Mình với chồng wfh nên ở nhà nguyên ngày.

(2 người 1 máy lạnh mở nguyên ngày.1 tủ lạnh.bếp từ)

Tháng vừa rồi mình trả 2 triệu tiền điện nên muốn biết là có cao quá ko?
",2,1.0,5,2025-04-21 08:12:17,https://www.reddit.com/r/VietNam/comments/1k48anb/tiền_điện_hcm/,These-Championship32
VietNam,1k482i0,Laws regarding selling a used bike,"Hey everyone, I have a motorbike that I want to sell that I also bought used, so I have the blue card of the previous owner.

Could anyone tell me the general procedure for selling a using bike in terms of cancelling old registration etc?

I read online that the laws more strict about vehicle registration and you should cancel all the documents before you sell it, but is that realistically what people do now?

Thanks.",2,1.0,2,2025-04-21 07:56:26,https://www.reddit.com/r/VietNam/comments/1k482i0/laws_regarding_selling_a_used_bike/,Former-Hurry9118
VietNam,1k47k00,Custom clothes tailor in Hanoi,"Hi! I'll be heading to Hanoi in August this year and I'm looking for a reputable and affordable tailor, and not just those which are viral on social media. Can any locals recommend their faves? Thanks in advance 🫶",2,1.0,1,2025-04-21 07:18:13,https://www.reddit.com/r/VietNam/comments/1k47k00/custom_clothes_tailor_in_hanoi/,Survey-Witty
VietNam,1k47e0w,Phan Hien Dao: A Doctor and Musical Talent of the Nguyen Dynasty,"**Vietnamese Text on the Sign:**  
""Phan Hiển Đạo (1829 - 1883), người làng Vĩnh Kim Đông, tỉnh Định Tường, nay là thành phố Mỹ Tho. Ông đỗ tiến sĩ năm 1858 đời vua Tự Đức, là người tài hoa, giỏi âm nhạc.""

**Direct English Translation:**  
""Phan Hien Dao (1829–1883), from Vinh Kim Dong village, Dinh Tuong province (now My Tho city), passed his doctorate examination in 1858 under the reign of Emperor Tu Duc. He was a talented person, especially skilled in music.""

Phan Hien Dao (1829–1883) was an important historical figure in the Nguyen dynasty, known for his talents and extensive knowledge. He was born in Vinh Kim Dong village, Dinh Tuong province (now My Tho city). In 1858, during the reign of Emperor Tu Duc, he earned the title of Doctor, affirming his position in the country's academic and intellectual circles.

Phan Hien Dao was not only skilled in literature but also a talented musician. His works contributed to Vietnam’s cultural heritage during a time of great social and political change. Although the country faced challenges under French colonial pressure, his artistic and academic achievements reflect the resilience and creativity of Vietnamese intellectuals of that era.

Phan Hien Dao’s life and career left a lasting legacy in Vietnamese history. His cultural contributions continue to be remembered as a testament to the vibrant intellectual and artistic traditions of the Nguyen dynasty.

**—**  
""Who are some other figures in your country’s history known for combining artistic talent with academic achievement?""",2,1.0,1,2025-04-21 07:05:54,https://i.redd.it/hwaprfck05we1.jpeg,signsofheroes
VietNam,1k457v4,Suggestions for Unique dining/ experiences in HCM for wedding anniversary,"Hey lovely people! I have just landed in HCM with my partner. It’s our 4th wedding anniversary tomorrow and would like to do something unique and special. Please recommend some unique experiences in HCM or outstanding date night option. I was also thinking of going for a couple spa, please drop suggestions if any. Thank you 🙏",2,1.0,2,2025-04-21 04:36:59,https://www.reddit.com/r/VietNam/comments/1k457v4/suggestions_for_unique_dining_experiences_in_hcm/,Beba2706
VietNam,1k3q4nm,Reccomend old-school/classic Vietnamese songs.,"Because of my family, I have an affinity for older Vietnamese songs (no hate to V-pop, it's just not what I'm drawn to or used to). I'll just list a couple of my favorites.

Composers: Vũ Thành An Phụng Công Từ

Singers: Tuấn Ngọc Trần Thái Hoà",2,1.0,9,2025-04-20 16:15:47,https://www.reddit.com/r/VietNam/comments/1k3q4nm/reccomend_oldschoolclassic_vietnamese_songs/,Tsunami_Aureate
VietNam,1k3l4jt,Any update on Nho Que river? Ha Giang Loop,"Hi all, 
I am currently on the Ha Giang Loop tour. 
Supposed to go tomorrow to Nho Que which I have been longing for quite some time. 

My rider says some congestions going on Nho Que and we shouldnt go tomorrow. Showed me some reel of a heavy traffic jam at the downpass of Nho Que river. 

He’s convincing me to go to Bamboo floating river instead where he could possibly join me on it. Dont think that would be as impressive as Nho Que. 

can anyone please confirm this news of detours at Nho Que? Thanks",2,1.0,2,2025-04-20 12:08:45,https://www.reddit.com/r/VietNam/comments/1k3l4jt/any_update_on_nho_que_river_ha_giang_loop/,princeabbas2000
VietNam,1k3kv5f,Reunification Day in Hanoi,Will the stores be closed? We are planning to shop around Bà Triệu and also eat at some of the famous restaurants/food stalls. We’ll be there April 28-May 3,2,1.0,2,2025-04-20 11:53:05,https://www.reddit.com/r/VietNam/comments/1k3kv5f/reunification_day_in_hanoi/,framboiloulou
VietNam,1k3hru9,"What are your favorite old-school songs, singers, and music composers and why? (no modern V-pop please)","Because of my family, I have an affinity for older Vietnamese songs (no hate to V-pop, it's just not what I'm drawn to or used to). I'll just list a couple of my favorites.

Composers:
Vũ Thành An
Phụng Công Từ

Singers:
Tuấn Ngọc
Trần Thái Hoà",2,1.0,0,2025-04-20 08:08:45,https://www.reddit.com/r/VietNam/comments/1k3hru9/what_are_your_favorite_oldschool_songs_singers/,Tsunami_Aureate
VietNam,1k3e0fi,"Mình hỏi về việc mua hàng trên ebay, amazon, buyee, etc.","Mình muốn đặt hàng online trên buyee, nhưng mà thấy là trên 1 triệu thì sẽ phải đóng thuế nhập khẩu. Mấy dịch vụ này nó có kê khai rồi làm giúp phần thuế cho mình luôn không, hay là mình sẽ phải tự liên lạc với hải quan để đóng thuế? Nếu phải thì làm như thế nào ạ?",2,0.75,3,2025-04-20 03:57:03,https://www.reddit.com/r/VietNam/comments/1k3e0fi/mình_hỏi_về_việc_mua_hàng_trên_ebay_amazon_buyee/,Zestyclose-Sundae593
VietNam,1k2y0mx,Travel Insurance,"Hello, I am first time travelling out of vietnam as a vietnamese. 

Want to know what are your go to travel insurance you all buy?

  
I am going to Malaysia",2,1.0,4,2025-04-19 14:52:34,https://www.reddit.com/r/VietNam/comments/1k2y0mx/travel_insurance/,Honest-Leopard6646
VietNam,1k2wc32,Welcome!,,2,0.75,1,2025-04-19 13:32:01,/r/FilipinosinVietnam/comments/1jzh03k/welcome/,rmwatercolors
VietNam,1k2v7r3,Lost Passport in International Mail – Any Advice or Similar Experiences?,"Hi everyone,

I'm hoping someone here might have experienced something similar or can offer some guidance.

About a month ago, I had a newly issued European passport shipped to me while I was traveling in Vietnam. The passport was sent from Portugal with a tracking number. On the last tracking update, the letter passed through the UK on its way to Vietnam—but since then, there have been no further updates. Vietnam Post doesn't have the tracking number in their system.



So far, I've taken the following steps:

Contacted UK Border Force, in case the letter was intercepted at a postal import hub there.

Contacted Vietnam Customs, asking whether the item may be held or delayed on their end.

Contacted Portuguese Customs, in case the passport was never properly dispatched or got held up before leaving the country.


Filed an official complaint with CTT (Portugal's postal service) using the Livro Vermelho (their official complaint system).


The passport contains no visa or sensitive insert—just a standard new document—but I’m now in limbo with no clear idea where it is or who might have it. I’ve provided all relevant details, including the passport number, to the authorities mentioned above, and I'm currently waiting to hear back.

Has anyone else experienced a similar situation with an international passport shipment getting lost or stuck in transit between countries? Any tips or ideas on what to do next would be hugely appreciated.

Thanks in advance!",2,0.76,4,2025-04-19 12:32:03,https://www.reddit.com/r/VietNam/comments/1k2v7r3/lost_passport_in_international_mail_any_advice_or/,TagusIce
VietNam,1k2syc2,Digital Nomad Couple  - coming to VT for 40 days - Last week of May / All June. Where should we base ourselves?,"**Looking for Advice: Nha Trang vs. Da Nang (or maybe near Hoi An?) for Remote Working Couple in Our 40s**

Hey everyone,

I've gone down the Reddit rabbit hole and read pretty much everything I can find about Nha Trang and Da Nang, but I still have a few final questions I'd love some input on from the hive mind! 😊

We’re an Australian couple in our 40s, currently slow-traveling and working remotely (posting this from Sri Lanka!). We’re not on holiday in the traditional sense—we’re still working full-time while trying to build a healthy, sustainable lifestyle as we move around.

We’ll be leaving Sri Lanka soon (visa limits), and I’m looking at Vietnam as our next base—ideally for at least a month or two.

# What we’re looking for:

* A **quiet**, comfortable place to live and work
* A **solid daily routine** with a good gym, healthy food, and a bit of exploring
* Definitely **not into the party scene**—we’re 90% sober, so nightlife isn’t a priority
* Walkable area preferred, with access to cafes, gyms, and decent groceries

# Weather:

According to ChatGPT (and other sources), it sounds like **Nha Trang has better weather** this time of year, while **Da Nang can be hit or miss with rain**. That’s nudging me toward Nha Trang, but I’m open to being convinced otherwise.

# About Nha Trang / Da Nang:

* I keep reading about the ""Russian invasion"" in Nha Trang—kind of like the Dubai Marina or Bali vibes? If it’s just a lot of tourists and a few tired buildings, we can manage that.
* We’re *not* looking for beachfront luxury—just a **quality apartment in a quiet area**, near food and gyms.
* Any thoughts on avoiding buildings like Gold Coast or Panorama in Nha Trang? I’ve seen complaints about overcrowding, elevators, and disrepair—reminds me of some high-rise issues in Dubai.

# Also considering: somewhere just outside Hoi An?

Is this a viable option for remote work and daily gym access, or would it be too quiet / inconvenient?

**So my main question: Based on all this, where would you base yourself—Nha Trang, Da Nang, or near Hoi An? And which specific neighborhoods or buildings would you recommend for a quiet, health-focused lifestyle?**

\*\*Thanks to chatGPT for helping me clean up this post \*\*

  
\*\*Edit - I would have postedthis in the travel sticky but I can't find it \*\*  
 \---  Feel free to link it below",2,1.0,4,2025-04-19 10:06:20,https://www.reddit.com/r/VietNam/comments/1k2syc2/digital_nomad_couple_coming_to_vt_for_40_days/,xxmicxx
VietNam,1k2rz20,Motorbikes market HCM,"Does anyone knows motorbikes market in Saigon? Or WTG honda pcx 125 3rd gen? 
I did check fb and cho tot alrdy, just wanna know some other sources ",2,1.0,0,2025-04-19 08:53:55,https://www.reddit.com/r/VietNam/comments/1k2rz20/motorbikes_market_hcm/,Otherwise_Set9382
VietNam,1k2gk5p,Ha Giang Loop by Car for my elderly parents,"Hello, I've traveled around the Ha Giang Loop a couple times by motorbike and my parents are visiting Vietnam for their first time this November. I want to find a tour they can do the Ha Giang Loop in by car. Something more comfortable to accommodate their older age (72, 73).   
If someone could recommend tours they've been on for the Ha Giang Loop that would be amazing. Thank you. ",2,1.0,6,2025-04-18 21:46:30,https://www.reddit.com/r/VietNam/comments/1k2gk5p/ha_giang_loop_by_car_for_my_elderly_parents/,GoldStage4189
VietNam,1k2eox3,Finding a location and photographer to propose (Ninh Binh / Hanoi),"I plan to propose to my partner during our trip to Northern Vietnam in mid-May. She definitely wants candid photos and for the location to be in scenic nature, so I was thinking of asking the question in Ninh Binh. But I understand that might be far for a Hanoi-based photographer and that sudden heavy rain can interrupt, so I am also looking into places within Hanoi.

Does anyone have recommendations for photographers (English-speaking) and for scenic spots that aren’t too crowded?",2,1.0,1,2025-04-18 20:24:29,https://www.reddit.com/r/VietNam/comments/1k2eox3/finding_a_location_and_photographer_to_propose/,TortoisePopTart
VietNam,1k2cukm,12 days in Vietnam,"Does this sound feasible or is it too much? 

Day 1-2: Saigon / Ho Chi Minh (skipping Mekong delta tour)

Day 3: Da Nang - exploring beach, hiking, dragon show at night 

Day 4: Ba Na Hills for golden bridge (Mercure Hotel at Ba Na Hills - is it worth it to stay a night there?)

Day 5: Hoi An - coconut boat tour, tailoring, and hoi an at night for lantern city

Day 6: Hanoi in the morning and spend the day there then overnight train to sapa

Day 7: Sapa exploring all day then one overnight at hotel at Sapa - alpine ride, fansipan tour 

Day 8: spending all day at sapa (exploring city and resting at hotel/cat cat village) then overnight bus or overnight train back to Hanoi
  
Day 9: Hanoi in the morning and drive to ninh binh in the morning and stay overnight there 

Day 10: arrive in hanoi in the morning and drive to ninh binh to stay overnight or a day trip at ninh binh only and drive back to Hanoi at night and overnight at hanoi 

Day 11: drive from Hanoi to halong bay or ninh binh (if overnight at ninh binh) straight to halong bay over night cruise tour. Will be at halong bay around 11 AM for cruise overnight.

Day 12: finish at 12 PM from cruise tour and drive back to Hanoi around 3 PM - last minute exploring/ resting/ spa/ dinner/shopping then flight at 11:35 PM 

We are trying to do the most we can! Do you think this itinerary is okay? Should we stay in danang/hoi an/ ba na hills for only 2 days and not stay overnight at ba na hills so we can have more time in north Vietnam? Should we not do overnight at ba na hills and return to hoi an so we can have more time in north Vietnam or is this too rushed? What do you think? ",2,0.75,30,2025-04-18 19:04:45,https://www.reddit.com/r/VietNam/comments/1k2cukm/12_days_in_vietnam/,strawberrymilkx
VietNam,1k2c4qd,"Capella Hanoi vs. Sofitel Metropole Hanoi June 28-July 1, 2025","Hi Everyone,

I am trying decide what to do for stay June 28-July 1st. Deciding between booking two basic rooms at either Capella or Sofitel Opera Wing with FHR benefits. The Sofitel is cheaper, however, I am betting on hopefully getting upgraded to a basic Heritage room which on the website appears to be one category higher than the basic opera wing room. Has anyone heard of this happening?

The Capella is approximately 60 USD more per night. Worth it? Or Sofitel? Not sure what to do. Any advice would help.

For context, our stay in Hanoi will be the conclusion of a 3 week trip throughout Vietnam:

Other stays prior to arriving in Hanoi are:

\- Park Hyatt Saigon

\- Six Senses Ninh Van bay

\- Amanoi

\- Intercontinental Danang Sun Peninsula

\- Anantara Hoi An vs Four Seasons Nam Hai

\- Azerai La Residences Hue

\- Deciding on staying overnight in the middle of our stay in Hanoi to stay at Tam Coc Garden (June 29-30 whilst Hanoi stay is 6/28-7/1) to visit Ninh Binh rather than an exhausting day trip \*this is why Stay 3 Pay 2 at Capella is a bit more enticing, yet still cheaper than paying the nightly rate at Sofitel. Hence my confusion on which way to go about this.

Thanks in Advance everyone",2,1.0,5,2025-04-18 18:34:22,https://www.reddit.com/r/VietNam/comments/1k2c4qd/capella_hanoi_vs_sofitel_metropole_hanoi_june/,Real-Tower8037
VietNam,1k286ul,Best location to stay in Hanoi,"Hi all, i love old quarters but i don't like the local hotels there. Most are old and small buildings. Even if they did refurbishment or renovation, most did not do much upgrade with drainage. 

Where's the next best location that's closest to old quarters and have a better quality room?

Thanks",2,1.0,9,2025-04-18 15:49:37,https://www.reddit.com/r/VietNam/comments/1k286ul/best_location_to_stay_in_hanoi/,KingJimmyJoe
VietNam,1k24ovt,Where will the april 30 th reunification day event in hcmc Take place? What time?,Sorry for my ignorance. Where will the april 30 th reunification day event in hcmc Take place? What time?  Thanks ,2,1.0,2,2025-04-18 13:16:34,https://www.reddit.com/r/VietNam/comments/1k24ovt/where_will_the_april_30_th_reunification_day/,Complete_Effective26
VietNam,1k22ma9,"I Regretted Signing Up, but the Gym Is Keeping My Deposit for 90 Days","
I recently went to California Fitness for what they advertised as a free 30-day trial.

But when I arrived, I didn’t get to try anything. Instead, I was sat down and sold to for the entire session by a staff member. They told me to come back the next day for a “free personal training” session to try things out properly.

On the second day, I went for what I thought was just a trial PT session. The trainer reassured me there would be no sales. But after the session, a staff member sat me down and tried to sell me a 24-month membership installment plan. I refused, clearly said I wasn’t ready — then they brought out another staff member to pressure me again.

After intense pressure, I caved and gave a 6 million VND deposit, thinking I’d just go home and cancel if I felt unsure.

But when I tried to cancel (the same evening), they said I needed to do it in person. When I returned, they told me no refunds, and offered to convert the deposit into 8 PT sessions instead. They also claimed they had already opened a loan for me with Sacombank before 7PM — even though I hadn’t signed anything for that.

Eventually, after more pushing, they said they’d refund my money — but it would take 90 days.

I’ve received zero services, signed nothing with the bank, and now my money is being held hostage for 3 months. I feel tricked.

Is this legal in Vietnam? Has anyone experienced something similar? What can I do to get my money back sooner?",2,1.0,2,2025-04-18 11:27:11,https://www.reddit.com/r/VietNam/comments/1k22ma9/i_regretted_signing_up_but_the_gym_is_keeping_my/,Tab_brickyPh
VietNam,1k22fcv,What are the best online guides/YouTube channels to learn Vietnamese pronunciation,"What are the best online guides or really thorough channels to learn Vietnamese pronunciation? Preferably with thorough explanations, throat movement diagrams, examples from other languages, good explanations etc",2,1.0,3,2025-04-18 11:15:47,https://www.reddit.com/r/VietNam/comments/1k22fcv/what_are_the_best_online_guidesyoutube_channels/,ZestyclosePicture252
VietNam,1k1snf9,Chả ốc in HCMC?,"Wondering if there are any spots that sell any of the following in Saigon:

Chả ốc
Chả Cá Trứng Bắc Thảo
Chả Ram Bắp

Thanks!",2,1.0,1,2025-04-18 00:59:56,https://www.reddit.com/r/VietNam/comments/1k1snf9/chả_ốc_in_hcmc/,TheCheeseVoider
