subreddit,post_id,title,content,score,upvote_ratio,num_comments,created_at,url,author
news,1jpdgj9,"Susan Crawford wins Wisconsin Supreme Court race, defying Elon Musk",,97627,0.94,2371,2025-04-02 02:06:25,https://www.nbcnews.com/politics/elections/wisconsin-supreme-court-election-results-rcna198353,IMSLI
news,1jjom7u,"As top Trump aides sent texts on Signal, flight data show a member of the group chat was in Russia",,91548,0.94,2092,2025-03-25 17:14:12,https://www.cbsnews.com/news/trump-envoy-steve-witkoff-signal-text-group-chat-russia-putin/,evissimus
news,1k2d6qa,Judge blocks administration from deporting noncitizens to 3rd countries without due process,,67064,0.94,1687,2025-04-18 19:19:22,https://abcnews.go.com/US/judge-blocks-administration-deporting-noncitizens-3rd-countries-due/story?id=120951918,Reiketsu_Nariseba
news,1jpfwg4,"Actor Val Kilmer, star of 'Batman Forever', dies at 65",,57836,0.94,2382,2025-04-02 04:04:21,https://www.reuters.com/world/us/actor-val-kilmer-star-batman-forever-dies-65-nyt-reports-2025-04-02/,jstehlick
news,1jwyvvi,Luigi Mangione defense asks judge to block death penalty in CEO slay case,,55528,0.95,238,2025-04-11 19:51:37,https://www.cnbc.com/2025/04/11/luigi-mangione-death-penalty-brian-thompson-case.html,ChooseRecuse
news,1k485d6,"Pope Francis has died, Vatican says in video statement",,54875,0.94,1255,2025-04-21 08:01:56,https://www.reuters.com/world/pope-francis-has-died-vatican-says-video-statement-2025-04-21/,randy88moss
news,1jl63ad,Yale professor who studies fascism fleeing US to work in Canada,,53019,0.91,1708,2025-03-27 15:06:58,https://www.theguardian.com/us-news/2025/mar/26/yale-professor-fascism-canada?CMP=Share_AndroidApp_Other,No_Kangaroo_2428
news,1jjsoal,Pentagon warned staffers against using Signal before White House chat leak,,52966,0.96,1115,2025-03-25 19:58:09,https://www.theguardian.com/us-news/2025/mar/25/signal-app-leaked-war-plans,korkythecat333
news,1jwn062,US fires Greenland military base chief for 'undermining' JD Vance,,52136,0.94,2654,2025-04-11 10:55:06,https://bbc.com/news/articles/creq99l218do,arrakis2020
news,1jz55kn,President of El Salvador says he won't return mistakenly deported man to U.S.,,52113,0.93,5000,2025-04-14 17:50:36,https://www.nbcnews.com/news/rcna201136,DushiPunda
news,1k4kxhw,Trans pilot falsely blamed in Potomac plane crash sues conservative influencer,,51959,0.9,735,2025-04-21 18:35:29,https://www.nbcnews.com/nbc-out/out-news/trans-pilot-falsely-blamed-potomac-plane-crash-sues-conservative-influ-rcna200474,KarateKid917
news,1jod9wq,SEC continuing $150 million lawsuit against Elon Musk over Twitter purchase,,50825,0.95,769,2025-03-31 20:29:32,https://abcnews.go.com/US/sec-continuing-150-million-lawsuit-elon-musk-twitter/story?id=120343524,Aggravating_Money992
news,1jm8mql,Elon Musk sued by Wisconsin attorney general ahead of state election - CBS Minnesota,,50708,0.96,735,2025-03-28 23:20:10,https://www.cbsnews.com/minnesota/video/elon-musk-sued-by-wisconsin-attorney-general-ahead-of-state-election/,dragonmom1971
news,1jzy5bh,Ice deports Venezuelan teen despite reportedly knowing he was not a target,,49155,0.93,2014,2025-04-15 17:44:13,https://www.theguardian.com/us-news/2025/apr/15/merwil-gutierrez-venezuelan-teen-deported-el-salvador,Rabidennui
news,1k1tb4q,US Senator Van Hollen says he met wrongly deported man in El Salvador,,46884,0.92,2079,2025-04-18 01:34:21,https://www.reuters.com/world/americas/us-senator-van-hollen-says-he-met-wrongly-deported-man-el-salvador-2025-04-18/,reallylatetotheparty
news,1jlv009,ICE detains University of Alabama doctoral student as government's college crackdown continues,,46675,0.93,2574,2025-03-28 13:24:35,https://www.nbcnews.com/news/us-news/university-alabama-doctoral-student-detained-ice-governments-college-c-rcna198320,apple_kicks
news,1jth1lv,U.S. sent 238 migrants to Salvadoran mega-prison; documents indicate most have no apparent criminal records,,45698,0.88,2977,2025-04-07 09:18:32,https://www.cbsnews.com/news/what-records-show-about-migrants-sent-to-salvadoran-prison-60-minutes-transcript/,LadyMadonna_x6
news,1joy4f8,DOJ to seek death penalty for Luigi Mangione in CEO murder case,,44968,0.91,3933,2025-04-01 15:16:30,https://www.cnbc.com/2025/04/01/luigi-mangione-death-penalty-brian-thompson.html,Ok_Ant707
news,1jpz95n,"Trump announces sweeping new tariffs to promote US manufacturing, risking inflation and trade wars",,44639,0.92,7427,2025-04-02 20:41:37,https://apnews.com/article/trump-tariffs-liberation-day-2a031b3c16120a5672a6ddd01da09933,hoosakiwi
news,1jt20o2,Chinese woman detained by US border patrol in Arizona dies by suicide,,43822,0.95,1393,2025-04-06 19:17:06,https://www.theguardian.com/us-news/2025/apr/06/chinese-woman-border-patrol-arizona-suicide,Aggravating_Money992
news,1jkbwnz,Trump signs election order calling for proof of U.S. citizenship to vote,,43162,0.91,8556,2025-03-26 13:34:57,https://www.reuters.com/world/us/trump-signs-election-order-calling-proof-us-citizenship-vote-2025-03-26/,Ok-Present5699
news,1jk9w5e,"Exclusive: DOGE staffer, 'Big Balls', provided tech support to cybercrime ring, records show",,40445,0.95,806,2025-03-26 11:50:46,https://www.reuters.com/world/us/doge-staffer-big-balls-provided-tech-support-cybercrime-ring-records-show-2025-03-26/?utm_source=reddit.com,iambarrelrider
news,1k3z8xd,"Defense chief Hegseth shared war plans in second Signal chat, NYT reports",,40188,0.95,1099,2025-04-20 23:16:51,https://www.reuters.com/world/us/defense-chief-hegseth-shared-war-plans-second-signal-chat-nyt-reports-2025-04-20,A-CommonMan
news,1jywb0b,Fears over extremism in US military as soldier revealed as neo-Nazi TikTok follower,,39772,0.92,1366,2025-04-14 11:14:25,https://www.theguardian.com/us-news/2025/apr/14/us-military-extremism-the-base,Aggravating_Money992
news,1jj03a9,Top US officials appeared to message a journalist Houthi strike plans,,37510,0.95,1323,2025-03-24 19:53:07,https://www.bbc.com/news/articles/cy4v3ndg28jo,SocraticTiger
news,1jvyp0m,Florida teacher loses job for calling student by ‘preferred’ name,,37450,0.92,2481,2025-04-10 14:03:24,https://www.clickorlando.com/news/local/2025/04/09/florida-teacher-loses-job-for-calling-student-by-preferred-name/,Hrekires
news,1jpa2ks,Sen. Cory Booker’s speech in protest of Trump breaks the Senate record,,37424,0.95,615,2025-04-01 23:23:28,https://apnews.com/live/donald-trump-news-updates-4-1-2025,brackenish1
news,1jz7w51,US sees biggest drop in Australian visitors since Covid as travellers avoid Trump’s America,,37317,0.96,1343,2025-04-14 19:38:57,https://www.theguardian.com/australia-news/2025/apr/15/us-sees-biggest-drop-in-australian-visitors-since-covid-as-travellers-avoid-trumps-america,Aggravating_Money992
news,1jo7n0i,"China, Japan, South Korea will jointly respond to US tariffs, Chinese state media says",,36671,0.95,1835,2025-03-31 16:41:06,https://www.reuters.com/world/china-japan-south-korea-will-jointly-respond-us-tariffs-chinese-state-media-says-2025-03-31/,Loud-Ad-2280
news,1k0y4ko,US IRS planning to rescind Harvard's tax-exempt status,,36434,0.95,3354,2025-04-16 23:03:21,https://www.reuters.com/world/us/us-irs-planning-rescind-harvards-tax-exempt-status-cnn-reports-2025-04-16/,cccdddyyy
news,1k571mo,"Info Pete Hegseth shared with wife, brother came from top general's secure messages",,39720,0.95,878,2025-04-22 14:01:09,https://www.nbcnews.com/politics/national-security/info-hegseths-yemen-signal-texts-came-generals-secure-messages-rcna198838,rapidcreek409
news,1jmvzmp,White House Correspondents’ Association cancels plans to have a comedian headline annual dinner,,35819,0.94,2280,2025-03-29 20:53:57,https://www.cnn.com/2025/03/29/media/white-house-correspondents-association-dinner-comedian/index.html,leftnotracks
news,1ju2x5n,Trump administration fires senior Navy female officer at NATO. She appeared on a 'woke' list,,35805,0.95,1153,2025-04-08 02:19:12,https://apnews.com/article/pentagon-hegseth-trump-dei-chatfield-nato-23df15b59766458d106567ba782d2f15,Ok-Lets-Talk-It-Out
news,1k2vovv,American born doctor receives email from immigration officials telling her to leave the country immediately,,35711,0.94,1594,2025-04-19 12:58:26,https://www.nbcnews.com/news/rcna201698,brokebacknomountain
news,1jqg810,U.S. tourist arrested after bringing a handgun into Japan,,35574,0.95,2014,2025-04-03 11:44:03,https://www.japantimes.co.jp/news/2025/04/02/japan/crime-legal/us-tourist-gun-japan/,lilnako
news,1jva4r9,China orders its banks to reduce US dollar purchases.,,34969,0.96,1334,2025-04-09 16:32:30,https://www.reuters.com/world/china/chinas-central-bank-asks-state-lenders-reduce-dollar-purchases-sources-say-2025-04-09/,Aakash7aak
news,1jkkgi5,Person in Ohio dies of rabies after contracting virus from organ transplant,,34477,0.97,2167,2025-03-26 19:33:33,https://www.whio.com/news/local/person-dies-rabies-after-contracting-virus-organ-transplant/HMS5STBDHZESJJ7FU6464OMN3I/,Ericovich
news,1k0tvf8,"Trump administration plans to end the IRS Direct File program for free tax filing, AP sources say",,34434,0.96,1637,2025-04-16 20:00:08,https://apnews.com/article/irs-direct-file-tax-returns-free-trump-4bb0bca02fab9b3d06ae6f45ac67b7ab,dirtywang
news,1jzg7jz,Trump officials cut billions in Harvard funds after university defies demands | Trump administration,,34255,0.95,1805,2025-04-15 01:53:29,https://www.theguardian.com/us-news/2025/apr/14/trump-harvard-funding-freeze,secretsofmagick
news,1jo04q9,Marine Le Pen is barred from seeking public office for embezzlement,,33688,0.96,890,2025-03-31 10:35:14,https://apnews.com/article/marine-le-pen-france-far-right-trial-verdict-f3da0614e9a6fc24c87eb33d5b873409,HellYeahDamnWrite
news,1jnresl,Wisconsin Supreme Court rejects effort to block Musk's $1M giveaways,,32795,0.93,1415,2025-03-31 00:56:43,https://abcnews.go.com/US/wisconsin-supreme-court-rejects-effort-block-musks-1m/story?id=120319945,Large_Squirrel1446
news,1jxrtde,US measles cases surpass 700 with outbreaks in six states.,,32459,0.96,1589,2025-04-12 21:24:52,https://apnews.com/article/measles-outbreak-texas-rfk-new-mexico-kansas-vaccine-e904ec9781f1d164c73afe4ab71774fe,Tracker-man
news,1jrk2fx,Federal judge rules return of Maryland man mistakenly deported to El Salvador prison,,32444,0.96,1040,2025-04-04 19:14:19,https://www.theguardian.com/us-news/2025/apr/04/maryland-deported-el-salvador-kilmar-abrego-garcia,Aggravating_Money992
news,1jl2syg,US honeybee deaths hit record high as scientists scramble to find main cause,,32400,0.96,2152,2025-03-27 12:31:50,https://www.theguardian.com/us-news/2025/mar/25/honeybees-deaths-record-high,b0sscrab
news,1jsqsa1,"Doge’s attack on social security causing ‘complete, utter chaos’, staff says | US social security",,32233,0.95,1072,2025-04-06 10:03:23,https://www.theguardian.com/us-news/2025/apr/06/musk-doge-social-security,ThatShoomer
news,1juey6e,Brussels police arrest US State Secretary Rubio's bodyguard,,30403,0.97,787,2025-04-08 14:30:02,https://www.brusselstimes.com/brussels/1526014/brussels-police-arrest-us-state-secretary-rubios-bodyguard-tbtb,LadyMadonna_x6
news,1js66yq,5 nurses who work on the same floor at Massachusetts hospital have brain tumors,,30097,0.97,1421,2025-04-05 15:37:48,https://www.nbcnews.com/news/rcna199798,IsilmeCalithil
news,1k39nva,Officers who attended Jan. 6 rally ask Supreme Court to keep identities anonymous,,29693,0.95,622,2025-04-19 23:49:12,https://abcnews.go.com/US/wireStory/seattle-officers-attended-jan-6-rally-us-supreme-120979630,StupendousMan1995
news,1jnaqpo,Satanist leader’s attempt to hold Black Mass in Kansas Statehouse sparks chaos and 4 arrests,,29606,0.95,2271,2025-03-30 11:49:34,https://www.cnn.com/2025/03/29/us/kansas-satanist-protest-arrests-hnk/index.html,Zen1
news,1k4jkdb,"Dow tumbles more than 1,000 points and dollar hits three-year low",,29295,0.97,1692,2025-04-21 17:42:21,https://www.cnn.com/2025/04/21/investing/us-stock-market/index.html,Warcraft_Fan
news,1k1fr6v,"2 Defense Department officials, including senior adviser to Pete Hegseth, put on leave amid leak investigation",,28976,0.97,486,2025-04-17 15:34:49,https://www.cbsnews.com/news/dan-caldwell-pentagon-leak-investigation-on-leave/,LadyMadonna_x6
news,1jv678m,Trump tariffs spark US government debt sell-off,,28876,0.96,1891,2025-04-09 13:47:27,https://www.bbc.com/news/articles/c5yrr0e7499o,CommonRagwort
news,1jm6dhu,Elon Musk's xAI buys social media platform X for $45 billion,,28557,0.93,3593,2025-03-28 21:37:57,https://www.reuters.com/markets/deals/musks-xai-buys-social-media-platform-x-45-billion-2025-03-28/,DeepestWinterBlue
news,1jm2shr,Woman Arrested After Miscarriage In Georgia Under Abortion Law,,28221,0.94,1779,2025-03-28 19:03:23,https://thegeorgiasun.com/news/woman-arrested-after-miscarriage-in-georgia-under-abortion-law/,johnboy43214321
news,1k1hl3l,Active shooter reported on Florida State University campus,,27861,0.95,2557,2025-04-17 16:49:40,https://www.cnn.com/2025/04/17/us/florida-state-university-active-shooter/index.html,shaggyhairjayy
news,1jmc643,Elon Musk must face Twitter shareholders’ lawsuit over alleged securities fraud,,27550,0.98,361,2025-03-29 02:17:38,https://www.cnbc.com/2025/03/28/elon-musk-must-face-twitter-shareholders-lawsuit-over-alleged-securities-fraud.html,jackytheblade
news,1k1n5bw,US FDA suspends food safety quality checks after staff cuts,,27501,0.96,1709,2025-04-17 20:41:06,https://www.reuters.com/world/us/us-fda-suspends-food-safety-quality-checks-after-staff-cuts-2025-04-17/,Skabomb
news,1jzy81r,Whistleblower org says DOGE may have caused ‘significant cyber breach’ at US labor watchdog,,26095,0.97,444,2025-04-15 17:47:18,https://www.reuters.com/technology/cybersecurity/whistleblower-org-says-doge-may-have-caused-significant-cyber-breach-us-labor-2025-04-15/,apple_kicks
news,1jud42u,"Chinese soldiers captured fighting alongside Russians in Ukraine, says Zelenskyy",,25810,0.91,763,2025-04-08 13:06:55,https://www.abc.net.au/news/2025-04-08/zelenskyy-claims-army-has-captured-chinese-soldiers-in-ukraine/105153948?utm_source=abc_news_app&utm_medium=content_shared&utm_campaign=abc_news_app&utm_content=other,Party_Storage_9147
news,1jqlttj,"Man says son was stabbed in the heart at high school track meet, died in twin's arms",,25817,0.95,300,2025-04-03 15:43:48,https://www.nbcdfw.com/news/local/student-stabbed-frisco-track-meet/3806667/,Nmasse
news,1jya2yz,DHS Mistakenly tells attorney US Citizen to leave the US,,25807,0.95,1031,2025-04-13 15:21:33,https://www.nbcboston.com/news/local/massachusetts-immigration-attorney-dhs-parole-termination/3684504/,HazyDavey68
news,1jqwm5v,Mehmet Oz confirmed by US Senate to lead Medicare and Medicaid,,25545,0.9,2484,2025-04-03 22:44:36,https://www.theguardian.com/us-news/2025/apr/03/mehmet-oz-confirmation-medicare-medicaid,CupidStunt13
news,1joyu2s,"Alabama can’t prosecute groups who help women travel to get an abortion, federal judge says",,24920,0.98,250,2025-04-01 15:45:26,https://www.cnn.com/2025/04/01/us/alabama-abortion-groups-ruling/index.html,AudibleNod
news,1jtyz6v,Supreme Court allows Trump to enforce Alien Enemies Act for rapid deportations for now,,24794,0.95,1262,2025-04-07 23:03:39,https://edition.cnn.com/2025/04/07/politics/supreme-court-deportation-flights-trump/index.html,hoosakiwi
news,1k1pvl9,Luigi Mangione indicted on federal charges for CEO killing,,24721,0.96,2078,2025-04-17 22:42:23,https://abcnews.go.com/US/luigi-mangione-indicted-federal-charges-ceo-killing/story?id=120928265,scotttrillgrim
news,1jturi9,Chief Justice Roberts pauses deadline for return of Maryland man mistakenly deported to El Salvador,,24595,0.95,1405,2025-04-07 20:01:21,https://apnews.com/article/supreme-court-trump-deportation-salvador-maryland-40136c5aa844b6c12ba20ee67ab4df9a,LordEdubbz
news,1jveszn,"Kash Patel removed as acting ATF director, replaced by Army Secretary",,23981,0.96,776,2025-04-09 19:42:31,https://www.reuters.com/world/us/kash-patel-removed-acting-atf-director-replaced-by-army-secretary-sources-say-2025-04-09/,DefiThrowaway
news,1jzd0ty,Columbia Activist Arrested by ICE at His Appointment for Citizenship,,23974,0.96,916,2025-04-14 23:18:26,https://www.nytimes.com/2025/04/14/nyregion/columbia-student-palestinian-arrested-ice.html?unlocked_article_code=1._k4.cex1.lATs6MwweUmU&smid=nytcore-ios-share&referringSource=articleShare,GeneralPatten
news,1jn32wr,Wisconsin appeals court won't stop Musk's $1 million payments to voters after attorney general sues,,23686,0.95,703,2025-03-30 02:48:38,https://apnews.com/article/wisconsin-supreme-court-musk-million-dollar-checks-43fa79215e16c333a1079a86cb9aab08,Agreeable_Stable8906
news,1jjlazi,"After living in the US for 35 years and raising 3 citizens, these parents got deported to Colombia. Their kids want them back",,23566,0.88,1698,2025-03-25 14:56:55,https://www.cnn.com/2025/03/24/us/colombia-immigrants-deported/index.html,madukfan
news,1k39l69,Indonesian student detained by Ice after US secretly revokes his visa,,23428,0.96,835,2025-04-19 23:45:19,https://www.theguardian.com/us-news/2025/apr/19/aditya-wahyu-harsono-immigration-indonesia,SnowFallIcy
news,1jqyzmi,RFK Jr. says 20% of health agency layoffs could be mistakes,,22888,0.96,990,2025-04-04 00:33:47,https://www.cbsnews.com/news/rfk-jr-hhs-job-cuts-doge-mistakes/,errantv
news,1jq1hu6,John Oliver faces defamation lawsuit from US healthcare executive | US healthcare,,22532,0.97,1142,2025-04-02 22:13:47,https://www.theguardian.com/us-news/2025/apr/02/john-oliver-defamation-lawsuit-healthcare,kaifilion
news,1jjacfj,US Postal Service chief DeJoy steps down,,22467,0.97,1014,2025-03-25 03:33:45,https://www.reuters.com/world/us/us-postal-chief-dejoy-stepping-down-immediately-2025-03-24/,alwaysshredready
news,1jweiht,Carnegie Mellon student with one semester left learns his visa was revoked with no explanation,,22222,0.96,638,2025-04-11 01:40:38,https://www.cbsnews.com/pittsburgh/news/carnegie-mellon-student-visa-revoked-interview/,Hrekires
news,1jrlaip,"Woman, 20, sentenced for false rape report that jailed innocent man for a month",,22007,0.93,1154,2025-04-04 20:05:48,https://local12.com/news/nation-world/anjela-borisova-urumova-woman-sentenced-for-false-rape-report-that-jailed-innocent-man-month-sexual-violence-bucks-county-correctional-facility-worst-crimes-criminal-activity-claims-evaluation-falsification-physical-evidence-mental-health-evaluation,realKevinNash
news,1jmw1qd,Protests hit Tesla dealerships across the world in challenge to Elon Musk,,21994,0.96,546,2025-03-29 20:56:39,https://www.theguardian.com/world/2025/mar/29/tesla-protests-elon-musk-doge,jackytheblade
news,1jrc3fa,Comedian Russell Brand charged with rape,,21320,0.95,1205,2025-04-04 13:38:07,https://www.bbc.co.uk/news/articles/c0457d02e9go,unleashthetea
news,1k2hlvm,Undocumented Immigrant Faces Decades In Prison After Breaking ICE Officer's Nose During Arrest,,21028,0.93,1542,2025-04-18 22:34:52,https://www.latintimes.com/undocumented-immigrant-faces-decades-prison-after-breaking-ice-officers-nose-during-arrest-581132,Aggravating_Money992
news,1k4u8n4,RFK Jr.'s autism study to amass medical records of many Americans,,21779,0.96,1899,2025-04-22 01:20:47,https://www.cbsnews.com/news/rfk-jr-autism-study-medical-records/,tsagdiyev
news,1k2pi9t,US Supreme Court orders temporary halt to deportations of Venezuelan migrants,,20927,0.97,610,2025-04-19 05:58:04,https://www.reuters.com/world/us/venezuelan-migrants-told-imminent-deportation-under-us-wartime-law-2025-04-18/,PM_ME_YOUR_AIRCRAFT
news,1jj2f58,Oscar-winning Palestinian director attacked by Israeli settlers and arrested,,19655,0.91,864,2025-03-24 21:24:58,https://www.theguardian.com/world/2025/mar/24/oscar-winning-palestinian-director-attacked-by-israeli-settlers-and-arrested,Loud-Ad-2280
news,1jtlin6,Elon Musk's X to clamp down on parody accounts,,19650,0.92,1758,2025-04-07 13:41:39,https://www.bbc.com/news/articles/c4g37elkrxdo,Aggravating_Money992
news,1jwmf4l,Rep. Marjorie Taylor Greene bought stocks hit hard by Trump tariffs during the market meltdown,,19501,0.98,482,2025-04-11 10:16:02,https://apnews.com/article/greene-stocks-conflicts-interest-restoration-hardware-tariffs-trump-f9922a970c837cb76dd8ddc01f20f51d,DepartmentStrange41
news,1jrmjpf,U.S. Peace Corps says Musk's DOGE has arrived at its HQ,,19229,0.97,965,2025-04-04 20:59:44,https://www.reuters.com/world/us/us-peace-corps-says-musks-cost-cutting-team-has-arrived-its-hq-2025-04-04/,Internal_Atmosphere
news,1jm98vh,Trump signs order ending union bargaining rights for wide swaths of federal employees,,19137,0.97,1186,2025-03-28 23:49:22,https://www.npr.org/2025/03/28/nx-s1-5343474/trump-collective-bargaining-unions-federal-employees,Sidarthus89
news,1k4p3ey,"Student loans in default to be referred to debt collection, Education Department says",,19102,0.96,1842,2025-04-21 21:24:03,https://apnews.com/article/student-loan-debt-default-collection-fa6498bf519e0d50f2cd80166faef32a,stubborn_facts
news,1jvbia7,Trump announces 90 day tariff pause,,18810,0.95,1855,2025-04-09 17:28:45,https://www.cnbc.com/2025/04/09/trump-announces-90-day-tariff-pause-for-at-least-some-countries.html,thegree2112
news,1juobid,'Time for you to abandon the United States': Asylum seekers who used app being told to leave,,18213,0.95,804,2025-04-08 20:54:53,https://www.cbc.ca/news/world/us-migration-app-removals-1.7504556,Rya_Bz
news,1jotcux,"Layoffs begin at US health agencies charged with tracking disease, researching, regulating food",,18085,0.97,675,2025-04-01 11:34:22,https://apnews.com/article/health-human-services-layoffs-restructuring-rfk-jr-ec4d7731695e4204970c7eab953b2289,s0free03
news,1jlcmj9,NY county clerk refuses to file Texas' fine for doctor accused of prescribing abortion pills,,17704,0.97,594,2025-03-27 20:23:03,https://apnews.com/article/abortion-pills-lawsuit-texas-new-york-carpenter-e97d5c38d9429083d03c2a7b385cbbfd,house-tyrell
news,1jzzezg,Funeral to be held for Idaho teen with autism shot 9 times by police in his yard,,17592,0.97,706,2025-04-15 18:34:57,https://www.nbcnews.com/news/us-news/funeral-held-idaho-teen-autism-shot-9-police-yard-rcna201360,BeckwithLBP
news,1jrzecd,"Elon Musk's DOGE teams cut critical funding from America's libraries, officials say",,17479,0.96,477,2025-04-05 09:09:10,https://www.cbsnews.com/news/elon-musk-doge-cuts-libraries/,Aggravating_Money992
news,1jz7mlt,"U.S. businesses sue to block Trump tariffs, say trade deficits are not an emergency",,17398,0.98,422,2025-04-14 19:28:16,https://www.cnbc.com/2025/04/14/us-businesses-sue-to-block-trump-tariffs-say-trade-deficits-are-not-an-emergency.html,kaizhu256
news,1jw1jzt,"USDA to close down DC headquarters, lay off thousands of workers: report",,17363,0.97,1233,2025-04-10 16:05:02,https://www.fox5dc.com/news/usda-close-down-dc-headquarters-lay-off-thousands-workers-report,Specialist_Heron_986
news,1jkmn4b,"Turkish student at Tufts University detained, video shows masked people handcuffing her",,17035,0.97,974,2025-03-26 21:03:26,https://apnews.com/article/tufts-student-detained-massachusetts-immigration-6c3978da98a8d0f39ab311e092ffd892,AwkwardTickler
news,1jiob6e,Woman says United Airlines crew tried to make her remove son's ventilator,,16592,0.96,978,2025-03-24 11:22:33,https://www.nbcnews.com/news/us-news/woman-united-airlines-crew-tried-make-remove-sons-ventilator-rcna197695,bighootay
news,1jrda3l,USA Fencing disqualifies athlete for refusing to compete against transgender woman,,16540,0.88,1047,2025-04-04 14:30:16,https://abcnews.go.com/US/usa-fencing-disqualifies-stephanie-turner-refusing-fence-transgender/story?id=120462854,DealEye9
news,1jyk9mc,"Wisconsin teen allegedly killed parents in extremist plot to assassinate Trump, FBI says",,16505,0.94,1290,2025-04-13 22:49:18,https://abcnews.go.com/US/wisconsin-teen-allegedly-killed-parents-extremist-plot-assassinate/story?id=120750496,AudibleNod
news,1jz8e2c,Harvard University rejects Trump administration's proposed conditions for federal funding,,16489,0.98,554,2025-04-14 19:59:16,https://www.cbsnews.com/boston/news/harvard-university-trump-federal-funding/,1Rab
news,1k5gv9k,Sarah Palin loses retrial of defamation case against New York Times,,25520,0.97,603,2025-04-22 20:37:09,https://www.theguardian.com/us-news/2025/apr/22/sarah-palin-loses-defamation-nyt-retrial,Aggravating_Money992
news,1k1numu,U.S.-born man held for ICE under Florida’s new anti-immigration law • Oklahoma Voice,,16065,0.97,610,2025-04-17 21:11:05,https://oklahomavoice.com/2025/04/17/u-s-born-man-held-for-ice-under-floridas-new-anti-immigration-law/,sabrenation81
news,1jt7gb5,CNN: Kennedy arrives in Texas after a second unvaccinated child dies of measles amid the state’s outbreak,,15547,0.97,678,2025-04-06 23:25:33,https://www.cnn.com/2025/04/06/health/measles-texas-second-child-dies/index.html,Ironworker977
news,1jkbt2y,The Atlantic publishes additional trove of Signal messages with details of Yemen strike,,15478,0.98,469,2025-03-26 13:30:10,https://www.cnn.com/2025/03/26/politics/the-atlantic-publishes-signal-messages-yemen-strike/index.html,Narwal10444
news,1jzyhg3,‘Treated like a criminal': US citizen says he was detained returning from Canada,,15104,0.97,964,2025-04-15 17:57:49,https://nbcnewyork.app.link/UHX2TktOASb,thejerseyguy
news,1jko0ua,"Trump places 25% tariff on imported autos, expecting to raise $100 billion in tax revenues",,14970,0.93,2786,2025-03-26 22:01:59,https://apnews.com/article/autos-tariffs-trump-tax-imports-ford-gm-e53823ef7bbb7b3c46d11eca90aaa638,JRockPSU
news,1jugemp,"US Justice Dept disbands crypto enforcement team, citing Trump order",,14875,0.97,430,2025-04-08 15:30:45,https://www.reuters.com/world/us/us-justice-dept-disbands-cryptocurrency-enforcement-unit-2025-04-08/,sillysalmonella87
