subreddit,post_id,title,content,score,upvote_ratio,num_comments,created_at,url,author
technology,1jil0dc,Amazon ends little-used privacy feature that let Echo users opt out of sending recordings to company,,224,0.91,55,2025-03-24 07:15:38,https://apnews.com/article/amazon-privacy-echo-7fb3c19fa7f664bde5c5be259f8b23ee,Majano57
technology,1jw3x52,Apple quickly shipped 600 tons of iPhones to ‘beat’ the new tariffs,,227,0.91,78,2025-04-10 17:43:15,https://www.theverge.com/news/646666/iphones-india-shipments-tariffs,Knightbear49
technology,1jt3k1t,"CISA to make comprehensive staff cuts in coming days, people familiar say",,222,0.91,31,2025-04-06 20:23:33,https://www.nextgov.com/people/2025/04/cisa-make-comprehensive-staff-cuts-coming-days-people-familiar-say/404320/,lurker_bee
technology,1jjk785,Napster pioneered music sharing over 25 years ago. It just got bought for $207 million,,221,0.93,76,2025-03-25 14:08:09,https://www.cnbc.com/2025/03/25/napster-pioneered-music-sharing-25-years-ago-bought-for-207-million-.html,ThatPatelGuy
technology,1k0lg3a,Thousands report Spotify problems around the world,,218,0.91,62,2025-04-16 14:13:49,https://www.bbc.com/news/articles/cde2rz199y5o,Lotr_fan1995
technology,1jplt06,Google’s AI feature on hold in most EU member states due to ‘strict rules’,,219,0.93,19,2025-04-02 11:01:09,https://www.euronews.com/next/2025/04/01/googles-ai-feature-on-hold-in-most-eu-member-states-due-to-strict-rules,serene_sketch
technology,1jw8qdf,Teachers are using AI to make literature easier for students to read. This is a terrible idea.,,222,0.9,42,2025-04-10 21:02:54,https://www.bostonglobe.com/2025/04/08/opinion/ai-classroom-teaching-reading/,ubcstaffer123
technology,1jq4h4i,First-party Switch 2 games—including re-releases—all run either $70 or $80 | All Nintendo titles see an increase from the $60 Switch 1 status quo.,,216,0.9,167,2025-04-03 00:28:28,https://arstechnica.com/gaming/2025/04/psa-mario-kart-world-is-50-bundled-with-a-switch-2-but-80-by-itself/,ControlCAD
technology,1k1g2k9,Former Google CEO warns AI may soon ignore human control,,215,0.74,124,2025-04-17 15:48:04,https://uk.finance.yahoo.com/news/former-google-ceo-warns-ai-140020810.html,MetaKnowing
technology,1jq72a8,Russian spy infiltrates ASML and NXP to steal technical data necessary to build 28nm-capable fabs,,213,0.94,19,2025-04-03 02:32:41,https://www.tomshardware.com/tech-industry/russian-spy-infiltrates-asml-and-nxp-to-steal-technical-data-necessary-to-build-28nm-capable-fabs,Logical_Welder3467
technology,1juaqbm,"AT&T states: ""Say Goodbye to Email-to-Text and Text-to-Email""",,211,0.91,90,2025-04-08 10:57:03,https://www.att.com/support/article/wireless/KM1061254/,Lighting
technology,1jw1b3q,"A new study finds that ChatGPT mirrors human decision-making biases in nearly half of tested scenarios, including overconfidence and the gambler’s fallacy",,207,0.92,38,2025-04-10 15:54:35,https://scitechdaily.com/more-like-us-than-we-realize-chatgpt-gets-caught-thinking-like-a-human/,MetaKnowing
technology,1jjkcyr,Ticketmaster may have violated consumer protection laws | The UK’s CMA weighs in after the Oasis reunion tour ticketing fiasco.,,210,0.96,19,2025-03-25 14:15:11,https://www.theverge.com/news/635236/ticketmaster-oasis-investigation-action,chrisdh79
technology,1jqnm5c,Smartphone and Hardware Makers Caught in Trump’s Tariff Storm,,204,0.92,48,2025-04-03 16:52:40,https://www.bloomberg.com/news/articles/2025-04-03/smartphone-and-hardware-makers-caught-in-trump-s-tariff-storm,s1n0d3utscht3k
technology,1jwmia6,Chinese sellers on Amazon to hike prices or exit US as tariffs soar,,204,0.92,33,2025-04-11 10:21:56,https://www.reuters.com/technology/chinese-sellers-amazon-hike-prices-or-exit-us-tariffs-soar-association-says-2025-04-10/,SanaBrina2
technology,1jwgasf,OnePlus won’t say why its Watch 3 suddenly costs $170 more than promised,,202,0.84,67,2025-04-11 03:17:10,https://www.theverge.com/news/646730/oneplus-watch-3-tariffs-price-hike-smartwatch,Logical_Welder3467
technology,1julfhz,Victory for DOGE as appeals court reinstates access to personal data | Divided court sides with Trump admin in case over alleged privacy law violations.,,195,0.94,9,2025-04-08 18:54:34,https://arstechnica.com/tech-policy/2025/04/victory-for-doge-as-appeals-court-reinstates-access-to-personal-data/,chrisdh79
technology,1jv49al,Razer pulls new Blade laptops from its US store amid tariff concerns,,197,0.91,19,2025-04-09 12:12:37,https://www.techspot.com/news/107474-razer-pulls-new-blade-laptops-us-store-amid.html,AdSpecialist6598
technology,1jnd0kv,Microsoft eliminates workaround that circumvents Microsoft account requirement during Windows 11 installation,,197,0.91,52,2025-03-30 14:00:11,https://www.tomshardware.com/software/windows/microsoft-eliminates-workaround-that-circumvents-microsoft-account-requirement-during-windows-11-installation,jluizsouzadev
technology,1jln8l3,IBM US cuts may run deeper than feared ‒ and the jobs are heading to India,,194,0.96,61,2025-03-28 04:44:02,https://www.theregister.com/2025/03/27/ibm_cuts_jobs_in_us/,Logical_Welder3467
technology,1jyx0xc,"Meta faces antitrust charges in court, as the FTC calls the company an illegal monopoly",,191,0.97,12,2025-04-14 11:56:46,https://www.cnn.com/2025/04/14/media/meta-ftc-trial/index.html,mepper
technology,1juvkle,TSMC faces $1 billion US fine for making chips for blacklisted Huawei,,194,0.95,16,2025-04-09 02:42:55,https://www.tomshardware.com/tech-industry/tsmc-faces-usd1-billion-us-fine-for-doing-business-with-huawei,ControlCAD
technology,1k1a9nf,Brit soldiers tune radio waves to fry drone swarms for pennies,,197,0.92,45,2025-04-17 11:18:19,https://www.theregister.com/2025/04/17/british_army_drone_weapon/,z8675309z
technology,1jlsf5n,"India pushes to ease international payments through homegrown network to rival Visa, Mastercard | Reuters",,193,0.87,53,2025-03-28 10:59:56,https://www.reuters.com/world/india/india-pushes-ease-international-payments-through-homegrown-network-rival-visa-2025-03-28/,BROWN-MUNDA_
technology,1k10sjt,This ICE-snitching app is actually promoting a meme coin,,196,0.92,10,2025-04-17 01:14:48,https://www.theverge.com/tech/650015/iceraid-app-immigrant-bounty-hunting-crypto,Dapper-Material5930
technology,1k0nbxv,Some Discord users now need to scan their face or ID to view sensitive material | The company says the age verification feature is “an experiment”,,191,0.86,78,2025-04-16 15:33:18,https://www.videogameschronicle.com/news/some-discord-users-now-need-to-scan-their-face-or-id-to-view-sensitive-material/,ControlCAD
technology,1jw29na,Polestar EV sales jump in Q1 on discounts like its 'Tesla conquest' bonus,,189,0.95,2,2025-04-10 16:35:02,https://techcrunch.com/2025/04/10/polestar-ev-sales-jump-in-q1-on-discounts-like-tesla-conquest-bonus/,ControlCAD
technology,1jn28ud,Russia completes development of 30-year-old outdated lithography tool,,184,0.87,33,2025-03-30 02:02:04,https://www.tomshardware.com/tech-industry/russia-completes-development-of-30-year-old-outdated-lithography-tool,Logical_Welder3467
technology,1jynqjp,"PS5 Price Increases Announced by Sony, Affect UK, Europe, and More",,190,0.9,51,2025-04-14 01:51:07,https://www.pushsquare.com/news/2025/04/ps5-price-increases-announced-by-sony-affect-uk-europe-and-more,ShuKazun
technology,1jzx90p,Apple airlifted iPhones worth a record $2 billion from India in March as Trump tariffs loomed,,186,0.91,19,2025-04-15 17:08:19,https://www.reuters.com/technology/apple-airlifted-iphones-worth-record-2-billion-india-march-trump-tariffs-loomed-2025-04-15/,Appropriate_Rain_770
technology,1jil1b3,A European startup is set to launch an orbital rocket on its first test flight,,183,0.96,2,2025-03-24 07:17:35,https://apnews.com/article/space-launch-isar-aerospace-norway-private-f3418df5553b8b8ee9aca7f83375aaad,Majano57
technology,1k4bw6q,Western Digital and Microsoft launch HDD recycling program to recover rare earths from e-waste | The recycling initiative recovers 90% of rare earths from data center hard drives,,185,0.94,15,2025-04-21 12:07:10,https://www.techspot.com/news/107615-western-digital-microsoft-launch-hdd-recycling-program-recover.html,chrisdh79
technology,1k4g87n,"With ‘AI slop’ distorting our reality, the world is sleepwalking into disaster | A perverse information ecosystem is being mined by big tech for profit, fooling the unwary and sending algorithms crazy",,189,0.88,9,2025-04-21 15:23:22,https://www.theguardian.com/commentisfree/2025/apr/21/ai-slop-artificial-intelligence-social-media,MetaKnowing
technology,1jxjexo,"Arguments start Monday in the FTC’s blockbuster antitrust suit targeting Facebook’s purchases of Instagram and WhatsApp, as Zuckerberg pleads for the White House to intervene.",,187,0.96,11,2025-04-12 15:08:52,https://www.washingtonpost.com/technology/2025/04/12/trump-sued-break-up-meta-2020-its-finally-going-trial/,indig0sixalpha
technology,1jm5u0g,Google discontinues Nest Protect smoke alarm and Nest x Yale lock | Google continues backing away from smart home hardware.,,184,0.92,96,2025-03-28 21:13:28,https://arstechnica.com/gadgets/2025/03/google-discontinues-nest-protect-smoke-alarm-and-nest-x-yale-lock/,ControlCAD
technology,1k5jzdo,Google is paying Samsung an ‘enormous sum’ to preinstall Gemini,,449,0.95,46,2025-04-22 22:50:03,https://www.theverge.com/news/652746/google-samsung-gemini-default-placement-antitrust-trial,lurker_bee
technology,1jxzfm8,Airport face scans could replace boarding passes and check-in as soon as 2028,,183,0.85,62,2025-04-13 04:19:15,https://www.msn.com/en-gb/money/technology/airport-face-scans-could-replace-boarding-passes-and-check-in-as-soon-as-2028/ar-AA1CLk4a,moeka_8962
technology,1jwnhp0,"Microtransactions accounted for 58% of PC gaming revenue last year | Call of Duty: Black Ops 6, Roblox, and Fortnite helped drive this growth",,174,0.92,56,2025-04-11 11:24:44,https://www.techspot.com/news/107506-microtransactions-accounted-58-pc-gaming-revenue-last-year.html,chrisdh79
technology,1k24vax,"Nintendo Maintains Nintendo Switch 2 Pricing, Retail Pre-Orders to Begin April 24 in U.S. - News - Nintendo Official Site",,173,0.86,110,2025-04-18 13:25:04,https://www.nintendo.com/us/whatsnew/nintendo-maintains-nintendo-switch-2-pricing-retail-pre-orders-to-begin-april-24-in-u-s/,Gorotheninja
technology,1k10cvt,One dose of experimental drug nearly wipes out stealthy cholesterol in 'remarkable' trial,,173,0.98,12,2025-04-17 00:52:48,https://www.nbcnews.com/health/health-news/one-dose-experimental-drug-nearly-wipes-stealthy-cholesterol-remarkabl-rcna198014,rchaudhary
technology,1jz2rul,Nato acquires AI military system from Palantir,,174,0.88,33,2025-04-14 16:13:02,https://www.ft.com/content/7f80b1bc-114c-4a00-ad06-6863fb435822,MetaKnowing
technology,1jqpq0g,Thunderbird Launches Open Source Services to Rival Gmail and Office365,,177,0.93,23,2025-04-03 18:12:29,https://linuxiac.com/thunderbird-launches-open-source-services-to-rival-gmail-and-office365/,fattyfoods
technology,1jj7odz,Samsung co-CEO Han Jong-Hee dies at 63,,167,0.87,32,2025-03-25 01:15:33,https://www.cnn.com/2025/03/24/tech/samsung-co-ceo-han-jong-hee-death-intl-hnk?cid=ios_app,N/A
technology,1k3091w,World's fastest Flash memory developed: writes in just 400 picoseconds,,166,0.93,27,2025-04-19 16:30:43,https://www.tomshardware.com/pc-components/storage/worlds-fastest-flash-memory-developed-writes-in-just-400-picoseconds,habichuelacondulce
technology,1js9alw,Trump's TikTok Ban Extension: National Security Move or Political Theater?,,164,0.87,49,2025-04-05 17:54:41,https://edition.cnn.com/2025/04/04/tech/tiktok-deal-ban-extended-trump?utm_medium=social&utm_source=whatsappCNN&utm_content=2025-04-04T17:52:24,IntelligentJacket46
technology,1jp1dnu,The threat of US–centric social media,,164,0.91,14,2025-04-01 17:27:16,https://opencanada.org/the-threat-of-us-centric-social-media/,Wagamaga
technology,1jiq9kt,Shutting down 2G networks leaves millions of phones obsolete - Rest of World,,165,0.92,50,2025-03-24 13:09:28,https://restofworld.org/2025/shutting-down-2g-networks-phones-obsolete/,serene_sketch
technology,1jmde0f,Elon Musk must face Twitter shareholders’ lawsuit over alleged securities fraud,,166,0.99,6,2025-03-29 03:24:36,https://www.cnbc.com/2025/03/28/elon-musk-must-face-twitter-shareholders-lawsuit-over-alleged-securities-fraud.html,TechnologyRemote7331
technology,1jisqae,"Data suggests RTX 5090 prices are slowly stabilizing — The average selling price on eBay has dropped to $4,000",,166,0.8,119,2025-03-24 15:01:23,https://www.tomshardware.com/pc-components/gpus/data-suggests-rtx-5090-prices-are-slowly-stabilizing-the-average-selling-price-on-ebay-has-dropped-to-usd4-000,Logical_Welder3467
technology,1k08hos,"CVE program faces swift end after DHS fails to renew contract, leaving security flaw tracking in limbo | CSO Online",,158,0.95,12,2025-04-16 01:20:02,https://www.csoonline.com/article/3963190/cve-program-faces-swift-end-after-dhs-fails-to-renew-contract-leaving-security-flaw-tracking-in-limbo.html,thetango
technology,1jofi0x,"OpenAI closes $40 billion funding round, largest private tech deal on record",,161,0.81,156,2025-03-31 22:01:58,https://www.cnbc.com/2025/03/31/openai-closes-40-billion-in-funding-the-largest-private-fundraise-in-history-softbank-chatgpt.html,Puginator
technology,1k1sytu,South Korea exports nuclear reactor design to US in historic first,,158,0.95,23,2025-04-18 01:16:16,https://www.chosun.com/english/national-en/2025/04/17/LP5HAO3X45HZRK3HDVK6ICYTQ4/,self-fix
technology,1juy0mq,"Magnificent Seven Stocks Tumble: Apple, Nvidia, Tesla Sell Off",,165,0.93,4,2025-04-09 05:05:20,https://www.investors.com/research/magnificent-seven-stocks-april-2025/?utm_source=chatgpt.com,PrestigiousZombie726
technology,1jjnv94,"Lonely People Are Even Sadder After Using Chatbots, Research Finds",,162,0.88,37,2025-03-25 16:44:10,https://gizmodo.com/lonely-people-are-even-sadder-after-using-chatbots-research-finds-2000580344,indig0sixalpha
technology,1k55ts0,Nvidia’s GPU drivers are a mess | A series of new drivers and hotfixes keep introducing issues for Nvidia GPU owners.,,181,0.92,51,2025-04-22 13:06:00,https://www.theverge.com/news/653115/nvidia-gpu-drivers-black-screen-crashes-issues,chrisdh79
technology,1jk083l,China Floods the World With AI Models After DeepSeek’s Success,,159,0.87,60,2025-03-26 01:25:43,https://finance.yahoo.com/news/china-floods-world-ai-models-144650368.html,lurker_bee
technology,1jiymmh,OCDSB seeking court order in bid to unmask anonymous 'redditor',,159,0.89,34,2025-03-24 18:55:43,https://cbc.ca/news/canada/ottawa/ocdsb-seeking-court-order-in-bid-to-unmask-anonymous-redditor-1.7489101,ParrotTaint
technology,1jri7mg,US Weather Agency Websites Set to Vanish With Contract Cuts,,154,0.94,10,2025-04-04 17:56:23,https://www.bloomberg.com/news/articles/2025-04-04/us-weather-agency-websites-to-vanish-under-planned-contract-cuts,Majano57
technology,1k4rgtl,"Amazon has halted some data center leasing talks, Wells Fargo analysts say",,159,0.95,21,2025-04-21 23:07:31,https://www.reuters.com/business/retail-consumer/amazon-has-halted-some-data-center-leasing-talks-wells-fargo-analysts-say-2025-04-21/,Fritja
technology,1k0psal,Nvidia takes $5.5 billion hit as Trump tightens export restrictions in China trade war,,153,0.92,21,2025-04-16 17:13:44,https://edition.cnn.com/2025/04/16/tech/nvidia-plunge-h20-chip-china-export-intl-hnk/index.html,nohup_me
technology,1jv4kzu,Revealed: Big tech’s new datacentres will take water from the world’s driest areas,,153,0.93,23,2025-04-09 12:29:32,https://www.theguardian.com/environment/2025/apr/09/big-tech-datacentres-water,zsreport
technology,1k0rrvq,EU provides burner phones to officials traveling to US amid espionage concerns,,150,0.93,2,2025-04-16 18:33:14,https://www.techspot.com/news/107576-eu-provides-burner-phones-us-bound-staff-amid.html,AdSpecialist6598
technology,1jr9d33,The Founder of OnlyFans Wants to Buy TikTok,,152,0.85,31,2025-04-04 11:15:12,https://www.wired.com/story/founder-onlyfans-wants-to-buy-tiktok/,NecessarySignal0007
technology,1jjzk6f,AT&T quietly issues stern warning to customers,,155,0.83,105,2025-03-26 00:53:37,https://www.thestreet.com/retail/at-t-quietly-issues-stern-warning-to-customers,lurker_bee
technology,1jyrk4m,"Tariffs on imported semiconductor chips coming soon, Trump says",,151,0.89,25,2025-04-14 05:38:10,https://www.reuters.com/markets/trump-plans-separate-levy-exempted-electronics-amid-trade-war-lutnick-says-2025-04-13/,Lotr_fan1995
technology,1k2r238,Nvidia faces $5.5 billion charge as US restricts chip sales to China,,149,0.93,12,2025-04-19 07:46:03,https://www.reuters.com/technology/nvidia-expects-up-55-billion-charge-first-quarter-2025-04-15/,fulltrendypro
technology,1jzqkn6,Japan's anti-monopoly watchdog accuses Google of violations in smartphones,,146,0.97,1,2025-04-15 12:25:50,https://apnews.com/article/google-japan-monopoly-android-search-a50213d4e7858381679404c62a39905c,Strict-Ebb-8959
technology,1jpckmw,Former Sony Exec Says It's About Time For PlayStation to Reconsider Its Focus on Cutting-Edge Graphics,,146,0.85,85,2025-04-02 01:23:00,https://www.ign.com/articles/former-sony-exec-says-its-about-time-for-playstation-to-reconsider-its-focus-on-cutting-edge-graphics,BiggieTwiggy1two3
technology,1jz6p8y,Why I Emphatically Oppose Online Age Verification Mandates,,146,0.89,10,2025-04-14 18:51:17,https://blog.ericgoldman.org/archives/2025/04/why-i-emphatically-oppose-online-age-verification-mandates.htm,vriska1
technology,1jtoken,"China-based manufacturer Unitree Robotics pre-installed an apparent backdoor on its popular Go1 robot dogs that allowed anyone to surveil customers around the world, according to findings from two security researchers.",,149,0.88,12,2025-04-07 15:51:08,https://www.axios.com/2025/04/01/threat-spotlight-backdoor-in-chinese-robots-future-of-cybersecurity,MetaKnowing
technology,1jkg94a,Broadcom’s VMware says Siemens pirated “thousands” of copies of its software,,148,0.96,19,2025-03-26 16:42:29,https://arstechnica.com/information-technology/2025/03/broadcoms-vmware-says-siemens-pirated-thousands-of-copies-of-its-software/,lurker_bee
technology,1k11toq,"Synology requires self-branded drives for some consumer NAS systems, drops full functionality and support for third-party HDDs",,146,0.93,55,2025-04-17 02:08:04,https://www.tomshardware.com/pc-components/nas/synology-requires-self-branded-drives-for-some-consumer-nas-systems-drops-full-functionality-and-support-for-third-party-hdds,ControlCAD
technology,1jv9izp,"Snap, Roblox break silence on anti-deepfake Take It Down Act",,144,0.9,16,2025-04-09 16:07:49,https://mashable.com/article/snapchat-take-it-down-act-trump,Anoth3rDude
technology,1jqniip,Breakthrough: World's Smallest Pacemaker Is The Size of a Rice Grain,,146,0.93,7,2025-04-03 16:48:47,https://www.sciencealert.com/breakthrough-worlds-smallest-pacemaker-is-the-size-of-a-rice-grain?utm_source=flipboard&utm_content=topic/technology,Sufficient-Bid1279
technology,1jp2d89,"NaNoWriMo shut down after AI, content moderation scandals",,147,0.9,63,2025-04-01 18:06:26,https://techcrunch.com/2025/04/01/nanowrimo-shut-down-after-ai-content-moderation-scandals/,ControlCAD
technology,1jy0isx,Nikola founder Trevor Milton accused of trying to derail bankruptcy case,,142,0.94,7,2025-04-13 05:30:41,https://techcrunch.com/2025/04/11/nikola-founder-trevor-milton-accused-of-trying-to-derail-bankruptcy-case/,Big_Maintenance_1789
technology,1k5bhrp,"In the US, saving money is top reason to embrace solar power",,201,0.93,34,2025-04-22 17:02:38,https://techxplore.com/news/2025-04-money-embrace-solar-power.html,sundler
technology,1jtmfrw,"Meta ends its fact-checking program, replacing it with Community Notes | Making users the arbiters of truth in Facebook and Instagram",,144,0.91,22,2025-04-07 14:22:10,https://www.techspot.com/news/107438-meta-ends-fact-checking-program-us-later-today.html,chrisdh79
technology,1jxg4az,"Founder of Nate app faces fraud charge for using ""AI"" that was really human call center workers",,143,0.93,11,2025-04-12 12:25:36,https://www.techspot.com/news/107510-founder-nate-app-faces-fraud-charge-using-ai.html,AdSpecialist6598
technology,1jurpuk,"Nvidia may avoid recent tariffs on its AI servers — 60% of Nvidia servers pass through Mexico, may be exempt from Trump tariff flurry",,140,0.9,21,2025-04-08 23:26:15,https://www.tomshardware.com/tech-industry/nvidia-may-avoid-recent-tariffs-on-its-ai-servers-60-percent-of-nvidia-servers-pass-through-mexico-may-be-exempt-from-trump-tariff-flurry,Logical_Welder3467
technology,1k2y2wt,"Build Canada Is Not DOGE, Says Spokesperson | The Tyee",,139,0.86,29,2025-04-19 14:55:32,https://thetyee.ca/News/2025/04/16/Build-Canada-Not-DOGE-Spokesperson/,Zarrakir
technology,1k1ysx8,NASA rover finds fresh evidence of the warm and wet past of Mars,,135,0.94,11,2025-04-18 07:03:40,https://www.reuters.com/science/nasa-rover-finds-fresh-evidence-warm-wet-past-mars-2025-04-17/,waozen
technology,1jvagvf,Bank of England says AI software could create market crisis for profit,,136,0.96,9,2025-04-09 16:46:24,https://www.theguardian.com/business/2025/apr/09/bank-of-england-says-ai-software-could-create-market-crisis-profit,printial
technology,1jjjlw4,Chinese Weaver Ant hackers spied on telco network for 4 years,,139,0.89,10,2025-03-25 13:40:48,https://www.bleepingcomputer.com/news/security/chinese-weaver-ant-hackers-spied-on-telco-network-for-4-years/,lurker_bee
technology,1k04hr7,Nvidia says it will record $5.5 billion charge tied to H20 processors exported to China,,135,0.91,23,2025-04-15 22:06:50,https://www.cnbc.com/2025/04/15/nvidia-says-it-will-record-5point5-billion-quarterly-charge-tied-to-h20-processors-exported-to-china.html,Gjore
technology,1jqtr62,"Google Is Helping the Trump Administration Deploy AI Along the Mexican Border | Google is part of a Customs and Border Protection plan to use machine learning for surveillance, documents reviewed by The Intercept reveal",,132,0.92,21,2025-04-03 20:46:29,https://theintercept.com/2025/04/03/google-cbp-ai-border-surveillance-ibm-equitus/,Hrmbee
technology,1jlifda,An Astronomer Calculated the Exact Day a Star Will Blow—and It’s Today,,133,0.89,54,2025-03-28 00:30:17,https://gizmodo.com/an-astronomer-calculated-the-exact-day-a-star-will-blow-and-its-this-week-2000580309,Anxious-Depth-7983
technology,1jne0kv,AI Experts Say We’re on the Wrong Path to Achieving Human-Like AI,,131,0.9,46,2025-03-30 14:47:55,https://gizmodo.com/ai-experts-say-were-on-the-wrong-path-to-achieving-human-like-ai-2000581717,ethereal3xp
technology,1k0vlfx,Trump’s Tariffs Hit Hard Tech Realities: China’s role in smartphone and chip supply chains is blunting the U.S. president’s ambitions—at least for now.,,131,0.96,1,2025-04-16 21:11:36,https://foreignpolicy.com/2025/04/16/trump-tariffs-tech-exemptions-semiconductor-chips-china-trade-war/,wonkintheworld
technology,1jmu4ym,"Putting the smartphone away at work may not be sufficient to reduce disruption and procrastination, or increase focus. The problem is not rooted within the device itself, but in the habits and routines that we have developed with our devices",,134,0.87,34,2025-03-29 19:29:12,https://www.frontiersin.org/news/2025/03/28/distracted-phone-procrastinate,nohup_me
technology,1k07igd,"Exclusive: US tariffs may cost chip equipment makers more than $1 billion, industry estimates",,128,0.94,7,2025-04-16 00:29:42,https://www.reuters.com/technology/us-tariffs-may-cost-chip-equipment-makers-more-than-1-billion-industry-estimates-2025-04-15/,WarmingNow
technology,1jk05p9,Napster sold to tech commerce company for $207 million,,129,0.87,48,2025-03-26 01:22:29,https://apnews.com/article/napster-music-pioneer-service-sold-7c2541f805d8debf0433171696c54518,intelw1zard
technology,1k2qnij,Chinese robots ran against humans in the world’s first humanoid half-marathon. They lost by a mile | CNN,,129,0.84,51,2025-04-19 07:16:54,https://edition.cnn.com/2025/04/19/asia/china-first-humanoid-robot-half-marathon-intl-hnk/index.html,N/A
technology,1jl1mbm,Four dead and dozens rescued after tourist submarine sinks off Egypt,,129,0.9,25,2025-03-27 11:23:55,https://news.sky.com/story/four-dead-and-dozens-rescued-after-tourist-submarine-sinks-off-egypt-13336566,FruitOrchards
technology,1k4yogh,Synology Lost the Plot with Hard Drive Locking Move,,131,0.93,47,2025-04-22 05:24:07,https://www.servethehome.com/synology-lost-the-plot-with-hard-drive-locking-move/,Doener23
technology,1jjpi8m,This violent extremist network targets kids online,,123,0.85,38,2025-03-25 17:50:26,https://www.cbc.ca/newsinteractives/features/online-extremist-network-that-targets-kids,Wagamaga
technology,1jzcuxt,Biotech firm creates weight loss pill that mimics the effects of gastric bypass surgery | The pill preserves muscle mass while reducing hunger,,126,0.94,23,2025-04-14 23:10:58,https://www.techspot.com/news/107527-biotech-firm-creates-weight-loss-pill-mimics-effects.html,chrisdh79
technology,1jvvqv2,"U.S. tariffs to heavily impact HDD and SSD manufacturers, increasing costs | Storage could get significantly more expensive due to tariffs.",,125,0.94,10,2025-04-10 11:37:12,https://www.tomshardware.com/pc-components/storage/u-s-tariffs-to-heavily-impact-hdd-and-ssd-manufacturers-increasing-costs,chrisdh79
technology,1jvko8i,"Ubisoft holds firm in The Crew lawsuit: You don’t own your video games | Plaintiffs bring up a new claim, too, in amended complaint",,124,0.89,31,2025-04-10 00:04:05,https://www.polygon.com/gaming/555469/ubisoft-holds-firm-in-the-crew-lawsuit-you-dont-own-your-video-games,chrisdh79
technology,1juh7lc,"Solar power sees 29% increase in 2024, marking new record",,125,0.95,2,2025-04-08 16:04:03,https://techxplore.com/news/2025-04-solar-power.html,sundler
