subreddit,post_id,title,content,score,upvote_ratio,num_comments,created_at,url,author
technology,1jv7ef2,Amazon Cancels Some Inventory Orders From China After Tariffs,,407,0.95,28,2025-04-09 14:39:53,https://www.bloomberg.com/news/articles/2025-04-09/amazon-cancels-some-inventory-orders-from-china-after-tariffs,DomesticErrorist22
technology,1jtt1j5,"Major Japanese studios and publishers were having a great time in 2025, right up until the weekend because of the (you guessed it) 'insultingly dumb' US tariffs",,399,0.93,13,2025-04-07 18:52:23,https://www.pcgamer.com/gaming-industry/game-development/major-japanese-studios-and-publishers-were-having-a-great-time-in-2025-right-up-until-this-weekend-because-of-the-you-guessed-it-insultingly-dumb-us-tariffs/,chrisdh79
technology,1jkkzfs,Allegations of Indian interference rock Canada election campaign,,400,0.94,39,2025-03-26 19:55:07,https://www.theguardian.com/world/2025/mar/26/canada-election-india-interference-warning,Wagamaga
technology,1k5clfi,Columbia student suspended over interview cheating tool Cluely raises $5.3M to 'cheat on everything',,674,0.75,99,2025-04-22 17:46:42,https://techcrunch.com/2025/04/21/columbia-student-suspended-over-interview-cheating-tool-raises-5-3m-to-cheat-on-everything/,lurker_bee
technology,1jsszmf,Trump delays TikTok ban another 75 days after China stalls divestment deal following tariffs,,403,0.9,50,2025-04-06 12:28:19,https://www.techspot.com/news/107427-trump-delays-tiktok-ban-another-75-days-after.html,AdSpecialist6598
technology,1jyrzxm,Anime Fans Score Big Win as Crunchyroll U-Turns on Massively Unpopular A.I. Plan,,399,0.92,28,2025-04-14 06:08:11,https://www.cbr.com/crunchyroll-ai-plan-u-turn/,moeka_8962
technology,1jqohcb,"Most Americans think AI won’t improve their lives, survey says | Rare survey of AI experts exposes deep divide with public opinion.",,397,0.96,69,2025-04-03 17:25:48,https://arstechnica.com/tech-policy/2025/04/survey-americans-fear-ai-will-hurt-them-experts-expect-the-opposite/,ControlCAD
technology,1julecg,Most Americans don’t trust AI — or the people in charge of it | Two new studies show that the public is anxious about AI.,,394,0.98,16,2025-04-08 18:53:12,https://www.theverge.com/ai-artificial-intelligence/644853/pew-gallup-data-americans-dont-trust-ai,chrisdh79
technology,1jlby1h,Pro-Palestinian activists under increased surveillance on Massachusetts campuses,,398,0.89,65,2025-03-27 19:33:18,https://theworld.org/stories/2025/03/24/pro-palestinian-activists-under-increased-surveillance-on-massachusetts-campuses,Wagamaga
technology,1jouvmv,Woman's Brain Implant Turns Her Thoughts Into Speech in Real Time,,388,0.92,97,2025-04-01 12:54:46,https://www.sciencealert.com/womans-brain-implant-turns-her-thoughts-into-speech-in-real-time?utm_source=flipboard&utm_content=topic/brain,Sufficient-Bid1279
technology,1jitjpw,Oracle denies data breach after hacker claims to hold six million records,,387,0.98,9,2025-03-24 15:35:02,https://www.techradar.com/pro/security/oracle-denies-data-breach-after-hacker-claims-to-hold-six-million-records,lurker_bee
technology,1jkxwyz,OpenAI's viral Studio Ghibli moment highlights AI copyright concerns | TechCrunch,,384,0.86,304,2025-03-27 06:48:30,https://techcrunch.com/2025/03/26/openais-viral-studio-ghibli-moment-highlights-ai-copyright-concerns/,TalentForge360
technology,1jw11ur,"Inside the DHS task force scouring foreign students' social media - A critic called the review a return to “McCarthyism,” a reference to tactics used to identify alleged communists during the Cold War",,385,0.97,20,2025-04-10 15:43:39,https://www.nbcnews.com/politics/national-security/dhs-task-force-scouring-foreign-students-social-media-rcna198532,digital-didgeridoo
technology,1jreai3,Nintendo delays Switch 2 pre-orders in response to Trump tariffs,,375,0.92,81,2025-04-04 15:12:51,https://www.polygon.com/nintendo-switch-2/553133/pre-orders-delayed-trump-tariff,retroanduwu24
technology,1k53fa2,An AI doctoral candidate in California says they had their student visa revoked,,399,0.93,17,2025-04-22 10:58:10,https://techcrunch.com/2025/04/21/an-ai-doctoral-candidate-in-california-says-they-had-their-student-visa-revoked/,Doener23
technology,1jlc0ul,TikTok ban loses momentum as fewer Americans view it as a security threat | A second US ban is looming,,368,0.88,103,2025-03-27 19:43:12,https://www.techspot.com/news/107316-tiktok-ban-loses-momentum-fewer-americans-view-security.html,chrisdh79
technology,1k0vf7d,Apple's greenhouse emissions are down by over 60%,,372,0.88,103,2025-04-16 21:04:09,https://appleinsider.com/articles/25/04/16/apple-cuts-more-than-60-of-its-global-greenhouse-gas-emissions,Wagamaga
technology,1jvjzl4,"Microsoft says it's 'slowing or pausing' some AI data center projects, including $1B plan for Ohio",,364,0.96,27,2025-04-09 23:30:05,https://apnews.com/article/microsoft-ai-data-center-pause-ohio-4d987fe8446fc9e6cda31d919f938911,CGP05
technology,1jpuhxg,"European police say KidFlix, ""one of the largest pedophile platforms in the world,"" busted in joint operation",,366,0.96,46,2025-04-02 17:32:04,https://www.cbsnews.com/news/germany-online-child-sexual-abuse-platform-kidflix-busted-europol/,No-Information6622
technology,1jjhcsg,4-day work-week pilot due in tech land by early summer | Microsoft and Dell keeping quiet on their work-life-balance trials,,368,0.97,36,2025-03-25 11:42:02,https://www.theregister.com/2025/03/25/fourdayworkweek_pilot_due_in_tech/,chrisdh79
technology,1k32di3,Apple’s Support Forums are a black hole for user feedback,,360,0.92,35,2025-04-19 18:04:54,https://www.notebookcheck.net/Apple-s-Support-Forums-are-a-black-hole-for-user-feedback.1001522.0.html,Ok_Transition5930
technology,1jwysyl,"DOGE just announced more layoffs at TTS, the government’s vaunted tech group, sources say",,362,0.94,14,2025-04-11 19:48:10,https://www.fastcompany.com/91314630/doge-just-announced-more-layoffs-at-tts,Majano57
technology,1k1nscz,Apple is already assembling iPhone 16e in Brazil as it shifts production from China,,363,0.93,62,2025-04-17 21:08:26,https://9to5mac.com/2025/04/17/iphone-16e-assembling-in-brazil/,ControlCAD
technology,1jlc37o,"NASA Abandons Pledge to Put Women, Astronauts of Color on the Moon",,359,0.88,111,2025-03-27 19:52:12,https://eos.org/research-and-developments/nasa-abandons-pledge-to-put-women-astronauts-of-color-on-the-moon,chrisdh79
technology,1jnr3tv,Linus Torvalds rages against ‘random turd files’ in Linux 6.15-rc1 directories,,360,0.86,53,2025-03-31 00:40:43,https://www.tomshardware.com/software/linux/linus-torvalds-rages-against-random-turd-files-in-linux-6-15-rc1-directories,Logical_Welder3467
technology,1k34yus,iPhone Shipments Down 9% in China's Q1 2025 Smartphone Boom,,358,0.94,52,2025-04-19 20:01:51,https://www.macrumors.com/2025/04/18/iphone-shipments-down-in-china-q1/,ControlCAD
technology,1jzimiv,"Microsoft OneDrive file sync apps for Windows, Mac broken for 10 months",,344,0.94,37,2025-04-15 03:59:41,https://www.theregister.com/2025/04/14/microsoft_onedrive_file_sync_apps_broken/,moeka_8962
technology,1jubj4n,Suspicions Telegram is cooperating with Kremlin rise as app’s unpaid fines are cancelled,,348,0.95,6,2025-04-08 11:45:25,https://novayagazeta.eu/articles/2025/04/08/suspicions-telegram-is-cooperating-with-kremlin-rise-as-apps-unpaid-fines-are-cancelled-en-news,duckanroll
technology,1jxndgn,Trump Tariffs Are Reshaping the Smartphone Industry — And Consumers Will Pay the Price,,350,0.88,54,2025-04-12 18:03:31,https://www.androidheadlines.com/2025/04/trump-tariffs-are-reshaping-the-smartphone-industry-and-consumers-will-pay-the-price.html,Appropriate_Rain_770
technology,1k37p8o,"Europe helped teach China to make cars. Now the tables are turning. The EU is trading market access for expertise in key technologies, just as Beijing once did.",,345,0.93,48,2025-04-19 22:10:55,https://archive.fo/xBkt4,BalticsFox
technology,1jngthf,Shuttle used to supply the International Space Station with food is damaged as future trips are put on hold,,344,0.95,32,2025-03-30 16:54:13,https://www.yahoo.com/news/shuttle-used-supply-international-space-153802207.html,lurker_bee
technology,1jilu1w,The Careless People Won - A controversial new book about Facebook serves as a field guide for the DOGE era.,,330,0.95,2,2025-03-24 08:20:59,https://www.theatlantic.com/technology/archive/2025/03/careless-people-won/682145/?gift=2LqfPZKi2W2A0U_vKWK-amwIsFwRguxSIWgoT-_iw2g,Majano57
technology,1jlkfye,The Revolving Door Spins: Former Trump FCC Boss Ajit Pai Promoted To Top Wireless Industry Lobbyist,,332,0.95,16,2025-03-28 02:10:55,https://www.techdirt.com/2025/03/27/the-revolving-door-spins-former-trump-fcc-boss-ajit-pai-promoted-to-top-wireless-industry-lobbyist/,indig0sixalpha
technology,1jjl0qx,Linus Torvalds forgot to release Linux 6.14 for a whole day,,327,0.8,62,2025-03-25 14:44:17,https://www.theregister.com/2025/03/25/linux_6_14_day_late/?td=rt-3a,Logical_Welder3467
technology,1k3nuzi,"French flock to Chinese e-commerce bargains, hunt for ‘agent Taobao’ to deliver",,324,0.91,22,2025-04-20 14:33:12,https://www.scmp.com/economy/global-economy/article/3307100/french-flock-chinese-e-commerce-bargains-hunt-agent-taobao-deliver?module=top_story&pgtype=homepage,Saltedline
technology,1k2c4tj,HP agrees to $4 million settlement over inflated PC prices on its website | Similar lawsuits have been filed against other major retailers,,331,0.98,16,2025-04-18 18:34:28,https://www.techspot.com/news/107604-hp-accused-fake-discounts-lawsuit-agrees-4-million.html,chrisdh79
technology,1jqxosr,"Fintech stocks such as Affirm, PayPal plunge on concern Trump tariffs will hurt consumer spending",,326,0.97,12,2025-04-03 23:32:19,https://www.cnbc.com/2025/04/03/affirm-paypal-fintechs-plunge-on-concerns-trump-tariffs-hit-consumer.html,Logical_Welder3467
technology,1jx0ieq,High school student uses AI to reveal 1.5 million previously unknown objects in space,,318,0.83,38,2025-04-11 21:01:07,https://phys.org/news/2025-04-high-school-student-ai-reveal.html,ubcstaffer123
technology,1jqxtzc,"US tech, retail stocks lead rout after Trump's tariff blow",,317,0.97,9,2025-04-03 23:39:07,https://www.reuters.com/technology/apple-shares-drop-7-frankfurt-after-trump-tariffs-china-2025-04-03/,serene_sketch
technology,1jwhl4b,Tesla suspends taking new orders for Model S and Model X on Chinese website,,316,0.94,44,2025-04-11 04:30:45,https://www.reuters.com/business/autos-transportation/tesla-suspends-taking-new-orders-model-s-model-x-chinese-website-2025-04-11/,esporx
technology,1jwyogr,"An AI-Powered Alternate Universe Where MAGA Figures Own Libs Is Thriving on YouTube. The slop is monetized, too.",,310,0.89,46,2025-04-11 19:42:49,https://gizmodo.com/an-ai-powered-alternate-universe-where-maga-figures-own-libs-is-thriving-on-youtube-2000588221,indig0sixalpha
technology,1jx2qer,Law professors side with authors battling Meta in AI copyright case,,312,0.96,17,2025-04-11 22:41:02,https://techcrunch.com/2025/04/11/law-professors-side-with-authors-battling-meta-in-ai-copyright-case/,Moonskaraos
technology,1jwqty2,"Researcher uncovers dozens of sketchy Chrome extensions with 4 million installs | Even weirder: Why would Google give so many the ""Featured"" stamp for trustworthiness?",,308,0.97,17,2025-04-11 14:11:02,https://arstechnica.com/security/2025/04/researcher-uncovers-dozens-of-sketchy-chrome-extensions-with-4-million-installs/,Hrmbee
technology,1jots7q,EV chargers now outnumber gas pumps in California as zero-emission vehicles surge | The state accounts for 30 percent of all new zero-emission vehicle sales nationwide,,311,0.93,50,2025-04-01 11:58:40,https://www.techspot.com/news/107367-ev-chargers-now-outnumber-gas-pumps-california-zero.html,chrisdh79
technology,1jla39p,Signal downloads spike in the US and Yemen amid government scandal,,303,0.95,47,2025-03-27 17:54:12,https://techcrunch.com/2025/03/27/signal-downloads-spike-in-the-u-s-and-yemen-amid-government-scandal/,Well_Socialized
technology,1jsqi02,This Device Translates Thoughts into Real-Time Speech | A novel brain device allowed a woman who had suffered a stroke to speak full sentences for the first time since 2005.,,310,0.94,27,2025-04-06 09:43:00,https://www.404media.co/this-device-translates-thoughts-into-real-time-speech/,chrisdh79
technology,1k0hxae,"Study finds CT scans could be responsible for 103,000 new cancer cases in the US each year",,306,0.8,61,2025-04-16 11:19:26,https://www.techspot.com/news/107564-study-finds-ct-scans-could-responsible-103000-new.html,chrisdh79
technology,1jt9em1,Trump Says China’s Objections to Tariffs Stalled TikTok Deal,,303,0.89,46,2025-04-07 01:06:46,https://www.bloomberg.com/news/articles/2025-04-07/trump-says-china-s-objections-to-tariffs-stalled-tiktok-deal,Techiiiiiie
technology,1jqms5y,TikTok reports massive cheating in Romanian elections; multiple disinformation networks,,304,0.94,4,2025-04-03 16:20:48,https://universul.net/tiktok-reports-massive-cheating-in-romanian-elections-multiple-disinformation-networks/,Wagamaga
technology,1julk13,UK creating ‘murder prediction’ tool to identify people most likely to kill | Crime,,305,0.93,148,2025-04-08 18:59:54,https://www.theguardian.com/uk-news/2025/apr/08/uk-creating-prediction-tool-to-identify-people-most-likely-to-kill,No-Information6622
technology,1jlzjz3,ChatGPT is shifting rightwards politically,,302,0.88,93,2025-03-28 16:48:01,https://www.psypost.org/chatgpt-is-shifting-rightwards-politically/,mvea
technology,1jvewiw,"Microsoft mulls more job cuts, this time focused on managers and non-coders, not just low performers, sources say",,297,0.95,37,2025-04-09 19:46:40,https://www.businessinsider.com/microsoft-mulls-more-job-cuts-managers-non-coders-2025-4,lurker_bee
technology,1jnhz3x,US immigration officials look to expand social media data collection,,299,0.93,38,2025-03-30 17:44:50,https://apnews.com/article/social-media-immigration-applicants-handles-dhs-f67b480abebff7e451056be17572593d,No-Information6622
technology,1k2ihqc,OpenAI's new reasoning AI models hallucinate more | TechCrunch,,293,0.95,37,2025-04-18 23:17:54,https://techcrunch.com/2025/04/18/openais-new-reasoning-ai-models-hallucinate-more/,MasterShadowLord
technology,1jjk076,"FBI issues new alert over phishing SMS scam about unpaid road tolls | If they're asking for money, it's probably a ""smishing"" scam",,295,0.96,39,2025-03-25 13:59:32,https://www.techspot.com/news/107267-fbi-issues-new-alert-over-phishing-sms-scam.html,chrisdh79
technology,1k23s63,Microsoft faces growing unrest over role in Israel’s war on Gaza: ‘Close to a tipping point’ | Technology,,289,0.84,52,2025-04-18 12:31:10,https://www.theguardian.com/technology/2025/apr/18/microsoft-ai-israel-gaza-war,Successful-Peach-764
technology,1jv8qei,Meta Whistleblower to Tell Congress That Company Aided China in AI Race,,293,0.97,6,2025-04-09 15:35:16,https://www.bloomberg.com/news/articles/2025-04-09/meta-whistleblower-to-tell-congress-that-company-aided-china-in-ai-race,MetaKnowing
technology,1jp93v7,"Tech’s big anxiety: fewer jobs, lower pay, more AI",,293,0.93,74,2025-04-01 22:40:45,https://sfstandard.com/2025/04/01/white-collar-recession-in-san-francisco-tech-industry,lurker_bee
technology,1jxrkxq,Trump exempts smartphones and computers from new tariffs,,281,0.85,76,2025-04-12 21:13:56,https://www.bbc.com/news/articles/c20xn626y81o,DalixamKC
technology,1jr9ikn,FAA Warns Boeing 787 Radio Can Cut Off Air Traffic Radio Without Notice,,287,0.95,31,2025-04-04 11:24:30,https://prospect.org/infrastructure/transportation/2025-04-04-faa-warns-boeing-787-radio-can-cut-off-air-traffic-control/,Smithy2232
technology,1k2adly,Company apologizes after AI support agent invents policy that causes user uproar | Frustrated software developer believed AI-generated message came from human support rep.,,282,0.93,43,2025-04-18 17:20:55,https://arstechnica.com/ai/2025/04/cursor-ai-support-bot-invents-fake-policy-and-triggers-user-uproar/,ControlCAD
technology,1jmfrrz,McMaster researchers discover new class of antibiotics,,282,0.95,26,2025-03-29 05:54:57,https://healthsci.mcmaster.ca/a-breakthrough-moment-mcmaster-researchers-discover-new-class-of-antibiotics/,fchung
technology,1jyvhpx,ChatGPT now lets users create fake images of politicians. We stress-tested it,,278,0.89,38,2025-04-14 10:22:56,https://www.cbc.ca/news/canada/chatgpt-fake-politicians-1.7507039,AlwaysBlaze_
technology,1jyvl4m,"Amid trade war ambiguity, Trump signals he will place further tariffs on Chinese tech",,280,0.92,33,2025-04-14 10:29:19,https://www.cbc.ca/news/world/trump-tariffs-exempted-electronics-1.7509266,AlwaysBlaze_
technology,1jp6ws2,"BYD Announces Home Solar-Powered Humanoid Robot for $10,000",,275,0.9,54,2025-04-01 21:07:15,https://cleantechnica.com/2025/04/01/byd-unveils-home-solar-powered-humanoid-robot-for-10000/#google_vignette,lurker_bee
technology,1k3zhu7,OpenAI’s o3 AI model scores lower on a benchmark than the company initially implied,,272,0.91,21,2025-04-20 23:29:15,https://techcrunch.com/2025/04/20/openais-o3-ai-model-scores-lower-on-a-benchmark-than-the-company-initially-implied/,Logical_Welder3467
technology,1jls0mt,NYU website defaced as hacker leaks info on a million students,,270,0.93,17,2025-03-28 10:32:56,https://www.techradar.com/pro/security/nyu-website-defaced-as-hacker-leaks-info-on-a-million-students,HellYeahDamnWrite
technology,1k0i3qc,Google faces £5 billion lawsuit in the UK for abusing 'near-total dominance' in search,,272,0.95,48,2025-04-16 11:30:06,https://www.cnbc.com/2025/04/16/google-sued-for-5-billion-in-the-uk-for-abusing-dominance-in-search.html,ControlCAD
technology,1jiqk8a,Hijacking news: Fake media sites sow Ukraine disinformation,,267,0.92,6,2025-03-24 13:23:33,https://www.france24.com/en/live-news/20250324-hijacking-news-fake-media-sites-sow-ukraine-disinformation,Wagamaga
technology,1k5dacx,A 5-minute charge to go 320 miles. Chinese EV battery giant CATL says its tech is even better than Tesla-killer BYD’s,,427,0.93,84,2025-04-22 18:13:54,https://www.cnn.com/2025/04/22/cars/china-catl-ev-battery-upgrade-intl-hnk/index.html,turb0_encapsulator
technology,1jpdh6n,"ZeniMax workers union votes to authorize a strike against Microsoft over stalled contract negotiations | After nearly two years of negotiations, a contract agreement still hasn't been reached.",,260,0.95,5,2025-04-02 02:07:18,https://www.pcgamer.com/gaming-industry/zenimax-workers-union-votes-to-authorize-a-strike-against-microsoft-over-stalled-contract-negotiations/,ControlCAD
technology,1k451e4,Neuralink Rival Gets FDA Clearance in Path to Less Invasive Brain Implants,,263,0.94,25,2025-04-21 04:25:42,https://www.bloomberg.com/news/articles/2025-04-17/neuralink-rival-precision-neuroscience-receives-fda-clearance-on-brain-device,waozen
technology,1jxv4mg,Microsoft's Windows 95 startup sound has been immortalized in the Library of Congress,,258,0.92,18,2025-04-13 00:10:19,https://www.tomshardware.com/software/windows/microsofts-windows-95-startup-sound-has-been-immortalized-in-the-library-of-congress,Logical_Welder3467
technology,1k26629,Crosswalks are being hacked to imitate tech billionaires,,257,0.94,2,2025-04-18 14:23:35,https://www.engadget.com/general/the-morning-after-engadget-newsletter-111621557.html,Javischak
technology,1jpn7ql,This Is How You Get a Chinese EV Into the United States,,256,0.76,126,2025-04-02 12:21:47,https://www.wired.com/story/this-is-how-you-get-a-chinese-ev-into-the-united-states/,Exciting_Teacher6258
technology,1k1fo0g,"Google Has an Illegal Monopoly in Ad-Tech Market, Judge Rules",,255,0.94,10,2025-04-17 15:31:02,https://variety.com/2025/digital/news/google-monopoly-ad-tech-judge-ruling-1236371629/,cmaia1503
technology,1k4hqbl,Google faces off with DOJ in attempt to break up company,,260,0.95,19,2025-04-21 16:30:59,https://apnews.com/article/google-search-monopoly-breakup-chrome-09b695c8de6c91b3d1e1b5305393f235,Strict-Ebb-8959
technology,1jswe5a,NVIDIA Makes PhysX & Flow GPU Code Open-Source,,253,0.94,25,2025-04-06 15:14:31,https://www.phoronix.com/news/NVIDIA-OSS-PhysX-Flow-GPU,GL4389
technology,1js28fn,Inside DOGE’s AI Push at the Department of Veterans Affairs,,253,0.93,15,2025-04-05 12:22:34,https://www.wired.com/story/doge-department-of-veterans-affairs-ai/,Exciting_Teacher6258
technology,1jwh011,Researchers concerned to find AI models hiding their true “reasoning” processes | New Anthropic research shows one AI model conceals reasoning shortcuts 75% of the time,,255,0.84,80,2025-04-11 03:56:44,https://arstechnica.com/ai/2025/04/researchers-concerned-to-find-ai-models-hiding-their-true-reasoning-processes/,ControlCAD
technology,1js5863,Autism disinformation on Telegram soars in Latin America and Caribbean,,252,0.94,8,2025-04-05 14:53:38,https://agenciabrasil.ebc.com.br/en/saude/noticia/2025-04/autism-disinformation-telegram-soars-latin-america-and-caribbean,Wagamaga
technology,1juj19v,Water filter with nanoscale channels selectively removes stubborn 'forever chemicals',,254,0.97,10,2025-04-08 17:18:59,https://phys.org/news/2025-04-filter-nanoscale-channels-stubborn-chemicals.html,Snowfish52
technology,1jlhxgz,"Musk 'Pressured' Reddit CEO to Silence DOGE Critics, Leaving Moderators Outraged",,250,0.99,38,2025-03-28 00:06:21,https://www.latintimes.com/musk-pressured-reddit-ceo-silence-doge-critics-leaving-moderators-outraged-report-579411,aacool
technology,1jtg6j8,No joke: Microsoft foolishly published inaccurate price list on April 1st,,251,0.91,14,2025-04-07 08:12:50,https://www.theregister.com/2025/04/07/microsoft_april_1_pricing_mistake/,Loki-L
technology,1jrfztl,DOGE wants to modernize Social Security’s legacy tech — what could possibly go wrong?,,242,0.91,75,2025-04-04 16:23:30,https://www.computerworld.com/article/3953741/doge-wants-to-modernize-social-securitys-legacy-tech-what-could-possibly-go-wrong.html,CrankyBear
technology,1joayki,An AI Image Generator’s Exposed Database Reveals What People Really Used It For | An unsecured database used by a generative AI app revealed prompts and tens of thousands of explicit images—some of which are likely illegal. The company deleted its websites after WIRED reached out,,247,0.9,64,2025-03-31 18:55:14,https://www.wired.com/story/genomis-ai-image-database-exposed/,Hrmbee
technology,1jksp0n,Scientists Turn Light Into a “Supersolid” Form for the First Time—a Quantum Physics Revolution,,246,0.92,55,2025-03-27 01:37:47,https://dailygalaxy.com/2025/03/scientists-turn-light-into-a-supersolid-form-for-the-first-time-a-quantum-physics-revolution/,upyoars
technology,1jk993u,"Apple Snoozed, so Now It Might Lose Google as Its Default Search Engine (and $22 Billion a Year) | Apple could be out $20 billion because of a court's decision.",,241,0.86,111,2025-03-26 11:11:16,https://gizmodo.com/apple-snoozed-so-now-it-might-lose-google-as-its-default-search-engine-and-22-billion-a-year-2000580603,chrisdh79
technology,1k3qtr8,Cupertino: City pays Apple $12.1 million following sales tax settlement,,239,0.94,16,2025-04-20 16:47:19,https://www.mercurynews.com/2025/04/18/cupertino-city-pays-apple-12-1-million-following-sales-tax-settlement/?share=toliegt1wllnt5ilel00,nosotros_road_sodium
technology,1k101xv,LAPD Publishes Crime Footage It Got From a Waymo Driverless Car | Police are starting to realize they can demand footage from driverless cars.,,236,0.93,24,2025-04-17 00:37:36,https://www.404media.co/lapd-publishes-crime-footage-it-got-from-a-waymo-driverless-car/,chrisdh79
technology,1jv6knw,China halts export of valuable rare earths minerals to US – DW,,240,0.98,21,2025-04-09 14:03:56,https://www.dw.com/en/china-halts-export-of-valuable-rare-earths-minerals-to-us/video-72182641,Fritja
technology,1jo69j9,A brain-reading implant that translates neural signals into audible speech has allowed a woman with paralysis to hear what she intends to say nearly instantly,,240,0.94,27,2025-03-31 15:43:57,https://www.nature.com/articles/d41586-025-01001-6?linkId=13744437,nimicdoareu
technology,1jpxxb2,BYD sold one million vehicles in Q1/2025,,237,0.9,39,2025-04-02 19:47:54,https://www.electrive.com/2025/04/02/byd-sold-one-million-vehicles-in-q1-2025/,Wagamaga
technology,1k4ft1x,AI-generated videos now possible with gaming GPUs with just 6GB of VRAM,,238,0.76,67,2025-04-21 15:06:12,https://www.tomshardware.com/tech-industry/artificial-intelligence/framepack-can-generate-ai-videos-locally-with-just-6gb-of-vram,ControlCAD
technology,1k3nm4p,Widespread Microsoft Entra lockouts tied to new security feature rollout,,234,0.95,16,2025-04-20 14:21:38,https://www.bleepingcomputer.com/news/microsoft/widespread-microsoft-entra-lockouts-tied-to-new-security-feature-rollout/,lurker_bee
technology,1k0udgt,LG TVs’ integrated ads get more personal with tech that analyzes viewer emotions,,227,0.9,140,2025-04-16 20:20:18,https://arstechnica.com/gadgets/2025/04/lg-tvs-integrated-ads-get-more-personal-with-tech-that-analyzes-viewer-emotions/,MrsSynchronie
technology,1jjyany,"In Warning Sign for Hollywood, Younger Consumers Are Choosing Creator Content Over Premium TV and Movies",,231,0.89,143,2025-03-25 23:54:08,https://www.hollywoodreporter.com/business/business-news/deloitte-gen-z-creator-content-streaming-price-1236171227/,ControlCAD
technology,1jm2g9c,The ChatGPT 4o Studio Ghibli AI Trend Is The Ultimate Heartbreak,,225,0.74,112,2025-03-28 18:49:23,https://www.forbes.com/sites/paultassi/2025/03/27/the-chatgpt-4o-studio-ghibli-ai-trend-is-the-ultimate-heartbreak/,taloSilva2005
technology,1k3k2xg,"New graphene-based flash memory writes data in 400 picoseconds, shattering all speed records | ""PoX"" can execute 25 billion operations every second",,227,0.93,19,2025-04-20 11:01:30,https://www.techspot.com/news/107614-new-graphene-based-flash-memory-writes-data-400.html,chrisdh79
