subreddit,post_id,title,content,score,upvote_ratio,num_comments,created_at,url,author
VietNam,1jkjrhz,Vietnam to allow SpaceX's Starlink satellite internet service,,64,0.89,53,2025-03-26 19:04:46,https://www.reuters.com/technology/space/vietnam-issues-decision-allow-spacexs-starlink-satellite-internet-service-2025-03-26/,lurker_bee
VietNam,1jyd4rd,"Obsessed Fan Grabs Head, Scratches Sơn Tùng M-TP's Arm; Security Team Criticised","Sơn Tùng M-TP experienced an incident with an overzealous fan during the *Sky Wave* concert, held on the night of April 12 in Hạ Long (Quảng Ninh Province, Vietnam). The incident has sparked outrage among netizens and fans alike.

# Obsessed Fan Jumps on Sơn Tùng M-TP

According to the circulating video, a male audience member unexpectedly breached security, ran onto the stage, and forcefully hugged and then jumped on Sơn Tùng M-TP.

Though surprised by the aggressive behaviour, the artist quickly regained his composure and politely said: ""Calm down, thank you so much everyone.""

Despite being pushed away by Sơn Tùng M-TP, the obsessed fan continued circling back and tried to pull the artist close again.

Only after security appeared did the fan return to the audience area. Concerned for the fan's safety, Sơn Tùng M-TP was heard saying ""careful, careful"", and kept repeating ""it's okay, thank you very much"".

Based on photos and videos, Sơn Tùng M-TP sustained a light scratch on his arm, with visible abrasions and bleeding following the incident.

Online, many have expressed concerns about the professionalism of the organisers for allowing such a dangerous situation to happen.

Comments from viewers include: ""Where were the security guards? It took them 2-3 minutes to get up there,"" ""So frustrating to watch,"" and ""What kind of show is this? So poorly managed.""

Some also pointed out that ""whether you're a fan or not, you can't behave in a way that endangers the artist and disrupts the entire programme"".

In addition to criticism of the organisers, many viewers praised Sơn Tùng M-TP's ability to handle the situation. Despite the chaos, the artist remained calm and continued interacting warmly with fans.

So far, neither the male singer nor the event organisers have commented on the fan's aggressive behaviour.

# Controversial Concert?

Previously, this concert had already sparked frustration due to ticket price fluctuations.

Tickets went on sale on March 16 and sold out all 10,000 within a day. However, many people were unable to buy tickets, while on the black market, tickets were still being sold in large quantities.

This was believed to be caused by ticket scalpers hoarding large amounts of tickets, then rushing to undercut official prices.

Resale prices fluctuated by the minute, with some tickets selling for 20–50% less than the original price, or even as buy-one-get-one-free deals.

This led to malicious rumours on social media, especially when some seats appeared empty, with people speculating that Sơn Tùng M-TP's popularity might be ""cooling off"".",64,0.85,19,2025-04-13 17:34:00,https://v.redd.it/31sseuh61nue1,notAssmin
VietNam,1jx7u0t,Vietnam's first successfully conducted partial artificial heart transplant.,"On April 12th, the 108 Central Military Hospital announced that its doctors had successfully performed Vietnam's first third-generation partial artificial heart transplant (LVAD - HeartMate 3). This marks a significant milestone, bringing Vietnamese medicine closer to advanced medical practices worldwide.  ",59,0.94,10,2025-04-12 03:09:48,https://www.vietnamplus.vn/thuc-hien-thanh-cong-ca-ghep-tim-nhan-tao-ban-phan-lan-dau-tien-tai-viet-nam-post1027289.vnp,sssssammy
VietNam,1jtojdq,What’s with the anti Viet Kieu with northern VNmese?,"TLDR; running into a lot of “how can you be Viet if…” comments from seemingly northerners.

Some background: I was born in HCM, lived a bit in Cambodia, and then moved to the UK when I was eight. So my Vietnamese is at the level of an eight year old (speaking, reading, and writing). 

I’ve now had multiple instances where (seemingly northerners) have made rude comments towards me. 

2016 - First time was at Tan Son Nhat, I asked for help with a form and was told ”người Việt mà không biết tiếng Việt”. Basically how am I Vietnamese without knowing Vietnamese. 

2023 - Second time was in the Vietnamese embassy in London where they had no English forms and I asked for one and was sighed at and also berated for not knowing Vietnamese. Ended up following along with Google translate.

2025 - Third time, also Tan Son Nhat. Tried to set up for the autogate and the guy behind the counter spoke very fast with a strong northern accent (not something I’m exposed to much). Then when I told him I didn’t understand much he asked me how I could have a Vietnamese passport if I didn’t understand. To which I responded that I was born here and left when I was young. He of course responded saying I shouldn’t have one if I don’t understand… 

Each incident seems to have common themes. My inability to understand high level language, and their northern accents. 

Anyone else experienced something similar?

Edit:
Just want to make sure people are not getting the wrong end of the stick. Perhaps my choice of wording isn’t right. I’m just trying to understand if there is context I am missing for these encounters - which some of you have informed me about the sentiments from Northerns to Viet Kieus from the war (and I appreciate that) it adds context. 

I’m not trying to say all Northerners hate Viet Kieus, in my experience it just seems to happen when official documents/processes and a northern dialect is involved. I’ve had very loving and kind interactions with people from all over Viet Nam, including the north. ",61,0.73,121,2025-04-07 15:49:59,https://www.reddit.com/r/VietNam/comments/1jtojdq/whats_with_the_anti_viet_kieu_with_northern_vnmese/,t_thi
VietNam,1jzo48j,Ha Giang Loop: Any tours with smaller groups + fun party vibe but not too wild?,"was looking at Mama’s for the Ha Giang Loop but their groups are big (15–20 people) and they split by nationality…. prefer something with smaller groups (max 12?), still fun and social with a solid party vibe - just not full-on “mad monkey” level chaos. any suggestions?",60,0.95,20,2025-04-15 10:05:20,https://i.redd.it/1uig5au33zue1.jpeg,Effective_Show_9043
VietNam,1joc4fc,Handcrafted In Hoi An,Loves this dress one off. ,58,0.85,37,2025-03-31 19:42:46,https://v.redd.it/unmojvrfw2se1,Asleep_Bench_6660
VietNam,1jn6m5x,Some Pictures from my Vietnam Travel,,59,0.98,4,2025-03-30 06:38:26,https://www.reddit.com/gallery/1jn6m5x,kumarmadhavnarayan
VietNam,1jwf1zd,Bun Thap Cam,Hanoi style Bun. In Saigon ,60,0.95,4,2025-04-11 02:09:17,https://www.reddit.com/gallery/1jwf1zd,americaninsaigon
VietNam,1jr3i0h,Trump Open to Tariff Cuts in Return for ‘Phenomenal’ Offers,,57,0.95,43,2025-04-04 04:31:55,https://www.bloomberg.com/news/articles/2025-04-03/trump-says-he-s-open-to-reducing-tariffs-for-phenomenal-offers?embedded-checkout=true&leadSource=reddit_wall,esporx
VietNam,1jje5gf,What does this decoration from my ông ngoại’s house say/represent? The words on top are difficult to read,,58,1.0,19,2025-03-25 07:51:10,https://www.reddit.com/gallery/1jje5gf,ale6898
VietNam,1jxdkzg,"Chỉ trong 4 ngày, 44 tờ khai xuất khẩu hơn 18.000 tỷ đồng bị hủy, 273 đơn hàng bị khách Mỹ báo hủy, tạm dừng: Bình Dương lập tức hành động",,56,0.88,16,2025-04-12 09:37:51,https://m.cafef.vn/chi-trong-4-ngay-44-to-khai-xuat-khau-hon-18000-ty-dong-bi-huy-273-don-hang-bi-khach-my-bao-huy-tam-dung-binh-duong-lap-tuc-hanh-dong-188250411210858504.chn,Resident-Pen5451
VietNam,1jtdut9,“Just 8 more lanes bro I swear”,,54,0.91,10,2025-04-07 05:24:29,https://i.redd.it/mvwr2xumlcte1.jpeg,NatterHi
VietNam,1jq70a6,Vietnam Charm Offensive Fails to Stave Off 46% Trump Tariff,,54,0.88,30,2025-04-03 02:29:59,https://www.bloomberg.com/news/articles/2025-04-02/vietnam-s-charm-offensive-fails-to-stave-off-huge-trump-tariff,s1n0d3utscht3k
VietNam,1k0d88i,The new Vietnam Airlines 30th anniversary special livery,"What are your thoughts on this new livery?
Also I got invited by the airline for the photo tour for this unveiling, so what do you guys think?

For me it looks nice, been a while they had not been adding any cool liveries.",57,0.95,13,2025-04-16 05:50:14,https://www.reddit.com/gallery/1k0d88i,TGWARGMDRBLX
VietNam,1jzp5i2,"The reason why a lot of Vietnamese people have the rude ""me-me-me"" attitude","I'm NOT saying that Vietnamese people are Chinese, but there are many similarities. This video explains it:

[https://www.youtube.com/watch?v=L5O\_HsrQT7I&ab\_channel=ShanShan](https://www.youtube.com/watch?v=L5O_HsrQT7I&ab_channel=ShanShan)

In short, it's a lack of emphasis on courtesy and empathy in the education system",53,0.62,134,2025-04-15 11:10:24,https://www.reddit.com/r/VietNam/comments/1jzp5i2/the_reason_why_a_lot_of_vietnamese_people_have/,headhonchobitch
VietNam,1jo0itn,Just passed a group of about 25 Mormans.,They look like they are all here on mission. How did they get visas? Are they allowed to evangelise on tourist visas?,53,0.81,89,2025-03-31 11:01:21,https://www.reddit.com/r/VietNam/comments/1jo0itn/just_passed_a_group_of_about_25_mormans/,PropMop31
VietNam,1jn87vo,Egyptian in vietnam!,,56,0.91,4,2025-03-30 08:42:37,https://www.reddit.com/gallery/1jn87vo,asosass
VietNam,1jx4v6v,why is Hai Phong so red 🤔,,57,0.95,20,2025-04-12 00:27:31,https://i.redd.it/i29cdb8ataue1.jpeg,Fit_Lemon_4621
VietNam,1jut7l7,is Tran Hung Dao worshipped/known as the “god of war” in vietnam?,pic credits: Cao Viet on ArtStation ,56,0.82,41,2025-04-09 00:40:20,https://www.reddit.com/gallery/1jut7l7,hamach1
VietNam,1jycoam,Moving to Vietnam,"Hi, I’m from the U.S. and got married to a Vietnamese woman in Vietnam two years ago. I knew her the previous 5 years on Facebook. I lived in Seattle, and made several Vietnamese friends there that introduced us. 

I always wanted to visit her, she made me wait 5 years, lol. Fell in love before we ever met. 

We were originally going to try and get her immigration here. The last two times I was in Vietnam, I fell in love with the country and the people. Her family loves me, and don’t expect anything from me than to be happy. 

I like the U.S., but live Vietnam. I have no real family here…and have hers there. I told her I’d like to move to VN, and the entire family was happy. 

They are not rich, not poor, own businesses and live comfortable lives. I’m not rich either. Everyone I met there was very kind to me. 

I plan on coming in about a month. With all this Trump news going on, I hope people are still kind to Americans that love Vietnam. Thought I’d come on here and see how people felt about people like me. I don’t care much for politics, I love my wife and Vietnamese family…and am coming regardless…asking if you think Americans will be treated differently because of what Trump does or doesn’t do? I don’t support him. Thanks for your thoughts, and for the wonderful times I had there 😊",54,0.79,74,2025-04-13 17:14:15,https://www.reddit.com/r/VietNam/comments/1jycoam/moving_to_vietnam/,Altruistic_End_4329
VietNam,1jvo05c,ELI5 - How most Vietnamese cafes allow food from outside? (I love this concept),"I have been to some amount of both developed and developing countries around the world and haven't seen this open culture of allowing food from outside. Even in my developing country (India) this is looked down upon or outright prohibited.

I wonder how do Vietnamese feel about it and how does it work? Can someone explain?

PS: I love it. I wish every country had this culture",51,0.86,43,2025-04-10 02:59:36,https://www.reddit.com/r/VietNam/comments/1jvo05c/eli5_how_most_vietnamese_cafes_allow_food_from/,soumitra_sg
VietNam,1js88he,Man on a bicycle,,56,0.97,3,2025-04-05 17:08:21,https://i.redd.it/42zk0qhgt1te1.jpeg,covinjo
VietNam,1jpk4am,Why does it look like a unicorn puked on all the streets around Danang,"Don't mean any disrespect by, just been seeing it all over Danang.  My friends and I have jokingly referring to it as unicorn puke, but we know it's part of some ritual, and we'd like to know about it.  So what is it??",51,0.86,29,2025-04-02 09:00:44,https://i.redd.it/3w99xe4fzdse1.png,earlbonor
VietNam,1k453m3,"When in Hoi An, hop on random water buffalo!",Two pix!! ,52,0.69,20,2025-04-21 04:29:29,https://www.reddit.com/gallery/1k453m3,Enough_Memory4918
VietNam,1jy5bgy,Night at Saigon city,,52,0.92,6,2025-04-13 11:13:25,https://www.reddit.com/gallery/1jy5bgy,Ill_Panda3275
VietNam,1jvptd7,My husband called my phone and a stranger answered but it was with me the whole time. What the hell? Help,"I was looking for my phone at the end of the night — my husband called me so we could find it. We had just gotten out of a Grab and gotten home. 

When he called a Vietnamese woman answered the phone and was talking and talking - didn’t seem to be able to hear what I was saying as I was asking her if she had my phone… I was worried that I had left it in the Grab or lost it on the street and she had picked it up. After about two minutes she hung up. I called a few more times and no one answered.

So I went to the Find my iPhone app and it said my phone was in my house. So I go back in and we call it again and it ends up it was under my pillow the whole time. 

What the hell happened here? Has this happened to anyone else? 
",52,0.84,71,2025-04-10 04:46:43,https://www.reddit.com/r/VietNam/comments/1jvptd7/my_husband_called_my_phone_and_a_stranger/,Katarshall
VietNam,1jryvod,"Why do people say ""Europeans kick out their children at 18"" to their children ?","I happen to find an online argument about a Taiwanese child filling lawsuit because his mom got into his room without permission and burned his comics. Of course with Vietnamese law also included the right to have privacy but then when i said about that they also cited law that children must obey to parents, again also saying that in Europe, if they are over 18, they should be leaving out, parents kick out, if staying then no complain. I looked into other reddit pages in european countries, for example in Germany they do have the right to kick children out at 18, yet their law says parents must pay for children until they finished education that enables them to go and work (maximum 25). They also say kicking out isn't a culture there. So if it is not culture there, why do they keep telling such stories of parents kicking out at 18 as if it is their culture ? Do they even think about the legitimacy of such an argument ?",50,0.85,80,2025-04-05 08:30:18,https://www.reddit.com/r/VietNam/comments/1jryvod/why_do_people_say_europeans_kick_out_their/,EqualChemical2877
VietNam,1jnz9kx,"A 106 member Vietnamese rescue team from the Ministry of National Defence and the Ministry of Public Security arrived in Myanmar and delivering $300,000 in emergency aid to support recovery efforts after the devastating 7.7-magnitude earthquake.",,51,0.94,1,2025-03-31 09:33:22,https://www.reddit.com/gallery/1jnvciz,Red_Lotus_Alchemist
VietNam,1jmbuss,"Internet culture is horrible in Vietnam, even in small and niche hobby group","
I collect pokemon card, and is in several facebook groups. Sometimes newcomer would come in the group, posting and asking about counterfeit card? 

What would be your reply to these posts? 

A: Hey mate your card is fake, here is how to differentiate them in the future

B: Joke about how the card is ""invaluable""

C: Cynical and straight up mean reply about how dumb the original poster is. That they should ""Tự cầm lấy mà chơi""

If you are lucky, you get B, most of the time it is C. 

Reminder that this is a group where we collect Pokemon card, imagine what is happening on a more serious space. Why do we always feel the need to act superior and display cynicism wherever we go? Why suck out all positivity whenever you show your presence? 

What's funny is that reddit, all of places, is where i find rare instances of people being decent to each other. And i understand if cynicism is all you receive, you are probably going to give it out to the world too, so it's just gonna turn into a stupid, depressing cycle.

Probably an unhelpful post because this is mostly a rant without giving a solution, but i guess i am wondering if anyone has noticed this too? ",52,0.84,27,2025-03-29 02:01:01,https://www.reddit.com/r/VietNam/comments/1jmbuss/internet_culture_is_horrible_in_vietnam_even_in/,The_Bear_Baron
VietNam,1jn3fzc,Hoi An tailors may be marking up hundreds of percents - my experience,"Hey everyone, just want to share my experience with tailors in Hoi An. So i went to the most popular tailor there and made a kimono. Pure silk, nice fabric etc, the service was nice as well. The price tag was of 200$. 

I thought it was kinda expensive but then i was like yea pure silk, handmade, guess it is worth this much.

Then we went to Hue, and to Da Nang. Went to the most popular tailors there, and the pricetags for identical models from also 100% silk, of the same fabric texture and feel, cost 35-50$. With a way bigger selection of silk even.

So this post is not to defame any tailor in hoian or to convince people to get their clothes tailored elsewhere, this is just my experience. The price me and my wife paid for a kimono and a dress was enough to buy about 5 custom made silk kimonos for my entire family + lots of silk for my mum. If you will find yourself in a similar situation, maybe this post can help you research more places and find the place that fits best your budget, needs and itinerary!
",51,0.89,67,2025-03-30 03:09:34,https://www.reddit.com/r/VietNam/comments/1jn3fzc/hoi_an_tailors_may_be_marking_up_hundreds_of/,whlatislovee
VietNam,1jjgohn,Waterfall & Camping around Danang,"""Looking for good camping spots around Da Nang! I’ve been to Hao Bac Valley a few times and the beaches, but looking to explore more. Any recommendations? Also, any good waterfalls nearby?  Somethings like the ones in these photos Thanks!",51,1.0,1,2025-03-25 10:59:42,https://www.reddit.com/gallery/1jjgohn,earlbonor
VietNam,1k4qcqn,VietJet Air is the worst,"It’s just that, it’s the worst. Don’t fly with them.",52,0.86,60,2025-04-21 22:17:43,https://www.reddit.com/r/VietNam/comments/1k4qcqn/vietjet_air_is_the_worst/,Yoooo_vacation
VietNam,1k0mr0h,Horse abusers in vietnam.,"In Ho chi minh city there are people, in Vietgangz horse something something. You can find them on google maps. 

88 Đường số 9, Long Phước, Thủ Đức, Hồ Chí Minh 700000

I have witnessed one of the trainers ruthlessly whip a horse when it went into the fence. When the trainee explicitly says: I think my horse is in pain. She’s pinning her ears back, sometimes slipping and bucking. Can you please check the tack and if i’m doing something wrong. 

They respond: no, no, it’s fine, just continue. 

And the trainer must know better, right? Wrong. After the lesson after the person got off the horse was foaming at the mouth and had eye wrinkles. That is wrong. I am not going back.

And one of the horses that got loose and slammed into another horse on gallop because the it was obviously improperly trained, the trainer and human is always at fault, I had witnessed it get whipped.

And why i couldn’t do anything? I am a kid. No one will listen to a teen. The adults know better right? The same adults who pout and whine when my mom wants to switch trainers because the trainer before was not right for me. The same adult who now glares at me when i come to train, or rather, came to train. These are man-children who take their anger out on helpless animals. I hope they get shut down. Please report them. I wish i had my phone with me so i could film and post it. If i ever go back and see that again - i’m filming it.",50,0.87,30,2025-04-16 15:08:49,https://www.reddit.com/r/VietNam/comments/1k0mr0h/horse_abusers_in_vietnam/,Efficient-Wallaby162
VietNam,1jyh0hd,Can someone translate this?,I got it from my grandma in Vietnam but I don't understand viet...,50,0.92,85,2025-04-13 20:20:07,https://i.redd.it/1xkaok2vunue1.jpeg,mochimatchayum
VietNam,1jrgke5,First country in SEA to close a deal with Trump?,"https://preview.redd.it/iftomx1mkuse1.png?width=1206&format=png&auto=webp&s=b80b0292c4428b4376b9abdacaff523a475bd723

",52,0.81,78,2025-04-04 16:47:17,https://www.reddit.com/r/VietNam/comments/1jrgke5/first_country_in_sea_to_close_a_deal_with_trump/,euan-b02
VietNam,1jlmqhv,"To anyone visiting North Vietnam soon, just an FYI, burn season is very real and still in full swing.","Don’t listen to people underplaying burn season. 

I’m in Sapa right now and it is smoky af. I’m about to do the Ha Giang loop and lowkey regretting my decision to not wait.

So many people on here trying to re-brand it as misty or “not actually that bad”, but if you enjoy seeing the sky and having clear sinuses… honestly skip it. Change plans and go south (or just come in a few months during rainy season).

I’ve lived in LA for the past decade and when the air quality is this bad from the fires, it’s a crisis. People leave the city. 

To be clear I’m not saying don’t ever go, it’s clearly insanely beautiful here. Just don’t go right now.

",49,0.87,35,2025-03-28 04:13:41,https://www.reddit.com/r/VietNam/comments/1jlmqhv/to_anyone_visiting_north_vietnam_soon_just_an_fyi/,Karma_Circus
VietNam,1jzpsvl,Saigon at night. Perfect to wander around looking for food and enjoying my hobby,"Love just walking around stopping for food and improving my hobby for photography. Sometimes it's so so much interesting things going on that I get to overwhelmed, but so far i love it! ",51,0.98,6,2025-04-15 11:46:36,https://www.reddit.com/gallery/1jzpsvl,godsilla8
VietNam,1jug4ej,Go watch Tunnel/ Địa Đạo. Highly recommend!,"I know it kind of sudden, but HOLY SHIT! The movie is good. 

I came in, expecting something like: ""Captialism U.S.A bad!!!! Communism good, it is freedom, it is what we fought for!"" And hell, I set the bar so LOW! I even brought my sketch note and a pen with me write down the bad parts of the movie but it never leave my pocket until the credit roll. 

But no! It was Good, really good, to the point that I ponder whether or not it was made by A24. The story, the pacing, the message, the combat, the sound even, it was SO GOOD! Maybe the only downside I can mentioned of the fighter plane and that just it, it show once during the bombing, and all, 10 seconds in an 2 hour film. It leave time for moment to linger and rememberable. Especially some of the death brutal and raw but not to the point it completely romantize them. 

Maybe the character is a bit cliché and I do agree that some romantic part of the story is one of the weak point but it so small and was in the first stage movie that it kind of was wash over me. 

On top of that...FINALLY! NO ""HÀI NHẢM"" and that is such a fresh air. The humor is on point and fit with the moment and you could felt like it could be something they said in that moment.

Lastly, the message, it is pro-communism? Actually and unexpect-ly no. Maybe there is but it was so suttle and would wash over those who aren't native and trying dig too too deep into politic. And it is another great point of the movie because it felt relatable to my own belief of the core reason we fight was just for freedom, that it is. There are no politic, no communism ideal shove down my throat, it is just about 'Why we fight?' . Just that and it give me that patriotic feeling. 

I am not saying this because I am patrioic or communist ethutiastic or want to ""support Vietnamese movie industry"" kind of guy. I have seen bad Vietnamese movie, really bad one that have oversexulizing or just cringy, trying to copy major action movie (858 or something, really terrible). 

In conclusion: It is peak Vietnam Cinema for me, and if anything, it be like the Battlefield 1 of Battlefield franchise- a well-respected and well made historical media. Hope this is what they will put in Cu Chi Tunnel cinema, because it really fit compare to what they had now.

So yeah! If you had some time, go watch it. ",47,0.79,33,2025-04-08 15:19:00,https://i.redd.it/3v8cduqoomte1.jpeg,binhan123ad
