subreddit,post_id,title,content,score,upvote_ratio,num_comments,created_at,url,author
VietNam,1jv4hdf,KIẾM CÔNG VIỆC DỊCH THUẬT/PHIÊN DỊCH TỪ XA,"Có ai đang cần một phiên dịch viên hoặc cộng tác viên dịch thuật làm việc từ xa không?

Mình đã tốt nghiệp ngành Biên – Phiên dịch tiếng Anh, có kinh nghiệm làm việc trong các lĩnh vực y tế, du lịch, giáo dục. Mình từng làm việc tại bảo tàng và hỗ trợ giao tiếp cho khách quốc tế. Mình sử dụng thành thạo tiếng Anh (gần như bản ngữ), tiếng Việt (bản ngữ) và tiếng Nhật trình độ sơ cấp (N4). Có thể đảm nhận cả dịch viết lẫn phiên dịch.

Hiện mình đang sinh sống tại Huế và chỉ tìm kiếm các cơ hội làm việc từ xa/làm việc tại nhà — có thể là toàn thời gian, bán thời gian hoặc các dự án ngắn hạn. Nếu anh/chị biết đến công việc phù hợp, xin hãy liên hệ với mình. Mình thực sự đang cần việc và rất mong nhận được sự giúp đỡ.

Chân thành cảm ơn sự quan tâm và hỗ trợ!",2,0.67,1,2025-04-09 12:24:29,https://www.reddit.com/r/VietNam/comments/1jv4hdf/kiếm_công_việc_dịch_thuậtphiên_dịch_từ_xa/,Opening-Fig-4132
VietNam,1jv3edm,3///?,"A Vietnamese person who lives in the US tweeted, ""I was never taught this flag (the flag is light blue on bottom, red on top, yellow star in middle) growing up. Especially in school.
To be fair, my parents never explained to me the 3/// either.""

Can someone explain what does 3 /// mean? I've seen it in a few tweets about Vietnam and viet diaspora but I can't find anything about it when I search or why Viet parents wouldn't teach about it ",3,0.59,18,2025-04-09 11:24:28,https://www.reddit.com/r/VietNam/comments/1jv3edm/3/,Captainbluehair
VietNam,1jurpbz,Vietnam trip how/when to go to Sapa,"Hello all,

I am having trouble planning a 3 days trip to Sapa from Hanoi using a VIP overnight bus. I will be arriving in Hanoi on July 30, and leaving to Sapa on the 31st at night.

1. When should I book for the VIP bus? Is it possible to book on arrival with hotel and will there be space available? Or would it be better to book online and which company is better? Does anyone have experience with this?
2. Do you guys have any nice hotel recommendations (looking for nice hotel views and amenities)!
3. How many days do you recommend to stay in Sapa for? I only have 6 full days in Hanoi before leaving to Da Nang and HCMC.
4.  Are there any good hotel rec. in Hanoi with nice view, good location, and would help book trip to Sapa in advance?

Im sorry if this is duplicate post or if someone else has already posted this. I cant seem to find a more definite answer ;( .",2,0.76,3,2025-04-08 23:25:37,https://www.reddit.com/r/VietNam/comments/1jurpbz/vietnam_trip_howwhen_to_go_to_sapa/,Sea-Trouble4184
VietNam,1jui13o,Coffee Help!,"I’ve been to Vietnam twice now and really struggling to replicate the Vietnamese iced coffee at home. Last time I was there I even went to a coffee making class and learned nothing as I already knew how to make one😭
I have tried a variety of Trung Nguyen grounds numbers 2-5 but they don’t taste like the drink I had when I was out there. 
I must note I live in England so certain grounds I’ve had difficulty finding.
Please please please help 
",2,0.75,18,2025-04-08 16:38:01,https://www.reddit.com/r/VietNam/comments/1jui13o/coffee_help/,stelph
VietNam,1jud7xk,Biking from north to south,"I’ll set the scene, been travelling for a few months and met a friend who wants to bike through the country! 

Starting in Hanoi is about the extent of the plans right now, we aim to go rural to experience something authentic, staying at hostels along the way. 

We want to experience what Vietnam truly is so any suggestions in places to visit, routes to adventure through and city’s to go through to. Any help will be appreciated :)) it’s gonna be so sick ",2,0.75,7,2025-04-08 13:12:12,https://www.reddit.com/r/VietNam/comments/1jud7xk/biking_from_north_to_south/,BluePrintFrequency
VietNam,1ju9ci8,Want to send some snacks to Vietnam from the US,I wanted to send my Vietnamese friend some snacks from the US. What would be the best least expensive way to do that?,2,1.0,9,2025-04-08 09:21:37,https://www.reddit.com/r/VietNam/comments/1ju9ci8/want_to_send_some_snacks_to_vietnam_from_the_us/,Motor_Ad_3159
VietNam,1ju6kb9,Online shops international shipping,"I’m looking to buy a graduation dress from Krissy clothing. Shipping from Vietnam to US using UPS is around $80. 

Has anyone one bought from here? 

Or do you recommend any other stores?

I was also looking at DeNio store—any experience buying for either of these stores?

",2,1.0,0,2025-04-08 05:54:42,https://www.reddit.com/r/VietNam/comments/1ju6kb9/online_shops_international_shipping/,Perfect_Character_71
VietNam,1jtyhxd,Possible to Buy Name Brand Apparel at Major Discount Somewhere?,"When I was in Thailand, there was a store that sold Nike stuff for virtually nothing.  The clothes had a piece of tape over the swoosh and I think there were minor imperfections in the clothing.  Since so much is made in Vietnam, is there anywhere you can buy genuine stuff at a huge discount?",2,1.0,3,2025-04-07 22:41:34,https://www.reddit.com/r/VietNam/comments/1jtyhxd/possible_to_buy_name_brand_apparel_at_major/,biglebowskiny
VietNam,1jtx7dz,How long does it take to get from Can Tho to Soc Trang?,I am researching about the ferry to Con Dao and found out that the Superdong is leaving about 70km south of Can Tho form Soc Tang Port. However the Futa bus schedule says it takes 4h to get there? Is that really true? Google Maps says 2h and other people said it took them just about 1h .... what's the experience here? Thank you!,2,1.0,6,2025-04-07 21:43:20,https://www.reddit.com/r/VietNam/comments/1jtx7dz/how_long_does_it_take_to_get_from_can_tho_to_soc/,SafetyCutRopeAxtMan
VietNam,1jtx2em,Option to carry money,"Hi, we are traveling from Canada and I wanted to know what is the best means to carry money so we have some spending ability. Is it cash or a prepaid card? If it is prepaid card, any recommendation? Thanks!",2,1.0,13,2025-04-07 21:37:09,https://www.reddit.com/r/VietNam/comments/1jtx2em/option_to_carry_money/,Tanmaycookiemonster
VietNam,1jtlebc,Anime figure stores in Hoi An,Hi all I'm a tourist and trying to buy some figures in Hoi An while I'm there. Does anyone know any shops with reasonable price there?,2,1.0,1,2025-04-07 13:36:06,https://www.reddit.com/r/VietNam/comments/1jtlebc/anime_figure_stores_in_hoi_an/,Xa8iv
VietNam,1jtjx67,"Last few weeks of traveling, advice welcome!","Hi all, I'm in this amazing country, enjoying every minute of it. I've been here for two weeks. 

I leave on the evening of the 24th of April, and am currently in Dong Hoi. Here's the remainder of my itinerary - I'm completely open to suggestions, having things crossed off or replaced. 

About my travel style: I don't love the touristy things - Hoi An was too much for me, for instance. I liked Hue, but mostly because I went late, and it's such a huge site that I could avoid being stuck. 

I like cities, and the food, and generally, just walking around and seeing amazing Vietnam doing its thing. 

Do I HAVE to do ha long bay or cat ba? or better to spend a few more days in Hanoi? 

  
**April 8–9: Phong Nha (2 Days)**

* DIY scooter loop: Paradise Cave, Botanical Gardens (optional: Dark Cave)
* Afternoon boat to Phong Nha Cave
* Day 2: Chill or bike Bong Lai Valley 
* → **Night train to Ninh Binh**

**April 10–11: Ninh Binh (2 Days)**

* Day 1: Tam Coc, pagodas, boat ride
* Day 2: Hang Múa hike + bike Van Long Wetlands 
* → **Evening train to Hanoi**

**April 12–15: Ha Giang Loop (Now 4 Days)**

* Apr 12: Early van/bus from Hanoi to Ha Giang (\~6–7 hrs), rest and prep
* Apr 13–15: 3-day motorbike loop (Dong Van, Ma Pi Leng, Du Gia) 
* → **Evening return to Hanoi on Apr 15**

**April 16–17: Hanoi buffer days**

* Recovery + cafés, wandering, offbeat stuff like Long Biên Bridge at sunrise or Soviet-era apartment cafés

**April 18–21: Cat Ba Island**

* Kayak Lan Ha Bay, hike Cat Ba National Park, relax on beaches 
* → **Evening return to Hanoi**

**April 22–24: Final days in Hanoi**

* Old Quarter, markets, Moto San Uber Noodle, puppet show, slow goodbyes before evening flight

thanks all",2,1.0,1,2025-04-07 12:22:27,https://www.reddit.com/r/VietNam/comments/1jtjx67/last_few_weeks_of_traveling_advice_welcome/,Open_Outcome_5633
VietNam,1jtg518,Five Hour Transit,"I'm going to be flying from Cambodia to Osaka and there is a five hour layover in Vietnam (Hanoi).  Is there enough time to go into the city, grab a small bite and then come back?

I'm scared getting my Visa and things like that will be a hassle.

Thank you in advance!",2,1.0,9,2025-04-07 08:09:38,https://www.reddit.com/r/VietNam/comments/1jtg518/five_hour_transit/,gyunit17
VietNam,1jtcojo,Advice on bringing cigarettes from Vietnam to the UK,"I travelled to Vietnam for the first time last year and was pleasantly surprised at the low prices of many consumables, cigarettes being one of the best. £0.80 for a pack of Camel black teas compared to £16.50 Benson and Hedges in the UK. With the added bonus that I found the former a lot nicer.

I was told that 10 packs was the most I was allowed to bring home so I did and now I’ve almost run out. I’m returning to Vietnam again in November and I was just wondering if anyone else from the UK had done the maths on whether it’s worth it to bring home more than 10 packs and pay the import tax on them. The rules are a little confusing to me. Thanks!",2,0.63,7,2025-04-07 04:09:46,https://www.reddit.com/r/VietNam/comments/1jtcojo/advice_on_bringing_cigarettes_from_vietnam_to_the/,Zerxin
VietNam,1jt4x8n,Visiting Hanoi,Is it crazy to plan a visit to Hanoi in July because of the rain?,2,1.0,3,2025-04-06 21:24:50,https://www.reddit.com/r/VietNam/comments/1jt4x8n/visiting_hanoi/,homeanywhere
VietNam,1jt4aqv,Vietjet seat booking,"I know this sub hates VJ but sadly I've an international flight with them from Hanoi. Do i mandatorily need to pay for my seats? What if I don't pre-book seat, will they randomly assign a assign a seat for me for free or will I have to still pay up at the airport?",2,1.0,5,2025-04-06 20:56:11,https://www.reddit.com/r/VietNam/comments/1jt4aqv/vietjet_seat_booking/,champ19s
VietNam,1jswivv,May - a good time to visit? Confused about the weather,"Hey all! I’m planning a 10-day trip with my wife to Vietnam in May and would love some advice regarding the weather.

My tentative itinerary includes:
	•	Hanoi
	•	Ha Long Bay
	•	Hoi An
	•	Sapa

The dates are roughly mid-May to the end of May.

I’m from India, so I’m used to heat 30 to 35°C is tolerable for me but I’ve been getting mixed opinions. Some say it’ll be hellishly hot and humid and not enjoyable at all, while others say it’s manageable and a great time to go.

I’m trying to figure out if this trip will be doable weather-wise or if it’ll just be exhausting due to heat and humidity. I’m okay with warm weather, but I don’t want it to ruin the experience.

Anyone who’s been there during this time of year can you please share your experience? Is it still worth going, or should I consider shifting my dates?

Thanks in advance!
",2,1.0,6,2025-04-06 15:20:34,https://www.reddit.com/r/VietNam/comments/1jswivv/may_a_good_time_to_visit_confused_about_the/,ismavspace
VietNam,1jsnmog,Motoroil tasting coffee recommendations,Which is a good cheap coffee (robusta) to take back from Vietnam. I want the stuff which is regular (one which is sold in carts for 15K per cup),2,1.0,6,2025-04-06 06:16:06,https://www.reddit.com/r/VietNam/comments/1jsnmog/motoroil_tasting_coffee_recommendations/,soumitra_sg
VietNam,1jsijzr,HCMC Apartment Hunt: District 9 vs. Thu Duc for Our Young Family - Need Your Wisdom!,"Hi everyone,

My wife (Vietnamese), our 7-month-old son, and I (English) are looking to buy an apartment in Ho Chi Minh City with a budget of around 4 Billion VND. We've narrowed down our search to a few areas and would really appreciate some advice from those familiar with them.

We've looked at apartments in The Origami and Beverley Solari in District 9 (Grand Park), as well as Opal Garden and Opal Riverside in Thu Duc.

One of the main attractions of District 9 for us is the potential for more space and slightly cleaner air, which we think would be great for our young son as he grows up. However, the distance from the city center is a definite consideration.

In Thu Duc, we liked some of the Opal developments. A significant point is that the apartments in Opal Garden come with a ""pink book"" (sổ hồng), which as a foreigner, gives me a greater sense of security alongside the sales contract. However, we found that Opal Riverside does not currently have pink books.

We're trying to weigh the benefits of more space and potentially better air quality in District 9 against the closer proximity to the city center and the peace of mind of having a pink book in Thu Duc (Opal Garden).
Our main questions are:

 * For families with young children, which district (District 9 or Thu Duc) do you think would be more suitable and why?

 * Does anyone have experience with the Vinhomes Grand Park (The Origami/Beverley Solari) or the Opal developments (Garden/Riverside)? What are your thoughts on these projects and the surrounding areas?

 * Specifically regarding the ""pink book"" situation with Opal Riverside, does anyone have insights into why some new developments might not have them immediately and what the potential risks or timelines could be? Is it something we should be significantly concerned about?

 * Considering our budget of 4 Billion VND, are there any other areas or specific apartment complexes we should be considering that might offer a good balance of space, convenience, and legal security (like having a pink book)?

Any advice or personal experiences you can share would be hugely appreciated as we make this important decision for our family.

Thanks in advance!",2,0.75,9,2025-04-06 01:07:16,https://www.reddit.com/r/VietNam/comments/1jsijzr/hcmc_apartment_hunt_district_9_vs_thu_duc_for_our/,Maximum_Procedure310
VietNam,1jsiai0,Package with vitamins sent from Thailand stuck in customs?,"I had some vitamins sent to me from Thailand (about 6 bottles) and I received a letter saying they are in customs and I need to contact them.

Do you know what I am going to have to do to get my box?

I have never done this before and I assume there are import tariffs and would imagine I would have issues if I had a case of vitamins get sent to me. But six bottles?

Am I crossing the line with what I should be doing in this country?

",2,1.0,7,2025-04-06 00:53:05,https://www.reddit.com/r/VietNam/comments/1jsiai0/package_with_vitamins_sent_from_thailand_stuck_in/,RealisticRelief6637
VietNam,1js4m4c,One way conversations & Deference to authority,"Is it just me, or is it impossible to have a legitimate conversation with anyone considered an elder? I don't mind listening, but I would also like to be listened to in order to have mutual understanding or clear up any issues. 



It seems like no matter what I say my words are very easily twisted to make the situation seem like something else, only focusing on half of what I said. I'm starting to think elders DON'T care about the youth, that the friendliness is just a mask. If I have an issue with someone I'd like to be able to resolve it, one way conversations aren't the answer, but it seems like its the only thing these older people know how to do & its driving me crazy. 

  
Am I wrong? Do I not understand something about Vietnamese culture? Or am I justified in pointing out an issue with how Vietnamese people communicate, or the lack thereof? ",3,0.67,16,2025-04-05 14:25:33,https://www.reddit.com/r/VietNam/comments/1js4m4c/one_way_conversations_deference_to_authority/,Much_Curve2484
VietNam,1jryg4b,"Fashionable, local clothing shopping in Hue?","Will be in Hue soon, and I’m interested in shopping for fashionable womens and men’s clothing/jewelry that I can’t get elsewhere. Does anyone have recommendations? I’m not looking for international designers. ",2,1.0,1,2025-04-05 07:58:13,https://www.reddit.com/r/VietNam/comments/1jryg4b/fashionable_local_clothing_shopping_in_hue/,Mcmoem
VietNam,1jrudb7,Coffee and Tea Shops in HCMC?,"Hi everyone! 
I’ll be in Saigon for two weeks in May and I’m looking for recommendations for coffee shops and tea shops in Saigon. I want to bring back tea and coffee for friends so shops that sell their own beans/tea leaves would be best. 
So far I’ve heard of Hatvala in Saigon and planning on trying Highlands Coffee. ",2,1.0,4,2025-04-05 03:30:52,https://www.reddit.com/r/VietNam/comments/1jrudb7/coffee_and_tea_shops_in_hcmc/,sapphire74__
VietNam,1jrtjol,Reliable shipments from the US to Vietnam.,I don’t get to go back to Vietnam as often as I like. I need to send care packages to my family. What is the best way to make sure they receive it? I tried mailing things and customs denied it and it never got returned. It was infant and baby clothes. Why are they so difficult?,2,1.0,9,2025-04-05 02:43:33,https://www.reddit.com/r/VietNam/comments/1jrtjol/reliable_shipments_from_the_us_to_vietnam/,Daddy_Roan
VietNam,1jrtdsw,Nike markup and how that will effect real prices and real demand,"This New York Post article talks about the price difference for US consumers with the 46% tariff on Vietnam goods. It is just an example of how the tariff will not affect the final price by 46% and that the markups from Nike and other US companies are huge from the labor side to the value-added side.

[Here's how much more Nike's Air Jordans could cost after tariffs hit](https://nypost.com/2025/04/03/business/heres-how-much-more-nikes-air-jordans-could-cost-after-tariffs-hit/)",2,0.67,1,2025-04-05 02:34:13,https://www.reddit.com/r/VietNam/comments/1jrtdsw/nike_markup_and_how_that_will_effect_real_prices/,qjpham
VietNam,1jrt8qw,Anywhere in Saigon I can buy the old school four strap rubber shoes?,"I’d like a pair as a keepsake for my time staying here because I just appreciate the simplicity and resourcefulness of the design. I’ll be in Saigon for a while, is there anywhere I can find them sold locally? Any help would be greatly appreciated!",3,0.71,9,2025-04-05 02:26:06,https://i.redd.it/zymz7272gxse1.jpeg,AlaskaWilliams
VietNam,1jrgnfq,Do you worry?,"Expats and Viet Kieus living & working Vietnam, do you worry about this trade war will potentially impact your livelihood (comfortable lifestyle) in Vietnam? And what do you plan to do now?",1,0.53,49,2025-04-04 16:50:47,https://www.reddit.com/r/VietNam/comments/1jrgnfq/do_you_worry/,seeking-sage
VietNam,1jrchkp,Buy laptop with card online and pick up in-store Ho Chi Minh,"My laptop just died and I need to get a new one with minimum delay. Problem is I don't have a physical card right now and I can either use my digital card which is identical to a mastercard debit with cvc/cvv or have a friend buy it for me but either way I need to find a store that allows online payments aside from bank transfers and ideally where I can go and pick it up immediately after purchase. 

All and any suggestions are deeply appreciated as it's very hard to do this research from my phone. 

Thank you,

Edit: I can probably do PayPal aswell ",2,1.0,5,2025-04-04 13:56:14,https://www.reddit.com/r/VietNam/comments/1jrchkp/buy_laptop_with_card_online_and_pick_up_instore/,eslof685
VietNam,1jqzf5q,Babysitting / Nanny in HCM,How do you find the nanny service in HCM? Do they speak English? And how much is it per hour? Do you ask for police clearance? ,2,1.0,0,2025-04-04 00:55:25,https://www.reddit.com/r/VietNam/comments/1jqzf5q/babysitting_nanny_in_hcm/,codiegirl
VietNam,1jqt7ba,Where to get glasses and dental,"Hi everyone! I’m looking for some suggestions on where I can get a new pair of prescription sunglasses as well as a new plastic retainer for at night. I’m going to be in Vietnam for 2 weeks soon and was hoping to these there. I’m going to mostly be in Da Nang, Hue, and Ho chị mình city/Saigon, but I was wondering if anyone had any suggestions on where I should get these or any shops where they have had good luck in these cities. 
Also, if I get prescription sunglasses, should I bring a copy of my prescription with me or will they check my eyes again there? 

And one last question. I have a heart condition and need lots of electrolytes. What is your favorite electrolyte drink in Vietnam?

Thank you so much!",2,1.0,13,2025-04-03 20:24:53,https://www.reddit.com/r/VietNam/comments/1jqt7ba/where_to_get_glasses_and_dental/,SiriusDogLover
VietNam,1jqnu1r,Trying to learn the language need YouTube videos with Viet subtitles and English,"Taught myself an eastern Euro language by watching videos like this and would like to learn Vietnamese this way.  Even better if it’s an English sit dubbed in viet with both subtitles but a Vietnamese show, karaoke with both subs helps or with English subs and I can use yt to add in the viet subs but their translation leave much to be desired.",2,1.0,0,2025-04-03 17:01:10,https://www.reddit.com/r/VietNam/comments/1jqnu1r/trying_to_learn_the_language_need_youtube_videos/,moldyjellybean
VietNam,1jqluvl,Hanoi to Sapa bus ride at 3am?,"Hi, is there any bus schedule from airport to Sapa at 3 or 4 AM? I will be arriving at 2 AM.",2,1.0,0,2025-04-03 15:44:58,https://www.reddit.com/r/VietNam/comments/1jqluvl/hanoi_to_sapa_bus_ride_at_3am/,Aggravating_Theme_64
VietNam,1jqlaq9,Ninh Binh for 2 days - help with the plan,"Hi I am travelling to Vietnam and will be for 2.5 days 17-19 April in Nihn Bihn. Where should I stay ; Tam Coc (as it has more restaurants) or Trang An? I also read that most people prefer the Trang An boat tour - route 3. What do you think?

Here is what I am thinking - let me know your thoughts: 

* **17/4**: Arrive at 20pm, go to accommodation, relax (anything to do in the night?)
* **18/4**: Grab to Trang An boat tour, do the tour route 3, visit also the Bai Dinh Pagoda. In the afternoon, climb Mua Cave (Hang Mua).
* **19/4:** Tam Coc boat tour (does it worth it?), or bike ride around Tam Coc rice paddie, visit Bich Dong Pagoda, duck leader (perhaps?). In the evening go to take the sleeper bus. 

Also, can you do any water activities there? Anything like ziplining or more adventurous? 

And any recommendations for accommodation or places for food/coffee?

  
Thank you",2,1.0,6,2025-04-03 15:22:56,https://www.reddit.com/r/VietNam/comments/1jqlaq9/ninh_binh_for_2_days_help_with_the_plan/,dnalpant
VietNam,1jqet8v,hoi an custom shoes,"just a heads up to anyone hoping to get custom leather shoes, get a half size up. they will measure your feet, but be insistent on adding a centimeter to the measurement. they told me the shoe will stretch but I am 2 weeks in and my feet are in unbearable pain, blisters on all sides and toes all crunched up inside.",2,1.0,3,2025-04-03 10:24:01,https://www.reddit.com/r/VietNam/comments/1jqet8v/hoi_an_custom_shoes/,catapilahs
VietNam,1jqd57w,Translation Help & Food Recs,"Hello!

I am pescatarian (eat seafood but not pork, chicken or beef).  I am unfortunately now allergic to crustaceans (prawn, shrimp, lobster, crab).

Can someone help me to translate into Vietnamese - I am allergic to crustaceans (prawn, shrimp, lobster, crab). Fish including 100% fish sauce, oysters, mussels and squid are ok.

Also - anyone got recommendations for Hanoi? Looking for a solid vegetarian Pho and Bahn mi",2,1.0,7,2025-04-03 08:34:53,https://www.reddit.com/r/VietNam/comments/1jqd57w/translation_help_food_recs/,Artistic-Run-4980
VietNam,1jqbvul,Find a place to rent in Ho Chi Minh that accepts foreigners,Hi me (American) and my Vietnamese national fiancé are look for a place to rent in Ho Chi Minh in tan binh district. I was wondering if anyone knows any places we can look or search for that could help because everything we find online will not accept foreigners.,2,1.0,10,2025-04-03 07:09:17,https://www.reddit.com/r/VietNam/comments/1jqbvul/find_a_place_to_rent_in_ho_chi_minh_that_accepts/,Remarkable_Problem86
VietNam,1jq7zwd,Ha Long Bay cruise recommendations?,"I’m looking to book a 2D/1N Ha Long Bay cruise for my friend and I. We’re in our late 20s/ early 30s and are looking for a tour that has a crowd of around the same age, and offers a cooking class, Vietnamese lunch & dinner, kayaking, squid fishing, and a cave visit.

Our budget is US$100-180. Would you all have any recommendations?

Or if there are any tours to avoid, please do let me know as well! E.g., bed bugs, horrible service etc.

Thanks!",2,1.0,3,2025-04-03 03:19:51,https://www.reddit.com/r/VietNam/comments/1jq7zwd/ha_long_bay_cruise_recommendations/,thehoomanbean
VietNam,1jps1u3,looking to hire someone for Operations in HCMC,"Hello! I'm looking to hire someone for Business Operations like (Procurement from Supplier & Inventory Management)in HCMC around District 1, let me know if you're interested. Thankyou! ",2,0.75,4,2025-04-02 15:54:39,https://www.reddit.com/r/VietNam/comments/1jps1u3/looking_to_hire_someone_for_operations_in_hcmc/,cryptonatic
VietNam,1jpgzgm,Poland Embassy in Vietnam,Hello. Has anyone applied for a work visa in Poland Embassy in Vietnam? How's the consulate? Are they strict and particular in accepting and rejecting visa applications? Please I need your insights based on your experiences. Thank you.,2,0.67,7,2025-04-02 05:12:05,https://www.reddit.com/r/VietNam/comments/1jpgzgm/poland_embassy_in_vietnam/,Ok_Abroad2024
