subreddit,post_id,title,content,score,upvote_ratio,num_comments,created_at,url,author
news,1k003v3,"Indiana mom brought gun to grade school and threatened lesbian teacher, police say",,14873,0.97,788,2025-04-15 19:02:25,https://www.nbcnews.com/news/us-news/mom-arrested-bringing-gun-indiana-elementary-school-harassing-teacher-rcna201316,BeckwithLBP
news,1js1vvt,Trans student’s arrest for violating Florida bathroom law is thought to be a first,,14849,0.94,310,2025-04-05 12:01:44,https://www.nbcnews.com/nbc-out/out-news/trans-students-arrest-violating-florida-bathroom-law-thought-first-rcna199697,OkEscape7558
news,1k13obj,Judge scraps US rule capping credit card late fees at $8,,14771,0.97,574,2025-04-17 03:48:53,https://www.reuters.com/business/finance/judge-scraps-us-rule-capping-credit-card-late-fees-8-2025-04-15/,WoofWoofster
news,1k2u9sy,Video shows doctor with measles treating kids. RFK Jr later praised him as an ‘extraordinary’ healer,,14758,0.97,511,2025-04-19 11:36:53,https://apnews.com/article/texas-measles-outbreak-rfk-jr-ben-edwards-2dd7c79d47c64ad2e6d4a4ac3c87ec1f,Infamous-Sky-1874
news,1k04v3e,Students at Pentagon schools sue Hegseth over book bans on race and gender,,14653,0.98,150,2025-04-15 22:23:24,https://www.theguardian.com/us-news/2025/apr/15/pentagon-school-students-sue-hegseth-book-bans,Aggravating_Money992
news,1jseutb,Canadian parliament on lockdown amid large police presence: ‘Lock all doors and hide’,,14622,0.98,416,2025-04-05 22:00:39,https://www.independent.co.uk/news/world/americas/canada-parliament-lockdown-ottawa-b2728127.html,unleashthetea
news,1jmob0v,Hegseth’s younger brother is serving in a key role as liaison and senior adviser inside the Pentagon,,14596,0.96,455,2025-03-29 15:07:16,https://apnews.com/article/hegseth-brother-signal-dhs-hired-68678a8a653c79a4c6ae31a8bee64836,LadyMadonna_x6
news,1jwv1ud,"Man has sex with corpse on NYC subway, sources say",,14545,0.94,2074,2025-04-11 17:09:56,https://www.nbcnewyork.com/new-york-city/man-sex-corpse-nyc-subway-video-r-train-body/6220060/,boxofstuff
news,1k0i8tj,U.K. Top Court Says Trans Women Are Not Legally Women Under Equality Act,,14420,0.92,50,2025-04-16 11:38:19,https://www.nytimes.com/2025/04/16/world/europe/uk-supreme-court-woman-definition-trans.html?unlocked_article_code=1.AE8.cfzk.pIrpb0-Czz4_&smid=url-share,jaded-navy-nuke
news,1jr2dn5,"US NSA director Timothy Haugh fired, Washington Post reports",,14082,0.98,654,2025-04-04 03:28:47,https://www.reuters.com/world/us/us-nsa-director-timothy-haugh-fired-washington-post-reports-2025-04-04/,LavenderBlueProf
news,1jow3e7,An ‘Administrative Error’ Sends a Maryland Father to a Salvadoran Prison: The Trump administration says that it mistakenly deported an immigrant with protected status but that courts are powerless to order his return.,,13982,0.97,784,2025-04-01 13:51:45,https://www.theatlantic.com/politics/archive/2025/03/an-administrative-error-sends-a-man-to-a-salvadoran-prison/682254/?gift=m9xwDJisxGbFpOkF7Nlt_LdBPvjg3gv0j8150ryU4l0&utm_source=copy-link&utm_medium=social&utm_campaign=share,ProletarianParka
news,1jpp3rb,"NYC Mayor Eric Adams corruption case dismissed with prejudice, judge rules",,13713,0.96,912,2025-04-02 13:53:12,https://www.cbsnews.com/newyork/news/nyc-mayor-eric-adams-corruption-case-dropped/,CorleoneBaloney
news,1jj7vj0,Samsung CEO Han Jong-Hee dies at 63,,13489,0.97,711,2025-03-25 01:25:21,https://www.cnn.com/2025/03/24/tech/samsung-co-ceo-han-jong-hee-death-intl-hnk/index.html,librarianjenn
news,1k59llu,US FDA suspends milk quality tests amid workforce cuts,,18108,0.97,1240,2025-04-22 15:46:27,https://www.reuters.com/business/healthcare-pharmaceuticals/us-fda-suspends-milk-quality-tests-amid-workforce-cuts-2025-04-21/,wei-long
news,1job1rk,Musk’s Doge gains access to federal payroll system despite staff warnings,,13229,0.97,370,2025-03-31 18:58:53,https://www.theguardian.com/us-news/2025/mar/31/doge-musk-federal-payroll-system,jeetah
news,1jw8a0c,Donald Trump signs order to 'make America's showers great again',,13166,0.94,1875,2025-04-10 20:43:26,https://www.bbc.com/news/articles/cm2eeggyppzo,ohineedascreenname
news,1jw76ae,Planes clip wings at DCA with members of Congress on board,,12767,0.98,509,2025-04-10 19:58:09,https://www.fox5dc.com/news/planes-collide-dca-per-members-congress-board,Splunge-
news,1jlv27w,Kentucky GOP supermajority overrides nearly all of Democratic governor's vetoes in one day,,12331,0.98,447,2025-03-28 13:27:39,https://www.lpm.org/news/2025-03-27/kentucky-gop-supermajority-overrides-nearly-all-beshear-vetoes-in-one-day,freshlyplanted
news,1jqlggd,White House fires three NSC staffers after president meets with far-right activist Laura Loomer,,12237,0.97,592,2025-04-03 15:29:11,https://www.cnn.com/2025/04/03/politics/nsc-firings-trump-laura-loomer-meeting/index.html,N/A
news,1k18v7z,Tesla whistleblower wins latest legal battle in fight against Musk,,12036,0.98,74,2025-04-17 09:46:32,https://www.bbc.com/news/articles/cevdz4yxpd9o,Aggravating_Money992
news,1jldxe3,Judge orders Trump administration to preserve Signal chat on Yemen strikes,,11955,0.99,380,2025-03-27 21:14:38,https://abcnews.go.com/US/judge-holds-hearing-administrations-signal-app/story?id=120229350,EscapeFromIowa
news,1jw0yot,"Police shoot best-selling author and wife of Weezer bassist, saying she pointed gun at officers",,11892,0.95,1410,2025-04-10 15:40:00,https://www.nbcnews.com/news/us-news/police-shoot-wife-weezers-bassist-say-pointed-gun-officers-rcna200543,Draxtonsmitz
news,1jjh4ee,Japan court orders controversial ‘Moonies’ church to disband,,11830,0.98,535,2025-03-25 11:27:43,https://www.bbc.com/news/articles/cge1lr7225yo.amp,phrozen_waffles
news,1jrglic,‘Oligarchy’: Trump exempts big oil donors from tariffs package,,11800,0.99,164,2025-04-04 16:48:33,https://www.theguardian.com/us-news/2025/apr/04/trump-exempts-big-oil-donors-from-tariffs?CMP=Share_iOSApp_Other,superschmunk
news,1k23x1n,"Japan bus driver with 3 decades of service loses $84,000 pension after he was caught stealing $7",,11763,0.95,494,2025-04-18 12:38:18,https://www.cbsnews.com/news/japan-bus-driver-loses-pension-for-stealing-7-dollars/,Superbuddhapunk
news,1jpresx,"European police say KidFlix, ""one of the largest pedophile platforms in the world,"" busted in joint operation",,11617,0.99,404,2025-04-02 15:28:13,https://www.cbsnews.com/news/germany-online-child-sexual-abuse-platform-kidflix-busted-europol/,Aggravating_Money992
news,1jo3tps,Bodies of missing aid workers found in Gaza ‘mass grave’ following Israeli attacks,,11569,0.93,306,2025-03-31 13:58:28,https://www.cnn.com/2025/03/31/middleeast/aid-workers-found-gaza-mass-grave-intl-hnk/index.html,apple_kicks
news,1k5i7c4,Tesla sales plunge as carmaker warns ‘political sentiment’ could impact future demand,,18294,0.96,1262,2025-04-22 21:32:17,https://www.theguardian.com/technology/2025/apr/22/tesla-sales-musk-white-house-exit,ERSTF
news,1jq5cpr,Stock futures plunge as investors digest Trump’s tariffs,,11155,0.98,926,2025-04-03 01:10:12,https://www.cnn.com/2025/04/02/business/us-stock-market/index.html,N/A
news,1jl4cie,Scientists find 18 million tons of 'white gold' beneath California's Salton Sea worth $540 billion: Report,,11082,0.93,1115,2025-03-27 13:49:50,https://www.deccanherald.com/world/scientists-find-18-million-tons-of-white-gold-beneath-californias-salton-sea-worth-540-billion-report-3463540,Rambos_Magnum_Dong
news,1jwobja,Australian with working visa detained and deported on returning to US from sister’s memorial,,10840,0.98,641,2025-04-11 12:11:37,https://www.theguardian.com/us-news/2025/apr/11/australian-with-us-working-visa-detained-insulted-deported,Aggravating_Money992
news,1k1s0pn,"A deadly E. coli outbreak hit 15 states, but the FDA chose not to publicize it | NBC News",,10863,0.98,300,2025-04-18 00:27:15,https://www.nbcnews.com/news/us-news/ecoli-bacteria-lettuce-outbreak-rcna200236,TheBlessedWant
news,1jmysot,Luigi Mangione may get a laptop in jail to work on his defense in CEO murder case,,10729,0.96,278,2025-03-29 23:07:03,https://apnews.com/article/luigi-mangione-trial-laptop-jail-unitedhealthcare-8bed30b120f57942cd24fdb91b61d210,NewDiamondBox_
news,1k42v5x,China sends back new Boeing jet made too expensive by tariffs,,10829,0.98,686,2025-04-21 02:24:24,https://www.theguardian.com/us-news/2025/apr/21/china-returns-boeing-737-jet-us-too-expensive-tariffs,thongs_are_footwear
news,1k2eu59,"Man arrested by ICE in Massachusetts can't be moved without notice, judge rules",,10733,0.97,253,2025-04-18 20:30:37,https://www.cbsnews.com/boston/news/new-bedford-ice-arrest-window-smashed/,berrekah
news,1jt20he,Alex Ovechkin breaks Wayne Gretzky’s NHL all-time career goals record | CNN,,10582,0.94,404,2025-04-06 19:16:51,https://www.cnn.com/2025/04/06/sport/alex-ovechkin-surpasses-wayne-gretzky-goals-record-nhl-spt/index.html,Bloated_Hamster
news,1jpr1so,"DOGE official at DOJ bragged about hacking, distributing pirated software",,10503,0.97,217,2025-04-02 15:13:18,https://www.reuters.com/technology/cybersecurity/doge-official-doj-bragged-about-hacking-distributing-pirated-software-2025-04-02/,Rude_Top_9967
news,1k4i0uz,Gunman who killed 23 in a racist attack at a Walmart in El Paso pleads guilty to capital murder,,10501,0.97,638,2025-04-21 16:42:38,https://apnews.com/article/el-paso-walmart-massacre-plea-deal-433bf2a50443a184c4f4e1ed003820dc,AudibleNod
news,1joy1r1,"23 states, DC sue Trump administration over billions in lost public health funding",,10275,0.99,84,2025-04-01 15:13:31,https://www.cnn.com/2025/04/01/health/public-health-funding-states-sue-hhs-rfk/index.html,keyjan
news,1k35ilh,"Bronx mom, son found dead with 4-year-old girl miraculously alive after days of screaming and foul odors.",,10290,0.97,396,2025-04-19 20:27:20,https://www.nbcnewyork.com/bronx/bronx-mother-brother-found-dead/6231232/,postonrddt
news,1jwlq0f,"US egg prices increase to record high, dashing hopes of cheap eggs by Easter",,10023,0.97,819,2025-04-11 09:26:50,https://apnews.com/article/egg-prices-bird-flu-cpi-b0ded420e9f7c0a707277c9c63396a76,tomorrow509
news,1k37uzx,Zelenskyy says Russia still firing on Ukraine despite ‘Easter truce’,,9976,0.98,140,2025-04-19 22:18:41,https://www.theguardian.com/world/2025/apr/19/putin-announces-surprise-easter-truce-and-claims-russia-will-not-attack-ukraine-until-monday,steffxoxoxoo
news,1jwz8tj,Judge rules Mahmoud Khalil can be deported,,9833,0.96,1971,2025-04-11 20:06:44,https://www.npr.org/2025/04/11/nx-s1-5361208/mahmoud-khalil-deported-judge-rubio-antisemitism-immigration-court,Krosis95
news,1jw089y,U.S. stocks slide again as euphoria over Trump's tariff pause starts to fade,,9718,0.99,421,2025-04-10 15:09:08,https://www.npr.org/2025/04/10/g-s1-59342/global-markets-react-trump-tariffs-pause,wei-long
news,1jz76d7,"Despite a court order, White House bars AP from Oval Office event",,9699,0.99,348,2025-04-14 19:10:02,https://apnews.com/article/trump-ap-press-freedom-court-gulf-caffd32aa8ec6b04a50b8c5277d7c9cb,Rya_Bz
news,1jn0xl3,Most employees at US Institute of Peace mass-fired via late-night email,,9671,0.97,339,2025-03-30 00:52:22,https://www.theguardian.com/us-news/2025/mar/29/us-institute-of-peace-mass-firings,KingoftheKeeshonds
news,1jt4cbk,National Park Services removes references to Harriet Tubman from ‘Underground Railroad’ webpage,,9542,0.97,395,2025-04-06 20:58:14,https://www.cnn.com/2025/04/06/us/national-parks-underground-railroad-harriet-tubman/index.html,HurricaneSalad
news,1jpuy4h,Nobel Peace Prize winner Oscar Arias says US cancelled his visa,,9450,0.98,182,2025-04-02 17:49:18,https://www.bbc.com/news/articles/c75dl7rdxexo,j1ggy
news,1js9b98,"Measles outbreak in Texas hits 481 cases, with 59 new infections confirmed in last 3 days",,9182,0.98,360,2025-04-05 17:55:28,https://abcnews.go.com/Health/measles-outbreak-texas-hits-481-cases-59-new/story?id=120485225,Surly_Cynic
news,1jue0ov,"Musk's DOGE using AI to snoop on U.S. federal workers, sources say",,8983,0.97,262,2025-04-08 13:49:39,https://www.reuters.com/technology/artificial-intelligence/musks-doge-using-ai-snoop-us-federal-workers-sources-say-2025-04-08/,evissimus
news,1jyeo51,China Halts Critical Exports as Trade War Intensifies,,8931,0.98,536,2025-04-13 18:39:10,https://www.nytimes.com/2025/04/13/business/china-rare-earths-exports.html?unlocked_article_code=1._U4.oI-5.uzRy92ofA0b5&smid=nytcore-android-share,jaded-navy-nuke
news,1jyzve3,"4 Months Into the Year, Chicago Set to Exhaust $82M Annual Budget for Police Misconduct Settlements",,8832,0.98,413,2025-04-14 14:13:19,https://news.wttw.com/2025/04/14/chicago-set-exhaust-annual-budget-police-misconduct-settlements,Hrekires
news,1jtmpj0,"US sidelines DOJ lawyer involved in deportation case, which judge calls 'wholly lawless'",,8821,0.97,203,2025-04-07 14:33:55,https://www.reuters.com/world/us/us-sidelines-doj-lawyer-after-judge-orders-return-man-deported-erroneously-2025-04-06/,swap_019
news,1jsavah,US rescuers notably absent in Myanmar quake cleanup,,8800,0.96,168,2025-04-05 19:02:17,https://www.nbcnewyork.com/news/national-international/myanmar-earthquake-us-aid-absent/6213545/,StupendousMan1995
news,1js7irg,Roofer says ICE arrested three of his relatives in a workplace raid.,,8727,0.96,501,2025-04-05 16:37:14,https://www.nbcnews.com/news/us-news/roofer-says-ice-arrested-three-relatives-workplace-raid-rcna199781,darthatheos
news,1jmdpds,Collision warning sounds in cockpit of Delta plane due to close call with Air Force jet near Reagan National Airport,,8681,0.98,370,2025-03-29 03:42:18,https://www.cnn.com/2025/03/28/us/delta-military-jet-close-call-dca/index.html,Warcraft_Fan
news,1johcii,Stocks close out their worst quarter since 2022 amid tariff uncertainty,,8482,0.98,334,2025-03-31 23:23:26,https://www.nbcnews.com/business/markets/stocks-close-worst-quarter-2022-tariff-uncertainty-rcna198956,BeckwithLBP
news,1jkgii5,Brazil Supreme Court to put Bolsonaro on trial for alleged coup attempt,,8447,0.99,258,2025-03-26 16:53:08,https://www.reuters.com/world/americas/brazil-top-court-justice-recommends-that-bolsonaro-stand-trial-alleged-coup-2025-03-26/,smegma_yogurt
news,1jsj1mo,Galapagos tortoises at Philadelphia Zoo become first-time parents at nearly 100 years old,,8366,0.98,218,2025-04-06 01:34:30,https://www.cbsnews.com/philadelphia/news/galapagos-tortoises-at-philadelphia-zoo-become-first-time-parents-at-nearly-100/,Plainchant
news,1jjtxay,Texas measles outbreak grows to 327 cases with 18 confirmed infections over last 5 days: Officials,,8331,0.98,376,2025-03-25 20:48:31,https://abcnews.go.com/Health/texas-measles-outbreak-grows-327-cases-18-confirmed/story?id=120126483,Surly_Cynic
news,1jm7l74,"U.S. turns to Europe for eggs to ease prices at home, but so far comes up empty-handed",,8245,0.97,928,2025-03-28 22:31:46,https://www.cbsnews.com/news/egg-prices-us-europe-exports/,Street_Anon
news,1jmcw6z,Andrew Tate sued by ex-girlfriend for alleged sexual assault,,8232,0.98,296,2025-03-29 02:57:16,https://www.bbc.com/news/articles/c62z2e5166eo,jackytheblade
news,1jj5cht,FBI launches Tesla threats task force,,8160,0.94,1091,2025-03-24 23:27:16,https://www.cnbc.com/2025/03/24/fbi-tesla-elon-musk-task-force-threats-trump-doge.html,HeinrichTheWolf_17
news,1jjmsyp,US consumer confidence tumbles for the 4th straight month as future expectations hit a 12-year low,,8145,0.98,233,2025-03-25 15:59:42,https://apnews.com/article/consumer-confidence-economy-inflation-bd6ece8784efff205e2ab922bcb86958,LadyMadonna_x6
news,1jux427,Microsoft 'not moving forward' with $1B Licking County data center plans right now,,8016,0.98,483,2025-04-09 04:09:11,https://abc6onyourside.com/news/local/microsoft-backs-off-1b-licking-county-data-center-plans,veksone
news,1k2jfws,White House changes COVID.gov web page to page supporting lab leak theory,,8035,0.96,679,2025-04-19 00:05:47,https://abcnews.go.com/Health/white-house-covid-web-page-page-supporting-lab/story?id=120956514,CupidStunt13
news,1k0lhzy,JPMorgan Chase sues more customers who allegedly stole cash in 'infinite money glitch',,7987,0.97,603,2025-04-16 14:16:05,https://www.cnbc.com/2025/04/16/jpmorgan-chase-infinite-money-glitch-bank-lawsuits.html,jeetah
news,1jjmnqu,"USDA halts delivery of 600,000 pounds of food to Michigan food bank",,7937,0.97,540,2025-03-25 15:53:26,https://www.mlive.com/news/grand-rapids/2025/03/usda-halts-delivery-of-600000-pounds-of-food-to-michigan-food-bank.html?utm_campaign=muskegonchronicle_sf&utm_medium=social&utm_source=facebook,Odd_Vampire
news,1jnsxbo,England to make the morning-after pill free over the counter in pharmacies,,7924,0.98,145,2025-03-31 02:19:19,https://www.abc.net.au/news/2025-03-31/morning-after-pill-to-be-made-free-in-england-pharmacies/105116292,Bgrdfino
news,1jzsxa1,Woman dies and another in hospital after cryotherapy session at Paris gym,,7922,0.97,330,2025-04-15 14:13:57,https://www.theguardian.com/world/2025/apr/15/woman-dies-hospital-cryotherapy-paris-gym,MasterpieceAlone8552
news,1jngu7a,9-year-old girl dies after a dental procedure involving anesthesia in Vista,,7921,0.96,872,2025-03-30 16:55:07,https://www.nbcsandiego.com/news/investigations/9-year-old-girl-dies-after-a-dental-procedure-involving-anesthesia-in-vista/3790395/,No-Information6622
news,1jt1x73,Trump administration argues judge cannot order return of man mistakenly deported to El Salvador,,7876,0.95,1146,2025-04-06 19:12:44,https://apnews.com/article/trump-el-salvador-prison-kilmar-abrego-garcia-5a92d6bd7f893eed64c2607cc129a6f9?utm_source=reddit&utm_medium=share,Curious_Position8949
news,1jv8btr,US to announce new tariffs on pharmaceutical imports,,7835,0.97,735,2025-04-09 15:18:24,https://www.bbc.com/news/articles/cedyylj1v32o,One-Emu-1103
news,1k0rihy,Missing toddler who walked 7 miles alone through Arizona wilderness led to safety by rancher's dog,,7747,0.99,374,2025-04-16 18:22:40,https://www.nbcnews.com/news/us-news/missing-toddler-walked-7-miles-alone-arizona-wilderness-led-safety-ran-rcna201479?utm_source=firefox-newtab-en-us,jeetah
news,1jvtslq,Elon Musk’s xAI powering its facility in Memphis with ‘illegal’ generators,,7638,0.97,227,2025-04-10 09:30:29,https://www.theguardian.com/us-news/2025/apr/09/elon-musk-xai-memphis,Aggravating_Money992
news,1jww842,Young mother traveled to Miami for plastic surgery. She died hours later while at recovery house,,7515,0.95,425,2025-04-11 17:59:08,https://www.nbcmiami.com/investigations/womans-death-post-surgery-recovery-house/3586743/,No-Information6622
news,1jlf446,Exclusive: FDA staff struggle to meet product review deadlines after DOGE layoffs,,7501,0.98,208,2025-03-27 22:02:35,https://www.reuters.com/business/healthcare-pharmaceuticals/fda-staff-struggle-meet-product-review-deadlines-after-doge-layoffs-2025-03-27/,johnboy43214321
news,1jwxzqz,Trump orders probes of two former officials who defied him,,7501,0.98,203,2025-04-11 19:13:02,https://www.nbcnews.com/politics/national-security/trump-orders-probes-two-former-officials-defied-rcna200523?utm_source=NBC&utm_medium=iframely,chesh14
news,1jwkyls,"China strikes back with 125% tariffs on U.S. goods, starting April 12",,7455,0.97,684,2025-04-11 08:29:23,https://www.cnbc.com/2025/04/11/china-strikes-back-with-125percent-tariffs-on-us-goods-starting-april-12.html,CrayonGlobal
news,1jtrp8s,"Sailor killed in Pearl Harbor attack finally ID'd 84 years later, bringing closure to family",,7362,0.98,79,2025-04-07 17:58:21,https://www.nbcnews.com/news/us-news/sailor-killed-pearl-harbor-attack-finally-idd-84-years-later-bringing-rcna199986,No-Information6622
news,1jwm3ua,Montana farmers see Canadian trade dry up due to tariffs,,7356,0.98,796,2025-04-11 09:54:53,https://nbcmontana.com/news/local/montana-farmers-see-canadian-trade-dry-up-due-to-tariffs,Street_Anon
news,1jtwehm,Villanova Student Demands Man Who Recorded Her Sexual Assault Not Walk at Graduation,,7272,0.98,197,2025-04-07 21:08:26,https://www.phillymag.com/news/2025/04/07/juan-eguiguren-villanova-sexual-assault/,dimplesgalore
news,1k0y44m,Harvard researchers say they might have to lay off workers and euthanize research animals due to funding freeze,,7197,0.97,572,2025-04-16 23:02:46,https://www.wxow.com/news/national/harvard-researchers-say-they-might-have-to-lay-off-workers-and-euthanize-research-animals-due/article_90bd9ea0-e8f5-55d4-ab2d-8c96b6e85915.html,Pretend_Ad4847
news,1jyo5vu,"FAA says company whose sightseeing chopper crashed, killing 6, is ceasing operations immediately",,7139,0.98,310,2025-04-14 02:14:18,https://apnews.com/article/helicopter-new-york-tour-industry-crash-bcd2e4ed8143d50d550b8d88ce77496e,Impossible_Piano_29
news,1k1025g,Congestion pricing is working': MTA says tolls keeping 82k drivers a day out of Manhattan,,7125,0.97,450,2025-04-17 00:37:53,https://gothamist.com/news/congestion-pricing-is-working-mta-says-tolls-keeping-82k-drivers-a-day-out-of-manhattan?utm_source=sfmc&utm_medium=nypr-email&utm_campaign=Gothamist+Daily+Newsletter&utm_term=https%3a%2f%2fgothamist.com%2fnews%2fcongestion-pricing-is-working-mta-says-tolls-keeping-82k-drivers-a-day-out-of-manhattan&utm_id=437122&sfmc_id=53418894&utm_content=2025414&nypr_member=True,Shlazeri
news,1jnrjrz,Health insurance CEO fired after admitting to hiring private investigators to dig up dirt,,7027,0.99,107,2025-03-31 01:03:59,https://news4sanantonio.com/news/local/health-insurance-ceo-fired-after-admitting-to-hiring-private-investigators-to-dig-up-dirt-austin-texas-house-committee-ken-paxton-background-checks,FlyingDarkKC
news,1k1wo0n,U.S. citizen from Georgia released from jail after arrest under Florida’s new anti-immigration law,,7015,0.98,188,2025-04-18 04:42:32,https://www.jacksonprogress-argus.com/plus/u-s-citizen-from-georgia-released-from-jail-after-arrest-under-florida-s-new-anti/article_d069906f-c2bb-5e33-841f-d9d30bd6df2a.html,LadyMadonna_x6
news,1jkc7an,3 teen girls try to stab mom for turning off Wi-Fi: Sheriff,,6953,0.97,1060,2025-03-26 13:48:58,https://abcnews.go.com/US/3-teens-stab-mom-turning-off-wi-fi/story?id=120126479,CaffinatedCoyote
news,1jqgirh,Layoff announcements surge to the most since the pandemic as Musk's DOGE slices federal labor force,,6931,0.98,269,2025-04-03 11:59:27,https://www.cnbc.com/2025/04/03/layoff-announcements-surge-to-the-most-since-the-pandemic-as-musks-doge-slices-federal-labor-force.html,p_pio
news,1jqqmjr,Pentagon’s watchdog to review Hegseth’s use of Signal app to convey plans for Houthi strike,,6802,0.98,95,2025-04-03 18:46:42,https://apnews.com/article/hegseth-signal-messaging-app-attack-plans-f8581bcb447b91d2e7f9cb7809ae0f06,BimBapBoom00
news,1jv5uor,European Union approves first set of retaliatory tariffs on U.S. imports,,6732,0.98,131,2025-04-09 13:31:25,https://www.cnbc.com/2025/04/09/european-union-approves-first-set-of-retaliatory-tariffs-on-us-imports.html,Cranyx
news,1juoxty,AP wins reinstatement to White House events after judge rules government can’t bar its journalists,,6701,0.99,84,2025-04-08 21:20:51,https://apnews.com/article/trump-ap-media-court-white-house-events-access-f346a0efe87c1dec4d6f90e6041abd09,adamfiner
news,1jsqvfi,Thunderstorms trigger catastrophic flooding across the middle of the US,,6597,0.98,509,2025-04-06 10:10:01,https://edition.cnn.com/2025/04/05/weather/central-us-storms-floods-hnk/index.html,Krisz-10
