subreddit,post_id,title,content,score,upvote_ratio,num_comments,created_at,url,author
VietNam,1joujtu,Anything I should buy when I’m in Vietnam?,"I’m heading to Vietnam in a few weeks and I hear a lot about all the cheap ‘designer’ gear and tailoring, but I’m wondering if there is anything else I should try? Thinking good snacks I can get in the supermarkets, skincare/cosmetics or medicines I can’t get in the UK over the counter.",26,0.78,93,2025-04-01 12:38:33,https://www.reddit.com/r/VietNam/comments/1joujtu/anything_i_should_buy_when_im_in_vietnam/,Tildatots
VietNam,1jk2uko,Different taxes?!!,Can anyone tell me what are the 3 different taxes that show up in this receipt from the Lotte West Lake supermarket?,25,0.78,17,2025-03-26 03:40:40,https://i.redd.it/oxkrj7z8gyqe1.jpeg,AncestralAngel
VietNam,1jzmg86,"Lo ngại 'cú đấm' thuế quan từ Mỹ, LG tạm dừng mở rộng đầu tư dự án tại Hải Phòng","
Ban Quản lý Khu kinh tế Hải Phòng cho biết, Tập đoàn LG đã dừng đầu tư mở rộng sản xuất lò vi sóng và tạm dừng sản xuất tủ lạnh, gây ảnh hưởng tới hơn 400 lao động.

Tập đoàn LG là một trong những nhà đầu tư nước ngoài lớn nhất tại Việt Nam, đóng vai trò chủ chốt tại Hải Phòng. Tính đến tháng 4/2024, tổng vốn đầu tư của LG vào thành phố đạt 8,24 tỷ USD, trong đó có 7 dự án lớn với giá trị đầu tư 7,24 tỷ USD từ các công ty thành viên như LG Electronics, LG Display, LG Innotek, LG CNS, LG Chemical và LG International.

Ngoài ra còn có 50 doanh nghiệp vệ tinh với tổng vốn gần 1 tỷ USD. Đặc biệt, tháng 11/2024, LG Display đã được cấp Giấy chứng nhận đăng ký đầu tư cho dự án mở rộng trị giá 1 tỷ USD tại KCN Tràng Duệ, nâng tổng vốn đầu tư tại đây lên 5,65 tỷ USD. Dự án này chuyên sản xuất màn hình OLED công nghệ cao với quy mô từ 13 đến 14 triệu sản phẩm mỗi tháng và được xem là một trong những khoản đầu tư trọng điểm của LG tại Việt Nam.
",24,0.93,2,2025-04-15 08:07:51,https://dautu.kinhtechungkhoan.vn/lo-ngai-cu-dam-thue-quan-tu-my-lg-tam-dung-mo-rong-dau-tu-du-an-tai-hai-phong-286661.html,Resident-Pen5451
VietNam,1jvmpks,"Tariff paused, what do y'all think is going to happen next?","https://preview.redd.it/p8yjss34ywte1.png?width=1204&format=png&auto=webp&s=ad3178bb2681f166b6cc67dd0eba5ac2369a706a

",23,0.88,55,2025-04-10 01:51:15,https://www.reddit.com/r/VietNam/comments/1jvmpks/tariff_paused_what_do_yall_think_is_going_to/,Pancake502
VietNam,1jsnbsp,What are these lines?,,23,0.76,36,2025-04-06 05:55:00,https://i.redd.it/gbt9gdh8m5te1.jpeg,No-Committee-6832
VietNam,1k4vecv,What's special in Hà Giang in March? The blooming bombax trees.,,24,1.0,0,2025-04-22 02:19:53,https://www.reddit.com/gallery/1k4vecv,Critical_Roof8939
VietNam,1k4elxy,Photo tip for caves,"I imagine most of you are like me in that you don’t want random people or objects in your vacation photos. You want a picture of the scenery, not other visitors, right? Well, when you take photos in the famous caves in central Vietnam (eg Phong Nha, Paradise, etc.) try to get at least one person or object in your picture as it provides an otherwise missing sense of scale. I’m looking through photos I took of huge cave formations but without anything else in the photo for scale (eg, a person), there’s no way to tell how truly massive these formations are. 

As an example, here’s a photo of some cave formations and a seemingly-unfortunately placed trash can. Yet, that little green bugger actually helps you understand how big the features around it are. ",24,0.96,6,2025-04-21 14:16:30,https://i.redd.it/fs8yskmc57we1.jpeg,whythehellSF
VietNam,1jsvhr8,Vietnam is the last hope of Chinese companies to deal with the tariffs,"Lam is a great leader who willing to take the risk of making nationalists anger to try making deal with Trump for his country and economy of Vietnam

If he does make zero [**tariffs**](https://www.bing.com/search?q=tariffs&FORM=AWRE) deal with Trump ,many of us China companies could survive by moving our supply and manifacture departments to Vietnam to avoid the 54% tarffis.",21,0.61,87,2025-04-06 14:34:28,https://www.reddit.com/r/VietNam/comments/1jsvhr8/vietnam_is_the_last_hope_of_chinese_companies_to/,Defiant-Ad6573
VietNam,1jn3uqo,"Stopped in ha giang loop, paid fine, took picture of me with bike but did not get booklet or paper.","Hello there. I just got stopped in Ha Giang, paid the fine. Riding a bike myself. They took a picture of us with our bikes, but didn’t get a booklet am I fucked?

Edit: finished the loop in 4 days. Only encountered check points leaving Ha Giang the first day. Went to Du Gia - Meo Vac - Dong Van - then back to Ha Giang. Didn’t see police, but was told they were stopping people entering back into Ha Giang. We took a longer route, around the city and entered through the side. We did not see any more police, only ended up paying the initial fine, but could potentially have been fined again if we were stopped. ",22,0.83,41,2025-03-30 03:33:44,https://www.reddit.com/r/VietNam/comments/1jn3uqo/stopped_in_ha_giang_loop_paid_fine_took_picture/,ionlyhave4
VietNam,1jwgx30,Nguyễn Huệ: The Emperor Who Redefined Vietnamese Warfare,"“Nguyễn Huệ (1753 - 1792) còn gọi là Quang Trung. Ông là anh hùng dân tộc, thiên tài quân sự Việt Nam. Quang Trung Nguyễn Huệ là Hoàng đế lập nhiều chiến tích quân sự nhất trong lịch sử Việt Nam.”

Nguyễn Huệ (1753–1792), better known as Emperor Quang Trung, didn’t just win battles—he shattered expectations. His legendary 1789 Lunar New Year offensive crushed Qing invaders in a matter of days. And that was just one of many victories. Even in a nation full of warrior-kings, Nguyễn Huệ stands alone as a tactician who combined speed, surprise, and sheer brilliance to change the course of Vietnamese history.

—
""If Nguyễn Huệ had lived longer, how different would Vietnam’s trajectory have been?""",22,0.87,15,2025-04-11 03:52:03,https://i.redd.it/rsbdbr0vo4ue1.jpeg,signsofheroes
VietNam,1jlo5v9,Who misses the former Bamboo Airways before the restructuring and thinks Bamboo today is still better than VietJet?,"I missed the former Bamboo Airways before it was taken over by the new management. After the restructuring, they scaled back their network. Do you think this was an attempt to protect Vietjet's dominance in the domestic market? 

There were more domestic routes and international flights to Singapore and Australia. Now it is not as great as before, but prices are still competitive, most of their domestic flights are punctual, on ground and inflight services are still great, and the planes are relatively new.

Give me a""Yes"" if you agree.
Love to hear your view even if you don't agree with me. ",21,0.87,23,2025-03-28 05:43:32,https://www.reddit.com/r/VietNam/comments/1jlo5v9/who_misses_the_former_bamboo_airways_before_the/,Temporary-Aioli5866
VietNam,1k22zrk,"Ho chi minh, girlfriend strandes and cant get home","UPDATE:
Its solved. Thank you all for trying to help.


I dont know what to do, we live in thu tiem and she went into the city in the afternoon and is unable to go back 

She cannot cross the bridge because they wont let her and no one on any app (grab etc.) is accepting a ride. 

I dont know what to do anymore


stranded*",19,0.69,18,2025-04-18 11:48:44,https://www.reddit.com/r/VietNam/comments/1k22zrk/ho_chi_minh_girlfriend_strandes_and_cant_get_home/,zlatansrighttesticle
VietNam,1jtkry4,15 cannons ready to welcome the 30/4 ceremony at Bach Dang wharf,,22,0.83,0,2025-04-07 13:05:25,https://www.reddit.com/gallery/1jtkry4,cassiopeia18
VietNam,1jsoijq,"Finally, we have smartphone's camoflague tech before GTA VI.",,22,0.76,10,2025-04-06 07:18:05,https://v.redd.it/kt1uxg0lc5te1,glutenbag
VietNam,1jqgvhb,Can Vietnam’s economy reach 8% growth this year despite the 46% tariff from America?,"1. Do you think this is realistic? 
2. Will the 46% tariff gonna slow down Vietnam’s economy in the next few years, or they will adapt? 

My opinion: I think Vietnam is resilient. They got hit in 2008 and 2020 but still became the fastest growing economy in the world in those years. So I think Vietnam will find ways to avoid this crisis ",22,0.73,54,2025-04-03 12:16:34,https://www.reddit.com/r/VietNam/comments/1jqgvhb/can_vietnams_economy_reach_8_growth_this_year/,Ok_Technician5130
VietNam,1jn64m7,Ký Con: A Revolutionary Sacrifice in Hanoi’s Fight for Freedom,"“Ký Con - Tên thật Đoàn Trần Nghiệp (1908 - 1930), quê quán Hà Nội. Ông là nhà hoạt động cách mạng tiêu biểu của tổ chức Việt Nam Quốc Dân Đảng.”

Đoàn Trần Nghiệp, also known as Ký Con, is remembered as a youthful and courageous revolutionary who rose to prominence in the Việt Nam Quốc Dân Đảng. Despite his small stature, his commitment to the cause of Vietnamese independence was anything but small. Joining VNQDĐ in 1928, he quickly became a trusted figure, managing party operations and taking part in daring missions against French colonial authorities.

In February 1930, Ký Con led an uprising in Hanoi, coordinating bombings and strikes to weaken the French regime. Even after his capture, he stood firm in his beliefs, declaring his dedication to driving the French out of Vietnam. His execution later that year marked him as one of the first martyrs of Vietnam’s independence movement.

Today, Ký Con is celebrated as a symbol of resilience and determination in Vietnam’s history, inspiring generations to continue the fight for freedom.

—
“What other early revolutionaries do you think have been underappreciated in history?”",21,0.93,1,2025-03-30 06:02:26,https://i.redd.it/u4ho9hm6prre1.jpeg,signsofheroes
VietNam,1jlpmqf,What flavor is this?,"My bestfriend just got back from Vietnam and she gave me a handful of these. She said she just randomly got it from a supermarket. 

I know its strawberry but I wanted to know what was inside. Google translate gives me different results but it says salt for sure. Its more than salt tho and I was thinking tamarind but I'm not sure. ",20,0.92,12,2025-03-28 07:31:00,https://i.redd.it/tcfhn6e5vdre1.jpeg,greenspoonyogurt
VietNam,1jk1v97,My last 24 hours in Hanoi,Went to ha long bay and came back to Hanoi. ,20,0.82,2,2025-03-26 02:47:49,https://v.redd.it/dwcypjrs6yqe1,Rondotf
VietNam,1jzt092,Sharing few pics from my recent trip,"Did an amazing 15 day trip and wanted to share few pics I captured during. Missed many places , will definitely come back 😃",20,0.92,3,2025-04-15 14:17:25,https://www.reddit.com/gallery/1jzt092,bhushan_44
VietNam,1joynpn,The translate bot of Reddit has some interesting pronounce choices...,,20,0.95,12,2025-04-01 15:38:30,https://i.redd.it/ff0ovbort8se1.png,Memes_Are_So_Good
VietNam,1jlj4vq,Can I get by without knowing Vietnamese?,"Hi all, going to Vietnam in April for a month, I have taken some language lessons however not much sank in. I want to be respectfully but feel my lack of Vietnamese language skills are absolutely insufficient. Will I be able to navigate my vacation while only speaking English? ",20,0.89,50,2025-03-28 01:05:05,https://www.reddit.com/r/VietNam/comments/1jlj4vq/can_i_get_by_without_knowing_vietnamese/,Debs4prez
VietNam,1jksyrm,The Hùng Vương era: 18 kings who shaped Vietnam’s origins,"“Thời đại Hùng Vương gồm 18 đời vua (2879 - 258 trước công nguyên), đặt quốc hiệu Văn Lang, mở đầu cho thời kỳ dựng nước của dân tộc Việt Nam.”

The Hùng Vương era, which lasted from approximately 2879 to 258 BC, represents the foundation of Vietnam’s first state, Văn Lang. It’s marked by legendary tales of the 18 Hùng kings—figures deeply woven into Vietnam’s national identity. Their era set the stage for the civilization and nation-building that followed, and it remains a cornerstone of Vietnamese cultural heritage.

—
“When you look back at the Hùng kings’ reign—shaping a nation out of legends and carving its identity in stone—what other moments in history come to mind that carry this kind of foundational weight?”",18,0.93,3,2025-03-27 01:51:37,https://i.redd.it/hw97cecp15re1.jpeg,signsofheroes
VietNam,1k3adc8,"What are some popular Viet songs, something catchy with a good beat, old or new doesn't matter","I'm not Viet but I'm open minded and listen to everything from hiphop, metal, R&B, Kpop, JPop, etc. 

I'm ngl, Viet music doesn't have the best reputation among tourists because most bars play loud music with similar beats (it sounds like EDM), but I'm sure there are more genres. I listened to some songs by Low G and Tlinh and liked it, there got to be more hidden gems. ",19,0.89,23,2025-04-20 00:27:07,https://www.reddit.com/r/VietNam/comments/1k3adc8/what_are_some_popular_viet_songs_something_catchy/,Fantastic-Success-18
VietNam,1k26ifp,Nguyen Trung Truc: A Symbol of Resistance Against French Colonialism,"**Vietnamese Text on the Sign:**  
""Nguyễn Trung Trực (1837 - 1868) quê phủ Tân An, tỉnh Gia Định. Anh hùng dân tộc trong kháng chiến chống Pháp. Năm 1868 bị Pháp bắt và hành hình tại Rạch Giá.""

**Direct English Translation:**  
""Nguyen Trung Truc (1837 - 1868), from Tan An, Gia Dinh province, was a national hero in the resistance against French colonialism. He was captured by the French in 1868 and executed in Rach Gia.""

Nguyen Trung Truc (1838–1868), whose real name was Nguyen Van Lich, is one of the prominent national heroes in the resistance against French colonialism in Southern Vietnam. He was born in Binh Nhat village, Tan An district, Gia Dinh province (now part of Ben Luc district, Long An province) in a family that made a living through fishing.

Nguyen Trung Truc began his resistance activities when the French attacked Gia Dinh in 1859. He joined the resistance movement under the leadership of Truong Dinh and quickly demonstrated his leadership abilities. In 1861, he commanded a group of insurgents in the famous battle at Nhut Tao, where he burned the French ship L’Esperance, achieving a resounding victory.

After years of fighting, he was appointed by the royal court as the Governor of Gia Dinh province and the Commander of Ha Tien. However, after Ha Tien fell in 1867, he withdrew to Rach Gia and continued his resistance efforts at Hon Chong and Phu Quoc.

Nguyen Trung Truc is famous not only for his military achievements but also for his indomitable spirit. He repeatedly refused to surrender under pressure from the French forces. Finally, in October 1868, to protect his guerrilla forces and the people on Phu Quoc Island, he surrendered to the French. He was tried and executed in Rach Gia on October 27, 1868, at the age of 31.

Nguyen Trung Truc is revered by the people as a symbol of patriotism and the spirit of resistance. Many temples have been built to honor him, including those in Rach Gia and Phu Quoc. His image lives on in the hearts of the Vietnamese people as a symbol of resilience against foreign oppression.

**—**  
""Who else in history has left such an enduring legacy of resistance?""",18,0.88,3,2025-04-18 14:38:39,https://i.redd.it/51ymdnplulve1.jpeg,signsofheroes
VietNam,1jq84l9,Năm Phỉ: A Southern Icon of Cải Lương,"“Lê Thị Phỉ (1908 - 1954) người thôn Điều Hòa, nay là Thành phố Mỹ Tho. Bà là một đệ nhất tài hoa cải lương miền Nam những năm 1930 - 1954.”

Lê Thị Phỉ (Năm Phỉ) became a cultural icon in Southern Vietnam through her groundbreaking contributions to cải lương. Born in Điều Hòa village in what is now Mỹ Tho City, she gained prominence during the 1930s for her exquisite voice, expressive acting, and ability to breathe life into the cải lương stage. Năm Phỉ’s performances not only entertained but also set the standard for generations of artists who followed.

Her talent, creativity, and commitment to her craft elevated cải lương from a regional performance style to a respected art form. Even after her passing in 1954, her influence continues to shape Vietnamese theater and cultural identity.

—
“Who are other lesser-known artists whose work shaped a nation’s cultural identity?”",18,0.85,1,2025-04-03 03:26:39,https://i.redd.it/h90xljj1hjse1.jpeg,signsofheroes
VietNam,1jokajt,Snicky lady,"
I sat down next to a Balut vendor lady to eat my Balut. As soon as I did, she moved my backpack a few inches away, placing it against the wall. I heard a thud—my phone had somehow fallen. She quickly picked it up and slid it underneath the tiny chair she had offered me to sit on.

Thing is, I knew for a fact I had placed my phone in the side pocket of my backpack. There was no way it could have just fallen out when she moved my bag. I picked it up, and before I could even put it back in my backpack, she said, ""just leave your phone there,"" as if I should just leave it under the chair.

Yeah, no. The chances of me forgetting my phone that way? Pretty damn high.

I wasn’t falling for that trick
",20,0.75,12,2025-04-01 01:48:35,https://www.reddit.com/r/VietNam/comments/1jokajt/snicky_lady/,No_Scallion8989
VietNam,1jjbbhk,My partner is worried about methanol poisoning in Vietnam,"We are off to Vietnam in 2 weeks (Saigon, Da Nang, Hoi an, Ninh Binh and Hanoi). 

With the recent death of the couple in Hoi An and six young people in Laos, she is worried about drinking any alcohol at all. 

We are not huge drinkers but really enjoy going to nice cocktail bars or having a few drinks with dinner when we are overseas. 

I want to assure her that at least the best bars in Saigon that are recognised in publications and Asia’s best etc. would not doing this kind of thing.. 

If anyone has any recommendations for bars/breweries or tips and advice that would be greatly appreciated!
",21,0.69,116,2025-03-25 04:29:43,https://www.reddit.com/r/VietNam/comments/1jjbbhk/my_partner_is_worried_about_methanol_poisoning_in/,rontricks
VietNam,1k2sopx,Saigon Soul Revival,"In case you haven’t heard of them yet, a group of locals and expats have formed a band called “Saigon Soul Revival”, celebrating a slice of music history from the 1970’s when, for a short period, Vietnamese artists created rock and soul music influenced by, and catering to, American soldiers stationed here. 

It’s really cool music, very original and unique, and the band is doing well, touring internationally and playing big events like Womad. Totally worth a listen!

Check them out on Spotify or YouTube ",18,0.85,2,2025-04-19 09:47:09,https://open.spotify.com/artist/6XegBccPJ644jlWLh43NqO?si=_jY_zhLIR4CCVJJQhtzl5A,No_Philosophy4337
VietNam,1jxm3n9,Why does Nam Dinh have so many blue roofs?,,17,0.88,2,2025-04-12 17:07:56,https://i.redd.it/whlvwbnrrfue1.jpeg,schnarg24
VietNam,1jwkh23,"50 years later, Vietnam's battlefields draw retrospective veterans and other tourists",,18,0.95,5,2025-04-11 07:52:00,https://apnews.com/article/vietnam-war-anniversary-battlefield-tourism-american-veterans-f53c8579d91b45d2bac23f6e6a7284dc?utm_source=reddit.com&utm_medium=referral&utm_campaign=post,APnews
VietNam,1jubgzl,Caged dogs and cats 10km from Sapa.,"I was trekking near the village Ta Van and saw caged dogs and cats by the main road. Are these to be sold as pets or to be eaten? I actually saw multiple chained or caged dogs today that seemed in bad condition, but I read that they chain them to protect them from being stolen.",19,0.95,15,2025-04-08 11:41:45,https://i.redd.it/wvdex7dxllte1.jpeg,Technical_Finding421
VietNam,1jir7qb,Parents in Vietnam are actively hindering their children’s developmental and intellectual progress.,I see it everyday. The same sad cycle. Zero emotional reasonability and understanding of human regulation. Everybody just blames everyone else. The land of zero accountability. What do you think? ,14,0.57,40,2025-03-24 13:55:06,https://www.reddit.com/r/VietNam/comments/1jir7qb/parents_in_vietnam_are_actively_hindering_their/,Wishanwould
VietNam,1jxzvq6,Halong Bay,"Picturesque Halong Bay 
April 9, 2025",18,0.85,3,2025-04-13 04:48:02,https://i.redd.it/g93ekodo8jue1.jpeg,thetravellerboy1996
VietNam,1jw4at7,Lôking for name suggestions,"Hello,


My daughter's Vietnamese name is Mỹ Anh. I just found out I will be having another girl. I am looking for name suggestions that will go well with Mỹ Anh. 

Thank you ",16,0.87,36,2025-04-10 17:58:52,https://www.reddit.com/r/VietNam/comments/1jw4at7/lôking_for_name_suggestions/,PossiblePlum284
VietNam,1jv1c1j,Suoi Ban An - Ha Giang. Where mountains bloom and hearts wander...,,17,0.96,1,2025-04-09 09:06:17,https://www.reddit.com/gallery/1jv1c1j,Critical_Roof8939
VietNam,1jls6xg,Does anyone know who supplies this pillow?,"

Went on a cruise and loved this pillow! I need to find who supplies them, but I'm getting absolutely nowhere in my searches back home. 

Thank yoooooou ",18,0.84,7,2025-03-28 10:44:51,https://www.reddit.com/gallery/1jls6xg,Idoleyesed
VietNam,1jiiu63,Only in Vietnam.,"Only in Vietnam will someone tell you you've been writing your name wrong all your life. Only in Vietnam will they tell you that the the spaces for your first, middle and last names on internationally acclaimed travel and business websites are incorrect and provide faulty information.....then make you pay 6 dollars to make everything make sense........for them........strange.",18,0.66,32,2025-03-24 04:39:51,https://www.reddit.com/r/VietNam/comments/1jiiu63/only_in_vietnam/,Leading_Fun_3080
VietNam,1k5ea3s,American Schools,"Not sure if this belongs here, but this is what bánh mì is in my school. It wasn’t even good bánh mì. It doesn’t drop crumbs with each bite, and just has random food in it.",60,0.92,41,2025-04-22 18:53:04,https://i.redd.it/g6vud99nnfwe1.jpeg,Marcus2TNT
VietNam,1jziwfw,Just wondering if this is normal? Odd sleeper bus experience.,I’m on one of the VIP sleeper busses (actually the most expensive one I’ve been on) and a man (i think the driver’s assistant) just started laying on the floor right next to my bunk with a blanket and keeps hitting my curtain and listening to loud TikTok’s. It lowkey makes me uncomfortable and it’s the whole reason I pay more for the nicer sleeper busses is so that I don’t end up sleeping next to some random man. I payed like $30usd and in comparison to what I’ve payed for other busses i think it’s crazy this is happening on this one 😭😭 ,16,0.94,26,2025-04-15 04:14:56,https://www.reddit.com/r/VietNam/comments/1jziwfw/just_wondering_if_this_is_normal_odd_sleeper_bus/,lethatshitgo
VietNam,1jytqu8,🚨 SCAM ALERT in Hanoi – Booking.com,"🚨 **Scam Warning – Avoid This Hanoi Host** 🚨

**Contact Number Used by Host:** \+84 81 204 3887  
**Addresses to Avoid:** 

20 P. Lê Văn Linh, Hàng Mã, Hoàn Kiếm, Hà Nội, Vietnam

Ng. 622 P. Minh Khai, Vĩnh Phú, Hai Bà Trưng, Hà Nội, Vietnam

If you book a hotel through [**Booking.com**](http://Booking.com) and the host changes and sends you to either of the addresses listed above -DO NOT GO. This is part of an ongoing scam.

Here’s what happened to us:

* After booking, he only allowed communication through Whatsapp. We later found out that he will constantly change his number and claim it isn't him when questioned by booking platforms.
* The host provided a new address 30 minutes away from the one listed. When we questioned it, he blamed Booking.com.
* We were threatened with full charges if we tried to cancel, leaving us feeling trapped.
* Later, we were moved again to a new property in the Old Quarter—this time, it only had one bed (we had booked two).
* The promised “free airport shuttle” was only available if we booked a tour through him.
* We were asked to pay via a third-party link, not through Booking.com.
* We never met the host in person; he made coffee shop workers check us in and would tell them instructions through the phone.
* When we left a bad review, the host contacted us from another WhatsApp number to insult us and laugh that we got scammed.

He continually changes listing names, addresses, and numbers, making it hard for platforms to hold him accountable. He will mark you as a no-show and claim that it wasn't him communicating with you.

⚠️ **Avoid this host at all costs.** Spread the word so others don’t go through the same thing.

Lower rated reviews shows that this is a pattern:

Location 1: [https://www.google.com/maps/place/NYNA+Coffee+-+Fresh+Coffee+Beans/@21.0375858,105.8430761,17z/data=!3m1!4b1!4m9!3m8!1s0x3135abeeb7083861:0x7cb37fd7f4497efc!5m2!4m1!1i2!8m2!3d21.0375858!4d105.845651!16s%2Fg%2F11llfqz\_4v?entry=ttu&g\_ep=EgoyMDI1MDQxNC4xIKXMDSoASAFQAw%3D%3D](https://www.google.com/maps/place/NYNA+Coffee+-+Fresh+Coffee+Beans/@21.0375858,105.8430761,17z/data=!3m1!4b1!4m9!3m8!1s0x3135abeeb7083861:0x7cb37fd7f4497efc!5m2!4m1!1i2!8m2!3d21.0375858!4d105.845651!16s%2Fg%2F11llfqz_4v?entry=ttu&g_ep=EgoyMDI1MDQxNC4xIKXMDSoASAFQAw%3D%3D)

  
Location 2: [https://www.google.com/maps/place/NYNA+Coffee+-+Minh+Khai/@20.9962637,105.8681008,17z/data=!3m1!4b1!4m6!3m5!1s0x3135ad4bd75c4bf3:0x2da85a8d79fee37a!8m2!3d20.9962637!4d105.8706757!16s%2Fg%2F11vx0g8j49?entry=ttu&g\_ep=EgoyMDI1MDQxNC4xIKXMDSoASAFQAw%3D%3D](https://www.google.com/maps/place/NYNA+Coffee+-+Minh+Khai/@20.9962637,105.8681008,17z/data=!3m1!4b1!4m6!3m5!1s0x3135ad4bd75c4bf3:0x2da85a8d79fee37a!8m2!3d20.9962637!4d105.8706757!16s%2Fg%2F11vx0g8j49?entry=ttu&g_ep=EgoyMDI1MDQxNC4xIKXMDSoASAFQAw%3D%3D)",16,0.9,9,2025-04-14 08:16:02,https://www.reddit.com/r/VietNam/comments/1jytqu8/scam_alert_in_hanoi_bookingcom/,riprs12
