comment_id,content_id,platform,content,created_at,score,author,source_name
mllml1w,1jrvxj0,reddit,"It isn't a mystery, just obvioius incompetence. There isn't a ""reason"".",2025-04-05 21:13:01,30,ar34m4n314,news
mlm11v9,1jrvxj0,reddit,Do you have any penguins or other wildlife that might participate in world trade?,2025-04-05 22:40:32,11,bentzu,news
mloke1b,1jrvxj0,reddit,That fits.  Because Trump doesn't know either.  :-),2025-04-06 11:02:05,9,UnusualAir1,news
mll6du0,1jrvxj0,reddit,"Joe Biden is responsible 


Somehow",2025-04-05 19:41:35,18,robbycakes,news
mll258j,1jrvxj0,reddit,He did it fluff up the numbers is my bet.,2025-04-05 19:17:04,15,redditorial_comment,news
mll5jpr,1jrvxj0,reddit,"""They know what they did."" - MAGA Hats.",2025-04-05 19:36:40,14,EnamelKant,news
mlkowie,1jrvxj0,reddit,Obviously it's to protect Hawaii's Norfolk Island pine industry.,2025-04-05 18:02:50,8,FifteenthPen,news
mlm1tgi,1jrvxj0,reddit,They don't know his administration is seriously incompetent?,2025-04-05 22:45:16,8,lrpfftt,news
mlni0lu,1jrvxj0,reddit,Trump doesn't know either. It's just a performative circus for the MAGA ranks.,2025-04-06 04:40:21,8,Vast_Ad8862,news
mlltdg4,1jrvxj0,reddit,That’s okay. He doesn’t either.,2025-04-05 21:53:18,8,Nameraka1,news
mlmjj1x,1jrvxj0,reddit,"Is there an internet domain associated with Norfolk Island? That’s how they broke down territories. 

That’s why the us island and military base Diego Garcia is facing tariffs",2025-04-06 00:36:23,6,kokopelleee,news
mln1x5p,1jrvxj0,reddit,"I bet Donald can barely point at 5 countries correctly on a map. USA, Mexico, Canada, and Russia on a good day… No more, no less.",2025-04-06 02:39:48,5,Happy-go-lucky-37,news
mlnnh82,1jrvxj0,reddit,"Like most of Trump’s victims, just in the way of his insatiable greed, grift, and laziness. (He used an AI to write up the tariffs.) You didn’t actually think he’d take time out of his golf game, did you?",2025-04-06 05:27:03,6,ptcounterpt,news
mllyv2d,1jrvxj0,reddit,He seems to believe that he can extort money from every place on earth to make him richer,2025-04-05 22:26:59,2,clementine1864,news
mloecei,1jrvxj0,reddit,I know why. Trump's an idiot.,2025-04-06 09:59:08,4,ThatShoomer,news
mloypqi,1jrvxj0,reddit,I don’t think anyone knows why they’re being tarrifed,2025-04-06 13:02:02,3,TROUT1986,news
mlpngb1,1jrvxj0,reddit,Are there any penguins on it?,2025-04-06 15:28:23,3,orb2jr,news
mlncst7,1jrvxj0,reddit,"Simple, Trump is an a$$ clown...that simple...",2025-04-06 03:59:25,2,TexanFromOhio,news
mlo0pib,1jrvxj0,reddit,Because orange clown boy doesn't know what the ef he's doing.,2025-04-06 07:32:01,2,Slamdunkdink,news
mlmm7j5,1jrvxj0,reddit,"It wouldn’t make any difference anyways as it’s the US citizen that would pay the tariffs on products exported from here. Because they export nothing, it’s a wash.",2025-04-06 00:53:39,1,2017x3,news
mlo0lms,1jrvxj0,reddit,"Wait till the MAGA looney tunes start making threats and leaving VM’s against the island.  That’s what they do.

Just wondering, they sell Norfolk Island pines as house plants here in states and they sell like hot cakes.  I’m assuming they are produced in green houses.  Just find it ironic.",2025-04-06 07:30:54,1,NormanPlantagenet,news
mlo2jf9,1jrvxj0,reddit,"It's technically part of Australia and they didn't actually check to see if it exported things, they just threw it on the list.",2025-04-06 07:51:20,1,AssociationMore242,news
mlodle2,1jrvxj0,reddit,"Did they check their island for a hidden colony of penguins, those creatures seem to trigger trump immensely.",2025-04-06 09:51:08,1,Positive_Chip6198,news
mlof6hp,1jrvxj0,reddit,What's more telling is that not even Australia levies a consumption tax on Norfolk Island. It's exempt from GST!,2025-04-06 10:07:58,1,adfraggs,news
mlp6ne7,1jrvxj0,reddit,So the 3 sheep a decade that get shipped to the US will have a tariff on them.,2025-04-06 13:53:55,1,Raa03842,news
mlpgc15,1jrvxj0,reddit,The bar just keeps getting lower.,2025-04-06 14:49:27,1,nipseymc,news
mlw1qkw,1jrvxj0,reddit,Got into the wrong spreadsheet.,2025-04-07 16:52:57,1,sovlex,news
mllnyg0,1jrvxj0,reddit,Probably to close any potential loophole.  Trump and the rest of the criminals who designed this project are good at spotting loopholes.,2025-04-05 21:21:07,-19,sugar_addict002,news
mohrgwn,1k5ga80,reddit,Powerful countries don't have to parade their missiles because when they say they have them everyone just believes them.,2025-04-22 20:28:50,80,Crede777,news
mol1wx9,1k5ga80,reddit,"So?
 The USA has their fighter jets flying over stadiums whenever they can....",2025-04-23 10:22:07,7,Marcysdad,news
mohwvox,1k5ga80,reddit,They are easier to count when you put them in a parade.,2025-04-22 20:55:27,8,DoubleBroadSwords,news
mohr2l3,1k5ga80,reddit,Have a Trump float in the parade and you might get a concession or two from the Americans in those talks you're having.,2025-04-22 20:26:52,5,steve_ample,news
mouoo7p,1k5ga80,reddit,"Chances are Trump will get bored of this negotiation if it takes more than a couple of weeks, he will then bluster and threaten Iran for a few more weeks before forgetting all about it.",2025-04-24 20:25:37,1,Spamgrenade,news
mohzuw8,1k5ga80,reddit,I always get scared when I see high steppers in fatigues.,2025-04-22 21:10:26,-1,SystematicHydromatic,news
mooteif,1k5ga80,reddit,"Trump really thinks he can just make a new Iran nuclear deal EIGHT years after ripping up the old one and giving Iran permission to start a nuclear weapons program…

They’ve probably invested billions in this nuclear weapons program. Why would they scrap it for Donald fucking Trump?",2025-04-23 22:26:33,0,Y0___0Y,news
mon9cj2,1k5ga80,reddit,"Hopefully the US and Israel will stop threatening them and there can be genuine peace. Iran has every right to defend itself from US threats, but it would be very sad if this escalated further.",2025-04-23 17:49:00,-1,HikmetLeGuin,news
ml10hif,1jpn0dy,reddit,Why is it always the ones you most expect?,2025-04-02 14:25:08,42,rarely_interacts,news
ml0r1vw,1jpn0dy,reddit,What the fuck is wrong with Rotherham‽,2025-04-02 13:33:05,21,ahothabeth,news
ml36vae,1jpn0dy,reddit,Oh. I am so shocked. What is the world coming to. Surely our police are beyond reproach. Once again. Oh.,2025-04-02 20:45:48,3,s73v3m4nn,news
mlojh3e,1jpn0dy,reddit,"1,400 girls were raped by men of mostly Pakistani descent.

that's a lotta girls.",2025-04-06 10:53:00,2,aMoose_Bit_My_Sister,news
ml1n8zo,1jpn0dy,reddit,"Like pokemon, collect them all and lock them up and throw awayvthe keys.",2025-04-02 16:19:31,2,Margali,news
mm7gpz8,1juxjbp,reddit,You know I got really confused because not 24 hours ago there was an article about the same county in Virginia where a 3rd grader brought a gun to school and it discharged.  I wondered at first if it was related.,2025-04-09 13:18:46,66,interknight1995,news
mm6lf2a,1juxjbp,reddit,[deleted],2025-04-09 09:18:49,61,N/A,news
mm8dcek,1juxjbp,reddit,Everyone involved was like 16-20 years old. How fucking pointless.,2025-04-09 16:04:44,8,ExpiredExasperation,news
mm5zfua,1juxjbp,reddit,All these shootings and we never do anything to stop easy access to firearms,2025-04-09 05:31:26,45,Healthy_Ladder_6198,news
mm6cxlp,1juxjbp,reddit,"It's a feature, not a bug. Those poor people.",2025-04-09 07:46:10,10,ptolemy_booth,news
mm8429g,1juxjbp,reddit,"~~The article calls it an “illegal gun sale” gone wrong (turned into a robbery).~~

~~The thing is, it’s Virginia.~~

~~The only thing “illegal” about it was the ages of the people involved (need to be 18 for long guns, and 21 for handguns).  Well, at least until it went sideways and turned into murder.~~

~~Other than that, there is no law requiring background checks or even paperwork for private sale of firearms.~~

~~There *are* penalties if one knowingly transfers a firearm to someone restricted from possessing it, but there is no onus on the seller to research that beforehand.~~

**Edit:  Wait, wait just looked it up, SB70 changed the law in 2021.**

Since then, VA requires background checks for private sales, and they must be between VA residents.",2025-04-09 15:19:04,4,randompantsfoto,news
mm79557,1juxjbp,reddit,If only there was a way to prevent it...,2025-04-09 12:33:32,0,drivermcgyver,news
mm7im3e,1juxjbp,reddit,Not like anything will be done to prevent this in the future.,2025-04-09 13:29:30,0,Travisoco,news
mm6xmsn,1juxjbp,reddit,Need more guns. Thats the solution to all life’s problems.,2025-04-09 11:13:06,-9,Derekjinx2021,news
mm83vu6,1juxjbp,reddit,More guns keeping us safe. MAKE AMERICA KNIFE EACH OTHER AGAIN 2028!!!,2025-04-09 15:18:10,-5,winstonsmith8236,news
mm82mc9,1juxjbp,reddit,my heart goes out to the Spotsylvanian people!!! i hope you guys deal with Count Dracula shortly,2025-04-09 15:11:54,-3,Marekin,news
ml41fhy,1jq2sh2,reddit,">Malanga’s 21-year-old son, Marcel Malanga, who is a US citizen, was among those convicted of participating in the coup. The other US nationals are Tyler Thompson Jr, 21, a high school friend of the younger Malanga who flew to Africa from Utah for what his family believed was a free vacation, and Benjamin Reuben Zalman-Polun, 36, who is reported to have known Christian Malanga through a gold mining company.

Feels like I'm a whole season behind on this one",2025-04-02 23:25:41,131,Savior-_-Self,news
ml4hyv8,1jq2sh2,reddit,"I’ve had a long week and my brain is mush, so I spent more than a few seconds wondering who “Doctor Congo” is before I finally realized they were initializing “democratic republic”",2025-04-03 01:00:49,36,kevin2357,news
ml5bs85,1jq2sh2,reddit,Just don’t let it happen again boys,2025-04-03 04:12:58,3,HenryGoodbar,news
ml5t1zr,1jq2sh2,reddit,The unemployed homie at 1pm on a Tuesday,2025-04-03 06:47:09,3,fruit4every1,news
ml4rlzr,1jq2sh2,reddit,"Listen, I've seen what happens when you don't put down an unjust coup.",2025-04-03 01:57:39,4,NNovis,news
ml7ebfr,1jq2sh2,reddit,This Dr. Congo guy sounds like a good man.,2025-04-03 14:25:28,1,Sinz_Doe,news
ml7qqhh,1jq2sh2,reddit,was it CIA backed at all?,2025-04-03 15:26:50,1,Disastrous_Fly7043,news
ml6sg8k,1jq2sh2,reddit,The tariffs are working?,2025-04-03 12:18:46,-3,Sour_baboo,news
mm1fzyz,1juev62,reddit,">Harry, who made a rare appearance in court for the hearing, lost his government-funded protection in February 2020 after he stepped down from his role as a working member of the royal family and moved to the U.S.

I feel like the Bobs from Office Space would ask ""What would you say you do here?"" He's 5th in line for the crown. And he's not a 'working member'. I can see him losing his detail.",2025-04-08 14:30:18,271,AudibleNod,news
mm2ueak,1juev62,reddit,Surely he can afford his own security detail.,2025-04-08 18:35:36,23,oldsurfsnapper,news
mm1xz2e,1juev62,reddit,He is making his own money and he is not royality anymore so pay for it yourself,2025-04-08 15:59:28,77,Cool_As_Your_Dad,news
mm1o6fu,1juev62,reddit,"Pay for your own security detail with your own money, like the rest of the “peasants.”",2025-04-08 15:11:11,121,TheCatapult,news
mm2qzr0,1juev62,reddit,I think the South Park creators nailed how everyone views him and his wife.,2025-04-08 18:18:50,45,Sensitivevirmin,news
mm23s47,1juev62,reddit,"""I know I do literally nothing for the country and I don't even live there but the taxpayers should be paying millions for my security in America because I am an entitled man kid"".",2025-04-08 16:28:30,40,TheRemedy187,news
mm1j2iv,1juev62,reddit,This moron renounced everything and now is bitching?,2025-04-08 14:45:55,121,TheGaslighter9000X,news
mm22ge8,1juev62,reddit,“We want our privacy! …but with security.”,2025-04-08 16:21:57,20,Fiendguy18,news
mm24f3k,1juev62,reddit,"Bro became a peasant, but still wants to reap the benefits ",2025-04-08 16:31:42,14,Competitive-Dot-3333,news
mm2e5zy,1juev62,reddit,"If he can't get what he wants in the UK, maybe he should just stay at home in California.",2025-04-08 17:18:57,7,continuousQ,news
mm1khqh,1juev62,reddit,"People complain enough about taxpayers having to finance royals who at least actually do their cerimonial/inspirational/statesman roles, now taxpayers are supposed to pay even for te ones who opt out?",2025-04-08 14:53:01,37,BlueSonjo,news
mm1t302,1juev62,reddit,"The entitlement of this guy, he raked in 27 million from his book ""Spare"". The title says it all. Pay for your own security, mooch.",2025-04-08 15:35:31,71,Ritaredditonce,news
mm2om7g,1juev62,reddit,"He is such a whiner and seems to make a career out of suing people. 

Hey that sounds like someone else.",2025-04-08 18:07:21,10,tooshpright,news
mm1ngxk,1juev62,reddit,Jesus Christ what a tool. If you aren't a royal anymore you don't get royal perks.,2025-04-08 15:07:42,43,obscureposter,news
mm3r5zy,1juev62,reddit,"I thought he wanted to live a ""normal"" life?",2025-04-08 21:14:11,3,Al_Jazzar,news
mm1t2gh,1juev62,reddit,That puts the Es in entitled.,2025-04-08 15:35:27,13,ChromaticStrike,news
mm395z8,1juev62,reddit,"Mate, your not doing royal duties anymore, your doing your own thing with your wife in America, pay for your own fucking money. I'm sure you got paid stupid amounts for your wife to burble on about arranging dinner parties or whatever that show was meant to be.",2025-04-08 19:48:41,8,HussingtonHat,news
mm2z9db,1juev62,reddit,Hey asshole you’ve got more than enough money pay for it yourself,2025-04-08 18:59:26,6,smokingace182,news
mm3o1h7,1juev62,reddit,"This is such a waste of the legal systems time and money. The crown can prove that not having publicly funded security has not affected him simply by the fact he has not been harmed since it was dropped years ago, even if he had to pay for it himself. That's a choice darling, welcome to reality!",2025-04-08 20:58:40,3,uncutlife,news
mm1pg3w,1juev62,reddit,"He can pay for his own, he walked away after backstabbing his family.",2025-04-08 15:17:30,14,Aretirednurse,news
mmcdw29,1juev62,reddit,probably the most disliked royal after prince Andrew,2025-04-10 05:43:28,2,curlystraws33,news
mm3z3t6,1juev62,reddit,What would he need it for anyways? I'm sure his wanna-be glamour wife was bitching and sent him to do this to keep their benefits.,2025-04-08 21:55:28,4,Infinizzle,news
mm4fx88,1juev62,reddit,This dude playing the victim constantly!!!! Go away and earn a living like a normal person can.,2025-04-08 23:29:53,3,Sedert1882,news
mm3vsxl,1juev62,reddit,"I thought Harry fucked off already, don't tell me we're still paying for his security",2025-04-08 21:38:07,1,RampantJellyfish,news
mm8a03x,1juev62,reddit,"What I don’t get is his moaning about the security in the UK, well where his living at the moment isn’t the most secure either, like factors such as naturally occurring disasters and what is the security over in California doing differently then the security here in the UK ??? I just think it’s not the security, I think it’s the better lifestyle that has attracted him to California moreover, correct me if am wrong. thoughts??? Yes his not royalty anymore and his paying for security himself now but wherever he goes he’ll be paying for security for life anyway.",2025-04-09 15:48:20,1,Ur-Mothers-MelonsMMM,news
mm9c4u3,1juev62,reddit,Is this really fp worthy news?,2025-04-09 18:51:40,1,Holly_Goloudly,news
mm34eeq,1juev62,reddit,Wouldn't the kidnapping or murder of harry put britain in an awkward spot vis a vis response/retaliation. Seems like the government would want him to have some burly dudes around for it's own security and peace of mind,2025-04-08 19:25:08,1,SillyGoatGruff,news
mm4tdi4,1juev62,reddit,"Imagine how fractured is the relationship with his father. I mean, Charles could fix this with a phone call.",2025-04-09 00:47:56,-1,Comfortable-Scar4643,news
mm1xfcr,1juev62,reddit,"Fuck the king, etc..

""I don't think people realise how the establishment became established. They simply stole land and property from the poor, surrounded themselves with weak minded sycophants for protection, gave themselves titles and have been wielding power ever since."" - Tony Benn 

(Anthony Neil Wedgwood Benn was a British politician, writer and diarist who served as a Cabinet minister in the 1960s and 1970s.)",2025-04-08 15:56:47,-8,reincarnatedusername,news
mm3dnxd,1juev62,reddit,People are never going to forgive him for marrying a black woman.,2025-04-08 20:09:54,-5,Past_Wrangler8120,news
mm1gbpf,1juev62,reddit,I see where Trump got this idea,2025-04-08 14:31:59,-14,Healthy_Ladder_6198,news
mm4ei0j,1juev62,reddit,"I think if anything, he became a ""working member"" after he left the royal family. Obviously that's not a club you can leave behind you without a whole bunch of compromises to your safety and well-being, so I don't understand why he'd need a security detail, LESS, when he is no lesser a member of that family. 

Where is the dignity and honor that the royals enjoy being the poster-children of? What if someone ends up hurting this guy because of something the royals have said or done or in fact, not done.....what happens then? No matter what, that's a f'd up family bc I don't know too many families that would withhold safety precautions if they had the means of providing those precautions to their family members.",2025-04-08 23:21:55,-6,D-inventa,news
mm1xn57,1juev62,reddit,"He wants to pay for police detail- which for some reason is not an option. Maybe someone can explain this part. Does he already pay for private security? I assume yes - but he is asking to pay police to do provide this service now, correct?",2025-04-08 15:57:50,-9,cranberryjuiceicepop,news
ml5fv14,1jq7gbm,reddit,If only we had a well supported and publicly funded agency at the ready to deal with such things...,2025-04-03 04:45:29,115,JohnnyGFX,news
ml57gu2,1jq7gbm,reddit,rebuilding homes just got a lot more expensive.,2025-04-03 03:41:08,55,Permitty,news
ml54ipo,1jq7gbm,reddit,Canceled policies and no FEMA assistance? Wow.,2025-04-03 03:20:38,96,MALESTROMME,news
mlaasb2,1jq7gbm,reddit,"If I was religious, I’d say that God was punishing republicans for living in sin and going against the Bible, but I’m an atheist.",2025-04-03 23:14:35,4,N/A,news
ml5dv8x,1jq7gbm,reddit,trump isn't coming to save you. womp womp.,2025-04-03 04:29:23,20,LipSeams,news
ml66rr4,1jq7gbm,reddit,"“Hey Canada….uh, do you have some extra lumber laying around by chance? Also, ummmm… do you have any extra eggs too by chance? We asked Lithuania but they said no.”",2025-04-03 09:13:22,15,pokemurrs,news
ml5adns,1jq7gbm,reddit,"They voted for this, hard to have empathy these days.",2025-04-03 04:02:22,16,devon223,news
ml66fzu,1jq7gbm,reddit,"Must be because of the gays, not the rampant autocracy….",2025-04-03 09:09:52,3,humpherman,news
mlcwbvc,1jq7gbm,reddit,It’s because of DEI obviously.,2025-04-04 11:37:44,1,kaynkayf,news
mkoxphk,1jo4prv,reddit,"Helene was 6 months ago, and it almost feels like Hurricane season never really ended: Is the end of this year bound to be really bad?",2025-03-31 14:41:40,35,VampireHunterAlex,news
mkqu10d,1jo4prv,reddit,Sounds like we in the Toledo area got off easy.,2025-03-31 20:21:37,2,DaMadBoomer,news
mktozz4,1jo4prv,reddit,"It was definitely a violent storm.

Here in Southern Michigan it knocked out power for hours, and caused plenty of property damage. 

It ripped the siding off my garage.

In Jackson County, wind gusts reached 98mph, which is comparable to the strength of  a category 2 hurricane.",2025-04-01 08:14:33,2,Wraxyth,news
mk74bz7,1jluw1d,reddit,Why don't they just buy from Canada 🤷,2025-03-28 15:19:17,19,Luckybuckets,news
mk6rxku,1jluw1d,reddit,Put your nuclear reactors back online and return to energy independence.,2025-03-28 14:17:09,126,double_teel_green,news
mk6sjo8,1jluw1d,reddit,"This headline and article is kinda trash. Just for the fact that it disproves itself within the first couple paragraphs.

*A report released on Thursday by Ember, an energy think tank, estimates that European purchases of Russian gas amounted to 21.9 billion euros ($23.6bn) last year, compared with 18.7 billion euros ($20.17bn) in financial aid to Ukraine.*

*That figure did not include military aid.*

Imagine not including one of the biggest forms of aid going into Ukraine.

Not to mention the two largest and consistent purchasers of Russian energy were Hungary and Slovakia, both currently being run by Pro-Russian leaders. If a nation should be chastised it should be France specifically because of their large increase of Russian LNG over the fall months of 2024, but overall they have greatly reduced their reliance on Russian energy. Just as the whole of the EU has.",2025-03-28 14:20:19,22,Ok-Lets-Talk-It-Out,news
mk6ii6j,1jluw1d,reddit,"Imported*.

This is last year and already known.

Gas sources are limited, cutting gas without alternative is not possible. Overall Europe has lowered its gas imports.

Instead of chasing gas imports, why don't you chase oil imports.

https://energyandcleanair.org/wp/wp-content/uploads/2024/02/image-14.png

AljazeeraNotBiased^tm",2025-03-28 13:25:54,10,ChromaticStrike,news
mkfw8jy,1jluw1d,reddit,"The remnants of the old US led world order need to tell Russia that unless they cease all hostilities in Ukraine, that they will explicitly support Chinese claims to Outer Manchuria.",2025-03-30 00:12:03,1,neurapathy,news
mkkgkhu,1jluw1d,reddit,How is it that alleged war opponents are now trading with each other?,2025-03-30 19:34:02,1,bsiviglia9,news
mless0o,1jrhgnv,reddit,"“We’re testing to see if the Russians are interested in peace,” Marco Rubio told journalists in Brussels after talks with Nato allies. “Their actions – not their words, their actions – will determine whether they’re serious or not, and we intend to find that out sooner rather than later.

Did they fail the test already?",2025-04-04 17:50:21,36,Zelenobot,news
mlfa4jm,1jrhgnv,reddit,"A children's playground, a ballistic missile with a cluster warhead.  

This is what Russia does.",2025-04-04 19:18:37,30,MadShartigan,news
mleul95,1jrhgnv,reddit,russians are terrorists!,2025-04-04 17:59:14,15,littlepindos,news
mlh9xrc,1jrhgnv,reddit,And then there's trump patiently waiting by the phone for putin to call about the ceasefire.  Maybe he should have left a callback.,2025-04-05 02:19:59,3,AcanthisittaNo6653,news
mk5dnsq,1jlpl8g,reddit,"Honesty I’m almost impressed someone found a pig’s head in the most populous Muslim country on earth, that takes some dedication",2025-03-28 07:38:05,24,Majestic-Lake-5602,news
mk5n5m5,1jlpl8g,reddit,You will see that start in the USA,2025-03-28 09:23:10,20,NPVT,news
mle0hf5,1jrd6cg,reddit,Now if they would get rid of the NMFS cops that come on your vessel fully kitted out like they are about to go into urban warfare.,2025-04-04 15:29:10,19,TenderLA,news
mlffx9i,1jrd6cg,reddit,"Climate change means the fisheries are ultimately doomed anyway. Might as well let the industry finish them off now, rather than the decades or so they could have lasted if properly managed.",2025-04-04 19:49:02,-27,PipsqueakPilot,news
mm6xm0g,1jv36ps,reddit,Why would twitch settle for this?,2025-04-09 11:12:56,175,Luka77GOATic,news
mm7qw3c,1jv36ps,reddit,How hasn't this case not been thrown out? I don't understand how you can sue for companies not wanting to do business with you.,2025-04-09 14:13:31,204,DTFlash,news
mm7t1dm,1jv36ps,reddit,Bezos bending the knee to Musk doesn’t surprise me. He doesn’t care about the precedent it sets it was probably just cheaper for him to cut a check then fight it in court.,2025-04-09 14:24:29,34,BreadTruckToast,news
mmal7d3,1jv36ps,reddit,">London-based Unilever said in a statement then that X as part of the agreement ""committed to meeting our responsibility standards to ensure the safety and performance of our brands on the platform.""

Oh I'm sure they're SUPER committed to that.",2025-04-09 22:41:31,8,Camwi,news
mmavx3b,1jv36ps,reddit,"Seems like they could have won easily, _especially_ given that Musk is on record telling advertisers to go fuck themselves.",2025-04-09 23:42:30,3,cyclemonster,news
mm8obtj,1jv36ps,reddit,"Great motivation for advertisers. When they quit paying after elon does some outrageous crap then elon sues them for money and to get out of court case they probably have to spend money on settlement. 

Normally companies pay for advertising to make more money in return but with twitter they pay to harm their reputation for being in that cesspool and if they try to get out elon tries to ruin them out of petty spite.",2025-04-09 16:58:40,6,qwerty080,news
moerk27,1k4zq5a,reddit,How does one grow food boldly,2025-04-22 10:51:40,47,addsomethingepic,news
mofhi7u,1k4zq5a,reddit,To boldly grow where no man has grown before.,2025-04-22 13:45:26,32,Q-ArtsMedia,news
mofrtqd,1k4zq5a,reddit,Good news but groan over the headline.,2025-04-22 14:39:36,8,NicksBirthdayParty,news
moh27ov,1k4zq5a,reddit,What about space tariffs? Just 10%?,2025-04-22 18:24:10,3,JustAnotherTrickyDay,news
mogsrhp,1k4zq5a,reddit,"Neat experiment, but what's the point? The same mass still has to be transported to orbit either way. ",2025-04-22 17:38:30,4,AltForObvious1177,news
moic6cz,1k4zq5a,reddit,The Final Food Frontier,2025-04-22 22:15:27,1,Content_Geologist420,news
moob7ex,1k6873j,reddit,"Dodged that bullet I guess, although I worked for CAS, my office was 55 Inverness Drive, the Jeppeson building, and that’s the division i started in. I’m sure they would have asked me to relocate, or leave as a result.  

And wow go I feel terrible for all my friends there. Nothing worse than having a private equity firm come in. Well I suppose it could be worse, it could have been KKR or one of those.",2025-04-23 20:51:58,54,zertoman,news
mos4uky,1k6873j,reddit,Private equity seems to be buying up everything.,2025-04-24 12:56:41,8,Hadleys158,news
