comment_id,content_id,platform,content,created_at,score,author,source_name
mmfz9nd,1jw5s8k,reddit,See what happens when you tariff penguins? Fucking teorrirism.,2025-04-10 19:46:03,25,championsofnuthin,news
mmggjvi,1jw5s8k,reddit,"Live action Madagascar remake already in the works, I see. ",2025-04-10 21:09:40,5,adminhotep,news
mmfykqf,1jw5s8k,reddit,Heard and McDonald Islands draw first blood. It has begun.,2025-04-10 19:42:35,14,steve_ample,news
mmhgoa6,1jw5s8k,reddit,New band name: Unsecured Penguin.,2025-04-11 00:34:15,4,Sorrow_cutter,news
mmiogzh,1jw5s8k,reddit,"Smile and wave, boys. Smile and wave.",2025-04-11 05:45:22,4,kdlangequalsgoddess,news
mmfx192,1jw5s8k,reddit,Should have slammed them with more tariffs.,2025-04-10 19:34:46,17,pilfererofgoats,news
mmfyr59,1jw5s8k,reddit,A warning for Trump to never mess with them.,2025-04-10 19:43:29,16,reddittorbrigade,news
mmfyts9,1jw5s8k,reddit,Penguins cant fly for a reason,2025-04-10 19:43:51,5,Picolete,news
mmgv4zu,1jw5s8k,reddit,"Coming soon to a theater near you. *Penguins in a helicopter (brought it!)*

“I have had it with these motherfuckin' penguins on this motherfuckin' chopper!""",2025-04-10 22:28:09,4,Acceptable-Peace-69,news
mmh043u,1jw5s8k,reddit,"I thought the headline was a joke. Then I read the article. Yip, my country did that! Well done us.",2025-04-10 22:56:27,4,Sedert1882,news
mmfxxe2,1jw5s8k,reddit,"For gods sake secure your penguins, people!",2025-04-10 19:39:17,6,CheeseburgerJesus71,news
mmg2rl0,1jw5s8k,reddit,The penguins are fighting back.,2025-04-10 20:02:41,3,BobbaBlep,news
mmgwza1,1jw5s8k,reddit,"Damn, that new Madagascar movie is intense. Disney finally did live action right!",2025-04-10 22:38:40,3,ShaneOfan,news
mmhb730,1jw5s8k,reddit,Kowalski... mission report,2025-04-11 00:01:06,3,Conbz,news
mmhmcbh,1jw5s8k,reddit,Thank god I read this and the penguin is ok. I did not need to read another horror news story today.,2025-04-11 01:09:06,3,_flying_otter_,news
mmsd0nu,1jw5s8k,reddit,They were all unharmed! Yay,2025-04-12 20:11:24,3,unskilledlaborperson,news
mmfwutw,1jw5s8k,reddit,This explains everything,2025-04-10 19:33:50,5,TooMad,news
mmg9zsf,1jw5s8k,reddit,Thank you for choosing Air Penguin.,2025-04-10 20:37:22,2,ChocolateHoneycomb,news
mmgex0c,1jw5s8k,reddit,I guess the penguin is not the only thing who cannot fly that day.,2025-04-10 21:01:20,2,NyriasNeo,news
mmgjkg3,1jw5s8k,reddit,Let this be a lesson. Secure your penguins before takeoff. ,2025-04-10 21:25:19,2,GreenConstruction834,news
mmi55nc,1jw5s8k,reddit,Penguins can't fly! PENGUINS CANT FLYYYYYYYYYYY!!!!,2025-04-11 03:09:34,2,moemegaiota,news
mmug90e,1jw5s8k,reddit,"“Kowalski, analysis”

“We’re crashing sir”",2025-04-13 04:14:32,2,yearningforlearning7,news
mmuhfhp,1jw5s8k,reddit,"Global Penguin Squadron failed to hijack..
Better remove tariff, GPS is coming..",2025-04-13 04:23:26,2,cham3lion,news
mmvxw68,1jw5s8k,reddit,"...and this is how the penguin wars started. Later, they partnered with killer whales until all ocean traffic was halted.",2025-04-13 12:42:06,2,Boxofbikeparts,news
mn5rgf8,1jw5s8k,reddit,So happy it wasn’t a loose seal 🦭,2025-04-15 01:04:04,2,okietarheel,news
mmfx5mj,1jw5s8k,reddit,Does this count as a bird strike,2025-04-10 19:35:22,3,ForgingIron,news
mmg60yu,1jw5s8k,reddit,Penguins now are terrorist,2025-04-10 20:18:01,3,Fire_Z1,news
mmfykm9,1jw5s8k,reddit,"""the specialist"". No need to say more apparently. The guy´s a specialist.",2025-04-10 19:42:34,2,Fuckkoff-,news
mmgaaxq,1jw5s8k,reddit,"These penguins are becoming a real threat, its high time for us to finally start sanctioning penguins across the globe",2025-04-10 20:38:54,2,Eran_Mintor,news
mmgd5f2,1jw5s8k,reddit,Always secure your penguin before flight. Always.,2025-04-10 20:52:41,1,schu4KSU,news
mmglngs,1jw5s8k,reddit,"His fight or flight response was triggered, and he was a flightless bird.",2025-04-10 21:36:20,1,titaniumoctopus336,news
mmgtfbj,1jw5s8k,reddit,What about the one in the Hudson River?,2025-04-10 22:18:27,1,sexaddic,news
mmgxvis,1jw5s8k,reddit,Seems like someone has made these penguins really bad,2025-04-10 22:43:48,1,Minty-licious,news
mmh7xk7,1jw5s8k,reddit,You don’t just go kidnapping a penguin like that! WTF. Demand an investigation. Aerial survey MY ASS!,2025-04-10 23:41:51,1,Cluefuljewel,news
mmh8594,1jw5s8k,reddit,"That's just what the man wants you to believe: remember, penguins can't fly! Think man, think!",2025-04-10 23:43:08,1,New--Tomorrows,news
mmhhlvu,1jw5s8k,reddit,"don't blame the penguin.

if you read the article, the penguin had *little* to do with it. any random Amazon box full of Happy Belly Cheese Crackers, a small kettle bell, a Slinky and toenail clippers would have done this in the hands of this passenger.",2025-04-11 00:39:56,1,espresso-puck,news
mmjmgr5,1jw5s8k,reddit,Let this be a stern lesson to all of us. ALWAYS secure your penguin(s).,2025-04-11 11:22:20,1,night_dude,news
mmjtusd,1jw5s8k,reddit,Did anyone check the unsecured penquin for war plans?,2025-04-11 12:15:19,1,Junior_Builder_4340,news
mmsp548,1jw5s8k,reddit,Did they not learn from watching Madagascar? Those guys are stealthy,2025-04-12 21:19:19,1,Joelnaimee,news
mmv1rfs,1jw5s8k,reddit,In their defense. An unsecured IPad caused a Chinook crash in the US. https://verticalmag.com/news/dropped-ipad-implicated-in-fatal-chinook-helicopter-crash/,2025-04-13 07:30:42,1,zalurker,news
mmg79cq,1jw5s8k,reddit,Penguins revolting against cheeto taxing them.,2025-04-10 20:24:02,1,sweetpeapickle,news
mmji9r4,1jw5s8k,reddit,I don't know tariff can be the cause of terrorism.,2025-04-11 10:48:16,0,VeraxLee,news
mm7kqld,1jv5v9a,reddit,">The International Monetary Fund on Tuesday said it has reached a preliminary, staff-level agreement with cash-strapped Argentina on a US$20 billion bailout, providing a welcome reprieve to libertarian President Javier Milei as he seeks to overturn the country’s old economic order.

Why would a libertarian accept a handout?",2025-04-09 13:41:20,424,def_indiff,news
mm7qjaq,1jv5v9a,reddit,Was this the jackass that gave president musk the chainsaw?,2025-04-09 14:11:43,147,nordender,news
mm8mn1c,1jv5v9a,reddit,"It should be noted that the reason Argentina has had a century of economic disaster after being one of the world's most promising economies in the early 1900s was because they did EXACTLY what Trump is doing now.

Universal tariffs that cut them off from the world economy and exploded their unbalanced domestic economy, because the regime in power wanted everything ""Made in Argentina,"" and to remove any reliance on foreign trade.

And more than a century later, they have not recovered.",2025-04-09 16:50:32,136,HerbaciousTea,news
mmcqpb0,1jv5v9a,reddit,"""The fund’s announcement offers a lifeline to President Milei, who has cut inflation and stabilized Argentina’s economy with a free-market austerity agenda that has reversed the reckless borrowing of his left-wing populist predecessors.""

  
This is from an AP article?  It reads it was written by the president's press-secretary",2025-04-10 07:53:09,6,slowestjogger,news
mm7mdka,1jv5v9a,reddit,thought they were doing better economically.,2025-04-09 13:50:06,37,Sweeth_Tooth99,news
mm7xb0s,1jv5v9a,reddit,"Milei talks a big game, loves to stand at CPAC with Elon and all the right wingers, but still needs to ask the IMF for money. What a hypocrite.",2025-04-09 14:45:47,42,DoubleBroadSwords,news
mm8oizr,1jv5v9a,reddit,You'd think that a Latin American country would have learned not to take IMF money after the first 10 times it fucked them over ...,2025-04-09 16:59:37,14,Diseased-Imaginings,news
mmb77xd,1jv5v9a,reddit,Looks like he made a deal with the guys from the structural adjustment committee (ie. the guys with the briefcases who show up before the guys with the guns).,2025-04-10 00:49:31,1,TryharderJB,news
mmbfyrl,1jv5v9a,reddit,Most people hating this guy on this thread have never heard him speak. Not only is he eloquent but he also goes out of his way to explain complex things in a way that everyone can understand,2025-04-10 01:41:05,-7,FarEntertainment8178,news
mmdibem,1jv5v9a,reddit,"How many bailouts does this make? When is the next one scheduled…?

/S",2025-04-10 12:08:22,0,nemesisx_x,news
mmaukxv,1jv5v9a,reddit,How many times did they bail them before ?,2025-04-09 23:34:52,-1,NoSignificance4349,news
mmkr68z,1jwictf,reddit,They are deporting people for the same star tattoo like every emo punk kid i knew in high-school got? These people are morons. ,2025-04-11 15:17:41,141,Czarchitect,news
mmlgvbm,1jwictf,reddit,Making their definition of “gang” tattoos as broad as possible in order to illegally deport and incarcerate people in El Salvador’s gulags.,2025-04-11 17:23:39,74,Wizchine,news
mmkswlp,1jwictf,reddit,Intentional idiocy and cruelty on full display,2025-04-11 15:26:05,28,HeIiax,news
mmlt15b,1jwictf,reddit,"Judging a book by it's cover. When will this maga insanity end?
   
The world is looking at them fools. 
   
I wouldn't be surprised if other countries have/or are collecting a ""who's who"" for later use.
 
Then people touring/visiting other countries will mysteriously disappear.",2025-04-11 18:23:30,16,guesthost1999,news
mmr6ind,1jwictf,reddit,None of those are gang tattoos,2025-04-12 16:25:16,16,MovingLikeDracula,news
mmtna0z,1jwictf,reddit,I'd be cancelling that family trip to Miami.,2025-04-13 00:51:40,14,thetrollking69,news
mmvojip,1jwictf,reddit,"So white people with nazi and kkk tattoos are being deported too, right?!   Or is this a brown and black only thing.",2025-04-13 11:28:11,10,dickysunset,news
mmue418,1jwictf,reddit,So uhm...you can't have a tattoo of an AR but you can wear an AR pin in Congress?,2025-04-13 03:57:49,6,BustAMove_13,news
mms42i1,1jwictf,reddit,Oh no I have a bunch of “gang tattoos” ,2025-04-12 19:21:41,3,Night_Porter_23,news
mn7gu9r,1jwictf,reddit,TRAINS ??? What the fuck trains have to do with gangs ?,2025-04-15 09:43:09,2,prophet_spiegel,news
mn7g2nh,1jwictf,reddit,My ex has two of those stars on her chest lol. She better not go to the US haha.,2025-04-15 09:35:02,1,my_teeth_r_dry,news
mneab7a,1jwictf,reddit,Tattoo flowers and big cats are on the list. Tiger King is Tren de Aragua,2025-04-16 12:17:20,1,paxrom2,news
mnlinop,1jwictf,reddit,This guy in the article says he has a trip to the US planned and fears Guantanamo?  Someone ought to tell him to look into CECOT EL Salvador. Better think twice about comng here.,2025-04-17 15:12:35,1,Nena902,news
mo942gh,1jwictf,reddit,I swear you’re gonna start hearing stories of Gang member forces their tattoos on people to blackmail them.,2025-04-21 13:23:39,1,Adrewmc,news
mn0oet6,1jwictf,reddit,Anyone else getting the sense that the Trump admin is tragically inept?,2025-04-14 05:49:40,0,Mala_Practice,news
mmm1qdj,1jwictf,reddit,"That dude looks shady, better deport him to El Salvador just to be sure.",2025-04-11 19:07:42,-7,JohnDLG,news
mlhkf3d,1jrjyxh,reddit,"Good. 0 penalty for rape is disgusting, regardless of age or talent.",2025-04-05 03:35:55,47,Coulrophiliac444,news
mlhm5zu,1jrjyxh,reddit,The justice system is really fucking telling on themselves when they avoid giving someone a sentence because it might damage them in some way. Reform and correction should be the point of prison,2025-04-05 03:49:21,55,ManfredTheCat,news
mlgcyjt,1jrjyxh,reddit,Excused him because he’s “young and talented”. And now he e knows he can get away with rape scott-free. And his victim knows all she gets is posturing.,2025-04-04 22:49:44,51,Lynda73,news
mk28to2,1jl93hc,reddit,You would have lost me at Egyptian Holiday Resort Submarine.,2025-03-27 19:28:29,96,ButterscotchSure6589,news
mk23wnn,1jl93hc,reddit,I'm starting to think these submarine things aren't the safest mode of transportation.,2025-03-27 18:46:25,37,karpDM,news
mk3ycsy,1jl93hc,reddit,"i'm just gonna cross trip in a private submarine off my bucket list, even though i haven't done it.",2025-03-28 01:10:15,14,sumquy,news
mk1ow4i,1jl93hc,reddit,"It sounds like it struck a reef at a depth of around 20m? I don't know enough about submarines to understand what the situation would have been, but at least the majority were able to be rescued.",2025-03-27 17:34:49,22,ExpiredExasperation,news
mk1wg9r,1jl93hc,reddit,Oh yes our yearly sacrifice to the sea almost forgot about that.,2025-03-27 18:10:13,32,Individual_Respect90,news
mk3ect2,1jl93hc,reddit,Aren’t they supposed to sink?,2025-03-27 23:21:01,12,Heil69,news
mk3b6ay,1jl93hc,reddit,"Why would anybody trust a ""tourist submarine"" that looks on the inside like the ones at Disneyland?",2025-03-27 23:04:37,12,DazedinDenver,news
mk6epmm,1jl93hc,reddit,"I had to read the title a few times because I kept seeing “submarine sinks tourist ship”, since that is the only thing that makes sense. Who goes on a tourist submarine!?",2025-03-28 13:03:37,1,Xinlitik,news
mk7nrsn,1jlu7io,reddit,Inspiring. I hope everyone stays safe.,2025-03-28 16:53:53,15,JayfishSF,news
mkegamp,1jlu7io,reddit,"I'm hesitant to keep my hopes up because I witnessed the arab spring 10 years ago, but I hope for the best. Seeing democracy in action would be very refreshing and beautiful, considering the current geopolitical situation. 

may the protests lead somewhere",2025-03-29 19:16:56,6,fleranon,news
mlcmrx1,1jr7v99,reddit,Oh that’s a relief. Wait how did oil avoid tariffs?,2025-04-04 10:16:41,83,shayKyarbouti,news
mld4nc5,1jr7v99,reddit,"There was an oil exec on Bloomberg recently - he was walking on eggshells discussing Trump's policies but was very clear when he said ""drill baby drill only makes sense when barrel of oil is at least $80"" 

So much winning.",2025-04-04 12:35:33,58,that_70_show_fan,news
mlf8bz8,1jr7v99,reddit,"OPEC probably also sees this a great opportunity to dismantle the US oil industry again.  Flood the market during an tariff induced economic slowdown, oil prices crash below $70/barrel, US exploration slows down/stops, low performing wells capped, and layoffs ripple through the US energy industry as foreign oil floods the market at noncompetitive rates.",2025-04-04 19:09:11,15,ViceroyFizzlebottom,news
mlcpss2,1jr7v99,reddit,"Uh Oh -- Factories slowing down and closing THANKS TO TRUMP, but OPEC-daddies must HAVE their  massive Oil Revenue!

Now the 'unintended consequences' start kicking in.  Oil glut.  Bad day for Trump!

1. ""National Energy Emergency"" Kaput - Wave goodbye to all the DRILLBABYDRILL laws he wanted to suspend with his fake emergency declared in January, and all the Arctic and coastal drilling he had lined up -- because 70/barrel oil (and falling) is plenty cheap and abundant, and drilling revenues would not even justify new prospects
2. Russian 'Cards' Kaput - Poor lil mistreated Putin won't be getting money from Russian oil revenue -- Uh oh - he'll lose his cards!
3. Arab Relations Kaput - Trump just made the rich Arabs he has been courting poorer.  That'll give them fewer reasons to accept any US trade route deal, and more reason to align with BRICS, 'Rusher', and 'Chiner'.
4. US Big Oil Donors Kaput - DRILLBABYDRILL Big Oil contributed over half a billion to Trump's campaign to get his allegiance on exploiting all the 'liquid gold under our feet'.  Guess what fellas it's just CHEAP dirty OIL again, get in line.

So much for demonizing clean energy.  So much for pushing for AI & Crypto data centers powered by corrupt Big Oil, fracking, etc.  Big OPEC players are back in the game, thanks to Trump's factory-killing tariffs.  Cheap crude is back.  Trump'll be trying to put on a good face while getting it sliced up in a 1000 cuts, and served back to him daily.

[https://www.theguardian.com/us-news/2025/jan/23/big-oil-445m-trump-congress](https://www.theguardian.com/us-news/2025/jan/23/big-oil-445m-trump-congress)

[https://www.theguardian.com/environment/2025/apr/03/trump-fossil-fuel-donors-data-centers](https://www.theguardian.com/environment/2025/apr/03/trump-fossil-fuel-donors-data-centers)",2025-04-04 10:44:52,49,XSinTrick6666,news
mlcmqd8,1jr7v99,reddit,Good ol Thuesday decisions.....,2025-04-04 10:16:16,6,czspy007,news
mlcnevy,1jr7v99,reddit,"""Drill, baby, drill"" came from the place no one expected.",2025-04-04 10:22:51,7,pimezone,news
mleor0k,1jr7v99,reddit,"So, now US oil companies will take the hit and start laying people off like they did in his first term. Awesome.",2025-04-04 17:30:31,3,EnslavedBandicoot,news
mlf4xff,1jr7v99,reddit,Quickest way to bankrupting Russia is to break the oil market.,2025-04-04 18:51:39,2,simfreak101,news
mlgglzw,1jr7v99,reddit,"oh right, in the midst of all this tariff bullshit i forgot that oil is still stupidly expensive",2025-04-04 23:11:43,1,Kitakitakita,news
mlej0vn,1jr7v99,reddit,Too bad we will see price increases,2025-04-04 17:02:04,1,JagoffMofo_374R,news
mkgjwe4,1jmfeqp,reddit,"The usual people who ask ""Why are they spending their time protesting and not at work??"" will finally have an answer since we can point at the daily ""10,000 people fired from job"" news articles",2025-03-30 02:38:35,42,Goodbye18000,news
mkswgmk,1jmfeqp,reddit,Just hope they remember to show up at the ballot box…,2025-04-01 03:40:19,-2,Weightmonster,news
mkgrg9g,1jmfeqp,reddit,[removed],2025-03-30 03:31:23,-88,N/A,news
mkh71gm,1jmfeqp,reddit,[removed],2025-03-30 05:41:11,-90,N/A,news
mm2lb1g,1juia9q,reddit,Headline already changed to 27 dead and 160 injured.,2025-04-08 17:51:59,46,JussiesTunaSub,news
mm34i20,1juia9q,reddit,Building and fire codes are written in blood.,2025-04-08 19:25:38,27,TheCatapult,news
mm5g61q,1juia9q,reddit,Everytime I go out these kinda disasters play on repeat in my head. Makes for a HELL of a time,2025-04-09 03:03:53,4,N/A,news
mmpnhqv,1juia9q,reddit,"RIP 

A community destroyed I assume 

Just tragic",2025-04-12 10:34:56,1,MarlonShakespeare2AD,news
mk2cz4d,1jlc469,reddit,"Incredible find for this antique dealer, however I find it ridiculous the news article blurred the sketched breasts.",2025-03-27 20:15:16,78,Subject-User-1234,news
mk2bnwd,1jlc469,reddit,"Good for her! 
Nice that someone figured out what it was before repurposing the frame for a Tom Selleck pic.",2025-03-27 20:06:21,109,Low-Lengthiness-2000,news
mk2lu0z,1jlc469,reddit,This is the kind of find that I dream about when I'm thrifting or antiquing.,2025-03-27 21:00:33,5,thebluecastle,news
mk2dcvd,1jlc469,reddit,aaaand its censored.  i hate this timeline,2025-03-27 20:17:22,27,sirbassist83,news
mk7law5,1jlc469,reddit,"While it is certainly worth much more than she paid for it, drawings usually sell for a hell of a lot less than paintings. 

Here are some auction prices for Renoir’s drawings

https://www.invaluable.com/artist/renoir-pierre-auguste-5grd8ripro/sold-at-auction-prices/?srsltid=AfmBOoo-eMY48IeNtCUzuDp043LVlFCSftHHrwi01PXPgP1C4qKvTPBq",2025-03-28 16:42:09,5,edfitz83,news
mk5dhfe,1jlc469,reddit,"Why is it censored??? It’s art, not porn.",2025-03-28 07:36:09,2,Ser_Pounce01,news
mkbmyrk,1jlc469,reddit,Somebody erased a perfectly good Renoir sketch!  /s,2025-03-29 07:25:01,1,FlickrReddit,news
mk2dxtg,1jlc469,reddit,Which is $11.99 more than I am willing to pay. But i suppose the value of art is in the eye of the beholder.,2025-03-27 20:20:29,-26,NyriasNeo,news
mmj9i4o,1jwlik5,reddit,"We need to rethink our continued purchase of utter junk from SHEIN to Temu, and of course Sweden’s great gift to the world H&M - which was a main starter of this trend",2025-04-11 09:23:21,253,No_Environments,news
mmjas3v,1jwlik5,reddit,Pretty much every time I walked pass clothing shops and just wondering who the fuck is buying all these clothes.,2025-04-11 09:36:47,78,yamirzmmdx,news
mmja86l,1jwlik5,reddit,"> Swedes throw away 90,000 tonnes of textiles per year, or 10kg per person, according to the Swedish Society for the Conservation of Nature.

> The EU average is 19kg

I'm maybe at 1Kg max, considering year where I don't even throw any clothes are common, I'm not even sure it's worth for me to talk in year. 

WTF is wrong with people.",2025-04-11 09:30:59,92,ChromaticStrike,news
mmjbpte,1jwlik5,reddit,"Fast fashion should be banned.  Producing clothes is agriculturally intensive, industrially intensive, and labour intensive.  

Clothes should be made to last.  Fashion should not be something so ugly it has to be changed every 6 months.",2025-04-11 09:46:24,70,Cyanopicacooki,news
mml3ofj,1jwlik5,reddit,"If regular clothes were more affordable it'd limit this. I don't mind paying more for higher quality but often it's 25 dollars for a shirt thats the same quality as a 5 dollar sheiin shirt. People can barely afford rent, groceries, gas, they're gonna say the 20 bucks for important stuff and go with the 5 dollar shirt.",2025-04-11 16:18:54,14,xHey_All_You_Peoplex,news
mmjsz5p,1jwlik5,reddit,Ban fashion dictators,2025-04-11 12:09:17,9,bier00t,news
mmjjewe,1jwlik5,reddit,"I worked at H&M for a while, half of the stuff I saw coming in had button with one stitch keeping them on. I bought clothing there with my employee discount pretty often, my pants buttons always needed the button re-sewn after about a week or two. 

I don’t know why anyone bought it. The employee discount made sense for me, but I never bought there again after I left (no bad blood with the company either, their product just sucks)

They got great benefits though",2025-04-11 10:57:50,7,NotPagle,news
mmj9mqy,1jwlik5,reddit,Nobody needs fast fashion. Let's stop wasting precious resources on bullshit.,2025-04-11 09:24:43,21,snmgl,news
mmj9di2,1jwlik5,reddit,"> 2,500 litres of water and one kilogramme of chemicals are needed to make a T-shirt that weighs 135 grammes

Fuck me, humans are a cancer on Planet Earth.

I don't even want to think about how much resources was just wasted by me submitting this comment.",2025-04-11 09:21:58,30,rnilf,news
mmlgzjj,1jwlik5,reddit,"That's why I'm a big fan of [capsule wardrobes](https://www.reddit.com/r/capsulewardrobe/).

I have just some basic jeans, khaki-style trousers, t-shirts, and polos that I can mix and match at will, plus some long-sleeved tops for winter.  I do own one suit for weddings or funerals.

I've probably had the same ""look"" for the last 20+ years, and will likely retain that look for the next 20...",2025-04-11 17:24:14,3,frankev,news
mmrfaud,1jwlik5,reddit,And yet second hand stores will rather throw out clothes than sell them at a decent price. ,2025-04-12 17:10:26,2,LEANiscrack,news
mmk2yvl,1jwlik5,reddit,"So, what is ""Fast Fashion""? I have heard the term and understand its trendy clothing produced in mass quantities and then generally doesn't get purchased so its just destroyed, but what is an example?",2025-04-11 13:12:40,1,Rapier4,news
mmmq4j6,1jwlik5,reddit,"See this is just incomprehensible to me but I also essentially have the wardrobe of a cartoon character (same kind of shirts, sweaters, pants/leggings). My favorite flannel shirt finally gave out after like 11 years and people are out here just throwing clothes away…. Crazy.",2025-04-11 21:13:04,1,Sablestein,news
mmuup10,1jwlik5,reddit,"I know people who buy clothes 3-4 times a year and throw away last year's clothes. 
Why?

Fashion victims.",2025-04-13 06:19:51,1,ILoveSpankingDwarves,news
mnfhq1k,1k0o62v,reddit,"ARTICLE:

The European Union on Wednesday published a list of seven countries that it considers “safe,” as member states seek to speed up migrant returns.

The list includes Kosovo, Bangladesh, Colombia, Egypt, India, Morocco and Tunisia.

WHAT DOES THIS MEAN FOR ASYLUM CLAIMS?

The expanded list means EU member states will process applications from the countries deemed safe using an accelerated procedure because they have a low chance of success.

“Many member states are facing a significant backlog of asylum applications, so anything we can do now to support faster asylum decisions is essential,” said Magnus Brunner, the EU’s commissioner for migration.

Although the EU presented a similar list in 2015, the plan was abandoned due to heated debates over whether or not to include Turkey.

WHY IS THE CHANGE BEING MADE NOW?

Brussels is under mounting pressure to crack down on irregular arrivals and ramp up deportations, as hard-right parties ride a wave of anti-migrant sentiment across Europe.

Hawks including Sweden, Italy, Denmark and the Netherlands in October demanded fast-tracked legislation to boost returns — and urged the Commission to act swiftly.

Italian Interior Minister Matteo Piantedosi said the change “constitutes a success for the Italian government, which has always worked both at a bilateral and multilateral level to obtain the revision of the regulation.”",2025-04-16 16:08:22,40,OutrageousCost4818,news
mng5d23,1k0o62v,reddit,[deleted],2025-04-16 18:01:54,-22,N/A,news
mnghqhw,1k0o62v,reddit,"India assassinated political dissidents in Canada! But the EU thinks they won't do it in their own country?!

Egypt openly arrests political opposition!",2025-04-16 19:04:29,-34,janethefish,news
mll61pk,1jrvxj0,reddit,"We know the answer. In the shipping data, sometimes it gets labeled wrong, and goods shipped to Norfolk, VA got labeled for Norfolk Island. The administration took the shipping dataset, collapsed it down to country code, and then ran their stupid formula against it, dusted their hands and made it policy. 

Global trade policy set in 30 minutes.",2025-04-05 19:39:36,417,bubba-yo,news
mllctmk,1jrvxj0,reddit,What are they manufacturing there that they are exporting to the United States?,2025-04-05 20:18:01,37,Jealous_Disk3552,news
mln358q,1jrvxj0,reddit,"Madagascar is the largest producer of vanilla, so they got hit with a 47% tariffs because of that. The US has no local vanilla production to protect. It's beyond belief.",2025-04-06 02:48:34,33,maporita,news
mllpd6c,1jrvxj0,reddit,"We all know, it's called incompetence.",2025-04-05 21:29:24,15,TrashCapable,news
