subreddit,post_id,comment_id,comment_content,comment_score,comment_created_at,comment_author
music,1k09sc0,mncea60,Highly underrecognized 90s gem right here. These guys were so much more than people gave them credit for.,8,2025-04-16 02:28:56,Emcee_nobody
music,1k09sc0,mncr1eg,I was a huge fan. Love this song.,4,2025-04-16 03:54:34,Figmentdreamer
music,1k09sc0,mndbafc,Cracking couple of albums from these 2,3,2025-04-16 06:49:39,Loquis
music,1k09sc0,mnihoz4,The lead singer went on to have a solo career for years. Absolutely still love his music. ,1,2025-04-17 01:40:14,garbagegoat
music,1jzet3t,mn83xav,Most underrated indie band out there.,1,2025-04-15 12:47:21,ALEXC_23
music,1jxykxp,mmuac90,[My favorite Prince solo](https://youtu.be/dWRCooFKk3c),3,2025-04-13 03:29:24,blackmoose
music,1jxaixa,mmp24xg,Nice,1,2025-04-12 06:53:02,Munsif2001
music,1jx66l2,mmo76ri,Ahhhh! GREAT song from one of the masters of Goth! 🤘🎸🥇,4,2025-04-12 02:36:31,theweightofdreams8
music,1jwjq55,mmiyep3,"*So drunk, in the August sun,  
And you’re the kind of girl I like,  
Cuz you’re empty…and I’m empty…  
And you can never quarantine the past.*

Genius",3,2025-04-11 07:24:02,chuckerton
music,1jwjq55,mmiyrme,Fuck yeah!,2,2025-04-11 07:27:48,skwaak16
music,1jwjq55,mmizylf,You can never quarantine your past.,2,2025-04-11 07:40:46,McGrawHell
music,1jwjq55,mmlo5bm,35th anniversary of Wowee Zowee today!,2,2025-04-11 17:58:59,MikePGS
music,1jwjq55,mmr58bj,There is no other song like this. One of my top favorites.,1,2025-04-12 16:18:34,poopoopoopalt
music,1jwe195,mmiduhp,Sheik Yerbouti,8,2025-04-11 04:14:13,NuNuMcG
music,1jwe195,mmhof14,"Old man here. Zappa has been a staple since college, when I fell in love with his music. YCDTOSA Vol 2 (Disc 1) Inca Roads and RDNZL are two of my favorite pieces of music (Zappa or otherwise). Oddly, I haven’t seen 200 Motels. It was remarkably hard to find back then, and I just haven’t thought to seek it out. Anyway, rock on! I wish I could start over and hear him for the first time again.",6,2025-04-11 01:22:06,timothypjr
music,1jwe195,mmhqcft,Joe's Garage was a staple in high school. Apostrophe  along with Live In New York too. Titties and Beer!,6,2025-04-11 01:34:06,gonepickin
music,1jwe195,mmhr8hx,One more for Joe's Garage!,6,2025-04-11 01:39:39,MillionDollarSticky
music,1jwe195,mmi4hl6,Over-Nite sensation,8,2025-04-11 03:04:53,nanosam
music,1jwe195,mmhx6vk,">who all here is a certified Zappa Freak?

Well, almost all of us over at r/zappa",4,2025-04-11 02:16:51,paultheschmoop
music,1jwe195,mmi4pv2,You are what you is,4,2025-04-11 03:06:31,wtfjohnny69
music,1jwe195,mmij4vq,Zoot Allures - Black Napkins,4,2025-04-11 04:58:04,N/A
music,1jwe195,mmi1m5u,Stink foot,3,2025-04-11 02:45:22,RussellAlden
music,1jwe195,mmikyeo,Fillmore East,3,2025-04-11 05:13:49,chemtrailsniffa
music,1jwcevh,mmhb5w3,Buen  tema,1,2025-04-11 00:00:55,Far_Student_6615
music,1jwcevh,mmjspmq, Sometimes you just get ripped and create a classic. From what I understand this was just something they played to the fans so they could take a break and get loaded.,1,2025-04-11 12:07:28,blackmoose
music,1jsen97,mlm7u97,Uplifting tune,1,2025-04-05 23:22:26,Mentalfloss1
music,1jsblgs,mll78n4,"The song ""A Child And His Lawnmower"" by Dead Kennedys is based on a real incident involving Frank Karnes, who was fined for shooting his lawnmower when it wouldn't start. This highlights themes of frustration and societal intolerance. This narrative serves as a critique of both the legal system and the violent tendencies of individuals when faced with mundane frustrations, reflecting broader societal issues that remain relevant today.

* [A Child And His Lawnmower | JG2LAND](https://jgtwo.com/2022/11/08/a-child-and-his-lawnmower/)
* [A Child and His Lawnmower — Dead Kennedys | Last.fm](https://www.last.fm/music/Dead+Kennedys/Jellos+Revenge+I+&+II/A+Child+and+His+Lawnmower)

^(This is a bot made by [Critique AI](https://critique-labs.ai). If you want vetted information like this on all content you browse, [download our extension](https://critiquebrowser.app).)",3,2025-04-05 19:46:32,critiqueextension
music,1jsblgs,mllf73m,Did sumwon say Holiday?,2,2025-04-05 20:31:17,simagus
music,1jr9gk3,mlcuzg7,Thin Lizzy,54,2025-04-04 11:27:23,squ1bs
music,1jr9gk3,mlczupt,King Harvest hands down!!!,18,2025-04-04 12:02:59,Neely67
music,1jr9gk3,mlcvs9l,"I never liked the song until I heard the King Harvest version, for much the same reasons as you.",12,2025-04-04 11:33:30,TFFPrisoner
music,1jr9gk3,mld42g1,"King Harvest by 1000 miles, but I'm biased: it was my parents' wedding song.",5,2025-04-04 12:31:44,CantFindMyWallet
music,1jr9gk3,mld8p8e,Pretty sure The Smashing Pumpkins also did a version. It's a b-side on Disarm and was on the reissue DVD of Pisces Iscariot.,4,2025-04-04 13:01:17,LazyCardigan
music,1jr9gk3,mldbak4,King harvest for sure,4,2025-04-04 13:17:01,N/A
music,1jr9gk3,mld8hxl,King Harvest’s Dancing in the Moonlight isn’t a song it is a magical incantation that transports me back to my 12 years old self.,3,2025-04-04 13:00:04,Harley_Schwinn
music,1jr9gk3,mldayzi,"I like the King Harvest version because I used to rollerskate to it in 1972 when I was 10.

However, I only just now found out it was actually written and recorded in 1970 by a band called [Boffalongo](https://youtu.be/r6dFjDQx_BQ?si=cUUBY9DlhHCv4UbH). It's likely our preferences are usually driven by whatever provides us with good memories.",3,2025-04-04 13:15:05,jaybee2
music,1jr9gk3,mlcxkum,"Toploader version because I think the organ riff they use is what sets the song apart, and is what's lacking from the King Harvest version.",7,2025-04-04 11:46:49,hippysmell
music,1jr9gk3,mlcyhdh,One of my favorite podcasts does an episode discussing this song! Made me appreciate this song even more.  https://open.spotify.com/episode/5QCBfn9SkphNyU9iSLPPqu?si=1tD2LJRPQbiEvQttfECm8g,2,2025-04-04 11:53:16,D0ubleD1ngo
music,1jqj90a,ml7am2b,"I have done the ""get a better earworm"" treatment but usually it results in a mashup (sometimes cool; sometimes disturbing)

I usually listen to the song in its entirety, song along and then listen to more music. 

If there is another song playing audibly it will distract until my channel changes internally.

Sometimes I'm stuck.


Wimowey to Yum Yum Bumblebee to sto in the name of love. It's just a channel until it changes",12,2025-04-03 14:06:33,doryllis
music,1jqj90a,ml7cmq7,"Listen to half a song I know and love

Then turn it off, it'll keep going in my head",5,2025-04-03 14:16:56,dogsledonice
music,1jqj90a,ml7pg6c,"Step 1. Listen to “Hollaback Girl” by Gwen Stefani. 


Step 2. Now “Hollaback Girl” by Gwen Stefani is stuck in your head.


This shit is bananas.",4,2025-04-03 15:20:31,Rip_Hardpec
music,1jqj90a,ml7e5x5,"I get songs stuck in my head often but the theme songs from my grandkids morning cartoons were driving me especially crazy. They were stuck in my head even when I was away from  home. I read that doing math in your head disrupts the earworm. I'll count by sixes or start with fifty and keep subtracting by three. I guess if one is good at math, they could do more complicated equations.",4,2025-04-03 14:24:42,Special_Possession46
music,1jqj90a,ml7vu4t,I have had One Headlight stuck in my head for a gd week. Why??????,5,2025-04-03 15:51:38,athenaseraphina
music,1jqj90a,ml7o8ng,"I live with this chronically, to be honest. I'm 99% sure it's a neurodivergency thing for me? Genuinely I just chase the bliss - embrace it and listen to it until it loses all meaning. Eventually there's an end of a line. 

But, at the end of the day, my baseline worm is one part of Ocean Man on repeat. Truly rent free in there.",6,2025-04-03 15:14:33,SquibbledSquab
music,1jqj90a,ml7jld1,"Just think of the Raiders of the Lost Ark theme and then you'll be thinking of that instead.

  
.........like you are now!",3,2025-04-03 14:51:44,ChipCob1
music,1jqj90a,ml7olz4,I think of a different song. At least I get to choose the ear worm. Seems to happen to me more and more. The last song on the car radio will go for hours it’s very annoying.,3,2025-04-03 15:16:22,notmenotyoutoo
music,1jqj90a,ml7rgm5,"Been dealing with this for a long time as well. What I found helps me , personally, is to grab a word or phrase from the song stuck in your head and use that as a different song. Example. You have ""We will rock you!"" stuck in your head, at the 'rock you' part switch it to like ""rock you like a hurricane!"". I've found if I do this a couple times or so, it breaks the radio head and I can usually think a bit more silently for a while.",3,2025-04-03 15:30:23,PunJedi
music,1jqj90a,ml7ewhu,The Indiana Jones theme cures them 100% of the time for me. ,2,2025-04-03 14:28:24,GryphonGuitar
music,1joz5qk,mkxu87f,"Hands down my favourite band. I saw them as late as February. It was masterclass, as usual.",1,2025-04-01 23:26:20,3nzo_the_baker
music,1jool3g,mktm186,"Highly recommend the Chaka Khan performance on Tiny Desk:

[https://youtu.be/Gse1LKXuV2M](https://youtu.be/Gse1LKXuV2M)

Insane talent that's only gotten better over the years.",2,2025-04-01 07:40:53,fulthrottlejazzhands
music,1jool3g,mktcgfs,I was listening to Chaka Khan all day today and I need to go to bed lolol,1,2025-04-01 05:57:37,ladyindev
music,1jool3g,mktcrid,Wonderful,1,2025-04-01 06:00:43,Gullible_Key6660
music,1jodhzq,mkqytvz,Love it,2,2025-03-31 20:45:24,jerryhsuisabitch
music,1jodhzq,mkrhise,"What year is this from?
Amazing group. Have loved them from the start.",2,2025-03-31 22:25:14,AssociationFrosty143
music,1jodhzq,mkwlmwz,The lyrics kill me. Amazing song.,2,2025-04-01 19:25:10,Resident_Level5231
music,1jnx6d3,mktxly2,Excellent.,1,2025-04-01 09:53:02,evil_nihilism
music,1jlze85,mk7l8x8,"If you can listen to this on a hi-fi system it's truly immaculate. Not just amazing harmonies, but a ripping Robert Fripp guitar solo and notably sampled very liberally by The Avalanches.",3,2025-03-28 16:41:53,warwickd
music,1jlze85,mk7misi,Grateful that you remind me of such a great one ❤️,1,2025-03-28 16:47:59,Fun_Cod277
music,1jlze85,mk7ne64,I absolutely love this whole album. Got me through some very dark times!,1,2025-03-28 16:52:07,Johnny-Alucard
music,1jlze85,mk7pimx,"I love this whole album. As a teenager, I just dreamed of being as cool as Suzzy Roche (at right) on the album cover. Hard to pick a favorite song on it, but it might be [Runs in the family](https://youtu.be/MR8emKSZe48?si=EtXCUWi71-mmnDa0)",1,2025-03-28 17:02:07,Webgardener
music,1jkplrf,mjx8s4b,Gloria - Patti Smith,31,2025-03-26 23:25:43,JimmyTheJimJimson
music,1jkplrf,mjx7jyf,"As a product of the 80s, early U2 from October (1981).  The Red Rocks version live is really great as well.  Saw them perform this live and it was just phenomenal....

[U2 - Gloria](https://youtu.be/ybYgP48X2DY?si=RNziSGg2hiJAQJGa)",22,2025-03-26 23:19:14,CrimsonFeetofKali
music,1jkplrf,mjxa6w1,[deleted],17,2025-03-26 23:33:13,N/A
music,1jkplrf,mjx7i2n,[removed],30,2025-03-26 23:18:57,N/A
music,1jkplrf,mjxafat,"Pretty sure Gloria has to be high on the list (Van Morrison/Them)

Not about the name, but Angels We Have Heard On High (and many other hymns): Gloria in excelsis deo",11,2025-03-26 23:34:28,paralyse78
music,1jkplrf,mjxjnks,Gloria by the Lumineers,8,2025-03-27 00:25:37,Charming_Rub3252
music,1jkplrf,mjxa1t4,"Venice Queen - Red Hot Chili Peppers

During the outro he spells out the name Gloria as a refrain",7,2025-03-26 23:32:29,DagmarTheSmall
music,1jkplrf,mjxc78p,Gloria - The Midnight,8,2025-03-26 23:44:06,_Sh_tlord_
music,1jkplrf,mjxb83o,Gloria - Mineral,7,2025-03-26 23:38:50,mbc106
music,1jkplrf,mjx6a2q,And Gloria in egg shells?  What's that about?,7,2025-03-26 23:12:29,justthenighttonight
music,1jj57u6,mjm8sux,"Great song! 👍 My favorite song from this album is still the title track, but this is a very good song. Bon Scott was a great singer!",3,2025-03-25 07:09:40,theweightofdreams8
music,1jixg4x,mjlauhx,One of my All-Time favorite albums,1,2025-03-25 02:26:29,Electrical-Hall5437
music,1k3rphz,mo4eei7,One of my favorite Beatles deep cuts.,3,2025-04-20 17:32:52,Matt_Benatar
music,1k3ekqn,moatv8x,Electronic? Really?,1,2025-04-21 18:49:33,Chocolat-Pralin
music,1k373vc,mnztcyk,Just watched this movie last night,2,2025-04-19 21:50:12,Boring_Ant_1677
music,1k34ubb,mnzkevs,RIP,1,2025-04-19 20:58:53,InvestmentFun3981
music,1k2cdor,mntaas7,Such a fantastic video. Love it.,2,2025-04-18 19:48:56,Koseoglu-2X4B-523P
music,1k0cklm,mndakps,These definitely have potential:),1,2025-04-16 06:42:23,DAD_SONGS_see_bio
music,1jxltn0,mn6n845,I listened to this album for the first time in years last week and fell in love with Zappa all over again.,2,2025-04-15 04:39:45,RitaLaPunta
music,1jvy4oy,mmeksah,"This song is a time machine for me, transporting me back to a canary-yellow attic bedroom in a flat in Headingley, Leeds, sharing Ferrero Rocher chocolates and drinking many Bloody Marys with a beautiful Yorkshire girl while listening to this on cassette just a day or two after Republic was released.",4,2025-04-10 15:39:12,ArcanumAntares
music,1jv9s4h,mm94wyo,Wish I was there.,3,2025-04-09 18:16:44,Dazzling_Form5267
music,1jv9s4h,mm946ok,I hope Stevie Ray Vaughan didn’t get hurt with that awkward stage exit at the beginning.,2,2025-04-09 18:13:13,SPMusicProduction
music,1jv9s4h,mmbzw3j,Would've been a fun place to go to.,1,2025-04-10 03:47:25,Empty_Original_1387
music,1juxcy9,mm5x1wz,One of my very favorite Al Stewart songs! 👍 The saxophone solo is one of the best in popular music too - second probably only to the one in Gerry Rafferty’s “Baker Street”.,2,2025-04-09 05:10:42,theweightofdreams8
music,1juj41m,mm3dz56,"Oh God there’s an embarrassing mistake there. Nena / Nina Hagen. You don’t do that, Pitchfork.",4,2025-04-08 20:11:23,rmiguel66
music,1jtpp45,mlw02xu,"i suggest everyone to listen this song, you won't regret",4,2025-04-07 16:44:32,Beautiful-Upstairs71
music,1jt2zno,mlr29y5,"""this is The Greatest And Best Song In The World""",1,2025-04-06 20:00:04,InevitablePoetry52
music,1jt1eia,mlr45nw,Bought this album when it first came out.,2,2025-04-06 20:09:49,WhiteFalcon60
music,1jspeb1,mlo6sst,"It’s a beautiful song. Great album. I think this song is on my heavy rotation mix on Apple right now. 

Can totally relate to the lyrics.",1,2025-04-06 08:37:06,NeoLoki55
music,1jspeb1,mlp2w0z,"Great song, but once they used it in the trailer for Benjamin Button, that's where it will always bring me when I hear it. Such a perfect song used for a specific film.",1,2025-04-06 13:30:27,braumbles
music,1jqxkng,mlakqwy,"Wait, am I counting 6?",1,2025-04-04 00:14:23,Bad_Here
music,1jpvjt3,ml2bueg,I hope silent albums are sold at a discounted rate.,3,2025-04-02 18:16:43,mdlewis11
music,1jpvjt3,ml2j2z6,"John Cage was against AI before it was cool.

(I’m joking, but actually I think this protest is a very neat one.)",3,2025-04-02 18:52:14,Phaedo
music,1jpvjt3,ml2cod2,Turn that shit UP,2,2025-04-02 18:20:46,radioOCTAVE
music,1jpvjt3,ml2vb3k,"Good on them!


I'm against it as well.",1,2025-04-02 19:51:53,emryldmyst
music,1jpvjt3,ml32ae4,"Still trying to find a backdoor to own chords I see...

I'll just leave this here: [https://www.youtube.com/watch?v=oOlDewpCfZQ](https://www.youtube.com/watch?v=oOlDewpCfZQ)

They tried, over and over, to own chords. They see the AI argument as a new back door to own sound itself.

  
Enjoy licensing the act of hearing if they win.",-2,2025-04-02 20:24:32,idgarad
music,1jpvjt3,ml3m57i,Cope. AI is here the stay.,-3,2025-04-02 22:01:51,IrrelevantLeprechaun
music,1jpuej8,ml2ahv7,"Loss Of Control is such a sick song. 

  
[Here's a stupendous cover of Loss Of Control by Mr. Bungle](https://youtu.be/L31yd2JMLSc?si=fJ_FjSRc-gxzoNuz).",7,2025-04-02 18:10:11,Nizamark
music,1jpuej8,ml2lxoq,"I'm not sold on the ""primal intensity"" of Could This Be Magic, but I will say that VH is a rare band who can pull off a sea shanty in the middle of a hard rock masterpiece.",6,2025-04-02 19:06:21,chris_wiz
music,1jpuej8,ml2i0sg,"One of the ultimate party albums.  And that's what a Van Halen concert was back then, a giant party.

Just glad I was able to experience this album in High School.  There's a reason I did terribly in school that year.",5,2025-04-02 18:47:00,krokus_headhunter
music,1jpuej8,ml23cpr,Women and Children Die First is the best Album by Remembering Never ,4,2025-04-02 17:36:36,Orphanpuncher0
music,1jpuej8,ml3r2wx,Nope….it’s Fair Warning,3,2025-04-02 22:28:29,StartingToLoveIMSA
music,1jpuej8,ml4q7s3,First VH Album is best.,3,2025-04-03 01:49:23,StatisticianOk9437
music,1jpuej8,ml25qzu,Yeah.,2,2025-04-02 17:47:47,bizoticallyyours83
music,1jpuej8,ml2hmi1,This post reminds me of American Psycho.,2,2025-04-02 18:45:02,freethis
music,1jpuej8,ml2vuch,Fair Warning is better and still not their best,2,2025-04-02 19:54:25,bobsmeds
music,1jpuej8,ml56hpe,"I've been saying this for many, many years (best VH album ever - all of the best were with Roth). And Romeo Delight is the best VH song. Ever.",1,2025-04-03 03:34:11,Scoob8877
music,1jps406,ml1jm8o,Ramones It's Alive 77. Kickass live record. No break besides some Joey quips. Dee Dee shouting at the top of his lung 1 2 3 4 and then the next song starts. Fantastic record,14,2025-04-02 16:01:06,Heuwender
music,1jps406,ml1lnnw,Secret World Live - Peter Gabriel,9,2025-04-02 16:11:29,hoganpaul
music,1jps406,ml1wssi,"The War on Drugs have 2 amazing live albums both released fairly recently. It basically is a live compilation, but very heavy on the last 3 albums.",9,2025-04-02 17:05:59,hatthewmartley
music,1jps406,ml1zvs1,Daft Punk - Alive 2007,8,2025-04-02 17:20:28,horsethecam
music,1jps406,ml2tqts,Fela Kuti and the Afrika 70 Live with Ginger Baker,6,2025-04-02 19:44:25,bobsmeds
music,1jps406,ml26npo,How the west was won - zeppelin.   Arguably the band at their peak in summer 72,6,2025-04-02 17:52:00,fromwhichofthisoak
music,1jps406,ml1mvo9,"Blink 182 - Mark, Tom & Travis Show.  Great album.",11,2025-04-02 16:17:39,Dozzi92
music,1jps406,ml1m2va,tangerine dream - poland : the warsaw concert,5,2025-04-02 16:13:37,spesimen
music,1jps406,ml1unlc,"Never understood why Ozzy Osbourne's ""Tribute"" live album, made as a tribute to Randy Rhoads, never ever gets mentioned on live album lists.  Every version on there slays the original recordings. 

Another great gem is the Beach Boys In Concert from 72.  This represents their strongest lineup with one of their best setlists. Seek this one out!!",4,2025-04-02 16:55:46,MeWiseMagicJohnson
music,1jps406,ml1x881,"Live Bullet (Bob Seger)
All Night Long (Sammy Hagar)
Live and Dangerous (Thin Lizzy)",4,2025-04-02 17:08:01,LongwoodFL_Josh
music,1joon0e,mktcumr,"This on repeat - yes, please. 

The queen on video : [https://www.youtube.com/watch?v=TjWmw-8-OEk](https://www.youtube.com/watch?v=TjWmw-8-OEk)",1,2025-04-01 06:01:36,ladyindev
music,1jnkwrk,mkkp27h,"In Motörheads ""Brave New World"" the line ""If Jesus showed up now he'd be in jail by next week"" goes super hard.",16,2025-03-30 20:17:42,Stahlwisser
music,1jnkwrk,mkkl9be,"Why believe you? You never gave us nothing to believe in!

Meet the Grahams by Kendrick Lamar",7,2025-03-30 19:58:24,DropDeadThrIIIc3
music,1jnkwrk,mkkukkw,"Real G's move in silence, like lasagna",8,2025-03-30 20:45:58,NixonsTapeRecorder
music,1jnkwrk,mkkxk7b,"“Wish I didn’t know now what I didn’t know then”
-Against the Wind by Bob Seger",6,2025-03-30 21:01:43,tootoosmash
music,1jnkwrk,mkkrj1g,"A Moment Of Forever by Kris Kristofferson

You were young enough to dream  
I was old enough to learn something new  
I’m so glad I got to dance with you  
For a moment of forever",5,2025-03-30 20:30:16,SyncRoSwim
music,1jnkwrk,mkknawx,"Nin Right where it belongs

See the animal in his cage you built.
Are you sure what side you're on?

Such a good opening line.",3,2025-03-30 20:08:49,Canusares
music,1jnkwrk,mkktvl3,"“It was in love I was created and in love is how I hope I die” - by Paolo Nutini, song: Coming Up Easy",3,2025-03-30 20:42:23,JohnnyJokers-10
music,1jnkwrk,mkku8e9,"You can’t change the way she feels, but you could put your arms around her

Protection - Massive Attack",4,2025-03-30 20:44:13,Gizagame1
music,1jnkwrk,mkkxe48,"""I'd love to change the world.

But I don't know what to do.

So I'll leave it up to you.""


I'd Love to Change the World | Ten Years After | 1971",4,2025-03-30 21:00:48,Neniaite
music,1jnkwrk,mklhpcy,"""Poor man wanna be rich, rich man wanna be king and the king ain't satisfied till he rules everything""


Bruce Springsteen - Badlands",4,2025-03-30 22:56:13,AdProfessional3042
music,1jln3ee,mk4xch7,A classic,1,2025-03-28 04:56:19,Mackyeroni
music,1jln3ee,mk52rld,So smooth.,1,2025-03-28 05:44:56,McGrawHell
music,1jlh9ox,mk6p61u,"this sub are full o haters this song bangs, none of you be objective",11,2025-03-28 14:02:47,Former_War1437
music,1jlh9ox,mk3pui0,good luck posting anything from / about LP on this sub nowadays.  The downvote brigade is out in full force for them.,12,2025-03-28 00:22:44,patronofchaos
music,1jlh9ox,mk3hvm0,![gif](giphy|zlWmW3JFBFys8),4,2025-03-27 23:39:30,AlaskanTroll
music,1jlh9ox,mk414uw,"Wasn't great honestly. I think anything that sounds close to their old material would just mean people will be reminded of Chester and their original hits.

I personally had only one song I really liked from their last album, and that was in part because it was something I never heard from them before.",4,2025-03-28 01:26:08,Akshatdes25
music,1jlh9ox,mk3qndn,"I miss him, but boy am I glad Chester never lived to see this shit",5,2025-03-28 00:27:12,aglaeasfather
music,1jlh9ox,mk5k47z,"The dj stated this was the greatest song they ever wrote.


How high was he?",2,2025-03-28 08:49:44,IPoisonedThePizza
music,1jlh9ox,mk3kxyb,Sounds like a song Paramore would make for like NBA2K...,4,2025-03-27 23:55:51,backindenim
music,1jlh9ox,mk4drv0,"I had hopes from the beginning but that chorus is horrific 


Also whatever she keeps doing with her hands/head us cringe.",-4,2025-03-28 02:39:46,Ill_Assumption_4414
music,1jlh9ox,mk4hplq,It's just way too safe,-3,2025-03-28 03:04:00,Georgeoverthere
music,1jjwt6f,mjrhfbd,"That is brilliant! If only someone could mash ""more human than human"" with Stevie Wonder's ""very superstitious"" my zombie mix listening life would be complete.",2,2025-03-26 01:37:48,theriex
music,1jjwt6f,mjt1q1x,Bill McClintock is the mashup king. Check out all of his YouTube,2,2025-03-26 09:40:09,Ruffdawg
music,1jj6si0,mjttcw9,Paywall’d,1,2025-03-26 13:13:49,N/A
music,1k4po90,moc1fh3,This one’s so good.,2,2025-04-21 22:31:54,Carl_Winsloww
music,1k4po90,moc9n7t,Love this song.,1,2025-04-21 23:18:12,LRClam
music,1k47u2j,mo806ge,I have no idea why this song is flagged as self harm on YouTube.,1,2025-04-21 07:40:16,blackmoose
music,1k40son,mo6kqc9,Such an underrated album.,2,2025-04-21 00:59:32,Antique-Yogurt6368
music,1k2xwxu,mnxo697,"Songs for the Deaf. 

I’d been listening to a lot of hip hop and electronic music and hadn’t listened to rock music in years.",19,2025-04-19 14:52:55,mekanub
music,1k2xwxu,mnxnp44,Physical Graffiti. On vinyl.,9,2025-04-19 14:50:17,Dystopia_Love
music,1k2xwxu,mnxnhsa,Locust Abortion Technician. I was waiting my whole life to hear sounds like that I didn’t know it.,9,2025-04-19 14:49:11,whatzzart
music,1k2xwxu,mnxqyih,The low end theory,8,2025-04-19 15:07:59,Necessary-Sock7075
music,1k2xwxu,mnxpm46,"Seems like a pretty generic answer, but still.

Death - The Sound of Perseverance.

https://preview.redd.it/mj1ra0ig3tve1.jpeg?width=1200&format=pjpg&auto=webp&s=ae610e5f1e44f1dcd9aeff557a942230c4058e59",6,2025-04-19 15:00:45,mystysilence
music,1k2xwxu,mnxrtyu,Images and words by Dream Theater turned my world upside down,6,2025-04-19 15:12:39,smaksandewand
music,1k2xwxu,mnxuqsk,Dream Theater - Images And Words,4,2025-04-19 15:28:15,StatisticianOk9437
music,1k2xwxu,mnxt4dq,"Chicago Transit Authority - s/t

There's a hunger and energy on this album that is unparalleled and unmatched on any of their other albums.  Beautifully mixed by Wayne Tarnowski.  I have owned this album on cassette, CD, Super Bit-Mapped 24k gold CD, and vinyl.  The 24k gold remaster by Doug Sax is still the best version I've ever heard of this album.  THIS is the Chicago that opened for Hendrix and Joplin and were, for awhile, the house band at the Whiskey-a-go-go.  The album sounds fresh and timeless even over 50 years after it's 1969 release.",4,2025-04-19 15:19:36,Perplexio76
music,1k2xwxu,mnxw0cj,Disintegration by The Cure.,4,2025-04-19 15:34:54,0khrana
music,1k2xwxu,mnxwmod,"Wilco: Yankee. Hotel. Foxtrot. Mind was blown and I still get that feeling when I hear the opening cacophony of I am Trying To Break Your Heart settle into that lumbering droning groove.  As another comment stated, I had been waiting to hear those sounds all my life.",3,2025-04-19 15:38:10,haldsy
music,1k1xzqq,mnpuiny,I haven’t heard this since it came out. It was so edgy then.,2,2025-04-18 06:16:59,mrmattb
music,1k1xzqq,mnpylnn,"The only song by him I know is Truth is Out of Style, which is hilarous.",2,2025-04-18 06:58:00,McGrawHell
music,1k1b9x0,mnl8dw6,"Ramones - Ramones  
The Velvet Underground - The Velvet Underground and Nico  
Nirvana - In Utero  
Hole - Life Through This  
A Flock of Seagulls - A Flock of Seagulls  
Depeche Mode - Violator  
The Cure - Disintegration  
Smashing Pumpkins - Siamese Dream  
David Bowie - Ziggy Stardust  
Garbage - Garbage",9,2025-04-17 14:22:20,fearofcrowds
