subreddit,post_id,comment_id,comment_content,comment_score,comment_created_at,comment_author
VietNam,1k3r9aq,mo498yl,"Lưu ý,

Bất kể bạn đang tham gia vào chủ đề thảo luận gì, hãy lịch sự và tôn trọng ý kiến của đối phương. Tranh luận không phải là tấn công cá nhân. Lăng mạ cá nhân, cố tình troll, lời nói mang tính thù ghét, đe dọa sử dụng bạo lực, cũng như vi phạm các quy tắc khác của sub đều có thể dẫn đến ban không báo trước.

Nếu bạn thấy bất kì comment nào vi phạm quy tắc của sub, vui lòng nhấn report.

***

A reminder.

In general, be courteous to others. Debate/discuss/argue the merits of ideas, don't attack people. Personal insults, shill or troll accusations, hate speech, any suggestion or support of harm, violence, or death, and other rule violations can result in a permanent ban.

If you see comments in violation of our rules, please report them.

***

*I am a bot, and this action was performed automatically. Please [contact the moderators of this subreddit](/message/compose/?to=/r/VietNam) if you have any questions or concerns.*",1,2025-04-20 17:06:21,AutoModerator
VietNam,1k3r9aq,mo4bat1,"Not sure about this one in particular but in Vietnam it is known that downed US aircrafts were scrapped to make various things.

Uncle Ho once gifted Fidel Castro an ashtray made from scraps of a downed helicopter.",5,2025-04-20 17:16:54,Mikimeister
VietNam,1k3r9aq,mo4p1xj,"This appears to be an auxiliary wing fuel tank from an F4 Phantom. They are designed to be jettisoned to save weight, improve weight distribution, and allow for improved maneuvering.",2,2025-04-20 18:28:47,FeedbackNo3124
VietNam,1k3kr0h,mo2sz7i,"Depends on your personal standard of living, but it is certainly possible in all of Vietnam. New college graduates earn like €340/month and live off that. It’s not great, but they do.",18,2025-04-20 11:55:38,tamucru
VietNam,1k3kr0h,mo2snx1,How r U gonna stay in VN long term when they don't have long term visas?,5,2025-04-20 11:53:06,Deep-Juggernaut-9943
VietNam,1k3kr0h,mo2sikt,You can absolutely live off that in Hanoi,2,2025-04-20 11:51:53,Sad-Association-5700
VietNam,1k3kr0h,mo2zcbq,"You can easily live well off that. With your own flat, eating mix of local and western food.",2,2025-04-20 12:44:29,Realistic_String5317
VietNam,1k3kr0h,mo334u4,"In Hue, a pretty good place/accommodation to live say an apartment might cost you less than $300. $150 for food and you are good to go. You can even teach English to cover your expenses.",2,2025-04-20 13:10:57,yeungon
VietNam,1k3kr0h,mo3q7i1,"college graduates can live off 350 dollars a month. 

i think you will be fine with 1k dollars a month.",2,2025-04-20 15:24:39,cdmx_paisa
VietNam,1k3kr0h,mo2x5ly,"Not insane and totally affordable. Obviously you won’t be living luxuriously and fine-dining but that is more than enough for a comfortable, pleasant life in Vietnam, even in the two big cities.",1,2025-04-20 12:28:20,SpanBPT
VietNam,1k3kr0h,mo3gaw2,"This is doable. It mainly depends on the place you rent.

In HCMC, a comfortable, clean, and relatively big furnished and serviced studio with a pool will be about 12mil VND for rent + 2 mil for utilities. That's about 475€ per month. If you eat mostly local or cook - comfortably - would be about 6mil (200€) per month. That leaves you with a spare 225€. Don't forget transportation.

You can cut everything by 2 if you want to live miserably. And it's substantially cheaper if you don't live in the social centers of HCMC or - even better - live in other cities, like up to 30% cheapers.

A visa run by bus cost about 80€ from HCMC, that includes visa cost for cambodia.",1,2025-04-20 14:30:26,Universal-Dismay
VietNam,1k3kr0h,mo3qzny,"dont live in saigon or hanoi. 

too easy to not have to use vietnamese

I recommend living in Quy Nhon or Dalat.",1,2025-04-20 15:28:54,cdmx_paisa
VietNam,1k3kr0h,mo4aaha,"On FB, join groups like Expats in Saigon. You'll see what you can rent.",1,2025-04-20 17:11:47,Universal-Dismay
VietNam,1k140pa,mnj5jf5,"What are you talking about? Any city have dog owners, many Viets love dogs. The problem is many dog owners have no manner or consideration for others, as they let the dog poops on the street without cleaning after them, no leash no muzzle when going out on walk which results in their dog scaring others or attacking others. Just be a decent owner and nobody will bat an eye.


Some appartments ban pets, so you will need to find house or pet friendly appartment, just like everywhere else. ",21,2025-04-17 04:18:46,RealDecentHumanBeing
VietNam,1k140pa,mnjbtfu,"Move to HCMC and live in District 7, Phu My Hung residential area. 

On the weekends there are huge dog owner meets in the parks. Dogs on leash being walked all morning and evenings by locals and foreigners.",4,2025-04-17 05:10:09,accidents_happen88
VietNam,1k140pa,mnjjkus,"I’m a dog owner here and have been apart of the small foreigner dog community here for some time now.  Your worries are correct and you shouldn’t trust people here saying “it’s not bad, everyone has dogs”.  This is generally a bad place for dogs if you actually care about their quality of life.  There are no animal rights in this country and dogs are generally seen by the public and government alike as disposable accessories/second class citizens.  Dog poisonings and kidnappings are real things that happen multiple times a year, absolutely not uncommon.  I’ve heard of cases where dogs were literally snatched off of the leash during a walk.  Theres little to no green space except for select parts of the cities and many of the green spaces are littered with trash and generally not somewhere I want to let my dog explore.  You can’t let your dog off leash and generally need to be on guard when walking your dog.  People are often scared shitless of dogs and even more so if your dog is big so expect to sometimes get wild reactions.  

I say this not to fearmonger, but so you understand that these are legit risks and you do the proper research before bringing your dog here.  These are risks that CAN be mitigated and maybe even brought down to a very low risk but you need to be strategic in picking the area you live and how you go about walking your dog.  Phú Mỹ Hưng is generally great and I know many people who have happily raised their pets there for years with very little worry (though there still has been recorded dog nappings here).  Another option is living in a compound (like a gated community) in a house/villa.  This is generally the best option and gives you the most peace of mind but is going to be expensive if you’re trying to live in the city center.  Many people will tell you a lot of the high-rise serviced apartments are “pet-friendly” and i would more so say they’re generally “barely tolerating pets”.  99% of them will require you to muzzle your dog if it’s outside of your apartment and you’ll need to take the service elevator every time you take your dog for a walk.  Many of them view dogs as nuisances are rules are constantly changing as management receives complaints from residents and changes their mind on a daily basis.  Some dog breeds are banned in these buildings.  Generally a shit place to live if you want freedom with your dog.

Again, a lot of this depends on where you live.  You can find areas that are much safer and dog-friendly but you need to make sure you do proper research and scout the area yourself beforehand or else you WILL be miserable (pls trust me, I didn’t do enough research and and am now miserable with my dog).  In general I find the attitude around dogs here to be enough of a reason for me to not like having a dog here.  I prefer for my dog to have a ton of green space and for the risk of dog poisoning to be 0% rather than 0.003% or whatever it is here (pulling that out of my ass).  I’m planning to move to give my dog a better life where I can live without fear of shit like dog thieves.  That’s just me though, and I love my dog dearly — I know people here who are very happy with their dogs so it’s not impossible.  Just pls do your research beforehand.  Check out HCMC dog lovers on Facebook, you’ll find a plethora of info there.",3,2025-04-17 06:21:48,koopaooper
VietNam,1k140pa,mnk1hik,D7 Saigon. Lots of dogs and their owners in Crescent Park around 5pm and on the weekends!,2,2025-04-17 09:27:44,Potential-Gazelle-18
VietNam,1k140pa,mnl5hlo,Live in Phu my hung (D7) near the main park. Big dog park. Check on dog lovers Ho Chi Minh City group on facebook to see which apartments are dog friendly. Or get a house (better option as long as your landlord ok). Apartment security guards can be absolute dicks.,2,2025-04-17 14:07:36,Narrow_Discount_1605
VietNam,1k140pa,mnj5p6k,Da Lat is nice if you're on a long-term visa without any commitment of having to find a job.,4,2025-04-17 04:20:00,paksiwhumba
VietNam,1k140pa,mnk0fbn,I have a dog in Thao Dien. Tons of people do here. It's no problem at all.,2,2025-04-17 09:16:30,SaigonNoseBiter
VietNam,1k140pa,mnjankz,"https://www.facebook.com/groups/1522115054746349/?ref=share&mibextid=NSMWBT

Please browse through this fb group. Lots of good information",1,2025-04-17 05:00:10,Affectionate-Key7492
VietNam,1k140pa,mnk1ub4,I saw a few in Hanoi by West Lake,1,2025-04-17 09:31:25,Justthefacts6969
VietNam,1k140pa,mnqfio3,"I travelled with my dog for a month and I would not do it again. In HCMC, it is too hot and there are too many aggressive dogs off-leash that dart out of nowhere to meet your dog, so unless you intend to keep them indoors all the time.

I found Da Lat and Nha Trang better suited for us, and helps if you find an apartment that tolerates dogs. It helps to have a small, non-shedding breed as those are the most popular there.

Vet care was easy to find, but they can charge exorbitant prices for foreigners. Overall, travel within the country is difficult with a dog and still lots of people hate them.",1,2025-04-18 09:55:23,d4rkc4sm
VietNam,1k0qb45,mnfzgjf,"Lưu ý,

Bất kể bạn đang tham gia vào chủ đề thảo luận gì, hãy lịch sự và tôn trọng ý kiến của đối phương. Tranh luận không phải là tấn công cá nhân. Lăng mạ cá nhân, cố tình troll, lời nói mang tính thù ghét, đe dọa sử dụng bạo lực, cũng như vi phạm các quy tắc khác của sub đều có thể dẫn đến ban không báo trước.

Nếu bạn thấy bất kì comment nào vi phạm quy tắc của sub, vui lòng nhấn report.

***

A reminder.

In general, be courteous to others. Debate/discuss/argue the merits of ideas, don't attack people. Personal insults, shill or troll accusations, hate speech, any suggestion or support of harm, violence, or death, and other rule violations can result in a permanent ban.

If you see comments in violation of our rules, please report them.

***

*I am a bot, and this action was performed automatically. Please [contact the moderators of this subreddit](/message/compose/?to=/r/VietNam) if you have any questions or concerns.*",1,2025-04-16 17:34:11,AutoModerator
VietNam,1k0qb45,mngczz5,Smart. stay away from China bank.,1,2025-04-16 18:40:12,Mister_Green2021
VietNam,1k0ecyt,mnelx4z,"Here's my list of my favorite local eateries and cafes, check it out if you're interested.

[https://docs.google.com/document/d/1xeheqQf-rR-NDE8iaYhxAQZjfTMs3RUo/edit](https://docs.google.com/document/d/1xeheqQf-rR-NDE8iaYhxAQZjfTMs3RUo/edit)",3,2025-04-16 13:26:03,TojokaiNoYondaime
VietNam,1k0ecyt,mng1bjf,Thank you so much! What a great list.,1,2025-04-16 17:42:55,frankiepedals920
VietNam,1k0ecyt,mng69kq,Mud baths,1,2025-04-16 18:06:16,TheDudeWhoCanDoIt
VietNam,1jw76v5,mmhochj,"Nice if you can gift a key to Minecraft. Translating from resource file only without context or real experience would be bad, especially sometimes it takes more vietnamese words for an english one and it's too long to fit in a small box or a sign.",2,2025-04-11 01:21:39,TallRent8080
VietNam,1jw76v5,mmjqc1c,Isn't there already a Vietnamese translation for the Java version? Not sure about the current quality but from what I remembered it wasn't too bad. Are there enough differences between Java and Bedrock version to warrant a new translation project when a simple port would do just fine?,1,2025-04-11 11:50:58,zdarkhero168z
VietNam,1jubfe4,mm0ouei,"I think you should use a Gimbal for stable footage, but anyways the Vlog is great!!!",1,2025-04-08 11:46:26,HYOUDOU_ARSHAD
VietNam,1jubfe4,mm0ov8h,Great way to remember your trip. 😊,1,2025-04-08 11:46:38,Connect-Package8178
VietNam,1jubfe4,mm0piyu,"Great first video, the shaking gives its own aesthetic to it imo.

>I am very new to photography and videography

Keep practicing even for mundane normal every day things and you'll improve. There are very few days where I don't bring my camera so I can just shoot random stuff.",1,2025-04-08 11:51:24,paksiwhumba
VietNam,1jskiwj,mln90n4,"All day everyday is a burning day in Vietnam. 

Daily trash burning. Weekly plant burning. Monthly house burning... From dawn to dusk.",13,2025-04-06 03:31:28,DDz1818
VietNam,1jskiwj,mlnoofl,"We are here for 2 weeks now, its very very bad in the North, Hanoi/Ha giang/Ninh Binh. We are in Da Nang now its better here. They are burning everything which is very sad. What's weird is that they gather donations everywhere for environment, on the other hand they pollute the air so much with this.

Tip; Check iqair.com for live air quality",5,2025-04-06 05:37:51,shepherd2442
VietNam,1jskiwj,mlnkagj,"You will probably have a great time but it’s very bad. Bring a scarf/mash and clear glasses (shades are too dark when there’s this much smoke).

Just finished the loop. First 2 days were incredibly smoky but still enjoyable - not enough to ruin the views, 3rd day you could see the sky/sun and was easily the best. Final day was a complete white out. Couldn’t see shit.",3,2025-04-06 04:59:09,Karma_Circus
VietNam,1jskiwj,mlncxbd,It wasn’t so much the smell or specific of the burning smoke that was bothersome in ha long bay. It was just foggy and cloudy while we were there last week. You can still see on the cruises and tours just no blue back drop or miles and miles of clear visibility.,2,2025-04-06 04:00:20,bougie858
VietNam,1jskiwj,mlnn1tk,"Hanoi is #2 itw most polluted air right now with an aqi of almost 200

There's only worse times and even worse times when it comes to the air quality sadly. This isn't even prime straw burning time of the year but there's just no focus on waste management or not burning random shit on a lot of corners",2,2025-04-06 05:23:11,areyouhungryforapple
VietNam,1jskiwj,mlod7j4,"Damn, I'll be there in a few weeks. Sounds like something I have bot considered. Maybe I have to adjust...",1,2025-04-06 09:47:01,SafetyCutRopeAxtMan
VietNam,1jskiwj,mlsps9p,I had a lot of difficulty breathing in Hanoi. But I have Asthma. Luckily I brought N95 masks with vents so you can exhale but it stops most particles and dust. I started a cold in Ninh Binh that turned into bronchitis which made things really hard to breathe in. I also had inhalers. Most people aren’t bothered.,1,2025-04-07 01:54:30,bluevervain3925
VietNam,1jskiwj,mltlgd4,There's a season?!?! My constant lung infections and asthma weren't aware there was a season. Lol,1,2025-04-07 06:01:54,Hawk4152
VietNam,1jskiwj,mlu02b4,We’re doing the ha giang loop on the last few days of April so i’m hoping the views are somewhat decent. I’m more bothered about ninh binh in early May really,1,2025-04-07 08:33:34,DisorganisedPigeon
VietNam,1jskiwj,mln934t,"Left Ha Giang yesterday, they started two or three days ago, there is very little smoke so far. But I assume it will go bad quite quickly",1,2025-04-06 03:31:59,one_bp
VietNam,1jpt4jf,ml1vnn6,"Not a dime.
Do you think the animals that produce this stupid product are well looked after?

Shitty ass coffee beans and cobra whiskey - stop supporting these stupid and exploitive products.  

As someone that's been drinking coffee for fifty years, I can tell you there are plenty of good coffees that didn't depend on the beans being washed out of the shit of a bunch of caged animals.

Don't be a dumb tourist.",44,2025-04-02 17:00:30,ddoubletapp1
VietNam,1jpt4jf,ml2hewe,“Weasel blend” my guy those are meerkats on the packaging 😭😭,20,2025-04-02 18:44:01,depquahv
VietNam,1jpt4jf,ml1swhf,"Shopee exists but there's loads of products on it that maybe aren't. I wouldn't buy this one. At that price maybe the coffee plantation's owner's cousin's good friend has seen a weasel five years ago but the coffee itself doesn't have anything to do with it.  
The animals on the package are African meerkats anyway. Could be a sign of the veracity of the ""weasel"" claim.",6,2025-04-02 16:47:19,Olfalf
VietNam,1jpt4jf,ml45ept,"Don't buy. It's fake. And even if it's real, do not buy because of the unethical treatment of animals. They are being forced feed.",6,2025-04-02 23:47:50,Lost_Purpose1899
VietNam,1jpt4jf,ml1s0nc,If its real its stolen otherwise its fake. I dont recall the exact price in Vietnam but its not much cheaper than in the US on a per pound basis.,3,2025-04-02 16:43:04,mygirltien
VietNam,1jpt4jf,ml2fnrg,"I thought it was supposed to go through a palm civet not a meerkat as the picture implies. Maybe meerkat shit tastes better, I wouldn't know.",3,2025-04-02 18:35:26,magungo
VietNam,1jpt4jf,ml3u3bq,"Nothing.  The practice of making this is incredibly cruel and inhumane to the civets.  Terrible, evil practice that should be banned on ethical grounds. 

And, why on earth would I want to drink something made from another animal’s shit in the first place?",4,2025-04-02 22:45:09,7LeagueBoots
VietNam,1jpt4jf,ml24cu1,"I dont wanna buy a coffee that I haven't tasted. As least give me a try taste in a 1 sip cup. Buying half a kilo of coffee from the internet? What is this, a game of mystery box? For an occasional drinker it may not vary. For an addict however getting stuck with a cheap pack of coffee means it's time to find someone who can accept an oppened pricy bag off coffee. Worst case you can try to drink on but end up ""accidentally"" leaving it at the workplace or a friend's house. Works every time.",2,2025-04-02 17:41:17,Savi--
VietNam,1jpt4jf,ml2575y,"The 30k was for a trial sample, full price on shopee is 60-75k/500g.

Still most likely fake. Real coffee should cost no less than 250k/1kg. Don't buy it.",2,2025-04-02 17:45:14,Megane_Senpai
VietNam,1jpt4jf,ml28eyn,"To answer your question, that specific ""brand"" is 25-50k for a 500 gram bag because it's very low quality normal coffee beans.

Nothing to do with kopi luwak other than the photo on the packaging.",2,2025-04-02 18:00:09,paksiwhumba
VietNam,1jpkd4b,mkzwnz7,"Make sure you can work legally in VN. Under the table jobs will pay less and can stress people out. 

All the best with your move.",9,2025-04-02 09:27:28,ps4db
VietNam,1jpkd4b,mkzz51v,"You haven’t explained your plan to qualify for a work permit or a work visa. Without a plan for that, you don’t have a plan.",7,2025-04-02 09:55:01,suchalittlejoiner
VietNam,1jpkd4b,ml1r650,If you have a university degree you'll be fine.,2,2025-04-02 16:38:57,WhiteGuyBigDick
VietNam,1jpkd4b,ml07l88,"I don’t see anything wrong with taking a few months off work for travel, before starting work at the end of November/start of December. But why would you spend that time just lounging around HCMC? You’ll be able to experience living in the city when you’re working so why not travel around during those 2 months, either in Vietnam or other countries.",1,2025-04-02 11:16:15,SpanBPT
VietNam,1jpkd4b,ml0k2pp,"I did basically what you're talking about, in May of last year. Flew out with $X and figured I'd work it out. It was basically fine. I would do a little research about your documents... notarizing / getting them apostilled doesn't work. They need to be ""legalized"" in the VNese manner. I can also say that ILA isn't going to want to hire you then just have you take a week off to party in Thailand.

Finally, regarding this: ""remember getting like really down on the fact that I was sitting in an office doing work (and actually sometimes even worse not doing anything, so literally sat there for no reason), whilst the country I had dreamed of coming to passed me by outside.""

...Unless you're retired / independently wealthy, this is how the world works. We our trade time for money, and then we get to enjoy non-work when we're not working. In fact, that's what is happening right now. Vietnam is here, passing you by, while you're in whatever country you're in that isn't Vietnam. Just saying.",1,2025-04-02 12:48:25,glimblade
VietNam,1jpkd4b,ml1w1kp,"My hubby and I moved to HCMC and stayed a year. 

We had about $20k usd savings. First month, we just got an Airbnb while we apartment hunted. FB groups are widely used. We got our apartment and on our second month we both got teaching jobs.  However we did squeeze in a week in Thailand before we started working. 

From my experience, tutoring centers are use to  foreigner employees taking time off and generally not paid. You should let your prospective employer know what your travel plans are because they have paying students who expect to learn. 

Just be careful of centers or job that ask to hang on to your passport. It’s a red flag for me. Make sure you have your university degree and English teaching certificate ready.",1,2025-04-02 17:02:22,New_Pizza_Rich
VietNam,1jpkd4b,ml06k50,"for finding flat even short term, saigon cribs on youtube he can help u out

www.inSaigon.app or on ios for events/activities

zalo for communication
we also have a group fr finding buddies
https://zalo.me/g/vribak483

grab for taxi",0,2025-04-02 11:07:25,Slow-Werewolf
VietNam,1jpkd4b,ml5tdka,Don't 😂,0,2025-04-03 06:50:23,Dumbledore_Albus420
VietNam,1jorzqb,mkuazrh,This is why we should have last seat/order time besides closing time.,11,2025-04-01 11:53:16,CeeRiL7
VietNam,1jorzqb,mkuak31,"\> Thật sự đây là quán ăn tệ nhất từ trước đến giờ tôi từng đến .

Sounds like one of those asshole one-percenters.",10,2025-04-01 11:50:03,how33dy
VietNam,1jorzqb,mku311b,They should let him know about last call time and if he/shes is ok with that,7,2025-04-01 10:47:28,bust_a_zot123
VietNam,1jorzqb,mku06ma,"I would say he do have a point if I were extremely hungry and it's the only place that still open at that time but maybe he's just unlucky and met a delicated amateur that didn't know that 30 mins is maybe for cleaning and closing or it's just the owner's order. Not gonna blame anyone, all I can say is, very unfortunate.",3,2025-04-01 10:19:49,hugo7414
VietNam,1jorzqb,mkufdhr,Fair review. Restaurant should’ve communicated better. I mean they took the customer’s order and money…,2,2025-04-01 12:24:29,Commercial_Ad707
VietNam,1jorzqb,mku1mr3,"Always ask the closing time at night, like it that easy.",1,2025-04-01 10:34:08,Hmm-welp-shit
VietNam,1jorzqb,mku3lyx,Better finish your meal fast before the restaurant closes. Or at least packing some first before you go. You know some drunkards come to the restaurant at near closing hour and stay there until midnight.,1,2025-04-01 10:52:49,Mindless-Day2007
VietNam,1jorzqb,mkvjkpi,Is this Kichi Kichi?? This review sounds familiar,1,2025-04-01 16:10:47,TartarugaHaha
VietNam,1jorzqb,mkx4u82,"If he paid the same money like every other customer, he should receive the same service like every other customer. Easy as that.

If you cant guarantee the same quality service to him, dont take his money.",1,2025-04-01 21:02:51,mrheosuper
VietNam,1jorkpy,mku0u94,"Super crowded, fake-looking, overpriced theme park. 

Sure, it’s the longest non-stop single-track cable car in the world, but the one in Phu Quoc is actually longer and cheaper with a lot better views.

If you want to spend about 1M vnd for a 20 min ride with not much of a view except for maybe top of trees and dirt piles of construction, then go for it. 

Also, you’ll have to pay for additional ride fees when you get up there if you want to see other parts of the park like the overrated Golden Hand Bridge, where you’ll get to enjoy being packed-in like sardines on the small bridge.",16,2025-04-01 10:26:21,ditme_no
VietNam,1jorkpy,mkubolb,"with only 4 days I would skip it,  goto monkey mountain, marble mountain and hoi an.  Spend a day exploring Da Nang.  If you are there on a weekend then you can go and see the dragon bridge fire show.

As for Ba Na its just a really weird themed set of buildings,  there is an outlook (hand bridge thingy) and a few not very exciting rides as well as some gardens to look around.  Personally I don't think it is worth the entry price but my wife's family enjoyed it (locals).",7,2025-04-01 11:58:24,cdp181
VietNam,1jorkpy,mktx1ff,make sure it’s not a rainy dat,2,2025-04-01 09:46:53,rudygene11
VietNam,1jorkpy,mku33ou,"It's great. As usual be prepared for the weather.. it will be hot in some sorts,  but totally worth it.",2,2025-04-01 10:48:11,Special-K-83
