subreddit,post_id,comment_id,comment_content,comment_score,comment_created_at,comment_author
gaming,1jsg4qk,mlm8gwo,"PowerA gave them proper triggers. If you're looking for GameCube pro-controllers, I'd buy from them.",323,2025-04-05 23:26:18,Killance1
gaming,1jsg4qk,mlm4yyq,NSO?,173,2025-04-05 23:04:48,IAmTheClayman
gaming,1jsg4qk,mlm522z,Yes the Z and sharp S buttons,95,2025-04-05 23:05:20,PaulyKPykes
gaming,1jsg4qk,mlmc01u,"Sticks don't click in either (L3 / R3) - so yeah looks like this will be great for GCN NSO specifically, but not ideal for a general controller",54,2025-04-05 23:48:11,your_evil_ex
gaming,1jsg4qk,mlmiosu,What are these... bumpers for ants?,36,2025-04-06 00:30:57,wuhkay
gaming,1jsg4qk,mlma54a,Nintendo needs to stop with the tiny buttons...,28,2025-04-05 23:36:42,TakeyaSaito
gaming,1jsg4qk,mlmfg60,Nah dude. You gotta keep that original “but why?” going. Only Nintendo would put a shoulder button on the controller but only on one side.,23,2025-04-06 00:10:06,Cryptan
gaming,1jsg4qk,mlm5jl6,"We have this already with the Power A Gamecube Switch controller.

I'm sure Power A will probably do the same for Switch 2.",29,2025-04-05 23:08:23,Demonic_Akumi
gaming,1k5bstr,mogpqqy,I’m old Gregg,1966,2025-04-22 17:24:13,Curtispritchard101
gaming,1k5bstr,mogqy9x,Potion seller?,435,2025-04-22 17:29:54,Lolligagers
gaming,1k5bstr,mogp112,It will make a fine stealth archer.,2059,2025-04-22 17:20:53,forsayken
gaming,1k5bstr,mogvxmc,Give lirik a somewhat decent character creator and this is what happens…. Every single time,431,2025-04-22 17:53:36,NovicePro_
gaming,1k5bstr,mogohm9,This looks like an AI pic with the instructions “create a dark fantasy 80s style orc”.,744,2025-04-22 17:18:20,AspGuy25
gaming,1k5bstr,mogpcs6,In a weird way this is pretty impressive,163,2025-04-22 17:22:25,bmsmcr
gaming,1k5bstr,mogpydi,"Ah, just like old times, just with fresh lipstick.",149,2025-04-22 17:25:12,Lexinoz
gaming,1k5bstr,mogso45,Lirik :D,144,2025-04-22 17:38:02,MiaMiVinc
gaming,1k5bstr,mogxvxa,Woh. I didn't give Bethesda permission to use my likeness,51,2025-04-22 18:02:52,ArferMorgan
gaming,1k5bstr,mogvl21,I smell them McElroy boys making a new Monster Factory episode.,84,2025-04-22 17:51:57,BladedDingo
gaming,1jjvn8v,mjqkro6,"My personal fave was in FO3; the top half of the door was *literally missing*, but I couldn’t unlock it.",2517,2025-03-25 22:38:54,TimeLord75
gaming,1jjvn8v,mjqdmiv,Can't gatekeep skill levels if you don't gate skills,1301,2025-03-25 22:01:15,trashboatfourtwenty
gaming,1jjvn8v,mjqf1pe,I teach middle schoolers. I know for a fact that they would find a way to fuck that task up. Somehow a hammer would be involved in removing the tape.,966,2025-03-25 22:08:38,panda388
gaming,1jjvn8v,mjqfw5e,"It says right there, trap. It looks simple, but if you don't know how to disarm it you're trapped",402,2025-03-25 22:13:07,shredbmc
gaming,1jjvn8v,mjqhta6,It bothered me in RE7 with the tape also like in that situation tape would not be a deterrence.,148,2025-03-25 22:23:13,No_im_Daaave_man
gaming,1jjvn8v,mjqh61k,"Hey that’s industrial tape, without the proper training and ppe you could accidentally burn to death.",128,2025-03-25 22:19:47,N/A
gaming,1jjvn8v,mjqmq6e,"I'm unbothered by this. Yes, it's silly game logic, but a trap that obvious probably has something less obvious that makes it dangerous to try to disarm. Beyond that, I just think of it as a stand-in for a more complicated trap. Kind of like how I think of my character taking multiple gunshots but surviving as stand-ins for ""almost"" getting shot or ""only"" getting grazed.",108,2025-03-25 22:49:12,Arch3m
gaming,1jjvn8v,mjqt5ku,"So....this is a ""trap""? How does this concept even work? How does the....flare(?) get lit? Why is it taped up in plain view? The box is already open. Why is ANY of this?",31,2025-03-25 23:22:14,gaffythegrey
gaming,1jjvn8v,mjqendd,Skill issue.,75,2025-03-25 22:06:33,Ontarkpart2
gaming,1jjvn8v,mjqelzi,To RPG or not to RPG. That is the question.,46,2025-03-25 22:06:21,BillyBruiser
gaming,1jmq3ow,mkdlcuv,This is beautiful,127,2025-03-29 16:32:07,Scarykevin
gaming,1jmq3ow,mkdo3jq,Possible to make this as a animated wallpaper for android?,54,2025-03-29 16:46:58,fakemcfakeres
gaming,1jmq3ow,mkdppjf,"That's awesome, nice skills",8,2025-03-29 16:55:34,Key_Regret608
gaming,1jmq3ow,mkf16wy,"Shouldn't he grab the silver sword when the ghoulie runs by?

But fr cool stuff, looks great",7,2025-03-29 21:11:49,TheRabidPigeon
gaming,1jmq3ow,mkdw21k,"Damn. I'd love to have this as my wallpaper! Is there any way to download the GIF, or is it just for viewing?",5,2025-03-29 17:28:47,AzerynSylver
gaming,1jmq3ow,mkdo7w6,Really feeling the vibe - so cool,4,2025-03-29 16:47:37,CyberJuno
gaming,1jmq3ow,mkdurti,Allow me to grant you this upvote to show my appreciation.,3,2025-03-29 17:22:06,-stud
gaming,1jmq3ow,mke8kuh,Amazing! What did use (plaform/app/etc) to make this?,3,2025-03-29 18:35:14,Takumi2x
gaming,1jmq3ow,mkgvji7,What did you make this with?,3,2025-03-30 04:02:21,ImHamuno
gaming,1jmq3ow,mkdmy82,Damn this is sick good work!,2,2025-03-29 16:40:48,Snookcaster
gaming,1k1nrmi,mnnk67h,"As long as you keep buying them, I highly doubt any of these companies give two shits whether it leads to angry rants on reddit or whether you are actually happy with your purchase.",7146,2025-04-17 21:11:38,Skeksis25
gaming,1k1nrmi,mnnkg7j,"You need to work on your FOMO.

 Are you really enjoying the game more for having unlocked these things? Are you gonna enjoy the game less if you don't? 

Think about all the content you haven't got for the games you play, do you actually feel your enjoyment is lessened due to not having them?

 Is it just a completionist idea, do you just want to have it because you like *having* it? Will you ever actually use the unlockables? You can't use everything all at once.

But nobody is going to sympathise with you, because it's all entirely optional.",1934,2025-04-17 21:13:04,Funmachine
gaming,1k1nrmi,mnnkx4b,"You could make the decision to NOT buy them, right?",816,2025-04-17 21:15:33,vario
gaming,1k1nrmi,mnnmlmj,You are part of the problem,1077,2025-04-17 21:24:06,20wall
gaming,1k1nrmi,mnnrlk3,"Valorant - Free to play

TFT - Free to play

Fortnite - Free to play

Frag Punk - Free to play

  
I think you are the problem.",483,2025-04-17 21:49:48,lemonloaff
gaming,1k1nrmi,mnnlahg,The problem is that you keep buying them.  Stop it.,383,2025-04-17 21:17:25,ZazaB00
gaming,1k1nrmi,mnnkngu,Stop buying them? You are the reason they are profitable. ,363,2025-04-17 21:14:08,ArcticFlava
gaming,1k1nrmi,mnnjp69,"Just don't buy them, and no one is forcing you to play through them.",436,2025-04-17 21:09:12,Hsanrb
gaming,1k1nrmi,mnnkuwk,Helldivers 2: no timeframe to buy or complete the battlepass + currency to buy the battlepass is easily farmable ingame,195,2025-04-17 21:15:14,loss182
gaming,1k1nrmi,mnnkmnw,Don't buy them on games you don't play regularly.,115,2025-04-17 21:14:01,unibaul
gaming,1k0safn,mngw2jr,"Five-thousand feet...

Ten-thousand feet...

Fifteen-thousand feet...

...Hallelujah",322,2025-04-16 20:16:08,CANYUXEL
gaming,1k0safn,mngg3ip,The choir singing “Will the Circle be Unbroken” when you land in Columbia is S-tier ambiance and foreshadowing. Infinite is a top 5 all timer for me.,2399,2025-04-16 18:56:01,Ucw2thebone
gaming,1k0safn,mnghxkr,"5000 feet

10000 feet

15000 feet

Hallelujah",267,2025-04-16 19:05:30,Sextus_Rex
gaming,1k0safn,mngg98q,Debatable still prefer Bioshocks 1 intro with rapture city introduction with that soundtrack.,1991,2025-04-16 18:56:49,Doctorsavage985
gaming,1k0safn,mnghm7e,Prey’s intro was pretty damn good with the discovery of the simulation and breaking out of it,586,2025-04-16 19:03:51,ffxivfanboi
gaming,1k0safn,mngidjq,Half life opening is iconic af,275,2025-04-16 19:07:48,Hounder37
gaming,1k0safn,mngh4k3,He doesn't row?,51,2025-04-16 19:01:16,MaskedBandit77
gaming,1k0safn,mngh15e,[deleted],110,2025-04-16 19:00:47,N/A
gaming,1k0safn,mnh0398,"Doom 2016 manages to distill the ENTIRE game, mechanically, narratively, sonically, characterizationally... down to a tiny 5-10 minute thesis statement that ends with you exiting an elevator and pumping a shotgun. 

A perfect statement of intent, and the rest of the game nails the execution.",55,2025-04-16 20:35:50,boar_amour
gaming,1k0safn,mngiep6,It’s all subjective.  My favorite opening is prolly The Last of Us,142,2025-04-16 19:07:58,YoYoMavaIous
gaming,1k58c70,mogx14d,"I cannot wait to head straight to the arena and fight my way to the top rank all over again, just like when I was a kid",382,2025-04-22 17:58:47,WestEndStoney
gaming,1k58c70,mofyybe,An armored horse in the trailer. Bethesda could release the horse armor dlc and it would come full circle.,892,2025-04-22 15:15:06,Dragoneon
gaming,1k58c70,mofxka8,I’ve only played Skyrim and loved it. Really looking forward to playing oblivion for the first time,504,2025-04-22 15:08:08,CapPhrases
gaming,1k58c70,mofx391,Its dropping TODAY! already out on steam [https://store.steampowered.com/app/2623190/The\_Elder\_Scrolls\_IV\_Oblivion\_Remastered/](https://store.steampowered.com/app/2623190/The_Elder_Scrolls_IV_Oblivion_Remastered/),689,2025-04-22 15:05:44,rooratty
gaming,1k58c70,mog5s3j,"Absolutely insane. 

Skyrim combat.

Really good visuals.

Re-recording voice lines clearly shows they took this seriously.

Hero of Kvatch has had a makeover.",584,2025-04-22 15:47:58,DeathByToilet
gaming,1k58c70,moguiga,Where is the dude who said he would crush his nuts between his fridge door?,172,2025-04-22 17:46:54,Thegauloise
gaming,1k58c70,mogo5st,"It's so strange to me a concept of same trailer, same release day in 2025.  
They spent 0 on marketing, this gotta be a game to keep us entertained for a decade.  
Edit: game is also 35 bucks in my country compared to the usual 60-80.  
Wow",243,2025-04-22 17:16:47,Plane_Jackfruit_362
gaming,1k58c70,mohqh9f,Unbelievable. I've just experienced an exact recreation of my first time playing this game in 2006 right down to being in awe of a bright sunny Tamriel after wading through that ugly sewer and immediately crashing to the desktop with a fatal error message,242,2025-04-22 20:24:00,Duchell
gaming,1k58c70,mofx98d,Already downloading on game pass,404,2025-04-22 15:06:36,runealex007
gaming,1k58c70,mofz02p,Can someone explain how this isn’t considered a remake instead of a remaster? It looks like they redid everything from gameplay to engine and mechanics but something like Delta is a remake,349,2025-04-22 15:15:21,DjCage
gaming,1k58w6p,mog0jic,"Well, ain't that a fucking thing!",3048,2025-04-22 15:22:59,WowzerzzWow
gaming,1k58w6p,mog5hvr,I can't wait to walk into the Oblivion gate in Kvatch and wake up on a prisoner carriage in Skyrim.,1112,2025-04-22 15:46:36,Dead301
gaming,1k58w6p,mog2t5m,ITS AVAILABLE TODAY??,2269,2025-04-22 15:33:51,Lillythewalrus
gaming,1k58w6p,mog3c19,"Having never played it….

And it being a Bethesda game….

Safe to say it’s 100s of hours of gameplay and something I shouldn’t even download if I have a massive backlog of unfinished games?",292,2025-04-22 15:36:20,Tonedef22
gaming,1k58w6p,mog58zz,"I really like this method of releasing things. I understand they want to let everyone know early what games are in development, but I think a simple announcement of ""We're doing this thing!"", and then silence until a reveal trailer and same day drop is more exciting and less exhausting than the constant hype. I really liked also having the introduction, and little interviews with people who worked on it, etc.",1223,2025-04-22 15:45:25,tadrith
gaming,1k58w6p,mog2ufr,Man dropping it on the day the trailer is out and on gamepass. Can't get better than that,1859,2025-04-22 15:34:01,HaggardSauce
gaming,1k58w6p,mog3smm,"I’ve played Skyrim so much I think I have the damn map memorized, but I’ve never played oblivion! Taking this as my sign to finally dive in",523,2025-04-22 15:38:32,VicePrincipalGamby
gaming,1k58w6p,mog1eqh,This was the first Elder Scrolls I played and it is still my most favorite.,1188,2025-04-22 15:27:09,doct0rdo0m
gaming,1k58w6p,mog2ohi,Already out on Game Pass!,347,2025-04-22 15:33:14,Perfect_Persimmon717
gaming,1k58w6p,mog413o,HUH?! It's out?!?!,90,2025-04-22 15:39:39,enceladus771
gaming,1jpuimx,ml2bomf,The secret cow level,2073,2025-04-02 18:15:56,Environmental_Sell74
gaming,1jpuimx,ml26pjc,Does this use the Tony Hawk Pro Skater mechanic to balance on the cable?,833,2025-04-02 17:52:14,Mehdals_
gaming,1jpuimx,ml25xh1,"Moo Moo Meadows Cow is a playable character? Fuck yeah, I'm in, here's my $500.",1521,2025-04-02 17:48:38,gr00316
gaming,1jpuimx,ml23efh,"Just you wait for Pokemon, somehow it will look worse than Ps2 games",990,2025-04-02 17:36:50,Pitiful-Vast7362
gaming,1jpuimx,ml2fp1m,I'm not sure there's a better metaphor for just how much of a minority reddit and gaming subreddit are then people on here always bashing Nintendos graphics and the Switch being the best selling console of all time in US and will likely pass PS2 for overall,544,2025-04-02 18:35:36,BajaBlastMtDew
gaming,1jpuimx,ml2a0jy,Imagine thinking this screenshot isn't awesome,750,2025-04-02 18:07:51,Kind-Possibility-117
gaming,1jpuimx,ml347ba,Redditors trying to prove how out of touch they are...,183,2025-04-02 20:33:26,Meret123
gaming,1jpuimx,ml2xjb9,"Am I missing something here? The graphics for this game look great, animations are awesome, and the stages are huge.",201,2025-04-02 20:02:18,DigitalGumby
gaming,1jpuimx,ml2fqdi,"OK, the Switch 2 doesn't really interest me at that price point, and I don't like Nintendo charging more for games, especially since their exclusives so rarely go on sale, but that pic isn't representative of the game, lol, this is ridiculous.",72,2025-04-02 18:35:48,curious_dead
gaming,1jpuimx,ml38enj,"Funny enough, seeing the cow was one of the moments that got a genuine reaction out of me.  If you don't want to play as a cow on a motorcycle, then I don't want to know you.",25,2025-04-02 20:52:54,RumHam88
gaming,1jkuzku,mjyh141,This looks like the kinda picture your grandma takes on Halloween when you’re 8 and hangs it on the fridge for the next 20 years.,1930,2025-03-27 03:50:42,ObeyTheSystem36
gaming,1jkuzku,mjyguf1,"The oversaturation and bloom in this photo just made it the absolute funniest shit to me because I imagine someone going ""Look, it's knuckles, we're saved!"" and [this](https://youtu.be/Damxx4K_Yo8?si=9JqCzv8JSAkzPHZ5&t=47) plays as it hard cuts to a pan across this image, my sense of humor is so cooked.",1538,2025-03-27 03:49:22,WMan37
gaming,1jkuzku,mjyjw87,I can’t tell if I’m looking at a memory or a picture,501,2025-03-27 04:11:58,eralsk
gaming,1jkuzku,mjyixm9,Are you from 1987?,281,2025-03-27 04:04:45,PallbearerOfBadNews
gaming,1jkuzku,mjygkao,Du u know de wey,441,2025-03-27 03:47:21,usernnamegoeshere
gaming,1jkuzku,mjyplcq,Why was this picture taken inside the flash of a nuclear bomb?,31,2025-03-27 04:59:03,AgonyOverdrive
gaming,1jkuzku,mjyhl55,Why does this picture look like it was taken in 1996? 🤣 it looks like you are doing one of those kid photo recreations for your parents or something. 🤣,134,2025-03-27 03:54:47,funthebunison
gaming,1jkuzku,mjygpji,Sick Noid costume bro,72,2025-03-27 03:48:24,SSj_CODii
gaming,1jkuzku,mjyl69p,Ralphy on Christmas morning,19,2025-03-27 04:21:59,AnxiousButAlright
gaming,1jkuzku,mjygfrt,Oh hello my sleep paralysis demon!,37,2025-03-27 03:46:26,dimhue
gaming,1jo7swh,mkpqpe5,"The thing that made me actually appreciate the seasons changing, other than the great visuals, is that it can actually affect how you play.

Atleast as Naoe, enemies can spot you more easily when you're hiding in bushes in winter because the foliage is dead, but they seem to be worse at hearing you move thanks to the snow and frozen lakes and rivers can give you another avenue for engaging, or act as a hazard.

Same seems to go for Autumn where its raining more often so you're harder to spot but the puddles make you louder.

These aspect don't always work perfectly, (tbh I don't think I've ever seen stealth mechanics work perfectly every time in a game), but it does add to the feel of the game a great deal.",1728,2025-03-31 17:07:15,calibur66
gaming,1jo7swh,mkpnpzc,"gotta give em credit where it's due  
they did a damn good job at graphics, the game looks gorjeous",822,2025-03-31 16:52:21,Sensitive_Yokai
gaming,1jo7swh,mkpq1q3,Its an amazing looking game I just think the season changes a bit too quickly. Im 10 hours in and in fall,324,2025-03-31 17:03:58,Slug_core
gaming,1jo7swh,mkposju,"The way spring and fall have such difference in the colour palette and the variety of trees is so nice to see. And regardless of the season, rain and thunderstorms always hit hard, some of the best thunderstorms I've seen in gaming. 

I hope weather mechanics are built up more with this generation's games. I really enjoyed just walking around and exploring the world.",128,2025-03-31 16:57:44,swat1611
gaming,1jo7swh,mkq2gqm,"I've been waiting for seasons to join day/night cycles in games for a long time- but it requires SO much to pull off.  Not only do you need 4 different models for every single plant, it needs a realistic transition between those seasons.",58,2025-03-31 18:04:37,WrappedInChrome
gaming,1jo7swh,mkqwo0f,"UBIsoft games always had beautiful worlds

Odyssey's Greek world and Avatar's pandora at high settings was jaw dropping for me,",34,2025-03-31 20:34:41,Rudradev715
gaming,1jo7swh,mktcntn,"Yep. Night and day, different weather, and different seasons all come with a whole host of different kinds of stealth and traversal pluses and minuses. 

Besides all the big stuff already mentioned, a couple things I noticed: during the heavy part of winter, the dense forests are slightly easier to get through because a lot of the foliage is thinner. So during the winter you can more easily traverse those big thick forest for short cuts across the terrain. The downside is that all the foliage is thinned out so there's not as many places to hide. The farmers actually take down their crops during that time of the year so those big fields of tall grass are gone. 

In deep snow, you can't run at fast speed! Not good if you get busted in the middle of a base and try to hightail it. 

Pretty much every logical game mechanic change you can imagine happens with the weather and nighttime and season changes.

It's a really brilliant mechanic and i'm surprised no one's talking about it more. I want more open world games to have this. A fantastic way to keep the game always shaken up a little.",7,2025-04-01 05:59:42,yotothyo
gaming,1jo7swh,mkqiwv8,"Shadows would never get its full credit only because its an AC game and a Ubisoft game.

If this were Ghost of Yotei or some other Sony exclusive the narrative about this feature would be more widespread and ""industry changing"".

But since its Ubisoft the narrative is like, ""thats a cool feature...."" and move on to something else.",127,2025-03-31 19:26:43,XulManjy
gaming,1jo7swh,mkr4cy3,The fact that you can watch snow slowly melt over time is sick,33,2025-03-31 21:13:34,Calibruh
gaming,1jo7swh,mkpsnmb,"Auto switching seasons when you fast travel (especially when it doesn’t look like the timer will do it) drives me insane. At first I when I just was leveled enough for Osaka/Kyoto regions I rode my horse everywhere to control it lol. 

I like that we can’t fast forward/change seasons on a whim and have to wait for either the timer to hit ~90 minutes or finish a quest that forces the change though.

Resetting wanted status, getting free scouts, new contracts, and other season locked stuff like the Winter Raiders questline tied to the seasons is cool. Really wish we could control/switch day and night time though.",24,2025-03-31 17:16:53,foreveracubone
gaming,1jpqcr9,ml174yc,"I was actually shocked when they announced you will have to pay for this shit. I thought that they would make it free since, it is a tech demo.",6460,2025-04-02 14:58:42,Awesomedogman3
gaming,1jpqcr9,ml14q5q,*paid user manual lol,3699,2025-04-02 14:46:37,tripbin
gaming,1jpqcr9,ml1be74,"I thought they were going for an Astro Playroom kinda thing... But then they said its essentially a paid tech demo...

Which, ya know, it's the most Nintendo thing ever but still caught me by surprise.",217,2025-04-02 15:20:13,Pharsti01
gaming,1jpqcr9,ml19fw4,"Man, Nintendo makes all these soft squishy happy warm games and banks on your childhood nostalgia, then they turn around and absolutely rake you over the coals financially every way they can think of",2094,2025-04-02 15:10:20,radium_eye
gaming,1jpqcr9,ml194h3,"- ""A game and guide to learn about Nintendo Switch 2""


- ""Oh!""



- ""Available as a paid download at launch""



- ""Feck off""",1061,2025-04-02 15:08:43,Kezly
gaming,1jpqcr9,ml170g7,Paid tutorial,248,2025-04-02 14:58:03,Picolete
gaming,1jpqcr9,ml1a1wc,"Wii - included wii sports, a whole ass game that simultaneously acted as tech demo for the new motion controls

*Wii U - also included Nintendo Land, a low key really good party game that made full use of the tablet / console combo

Switch - sold 1 2 switch, a tech demo ""game"" that is much less impressive compared to wii sports - for a whopping 50$

Switch 2 - fuck it, just sell them a tech demo that doesn't even try to be a game anymore",449,2025-04-02 15:13:25,zennok
gaming,1jpqcr9,ml15m35,"EDITED: Astro Playroom was the free tech demo.

Yeah I was skeptical at this stage of the direct, and then when I saw the console and and prices my suspicions were confirmed. At least the Ps5 had their tech demo (Astro Playroom) free.",944,2025-04-02 14:51:04,ELRUST0
gaming,1jpqcr9,ml16uc5,Most egregious part of this whole unveiling. The price sucks but isn't overly surprising. This... this is just sad.,828,2025-04-02 14:57:12,forsayken
gaming,1jpqcr9,ml192cv,"I'm surprised it's not included in bundles...

Then again, I don't see a necessity... Unlike Astro Bot, it looks pretty boring...",89,2025-04-02 15:08:25,PMC-I3181OS387l5
gaming,1jv0frk,mm6pg60,"You're telling me the plot, where you mix donuts, horse semen, batteries and gasoline into meth, is too similar? 


I find that hard to believe",4601,2025-04-09 10:00:31,Bishopkilljoy
gaming,1jv0frk,mm6js7m,"Jesus this is stupid. If the 'plot' of a drug dealing simulator is a copyright issue, there are some TI-series calculator programmers out there who have skin in this game from 30ish years ago.",3965,2025-04-09 09:01:08,GoodTeletubby
gaming,1jv0frk,mm6x5nr,"Schedule 1 is such a stupid fun breath of fresh air, plus the music in the game is legitimately good, I can’t wait to see what it’s like when it’s finished.",632,2025-04-09 11:09:18,CommanderShepard6669
gaming,1jv0frk,mm6esve,I just hope Schedule 1 keeps going strong.,1420,2025-04-09 08:06:15,N/A
gaming,1jv0frk,mm9qxyx,"So from what I gather is, they are not suing but they HAVE to investigate regardless of how stupid it sounds because they have investors and their company publicly trades stocks or some shit like that and if they DONT it would mean they are not a trustworthy company, I'm sure it will reach nothing so all they are asking is to chill with the negative reviews.",208,2025-04-09 20:03:48,cyborgdog
gaming,1jv0frk,mm6gpfc,[deleted],462,2025-04-09 08:27:20,N/A
gaming,1jv0frk,mm6h8gx,ever notice how the internet LOVES drama? like it's oxygen or something,424,2025-04-09 08:33:13,Adorable-Chip8916
gaming,1jv0frk,mm7rf30,ITT: legal analysis from folks who got their law degrees from watching a Phoenix Wright let's play,39,2025-04-09 14:16:13,mcylinder
gaming,1jv0frk,mm9r05j,That's very fair honestly,8,2025-04-09 20:04:05,ShadonicX7543
gaming,1jv0frk,mm6kfvq,"What infringement?

Game mechanics are not copyrighted. Unless they have a patent on something, that they arent claiming to have, then theres no possible infringement.",164,2025-04-09 09:08:19,Okichah
gaming,1jy0mql,mmurivr,"The year is 2100. The oceans are made of plastic. GTA 7 costs 500,000 dollars",4017,2025-04-13 05:49:37,bldkis
gaming,1jy0mql,mmuqy4n,"I mean, from a business perspective, this makes sense. I obviously dont want to pay more, but I imagine the reaction from gamers wouldn’t be as bad if it was just a regular thing for them to go up $5 every generation. 

Having said that, I will argue with myself here, and say that since so many games today have major stories or important content hidden behind paid DLC, they’ve already essentially raised the price.",7262,2025-04-13 05:44:16,elmatador12
gaming,1jy0mql,mmuukqi,"Companies to investors: ""We're doing better than ever. This quarter we've made record profits. We have plans to introduce a new DLC that should increase revenue by an additional 500 million.""

Companies to gamers: ""For just $10 extra per game, you too, can help a poor company struggling to stay afloat. Game development is expensive, and we might have to lay off some employees if you don't pay us. You wouldn't want that, would you?""",1273,2025-04-13 06:18:41,Reddit-Simulator
gaming,1jy0mql,mmuqikf,I will hold off longer each generation to get the better deals and discounts,883,2025-04-13 05:40:18,EndenDragon
gaming,1jy0mql,mmuwnyw,"Companies should also release games in a finished state.

But we don't always get what we want.",168,2025-04-13 06:39:22,McDaddy-O
gaming,1jy0mql,mmvnlvx,I am patient guy. I'll wait for -90% sale.,52,2025-04-13 11:19:50,ArvaaVaa
gaming,1jy0mql,mmw4hip,"Good luck with steam sales. 


I buy only one game per year at list price or above $50. Everything else is Steam Sales. It's literally why im a pc gamer.",45,2025-04-13 13:26:38,Ok-disaster2022
gaming,1jy0mql,mmurbct,I'll agree if and only if all DLC and Microtransactions are free,236,2025-04-13 05:47:42,thebladeofchaos
