subreddit,post_id,comment_id,comment_content,comment_score,comment_created_at,comment_author
music,1k4d8vo,mo9b7ai,"""Possum Kingdom"" is their one hit but Toadies' best song is either ""Tyler"" or ""I Come from the Water"" depending on the mood I'm in.",22,2025-04-21 14:04:48,VampireOnHoyt
music,1k4d8vo,mo9de8l,"The Violent Femmes are not One Hit Wonders, but I'm guessing many people only know Blister In the Sun.  Their self titled album is incredible and Blister is like the 5th best song.",21,2025-04-21 14:16:37,zerohm
music,1k4d8vo,mo9cwd9,Tubthumping by chumbawumba is the worst song on the album,31,2025-04-21 14:13:58,Aeon1508
music,1k4d8vo,mo948yx,Everything else Blind Melon did is better than No Rain,40,2025-04-21 13:24:46,devadander23
music,1k4d8vo,mo9bfq9,"Marcy playground sounds nothing like sex and candy. 

They sound like Pedro the lion. ",10,2025-04-21 14:06:04,baumpop
music,1k4d8vo,mo9e1dg,"While he's definitely no longer a one-hit wonder (and debatably never was), I don't think 'Take Me to Church' was Hozier's best song from when he might have had that status. 'Jackie and Wilson' has it beat easily.",9,2025-04-21 14:19:59,TheIrishninjas
music,1k4d8vo,mo9etg0,Secret Smile was better than the more popular Closing Time by Semisonic,9,2025-04-21 14:24:04,cloudstrifeuk
music,1jyx8nk,mn1s1b2,"One of the most beautiful songs I've heard

There's something about this song that is so settling, hopeful, and fleeting at the same time. Bittersweet",5,2025-04-14 12:12:46,twats_upp
music,1jyx8nk,mn1seen,"The New York Times (2021)

Aphex Twin's ""Avril 14th"" is an instrumental piece that barely lasts two minutes. It has been sampled by pop stars, inspired classical pianists and experimental artists alike, and once cost a major TV network over $100,000. [https://nyti.ms/3e2ch2T](https://nyti.ms/3e2ch2T)",2,2025-04-14 12:15:19,igor_spurs
music,1jyx8nk,mn4o12a,AND IRAN..... IRAN SO FAR AWAY.....,1,2025-04-14 21:17:03,rocky_iwata
music,1jyx8nk,mn5ionv,dark sweet haunting,1,2025-04-15 00:11:56,moneyscan
music,1jjotbz,mjot7o7,More cowbell!,1,2025-03-25 17:25:35,withoutlebels120
music,1k3mc69,mo372za,"Neutral Milk Hotel’s In the Aeroplane Over the Sea…

I absolutely love it now but it was definitely a grower. It took some getting used too. 

Kid A also took a bit but I knew it had the reputation of being a bit thorny, especially since I wasn’t fond of electronic music.

Also, The Idler’s Wheel by Fiona Apple.

All great albums but all took a few listens to REALLY appreciate them.",30,2025-04-20 13:36:17,heffel77
music,1k3mc69,mo36ovd,"Like... a third of my favorite albums

OK Computer - Radiohead, I was very new into music at the time (and admittedly now as well) and wasn't used to these more depressing and more experimental music, then after liking The Bends, I tried this album over and over until I practically gaslighted myself into liking this album, now Radiohead is my third favorite band ever

The Velvet Underground & Nico, didn't enjoy it before listening to their third album, now my favorite band ever

loveless - my bloody valentine, thought it was just bunch of random noise thrown in together, after developing an obsession with shoegaze, (Blue Rev - Alvvays and To See the Next Part of the Dream - Parannoul was all I was listening to) I finally realized it was genius and it's now in my top 10 albums ever

Unknown Pleasures - Joy Division, thought it was boring at first and only liked Disorder from it, I don't know what changed within me but I love it now, I hope the same thing happens with Closer

For the First Time - Black Country, New Road, absolutely loved Ants From Up There, and got disappointed that their debut album was very far from Ants, after a while, I learned to appreciate Sunglasses then the whole album

Hellfire - black midi, listened to it because of BCNR, and thought it was way too technical and complicated for me, then after getting into FTFT, this clicked with me simultaneously

Hounds of Love - Kate Bush, idk I think I was just stupid",14,2025-04-20 13:33:53,Dakotaraptor123
music,1k3mc69,mo356hf,Anything really prog took some getting used to before I really got into it. Brain salad surgery,11,2025-04-20 13:24:23,Low_Primary_3690
music,1k3mc69,mo380bi,In The Aeroplane Over The Sea. The first few times I heard it I thought it was just a campy guitar with a bad singing voice. At some point it just clicked how genius the songwriting was. It’s now a favorite of mine.,9,2025-04-20 13:41:55,giants4210
music,1k3mc69,mo36uuq,"American Idiot - Green Day

Everything was overplayed on the radio when it came out.  20 years later, I gave it a complete listen and mad at myself for not listening to the album as a whole.  What a fantastic album.",14,2025-04-20 13:34:54,flashpoint2112
music,1k3mc69,mo37e7y,Believe it or not Exile On Main Street,7,2025-04-20 13:38:11,Bubba-ORiley
music,1k3mc69,mo3dcu8,Hail to the Thief was an album i thought was okay and then forgot about. Went back and listened to it recently and it blew me away,6,2025-04-20 14:13:44,bambinoquinn
music,1k3mc69,mo36x44,"Two from my late high school/early college days come to mind:  

Achtung Baby by U2

Blind Man’s Zoo by 10,000 Maniacs",5,2025-04-20 13:35:17,Eroe777
music,1k3mc69,mo38kr2,*Islands* - King Crimson,5,2025-04-20 13:45:22,browster
music,1k3mc69,mo350s8,Mastodon's Blood Mountain was just weird and confusing at first. Now it's one of my fav metal albums.,6,2025-04-20 13:23:21,aadu3k
music,1jxxdf2,mmu5ybx,I like that Rivers threw in the little “Buddy Holly” riff in the solo.,20,2025-04-13 02:58:12,mbc106
music,1jxxdf2,mmu2roo,They recorded their version for the Metallica Blacklist. I found it to be one of the weaker entries. It didn’t offer a fresh take on it or anything like that. It was just the same song with a worse solo.,23,2025-04-13 02:36:10,Blackened-One
music,1jxxdf2,mmx7m2t,“Band covers song at concert.” Is this what headlines are these days?,1,2025-04-13 16:57:42,ILikeMyGrassBlue
music,1jxxdf2,mmvcwfj,"Should have covered ""I Fought the Law""",0,2025-04-13 09:30:22,no0neiv
music,1jxxdf2,mmwtyv4,"“Exit light, cop shot wife”",1,2025-04-13 15:46:40,BigMateyClaws
music,1jxxdf2,mmu7gby,I don’t know man this CC cover was ill,-3,2025-04-13 03:08:29,swuavvit
music,1jxpp7p,mmupgpm,“That ni@@a is Russian Intelligence!” (all day),3,2025-04-13 05:30:50,jennasea412
music,1jxpp7p,mmv5031,"This is on repeat bumping as I drive around for work. Got a nice little glass marker writing the same words on my back window hahahah 

We gotta tell the world",2,2025-04-13 08:04:27,evillurks
music,1jue2d7,mm1e0y9,Must’ve been a blast for everyone involved shooting this video.,5,2025-04-08 14:20:01,TommyOnRedditt
music,1jue2d7,mm54kko,"Read or listen to his book, it’s fantastic.",2,2025-04-09 01:53:57,ADVANTAGE_CONNORS
music,1jue2d7,mm451gs,Underrated,2,2025-04-08 22:28:16,IntegrateandOptimise
music,1jue2d7,mmjkf4x,Wow this sends me right back to middle school.,1,2025-04-11 11:06:09,ApartmentUpstairs582
music,1jsrz46,mlq0lc7,Primus sucks!,7,2025-04-06 16:39:58,BOBmackey
music,1jsrz46,mlos10i,P-p-p-p-p-p-puppies,3,2025-04-06 12:11:03,I_was_bone_to_dance
music,1jsrz46,mlpbeky,With guns in their handssss,2,2025-04-06 14:22:00,stratdog25
music,1jsrz46,mmfx7v8,"My band covered this at our school’s Battle of the Bands, my senior year. It was the height of the GWoT. 

We lost, of course, most of those kids could give a fuck about Primus. The band that won was the same one that had won every year, they were the most talented musicians at our school and played Incubus covers every year. 

I ran into the guitarist and vocalist of the band that always won a few years ago, he’s the store manager for a chain restaurant. Rock on, dude. 

I love this song.",1,2025-04-10 19:35:41,RobotVomit
music,1jsevdr,mlm7zwd,Troubled Waters on Armchair Boogie is hauntingly beautiful. RIP friend,3,2025-04-05 23:23:24,vcmaes
music,1jsevdr,mln0a3q,Wow I’ve been listening to him a lot recently. Penguins is a favorite of mine RIP 🐧❤️,2,2025-04-06 02:28:20,LeonCloud11
music,1jsevdr,mlmi7qz,RIP,1,2025-04-06 00:27:54,InvestmentFun3981
music,1jn3e3f,mkgplvc,Mainstream popularity of the blues came and went with SRV. RIP,1,2025-03-30 03:17:54,Evelyn-Bankhead
music,1jn3e3f,mkgx8xp,The best to ever do it.,1,2025-03-30 04:15:59,FoxyOverFifty
music,1jn3e3f,mkj4eu0,"For me, no better guitarist",1,2025-03-30 15:27:49,Winston74
music,1jlxf2h,mk9sk5v,Calling the Last Resort riff “brutal metal” gave me a good chuckle,9,2025-03-28 23:24:17,spoonerluv
music,1jlxf2h,mk7h1sz,"""Custodian, dick!""",15,2025-03-28 16:21:17,Ginger_Jesus
music,1jlxf2h,mkamtmr,"For as much flack as Papa Roach gets with last resort, Scars is a f'ckin awesome song.",2,2025-03-29 02:22:26,chewie_33
music,1k180n6,mnkpwnt,You never know how much you actually like Supertramp until you start playing them. They have so many great songs.,8,2025-04-17 12:40:02,p3p3_silvia
music,1k180n6,mnm9xto,One of the better bands of the 70s.,5,2025-04-17 17:24:06,Mission-Pie-9953
music,1k180n6,mnkrkxg,"Supertramp are an enigma to me. When I was a kid I had the _Breakfast In America_ album and loved it. Now I absolutely can't stand to hear them. 

I have no idea why I liked them so much then but hate them so much now. I can't think of a single other group like that.",-4,2025-04-17 12:50:07,schoolhouserocky
music,1jx26sm,mmnbzci,[Spacehog - In the Meantime](https://youtu.be/PCsGRCf8T9Y?si=XV93u7yhjuiNMGuK),14,2025-04-11 23:18:42,Mayonnaise_Poptart
music,1jx26sm,mmn454l,"The list is endless, but I’ll mention Can You Get To That - Funkadelic.  Pretty much the whole Maggot Brain album.  

[Can You Get to That - Funkadelic](https://youtu.be/8rrOdcnFbAY?si=ucWgtHHZCdLHIR9k)


The Eagles - Journey of the Sorcerer

[https://youtu.be/wZdZKolMIl0?si=dNIbieCTOfPPqu-S](https://youtu.be/wZdZKolMIl0?si=dNIbieCTOfPPqu-S)",8,2025-04-11 22:32:05,Ridenthadirt
music,1jx26sm,mmna51s,Radiohead - Reckoner,6,2025-04-11 23:07:43,hi_im_dennis
music,1jx26sm,mmncitt,2112 by Rush.,6,2025-04-11 23:21:58,Queef-Supreme
music,1jx26sm,mmndrk6,"More Than a Feeling. All of a sudden Im in highschool sitting on the side of my bed on a rainy day, looking out the window and thinking about the boy that dumped me.",6,2025-04-11 23:29:31,Grouchy-Island5910
music,1jx26sm,mmnusml,David Bowie - Space Oddity,6,2025-04-12 01:16:03,Extreme_Smile_9106
music,1jx26sm,mmn67o9,"Hope there's someone - Anthony and the Jonhsons

it's about the day battlenymph dies",5,2025-04-11 22:44:36,attilla68
music,1jx26sm,mmo85xt,"Wish you were here - Incubus

Especially when they play it live.",5,2025-04-12 02:43:02,justpuddingonhairs
music,1jx26sm,mmnd5wv,Space Age Love Song by Flock of Seagulls,4,2025-04-11 23:25:51,snitch_or_die_tryin
music,1jx26sm,mmotxrr,Sowing the Seeds of Love by Tears for Fears,4,2025-04-12 05:33:20,Stashmouth
music,1jt57jt,mls5gwt,"Paul is a dead man, miss him miss him miss him",1,2025-04-06 23:43:37,i-am-the-walrus789
music,1jt57jt,mlrswdr,Ween - [I'm So Tired](https://youtu.be/0l1o7n8gUUI?si=yKJ68TcoYOvCrFvf),1,2025-04-06 22:28:04,Nizamark
music,1juvq2u,mm5ga3r,"I was working at a HMV when this album came out my freshman year of college in fall of 2000. It was on heavy rotation in the 5 disc CD player in the store. Along with PJ Harvery’s ‘Stories from the City, Stories from the Sea’. A year later the world became a very different place.",8,2025-04-09 03:04:38,thisolddog1
music,1juvq2u,mm5eul7,Brilliant,4,2025-04-09 02:55:16,pike360
music,1juvq2u,mm5ece3,"Radiohead made this song over two decades ago, but I think it would make a good anthem right now.",3,2025-04-09 02:52:01,theweightofdreams8
music,1ju9f1d,mm0a0iy,"21 December 1979 The Cure released their debut single, ""Killing An Arab"", an existential track inspired by Albert Camus’ novel The Stranger. While the song explores philosophical themes, the title sparks controversy, with the band facing accusations of racism that linger for decades. Frontman Robert Smith repeatedly clarifies that the lyrics are purely literary, but misinterpretations force the band to issue disclaimers and alter lyrics in later performances.

Check out more rock music facts from my newly released book The Rock And Roll Almanac.

[https://www.amazon.com/dp/9526570308](https://www.amazon.com/dp/9526570308)

Here's a sneak peek from todays spread.

https://preview.redd.it/oo0ko4m4zkte1.jpeg?width=1687&format=pjpg&auto=webp&s=dc7c684832ff1df562dffd6a511af09e92870e33",5,2025-04-08 09:34:20,AmpedArchivist
music,1jqbtd1,ml6ywqw,12 Years!!,6,2025-04-03 13:00:01,No_Support3633
music,1jqbtd1,ml7ngaw,Nice. This also means more potential material for Toh Kay.,3,2025-04-03 15:10:42,KNNLTF
music,1jqbtd1,ml7x7n8,Well this is just fantastic news.,3,2025-04-03 15:58:23,MrDannyProvolone
music,1jqbtd1,ml82xy3,Yesss!!,3,2025-04-03 16:26:49,Danny2Many
music,1jpx7cw,ml2qsuy,Dummy is a PERFECT album.,8,2025-04-02 19:29:56,Awriternotalefter
music,1jlcn9v,mk2ynef,God damn I love motorhead 🖤,2,2025-03-27 22:01:49,DrEdwardMallory
music,1jirz58,mjhk772,Minor Threat covering The Monkees. Awesome.,2,2025-03-24 14:58:49,GoochManeuver
music,1jzxpre,mn9n8ke,It's almost like you are describing the power of art.,15,2025-04-15 17:33:26,hungryhoss
music,1jzxpre,mn9pk0q,Yes. Music was my life when I was younger (wrote and shot for rock mags in the 1980s). I turned away from it for a decade; I recently started listening again. It’s made a world of difference. I am writing creatively again. I’m happier. I’m going to concerts again. I will never lose that side of myself again.,3,2025-04-15 17:44:39,UFO-Band-Fanatic
music,1jzxpre,mn9uvg3,More like it helps me break into my life,3,2025-04-15 18:10:50,LugnOchFin
music,1jzxpre,mnao0o2,It IS real life,3,2025-04-15 20:36:35,Vegetable-Dog5281
music,1jzxpre,mn9mpi4,"Yes! Listening to them live at a concert, i feel like they are singing to just me.",2,2025-04-15 17:30:52,hottmomnextdoor
music,1jzxpre,mna2pgh,"My music will match my emotions quite often, sometimes evoke then, or nostalgia. Music is very powerful.",2,2025-04-15 18:50:22,Necessary-Sock7075
music,1jzxpre,mnb5jp4,"I think it adds character to your environment whether joyful, sad, angry, strong etc.",2,2025-04-15 22:07:36,Sicky_Stylee
music,1jzxpre,mnjcuju,"I like that music fills my head and instead of hearing negative thoughts I'll have  song I like stuck in my head.

I've found when I stop listening to music I start getting more negative in my head day to day.",2,2025-04-17 05:19:11,Jojobjaja
music,1jzxpre,mn9sjkl,Escape the real life. Get lost in fantasy...,1,2025-04-15 17:59:14,Balorpagorp
music,1jzxpre,mnagtvh,"Absolutely, after a pain in the ass day my favorite music helps me decompress and chill",1,2025-04-15 20:01:04,HDDos
music,1jwzh9o,mmmj5xo,Awesome song-Great artist!,5,2025-04-11 20:36:38,Raven586
music,1jwzh9o,mmmmkdd,Very underrated as a guitarist.,5,2025-04-11 20:54:04,5centraise
music,1jwzh9o,mmmy7pn,Fuckin love this song. Absolute treasure of a guy as well,3,2025-04-11 21:57:42,Hechtic
music,1jwzh9o,mmo87b0,"true music royalty. from The Spencer Davis Group to Traffic to Blind Faith to a solo career, this man has lived a life. I don't think he really gets the credit he deserves.",4,2025-04-12 02:43:18,jVCrm68
music,1jwzh9o,mmprqvo,The music of a 5-star man; a golden god,4,2025-04-12 11:14:30,name-classified
music,1jwzh9o,mmnf2oj,[deleted],3,2025-04-11 23:37:27,N/A
music,1jwzh9o,mmmumps,Drop C tuning?,2,2025-04-11 21:37:42,bebopbrain
music,1jwzh9o,mmo6gjz,I’ve been watching this video on YouTube for 10+ years. So happy to see it posted.,2,2025-04-12 02:31:36,chealey21
music,1jwzh9o,mmodvg3,Love doing it in standard tuning. I can't do Windwood vocals.,2,2025-04-12 03:22:40,kenticus
music,1jwzh9o,mmoexfj,"Truly amazing rendition, my friend recorded at his home studio.",2,2025-04-12 03:30:16,Francis_Dollar_Hide
music,1jwrh9r,mmkpca9,"Possibly this: https://www.weirdretro.org.uk/stalagghgulaggh-music-from-damaged-minds.html

From the read it sounds more of an anti-art, anti-music project than anything engagingly listenable. I wouldn't listen to it personally.",10,2025-04-11 15:08:39,Savantfoxt
music,1jwrh9r,mmkwl93,Yea even i just started to look for it - saw the same thing on reels and even i cant find it maybe would look on torrent later on,5,2025-04-11 15:44:02,nick_is_resting
music,1jwrh9r,mmlfako,piqued,5,2025-04-11 17:16:00,bngbngcpsnrbbrs
music,1jwrh9r,mmlpy3y,"I probably saw the same short you did, im trynna find it too",4,2025-04-11 18:07:57,Zestyclose-Ad-5935
music,1jwrh9r,mmnxrxb,Don’t quote me on this but I think it all ai bull. I mean there’s nothing on the internet about these “songs” and the only song I could find using that name is a from the Sherlock Holmes movie in 2011 so that’s my take on it .,2,2025-04-12 01:35:11,AnteaterEmpty6284
music,1jwrh9r,mmo2tmg,saw this too,2,2025-04-12 02:07:43,dominion2044
music,1jwrh9r,mmok7az,Piqued,1,2025-04-12 04:10:01,57thStilgar
music,1jwrh9r,mmpagja,intrigued,1,2025-04-12 08:17:37,Cassie_Opium
music,1jwrh9r,mmujmyq,What ever i fucking listened to was worse then the devil rejects,1,2025-04-13 04:41:01,i-cry-glass
music,1jusfww,mm4xgjd,Their Death Atlas album is easily one of the top ten extreme metal albums ever written.,8,2025-04-09 01:12:00,MaxillaryOvipositor
music,1jusfww,mm4pwv1,Saw them in Toronto two years ago and they were incredible. I had to explain to my work I was going on vacation to a concert and not a live animal sacrifice,6,2025-04-09 00:27:40,TicklerVikingPilot
music,1jusfww,mm4rvqk,One of the best death metal bands I’ve ever seen live! I’ll see them every time they come through town.,3,2025-04-09 00:39:13,horseradish_is_gross
music,1jusfww,mm8f8ru,"This whole album fucking RULES! Saw them open for Obituary, Carcass and Amon Amarth in 2022. Absolutely amazing show.",1,2025-04-09 16:14:10,pbrslayer
music,1jusfww,mm6eg17,"Hell yes, awesome to see Cattle Decap on this sub 🤘",1,2025-04-09 08:02:19,thespaceageisnow
music,1jusfww,mm6zngs,Sounds like someone constantly pushing instruments down the stairs while stepping on Lego…..,-5,2025-04-09 11:28:43,FrankyFistalot
music,1jusfww,mm4o88u,"Reminds me of my friend. I was married he was not. I demanded Friday or Saturday nights as our nights. We would listen to this radio show all night. Called ""the root of all evil"". This is the closest we ever got to scandavia!! Lol.

Brutal death metal deserves more updoots than it does here.",-16,2025-04-09 00:17:45,Old_One_I
music,1jusfww,mm4ywbi,I had a vision once. A young mans farm with willing cattle. The cattle in the organic farm sat beside their head on the ground. Waiting to be sold.,-9,2025-04-09 01:20:31,Old_One_I
music,1jp8x4c,mkxmrkj,Bob weir and the wolf bros with the philharmonic will be sick,1,2025-04-01 22:42:58,ANP06
music,1jp8x4c,mkxswib,Bobby?!,1,2025-04-01 23:18:33,Louisvillainous
music,1jp8x4c,mkyceoz,I'mma go there and tarp.,1,2025-04-02 01:18:36,Admiral_Furskin
music,1jnn8wd,mkl6q7y,Listen to any Smiths album.,96,2025-03-30 21:52:03,N/A
music,1jnn8wd,mkl6xpn,"The Tears of a Clown - Smokey Robinson & The Miracles

Come Dancing - The Kinks",63,2025-03-30 21:53:14,aemtynye
music,1jnn8wd,mkl7b8l,"""Last Kiss"" by J. Frank & The Cavaliers. Pearl Jam remade the song to put it in its proper tone.

""Cecilia"" by Simon & Garfunkel is another good example.",46,2025-03-30 21:55:20,Laughing_with_myself
music,1jnn8wd,mklbau3,"“You are my Sunshine”

“Clementine”

“Man of Constant Sorrow”

“I’ll Fly Away”

Basically most of the religious bluegrass music or late 1800’s stuff.",35,2025-03-30 22:18:18,slightly_drifting
music,1jnn8wd,mklc46f,Born in the USA 🇺🇸,35,2025-03-30 22:23:08,ComprehensiveEast376
music,1jnn8wd,mklc14t,"The Beatles did that with Maxwell's Silver Hammer, which was released in 1969. Upbeat and happy sounding song with lyrics about a guy killing people with a hammer.",29,2025-03-30 22:22:38,tshoemaker325
music,1jnn8wd,mkl7nmb,Leader Of The Pack by The Shangri-Las,23,2025-03-30 21:57:16,Chainsaw_Wookie
music,1jnn8wd,mkl3up4,All of ABBA's tunes,37,2025-03-30 21:36:03,doctor6
music,1jnn8wd,mkl4vnf,"""I don't like Mondays"" by the boomtown rats",24,2025-03-30 21:41:47,Mirgss
music,1jnn8wd,mkl905r,Pet Sounds,11,2025-03-30 22:04:56,fargus_
music,1jlfjgp,mk33ox8,"Not many know that robby was a flamenco guitarist before he joined the doors , this here to remind them",8,2025-03-27 22:26:58,Tabula_Rasa00
music,1jlfjgp,mk34mc1,"Also, the doors’ studio production never cease to amaze me. What incredible mastering, sounds as fresh as can be",7,2025-03-27 22:31:38,Tabula_Rasa00
music,1jlfjgp,mk3n7l3,"Love this tune, the breakdowns are super cool.",4,2025-03-28 00:08:12,yousyveshughs
music,1jkan3f,mjtpa4k,"I don't see who you're talking about, but it could well be Zuzana Ružicková whose book One Hundred Miracles shows how music helped her survive not only the Holocaust but the Soviet occupation of Czechoslovakia.  I recently read it with a clergy book group at Gordon Conwell Seminary.",3,2025-03-26 12:49:12,ChapBob
music,1jismht,mjhvdid,"Man, there was just something about 90's distortion",14,2025-03-24 15:54:32,palinsafterbirth
music,1jismht,mjio9i4,"There's a guy with a music shop ""Totem Paul Guitars"" in Neosho, MO who basically has a shrine to Collective Soul and I believe has the guitar from this music video in this shrine as well as some Dio stuff",5,2025-03-24 18:13:25,POLOSPORTSMAN92
music,1jismht,mjl9o60,"Just saw these guys last month. The new songs they played were ok, but the classic stuff still rips. I had a ball.",3,2025-03-25 02:19:10,HMTMKMKM95
music,1jismht,mjhqyod,"When this song was released it was vitally important who were the ""cool"" bands and who weren't. And Collective Soul were one of the uncool, inauthentic bands jumping on the bandwagon like Bush.

But thirty years later it doesn't matter. When a fifteen year old kid hears this song on the car radio and says, ""Turn it up, this is so good"" it doesn't matter who was in or out all those years ago. The only thing that matters is the songs. And this is a great song.",8,2025-03-24 15:32:47,RunDNA
music,1jismht,mjjb8rm,Warning: Youtube titties,2,2025-03-24 20:04:05,JasonTO
music,1jismht,mjhk25l,Quality song,1,2025-03-24 14:58:06,god-full-throttle
music,1jismht,mjqdgt9,How this weak ass shit has managed to sustain even a support act/county fair career for twenty years is beyond me.,1,2025-03-25 22:00:26,No_Leg6935
music,1jismht,mjii1yy,"These guys were immediately labeled posers back in the day. I’m older, wiser, and I’ve mellowed quite a bit since those days. I would now like to say, these guys still suck.",-16,2025-03-24 17:43:57,tdizell
music,1k1j7n6,mnotg05,One of my favorite albums,1,2025-04-18 01:32:15,whoisoliver
music,1jsiggw,mln1mag,Really good song,5,2025-04-06 02:37:42,EmployOk5086
music,1jppqt8,ml116fm,"I’m always amazed how ahead of the times this song is. Released in 1964, when The Rolling Stones was singing “It’s All Over Now” and The Beatles released “Eight Days A Week”, The Kinks had this rough and ready track, part grunge/garage rock, part punk…and STILL a banger SIXTY YEARS LATER!! A testament to its status in the pantheon of forever rock! To put it in context, sixty years before this track was recorded, would have been TWENTY YEARS before the golden age of radio!!",7,2025-04-02 14:28:40,bill_b4
music,1jppqt8,ml2pfzy,Talk about 2 brothers that couldn’t stand each other before it was cool to hate your brother,2,2025-04-02 19:23:17,bones_boy
music,1jppqt8,ml26ks4,Nathan,1,2025-04-02 17:51:36,Intelligent_Wave_648
music,1jppqt8,ml12izi,"I love the Kink's, i love that many of their songs would be seen as ""woke bullshit"" if released today such as Lola, Out Of The Wardrobe or Supersonic Rocketship. I wouldn't change anything about them, Here Comes Flash always reminds me of that autotuned viral news song from many years ago ""hide your daughters, hide your wives, lock your doors and stay inside, here comes Flash""",1,2025-04-02 14:35:36,Martipar
music,1jith30,mjhte99,"Avant-garde is the better word.  Late 70s art-rock, borrowed from the glam rock movement, took it to a theatrical approach in-concert, and they were a blast to see live.  I do think they tried to set that aside a bit and get into the mainstream, and this was around the same time as Devo was getting a bit more attention.  She's a Beauty (1983) was a MTV hit, but their first attempt at a breakthrough was the unfortunate choice to be in Xanadu, along with Gene Kelly, the guy from The Warriors, roller-skating and Olivia Newton-John.

The Tubes aren't for everyone, and while I do think they were best seen live, I sort of put them in a slot with Devo, J. Geils Band, and Utopia (bands I've seen live), where I can enjoy their work, even if it's a bit dated, but I do think the live concert is what drove both my enjoyment and their reputation.  Fee was quite the showman.

[Xanadu - Dancin' (The Tubes)](https://www.google.com/search?client=firefox-b-1-d&q=the+tubes+xanadu#fpstate=ive&vld=cid:6a97226c,vid:vat2nXq2MPM,st:0)",22,2025-03-24 15:44:51,CrimsonFeetofKali
music,1jith30,mjhsfz4,"Talk to You Later is an all-time banger IMO

Completion Backward Principal is a gem throughout",34,2025-03-24 15:40:09,DoinDonuts
music,1jith30,mjhtbaf,"What Do You Want From Life? is a personal favorite. I think they weren’t that popular because they were too hard to peg - at seemed like a sarcastic jokey wry band, like Zappa or Ween, but then they put out a string of straight pop hits like She’s A Beauty. Loved em though!",14,2025-03-24 15:44:26,N/A
music,1jith30,mjhrx41,I have loved the tubes since the first time I heard them... The biggest challenge for them is they were so far out of the mainstream with songs like white punks on dope and Mondo bondage... That it would have been hard to discover them,12,2025-03-24 15:37:32,db4378
