subreddit,post_id,comment_id,comment_content,comment_score,comment_created_at,comment_author
VietNam,1jysjd8,mndot7i,"I’ve solo traveled Vietnam - 

- download grab app - fixed fare taxis like uber. Taxis are cheap in my experience 
- you need cash - check which atms are legit on google maps. I’d say it’s 50/50 in terms of paying by phone / cash. Use a debt card. 
- credit cards - expect 3-6% per transaction 
- coffee places - go to place where locals are, just walk and explore 
- restaurants / bars - lots of fake reviews on google maps. They ask customers / offer drinks for reviews. Ask on Reddit for ppls fav places.  
- tourist traps - it’s no different to other parts of the world but everyone will hard sell you and want money from you. Expect to be hustled. From the driver on commission to ppl in the shops. 
- traffic - ppl drive a bit crazy here, but I’m used to it and it’s comparable to India / Thailand / Philippines etc. you kinda have to walk out into the road and they go around you. 
- google translate - ppl don’t speak much English here, so this is a life saver 
- safety - I’ve been to dodgy parts of the world, feels safe here but be sensible
- be respectful and friendly",2,2025-04-16 09:14:32,Dazzling_Reaction746
VietNam,1jysjd8,mnlzywh,There is so much more to Vietnamese food than Pho - research the local specialities from each town/region. I would also add Hue as a place if you are doing Da Nang and Hoi An.,1,2025-04-17 16:36:25,qwertypi_
VietNam,1jysjd8,mnnua7e,"\- in Ha Noi: due to air pollution, always wear mask. 

\- Sapa is good for Hiking.

\- Hoi An: good for vibe cycling, there hotels always offer free bike for you to go around Hoi An

\- Da Nang: Good for some serious cycling, you can go around Son Tra.

\- Beers are cheap.

 \- Do not drink tap water",1,2025-04-17 22:04:11,WarmAssociate7575
VietNam,1jysjd8,mnq8lhy,Bring pepto bismos. lots of it.,1,2025-04-18 08:43:05,Fun_Trip_Travel
VietNam,1jyrqkp,mn0p9ty,"Go buy a phin, some cans of condensed milk, and Trung Nguyen coffee. Thank me later.",10,2025-04-14 05:57:57,thriftytc
VietNam,1jyrqkp,mn0upih,If you're in the U.S. then get Cafe Du Monde. It is what the majority of Vietnamese use. Trung Nguyen and Cong Cafe products suck ass unless you can replicate their brew process.,5,2025-04-14 06:52:20,Logarithmic9000
VietNam,1jyrqkp,mn3plr0,"Yes, condensed milk is very important..I brought home 5 lbs of coffee from Dalat. Amazing!!!",4,2025-04-14 18:22:28,Warm-Boysenberry3880
VietNam,1jyrqkp,mn4yhvx,"You’re in the Middle East, is the coffee there not as good? 

The powder stuff is instant coffee and they could never ever be as good as coffee brewed with a phin filter.  Check out lenscoffee.com, they sell Vietnamese coffee.",2,2025-04-14 22:14:49,Sudden_Ad_4193
VietNam,1jyrqkp,mn0pctq,"just buy a phin filter and support your Viet coffee roasters (if any), or buy some beans off an online marketplace, wherever you are. DIY Vietnamese coffee is the best Vietnamese coffee",1,2025-04-14 05:58:45,NoAppearance9091
VietNam,1jyrqkp,mn0qx74,"You can buy “Lee’s Coffee” at Costco. It’s cold and in bottles, I think you buy them in packs of 8. They taste just like the stuff you get in Vietnam.",1,2025-04-14 06:14:04,1lookwhiplash
VietNam,1jyrqkp,mn0s3x0,"For instant coffee I recommend Cafe Phố, it's really good",1,2025-04-14 06:25:57,Maxanis
VietNam,1jyrqkp,mn1d48g,[deleted],1,2025-04-14 10:09:03,N/A
VietNam,1jyrqkp,mndyg25,Not sure where you live but I’m in the states and I have a phin (metal coffee filter thingy). I use Starbucks espresso coffee bean and ask them to grind for me in store. I make Vietnamese coffee with that and of course condense milk,1,2025-04-16 10:48:50,Hxt_hopeful
VietNam,1jyrqkp,mn257bp,"Vietnamese coffee and all its varients are a matter of process and ingredients not specifically any particular bean. Stick with dark roast and figure out what ratio works best for you.

Edit, Forgot to mention that using espresso is key but most dont have espresso maker including me. Though we use a Moka pot which is as close to espresso as you can get without having an actual machine.",1,2025-04-14 13:36:44,mygirltien
VietNam,1jy9lig,mmx41wg,"Wait, your partner's parents accepted your gay relationship? That surprised me, good for you dude",7,2025-04-13 16:39:16,khoavanthanh123
VietNam,1jy9lig,mmxhje7,"At first i was confused as well,i dont judge but right now inside Vietnam , alot family not support this,cursing their sons as well,but super normal in US dude, even the family super old tradition as long as they live in US for long time their mind been cleaned,i mind i dont have Communist thinking anymore and for sure 100% they will accept you as long as you be nice to their son , some cleaning and mopping are super normal,they want their son to marry someone who can help out houseworks , better than some lazy one doesnt know what do to anything , old south Viets people from Saigon are super easy , you can ask all people from Viets as well, from beginning maybe they dont like it but give them little bit time when they called you “Con” it means they do accept you as you are , keep doing good work and show them respects on things they will love you like their own blood for sure from me here,good luck to you both 😄",2,2025-04-13 17:48:04,Teddy9999
VietNam,1jy9lig,mmwmyes,"Pretty much yes! It’s depends and different from each family. However, if they only let you do all of the chores without offering any help then consider end this relationship before it’s too late.",1,2025-04-13 15:09:46,stevenfromVN_2909
VietNam,1jy9lig,mmwoqbj,"It depends on the family and the length of your relationship . Vietnamese parents don’t  push their kids partners in house chores at this stage. Unless you are living with them and depending on them financially, this seems unusual.",1,2025-04-13 15:19:05,mindtwistingdonut
VietNam,1jy9lig,mmwrdhr,"You have a give a bit more details. Are you living in or outside Vietnam? Are you living with him, consequently doing house chores in your house? Where are they from north or south",1,2025-04-13 15:33:07,Eastern-Unit-6856
VietNam,1jy9lig,mmwtswu,"You are lucky torr partners parents are so accepting. Usually viet patents are very negative towards gay relationships, but sounds like your partners parents accepted you in their family 😁",1,2025-04-13 15:45:50,uhuelinepomyli
VietNam,1jy9lig,mmxdwgw,"From my experience, I never had to cook or clean. I’d help with dishes and clear the table after a meal but that’s about it. 

Honestly, if they made me do all of this, I’d run away.",1,2025-04-13 17:29:25,Tooswt29
VietNam,1jy9lig,mmxjln3,"only $50 ,,bu you will pick up over time .this is cheating

# Real-Time Translator Earbuds - 150 Language Two-Way AI Translation Headset with Free Subscription App Support, ENC Noise Cancelling & 10H Playtime for Travel/Business/School

[https://www.amazon.com/Real-Time-Translator-Earbuds-Translation](https://www.amazon.com/Real-Time-Translator-Earbuds-Translation)",1,2025-04-13 17:58:25,kabir93117
VietNam,1jy1p1c,mmuxxva,"Lưu ý,

Bất kể bạn đang tham gia vào chủ đề thảo luận gì, hãy lịch sự và tôn trọng ý kiến của đối phương. Tranh luận không phải là tấn công cá nhân. Lăng mạ cá nhân, cố tình troll, lời nói mang tính thù ghét, đe dọa sử dụng bạo lực, cũng như vi phạm các quy tắc khác của sub đều có thể dẫn đến ban không báo trước.

Nếu bạn thấy bất kì comment nào vi phạm quy tắc của sub, vui lòng nhấn report.

***

A reminder.

In general, be courteous to others. Debate/discuss/argue the merits of ideas, don't attack people. Personal insults, shill or troll accusations, hate speech, any suggestion or support of harm, violence, or death, and other rule violations can result in a permanent ban.

If you see comments in violation of our rules, please report them.

***

*I am a bot, and this action was performed automatically. Please [contact the moderators of this subreddit](/message/compose/?to=/r/VietNam) if you have any questions or concerns.*",1,2025-04-13 06:52:07,AutoModerator
VietNam,1jv2qgf,mm6u7gz,"Lưu ý,

Bất kể bạn đang tham gia vào chủ đề thảo luận gì, hãy lịch sự và tôn trọng ý kiến của đối phương. Tranh luận không phải là tấn công cá nhân. Lăng mạ cá nhân, cố tình troll, lời nói mang tính thù ghét, đe dọa sử dụng bạo lực, cũng như vi phạm các quy tắc khác của sub đều có thể dẫn đến ban không báo trước.

Nếu bạn thấy bất kì comment nào vi phạm quy tắc của sub, vui lòng nhấn report.

***

A reminder.

In general, be courteous to others. Debate/discuss/argue the merits of ideas, don't attack people. Personal insults, shill or troll accusations, hate speech, any suggestion or support of harm, violence, or death, and other rule violations can result in a permanent ban.

If you see comments in violation of our rules, please report them.

***

*I am a bot, and this action was performed automatically. Please [contact the moderators of this subreddit](/message/compose/?to=/r/VietNam) if you have any questions or concerns.*",1,2025-04-09 10:44:53,AutoModerator
VietNam,1jv2qgf,mm70ehf,"Nguyễn An Ninh, born in 1900 in Long Thượng village (now part of Ho Chi Minh City), was a pivotal figure in the Vietnamese patriotic movement before 1945. Educated in France, he became an influential thinker, writer, and organizer. As founder of the Thanh Niên Cao Vọng Party, he inspired thousands to strive for freedom and democracy.

A fearless voice against colonial rule, Nguyễn An Ninh established newspapers like La Cloche Fêlée and authored influential cultural and political essays. Despite numerous arrests, his unwavering dedication left an indelible mark on Vietnam’s path to independence.",2,2025-04-09 11:34:16,signsofheroes
VietNam,1jus1fu,mm4n7gr,Mần răng?,5,2025-04-09 00:11:42,VN_Boy2020
VietNam,1jus1fu,mm4qm79,"Miền Nam is sort of a melting pot of immigrants from pretty much everywhere. Many from Central and North Vietnam migrated to the South partly due to its rich and bountiful natural resources.

Really good book [here](https://vietmessenger.com/books/?title=noivemiennam) that explains it well.",7,2025-04-09 00:31:49,Da_Bootz
VietNam,1jus1fu,mm4xonl,"That's interesting, my in-laws are all from miền Tây and I've only ever heard them say làm. Maybe varies within the region too?",2,2025-04-09 01:13:20,holycrapoctopus
VietNam,1jtkzoo,mlv2rvy,free holiday to go to the beach!!!!!,11,2025-04-07 13:51:54,Minh1403
VietNam,1jtkzoo,mlv0mfb,"Not sure how I would have felt if I were alive during the war but someone who was born way after the war ended, I'm glad we are a unified country. While I personally would have prefered a different system than team red, I certainly wouldn't want to be unified under the banner of South Vietnam whose government was too busy couping each other that they got steamrolled 1 year earlier than even the North expected. With those schmucks at the helm, we would have likely lost the country anyway when the Chinese inevitably invaded.

That being said I do feel a strong sense of repulsion when the war is portrayed as very much a simple black and white matter in Vietnam with the whole thing being overromanticised. Vietnam War (which I can't even say in Vietnamese without getting crucified) was a huge complicated clusterfuck and anyone denying it is either uninformed or dishonest.",34,2025-04-07 13:39:28,2xCommie
VietNam,1jtkzoo,mlvnjtu,"When a war concludes decisively, there are always losers and winners. But for the war itself, as I quote Bao Ninh, “war has no losers or winners, only the guys who never fought argue about who wins and who loses” 

I think it’s worth celebrate that the bloodshed was ended, and the supposed blood bath against South Vietnamese who worked for the Thieu regime is wildly exaggerated to say the least. You can talk about the vigilantism or imprisonment, but there was no policy, official or implied green light, to kill anyone for their service to RVN after Saigon fell.

As to the future of the country, the best case scenario had the RVN survived would be like South Korea (which I highly doubt, more likely will go similarly to Thailand and the Philippines). And well, you’re welcome to dream about it but I very much prefer our current situation to the Korean peninsula.",5,2025-04-07 15:39:57,Open-Sentence2417
VietNam,1jtkzoo,mluyvzy,"Basically yeah. It's a day of celebration and unity, I don't really care how VKs see it or how they think about it overseas. Plus we get some days off so people like to travel or have fun during those days.",16,2025-04-07 13:28:48,NoAppearance9091
VietNam,1jtkzoo,mluxx0q,"Fairly accurate yeah. Personally, I'm not in the anti-communist crowd but also not interested in the nationalistic/patriotic stuff, so I guess somewhere in the middle. I'm happy the country's united nonetheless.",3,2025-04-07 13:22:47,Swimming_Ad_9459
VietNam,1jtkzoo,mlvxvlg,"If we are talking from a gov standpoint then they still consider it as ""Liberation of the South and Unification Day"" which makes sense since Vietnam in the end is still an authoritarian country ruled by a communist party that has existed since like 1946 so they have to maintain the image to have a form of legitimacy.

But myself as a native I think it's a day of reunification no matter how much the gov tries to spin it. Even if the current gov isnt a good one and is an oppressive authoritarian type of gov, I'm at least still glad in the end we still manage to unite and not care about sticking guns to eachother constantly like north and south korea. So that in the future we may once and for all change this country together and not have to deal with the constant fear of one invading the other when bad times come.",3,2025-04-07 16:33:01,OrangeIllustrious499
VietNam,1jtkzoo,mlvcfy3,"people born in the 80s and on dont really care, its a day off so yea they probably care for that, but the meaning behind it is lost. Sort of like July 4th, how many people in the U.S really know that day other than independence day. In UK, its just another day.",1,2025-04-07 14:43:24,Ada187
VietNam,1jtkzoo,mlwipy7,"It's day of rememberance for those who were there, but TBH almost no one I know under 60 really talks about it. None of the younger generation are marching and carrying flags. During the last 12 years I've known the Vietnamese association, their numbers are getting less and less. 

Majority will show up to their meetings and share about their personal experience during those times now, or some old miltiary personnel will have yearly get togethers.

I'm mid-40s and don't even think about it much less what people in Vietnam would think as well. However I've known some who would be blacklisted if they did show any celebration towards it.",1,2025-04-07 18:17:50,mijo_sq
VietNam,1jtkzoo,mlv06cy,"Most of the Viet Kiet refugees had already abandoned the old RVN ideology, moved forward, and become normal French/Australian or US citizens, only a small number still being fanatics and holding a grudge",1,2025-04-07 13:36:48,SymbolicSheep
VietNam,1jtkzoo,mluz1wf,The day the commies sucessfully robbed and killed South Vietnamese intellectuals. Thats how the Orange County VK view (according to someone I know),-2,2025-04-07 13:29:48,Annoymous-123
VietNam,1jt4nj5,mlrnmnh,"Can’t speak to podcasts but I’ve been reading Ben Kiernan’s _Vietnam: a History_ and think it’s great. I actually just finished the section on the Han. One of the things I like about the book is it treats the history regionally. 

What is the podcast on China you’ve been listening to? Would be interested thanks.",2,2025-04-06 21:56:30,EpeeDad
VietNam,1jt4nj5,mls26zn,"Christopher Goscha's Vietnam a new history is the best general history book so far, free from old biases and has a lot of new insights.",0,2025-04-06 23:23:47,yangbot2020
VietNam,1jt4nj5,mlskpzn,"1. Podcast: ""The History of Vietnam""

2. Book: ""Vietnam: A History"" by Stanley Karnow

3. Book: ""The Birth of Vietnam"" by Keith Weller Taylor

4. Blog: ""Asia for Educators"" (Columbia University)",0,2025-04-07 01:21:05,MrMr0595
VietNam,1jqh07s,ml70vlk,"Get blackout drunk at a bar that the chick who smiled at you once brought you to, knock up the masseuse at the “VIP Massage”, pass out at the hostel you found for $3 at the last minute, wake up with the worst case of gonorrhea ever seen this side of the pacific, block the masseuse’s and the chick’s number because she won’t stop calling now, then maybe see the Literature Museum before getting on a plane with the worst hangover you’ve ever had while coming up with a story about how “spiritual” this experience was. 

DO NOT check your bank statements until you get home at which point you can come back here asking us if you missed out with the girl because you really felt a connection.",19,2025-04-03 13:11:57,No-Damage6935
VietNam,1jqh07s,ml6w4og,Blackout drunk in Bui Vien,13,2025-04-03 12:43:02,magicbaconmachine
VietNam,1jqh07s,ml6v3at,"Local people usually dont seek out an adrenaline rush, they have to work. Trying to survive in traffic is literally your only option.",7,2025-04-03 12:36:23,BeniCG
VietNam,1jqh07s,ml73wyo,Walk amongst the traffic in Hanoi. Can’t overstate how much I enjoyed walking in that city.,6,2025-04-03 13:29:35,harbingergatsu
VietNam,1jqh07s,ml6v5c5,Famous UNESCO cultural site Bui Vien street.,4,2025-04-03 12:36:45,Narrow_Discount_1605
VietNam,1jqh07s,ml8lh2g,Try dog with a reputable Vietnamese friend. Don’t be shocked if it’s absolutely delicious.,5,2025-04-03 17:56:51,ButMuhNarrative
VietNam,1jqh07s,ml6z34d,Must do things is to search this sub and maybe Google,3,2025-04-03 13:01:05,Commercial_Ad707
VietNam,1jqh07s,ml78rob,5k trek through the Jungle to Hang Tien cave. Most amazing experience!,3,2025-04-03 13:56:44,flyin_jimmy
VietNam,1jqh07s,ml7ldh8,"Street food, especially banh mi.",2,2025-04-03 15:00:20,OleaC
VietNam,1jqh07s,ml7lsz3,"Ha Giang loop with an Easy Rider
Mekong Delta
At least one 10 hr sleeper bus ride
The train from Hoi Ann to Hue
Hanoi Old Quarter
Ho Chi Minh’s resting place at night - don’t need to actually enter the mausoleum 
Tam Coc’s fun for excursions (Kong, Skull Island territory)",2,2025-04-03 15:02:27,Fuzzbass2000
VietNam,1jq5unb,ml4nlz3,"Lưu ý,

Bất kể bạn đang tham gia vào chủ đề thảo luận gì, hãy lịch sự và tôn trọng ý kiến của đối phương. Tranh luận không phải là tấn công cá nhân. Lăng mạ cá nhân, cố tình troll, lời nói mang tính thù ghét, đe dọa sử dụng bạo lực, cũng như vi phạm các quy tắc khác của sub đều có thể dẫn đến ban không báo trước.

Nếu bạn thấy bất kì comment nào vi phạm quy tắc của sub, vui lòng nhấn report.

***

A reminder.

In general, be courteous to others. Debate/discuss/argue the merits of ideas, don't attack people. Personal insults, shill or troll accusations, hate speech, any suggestion or support of harm, violence, or death, and other rule violations can result in a permanent ban.

If you see comments in violation of our rules, please report them.

***

*I am a bot, and this action was performed automatically. Please [contact the moderators of this subreddit](/message/compose/?to=/r/VietNam) if you have any questions or concerns.*",1,2025-04-03 01:34:10,AutoModerator
VietNam,1jq5unb,ml57jr3,1 usd to 30k VND soon,13,2025-04-03 03:41:43,free_loader_3000
VietNam,1jq5unb,ml4swom,Maybe Buy a little gold and silver to be safe?,5,2025-04-03 02:05:23,We_are_all_friends
VietNam,1jq5unb,ml66b6n,"if you don't have anything to spend money on, you can buy gold to maintain your money value.",2,2025-04-03 09:08:24,Icy-Run-6487
VietNam,1jq5unb,ml68xyx,Economy flushed down the toilet. Say thanks to your trump supporting friends.,4,2025-04-03 09:36:28,magicbaconmachine
VietNam,1jq5unb,ml5qoz4,Does devaluing currency mean printing more? What effect does devaluing have on inflation?,1,2025-04-03 06:23:30,GGme
VietNam,1jq5unb,ml68av4,Who knows maybe USD weakens because people stop using it settle non-US trade,1,2025-04-03 09:29:45,jacuzziwarmer7
VietNam,1jq5unb,ml73ij3,The government may sell off its gold stock and devalue the vnd cutting the trade deficit. They did this during Trumps 1st term. I don’t think that would be enough this time around though. I would never feel safe having money in the country without significant systematic and regulatory changes.,1,2025-04-03 13:27:17,dausone
VietNam,1jq5unb,mlagrws,Du maga,1,2025-04-03 23:50:02,sarusauce
VietNam,1jq5unb,ml5pwlf,They should have devalued it long ago and taken some of the zeros off. Many payment portals cannot be used in business because they cannot accommodate so many zeros.,-3,2025-04-03 06:15:49,Background-Dentist89
VietNam,1jpvzgq,ml2fmde,"Is that instant pho?...




You ok?",3,2025-04-02 18:35:15,Chubbypand4
VietNam,1jpvzgq,ml3ppls,Damn Instant Pho and Taco bell sauce lol,2,2025-04-02 22:21:01,shocktopper1
VietNam,1jpvzgq,ml4qaj3,"Believe it or not, this one is also straight to jail",2,2025-04-03 01:49:50,Euphoric-Policy-284
VietNam,1jpvzgq,ml2srr8,A+ for effort.,1,2025-04-02 19:39:42,how33dy
VietNam,1jpvzgq,ml3sbtb,🤢🤮,1,2025-04-02 22:35:20,Goodness_Beast
VietNam,1jpvzgq,ml4h232,Could’ve at least used Fire,1,2025-04-03 00:55:30,Commercial_Ad707
VietNam,1jpvzgq,ml5qopb,I used to use Sriracha and still like it on sandwiches but I prefer chinsu for a lot of things now.,1,2025-04-03 06:23:25,tuansoffun
VietNam,1jpvzgq,ml84i4z,How was it?,1,2025-04-03 16:34:32,Tooswt29
VietNam,1jpvzgq,mlc73qq,Even sriracha is bad,1,2025-04-04 07:29:19,FactLicker
VietNam,1jpuuxg,ml27eqt,I’m going to Ninh Binh day after tomorrow,5,2025-04-02 17:55:28,bhushan_44
VietNam,1jpuuxg,ml2677l,"I'm planning on going to Vietnam next month and I came across this tour on AirBnB and was skeptical. But after looking at your post, I'm definitely booking it. My friends are gonna love it too. You and your girlfriend make a cute couple! She's pretty ♥️",2,2025-04-02 17:49:52,Turbulent-Record-511
VietNam,1jpuuxg,ml28ocd,I’m going to Ninh Binh day after tomorrow. Thanks,1,2025-04-02 18:01:24,bhushan_44
VietNam,1jpuuxg,ml2z2uy,We’ll be there for 2.5 days. What are your best recommendations?,1,2025-04-02 20:09:35,DisorganisedPigeon
VietNam,1jpuuxg,ml3tngr,So its a day trip from Ha Noi to Ninh Binh? What was price for 2?,1,2025-04-02 22:42:41,TheTransformers
VietNam,1jpuuxg,ml51y40,Going soon too. Hope the air quality won't be too horrible 😐,1,2025-04-03 03:03:19,_Sweet_Cake_
VietNam,1jonpmp,mkt8arj,"Oh.. ""mắc ke"" is a special herb, dried and sold in commercial packaging that'll do great for grilled meat marination.

""Mắc mật"" same function - but come in fresh, can be frozen and airtight before the flight.",3,2025-04-01 05:17:43,Super-Blah-
VietNam,1jonpmp,mktaw9n,whatever you bring back home just make sure it can clear your home country's customs.,3,2025-04-01 05:42:15,Fun_Trip_Travel
VietNam,1jonpmp,mkt83dm,Green peppercorn can go great in a number of dishes.,2,2025-04-01 05:15:49,Super-Blah-
VietNam,1jonpmp,mktgzbu,"My mother won’t let me come home without white pepper.

Cinnamon is also a must have because we use a different type of tree.

And then there are all kinds of local black pepper types and even red pepper which is close to Szechuan pepper.

Aside of that, Vietnamese 5 spices and my aunt swears on ahn hai’s blend. I think that’s a place in cho Ben Thanh ",2,2025-04-01 06:44:40,MillyQ3
VietNam,1jonpmp,mkt7tpi,"Whole (black) peppercorns, might be basic but Vietnamese black pepper has a citrus-y flavour note to it which is different from the black pepper available in my home country. I always give friends a bag to bring home.

While I wouldn't recommend Ben Thanh market in most situations, there's a spice shop where I frequently buy from, ""Anh Hai"". You could probably get it from them.

And consider anything that you *might* use and can't find back home. Dried spice lasts pretty long overall. Pho packs usually do well as souvenirs.",1,2025-04-01 05:13:23,paksiwhumba
VietNam,1jonpmp,mktv9vt,Where do U live? Because alot of countries sell all those spicies so U don't have to take it all the way from Vietnam,1,2025-04-01 09:27:14,Deep-Juggernaut-9943
VietNam,1jonpmp,mkumld5,The dry chili sa te. Love that shit. Way way better than laogonma or whatever it’s called.,1,2025-04-01 13:11:25,Zealousdaddi
VietNam,1jonpmp,mku5x20,"Pot, coke, heroine, crack, etc.",0,2025-04-01 11:13:00,DienbienPR
VietNam,1jlelxv,mk3y1bp,My favorite is Huda from Huế,6,2025-03-28 01:08:27,Fantastic_Search2300
VietNam,1jlelxv,mk3hdr8,Tried a bunch and for me it’s 333,10,2025-03-27 23:36:55,imnotatourist2020
VietNam,1jlelxv,mk3vq4f,"I kinda like Truc Bach. If it's not available, I would stick to 333.",6,2025-03-28 00:55:26,Vince781
VietNam,1jlelxv,mk3zbex,If you’re into craft beer you should try 7 Bridges. Their beer rules.,8,2025-03-28 01:15:42,ThatCatisaFish
VietNam,1jlelxv,mk40kpn,"Depends, are we talking about cheap beers that you drink with ice ? Or craft beers ?

For cheap beers, all are rather tasteless (but go well with ice). I always take Saigon special (guess where I live) but Huda may be the least tasteless of those beers. 

However there are tons of craft beers in Vietnam, many are excellent. The Jasmine IPA by Pasteur Street is arguably the best.",3,2025-03-28 01:22:54,arllt89
