subreddit,post_id,comment_id,comment_content,comment_score,comment_created_at,comment_author
gaming,1k4xvpo,moe0si6,More doesn’t always mean better. I figure the recent trend of banger independent studio games shows us that. Having a solid gameplay vision goes a lot further with gamers than cinematic BS.,3,2025-04-22 06:14:33,Grouchy_Egg_4202
gaming,1k4xvpo,moe3ole,Skyrim was made with a team of 100 people.,12,2025-04-22 06:43:42,delicious_brains818
gaming,1k4xvpo,moe39ot,"Until they make a new engine, every game will have the same limitations and issues.",18,2025-04-22 06:39:25,ShockRampage
gaming,1jshwxx,mlmkbi7,"Time feels faster as you age. I remember an hour feeling like *forever* as a kid. When we went on a 1 hour road trip to the neighboring city, I would bring a bag full of stuff like a book, notepad, games, etc. And I would still run out of things to do. Now, I can easily zone out and drive that trip in what feels like 5 minutes. ",4475,2025-04-06 00:41:26,You_Stole_My_Hot_Dog
gaming,1jshwxx,mlmjla2,"I think part of it was we were just so engrossed in the moment that a 2hr gaming session felt like all day, whereas now 2hrs pass and I feel like I was just getting started",2196,2025-04-06 00:36:47,Own_City_1084
gaming,1jshwxx,mlmk0qv,"Adults work full time, maybe even have a second job. Plus they have chores, errands, etc. Plus time with kids or SO outside of gaming.



In general, yes adults have less free time than kids.


Kids can game from school till bedtime. 5 hours of gaming time per night as an adult is rare.",645,2025-04-06 00:39:32,stallion8426
gaming,1jshwxx,mlmmqwu,"Kids absolutely have more time 

Come home from school, maybe do some homework, and the rest is all free time. Add on summer holidays, spring break etc 

Adults have responsibilities , jobs with longer hours than school, prone to being more tired, etc",269,2025-04-06 00:57:10,VolksDK
gaming,1jshwxx,mlml6zw,"As a kid I’d go home and have nothing to worry about. Food got made, groceries got bought, errands got run lunches got made for the next day. 

And we might have 6-7 hours of playtime unless you had homework and chores. 

Our perception of time also changes as we age. 

3-4 hours as a kid felt like forever. 

Now I finish work, gotta workout to stay in shape,have to hit up the grocery store,oh got to go pick up the gf, she need to stop somewhere, oh forgot to grab snacks, get home, oh gotta do the dishes and laundry, take a shower, make supper, make lunch for the next day. 

Bam, I have 1-2 hours and I had a tough day of  work so I’m tired. Start a game and shut it off because I’m drained mentally and physically.

I don’t even have kids. No idea how parents get to enjoy gaming.",81,2025-04-06 00:47:02,-SOLO-LEVELING-
gaming,1jshwxx,mlmks8y,"I pulled so many all nighters as a kid. I don't think I saw the sun for a week at one point. Summer time at age 14 and below was amazing. 

Then I started working and I have had maybe 3 real 2 week vacations in the last 20 years. Idk what led you to think this lol.",20,2025-04-06 00:44:24,PM_ME_UR_CIRCUIT
gaming,1jshwxx,mlmk1xq,i feel like i have more time now then in school back then it was school homework playing outside bedtimes. now it's work then few chores and that's it,53,2025-04-06 00:39:44,Worried_Train6036
gaming,1jshwxx,mlmjxf4,Time has always had limits,44,2025-04-06 00:38:56,ScribebyTrade
gaming,1jshwxx,mlmoqfg,Cut back on your reddit/doomscrolling and play more video games.  You can thank me later.,21,2025-04-06 01:10:24,Sepulchura
gaming,1jshwxx,mlmjmjv,"Both

I am more carefull how i pick games

I pick less games but higher quality",21,2025-04-06 00:37:01,katfat1
gaming,1k5izm7,moit2dc,"If this is steam, it's false. I played a bit before work but didn't make it outta the sewers yet.",914,2025-04-22 23:50:04,Krust3dKan4dian
gaming,1k5izm7,moib8nz,"I mean, no one is casually purchasing a remaster of a 2006 game when it's been shadow dropped and is not immediately playing it. I'd expect nothing less. Next month, the number will begin to drop.",3369,2025-04-22 22:10:18,zeppelinoasis
gaming,1k5izm7,moiciut,"I’m part of the 1.7 percent of players that have closed an oblivion gate, so I have that going for me.

Edit: 1 day later, 17.3 percent of players.",528,2025-04-22 22:17:23,mlross15
gaming,1k5izm7,moibde3,That's not how that works,210,2025-04-22 22:11:02,WrongKindaGrowth
gaming,1k5izm7,moj1xpx,True gamers save right before you step out of the gate,12,2025-04-23 00:40:53,Banetaay
gaming,1k5izm7,moikck1,That's not what that means.,30,2025-04-22 23:01:23,DayneTreader
gaming,1k5izm7,moj1e38,I wanna buy it  - then cheat past the trigger that gives you this and continue playing to bring the % down to 99.9999,12,2025-04-23 00:37:44,Eisegetical
gaming,1k5izm7,moiclho,"No it mean 100% of people who play the game finished tutorial...

Im not playing oblivion right now",66,2025-04-22 22:17:48,Archive_keeper37
gaming,1k5izm7,moinnkp,"I remember buying an Xbox 360 back on the launch day of oblivion so that I could play it, they only had collectors editions left for the game and I got one",4,2025-04-22 23:19:51,BrodyCanuck
gaming,1k5izm7,moko1md,"Becoming a pit dog in the arena is a rare achievement right now 😂 everytime I ranked,  it gave me a rare achievement 😭",3,2025-04-23 07:56:30,delliebellie16
gaming,1jt42b7,mlrelr7,I miss the Machinima videos :(,309,2025-04-06 21:05:15,SteamingPie93
gaming,1jt42b7,mlrdjlv,"Thats dope.  Tough day for red team, though.",145,2025-04-06 20:59:28,That5kum8ag
gaming,1jt42b7,mlredi3,Memory is the key,82,2025-04-06 21:04:00,KPeters93
gaming,1jt42b7,mlrzy5y,You ever wonder why we're here?,47,2025-04-06 23:10:15,evilton-chin
gaming,1jt42b7,mlrffc5,"Luckily, I am not lazy like a shisno.",43,2025-04-06 21:09:47,q_bitzz
gaming,1jt42b7,mlrn2xz,Kill the Reds! Kill the Reds! Kill the Reds! Kill the Reds!!!,38,2025-04-06 21:53:18,Bondorian
gaming,1jt42b7,mlsb10q,"Wow this just made a wave of nostalgia hit me like a ton of bricks. The memories I had watching red v blue, or just fucking any machinima/roosterteeth halo video, was my childhood. Having to wait for the video to buffer every 5 seconds, yet still watching intently was terrible, but I still waited lol. 

The memories I have on halo and the community are some I hold very dear, a lot I forgot, and this post reminded me of those amazing memories about the game and the fun times I had with the community so thank you.",19,2025-04-07 00:18:42,Mind_Mischief2
gaming,1jt42b7,mlrex7y,halo blender i made in render,18,2025-04-06 21:07:00,ResidentPoem6607
gaming,1jt42b7,mlrexxr,"Very clean dude, nice.",4,2025-04-06 21:07:07,Lanky-Thanks4950
gaming,1jt42b7,mlt1lit,This is so sick. The laser is crooked coming from the splaser though.,4,2025-04-07 03:14:35,N/A
gaming,1jrs931,mlh38kl,"My issue is I always step away from long games, and when I try to start them up again my character is on top of a random mountain in their underwear and I have no idea what I was doing or why I was there.",778,2025-04-05 01:35:14,sarduchi
gaming,1jrs931,mlh3dcw,Holy shit it's John Skyrim,145,2025-04-05 01:36:06,redraptor117
gaming,1jrs931,mlh4pys,[deleted],88,2025-04-05 01:45:00,N/A
gaming,1jrs931,mlh4uvj,Can’t wait for Skyrim:The Definitivitely Legend Edition for the Switch 2,42,2025-04-05 01:45:55,LynchMob187
gaming,1jrs931,mlh6exx,"You mean 20 characters you meant to play differently, but all of them ended up being stealth archers",19,2025-04-05 01:56:12,hyren82
gaming,1jrs931,mlh3on2,"I can't be trusted with a true open world. 

I NEED some railroading/linearity to my experience. 

When given the choice to do anything, I will usually choose to do nothing....just like real life.",124,2025-04-05 01:38:10,BardBearian
gaming,1jrs931,mlh464x,"download skyrim, install the same 10+ mods, run around the world for 10-20 hours.

repeat yearly",45,2025-04-05 01:41:24,InternalWarth0g
gaming,1jrs931,mlh7atp,"Hyperoptimisation of "" the first playthrough""  is what ruins this.  
That's the mistake many people do in these games is to immediately disregard the main story and jump right into doing every sidequests , minigames , collectables and do deep dives into microlevels of min-maxxing into whatever the game has to offer first. That's why it gets so repetitive. They do this, are stuck playing a low level character for hours, barely find new loot that's useful due to not leveling up and probably fight the same hordes of enemies for hours too. Stop that! Go do the main story in bigger chunks instead of getting lost in side activities after doing 1 mission or so. 

Don't be afraid to not get a 100% on your first playthrough. If you liked the game enough, you will have a better time with character #2 when you know a lot more about the game.

Something I had to re-learn to enjoy longer games again. Railroad yourself into the main plot more.",17,2025-04-05 02:02:04,HaztecCore
gaming,1jrs931,mlh5663,"While in-game tutorials are obviously a thing, I wish games had a ""get reacquainted"" feature so I don't feel the need to start over.",17,2025-04-05 01:47:58,cpt_justice
gaming,1jrs931,mlh3yjk,"Skyrim is one of my favorite games of all time and I’ve logged hundreds if not 1000 hours, but I still haven’t finished the main quest line.",19,2025-04-05 01:39:59,Adventurous-Test-910
gaming,1jppd0d,ml0wmn3,Nintendo Exclusive. Freaking bonkers.,3558,2025-04-02 14:05:13,gimme_that_funkymilk
gaming,1jppd0d,ml0y45u,"The whole time I was like:

- omg bloodborne remaster?
- bloodborne 2?
- okkk bloodborn spinoff?
- Elden Ring Bloodborn?
- ... dinosaurs wtf
- cute rat I guess?

Wtf is this game",923,2025-04-02 14:13:00,StarChief1
gaming,1jppd0d,ml10hcr,"Not only it's apparently a multiplayer title, the trailer highly suggests it uses premade characters like Nightrein too.

Miyazaki has shown interest towards multiplayer titles like Tarkov some years back. I assume this is a result of his new direction.",370,2025-04-02 14:25:07,countryd0ctor
gaming,1jppd0d,ml0wrlr,Genuinely insane if this is exclusive to Nintendo. The madlads.,1605,2025-04-02 14:05:56,Brisslayer333
gaming,1jppd0d,ml0wwq6,I can’t believe we’re getting Bloodborne 2 as an exclusive for the Switch 2.,1290,2025-04-02 14:06:41,Hounds_of_war
gaming,1jppd0d,ml0x2y4,"NGL, I really thought this was a tie-in to Bloodborne. Has all the DNA of the world of Yharnam, familiar locations, and the voice of Mickolash.",635,2025-04-02 14:07:36,ReaddittiddeR
gaming,1jppd0d,ml0x44g,It is insane that FromSofware's next game is exclusive to the Switch 2.,454,2025-04-02 14:07:46,YouThinkOfABetter1
gaming,1jppd0d,ml0x57h,"Jaw-dropped but what the hell is it?   
Miyazaki will give an in depth interview on 4th April",188,2025-04-02 14:07:55,No-Seesaw2384
gaming,1jppd0d,ml0wpew,"Looks unreal, however it does say Switch 2 Exclusive correct? That seems crazy to me",324,2025-04-02 14:05:38,mvanigan
gaming,1jppd0d,ml18rq5,"What is that jet pack, lmao. The dinosaur also seems out of place.",25,2025-04-02 15:06:55,ViktorTheWarlord
gaming,1js5im0,mlju26y,"That explains why Nintendo released lists of incompatible games.
I wonder if nint will keep working to have them available or just give up.",2119,2025-04-05 15:12:02,Valuable-Material742
gaming,1js5im0,mlk0v6y,Is this similar to the Proton layer on Steam Deck?,542,2025-04-05 15:50:28,damafan
gaming,1js5im0,mljyd1r,"Requiring a translation layer doesn’t mean it’s functionally not backwards compatible. At a certain point we’re just being intentionally pedantic. 

That’s like saying Steamdeck is not compatible with most PC games because it requires Proton to run any Windows only game. 

And Proton is similarly not perfect with every game, but it’s generally a good enough solution and it’s something that can improve over time.",911,2025-04-05 15:36:29,takeitsweazy
gaming,1js5im0,mljvtt0,The same interview also says that tested games had less performance issues and loaded faster. Meaning games with performance issues or dynamic res should see a bump on resolution and performance.,189,2025-04-05 15:22:06,bobmlord1
gaming,1js5im0,mlkh0ps,"It's sort-of-kind-of halfway between hardware and software levels of compatibility.  This video can explain it better.

[https://www.youtube.com/watch?v=WVgUe3qSU9k](https://www.youtube.com/watch?v=WVgUe3qSU9k)",16,2025-04-05 17:20:13,DanganJ
gaming,1js5im0,mllv7kw,Non issue,12,2025-04-05 22:04:34,FederalSign4281
gaming,1js5im0,mljuyjq,"This still seems vague as hell, I'm concerned it might result in extra latency",203,2025-04-05 15:17:09,MarkyDeSade
gaming,1js5im0,mljts7h,Lotta words just to say jit,241,2025-04-05 15:10:28,KruNCHBoX
gaming,1js5im0,mljxp7j,In other words it's backwards compatible ,77,2025-04-05 15:32:46,thatnitai
gaming,1js5im0,mlksqk2,"This is like what the Steam Deck does to run Windows games on Linux, via Proton. It's the same principle.",6,2025-04-05 18:24:00,Acceptable_Beach272
gaming,1jw871p,mmgbao6,"I’m the same way. Mainly because I’ll forget where I was, what I was doing, and even the controls. ",2328,2025-04-10 20:43:42,Dr_Mantis_Teabaggin
gaming,1jw871p,mmgc4vz,It's normal for me. lol It's to the point where I know the first act of Baulders Gate 3 like the back of my hand but am totally lost in act 2 and 3. Same with the opening area of Elden Ring.,376,2025-04-10 20:47:46,WouldYouKindly818
gaming,1jw871p,mmgl37q,I think this is just what gaming as an adult is like lol,281,2025-04-10 21:33:22,jmarzy
gaming,1jw871p,mmgbdet,I think that's pretty normal. Trying to remember what you were doing with your build and what all the skills and buttons do while late into the game is a frustrating experience most of the time. Starting over usually smooths that over and it will likely take you less time to get back to where you were since you already have that previous experience.,292,2025-04-10 20:44:05,SirCris
gaming,1jw871p,mmgbypf,"There's a reason why I never finished Witcher 3 lmao.

I'd get so far, put it down for a while and forget how to play it. Get annoyed with myself and say ""I'll just start again so I know what I'm doing"". Get to novigrad or whatever it's called which is a bit of a slog for me and get bored.

I've done this three times I think so far... le sigh lol.",252,2025-04-10 20:46:57,-Drunken_Jedi-
gaming,1jw871p,mmgdv8x,"This is the main reason I have so many unfinished games in my backlog.

Skyrim and Persona 5 are the biggest culprits for me.

I have played the first 5-10 hours of each of them multiple times... Then I fall off, and come back to it months later... Just to play the first few hours again...",27,2025-04-10 20:56:14,WeekendInner4804
gaming,1jw871p,mmgd54n,"""Stopped playing for a few months"", I've done it for less than a week. Most recently was raft.

Was tempted to do it with Elite dangerous after 2yrs of not playing, but my 500hrs kinda convinced me other wise.",16,2025-04-10 20:52:39,roachslayyer
gaming,1jw871p,mmgc87q,"I'd say it's not normal, but my 40+ year one farms on stardew valley would say otherwise",44,2025-04-10 20:48:13,HoraryZappy222
gaming,1jw871p,mmgc2fe,"Very normal, I just end up forgetting how to play",9,2025-04-10 20:47:26,Historical_Proof1109
gaming,1jw871p,mmgf12g,"Not every game, but with some games yeah.",9,2025-04-10 21:01:54,Mojo_Mitts
gaming,1jykwrq,mmzafej,A console going up in price 5 years after launch? Lmfao,1699,2025-04-13 23:47:01,Ub3ros
gaming,1jykwrq,mmz89gf,Remember when console prices use to go down and not up?,2345,2025-04-13 23:33:29,Gammarevived
gaming,1jykwrq,mmz7t2c,"This has got to be the most interesting pricing for a console cycle we've seen. It started off at the lowest and has been increasing since then. I got my digital for $500 cad in 2020. It costing €500 now is insane, and equivalent to ~$750 cad.",1317,2025-04-13 23:30:40,samwise141
gaming,1jykwrq,mmzhstf,"🙄 game companies making excuses to raise prices in regions that aren't even affected by tariffs, smh",481,2025-04-14 00:33:34,Pure_Honey8802
gaming,1jykwrq,mmz76sv,Haven’t Australia and New Zealand suffered enough?,484,2025-04-13 23:26:52,Delicious_Series3869
gaming,1jykwrq,mmzdge8,It’s insane that I got the console on December 2021 for less than what it costs now.,102,2025-04-14 00:05:58,Kyserham
gaming,1jykwrq,mmz93av,Everything goes up except for wages,624,2025-04-13 23:38:39,mal3k
gaming,1jykwrq,mmz6wx0,Why are they increasing elsewhere,249,2025-04-13 23:25:11,MrMxylptlyk
gaming,1jykwrq,mn0cy0e,"Sony can fuck right off with this bs. Currencies slump against the Dollar, they increase the price everywhere except the U.S. The Dollar slumps against every other currency, and these fuckers still increase the price of their consoles everywhere except the U.S.",159,2025-04-14 04:08:31,Kratos_BOY
gaming,1jykwrq,mn1duya,Guess I'm still not buying a PS5 then,28,2025-04-14 10:16:24,SpareZealousideal740
gaming,1jpbfei,mky59ka,"I would have been down for that, like the Markplier Iron lung movie. Wait, where the fuck is that movie?",1987,2025-04-02 00:33:43,Vcheck1
gaming,1jpbfei,mkyuxp9,We were THIS fucking close to finally getting more SOMA content. Fuck.,1113,2025-04-02 03:18:59,Electrical_Knee4477
gaming,1jpbfei,mky8y71,"The video series is already pretty amazing, for anyone curious who might not know that such a thing exists. 

SOMA Transmissions: https://m.imdb.com/title/tt11252208/",413,2025-04-02 00:56:47,BananaResearcher
gaming,1jpbfei,mkycsgl,Here’s the actual video at the right timestamp: https://youtube.com/watch?v=ac2NAW4AHfc&t=285s,128,2025-04-02 01:21:03,RoryJefferson33
gaming,1jpbfei,mky88m7,Early April Fools joke? I’d be really disappointed if it wasn’t because that sounds awesome.,169,2025-04-02 00:52:19,Obsessivegamer32
gaming,1jpbfei,mkzm0ag,:c,19,2025-04-02 07:23:18,AnAncientMonk
gaming,1jpbfei,ml08s2h,Soma is one of my favorites as well but I don't think it needs an animated show. The game told the story perfectly,19,2025-04-02 11:26:09,Xerosnake90
gaming,1jpbfei,mkzyjos,Daaaaamn an animated SOMA show would’ve been amazing :(,36,2025-04-02 09:48:38,HuanFranThe1st
gaming,1jpbfei,ml18k1v,Soma is one of the most depressing stories and atmospheres I’ve ever seen and I mean that in a good way. It encapsulates and encompasses what existentialism and bleak nihilism feels like,15,2025-04-02 15:05:50,Yourfantasyisfinal
gaming,1jpbfei,mkz4iyg,"Soma was really amazing. Super sad to see it didn’t work out, but better it die than become another Electric State",66,2025-04-02 04:33:50,Spawn_Beacon
gaming,1jlbhka,mk27ps8,"I do not share this experience. For me as a kid, when I beat a favourite game, there was no question regarding what to do next - the answer was obvious. ...It's time to start it again from the beginning!

I played through Sonic 3 & Knuckles dozens and dozens of times as as kid. I played through Zelda Link's Awakening multiple times too. And others.
Kids love repeating their favourite things over and over again. Just ask any parent who's sick of watching the same disney film ten times a day.",1019,2025-03-27 19:14:26,BenjyMLewis
gaming,1jlbhka,mk25typ,[deleted],480,2025-03-27 18:56:48,N/A
gaming,1jlbhka,mk2tr3w,[removed],194,2025-03-27 21:38:41,N/A
gaming,1jlbhka,mk3h37l,"When I was a kid, every game was left unfinished. As soon as I'd get stuck, I'd abandon it and start something else.


Fallout New Vegas was my first finished game, and I was a senior in high school when I finished it.",116,2025-03-27 23:35:23,ashyguy1997
gaming,1jlbhka,mk2q94k,It was probably a Commander Keen game for me,28,2025-03-27 21:22:20,SquirrelMoney8389
gaming,1jlbhka,mk3f00p,Pitfall on the original Atari was the first one for me.   Took a Polaroid picture and got the patch from Activision.,25,2025-03-27 23:24:27,bbruin777
gaming,1jlbhka,mk29nug,"Vector-Man on the Genisis.



On the box it said you could win $1,000,000,000 if you beat it but it turned out that you just got an entry into a sweepstakes to win the money but by the time I beat it the sweepstakes had already ended and I haven't forgiven Sega since.",45,2025-03-27 19:39:55,jimmy_talent
gaming,1jlbhka,mk2aioh,"First game I ever really beat was Halo for the Xbox og.  When Chief said, ""We are just getting started"" I was like, AWESOME, LETS GO!....and then the credits rolled and I immediately restarted to play again.

Now, I had ""beaten"" games before, but only stuff like Unreal Championship 1, and Test Drive.  But Halo was my first Credit experience",38,2025-03-27 19:52:09,Decent-Quit8600
gaming,1jlbhka,mk2a0yl,"I don't know if it was the FIRST time, but when you beat the Game Boy version of Tetris on level 9 with high (the level of blocks that started in place on the level) 5 (the highest setting that didn't use Super Heart mode, which I found out from a Kool-Aid package), you got a little cutscene where a band played some music and some dancers danced, before it switched over to a space shuttle launch.

So that version, at least, had an ending.",12,2025-03-27 19:44:56,SidewaysGiraffe
gaming,1jlbhka,mk2gwp6,Starfox 64 for me. I mastered it by probably age 10 lol it was the only game i could beat my uncles in,9,2025-03-27 20:35:40,AssMasterXL
gaming,1k0u9bw,mngyu8a,"There was an old ps3 game, White Knight? You create your own character, and it turns out they’re just always in the background. Felt weird, but I loved the game",2438,2025-04-16 20:29:50,zandariii
gaming,1k0u9bw,mngwy33,Final Fantasy 12 for the most part. You play a POV character but the story 100% revolves around the other characters.,2799,2025-04-16 20:20:30,N/A
gaming,1k0u9bw,mnh6s2z,"Maybe the South Park games (Stick of Truth, Fractured But Whole)? You play as a nameless new kid, but the story is kind of about everyone else",834,2025-04-16 21:09:19,Astro_Queen
gaming,1k0u9bw,mngyfkw,"Mount and Blade: Warband 

It's Jeremus world and we're just living in it",1166,2025-04-16 20:27:47,BostonYankeesBB
gaming,1k0u9bw,mngybss,fire emblem awakening is my first thought,905,2025-04-16 20:27:16,thehero1900
gaming,1k0u9bw,mngwq6y,Soma - he is but he is not,849,2025-04-16 20:19:24,Antulaya
gaming,1k0u9bw,mnh609l,"Here’s an old one, I haven’t played it recently, but at least until the Legion expansion, in World of Warcraft, you character was canonically “and some adventurers/mercenaries/heroes”",532,2025-04-16 21:05:21,nightox79
gaming,1k0u9bw,mngwig7,"The original Marathon games by Bungie. The real protagonist is Durandal, the player character is just a silent, reanimated cyborg helping him out.",397,2025-04-16 20:18:20,AlericandAmadeus
gaming,1k0u9bw,mngxkc1,"Final Fantasy 12. Virtually every character, other than Penello and maybe Fran is more vital to the story/plot than Vaan is, whose plot pretty much wraps up between him and his brother after the tutorial segment.",323,2025-04-16 20:23:31,FewAdvertising9647
gaming,1k0u9bw,mnh7xk7,"Nier: Automata Kind of falls into this, though not neccesarilly in the ""an npc is the *real* protagonist"" kind of way.

>!If you just played the first ending, you'd think 2B was the main character of the series. She's who you play as, and is the posterchild for the whole game. Even in the second playthrough, she's at least *there*. Then you start playthrough 3 and just ""blegh"" dead. And for the next three endings, A2 and 9S are the real focus for the real meat and potatoes part of the game. Even between those two 9S is really the most important.!<",273,2025-04-16 21:15:17,skyshroud6
gaming,1jpp3zr,ml0vr0o,Hiding it in the spare games pile is the most Silksong thing ever,1852,2025-04-02 14:00:25,SirDoober
gaming,1jpp3zr,ml123d0,Time to see the damage to r/silksong,603,2025-04-02 14:33:22,_RRave
gaming,1jpp3zr,ml0um0a,Of course it doesn't get an announcement and was just a short clip.,328,2025-04-02 13:53:59,thebohster
gaming,1jpp3zr,ml1fd9j,"I will believe Silksong is releasing this year when I confirm it on the eshop for download, and not a \*single\* moment before that.",94,2025-04-02 15:40:09,ZT_Ghost
gaming,1jpp3zr,ml0wx8q,ah shit. here we go again 👀,77,2025-04-02 14:06:45,N/A
gaming,1jpp3zr,ml0wbgv,THE SILKSONG IS REAL,75,2025-04-02 14:03:34,minecraft24133
gaming,1jpp3zr,ml0ysxk,A COUPLE SECONDS OF FOOTAGE I'M SKONGING SO HARD,104,2025-04-02 14:16:34,shiftblizz4rd
gaming,1jpp3zr,ml112n4,They said the same thing in 2023 dont forget,95,2025-04-02 14:28:08,KekKeanuReddit100
gaming,1jpp3zr,ml11d0f,"You know what, let me take a look at Silksong sub

Edit: yeah, they are going crazy",48,2025-04-02 14:29:36,SatyrAngel
gaming,1jpp3zr,ml16ok7,I'll believe it when i can play it.,25,2025-04-02 14:56:24,naoak
gaming,1jqrslx,ml9fv3t,What a pointless thing to do that makes absolutely no fucking sense. Just use the likeness of the people who worked on the game or something.,1126,2025-04-03 20:26:56,VagrantandRoninJin
gaming,1jqrslx,ml99isf,lmfao I KNEW it was Paradise. What a scam.,292,2025-04-03 19:56:14,HoodGyno
gaming,1jqrslx,ml96ix0,AI + Streamers... The most uninteresting and useless combination of recent times.,1598,2025-04-03 19:41:41,SlickRick734
gaming,1jqrslx,ml98u0i,Max Headroom streamers incoming.,100,2025-04-03 19:52:56,Beytran70
gaming,1jqrslx,ml9g4ci,"Streamers are probably the last people you want to copyright. They got money to burn, and that lawsuit gonna cost you more than it costs them",130,2025-04-03 20:28:10,TomSuga
gaming,1jqrslx,ml96wxm,This is like hammering two turds together.,132,2025-04-03 19:43:38,Quetiapine400mg
gaming,1jqrslx,ml9cwso,"Man, AI chuds really think the world is their's to plunder, don't they?",68,2025-04-03 20:12:33,GenericFatGuy
gaming,1jqrslx,ml9gz9p,"Wow, this is months old information. The guy who bought this all to light made his Youtube videos close to 6 months ago.

Did new info just come out today? Oh, I see, there's a demo now? Looks pretty much what we expected, a terrible looking asset flip.",30,2025-04-03 20:32:19,Earthbound_X
gaming,1jqrslx,ml97lnw,"Was it called ""Vapid"" ?",20,2025-04-03 19:47:00,Underwater_Grilling
