subreddit,post_id,comment_id,comment_content,comment_score,comment_created_at,comment_author
music,1jr8abw,mldh0u4,"Before his comedy career, Phil Hartman of SNL, was a graphic designer and did a few of the Poco album covers. I just think that's a neat little fact.",14,2025-04-04 13:49:53,Sh0ckma5ter
music,1jr8abw,mlcqc70,Crazy Love will always be one of my favorite songs.,11,2025-04-04 10:49:36,dswpro
music,1jr8abw,mlcnxet,"Nostalgia band for me, reminds me of Hot Summer nights down by the Missouri River drinking beer & listening to a.m. radio….ah the early 80s…",7,2025-04-04 10:27:43,hotbutteredsole
music,1jr8abw,mlcrop6,Wasn't Poco the Triple A team affiliated with the Eagles?,5,2025-04-04 11:01:04,powdered_dognut
music,1jr8abw,mlczy1i,"Used to head over to the T Bowl in Orlando in the late 70's for the summer afternoon shows. Bob Seeger, Hall & Oates, Poco, Pablo Cruise. Sweating in the middle of a Florida afternoon with the sound just crashing over us all.",5,2025-04-04 12:03:38,geekitude
music,1jr8abw,mlcmv6y,I inherited a collection from my friends dad and there is a LOT of Poco. I despise the Eagles sound so it hasn't clicked with me. I can't do that kind of soft rock. So if anybody wants a big bundle of Poco records just pay me shipping 🥲 ,4,2025-04-04 10:17:35,FoggyInc
music,1jr8abw,mlcrjrv,"Thanks for the info and reminder / introduction to Poco! I'll definitely go check out their other stuff, this one is the only song I've heard, I think?

https://youtu.be/cGEBXL11THc?si=FHi7MqRfYYSRWSev",4,2025-04-04 10:59:54,starfire89
music,1jr8abw,mlcsaq8,"I'm not sure how I started listening to the band, it must've been a rec from a forum post on underrated bands.

I listened to their greatest hits album and I was shocked that I had never heard any of their songs on the radio before. They are as good if not better than the Eagles.

I also like that they had a character named after the band in Jojo's Bizarre Adventure, the writer Hirohiko Araki has great taste in music.",5,2025-04-04 11:06:09,WHALE_BOY_777
music,1jr8abw,mlcu5wz,"Poco fan, listening right now - Shoot for the Moon

https://open.spotify.com/track/4JuWSuPTxSWhxactc73T5X?si=DozBpNVaTDu8veF7nZ9eZg",4,2025-04-04 11:20:59,Deep-Recording-4593
music,1jr8abw,mlczpwh,"I think it was 1978 or so, I met this girl and “our” song was crazy love. I bought the album legend and I was a fan from then on out. I will say that for my taste they were a bit hit or miss in likability, they either had a whole album fife with great material or just one some I liked, but I stuck with them. Fast forward to a concert in Columbus Ohio at I think it was called the underground and, sound was not too good and they left the format of a traditional concert with everyone standing up and playing to a more intimate approach of even sometimes sitting on the stage dangling their feet over the edge talking and playing. Most memorable concert I have been to. Insmorata is still my favorite album",4,2025-04-04 12:02:02,Breezyviolin
music,1jsk4hb,mln7fr7,I wish I could upvote this post to the moon. Very happy to see an Utah Phillips mention. ,13,2025-04-06 03:19:42,Flannelcommand
music,1jsk4hb,mlnbznj,"“Forget about the bum on the rod, worry about the bum on the plush.”",8,2025-04-06 03:53:35,zen_cricket
music,1jsk4hb,mln7aje,"I love Utah.  A poet for the working man.  ""All Used Up"" is probably my favorite U. Utah song, but ""Phoebe Snow"" and ""Goodnight Loving Trail"" are way up there as well.  He could sing a train song, a protest song, or country song as easy as anyone, and what a storyteller.  Absolutely brilliant!",8,2025-04-06 03:18:37,Naive_Elk4941
music,1jsk4hb,mlnghix,His daughter sent me a bunch of recordings as a thank you years ago. Had never heard of him before. Became a fan.,5,2025-04-06 04:27:49,myriadsituations
music,1jsk4hb,mlngqdd,My absolute favorite folk musician. His long preambles are my favorite.,3,2025-04-06 04:29:50,WillFortetude
music,1jsk4hb,mlnfqmn,"I haven’t thought about that album in a long time, but I’m glad you reminded me of it.",3,2025-04-06 04:21:53,lowfreq33
music,1jsk4hb,mlp1a34,"What I do is, I collect stories...",2,2025-04-06 13:19:46,HoodGinga
music,1jsk4hb,mlpcejo,Rock Salt and Nails is a good one…..,2,2025-04-06 14:27:36,ackackakbar
music,1jsk4hb,mln46kh,"I enjoy his music, and I listen to his stuff every May Day, but many tracks of his have long preambles of story or monologue. When I'm in a music listening mood that stuff narrows down what of his I'll play. Guthrie, Baez, Seeger, Glazer, McCutcheon, Feeney don't have the same problem for me.",3,2025-04-06 02:56:00,roytheodd
music,1jsk4hb,mloywb7,"It's a masterpiece that I don't hear many people talk about. Love it, and Utah. His Moose Turd Pie story is amazing. ",1,2025-04-06 13:03:19,edgarpickle
music,1jnryfg,mkm91xd,What a cool mofo,6,2025-03-31 01:43:34,MyVoiceIsElevating
music,1jnryfg,mkm9yq4,yea this guy was good.,6,2025-03-31 01:49:21,rdhdpsy
music,1jnryfg,mkmwtje,"First time seeing this live, amazing they had such an awesome flute player even live!",3,2025-03-31 04:32:53,FondantNo7807
music,1jnryfg,mkmxg41,This version goes so much harder than the album version,3,2025-03-31 04:38:11,AmidoBlack
music,1jk9m0n,mjtfla7,I was talking about him the other day. Whose gonna keep the parody game strong when he's gone,8,2025-03-26 11:43:20,LCODB
music,1jk9m0n,mju550y,Man I remember the Bobbit story being EVERYWHERE for quite a while,8,2025-03-26 14:18:49,BelieveInTheShield
music,1jk9m0n,mjv816p,"So funny remembering that story of the guy who got flogged in Singapore for acting like a dipshit.

Edit: Just looked it up holy shit I'm old, that was over 30 years ago  
[https://en.wikipedia.org/wiki/Caning\_of\_Michael\_Fay](https://en.wikipedia.org/wiki/Caning_of_Michael_Fay)",4,2025-03-26 17:29:31,Stevie_Rave_On
music,1jk9m0n,mjtjmbt,They got 2020s era Rick Rubin 3 decades early in the audience there.,3,2025-03-26 12:12:07,StreetwalkinCheetah
music,1jk9m0n,mjuujqy,"Great cameos by Doug Llewelyn (The People's Court host), Dr. Demento, and Judy Tenuta.",2,2025-03-26 16:25:26,writenroll
music,1jk9m0n,mjvtdcw,The original was a bit of a parody in it's own way lol.,2,2025-03-26 19:12:07,RaymondLeggs
music,1k5fqjl,mohkxx1,What a career,9,2025-04-22 19:57:01,devenrc
music,1k5fqjl,mohlxfa,I'm just going to carry on as if nothing really matters.,5,2025-04-22 20:01:51,512Buckeye
music,1k5fqjl,moizo9j,The Cars 1st album too. His drum sound and vocal harmony layering techniques are legendary!!,4,2025-04-23 00:27:44,DomerCRM114
music,1k5fqjl,moi450l,I'd imagine Bohemian Rhapsody sounding quite fast at 78. RIP.,5,2025-04-22 21:32:40,Logical_Bat_7244
music,1k5fqjl,mohmwix,Legend,3,2025-04-22 20:06:40,Junkstar
music,1k5fqjl,mohlu33,RIP,2,2025-04-22 20:01:24,InvestmentFun3981
music,1k5fqjl,mojaj8y,"Literally, involuntarily said ""Oh, no!"" out loud.  His Cars records were very important to a pubescent me.  Sad day, sad day.",2,2025-04-23 01:31:33,blackjacktarr
music,1k5fqjl,mojq7mu,May Roy Thomas Baker rest in peace.,2,2025-04-23 03:05:41,Ricardolindo3
music,1k5fqjl,monb08p,"It's a sad, sad day for music production. He made so many great records but I'll single out Jazz by Queen. The drum sound on Don't Stop Me Now still sounds effin' amazing after all these years. RIP legend",1,2025-04-23 17:56:44,northern_boi
music,1k5fqjl,moiypgk,"Tragedy today, as producer Roy Thomas Baker was eaten by wolves. He was delicious.",0,2025-04-23 00:22:05,DrMartinVonNostrand
music,1k4wi78,modeznq,"LOL, Gasmask is a genre.  Mike Patton sure does use it a lot with Tomahawk.",6,2025-04-22 03:20:33,cycoivan
music,1k4wi78,modl7h2,This song is a masterpiece that remains a perennial favorite for me.,6,2025-04-22 04:03:32,FandomMenace
music,1k4wi78,moh0x7m,John Stanier is a god,2,2025-04-22 18:17:50,theplayerpiano
music,1k4wi78,mom8vta,I will always upvote this absolute banger.,2,2025-04-23 14:53:32,willogical
music,1k4wi78,moflcui,We loved to perform this and leave the crowd totally bewildered!!,2,2025-04-22 14:06:15,smaksandewand
music,1k4wi78,modkoua,Dillinger Escape Plan has entered the chat.,-5,2025-04-22 03:59:49,BitchesGetStitches
music,1k0wzrl,mnhj1ut,I can barely get out of bed each day at 46 and these geezers going on a world tour. Damn.,20,2025-04-16 22:16:09,Eastiegirl333
music,1k0wzrl,mnk2lfm,Bummed there are no PNW shows. My mom raised me on Alice and it would be great to take her to a show.,2,2025-04-17 09:38:57,stephwithstars
music,1k0wzrl,mniku4c,I saw both last year so I shouldn't complain but I am sad they aren't coming to Minneapolis,1,2025-04-17 01:58:55,thatmusicguy13
music,1k0wzrl,mnjkjin,Im genuinely curious as to who's going to play lead guitar for Judas Priest with Richie Faulkner having the health issues he's going through,1,2025-04-17 06:31:20,xzether
music,1k0wzrl,mnil2we,Remember the Coop!,0,2025-04-17 02:00:21,Stratomaster9
music,1jthsj9,mlwrlxc,Structural collapse is an interesting way of saying incompetent festival organizers jacked a scissor lift to max height and added a giant sail to it.,12,2025-04-07 19:03:16,pancakes78
music,1jthsj9,mlvfbm2,That's horrific. RIP to them,3,2025-04-07 14:57:57,InvestmentFun3981
music,1jsrip4,mlol7rj,I know the perfect person for this!,7,2025-04-06 11:10:16,Fritzkreig
music,1jsrip4,mltttvl,A rare non-Lonely Island song I need as a single,2,2025-04-07 07:24:12,HowlingHipster
music,1jsrip4,mlxczwj,Portlandia did it first (and it had Danzig lol),1,2025-04-07 20:53:54,helvetin
music,1jsrip4,mlq2o1z,Kenan Thompson needs to retire.,-65,2025-04-06 16:51:04,stubborn1diot
music,1jopwam,mktqh4n,"'Walk This Way' by Aerosmith.... Some 10 years later, their re-recording with Run DMC was a massive worldwide hit, revived the career of Aerosmith, and was super influential in popular culture.

  
Bonus hair metal point: 'Here I Go Again' by Whitesnake. Recorded twice, a bigger hit second time around.",330,2025-04-01 08:31:47,GuitarHenry
music,1jopwam,mktre9y,"a bit niche, but 90s skate-punk band Pennywise released a song on their self-titled debut album called ""Bro Hymn"" It was written by the band's bassist Jason Thirsk about friends of his that died. Tragically a few years later, Jason Thirsk died, and the song was re-recorded in honour of him and released on their 1996 album Full Circle as ""Bro Hymn Tribute""",111,2025-04-01 08:42:40,detourne
music,1jopwam,mktunit,"Cornershop- Brimful Of Asha was a minor chart hit, but after Norman Cook helped them with a remix, it became a massive hit that still gets regular radio play.",64,2025-04-01 09:20:12,Mackem101
music,1jopwam,mku184v,"Pet Shop Boys released their first version of ""West End Girls"" in 1984, which was a minor club hit. They released a new version produced by Stephen Hague in 1985, which is the one that went to number 1 in several countries

Similarly, A-ha released the first version of ""Take On Me"" in 1984 to no attention, then reworked it and released the new version in 1985 (but still little attention). But the label saw potential so they created the iconic video, and then did a second release in 1985 of the reworked version, finally hitting chart gold",64,2025-04-01 10:30:09,Palpablevt
music,1jopwam,mku6cmb,"""Wild Thing"" sampled Van Halen's ""Jamie's Crying""  
""Funky Cold Medina"" sampled the Rolling Stones' ""Honky Tonk Woman""

The tempos are different. Never once thought they were the same song.",123,2025-04-01 11:16:37,_Silent_Android_
music,1jopwam,mktop9w,"The Beatles had the single Revolution and Revolution 1 on the White Album. 


The Revolution single was hard rocking while Revolution 1 was acoustic and a bit more doo-wop. Same song though. ",35,2025-04-01 08:11:08,mfmeitbual
music,1jopwam,mktqjs6,Do Black Eyed Peas count? [You know which song.](https://youtu.be/LrkEc2V3mO4?si=YGufAqw1dXErzk8x),43,2025-04-01 08:32:41,orbitalchimp
music,1jopwam,mku6n90,"Chubby Checker has basically an entire section of Wikipedia on all the versions of The Twist he released: 

>Checker re-recorded the song numerous times. An updated 1982 recording (from his album *The Change Has Come*) was retitled ""T-82"", and in the 1990s, he recorded a [country](https://en.wikipedia.org/wiki/Country_music) version. In the late 1970s, he recorded a new version that, except for the sound mix and some minor arrangement changes, was identical to the 1960 original; as a result this later version is often misidentified on compilations as the original recording. In 1988, he joined [The Fat Boys](https://en.wikipedia.org/wiki/The_Fat_Boys) on a rap version of the song, which hit number 2 in the UK, number 16 in the US, and number 1 in Germany and Switzerland. Checker also joined the group to perform the song that summer at [a London tribute concert](https://en.wikipedia.org/wiki/Nelson_Mandela_70th_Birthday_Tribute) for [Nelson Mandela](https://en.wikipedia.org/wiki/Nelson_Mandela).[^(\[17\])](https://en.wikipedia.org/wiki/The_Twist_(song)#cite_note-stars-17) In addition, he recorded variations on the theme, such as ""[Let's Twist Again](https://en.wikipedia.org/wiki/Let%27s_Twist_Again)"" to keep the craze alive (""Let's Twist Again"" was and has remained more popular than ""The Twist"" itself in the United Kingdom).",21,2025-04-01 11:19:07,solinvicta
music,1jopwam,mktwn11,Sweetest Thing by U2. It was a b side to “Where the Streets Have No Name” in 1987. Re-recorded and released as a single in 1998. This was a chart hit and the version you probably hear 99.9% of the time.,43,2025-04-01 09:42:30,Brodiggitty
music,1jopwam,mktn8cz,Every Chuck Berry song.,49,2025-04-01 07:54:19,OlDirtyBathtub
music,1jo93pa,mkqrxed,"Oh gosh,  RZ were formative for me back in college. Their record *Villa Elaine* remains one of my all-time favorites.",3,2025-03-31 20:11:16,InfernalWedgie
music,1jo93pa,mkskwtz,Aren’t they most well known for the Smallville opening credits song?,5,2025-04-01 02:21:49,VampireHunterAlex
music,1jo93pa,mks12i3,"My wife introduced me to that band and their album Villa Elaine, and it is pretty good!",3,2025-04-01 00:18:49,Micahman311
music,1jo93pa,mksnhws,Remy Zero? I haven't heard that name since *Smallville*.,2,2025-04-01 02:38:28,theprophecysays
music,1jo93pa,mkv2ja8,"Remy Zero was great, listened to Villa Elaine and The Golden Hum in high school so much.",1,2025-04-01 14:42:46,topplehat
music,1jo93pa,mkws8bm,I was the LD with *Thievery Corporation* when this was at its peak and the soundtrack really gave the tour a boost.,1,2025-04-01 19:59:08,citizenjones
music,1k3z6jn,mo681up,"I don't disagree with you about the value of full albums.

But I also don't really care about Spotify stats at all.  

I fear it might be a pretty narrow subsection of people who both care about Spotify stats AND value full album experiences.  

I wouldn't mind if they published the stat you're looking for, but I'm not sure they'd get much benefit out of doing so.  

I think for me my wish is just that more people would value full album experiences in general.",25,2025-04-20 23:44:32,FaceInJuice
music,1k3z6jn,mo6xqhr,"But this has always been true. 


The biggest hits in terms of single sales and radio play rarely comes from the best albums. 


If anything, it is the making of albums that is anomolus in the history of music. 


I mostly listen to albums, but sometimes life gets in the way of making it the whole way through. So how do you measure that in your stats?",3,2025-04-21 02:17:26,KrawhithamNZ
music,1k3z6jn,mo85lhr,"I would love to see the data on full album listens, and that’s how I prefer to enjoy music. 

I think the album is still valued but singles are always going to be the focus for big pop acts.",1,2025-04-21 08:37:47,JimFlamesWeTrust
music,1k3z6jn,mo878mw,"It's definitely misleading but it's also the best equivalent we have to album sales since people were buying albums because of a few singles. There's never been charts for what you're talking about because the money makers have always been the singles, and people in general don't care about albums.",1,2025-04-21 08:55:01,Analord2
music,1k3z6jn,mo6mh01,"I'm expecting that were seeing the end of ""albums"" as we know it.  Bands will release tracks individually, and only release album collections much later if at all.",-5,2025-04-21 01:09:50,Underwater_Karma
music,1jzbs5q,mn4zyw9,In honor of Katy Perry's trip to space.,17,2025-04-14 22:23:16,DeathLeopard
music,1jyyv1l,mn397y9,I’m more of an NWH guy.   “What we sayin’ is ‘Yo!  We got hats MF!’”.,3,2025-04-14 17:02:54,Differentdog
music,1jyyv1l,mn27al7,They should do a cut where they back Weird Al and call themselves Men With Hard Hats,1,2025-04-14 13:48:46,SPMusicProduction
music,1jyyv1l,mn2jgy3,I prefer the literal version [https://www.youtube.com/watch?v=QMGodM0zm8k](https://www.youtube.com/watch?v=QMGodM0zm8k),1,2025-04-14 14:53:38,hamageddon
music,1jyyv1l,mn3u5za,I like this single version better than the album version,1,2025-04-14 18:45:29,harlotstoast
music,1jyyv1l,mn2r4pa,"This butthole keeps saying he can dance, but its like... he can't dance.",1,2025-04-14 15:32:39,ExistingTheDream
music,1jpxc18,ml2qbf1,This whole concert is cool: [https://www.youtube.com/watch?v=GJ9xnaCWGZE&ab\_channel=GorillazLiveArchive%28formerlyGZ23%29](https://www.youtube.com/watch?v=GJ9xnaCWGZE&ab_channel=GorillazLiveArchive%28formerlyGZ23%29),4,2025-04-02 19:27:32,blackfeltfedora
music,1jpxc18,ml3hwaf,"Always loved this track, especially the spooky acoustic interlude.",5,2025-04-02 21:39:54,Yuli-Ban
music,1jpxc18,ml30mi8,Gorillaz are so good.,2,2025-04-02 20:16:50,dunkzilla
music,1jnbbk0,mkih1rz,"Decades of listening to music will do that to you. About twice a year though I get really excited about something new that reminds me why I’m into music so much. 

Make sure to listen to lots of different genres.",13,2025-03-30 13:11:32,lookingtobewhatibe
music,1jnbbk0,mkiehlm,Go see live music from bands you’ve never heard,15,2025-03-30 12:53:41,Evelyn-Bankhead
music,1jnbbk0,mkic8dz,I felt like this and then a few months ago I fell down a YouTube rabbit hole for a band called Cardiacs from the 80s/90s and I was in love again. No idea how I had never heard of them before.,7,2025-03-30 12:37:12,Critical_Trash842
music,1jnbbk0,mkie0kp,"Based on my experience, I hope you are like I was and it's just nothing moved you for a while.


I felt similarly for a few years, still listened to a lot of stuff of varied genres. Some was definitely good and what I should like. But it didn't scratch an itch, I didn't connect. 


I still threw all this stuff on playlists which seemed to make things worse where it felt like I was encountering stuff I should like but felt was mediocre. 


Then in the space of a couple of weeks, about 3-4 years ago, I found both Ghost and MUNA which both really got me where I needed them too. I loved both but realising I could find stuff I could properly love that hard made me appreciate other music all the more and just feel kinda optimistic again",3,2025-03-30 12:50:17,Stueykins
music,1jnbbk0,mkimq31,"Yes--fewer and farther between artists that blow my mind as I've gotten older.  Maybe because the longer you are around, the harder it is to find something unique?",2,2025-03-30 13:48:37,Meow_My_O
music,1jnbbk0,mkjq8pe,"Yes, but I'm almost certain it's due to listening to most things only once as an effect of living in the streaming era",2,2025-03-30 17:20:45,GreenZebra23
music,1jnbbk0,mkjsaa3,"I still fall head over heels a lot, but a lot of the newer recommendations just dont fully land for me.

Here are a few examples of some jaw droppers you can try: 

Birds by dominique fils-aime (jazz singing)

Teletype by everything, everything (brit art rock)

Magic mountain by hollow ship (psychedelic rock)

Highway in the wind by arlo guthrie (bob dylan style folk)

The album if your feeling sinister by belle and sebastian (modern indie folk)

The album odessey and oracle by the zombies (60s psychedelic pop)

Ping pong by armin van buuren (edm)

Deep jungle by astrix (psytrance)

Free tibet by vini vici (also psytrance)

The album khemtrails by khemist (rap and he only has like 500 monthly listeners so you can jumpstart a career. Sounds like childish gambino, kendrick and drake all mixed together.)",2,2025-03-30 17:31:07,Haasonreddit
music,1jnbbk0,mkm070h,"I’m 60 and did not want to become one of those people who only listened to music they discovered in their youth. I work from home and let Apple Music play all day. While it hasn’t turned me on to tonnes of new music, I have found a handful of artist which I really love (Charlotte Adígery; Mandy, Indiana; PVA; julie, etc.). 

I think the lesson is you have to seek it out as you get older.",2,2025-03-31 00:47:18,forkboy_1965
music,1jnbbk0,mkicsmr,"I just discovered  Rabih Abou-Kahil and Ahmed Abdul-Malik. Just last year I discovered Hoodna Orchestra, The Funk Ark, and I finally took the deep dive into Fela Kuti’s discography. Well, at least up until Africa 70 walked out in him.  So, no.",1,2025-03-30 12:41:28,ThemBadBeats
music,1jnbbk0,mkictbi,"My tastes have changed as I got older but I still like the stuff I grew up on too. Lately, I’ve been listening to a variety of different stuff. 

Allman Betts band, Jackson Stokes Band, North Mississippi All Stars, JJ Grey & Mofro, Horse Cave Trio, The Red Clay Strays.",1,2025-03-30 12:41:36,music420Dude
music,1jms5w3,mketcnk,"I haven't heard this in years!  thanks for taking me back. If you like these guys you'll like Dicks, a punk band from Austin in the 80s. Maybe you've heard of them.",2,2025-03-29 20:28:38,Haunting_Try_5043
music,1jms5w3,mkfcty2,Always great!,2,2025-03-29 22:18:43,Vathi
music,1k3xgfy,mo5rrn6,"My girlfriend in high school thought the Pearl Jam song was ""Can't Find the Butterman."" Still married her for some reason.",58,2025-04-20 22:05:34,RUKiddingMeReddit
music,1k3xgfy,mo617fl,"When I was little I thought AC/DC was chanting ""Thirty thieves and the thunder chief!"" I can't even bring myself to sing the right words 30 years later.",42,2025-04-20 23:03:33,MDubbery
music,1k3xgfy,mo5tsos,"Owner of a lonely horse (Yes)

A year has passed since I broke my nose (The Police)",22,2025-04-20 22:17:55,MeditatingElk
music,1k3xgfy,mo5yq4p,"Diary of Jane, Diarrhea Jane.",22,2025-04-20 22:48:22,Zakimus
music,1k3xgfy,mo6475x,"Destiny’s Child Independent Women had one.

Real lyric.

The shoes on my feet (I bought it)

The watch I’m wearing (I bought it)

How I heard it:

The shoes on my feel (I farted)

The watch I’m wearing (I farted)",18,2025-04-20 23:21:28,archieologist518
music,1k3xgfy,mo6330o,"My baby sister would sing ""Ah ah do it like a lady!""",14,2025-04-20 23:14:44,refinnej78
music,1k3xgfy,mo5wlfl,"Not so much misheard but mis-remembered. The other night my roommate wanted me to put on the Beatles song that goes ""I like you, you are so fat."" Any guesses what he was talking about?",12,2025-04-20 22:35:12,FakeLittleLiarBirds
music,1k3xgfy,mo5rows,"For months I was certain that a line in “Mourning Palace” by Dimmu Borgir went ‘Is this the guardian of the gravy’ even though I thought it seemed wrong right from the start.

Yes, they had printed lyrics in the booklet but they were pretty much unreadable due to the background and the colour of the text. And no, I didn’t get internet until months later.

But when I finally got access to the internet I was quick to look up the lyrics and finally found out that the proper lyrics were ‘In this garden of depraved beings’.

Not even close..",10,2025-04-20 22:05:07,Clown_Wheels
music,1k3xgfy,mo5z9af,"When my daughter was a toddler Gwen Stefani's Hallaback Girl instead of beginning ""uh huh it's my shit, it's my shit"" was""it's mooshy it's mooshy""

My wife who speaks Spanish as a first language swore Beck's Loser lyric was ""soooooo close the door.  I'm a loser baby""",10,2025-04-20 22:51:36,night_breed
music,1k3xgfy,mo61xif,"Megadeth classic: “You try to take his BAaAAlLs” Hendrix: “Actin’ funny, but I don’t know why. Scuse’ me, while I kiss this guy” ",8,2025-04-20 23:07:54,NMA6902
music,1jrt5oj,mlhhcam,I like Colin Hay's acoustic version of Overkill more than the Men at Work version.,101,2025-04-05 03:12:33,rimshot101
music,1jrt5oj,mlhb3zy,"Plush, Stone Temple Pilots",71,2025-04-05 02:28:05,Bliss-Smith
music,1jrt5oj,mlhat40,"just my personal opinion feel free to disagree 

Everlong - Foo Fighters 

Until The Day I Die - Story Of The Year 

Tears Don’t Fall - Bullet For My Valentine",56,2025-04-05 02:25:58,EstrogenL0ver
music,1jrt5oj,mlhawbt,Foo Fighters - Everlong,63,2025-04-05 02:26:34,jeweynougat
music,1jrt5oj,mlhamut,[deleted],59,2025-04-05 02:24:45,N/A
music,1jrt5oj,mlhee47,Overkill by Men at Work.  Featured on an episode of Scrubs.,17,2025-04-05 02:51:09,Chaosmusic
music,1jrt5oj,mlhbf82,"With all due respect to the late D. Bowie, acoustic version of The Man Who Sold the World covered by Nirvana kicks the ass out of the original.",82,2025-04-05 02:30:18,undergroundbastard
music,1jrt5oj,mlhj0hw,The entire Nirvana MTV Unplugged set slaps. Every song on there meets or exceeds the original,42,2025-04-05 03:25:08,Ethanol_Based_Life
music,1jrt5oj,mlhupcv,Eric Clapton's Layla from his unplugged album.,14,2025-04-05 04:59:47,Itorres89
music,1jrt5oj,mlhkevl,"I hate most covers, but Chris Cornell's acoustic version of ""Nothing Compares 2 U"" (written and first recorded by Prince, made famous by Sinead O'Connor) is a masterpiece.",38,2025-04-05 03:35:53,RamonaAStone
music,1jp6bst,mkxn5db,Cool song…I like 👍🏻,5,2025-04-01 22:45:12,slh63
music,1jp6bst,mkx4ksr,Sounds like they covered a Franz Ferdinand song.,6,2025-04-01 21:01:28,Active_Sock177
music,1jp6bst,ml0boio,"Killer song, I love the vibe and drumming.",2,2025-04-02 11:48:52,magicbaconmachine
