subreddit,post_id,comment_id,comment_content,comment_score,comment_created_at,comment_author
music,1ju3xc4,mm244si,🙌,2,2025-04-08 16:30:16,haunted_haus25
music,1jsp7c7,mlsqjqe,Wonderful,1,2025-04-07 01:59:31,Gullible_Key6660
music,1jsp7c7,mlo44tf,"One of the best live performances.

Do i dare say it? I think I do. One of the best live performances ever.",0,2025-04-06 08:08:03,reessagny
music,1jrmz2r,mlfzfo9,Love Cat Power,2,2025-04-04 21:30:57,MileenasFeet
music,1jqgugo,ml6sj1y,it should have gotten a 10 tbh,12,2025-04-03 12:19:19,chamberk107
music,1jqgugo,ml6v2xn,I remember when a Pitchfork review could make or break an album,5,2025-04-03 12:36:19,RaisinBran21
music,1jqgugo,ml6zsmo,"Pitchfork used to be in my browsers url autocomplete, I was lost in the hipster sauce


Related, I've been listening to Tapes n Tapes - The Loon again a bunch lately and it deserves to be an all timer from this era",7,2025-04-03 13:05:27,ThinkThankThonk
music,1jqgugo,ml6y8bo,"Needle dick cheap tear downs of anything not ""cool"" enough but was really friend connected bullshit. This dork ass imprint launched a dozen loser wealth trash garage bands that are now in the dustbin or in teenagers dms like that piece of garbage from The Strokes.",10,2025-04-03 12:55:54,CokeDigler
music,1jqgugo,ml7puq3,Pitchfork has always been hipster trash and impossible to take seriously.,5,2025-04-03 15:22:31,inkyblinkypinkysue
music,1jqgugo,ml6te99,The pitchfork mix that Optimo produced is a work of genius but cannot be found anywhere in the Internet,2,2025-04-03 12:25:07,doctor6
music,1jqgugo,ml8bzx4,"Bought this album despite not knowing anything about him other than I'd heard a few NP songs and liked some. I made this purchase thanks to Pitchfork, and I hated it. Thought it was the smarmiest music I'd ever heard. Obviously my opinion didn't align with popular opinion.",2,2025-04-03 17:11:15,_themaninacan_
music,1jqgugo,ml6vqnf,"“You see your pitchfork I-rock saviors
And I'm sorry I still prefer Jim Neighbors
And damn they're looking ugly to me
Damn they're looking ugly to me”",1,2025-04-03 12:40:35,ol_dirty_applesauce
music,1jqgugo,ml8p0hj,[Pitchfork gives music 6.8.](https://theonion.com/pitchfork-gives-music-6-8-1819569318/),1,2025-04-03 18:14:09,Planet_Salesman
music,1jp1tzm,mkxv0dw,"Where'd the ""how to leave a label,"" part come from?",3,2025-04-01 23:31:02,zachtheperson
music,1joczii,mks314m,Not my favorite song from the first and only album of CTA. 🚊,1,2025-04-01 00:30:53,Chocolat-Pralin
music,1jlyzvp,mk7htiv,"Just putting this here - I miss you dad. Wish you could have met the grand kids (your grandson is just like you, it’s kind of amazing) 

Hope you’re resting well.",5,2025-03-28 16:25:02,yojoewaddayaknow
music,1jjbezf,mjm66k3,"From Wikipedia:

On February 27, 1968, Lymon was found dead on the floor of his grandmother’s bathroom from a  overdose with a syringe by his side. Lymon was only 25 years old.

Such a sad end.",4,2025-03-25 06:41:28,chuckerton
music,1jjbezf,mjluwyv,"Always loved the harmonies in this one! 

I’ve never seen this video, though. Could those pathetic girls look any more disinterested? So rude!",3,2025-03-25 04:51:03,LexiiConn
music,1jiphy3,mjinp0z,Is this the best bass line of all time?  It's gotta be top 5.,1,2025-03-24 18:10:39,NubbinSawyer
music,1k2jojo,mnuoc7a,"My old radio had Lateralus stuck in the deck.

They'd be like ""What a tool.""",6,2025-04-19 00:34:45,Allaplgy
music,1k2jojo,mnuzut2,"I lost about 20+ of my favorite 90s CDs in a wreck so now I basically carry a bunch of greatest hits CDs around.

Airlifted to hospital, by the time I was out and I thought of it they was long gone. The worst thing is I still have all the cases to remind me.",6,2025-04-19 01:47:17,CrispyDave
music,1k2jojo,mnun2jo,"I can't say I'm super familiar with your CDs, just the artists. Based on that, you seem like a chill dude/dudette! Perhaps you enjoy getting high. 


I've got 10 CDs in my car.  One by Alien Ant Farm, two by Deftones, three by Purity Ring, three by Kælan Mikla, and one by Nine Inch Nails. Sad boy, I suppose. They'd be right.",3,2025-04-19 00:26:43,DaytimeLanternQQ
music,1k2jojo,mnv0014,One day you'll just be glad that you weren't in an accident and not give a hoot what anyone thinks about your taste in music.,3,2025-04-19 01:48:13,N/A
music,1k2jojo,mnv9rgz,I’ve had Tom Jones Greatest Hits stuck in my cd player for 4 1/2 years. I wonder what that says about me.,3,2025-04-19 02:52:53,DStew713
music,1k2jojo,mnvjd8z,"Radiohead - The Bends  
Queens of the Stone Age - Songs For the Deaf  
The Beatles - The White Album  
Nofx - The War on Errorism  
Primus - The Brown Album",3,2025-04-19 04:03:30,PrimusSkeeter
music,1k2jojo,mnutthx,"If you get in a car crash and your radio is up loud, be sure to turn it down. The tow driver told the cops my radio was up loud when I rear ended somebody.",5,2025-04-19 01:09:27,DarkSociety1033
music,1k2jojo,mnun77m,"I would probably think you were cool for still listening to cd’s, not just on Spotify. I think there’s something intentional about physical format music, the increased audio quality and support of the artist as well. As for your taste in music, sure dog whatever you’re into. Not my exact flavor but that’s cool.",2,2025-04-19 00:27:32,J_Nastyyyy
music,1k2jojo,mnuxvym,"I almost was turned into a sandwich when a trailer rear ended my car at 45MPH and when the shock wore off I realized that despite my car being crumpled ""New Freezer"" was still playing. I never even liked that song to begin with 😭",2,2025-04-19 01:35:10,CallMeB001
music,1k2jojo,mnuyzqt,[The Artist in the Ambulance](https://g.co/kgs/5ymN1Ja),2,2025-04-19 01:41:52,VictoriousRex
music,1k29k3r,mnsluwk,Loved this song,4,2025-04-18 17:42:41,dmilesai
music,1k29k3r,mnt8n37,Their new album is awesome. Sounds like summer.,5,2025-04-18 19:40:02,ikickedagirl
music,1k1oi6o,mnnq79a,Cool song🤘,3,2025-04-17 21:42:31,Mission-Pie-9953
music,1k1oi6o,mno9l3s,"Much prefer Bruce's original, but the live performance with Springsteen and Tom Morello is next level.",3,2025-04-17 23:31:33,partylange
music,1k1oi6o,mno5yfc,Joad?,0,2025-04-17 23:10:38,AnthMosk
music,1k0r9ir,mng8r6c,Uninvited,85,2025-04-16 18:18:42,ListenTHANSpeak8
music,1k0r9ir,mng86wt,"The hidden track on jagged little pill

https://www.youtube.com/watch?v=GAR-Bcs0PH4",50,2025-04-16 18:15:53,SummerMummer
music,1k0r9ir,mng8ypy,"Uninvited. Saw her perform it live, and it was beautiful and raw.",26,2025-04-16 18:19:46,poopfacelarry
music,1k0r9ir,mngevbu,“That I Would Be Good” feels pretty raw,17,2025-04-16 18:49:45,Acceptable-Fold-3192
music,1k0r9ir,mngc507,"""You Oghtta Know"" ...man she HATED Dave Coulier.",17,2025-04-16 18:35:47,zzyzx2
music,1k0r9ir,mngh8p1,"Maybe.... Right Through You.  Was never even a single, but it's my favorite song on Jagged Little Pill",14,2025-04-16 19:01:51,Echo127
music,1k0r9ir,mngpmhr,My vote is Uninvited.  Haunting.,10,2025-04-16 19:44:25,Jazzlike_Penalty5722
music,1k0r9ir,mnhrezc,"Joining You. It's a song she wrote after her friend's failed suicide attempt.

But really just listen to the entirety of the Supposed Former Infatuation Junkie album.",7,2025-04-16 23:03:19,MaxxDelusional
music,1k0r9ir,mng9rux,Reasons I Drink,1,2025-04-16 18:23:47,PatentGeek
music,1k0r9ir,mngbup5,"Princess Familiar for me. “Please be just like my…”

This Grudge is pretty subtly raw too.",2,2025-04-16 18:34:18,karlverkade
music,1jwbhdo,mmh5rlx,That golden voice still has me mesmerized all these decades later. What a beautiful and sexy rendition of this song,3,2025-04-10 23:29:02,nickscorpio74
music,1juh1fj,mm2088z,"Any Stereolab is good Stereolab. Never heard this one, so thank you for sharing!",3,2025-04-08 16:10:48,simagus
music,1juh1fj,mm453io,New?,1,2025-04-08 22:28:35,IntegrateandOptimise
music,1jtqu5a,mlx07u3,R.I.P. Clem Burke,2,2025-04-07 19:48:04,Evelyn-Bankhead
music,1jqfan7,ml6hidg,"Hardcore - where the bands make up a big part of the audience of most shows.

Hardcore - rich kids singing about how the world sucks

Hardcore - straight edge… until you’re not",-3,2025-04-03 10:57:06,Udosari
music,1jqd4m5,ml91pmc,Cameos from singer Cy Curnin and guitarist Jamie West-Oram of The Fixx in this video! 👍,3,2025-04-03 19:17:36,theweightofdreams8
music,1jqd4m5,ml6qcw2,[Did you know that's a cover?](https://www.youtube.com/watch?v=Hmh7AhAKzpw),2,2025-04-03 12:04:15,Anal-Love-Beads
music,1jq5p9o,ml5pmg3,"> This music video is almost 20 years old  

MY BACK!",1,2025-04-03 06:13:05,eddmario
music,1jq4xzz,ml5tbec,"Johnny giving advice through his music that would still be useful today (but quite a bit more difficult). 😄
R.I.P., Johnny - we still miss you! 🙏",2,2025-04-03 06:49:46,theweightofdreams8
music,1jq30tm,ml559ue,Great song -- my favorite for karaoke.,1,2025-04-03 03:25:44,Orcapa
music,1jnnpxb,mklabk7,"I really dislike the fact that a lot of the time, the only version of an album you can find is the deluxe 40 track edition with demos/mono versions/outtakes etc. Like broh, I just wanna listen to the OG album, please.",26,2025-03-30 22:12:35,Argus_Checkmate
music,1jnnpxb,mklnkqy,"Youtube and Spotify are the 2 worst ways to listen to music. CD's, Apple Music, Tidal, Amazon Music, Qubuz all offer high quality music. It is not snake oil, you can hear it on car radios and earbuds, especially with symbols and voices. But that's just a place to start, lots of music is remastered by default on those platforms. 

CD's started being marketed as remastered in the late 90's so they would be loud enough on crappy boomboxes and CD players, and they almost always ruined the sound quality in the way you describe, loud and boomy and bassy and overproduced with the highs cut off. You want to find the releases with the matte black plastic spine. Rush and Judas Priest were particular offenders for butchered remasters, Painkiller was unlistenable.",2,2025-03-30 23:30:09,N/A
music,1jnnpxb,mkm8j59,"If you want to hear the original and best-sounding masters of your favourite pre-2000s songs, the old CDs from the '80s / '90s are the way to go. 

As you have noticed, modern remasters on streaming often have the dynamic range squashed to sound 'louder' on bad quality equipment.",1,2025-03-31 01:40:16,NowtShrinkingViolet
music,1jnnpxb,mknchsp,"It was surprising to me to hear this first hand comparing albums from streaming and old albums. I thought it was exaggerated, but comparing two albums were actually different.

I wonder if it is done intentionally? Why would musicians want lower quality versions of their music? Do they alter the music for some reason for different mediums? 

What is the file type for 24 bit music? .WAV? What portable players can play that?",1,2025-03-31 07:01:10,chinoswirls
music,1jnnpxb,mkzedd0,"And justice for all by Metallica and raw power by The Stooges are two albums which I vastly prefer the original mix. The remasters are technically a better mix, but they are not the way that the artist released the albums and they are not the way I originally heard the songs. These are two of my favorite albums, and I absolutely hate that most streaming services only have the remastered versions. I can hear the difference immediately and I hate it.",1,2025-04-02 06:02:24,ColonelBlairToast
music,1jnnpxb,mklxgkc,"For the best quality, you typically want the 24bit versions of songs, which you can stream or purchase online. Not because 24bit is technically better or more capable than 16bit, but rather because we in the audio engineering world put the best sounding masters out as 24bit for discerning listeners, and hyped/mangled versions out as 16 bit and mp3 quality to provide instant gratification for the masses. ""24 bit"" is essentially a proxy for ""we didn't distort the fuck out of this version"".

CD releases will tend to have the same 16bit masters as Spotify/Youtube, just with less artifacts - i.e. they will be just as loud, unless you go hunt secondhand stores for old copies from the early 90s.

Vinyl can *sometimes* sound better than 24 bit releases, but it's fairly rare. Music gets so hugely twisted when physically carved into vinyl that to make a 24 bit digital release sound worse than vinyl, the engineer really has to be a muppet.

There are some esoteric physical formats like dsd, but they are rare and expensive, and of very marginal improvement over a 24bit stream.

Qobuz is my service of choice for 24bit streaming. It's very seldom I find myself wanting to listen to a different master to what they have.",1,2025-03-31 00:30:02,f10101
music,1jnnpxb,mklxr9e,Its been remastered for a reason.,-3,2025-03-31 00:31:53,tactslave
music,1jnbai6,mkitszq,"If I'm 555, well by golly, that means you're 666.",1,2025-03-30 14:29:54,DjCyric
music,1jmtj31,mkehuoa,"I believe the answer is compression, and the trend towards tighter, more compressed mixes to get the “punchiest” possible sound. Punch = attention grabbing = streams/radio play/etc.

If everything is mixed to be up-front and in your face, a byproduct for some people is that it may also sound flatter and narrower. This is of course far from a universal rule and you can find plenty of current artists creating wide, rich soundscapes. But it’s true as a general trend in mainstream music, and especially rock. 

A good anecdote for this: some buddies and I did mushrooms and put on Abraxas by Santana and went on an absolute journey. When the album ended, it auto-played straight into Smooth by Santana featuring Rob Thomas and the change in vibe was JARRING. Super compressed, tight 2000’s pop. It pulled us right out of the moment and we even started poo-pooing on the decline in quality, but after a minute or so our ears adjusted and we ended up bopping SO hard to Smooth. So yeah, for better or worse it’s a thing.",28,2025-03-29 19:25:37,sonofsteffordson
music,1jmtj31,mkeg85g,Sounds like you’re experiencing both sides of the [Loudness War](https://en.m.wikipedia.org/wiki/Loudness_war).,52,2025-03-29 19:16:33,zsh_n_chips
music,1jmtj31,mkeg9rw,"You see, When you were young everything was big. Now you are big and the music is the same size, but you perceive it as smaller. Learning this is just a part of growing up. In time you will understand grasshopper.",35,2025-03-29 19:16:48,IllustriousAnt485
music,1jmtj31,mkeg831,Could this be the [loudness war](https://en.m.wikipedia.org/wiki/Loudness_war) at work?,7,2025-03-29 19:16:33,mopslik
music,1jmtj31,mketdmk,"You don't really sound like ""someone who really has no idea what they are talking about"", but more like an audiophile with a complaint about modern music vs the vintage.",3,2025-03-29 20:28:47,Badbobbread
music,1jmtj31,mkegctw,Changes in the way music was recorded and mixed.  Older music was mastered a lot quieter for one thing.,2,2025-03-29 19:17:17,Md655321
music,1jmtj31,mkf1co4,When you say “modern music”…which modern music?,2,2025-03-29 21:12:43,rthrtylr
music,1jmtj31,mkf8zba,"Not just the loudness war, but the techniques used in mixing. People don't pan things like they used to. So much of our music consumption occurs without a properly stereo setup, so people mix in a way where a mono output will still have everything. I play an old Beatles track on my phone and the hard-panned drums might go missing for whole songs at a time.",2,2025-03-29 21:56:19,Cbasg
music,1jmtj31,mkee8f9,Sounds like you need to turn it up a little bit.,5,2025-03-29 19:05:41,Impossible_Okra_8149
music,1jmtj31,mkehuxw,"People are talking about audio quality but I know what you’re saying. My guess as a layman would be modern production/mixing style, techniques, and equipment make for a fuller sound.",5,2025-03-29 19:25:40,pierrechaquejour
music,1k5er80,mohkeib,Thomas Dolby has some great songs beyond She Blinded me with Science which tends to get most of the attention.,5,2025-04-22 19:54:24,numsixof1
music,1k3ppcp,mo53r8v,Fucking Classic,2,2025-04-20 19:49:30,zsreport
music,1k1x9if,mnpov2c,"The song ""Strawberry"" by Butthole Surfers features an extended sample of a man speaking Navajo at the end, which is also used in Manowar's ""Spirit Horse of the Cherokee."" This connection highlights the band's experimental approach and their incorporation of diverse cultural elements into their music, reflecting a broader trend in alternative rock during the early '90s.

* [Independent Worm Saloon - Wikipedia](https://en.wikipedia.org/wiki/Independent_Worm_Saloon)
* [Butthole Surfers -- ""Strawberry"" (1993)](https://2or3lines.blogspot.com/2013/02/butthole-surfers-strawberry-1993.html)
* [Butthole Surfers – Strawberry Lyrics - Genius](https://genius.com/Butthole-surfers-strawberry-lyrics)

^(This is a bot made by [Critique AI](https://critique-labs.ai). If you want vetted information like this on all content you browse, [download our extension](https://critiquebrowser.app).)",0,2025-04-18 05:22:37,critiqueextension
music,1k1ilpp,mnv69lp,"I saw them live one time, just kind of randomly. 

I had no idea who they were or what kind of music they played.

Pretty damn impressive.

I also really liked this track by them:

The World Is Our _____

https://youtu.be/yEZGZ7LpCuk",2,2025-04-19 02:29:00,NeuxSaed
music,1k0x1u4,mnlnib3,One of my many finds songs on the album.,2,2025-04-17 15:36:03,NeighborhoodLeft2699
music,1jzs5ou,mncp277,Awesome song.👍,2,2025-04-16 03:40:15,Mission-Pie-9953
music,1jysp5t,mn1mbvp,I love discovering new music and these guys are completely new to me. Amazingly tight performance! Thank you for sharing. 😎,2,2025-04-14 11:30:13,Jisp_36
music,1jysp5t,mn1xhpc,Hendrix of the dunes,2,2025-04-14 12:49:34,Long-Confusion-5219
music,1jyf1zn,mmy5ccp,"I wiiiiiiish weeeee had, a joooooiiiint soooo baaaaad",2,2025-04-13 19:53:55,synthscoffeeguitars
music,1jyf1zn,mmxy3u8,I like Cheap Tricks take on this a little better,1,2025-04-13 19:14:56,Evelyn-Bankhead
music,1jxsyj3,mmt25h4,You got to eat a banana while performing this! 🍌,1,2025-04-12 22:36:52,heyyouthere18
music,1jwpn9x,mmkcb9w,Go Go Jason Waterfalls!,5,2025-04-11 14:03:31,The_Powers
music,1jwpn9x,mmk4rr5,It's hard for me to listen to this song and not think about Michael Keaton's performance in The Other Guys. Cracks me up every time.,3,2025-04-11 13:23:02,withoutlebels120
music,1jwpn9x,mmkq56o,![gif](giphy|C3hTmx1EsMhpqrkf0y),2,2025-04-11 15:12:36,N/A
music,1jwpn9x,mmlhbxo,"I would accept R&B or pop but calling this hip-hop is a stretch.     

Somebody rapped in it! Well, it must be hip-hop then.",2,2025-04-11 17:25:52,Ghostofjemfinch
music,1jv5pd7,mm7i9x9,English speaker and I can’t understand half the lyrics without reading them either lol,66,2025-04-09 13:27:36,vigilantesd
music,1jv5pd7,mm7wiie,Congratulations! You are a perfectly normal person.,8,2025-04-09 14:41:54,MagnusCromulus
music,1jv5pd7,mm7lxs2,"Nobody understands song lyrics.  If you want to find out what they are, just look them up online, and then you can read through them as the song plays.",15,2025-04-09 13:47:46,HortonFLK
music,1jv5pd7,mm8ogw1,"Sung lyrics are notoriously easy to misinterpret, even for native speakers of the language. There's even a term for this, [Mondegreen](https://en.wikipedia.org/wiki/Mondegreen). These are some of the more famous examples of Mondegreens:

""There's a bathroom on the right"" (the line at the end of each verse of ""[Bad Moon Rising](https://en.wikipedia.org/wiki/Bad_Moon_Rising_(song))"" by [Creedence Clearwater Revival](https://en.wikipedia.org/wiki/Creedence_Clearwater_Revival): ""There's a bad moon on the rise"").

""’Scuse me while I kiss this guy"" (from a lyric in the song ""Purple Haze"" by [The Jimi Hendrix Experience](https://en.wikipedia.org/wiki/The_Jimi_Hendrix_Experience): (""’Scuse me while I kiss the sky"")

""The girl with [colitis](https://en.wikipedia.org/wiki/Colitis) goes by"" (from a lyric in the [Beatles](https://en.wikipedia.org/wiki/The_Beatles) song ""[Lucy in the Sky with Diamonds](https://en.wikipedia.org/wiki/Lucy_in_the_Sky_with_Diamonds)"": ""The girl with kaleidoscope eyes"")

These days you can pretty much find any lyrics online. The online interpretations might not even be correct, but they'll be close.",5,2025-04-09 16:59:20,hospicedoc
music,1jv5pd7,mm7mmue,This is not a you problem. This is a general problem with listening to lyrics. No one understands song lyrics without a lyric sheet. Don’t beat yourself up for this - it’s completely normal.,9,2025-04-09 13:51:27,DrBlankslate
music,1jv5pd7,mm7lsxb,"Read them, learn them, then enjoy them being sung. 
Nobody can understand a lot of Dylan's singing but most agree his lyrics are good",3,2025-04-09 13:47:04,Severe-Delay6037
music,1jv5pd7,mm7q4qx,"Practice practice practice.


Listen to songs while reading the lyrics
Watch movies in English with subs
Speak more to native English speaker
Stop listening to brutal death metal",3,2025-04-09 14:09:38,IPoisonedThePizza
music,1jv5pd7,mm8fl05,"I'm a native English speaker and I could never understand most song lyrics as a kid or teen. The worst are Bob Dylan and Bruce Springsteen, both of whom write incredibly great lyrics and sing like they are gargling.",3,2025-04-09 16:15:51,Tabitheriel
music,1jv5pd7,mm7vnwk,"It’s actually a good way to develop your ear for English. Singing will test the ranges of pronunciation and dialects. Read the lyrics and listen, and it may help your English development.",2,2025-04-09 14:37:40,Rich-Wrap-9333
music,1jv5pd7,mm81l57,"Maybe it's just normal for most people with first language as English? I can hear most lyrics, but sometimes there are parts where I can't hear it. It all depends on what kind of music you're listening to, I think. Maybe try read the lyrics while listening to music and see if you can understand it the next time?",2,2025-04-09 15:06:45,BeautyDisaster107
music,1juk0wo,mm3ponx,🫶,2,2025-04-08 21:06:42,haunted_haus25
music,1jugm8b,mm1utqb,Seminal record. In my top 20 of all time.,1,2025-04-08 15:44:05,No_Sink_5606
music,1jtztup,mlycj1c,I had forgotten all about that one.  Used to love that song. Back before autotune when the singer had to actually know how to sing and create a harmony.,5,2025-04-08 00:15:42,chrisinvic
music,1jtztup,mm0tt1s,"Synth pop?  Really?

  
Icehouse are soft aussie rock.",1,2025-04-08 12:21:18,Wotmate01
music,1jt1cpf,mlr1isf,"do you think he's just totsally ripping ass, as he walks by? and thats his real downfall?",-1,2025-04-06 19:56:04,InevitablePoetry52
music,1jsyils,mlq2a9w,She’s so beautiful in this video!,2,2025-04-06 16:49:01,slh63
music,1jsyils,mm2dqmx,belinda briefly played drums for l.a. punk band the germs. i always thought this was cool.,2,2025-04-08 17:16:55,Mighty_Poonan
music,1jnj89k,mkk7z7c,Holy fuck what an insane song! These guys are so fuckijg good!,5,2025-03-30 18:50:00,Horror-Potential7773
music,1jnj89k,mkk82y7,I’m down with all the Mastodon being posted today.,5,2025-03-30 18:50:32,superkickpunch
music,1jnj89k,mkkvq05,Mastodon fucking rips. This is the song that got me into them.,4,2025-03-30 20:51:56,Chance_Marketing9685
music,1jljbd1,mk3z56n,I always thought this was ACDC.,1,2025-03-28 01:14:42,Old_One_I
music,1jkmtvj,mjwpcrp,"Will not miss this one! I saw both Burton and Bachman solo last year and it was fantastic. Grew up with this music, can’t wait to see them together again!!",2,2025-03-26 21:43:24,cryptonewb23
music,1jkmtvj,mjwr2l9,"My goodness! After last year, I never would have expected such news! I’ll have to think about seeing them if they come close by. 👍",2,2025-03-26 21:52:08,theweightofdreams8
music,1jkmtvj,mjwsyhk,"Here's a pretty fun Guess Who reunion show from...checks watch...42 years ago.  It's a pretty fun watch. I don't know that these guys still have this in them 40+ years later.

[https://youtu.be/AfPXAPOjPdc?si=-57sn7pB5fV\_eD56](https://youtu.be/AfPXAPOjPdc?si=-57sn7pB5fV_eD56)",2,2025-03-26 22:01:48,DevinBelow
music,1jkmtvj,mjxj5ty,Bachman Cummings Overdrive!,1,2025-03-27 00:22:51,Zenon7
music,1jkmtvj,mjxuy5s,"""Im not about to die letting Michael Cera have the last word, that hairless twink!""",1,2025-03-27 01:30:44,Decabet
music,1jjqvj8,mjqizpy,Dee Snider has been going hard right wing these last few years. So he can kick rocks.,-2,2025-03-25 22:29:22,IrrelevantLeprechaun
music,1jjqbjp,mjrt78e,Classic,1,2025-03-26 02:47:39,Gullible_Key6660
music,1jjkax2,mjnvaiz,still slaps!,2,2025-03-25 14:51:08,LoveStreams617
music,1jj9h4g,mjlet40,A real tour de force! Great song,2,2025-03-25 02:51:24,Chocolat-Pralin
music,1jj78yu,mjl5j8y,Brings back memories.,4,2025-03-25 01:54:13,ss_lbguy
music,1jj1w8z,mjm8xa7,Oops! You have entitled “Enjoy The Silence” as “People Are People”! 😄 It’s ok - both songs are great!,2,2025-03-25 07:11:00,theweightofdreams8
music,1jj1w8z,mjjp8o7,Classic,1,2025-03-24 21:10:06,tired-of-all-yall
music,1k50qe7,moednor,**Crimson and Clover** intercoursing with **Wild Thing**.  Awesome.,5,2025-04-22 08:30:25,ZorroMeansFox
music,1k50qe7,moegrbn,Remember being so giddy when I first discovered/heard this as a teen. Gonna re-listen now. Thanks 😁,3,2025-04-22 09:04:27,kaia-papaya
music,1k3vyz3,mo5pwa9,"The background vocals remind me of ""Marijuana in your brain"" by Lords of Acid",2,2025-04-20 21:54:28,elcucuey
music,1k3rufu,mo4wgfh,This album turns 20 in a handful of weeks…,2,2025-04-20 19:08:36,VampireHunterAlex
music,1k3fi99,mobi3ux,"It’s great. So is the original. And my personal favourite is the wonderful cover by The Stranglers. To be fair, Bacharach and David were a pretty remarkable pair of writers.",1,2025-04-21 20:49:19,NeighborhoodLeft2699
music,1k3d9ax,mo1ghkl,Always gives me chills.....,3,2025-04-20 04:02:15,TacoFromTheAlley
music,1k11n4b,mninj6h,Geezers Need Excitement.,5,2025-04-17 02:15:23,ceejaydee
music,1k11n4b,mniy2y9,The nostalgia is almost too much to handle,3,2025-04-17 03:23:43,skialldayerrday
music,1k11n4b,mnkbiga,Let's put on our classics and we'll have a little dance shall we?,3,2025-04-17 10:59:55,HAMforPastry
