comment_id,content_id,platform,content,created_at,score,author,source_name
monyblu,1k6873j,reddit,this also includes foreflight,2025-04-23 19:49:50,21,gimp2x,news
moo7bo0,1k6873j,reddit,"I first thought that said ""Jeppson's"" and I was confused about why Boeing even owned the famous company making Malört...but it wouldn't be out of the ordinary for a plane manufacturer to own a company that makes a liquor that tastes like fuel for some type of vehicle.",2025-04-23 20:33:16,24,lod001,news
moq53yt,1k6873j,reddit,That will float them one quarter maybe.,2025-04-24 03:02:10,3,chrisagiddings,news
mjvmcih,1jkguxp,reddit,Unfortunately [it looks like they didn't make it](https://www.theguardian.com/us-news/2025/mar/26/soldiers-missing-lithuania),2025-03-26 18:38:00,94,DeathwingAdeptus,news
mjw5g4u,1jkguxp,reddit,">The US army later said that a vehicle used by the soldiers had been found submerged in water, adding that the search for the missing troops continued.

>“The M88 Hercules armored recovery vehicle the four missing US soldiers were operating during a training exercise has been located in Lithuania,” it said in a statement.

This happened close to me during an epic sand storm during the 2003 Iraq invasion. An Abrams was crossing a river and went over the edge of the bridge crossing into the water and no one noticed because the sand storm was so bad. It landed upside down and the crew wasn't able to open the escape hatch to get out.

A horrid way to go.",2025-03-26 20:11:05,99,2HDFloppyDisk,news
mjw85gi,1jkguxp,reddit,Reminds me of the 2020 incident where 9 drowned. Scary stuff,2025-03-26 20:23:19,18,howdiedoodie66,news
mjvpbnu,1jkguxp,reddit,Thanks Trump! So much winning,2025-03-26 18:52:24,-44,xFiLi,news
mjx4043,1jkguxp,reddit,"Why did trumpfs shitty leadership lead to 4 dead Americans during a training exercise??... This is truly disgraceful. 


trumpf and hegseth should both resign immediately due to this desecration of our service members. ",2025-03-26 23:00:24,-24,prodriggs,news
mjwms44,1jkguxp,reddit,Loose lips sink ships.,2025-03-26 21:30:07,-25,bornlasttuesday,news
mnxa62c,1k2rgdw,reddit,"Damn, someone wanted that dude dead. Blew up the whole block.",2025-04-19 13:32:21,22,DeathStalker00007,news
mo27tzw,1k2rgdw,reddit,My first thought was meth lab.  After reading the article...well that's still a possibility.  Although I would expect different preliminary charges if there was a drug lab.,2025-04-20 08:23:04,5,misogichan,news
mo4xuze,1k2rgdw,reddit,"I expect better from the BBC:  They state the body of a 53 year old man was found, later identified as...

How did they know the man was 53 years old before he was identified.  It should read:  The body of a man was found, later identified as 53 year old....",2025-04-20 19:16:27,2,the_eluder,news
moa9myp,1k2rgdw,reddit,"House asplode.

Just happens sometimes. Vacuum fluctuations and particle creation/annihilation.

No way to predict.",2025-04-21 17:11:48,1,Sensitive-Option-701,news
mo49nl3,1k2rgdw,reddit,"What does ""arrested, questioned, and bailed"" mean in a criminal justice context for the UK?  

In the US they're supposed to have evidence to arrest you, but in practice that can often be quite thin.  After arrest they can question you (albeit with you having the right to remain silent).  Depending on how that goes they can formally charge you at which point the prosecution needs to show a judge they at least have some real evidence, the judge can either disagree and you're done or the judge can set or deny bail.  (This is not 100% accurate, it's all somewhat more complicated).


To me ""bailed"" implied they had enough evidence to charge him, but at least around here there is next to no chance they'd let someone out on bail if you were accused of murdering someone with explosives unless you had some very very expensive lawyers.",2025-04-20 17:08:29,0,Dillweed999,news
mm713he,1jur87t,reddit,"I'm sorry, could we expand on the part where ""a fight broke out in the tower""!?",2025-04-09 11:39:21,57,shiftingtech,news
mm8ct8v,1jur87t,reddit,"Per the article: 

>The new details, first reported by CNN, renew concerns about the safety of military and commercial aircraft operating in close proximity and raise new questions about whether air traffic controllers in the nation’s capital are too stressed in the wake of the worst US air disaster in decades.

Should say

...whether air traffic controllers in the nation’s capital are too stressed in the wake of ~~the worst US air disaster in decades~~ *the dismantling of several US government agencies*.",2025-04-09 16:02:05,44,Draano,news
mm6wdma,1jur87t,reddit,They still have air traffic controllers??,2025-04-09 11:03:01,13,kolkitten,news
mmcjk54,1jvr7bw,reddit,"A lot of international articles about the Treaty have been bad, but this one is actually quite good. This bill, if passed, would have - among many bad things - allowed one man, a member of a minority party (ACT) to unilaterally rewrite the founding document of our country at the detriment of indigenous people. 

When the time came for consultation on the proposal, more people wrote submissions against the bill than voted for ACT in the first place.

I am so glad that it was stopped",2025-04-10 06:38:15,146,MedicMoth,news
mmcjlid,1jvr7bw,reddit,"Well, now kiwis know which 11 people in their parliament to never vote for again.",2025-04-10 06:38:37,78,LeClubNerd,news
mmd2uy4,1jvr7bw,reddit,"Some info about the guy who fronted the bill, David Seymour:
- Ties to Atlas network, a global right wing libertarian “think tank” that he continues to deny has any influence on him despite starting his political career working in one of their organisations and appearing at their events. One of his biggest donors, a matter of public record, is the mother of the Atlas CEO, but whenever one of them is asked about if they feign ignorance and call it a conspiracy theory. 
- New Zealand has extremely high rates of child poverty, the previous government set up a school lunch scheme. David Seymours first large political act after getting into government was to dismantle the school food programme and replace it with slop from a company that was found to be serving horse meat. 

Theres so much more, unfortunately.

His party still appeals to way too many voters, especially fringe voters who feel unheard by the progressive parties or the very old and stale moderate conservatives.",2025-04-10 10:03:36,13,MysteriousDesk3,news
mmck2nq,1jvr7bw,reddit,"As a Kiwi, I’m so proud of how New Zealand has embraced the Māori culture and language so fully, especially since I now live in the US, where they tend to treat Native Americans and their cultures in a very different way. Mostly as mascots for their sports teams or cigarette brands. I miss Aotearoa.",2025-04-10 06:43:22,44,N/A,news
mmctbol,1jvr7bw,reddit,"More people submitted opposition to the bill than voted for ACT.

By around 20,000 people.",2025-04-10 08:22:01,12,Aun_El_Zen,news
mmcwdwn,1jvr7bw,reddit,"fucking aye!!! fuck outta here you racist cunts, fuck off out of NZ, proud if my country telling these dog cunts to fuck right off David Seymore is a piece of garbage the dude doesn’t deserve the right to call himself kiwi hes a coward racist with zero policy’s that matter and a face that only fists could love",2025-04-10 08:55:59,15,Cliffcastle,news
mn3b77x,1jz393x,reddit,So this is an actual scunthorpe problem,2025-04-14 17:12:46,76,Xaroin,news
mn5hrex,1jz393x,reddit,A Government’s confidence in keeping the fires going.   GOAT metaphor,2025-04-15 00:06:27,5,Kokophelli,news
mn3jo15,1jz393x,reddit,"Would this potentially be an opportunity to build a nuclear powered foundry?

Update from using coke to cleaner fuel.

I'm not sure what buying the plant from the Chinese firm would look like, and I hesitate to suggest 'nationalizing' it but if the company that bought it did so in bad faith with the intent to close it that's grounds to start the discussion.",2025-04-14 17:53:23,15,inucune,news
mn3osvh,1jz393x,reddit,"> The site produces the majority of rail tracks used by Network Rail. The company said it does not expect ""any impact on the continued delivery of reliable rail services"" as it built up a stockpile of steel in anticipation of the plant's possible closure.

> On Sunday, Business Secretary Jonathan Reynolds said it ""became clear"" to the government that Jingye was intent on closing down the blast furnaces no matter the financial support offered, prompting it to recall Parliament to pass the emergency law wresting control of the site from its owner.

Wow, didn't even offer to buy the company, just voted to steal it. That's a very public step backwards in commercial ownership rights. (Edit) I know the government offered half a billion pounds but when they knew the current owner was going to close, they voted to take it instead of upping their offer to a buyout price.",2025-04-14 18:18:30,-36,Daren_I,news
mjy8scp,1jko34t,reddit,"Aurora Borealis!? At this time of year, at this time of day, in this part of the solar system, localized entirely within Neptune??",2025-03-27 02:54:25,27,Fantastic_Fox_9497,news
mjwuuul,1jko34t,reddit,"""great detail""

*Adds some green low res noise.*",2025-03-26 22:11:52,23,ChromaticStrike,news
mjztkgx,1jko34t,reddit,"I read that aromas, and was really confused understanding that this is not the year 3000 yet",2025-03-27 11:36:36,3,thatnextquote,news
mjy9atq,1jko34t,reddit,Not for long,2025-03-27 02:57:43,1,RatherBeBowin,news
mnerddf,1k0b4mc,reddit,"Edit your headline:

""Two Service Members Lives Wasted on Needless Political Spectacle""

  
Accidents happen. Accidents happen all too often when you place young men & women in situations where they are tasked with operating heavy equipment and machinery while overburdened, fatigued, in austere conditions. A military life is not always a safe life. They weren't drafted, they volunteered, but that's no reason to exploit their commitment to service by placing them in an environment that makes accidents like this more likely. 

Make no mistake, the entire Border mission is a political show to appease the current administration. The US Army is not trained to conduct these operations, nor is it part of their roles as defined in current military doctrine. Border security is the responsibility of Customs and Border Patrol - something this government continues to fail to remember. If CBP is unable to perform their duties, it should NOT fall upon the Armed Forces to pick up their slack. A Stryker (like the one depicted in the photo attached to this article) is overkill and wasteful for the role assigned, which would be under normal circumstances be performed by a CBP officer in a CBP Ford Expedition or similar SUV. Which perfectly encapsulates the overwrought optics of this whole sideshow.

Two Americans died, needlessly, in a situation they should never have been in. Contact your Representatives.

\- A Retired Officer",2025-04-16 13:56:31,266,ofWildPlaces,news
mnex131,1k0b4mc,reddit,"One time, I was camping near the border, driving along a two track road that was frequented by military and border patrol agents. I saw a truck approach from the opposite direction, and pulled as far to the side as I could to let them pass. 

They proceeded to run full speed into an ironwood tree, completely wrecking their nice, new truck. I pulled past them, and, kind of in disbelief, asked the driver if they were okay. A man in military fatigues, who looked like he had been up for days on Bang! Energy or experimental military-grade amphetamines, said to me, “that’ll buff right out”. 

I wonder if this accident was something like that. ",2025-04-16 14:26:03,37,Readecv,news
mnfmz26,1k0b4mc,reddit,And the Trump body count increases yet again.,2025-04-16 16:34:34,18,Incontinento,news
mnfu56c,1k0b4mc,reddit,Let's see if the orange shit stain even acknowledges these soldiers.,2025-04-16 17:09:07,11,justhavingfunMT,news
mng90u9,1k0b4mc,reddit,This reminds me of the band of brothers episode after Germany surrenders. They keep having non-war related issues because the soldiers are idle. No evidence that this was the same kind of accident (alcohol related I mean) but it sure sheds a different light on the consequences of using soldiers for political theatre.,2025-04-16 18:20:03,3,I_am_pooping_too,news
mnj3iip,1k0b4mc,reddit,Trumps gonna say they were killed by Venezuelans,2025-04-17 04:03:05,1,kolkitten,news
mngcu89,1k0b4mc,reddit,Must have been a DEI hire.,2025-04-16 18:39:23,1,GoWest1223,news
mkzn9h8,1jpiszv,reddit,"“The parade, held every year on April 1, drew thousands of Assyrians from Iraq and across the diaspora, who marched through Dohuk in northern Iraq waving Assyrian flags and wearing colorful traditional clothes.

Witnesses said the attacker, who has not been officially identified, ran toward the crowd shouting Islamic slogans.

He struck three people with the axe before being stopped by participants and security forces. Videos circulated online showed him pinned to the ground, repeatedly shouting, “Islamic State, the Islamic State remains.”

A 17-year-old boy and a 75-year-old woman suffered skull fractures. A member of the local security forces, who was operating a surveillance drone, was also wounded. All three were hospitalized, local security officials said.”",2025-04-02 07:37:46,37,thelife3,news
mkzoxhe,1jpiszv,reddit,wtf is wrong with people,2025-04-02 07:56:53,19,MarlonShakespeare2AD,news
ml2ga1y,1jpiszv,reddit,"No, but Bernie & AOC did. They should all get on the road.",2025-04-02 18:38:30,-26,Zoey_0110,news
mm4b4ca,1juob5p,reddit,"Donnie gets to run memecoin scams… perfectly legal, perfectly cool",2025-04-08 23:02:52,108,Busty_Ronch,news
mm4hrbp,1juob5p,reddit,Well we know where the next unreported fraud will be.,2025-04-08 23:40:17,31,Q-ArtsMedia,news
mm4l687,1juob5p,reddit,The irony of shifting to fraud 😂,2025-04-08 23:59:45,26,ToysandStuff,news
mm4mzoz,1juob5p,reddit,"They already work for Trump, terrorism and fraud are a given",2025-04-09 00:10:25,25,MentokGL,news
mm4tbks,1juob5p,reddit,I bet the crypto bros lobbied hard for this...,2025-04-09 00:47:37,10,DoubleBroadSwords,news
mm4vl88,1juob5p,reddit,"They're not going to regulate crypto, but ARE going to regulate fraud? They're literally the same darn thing! ",2025-04-09 01:00:56,17,HappyFunNorm,news
mm7hnvm,1juob5p,reddit,Crypto = fraud. Too bad its the kind of fraud Trump likes.,2025-04-09 13:24:07,12,me0w_z3d0ng,news
mm4wzec,1juob5p,reddit,Yeah because he's rug pulled two already and is trying to use our money for BTC. I'm not even explicitly against a bit of that but not via the guy who has bankrupt fucking casinos (among other things he's made shit the bed).,2025-04-09 01:09:11,6,T1Pimp,news
mm6lf1t,1juob5p,reddit,boutta be a lot of russian crypto payments to maralago,2025-04-09 09:18:49,3,kqlx,news
mmgx1yf,1juob5p,reddit,"America is the biggest terrorist in this world, and leader is the biggest fraudulent incompetent loser in the world. It's not going to investigate itself but make up more excuses to snuff out anyone that stands up to them, fuck america",2025-04-10 22:39:05,2,BoofThyEgo,news
mm4mw84,1juob5p,reddit,Ian Freeman needs a pardon.,2025-04-09 00:09:50,2,MrMcGreenGenes,news
mm785gv,1juob5p,reddit,"Oh, so they will focus on the president and his orange sidekick! /s",2025-04-09 12:27:14,1,DanielOakfield,news
mm7pg81,1juob5p,reddit,Is the focus tuning inward?,2025-04-09 14:06:05,1,Fantastic-Refuse1338,news
mmha5k0,1juob5p,reddit,Fraud?  You mean like stock market manipulation?,2025-04-10 23:54:56,1,sugar_addict002,news
mmbaap1,1juob5p,reddit,...shifted to fraud and terrorism.....which is funded through crypto.....,2025-04-10 01:07:45,1,ntgco,news
mldmk4t,1jrbl76,reddit,That's such a scary headline. It went from 6.6% unemployment to 6.7%.,2025-04-04 14:19:24,90,LorderNile,news
mldl4rb,1jrbl76,reddit,Did an editor approve this title?,2025-04-04 14:12:01,18,greenorchids1,news
mldw323,1jrbl76,reddit,"Those poor ""fuck Trudeau"" merchandise workers who thought the gravy train would never end...",2025-04-04 15:07:11,6,ceribus_peribus,news
mlef5hv,1jrbl76,reddit,"I'll gladly move to Canada to take a job there.  I have a comp sci degree and want to get the fuck out of trump's america.  

Canada, please take me.  I want out of this hellscape!",2025-04-04 16:42:47,-12,creamy_cheeks,news
mlrzdfv,1jrbl76,reddit,"Well, I’m glad we can accommodate hundreds of thousands of new immigrants.",2025-04-06 23:06:48,0,ForwardLavishness320,news
mldu5vp,1jrbl76,reddit,"Sorry Canada - Our Plan was to Break America to Fix America.

But we only know how to do Part 1.",2025-04-04 14:57:39,-11,Heimerdingerdonger,news
mlh973c,1jrbl76,reddit,"US saw job losses last month too, even though the jobs report says otherwise.  You can't trust government data these days.",2025-04-05 02:14:56,-8,AcanthisittaNo6653,news
moiechj,1k5hzvi,reddit,"Flicking through the funeral catalogue.

*Got, got, got, need.*",2025-04-22 22:27:39,24,-SaC,news
moi44ux,1k5hzvi,reddit,Gonna be honest. I totally thought that this was the guy who came up with Paninis the restaurant chain.,2025-04-22 21:32:39,72,Siny_AML,news
moid3ph,1k5hzvi,reddit,Well now I'm torn. I mentally had my panini maker out already.,2025-04-22 22:20:39,33,dblan9,news
moia56e,1k5hzvi,reddit,"Are they gonna do a 1/1 relic card of him with crazy autos from Pele, Messi, Jordan, LeBron, Brady, Pokémon, Han Solo, etc., to commemorate his passing?",2025-04-22 22:04:20,19,momoenthusiastic,news
mok08is,1k5hzvi,reddit,"RIP. Gonna need to see how this impact manga in countries where they were a publisher, like Mexico and Italy.",2025-04-23 04:15:31,3,metalsluger,news
mok9g72,1k5hzvi,reddit,">Panini expanded its reach significantly, becoming a multinational entity known for its stickers, trading cards, and comics.

But then where did the sandwich come from‽

>Although the first US reference to panini dates to 1956, and a precursor appeared in a 16th-century Italian cookbook, the sandwiches became trendy in Milanese bars, called paninoteche, in the 1970s and 1980s. Trendy US restaurants began selling panini, with distinctive variations appearing in various cities.

>During the 1980s, the term paninaro arose in Italy to denote a member of a youth culture represented by patrons of sandwich bars, such as Milan's Al Panino, and Italy's first US-style fast food restaurants. Paninari were depicted as right-leaning, fashion-fixated individuals, delighting in showcasing early-1980s consumer goods as status symbols.

https://en.wikipedia.org/wiki/Panini_%28sandwich%29?wprov=sfla1

That told me nothing..",2025-04-23 05:30:57,6,alien_from_Europa,news
mojkhep,1k5hzvi,reddit,Dude revolutionized the sandwich. RIP,2025-04-23 02:30:23,-3,Open_Ad_8200,news
mmkpgic,1jwg6lf,reddit,"Turns out, the enemy of my enemy is not necessarily my friend.",2025-04-11 15:09:14,100,Karr0k,news
mmqn1i8,1jwg6lf,reddit,You can hate 2 different bullies for different reasons.,2025-04-12 14:42:06,13,Left-Instruction3885,news
mmp7tt1,1jwg6lf,reddit,The enemy of my enemy is not my friend but I think we all need to face the new reality of Trump handing the keys over to China real soon.,2025-04-12 07:50:49,14,Commercial-Set3527,news
mmss5qk,1jwg6lf,reddit,"This is posturing on Australia part because Australia just signed a longterm massive $1.5Billion LNG deal with China, essentially ""stealing"" that business from the US.",2025-04-12 21:37:01,4,Positive-Vibes-2-All,news
mmpd1zf,1jwg6lf,reddit,Turns out people in other parts of the world still need the stuff we were going to sell to the US.,2025-04-12 08:45:13,2,corkas_,news
mmrc474,1jwg6lf,reddit,"People don’t dislike the U.S. the way they dislike the Chinese government. In the U.S., governments can change, and so can public opinion. That’s the thing about autocracy — it doesn’t change, no matter how much people dislike it. So, you either make a wrong choice for the next four years, or a wrong choice for many more. It's very easy to pick a side with these circumstances.",2025-04-12 16:54:23,2,FutureDegree0,news
mn0owde,1jwg6lf,reddit,"China is our biggest trade partner but definitely isn’t a friend. I’m thinking it’s rime to get rid of America as a defense partner, since they’re unreliable anyway and focus on regional trade and Europe",2025-04-14 05:54:21,1,GolfIll564,news
mmla48c,1jwg6lf,reddit,Australia is going to say thank you for the tarrifs,2025-04-11 16:50:48,-23,Xanadukhan23,news
mmnkd0z,1jwg6lf,reddit,Surprise!  Racism wins again!,2025-04-12 00:09:46,-23,ehjun18,news
mmrzs3v,1jwg6lf,reddit,China has behave like a cunt to Australia. So why would Australia help them out.,2025-04-12 18:57:34,-1,robustofilth,news
mmsphk8,1jwg6lf,reddit,[deleted],2025-04-12 21:21:19,0,N/A,news
mmlg2i2,1jwg6lf,reddit,"Serious question.

Who is the lesser evil, Trump or Xi?",2025-04-11 17:19:46,-22,reddittorbrigade,news
mlvz7bp,1jtpok5,reddit,"Before people say they haven't heard of either, they basically operate a lot of regional flights for larger airlines in the US.",2025-04-07 16:39:58,27,defroach84,news
mlwnli4,1jtpok5,reddit,"I'm sure this has nothing to do with the fact that the CEO of Republic Airways was just nominated to be the FAA Administrator. Totally definitely a coincidence, right?",2025-04-07 18:42:52,8,Spa_5_Fitness_Camp,news
mlw80ww,1jtpok5,reddit,Missed opportunity to rebrand as AIRizona,2025-04-07 17:24:46,10,Gregolas789,news
mm4cih0,1jtpok5,reddit,"Fun fact: I knew the founder of Mesa, and my cousin was even engaged to his son. 

After he got pushed out of the company he started a new company that brokered aircraft.",2025-04-08 23:10:39,1,DFWPunk,news
mlugzd8,1jtioi2,reddit,"Good. I really hope this doesn't spread again to neighbouring countries, the loss of life will be insane. Last thing we want is a 3rd Congo war.",2025-04-07 11:23:04,8,Aria_Athena,news
mlgnar6,1jqzy5q,reddit,"pointless cruelty

175M isnt even a drop in the budget: how much is a plane?

edit, cut n paste from wikipedia
 ""Building each aircraft cost an average of US$737 million, while total procurement costs (including production, spare parts, equipment, retrofitting, and software support) averaged $929 million (~$1.11 billion in 2023) per plane.""",2025-04-04 23:52:38,29,LavenderBlueProf,news
mlnriyr,1jqzy5q,reddit,"these funds are largely secured through large investors, rather than pure tax dollars. There is absolutely nothing stopping us from raising the money needed (and likely more) be removing our reliance on the current administration’s whimsy.",2025-04-06 06:03:56,-1,rosebudlightsaber,news
mnyedjq,1jzg1yx,reddit,"
> The Chinese official’s remarks at the December meeting were indirect and somewhat ambiguous, but most of the American delegation in the room **interpreted** it as a tacit admission and a warning to the U.S. about Taiwan, a former U.S. official familiar with the meeting said.

So, it is an interpretation by unnamed alleged experts rather than an acknowledgment from Chinese officials.",2025-04-19 17:11:49,4,loyola-atherton,news
mnasq0g,1k02v9t,reddit,"Excerpts from the article

> At least three police officers were killed and 16 others injured on Tuesday after a bus carrying police personnel exploded in the Pakistani province of Balochistan.

> While no group has claimed the attack, the Baloch Liberation Army (BLA) is the most active group in the region that carries out such deadly attacks on security forces.

> …

> The mineral-rich southwestern province borders Afghanistan and Iran.

> The situation in Balochistan has become increasingly tense in the last month after several Baloch separatist groups announced the formation of a common armed front on March 2.",2025-04-15 20:59:50,6,FLTA,news
mnat1pa,1k02v9t,reddit,i always wonder where these people are getting the parts to make these bombs,2025-04-15 21:01:26,1,CoralinesButtonEye,news
mng3dyg,1k0mms1,reddit,"Not totally related but the island nation of Nauru also does not have cash machines (ATMs) but for a very different reason. 

In the 1990’s Nauru was the richest place on the planet per capita after the discovery of extensive phosphate deposits. 30 years later and it’s one of the poorest countries after questionable investments and later money laundering. The small island of Nauru became home to dozens of banks, for countries around the world, circumventing taxes. Deteriorating Lamborghinis and Range Rovers can still be found abandoned on the streets - a ghost of an era.

In the 2000’s a law was passed that only one national bank (Bank of Nauru) was allowed to exist for the population, and subsequently no ATMs! There’s some pretty great documentaries on YouTube about this story.",2025-04-16 17:52:30,44,SQL617,news
mnf6zas,1k0mms1,reddit,"""Country that may be completely underwater in fifty years gains access to world economic system that makes their doom possible"".",2025-04-16 15:15:22,84,ttogreh,news
mnfyg4i,1k0mms1,reddit,And here I thought their cash machine was clever marketing of the .tv top level domain.,2025-04-16 17:29:23,11,cobaltjacket,news
mnfd38s,1k0mms1,reddit,That must have been a nightmare to have to go to a bank each time you need money.,2025-04-16 15:45:28,0,Superbuddhapunk,news
mnfh5gn,1k0mms1,reddit,There are places in the world where people still use cash? Crazy! ,2025-04-16 16:05:31,-22,HappyFunNorm,news
mkbff4h,1jlb2y6,reddit,Why don't we know everyone who was actually in the group chat yet? I have a hunch they weren't all American...,2025-03-29 06:04:13,8,katiescasey,news
