subreddit,post_id,comment_id,comment_content,comment_score,comment_created_at,comment_author
VietNam,1k49457,mo8jzk5,Oh nooo. That’s what’s happening rn. My bank keep saying that they have not receive any response from TP bank. I will try tomorrow!,1,2025-04-21 11:01:12,IslaMelthem
VietNam,1k3uyhk,mo562r6,"Ah that's too bad. Try to get the most out of your trip if you can. I can tell you about Saigon because I love it and have been numerous times to visit family and have fun.

I don't think these places require Vietnamese.

Saigon:
- Definitely go at night if possible because that's a lot more fun—they have fountains/spouts in the ground that light up at night and dances and singing (uh maybe bring earplugs tho or be a decent distance away from the music lmao)
- Visit the lotus fountain
~~~requires a tiny bit of cash~~~eat desserts/foods at Bánh Mì Như Lan—you said you have no money but it's pretty affordable (also, since it's  a popular enough spot, I feel like they'll know how to serve people that don't speak Vietnamese)
- In the same general area as the lotus fountain and Như Lan, there are plenty of luxury stores and normal stores to just walk around
- Absolutely go swim if your hotel has a pool—I had a good time going to a high floor and swimming (it was the Saigon Intercontinental Hotel or something)",3,2025-04-20 20:02:19,Tsunami_Aureate
VietNam,1k3uyhk,mo5k6pu,People watching is free. Take a book to a public park and just do that.,2,2025-04-20 21:21:16,Ok_Relative_7166
VietNam,1k3uyhk,mo7a83a,"That sounds sad. I’m curious why the family took the time to fly over here but doesn’t seem interested in experiencing the essence of Vietnam? Good activities and food do cost money, so maybe ask them for a budget. With that, you can come on here and get help putting together a fun, age appropriate list of things to do. It’s been really hot in HCMC lately, so try not to stay out too long in the sun, it’s not great for your health",2,2025-04-21 03:38:33,Eastern-Unit-6856
VietNam,1k3uyhk,mo575h9,Have them book you a motorbike food tour,1,2025-04-20 20:08:19,sl33pytesla
VietNam,1k3uyhk,mo5n7u8,"Yeah, just walk around and take in the sights and sounds. I used to love just sitting at a coffee shop on a busy corner and watching and listening to everything.",1,2025-04-20 21:38:52,totes_a_biscuit
VietNam,1k3uyhk,mo69al4,"The basic tourist sights around Hanoi you can find on google maps are all walkable but some of them will require money to enter. If you're visiting Hanoi during the weekends the Hoàn Kiếm Lake area is closed to traffic for walking, lots of people there so it's lively. It's pretty at night so people hang out on rooftop cafes and watch the people and sights. West Lake sunset can be beautiful too.",1,2025-04-20 23:52:01,CoffeeCannaGreen
VietNam,1k3uyhk,mo6m0d4,"Install whatever dating app. In Vietnam, dating apps are for ... meeting people, crazy right. Trust me you won't be the youngest person in those apps, just maybe filter the age range tightly. Then just met them for whatever, coffee, walk around the city, that's not tourism but that's genuinely enjoyable time.",1,2025-04-21 01:07:06,arllt89
VietNam,1k3l94w,mo2whc1,"Great vinahouse is an oxymoron 

Maybe good",4,2025-04-20 12:23:14,Commercial_Ad707
VietNam,1k3l94w,mo5m0bc,"With the rising prices in the real estate market, no one in vina has a house anymore",1,2025-04-20 21:31:51,Adventurous-Ad5999
VietNam,1k3l94w,mo63m3y,"Search on YouTube 'ton tặc ton tặc ton tặc 10 hours'

Pick any fron the results.

Hold volume down button for 5 seconds. Best trip.",1,2025-04-20 23:17:54,FreshOffTheBoeing
VietNam,1k3ikk0,mo3o4j1,What kind of software do you need? I have built some myself but mostly for Vietnamese students learning Vietnamese.,1,2025-04-20 15:13:14,yeungon
VietNam,1k2ru7e,mnwdpic,Ninh Binh is usually called Ha Long Bay in land but imo it's better than Ha Long Bay and is one of the best places to visit in Northern Vietnam.,21,2025-04-19 08:53:33,TojokaiNoYondaime
VietNam,1k2ru7e,mnwdcac,Ninh Binh is must visit,15,2025-04-19 08:49:38,bhushan_44
VietNam,1k2ru7e,mnwklkq,We were in Ninh Binh area three weeks ago (mid 60s). Do the boat trip from Trang An which is a must rather than Tam Coc as vendors etc. aren't allowed there so it's more peaceful. Number 3 is through the longest cave. Don't attempt the climb at Hang Mua unless you're super fit. I managed thanks to my walking pole but it wasn't easy as some of the steps are so high and uneven. And dangerous in wet weather which it wasn't thankfully for us. Get a Grab to Trang An and back (and everywhere in fact). Bich Dong Pagoda is very nice as is Bai Dinh Pagoda although most buildings there are more recently constructed.  The advantage there is you can take golf style buggies from point to point if you buy the more expensive ticket.  The site is absolutely huge.  Can't comment on Mai Chau as only my daughter has been there twice.. to a cave rave which is a huge event so don't visit at that time! Can recommend the Lalita Boutique hotel on the outskirts of Tam Coc.  We didn't visit Ninh Binh city at all. Stayed 3 nights.,3,2025-04-19 10:07:53,InspectorJacko859
VietNam,1k2ru7e,mnwgn7z,"Ninh Binh is great, my family really enjoyed it. It was probably their favourite place when visiting. Mai Chau is also really cool, but probably only for 1 day 1 night.",3,2025-04-19 09:25:35,No-Opportunity-6234
VietNam,1k2ru7e,mnwim3i,Ninh Binh - Definitely one of the better places i went. Air pollution was pretty bad when I went,3,2025-04-19 09:46:55,Dumbledore_Albus420
VietNam,1k2ru7e,mnwkrma,"As a Vietnamese I'd say it's great, but plan for a max 2 nights. The caves boat tour is definitely a must, and the night market is amazing, but other than that there's nothing else in town.",3,2025-04-19 10:09:40,Confused_AF_Help
VietNam,1k2ru7e,mo1a78c,"It’s amazing. Stay for 2 nights. Take bicycle, or scooter rides around the incredible limestone cliffs and farmland. One of the coolest places I’ve ever been to.",3,2025-04-20 03:15:15,Davidhuston9
VietNam,1k2ru7e,mnwmdst,"The place I preferred, must see",2,2025-04-19 10:26:23,waynax
VietNam,1k2ru7e,mnwtat4,I went to both and preferred Ninh Binh(Tam Coc),2,2025-04-19 11:31:12,Connect-Package8178
VietNam,1k2ru7e,mo1co3y,"Been to both, loved them both ! Mai chau and Pu Luong are really quiet and the rice terraces in Pu Luong are worth the detour, especially if you don't go up north after to Sapa or others. 
For Ninh Binh we stayed near Tam Coc and cycled around and it was great, stunning views and easy to get out of the tourist flow, except for eating as all is in town and the town itself has no interest. 

We also went to Cat Ba island and did a day cruise in Lan Ha bay, I'd recommend it as well. It's definitely not the same feeling as the other two.",2,2025-04-20 03:33:03,Illustrious_Lab_1837
VietNam,1k2nqox,mnvk0vp,"i have an accountant i can send u her contact, she speaks english, send me a dm i send u her zalo",2,2025-04-19 04:08:37,Slow-Werewolf
VietNam,1k2nqox,mo8nbtm,[removed],2,2025-04-21 11:29:06,N/A
VietNam,1k2fqqm,mntrn92,Rice from a package? What kind of package?,6,2025-04-18 21:20:33,Commercial_Ad707
VietNam,1k2fqqm,mnuoeib,Get yourself a rice cooker lol,4,2025-04-19 00:35:09,fsoft_tech
VietNam,1k2fqqm,mnu9fgo,"You're killing Uncle Roger:
 
https://m.youtube.com/watch?v=53me-ICi_f8",5,2025-04-18 23:04:00,teekeno
VietNam,1k2fqqm,mnu6dak,"Hmmmmm. This is what you do. First, you book a trip to Vietnam. Then, you book a tour to maybe sapa. Or any other attractions with amazing rice paddy fields works too. Or you could book multiple tours, locations. Works better. Then, during the tour, when you see the rice fields, this part is really important, find the farmers and go to them and say : Tôi rất xin lỗi, tôi đã lãng phí số gạo mà bạn đã mất nhiều công sức để trồng và chăm sóc. Lần sau tôi sẽ dùng nồi cơm điện.

After the tours, you go back home and buy a rice cooker. They have these really small cute ones for single person or those multipurpose ones if you really want to save space. Let us know how it works! Good luck!",2,2025-04-18 22:45:43,Cool-Palpitation-729
VietNam,1k2fqqm,mnu5bfb,"Ok, here's how I do it if I plan to go without a rice cooker: 


1. Pre-wash rice until water is about 50% clear of starch. 


2. Finger method for amount of water to add. (Honestly, you can go slightly over with the pot method because of Step 4.)


3. Put on high heat and come to boil with lid off (to prevent overflow). Continue to stir frequently to prevent sticking/burning to the bottom.


4. Continue to keep on high and stir until water has about 85% boiled off. The rice in the pot should be plump, look like ""dry"" congee, and continue to produce bubbles. When you stir the rice, it takes 1-2 sec for the rice to return to its previous shape. (E.g. you can see the after effects of how you stir your rice for a brief sec.) You can continue to cook the water down if you like your rice dry. I personally like soft rice, so I'll turn the heat down to low here and pop the lid on.


5. Keep on low for several minutes. I kinda eyeball it here. Maybe 8-10 min? I just pop the lid off, fluff the rice, and if it has the consistency I like, I turn off the heat and let it settle on its own with the heat on until I'm ready to serve. 


6. Happy eating!",4,2025-04-18 22:39:23,horatiostrikeZ
VietNam,1k2fqqm,mnu8s4o,I've made rice in a claypot (same one you use to make Cá Kho Tộ in) pretty successfully on the stove. Claypots are relatively cheap and you can find all kinds of sizes at any Asian supermarket. Plenty of recipes online.,1,2025-04-18 23:00:09,pichuru
VietNam,1k2fqqm,mnuemgw,"I've always used a rice cooker so I don't know how to make rice on the stove.  But the rice cooker makes it soooo easy and foolproof.  I know you said you do not have room, but they do make small rice cookers.  Maybe making a little room would be worth it if you plan on making rice often.  I rinse my rice until it comes out clear.  Add chicken buillon and vegetable oil.  Best of luck.",1,2025-04-18 23:35:01,Professional-Arm-380
VietNam,1k2fqqm,mnuto9c,"I just use parts water to one part rice and boil for 20 min. Do not lift the lid. That's it. Oh, and add a pat of butter or oil.",1,2025-04-19 01:08:33,Ok_Relative_7166
VietNam,1k2fqqm,mnuyl9w,If you have a pressure cooker old school it works as well,1,2025-04-19 01:39:26,tshungwee
VietNam,1k2fqqm,mnvcvir,[this changed my life](https://www.recipetineats.com/how-to-cook-rice/),1,2025-04-19 03:14:52,Comfortable-Leg-703
VietNam,1k21sru,mnqlxw3,"it's always a good idea to book in advance if you know you're gonna be somewhere. Hanoi and Saigon will host the biggest celebration. Hoi An would probably be lowkey.

I was in SG District 1 last night and there were thousands of people watching the rehearsal near Nguyen Hue Walking Street.",3,2025-04-18 10:55:54,Fun_Trip_Travel
VietNam,1k21sru,mnrvjta,"Big reminder that it's gonna be the second longest holiday in Vietnam every year, we's gonna get 5 consequential day off from April 30th to May 4th, so everywhere's gonna be packed to the brim. You should definitely prebook everything you can. Actually, start right now!",1,2025-04-18 15:31:53,Lazearound10am
VietNam,1k1tnfm,mnp6ls0,"Just did a little googling, apparently Mekong Auto has a permit to import Pyeonghwa cars, but other than that there's zero info about them on Mekong Auto's publications. Also, someone spotted what looks like a Pyeonghwa in Phan Thiet quite recently https://vneconomy.vn/automotive/oto-trieu-tien-tung-ban-o-viet-nam.htm",5,2025-04-18 02:57:40,Confused_AF_Help
VietNam,1k1tnfm,mnp5vvr,Never heard of this branch until today. I haven't heard of any North Korea production was sold in open market in  Vietnam for last 30 years. So you definitely can't find such car in Vietnam.,5,2025-04-18 02:52:43,vietvn85
VietNam,1k1tnfm,mnpr6kp,Search facebook for a used Pronto (2016) and the price is 148m vnđ.,1,2025-04-18 05:44:22,Double_Ad5916
VietNam,1k0akju,mncqeg6,"Oh, the girl from yesterday?",7,2025-04-16 03:49:54,WithMyD
VietNam,1k0akju,mnct2ck,The song: Who let the dogs out?,4,2025-04-16 04:09:39,studying-hard
VietNam,1k0akju,mne5iyy,lmao,1,2025-04-16 11:44:16,IllustriousPea9931
VietNam,1k0akju,mnf61ec,I do the same thing in vietnam. When i dont feel like dealing with people trying to get an angle i pretend i dont speak english.,1,2025-04-16 15:10:44,mygirltien
VietNam,1k0akju,mnlyjj9,"You did the right thing, because these mostly are scams. To explain how it works, the scammer will approach you through any social media, texts, and ask randomly (Are you ABC? Hi ABC, etc...). And when the conversation starts, the scammer will then lure you to ""do these quests to get money!!!!"" or just straight up bitcurrency investment (which is again, scam). When you give them a good load of money (~1000 US and more) they will instantly ban you and you'll never be able to contact them or get your money again.",1,2025-04-17 16:29:22,ct3w0c
VietNam,1k08vho,mnca0ll,"some FFP2 face masks, pollution is super high here",10,2025-04-16 02:02:37,NeighborhoodNo7909
VietNam,1k08vho,mncc908,"U can buy first aid stuff in vietnam, it's prob cheaper",4,2025-04-16 02:16:18,Hungry1nsomniac
VietNam,1k08vho,mncdkrd,"As a medic I carry certain things for general meds…Imodium (prevent dehydration and the need to find a busy bathroom)… diphenhydramine aka Benadryl (amazing drug use if for nausea, sleep aid, rash, allergies and ot allergic reactions…zofran aka ondansetron for nausea but it OTC in Vietnam. And mole skin for blisters and or tape if you need. 

Drop those stickers for bugs go on Amazon buy 100% Deet bug spray (probably causes cancer but it works)

Learn some fun games with those cards best way to make friends at a hostel is to offer a beer and to come play a game. My favorite easy ones for one deck are 7’s, 31, and modified version of the Italian game Scopa",8,2025-04-16 02:24:31,Secret_Example1098
VietNam,1k08vho,mnceah0,Toilet paper,1,2025-04-16 02:28:59,quatchis
VietNam,1k08vho,mnckyk8,Resident Evil fan?,1,2025-04-16 03:11:39,NoAppearance9091
VietNam,1k08vho,mncmxs6,Why do you have cash in an envelope?,2,2025-04-16 03:25:06,GeneralAutist
VietNam,1k08vho,mncr365,"I suggest you bring a fan or buy one or bring something to prevent heat stroke, it's gonna get really hot in a day or two, like 38-39 degree celcius hot or 100-102 farenheit the hot that would knock out even the healthiest local.",1,2025-04-16 03:54:55,yesimareddituser
VietNam,1k08vho,mnctfyi,"I lived in Vietnam for a year. 

I would recommend little packets of tissue or small wet wipes for hands and other parts. Most restaurants charge for wet naps. And I have encounter several restrooms without toilet paper. 

Bottled drinks, coffee, tea, fresh juice is EVERYWHERE. I would let the life straw stay home this trip.",3,2025-04-16 04:12:31,New_Pizza_Rich
VietNam,1k08vho,mncu11o,get one of these if you dont have it already. just for additional safety [https://www.amazon.com/s?k=concealed+travel+wallet](https://www.amazon.com/s?k=concealed+travel+wallet),2,2025-04-16 04:16:58,10ballplaya
VietNam,1k08vho,mncutx2,"I like to have a good raincoat as it may rain heavily soon. Cheap raincoats are sold everywhere here but I prefer a good one which I can use for years. Also it is better to have a waterproof cover for the backpack. 

Cash in foreign currency is hardly needed here. Just order (while at home) Revolut or Wise card (not sure what is popular in US among travellers) and get cash from ATM. I neary never withdraw more than 2kk VND.",2,2025-04-16 04:23:02,HeavySink3303
VietNam,1jzjrem,mn6wqnq,"It basically doesn't, in that people here love to burn almost anything on a daily basis.",5,2025-04-15 06:06:54,Departed00
VietNam,1jzjrem,mn7nhtg,Lol,1,2025-04-15 10:48:16,katsukare
VietNam,1jzjrem,mn7nko5,This isn't even the burning season....,1,2025-04-15 10:48:59,automatedusername13
VietNam,1jzjrem,mn75s7l,It doesn’t. This is a hallmark of a third world mentality.,0,2025-04-15 07:41:54,HoMasters
VietNam,1jzi88h,mn91y4m,The train also goes over the hai van pass in case you're wondering. I did it a few days ago in the opposite direction from Da Nang to Hue. Just make sure you're sitting on the left hand side of the train for the views out the window,2,2025-04-15 15:48:55,kronkite221
VietNam,1jzi88h,mndjuxz,"You can find Sunny rider tour service at 15/177 Phan Dinh Phung street, Hue City for advice. WhatsApp: +84 332184850",1,2025-04-16 08:20:32,sunnytran2222
VietNam,1jzex2j,mn5rvyb,Banh cam,5,2025-04-15 01:06:41,Borntochief
VietNam,1jzex2j,mn5szfi,Chè bưởi đậu xanh. the best for this hot weather. PS for the link having English sub just in case: [https://www.youtube.com/watch?v=bH7dUp3Fbjs](https://www.youtube.com/watch?v=bH7dUp3Fbjs),5,2025-04-15 01:13:17,TakkuNguyen
VietNam,1jzex2j,mn5ybs7,Creamed avocado in coconut milk with Durian bits,3,2025-04-15 01:45:44,Dr-Mind-Bubble
VietNam,1jzex2j,mn5zah6,"My mother in law makes a killer fried banana. When I visit I always ask her to make me some.
Now my wife’s grand mother makes this awesome banana and ginger candy.
Well I’ll soon be divorced from my wife so I won’t be able to have them anymore.


Now if you’re talking about store bought desserts, Banh In with dau xanh gets my vote.",3,2025-04-15 01:51:38,StunningAttention898
VietNam,1jzex2j,mn5q7fn,My mom always made this coconut jelly that was layers of coconut water jelly and coconut milk jelly inside a young coconut with the flesh and honest to God it's my favorite 😍 😋,2,2025-04-15 00:56:36,SpicyBanhBeo
VietNam,1jzex2j,mn66bv2,bánh nướng definitely. Goes well with tea,2,2025-04-15 02:35:37,nhansieu1
VietNam,1jzex2j,mn6luzv,"Flan, caramel, yogurt.",2,2025-04-15 04:28:25,add1910
VietNam,1jzex2j,mn6ml1i,"There is tàu hũ, flan, yogurt, ice cream i know it's not from vietnam but you can't mention deserts without them in vietnam really",2,2025-04-15 04:34:26,DogeMeat20
VietNam,1jzex2j,mn6zpty,"Che buoi. 
Che Thap cam. 
Banh Bao with coconut cream and sesame seeds. 
Fresh banh choi with coconut cream and sesame. 
And the soy curd with ginger syrup coconut cream and chewy tapioca. Served in a porcelain bowl not plastic.",2,2025-04-15 06:37:19,Narrow_Discount_1605
VietNam,1jzex2j,mn87uqf,"Bánh bò
Bánh da lợn
Bánh chuối",2,2025-04-15 13:11:16,Constant_Grocery5223
VietNam,1jy9i45,mmwopu5,"District K was exclusively Vinahouse when I was there on a Tuesday night. It was almost full and the sound system was so powerful I could feel it reverberating through my body.  It was a fun night and I met a lot of locals.  The security was very good also, taking me through the crowd multiple times to use the toilet.",3,2025-04-13 15:19:00,AtreyuThai
VietNam,1jy9i45,mmws3z9,the app inSaigon lists events in the city,1,2025-04-13 15:36:59,Slow-Werewolf
VietNam,1jy9i45,mmykst5,"I was the only foreigner in a club in Hue with earplugs, best idea ever.",1,2025-04-13 21:17:19,Snowboardeur
VietNam,1jxperv,mms90fm,"Let's say your ancestors have an Indian ancestor in their ancestors....

Yes it is possible, you inherit genetic load through generations, you can even have your South Asian trait coming from your direct non-Vietnamese ancestor (father or mother)",2,2025-04-12 19:49:10,IandSolitude
VietNam,1jxperv,mmtdfda,I think after the guy sent in his lizards DNA swab to 23&me and got back that his lizard is 48 percent west asian and 51 percent Jewish I lost trust in these for this. I think good for matching offspring and family but idk about these origin ones.,1,2025-04-12 23:47:25,didyouticklemynuts
VietNam,1jxperv,mmtm4qt,If one of your parent has long history in the South then it is possible. Vietnam was originated in the north around the red river delta and we conquered champa and part of khmer. We did a thorough jobs of wiping out those nations population but in the progress for sure some inter marriage happened that's why some Southern Vietnamese have South Asia genes.,1,2025-04-13 00:44:00,toitenladzung
VietNam,1jxperv,mnjxnhz,"Champa people migrated from Indian subcontinent. So did a lot of Khmer people. During the Chola Dynasty, Tamil traders and military forces sailed all over Asia. One Korean queen (Queen Heo) was Indian. North Vietnamese usually have next to no Indian ancestry, but Southern Vietnamese who intermingled with Khmer and Champa are much more likely to have some Indian ancestry. I believe there used to live a community of multigenerational Indians in what's now D5 and D8 in HCMC (Cho Lon). I believe Ong Cha Va (founded in 1935) was either an Indian brand or inspired by Indian cuisine. The logo's an Indian guy.",1,2025-04-17 08:47:13,feixiangtaikong
VietNam,1jxi2nx,mmqgkp8,"Lưu ý,

Bất kể bạn đang tham gia vào chủ đề thảo luận gì, hãy lịch sự và tôn trọng ý kiến của đối phương. Tranh luận không phải là tấn công cá nhân. Lăng mạ cá nhân, cố tình troll, lời nói mang tính thù ghét, đe dọa sử dụng bạo lực, cũng như vi phạm các quy tắc khác của sub đều có thể dẫn đến ban không báo trước.

Nếu bạn thấy bất kì comment nào vi phạm quy tắc của sub, vui lòng nhấn report.

***

A reminder.

In general, be courteous to others. Debate/discuss/argue the merits of ideas, don't attack people. Personal insults, shill or troll accusations, hate speech, any suggestion or support of harm, violence, or death, and other rule violations can result in a permanent ban.

If you see comments in violation of our rules, please report them.

***

*I am a bot, and this action was performed automatically. Please [contact the moderators of this subreddit](/message/compose/?to=/r/VietNam) if you have any questions or concerns.*",1,2025-04-12 14:06:01,AutoModerator
VietNam,1jxfryj,mn2lbek,"From my experience d7 accomodation will cost you around 4M for a decent place and 5-6M for a nice place (VND monthly per person). Food around Ton Duc Thang is quite cheap, but it's near a shopping mall so a meal can be anything from 20-30k for a cheap meal or 100k+ if you want something fancy.

personally i think d7 is very liveable and it's one of the most friendly place in hcmc, especially for students. but i think you should spend time getting to know your friends at the uni and they'll guide you to enjoy the city much better than what people may suggest",2,2025-04-14 15:03:04,malego290704
VietNam,1jw2j39,mmeze02,"Social media loves to exaggerate everything... click bait gets clicks.

You might face a little discrimination, but Vietnamese above all else worship the all mighty Dong. If you're not a dick, treat people with respect and have money to spend you'll be totally fine.

Some of the warnings that might apply to other foreigners won't apply to you - things like the grittiness of the urban areas are something you'll already be accustomed to...",30,2025-04-10 16:50:58,richmond_driver
VietNam,1jw2j39,mmf6ogt,"As a Vietnamese, I have never seen any Indian that is chased away from restaurants. I myself have 2 good Indian colleagues which become my friends, you just need to integrate into the society, you will find it’s not that difficult to make friends with Việt people. Gluck.",6,2025-04-10 17:26:11,mightyquack_21
VietNam,1jw2j39,mmfttk8,"Indian TOURISTS don't carry a good image in Vietnam like, at all.

So as long as you're not tourist & be respectful, everything will be fine.",5,2025-04-10 19:18:52,nazgron
VietNam,1jw2j39,mmf09ys,"You seem to be in a more privileged bracket, with company provided housing and chauffeur, so logistical issues should not be a major concern for you. In Vietnam, some people with prior negative experiences with Indian individuals might give you a hateful stare, but for the most part, people won’t judge you as long as you’re respectful. I know Indians from the US, UK, and even one from Kerala who are always well mannered. They thrive at work, make friends easily, and are respected by their peers",4,2025-04-10 16:55:19,Eastern-Unit-6856
VietNam,1jw2j39,mmf5k3o,"Don't worry.  In VN, money talk, Bullshit Walk.  

Just don't buy anything from the open market where you have to haggle.  Indian famous for haggling price to the point it doesn't make sense...

just don't be that ""namba 1 bullshit guy, who did the weewoo weewoo"" and you'll be fine.",5,2025-04-10 17:20:51,N/A
VietNam,1jw2j39,mmf21gw,Generally speaking people are very kind and friendly in Vietnam so I don’t think you would have any problems.,6,2025-04-10 17:03:54,Electronic_Walk411
VietNam,1jw2j39,mmfsuie,"I have been studying in Vietnam 🇻🇳 for more than two years now, and I think every day is worth the experience. All I will tell you is to make the move and experience things yourself. Come with an open mind.",3,2025-04-10 19:13:56,royadeveloper
