subreddit,post_id,comment_id,comment_content,comment_score,comment_created_at,comment_author
news,1k39nva,mo0fd17,Traitors against the US with badges and guns.,43,2025-04-19 23:58:40,threehundredthousand
news,1jnaqpo,mki738x,"“When we saw that nobody was doing anything — I guess just in the moment of it — it was like, ‘He’s not supposed to be allowed to do this,’ so we tried to stop him,” she said.

The party of free speech, everybody...",8635,2025-03-30 11:56:05,rubixor
news,1jnaqpo,mkia4wn,Where’s the don’t tread on me crowd?,3351,2025-03-30 12:21:02,Comet7777
news,1jnaqpo,mkidmap,They should have all worn Tesla logos. Then anyone attacking them would have been classified as domestic terrorists. : ),2471,2025-03-30 12:47:25,TMTBIL64
news,1jnaqpo,mki8wlk,"The Government of the United States gives to bigotry no sanction, to persecution no assistance. Require only that they who live under its protection should demean themselves as good citizens, in giving it on all occasions their effectual support.

-George Washington


	“We the General Assembly of Virginia… do enact that no man shall be compelled to frequent or support any religious worship, place, or ministry whatsoever, nor shall be enforced, restrained, molested, or burdened in his body or goods, nor shall otherwise suffer on account of his religious opinions or belief.”

-Thomas Jefferson



	“The civil rights of none shall be abridged on account of religious belief or worship.”

-James Madison",2322,2025-03-30 12:11:08,domine18
news,1jnaqpo,mkjgsgs,"The original permit allowed them into the rotunda and in a horrifying display of religious persecution, legislators stepped in to edit the permit at the last second. The Satanists went ahead with their ceremony and were assaulted.   
I don't understand why the leader was arrested. This is ridiculous.",268,2025-03-30 16:32:22,FloppedTurtle
news,1jnaqpo,mkia2xw,"They say “chaos” but it was positively uneventful compared to what they apparently expected to happen. It was amazing how much of an overreaction there was to this. (Of course hindsight is 20/20). They had police cars surrounding the capitol. An acquaintance who works in the capitol told me they  had SWAT on every floor and hid all the tables and chairs so they couldn’t be used as weapons. They gave all the state workers administrative leave that day too, so they wouldn’t be caught up in anything downtown.

And yet despite all the worry about mass violence, there were a ton of children amongst the counter protesters, all dressed in their Sunday best.",2192,2025-03-30 12:20:37,Ekyou
news,1jnaqpo,mkide39,I love that Satanist’s don’t even believe in Satan. It’s the Christians that do.,3269,2025-03-30 12:45:48,sgruberMcgoo
news,1jnaqpo,mki8ayb,*trying to remember if there are any photos or evidence of satanists burning an inverted pentagram in front of a black family's house.,3422,2025-03-30 12:06:11,blaccguido
news,1jnaqpo,mkiaf73,"Christians always really struggle to understand that Satanists are a political activist group pointing out the hypocrisy of our government bias towards Christianity, not literal worshipers of Satan. 

It would take less than 5 minutes of googling to understand this. The only ones at that protest who actually believe in Satan are the Christians.",5678,2025-03-30 12:23:17,itsbritain
news,1jnaqpo,mki7k3a,The rational next step is to do a bigger one.,952,2025-03-30 12:00:03,hadoken12357
news,1k4jkdb,moamfzl,"Funny, I used to get little quips from my retired parents anytime the stock market went down under Biden (“he just cost me $xxxxx”). Haven’t heard a single comment about their portfolio since trump took office",5494,2025-04-21 18:13:05,Mythranite86
news,1k4jkdb,moaglhk,"Long term gain, though, right?

...you guys?",6768,2025-04-21 17:45:02,Callabrantus
news,1k4jkdb,moah1mi,"He's running the country like he does all of his businesses. Imagine being this incompetent, but also so unaware.",3845,2025-04-21 17:47:09,USAF_DTom
news,1k4jkdb,moahfuj,Reminder that Trump enjoys a 90% approval rating from Republicans right now,2967,2025-04-21 17:49:00,pontiacfirebird92
news,1k4jkdb,moahq11,"I’m confused, is America great again yet or not?",407,2025-04-21 17:50:20,Stinkydadman
news,1k4jkdb,moal04b,"Bond yields are spiking again, too.  
Faith is being lost in not just the dollar and U.S. equities, but Treasuries, too.  
Yikes.",183,2025-04-21 18:06:04,baconography
news,1k4jkdb,moaurh5,Every time a Republican is in office my life gets harder.,348,2025-04-21 18:53:58,SodaPop6548
news,1k4jkdb,moah3lj,MAGA: This is good. We shouldn't be involved in any foreign exchanges anyway. It costs nothing to lose money.,944,2025-04-21 17:47:24,Moku-O-Keawe
news,1k4jkdb,moahmpx,The value of a dollar is rapidly approaching its lowest low since the last time this skidmark was in office,396,2025-04-21 17:49:54,dstarr3
news,1k4jkdb,moaj08y,If Powell leaves it'll tumble another 1000.,321,2025-04-21 17:56:25,Dudedude88
news,1k1fr6v,mnlnwbd,">A source familiar says Caldwell is accused of sharing classified documents with reporters.

Oh, is that a problem for Hegseth now?",8487,2025-04-17 15:37:55,Bhosley
news,1k1fr6v,mnlno62,Such a mess. 0 Professionalism,1867,2025-04-17 15:36:50,Antonioshamstrings
news,1k1fr6v,mnlnyj9,What about Hegseth? Shouldn't he be on leave too?,2096,2025-04-17 15:38:12,black_flag_4ever
news,1k1fr6v,mnlo189,"WHISKEY LEAKS
Remember: Trump only hires the best. ",584,2025-04-17 15:38:32,PoopTransplant
news,1k1fr6v,mnlq5cf,"Damn, I got excited when I misread ""including Pete hegseth""... then I remembered he's already at the top of that chain",490,2025-04-17 15:48:42,pzman89
news,1k1fr6v,mnlpefd,"Every top official on that chat knew it was illegal to use for classified information. All of them, including the VP, needs to be impeached, removed from office, and prosecuted.",232,2025-04-17 15:45:06,Reviews-From-Me
news,1k1fr6v,mnlohwe,This DEI-less experiment seems to be a disaster.  Can we go back to being really good at things again?,377,2025-04-17 15:40:45,fossilnews
news,1k1fr6v,mnlq80j,"Imagine being the one in the chat, leaking information, and then it's your assistant that gets suspended...Much accountability, much wow.",215,2025-04-17 15:49:03,Monnster07
news,1k1fr6v,mnlqmlf,It's three of them now. https://www.politico.com/news/2025/04/16/pentagon-official-suspended-leak-investigation-00293473,47,2025-04-17 15:50:59,rtdonato
news,1k1fr6v,mnlq6o7,Just over 3 months in and this administration is a shitshow. Totally expected but hey at least we are Making America Great Again lol  /s,41,2025-04-17 15:48:52,DontTickleTheDriver1
news,1jv678m,mm7wyf5,Don’t forget - Trump is only able to do this because Republicans refuse to rein him in. This is a Republican problem. ,12228,2025-04-09 14:44:04,ARazorbacks
news,1jv678m,mm7v2bd,"Fucking Christ if US bonds go off a cliff, what else is left. That shit is supposed to be a gold standard in investment.",4260,2025-04-09 14:34:40,GOD_DAMN_YOU_FINE
news,1jv678m,mm7wot9,"Trump said if I voted for Kamala the economy would be in ruin. And I gotta say, he clocked it right. I voted for her and the economy is in shambles.",30306,2025-04-09 14:42:46,ericsipi
news,1jv678m,mm7rh0b,"Donald Trump has broken his own record as the worst president of All time.

He has betrayed the American people including his voters who were hoping that the prices would go down.",5866,2025-04-09 14:16:29,reddittorbrigade
news,1jv678m,mm80ij3,"*Some analysts suggested that America's central bank - the US Federal Reserve - might be forced to step in if turbulence continues, in a move reminiscent of the Bank of England's emergency action in 2022 following Liz Truss's mini-Budget.*

*”We see no other option for the Fed but to step in with emergency purchases of US Treasuries to stabilise the bond market,"" said George Saravelos, global head of FX research at Deutsche Bank.*

LoL, all the pro-Trump “sound money” folks railed against exactly this during the quantitative easing of 2008+. Now they’ll turn around on a dime and be all for it. Anything to defend the Trump regime.

Quacks, every last one of them.",1191,2025-04-09 15:01:23,AtticaBlue
news,1jv678m,mm7vi61,China has a LOT or Treasuries to offload - no interest rate cuts,826,2025-04-09 14:36:53,BrexitReally
news,1jv678m,mm8f3cc,"I am not informed enough to understand how one person has that much power in the United States.

Congress is currently talking about limiting the President's power over tariffs and my reaction is... why didn't they have power over this to begin with?

How can we not cancel $10k in student loans without congressional approval, but the President can trigger a great depression and global recession without congressional approval?",297,2025-04-09 16:13:25,hombregato
news,1jv678m,mm83c0n,"The GOP budget resolution adds 5 trillion to the debt ceiling. People are understanding USA has no intention on paying off its debt. That's 5 trillion uncollected taxes from the rich. To put it in easier to understand numbers: 5,000,000,000,000/150,000,000 taxpayers = about $32,000 debt increase per person who filed taxes last year. The tariffs are a smokescreen and we are getting robbed.",576,2025-04-09 15:15:27,Accomplished-Noise68
news,1jv678m,mm7yuag,"For the MAGA people, Trump could burn your house down and shit in your mouth and you'd thank him for the warmth and what he ate beforehand.",524,2025-04-09 14:53:15,Cruzy14
news,1jv678m,mm7sotq,MAGA loves him even though they literally will be go broke and in dept :3,882,2025-04-09 14:22:43,CantAffordzUsername
news,1jm6dhu,mk9eaw0,"An all stock transaction... From one private company to another private company, both fundamentally controlled by the same person. This is really just economic sophistry isn't it?",6787,2025-03-28 22:05:35,sudoku7
news,1jm6dhu,mk9bl0s,[deleted],2035,2025-03-28 21:50:55,N/A
news,1jm6dhu,mk9cd22,"""$45 billion"" of xAI stock... so you have to accept xAI's totally specious $75B valuation in order to believe this transaction is actually worth $45 billion.  What a joke.  

xAI has raised around $20 billion from investors and sells nothing but vaporware.",10704,2025-03-28 21:55:02,lawn_question_guy
news,1jm6dhu,mk99joo,"Okay... what?

This must be some tax/loan reshuffling thing I'm too plebeian to understand",3503,2025-03-28 21:40:07,Aivoke_art
news,1jm6dhu,mk9aapa,This is like when a no name influencer “sells” their shitty NFT to themselves for $10million,7411,2025-03-28 21:44:05,Borgalicious
news,1jm6dhu,mk9bxyx,"Wait... so he raised money from investors for xAI, used that money to buy himself out of the $40B Twitter hole that he dug himself?? This seems very questionable at best...",21816,2025-03-28 21:52:48,jaaagman
news,1jm6dhu,mk9d045,"So he Bought it for 45 billion Tanked it into the Ground to get Trump Elected. Then somehow Magically with no Innovation/ increase in revenue/ Advertisers didn't come back/ Multiple boycotts and Still the value went back up magically to what he bought it for? 

He then Sells it from himself to a company owned by him in order to pay back the 45 billion dollar loan on the saudi's before they make a call on his Tesla Stock which he was tanking. and Somehow in all of this i'm pretty sure he paid Zero taxes somehow. 

This Feels like all smoke and mirrors and there's got to be some Legality involved. Where's the SEC and the FTC oh right their being defanged and Gutted by Musk as we speak. 

  
/sigh",10297,2025-03-28 21:58:27,CloudstrifeHY3
news,1jm6dhu,mk9auor,"This is exactly why he put his DOGE team within the SEC. Definitely committing fraud, but no one will be able to investigate him for it. We're so fucked in this country.",10990,2025-03-28 21:47:00,Risky_Phish_Username
news,1jm6dhu,mk99rmu,Moving the trash from one garbage bin to the other.,5005,2025-03-28 21:41:17,Goat_Wizard_Doom_666
news,1jm6dhu,mk9b3cb,So that recent surprise valuation of Twitter (x) now becomes clear. If only we had a functional FTC. This is just straight up fraud is what it is.,1178,2025-03-28 21:48:18,brickyardjimmy
news,1jm2shr,mk8f2d5,You know what will help that person deal with the trauma of a miscarriage? The trauma of an arrest. That will surely improve her life /s,12202,2025-03-28 19:05:42,me0w_z3d0ng
news,1jm2shr,mk8jnw8,"""*What Should Women Who Miscarry Do?: We asked several Tifton Police Department and Tift County officials what women who miscarry should do with the remains of the fetus. So far, only Tift District Attorney Patrick Warren has answered and said typically miscarriages are not handled in this manner.*""

So they asked what she was supposed to do with the fetus and nobody had an answer.  If you can't tell her what she did wrong, why was she arrested?  Just because she probably didn't have a healthcare plan that would pay for it?",7118,2025-03-28 19:28:53,TheWasabinator
news,1jm2shr,mk8fdjz,"""The coroner’s office ruled it to be a occurring miscarriage""

I don't know if there's an official procedure of what to do with remains of a child when you have a miscarriage, but to jail and punish a mother for having one?   I mean... it's a miscarriage.  Did they want her to keep it in the fridge until the damn coroner can pick it up or something? Geeze! It's already traumatizing enough.",3139,2025-03-28 19:07:16,Marcellusk
news,1jm2shr,mk8gek5,People wonder why from the 1950s-70s why women hid miscarriages? This right here.,2469,2025-03-28 19:12:28,BoosterRead78
news,1jm2shr,mk8mmv9,"Oh, look. That thing that women were told not to worry about happening has happened.

  
They want to criminalize women for not being perfect broodmares.",405,2025-03-28 19:43:59,YomiKuzuki
news,1jm2shr,mk8oitb,Nothing says family values and traditionalism like arresting a mother for a miscarriage she had no control over whatsoever /s,102,2025-03-28 19:53:15,esepinchelimon
news,1jm2shr,mk8mvyh,"What was she supposed to do with a dead fetus? At 19 weeks it was not close to viable. Women have been arrested for burying their stillborn children. Women miscarrying get turned away from hospitals because doctors are afraid to be accused of performing abortions. Maybe she didn’t even have the money to afford the ER visit (a whole other issue about how shitty the US is about healthcare).

Look, I’ll be real with you. I used to work with animal control. Laws are different in different places, but when we had dead animals the law was two trash bags, into the dumpster. Trash bag/dumpster seems better to me than flushing it down the toilet. Burying it in the yard like a dead pet? If there are no laws regarding this, Tifton needs to leave this woman alone.",556,2025-03-28 19:45:14,_Ruby_Tuesday
news,1jm2shr,mk8fbq9,"Hey, remember when all the hippies were like ""these laws are going to be used to criminalize miscarriages!"" and the republicans were all ""nah, not us!"" and the hippies were right, just like we always are?",1789,2025-03-28 19:07:01,ActualSpiders
news,1jm2shr,mk8jmxy,"I have suffered from 2 miscarriages and I can say with absolute certainty that if, while healing physically and emotionally from a miscarriage, I had also been arrested for said miscarriage I would be ready to burn everything down.  I can also say with absolute  certainty that I still have not emotionally healed from my miscarriages, and neither has my husband.  It's one of those things where you never actually get over it, but time makes it easier to go about your day.  This is heartbreaking and chilling and I wish this woman infinite strength.",504,2025-03-28 19:28:45,WNYAuntie
news,1jm2shr,mk99qnf,"Step 1: Make healthcare insanely expensive, and allow insurance companies to deny legitimate services. 

Step 2:  Create draconian and constitutionally illegal laws around women's bodily autonomy.

Step 3: Kill Medicare and Medicaid so there are no alternative options for health insurance for the middle and lower classes. 

Step 4: Force as many people into privatized for-profit prisons, which somehow can constitutionally use prisoners for slave labor

Step 5: America has been made great again?",113,2025-03-28 21:41:08,pizquat
news,1k1hl3l,mnm7ces,"> Suspect in custody
1:05 p.m. – A Tallahassee police spokesperson confirmed that one person is in custody but could not confirm any deaths. There were, however, ""multiple injuries.""

A live update on another article.",3914,2025-04-17 17:11:48,Peach__Pixie
news,1k1hl3l,mnnq5yh,"CNN says the suspect used his mom's gun, and that the suspect's mom was a sheriff deputy.",251,2025-04-17 21:42:20,Nomo-Names
news,1k1hl3l,mnmcwqd,"6 patients, 1 in critical condition, the rest in serious condition 

https://www.tallahassee.com/story/news/local/2025/04/17/active-shooter-reported-at-fsu-shelter-in-place-alert-sent-out/83139928007/

Edit: as of 2p  law enforcement has not confirmed any deaths


Edit 2: as of 2:32, NBC reporting one dead, 6 injured


https://www.nbcnews.com/news/us-news/live-blog/florida-state-university-active-shooter-rcna201756

Edit 3: 4:35p according to press conference, 2 dead (not students), 5 injured, they have ID'd the shooter, 20 yo son of sheriff deputy, I did not catch the name, he had access to one of her weapons which was found at the scene",1332,2025-04-17 17:38:07,InformalWish
news,1k1hl3l,mnm615y,Shooter in custody according to CNN.,6066,2025-04-17 17:05:32,Drain_Surgeon69
news,1k1hl3l,mnm3tbn,Reminder that FSU had a similar event back in 2014 when a gunmen went into the library and started shooting kids.,1842,2025-04-17 16:54:57,Naive-Offer8868
news,1k1hl3l,mnm90sk,Yesterday was 18 years since the Virginia Tech shooting 😢,1001,2025-04-17 17:19:46,CPOx
news,1k1hl3l,mnmuu4x,"Sad to think some of these kids are graduates of Stoneman, and most likely experienced their second school shooting of their life. Unreal and awful.",391,2025-04-17 19:05:48,starrfish69
news,1k1hl3l,mnnhi58,"His IG just got taken down, was already private, all I saw was the Bio. Bio was just a quote from Jeremiah: ""You are my war club, my weapon for battle— with you I shatter nations, with you I destroy kingdoms""",154,2025-04-17 20:58:09,Tobeck
news,1k1hl3l,mnm5txr,Actually briefly forgot about mass shootings at schools. Sigh.,935,2025-04-17 17:04:34,politicalpug007
news,1k1hl3l,mnm6pv4,"I live right off campus. My friend is in the midst of it right now. Horrifying situation. Seems like there are some injured, possibly dead. Really really sad and just hoping it’s over soon. We get alerts pretty consistently and there has yet to be an all clear. ",55,2025-04-17 17:08:49,Danyul4u
news,1jmc643,mkamu2x,"""Musk’s attorneys have argued that while his disclosure was filed after an SEC-mandated deadline, this was merely an error and that the tech magnate did not commit nor intend securities fraud.""

Look your honor, I may be a simple a simple country hyper-chicken, but my client did not intend to commit securities fraud, just did.",6130,2025-03-29 02:22:31,Jrk67
news,1jmc643,mkaovso,"I like how Musk portrays himself as the most detail-oriented guy when trying to pretend like he knows what the fuck is going on with SpaceX rockets but then he commits an ""oopsie"" like this. As if he doesn't have somebody on his staff who's job is to deal with this.",2774,2025-03-29 02:35:45,Bobby6kennedy
news,1jmc643,mkanjmo,I get the feeling that lawsuits against Musk won't amount to much. Buying the last election is really paying out for him.,1258,2025-03-29 02:27:05,plaidtattoos
news,1jmc643,mkaptgj,"Never knew this detail:




""In his 43-page opinion, the judge also noted that Musk had posted a tweet on March 26, 2022 indicating he was thinking about buying a different social network, not Twitter, although he had already amassed millions of shares in Twitter as of March 25, 2022.

He wrote, it was “reasonable” to read Musk’s tweet “as a statement meant to misdirect the public to think that buying Twitter was just a fantasy.” The judge also wrote that, “it is more likely than not that Musk issued a material misleading representation,” with those tweets.

Musk ultimately bid on and led a leveraged buyout of Twitter in 2022 in a deal worth about $44 billion. He made sweeping changes to the business, the social platform and later renamed it X.""",600,2025-03-29 02:41:49,Limp-Definition-5371
news,1jmc643,mkan841,It was announced today DOGE was going through onboarding with the SEC. So this will be dismissed at some point,430,2025-03-29 02:25:01,annaleigh13
news,1jmc643,mkammsk,"""In the wallet"" is his weak point.",130,2025-03-29 02:21:15,ninj4geek
news,1jmc643,mkarawp,That turd needs to face all the people he’s screwing over.,38,2025-03-29 02:51:29,MayorCharlesCoulon
news,1jmc643,mkc7jsi,"We need to start applying violent criminal punishments to 'white collar' crimes in this Country.  
This is ridiculous.",61,2025-03-29 11:11:49,MD_Hamm
news,1jmc643,mkd34t0,">In his 43-page opinion, the judge also noted that Musk had posted a tweet on March 26, 2022 indicating he was thinking about buying a different social network, not Twitter, although he had already amassed millions of shares in Twitter as of March 25, 2022.

So the judge is definitely right, Musk (and Twitter) lied publicly to influence the price of the stock.

Luckily, for Musk, for now, he also bought the US government.",21,2025-03-29 14:52:00,mlc885
news,1jmc643,mkatpin,"This has to be why 🍑🍑 pardoned that other guy today… lying to investors to get money is just what these amoral people do, and they have no qualms about using the “if you’re stupid enough to believe me then it’s your own fault” mentality.  They have no business whatsoever being in the Oval Office, too bad their voters cannot seem to see past their aggrieved mentality to see that.",53,2025-03-29 03:07:38,SnoopsBadunkadunk
news,1k1n5bw,mnnj9i7,"“ The program will be suspended at least through September 30 and means the agency will be unable to do planned quality control work around lab testing for the parasite Cyclospora in spinach or the pesticide glyphosate in barley, among other tests, the email says…

The FDA in early April suspended an effort to improve its testing for bird flu in milk, cheese and pet food, as a result of staff cuts.“",3537,2025-04-17 21:06:57,Decent-Ganache7647
news,1k1n5bw,mnnfjwy,Poison themselves to own the libs.,2086,2025-04-17 20:48:33,Scottdg93
news,1k1n5bw,mnnffo1,Stuff like that is basically going to made any food created in the US unsellable to any place in the world with a food standard.,4632,2025-04-17 20:47:59,xondk
news,1k1n5bw,mnnj11p,Ummm… do republicans not eat food?,456,2025-04-17 21:05:46,buttnutz1099
news,1k1n5bw,mnnebgi,"This is going to kill people. 

Guaranteed.",10701,2025-04-17 20:42:34,Skabomb
news,1k1n5bw,mnngia8,Oh good I was hoping I would get worms in 2025,418,2025-04-17 20:53:14,fruitl00ps19
news,1k1n5bw,mnnkm6g,Wtf are my taxes even for anymore?,586,2025-04-17 21:13:57,BahtooJung
news,1k1n5bw,mnnerot,Food safety checks + fluoride + vaccines + deportations = huge decrease of the population in the next years,2198,2025-04-17 20:44:45,Lagas76
news,1k1n5bw,mnniwik,Upton Sinclair is rolling in his grave.,475,2025-04-17 21:05:07,DrNonathon
news,1k1n5bw,mnng9uq,I knew it would end up with me growing my food. Fuck. I hate mowing my yard. How am I going to maintain a garden? lol,634,2025-04-17 20:52:04,HoldOnDearLife
news,1jzy81r,mn9qmru,Just imagine the damage we won't find out about until years later,5516,2025-04-15 17:49:52,1984Slice
news,1jzy81r,mn9rprn,"This story is getting lost in the sauce, but outside of the current disappearing of non-native citizens, this is probably the largest ""wtf omg bbq"" scandal of the administration. DOGE staffers stole 10 gigabytes worth of data from NLRB's network, and then attempted to hide their trail so no one would find out. They're stealing information on almost all americans, but also sensitive information on unions, ongoing legal cases and corporate secrets, including cases involving Musk's companies. It's a long read, but the source is from NPR.  ""https://www.npr.org/2025/04/15/nx-s1-5355896/doge-nlrb-elon-musk-spacex-security",1816,2025-04-15 17:55:06,bob_scratchit
news,1jzy81r,mn9qkh6,DOGE is the cyber breach...,1891,2025-04-15 17:49:34,Feeding2B
news,1jzy81r,mn9rwzb,"I heard about this on NPR. What NPR reported but is not included in this article, is that they detected remote logins using legitimate usernames and passwords, but originating from a Russian IP address. So not only is DOGE removing information, but they’ve given remote access to Russia. 99.9999999% chance this isn’t the only agency they now have access to.

Edit:  it is in the article. I missed it.",528,2025-04-15 17:56:04,RonWill79
