subreddit,post_id,comment_id,comment_content,comment_score,comment_created_at,comment_author
news,1k1s0pn,mnojj5a,"Note this discovery is in conjunction with the US FDA cuts according to reuters [https://www.reuters.com/world/us/us-fda-suspends-food-safety-quality-checks-after-staff-cuts-2025-04-17/](https://www.reuters.com/world/us/us-fda-suspends-food-safety-quality-checks-after-staff-cuts-2025-04-17/)

Highly concerning to US food safety, and wont make it easier for the US to export their agricultural products overseas.
Edit: this occured last year supposedly and was never reported, things are likely far worse now",277,2025-04-18 00:30:52,TheBlessedWant
news,1k1s0pn,mnoqlqg,[deleted],21,2025-04-18 01:14:28,N/A
news,1k1s0pn,mnosovu,"89 cases they know about.  There are undoubtedly hundreds if not thousands of cases not reported.  I’ve been poisoned multiple times, and never once reach the level of statistic.",24,2025-04-18 01:27:30,Ok_Bill227
news,1k1s0pn,mnqzqea,This will happen a lot now since trump fired food safety ppl,15,2025-04-18 12:38:28,HusavikHotttie
news,1k1s0pn,mnopgng,"When Trump was elected the first time people said “We survived Obama, you’ll survive Trump”. Trump shut down the global CDC network, lied about COVID, and 1.2million Americans died. 


It’s happening again.",67,2025-04-18 01:07:19,Blackbyrn
news,1jmysot,mkgay9a,This is for when the DOJ accidentally adds him to their Discord chat.,3570,2025-03-30 01:41:40,GnomeChildHighlander
news,1jmysot,mkfsza7,I know he won’t have internet but will he have a webcam?,1480,2025-03-29 23:52:46,ExultantSandwich
news,1jmysot,mkg5e52,So what are his chances of avoiding life in prison with no parole?,545,2025-03-30 01:07:18,Immediate_Concert_46
news,1jmysot,mkggzvx,"And fix the crappy Civ 7 UI as well, hopefully.",312,2025-03-30 02:19:32,Avatara93
news,1jmysot,mki5kwg,Can someone please explain the Civ VII comments?,110,2025-03-30 11:43:12,SiBlap123
news,1jmysot,mkiuv9v,He has a lot of discovery information; most inmates going to trial are issued one.,23,2025-03-30 14:35:54,Extension-Pen9359
news,1jmysot,mkjbvhv,"Firaxis really needs an intern again, huh.",27,2025-03-30 16:06:39,ShadowStarX
news,1jmysot,mkktpx8,That is a life or death homework assignment.,10,2025-03-30 20:41:33,Mrnicelefthand
news,1jmysot,mkg2ovq,[removed],611,2025-03-30 00:50:45,N/A
news,1jmysot,mkgj1e9,Finally Civ VII is about to get debugged,55,2025-03-30 02:32:56,bighatartorias
news,1k42v5x,mo70jvc,"What's fucking crazy to me is tariffs apply on orders already made.... Planes, or board games, doesn't matter, you get fucked",3681,2025-04-21 02:34:57,McFistPunch
news,1k42v5x,mo7eam8,"Boeing Tech here, this is bad, like really fuckin bad. Billions of dollars of China bound planes just sitting waiting for delivery is going to stack up quick. Boeing doesn't get the final check until it tickets.",1274,2025-04-21 04:08:48,DrothReloaded
news,1k42v5x,mo7652r,I wonder if those “I did that” stickers come in plane-size?,461,2025-04-21 03:10:04,superp2222
news,1k42v5x,mo6z5f2,Did they check the back or bottom of the receipt for the return policy,633,2025-04-21 02:26:17,blownafidesmooth
news,1k42v5x,mo74cyo,"On the upside, I got to leave Hong Kong on Friday with half the junk my in-laws gave us left behind since the HKPO decided it was going to deal with US for a bit. Downside, I'm sure management at Boeing will use this as an excuse to can more engineers that have ever dared to bring up concerns to management. Or get rid of some suppliers. Regardless my local economy is going to take a hit.",196,2025-04-21 02:58:18,MrLetter
news,1k42v5x,mo78orj,Boeing has to be angry. And we know what happens to people who make Boeing angry..,351,2025-04-21 03:27:37,x10FoilHatx
news,1k42v5x,mo7dy15,"It has always been funny to me how people type “If it’s it not made in America, I don’t want it” from their (non) American-made smart phone or laptop.",50,2025-04-21 04:06:06,wm313
news,1k42v5x,mo731ok,[deleted],43,2025-04-21 02:49:50,N/A
news,1k42v5x,mo9gs3x,I work for a US based factory where we ship stuff to Chinese customers. But due to the retaliatory tariffs they cancelled $2.5million worth of orders for the year. Some with as little as 2 weeks lead time.,46,2025-04-21 14:34:09,DaveCootchie
news,1k42v5x,mo7r055,"So rich people refuse to build in USA because they would have to pay way more for labour. But they are fucking over other countries now as well, who provided them w cheap labour. What is the end game here? Cash in from everyone and not give 2 fucks about anything? Drive half the country to job less poverty until they accept slave labour salaries? 

Absolutely wild how out of control this is.",73,2025-04-21 06:03:35,Dtoodlez
news,1k2eu59,mntj6q2,"Headline tomorrow

Man arrested by ICE in Massachusetts moved without notice",3762,2025-04-18 20:35:39,PhoenixTineldyer
news,1k2eu59,mntj5vg,Aaaaand he’s (probably) been moved.,521,2025-04-18 20:35:32,Luckydog12
news,1k2eu59,mntpmna,"People meme, but every single order like this still matters. They are still feigning innocence precisely because they don't have full support for extrajudicial action.",577,2025-04-18 21:09:36,mechajlaw
news,1k2eu59,mntkenm,"ICE: \*Sends him to El Salvadorian Death Camp\* ""What are you gonna do about it, huh?""",375,2025-04-18 20:42:03,MalcolmLinair
news,1k2eu59,mntrxoi,Judges should start holding the ICE officers themselves in contempt. Throw a few of them in jail and see what happens.,198,2025-04-18 21:22:08,Dry-Amphibian1
news,1k2eu59,mnuz6it,[deleted],37,2025-04-19 01:43:02,N/A
news,1k2eu59,mntxfkg,[removed],63,2025-04-18 21:52:46,N/A
news,1k2eu59,mntubiq,These guys are Nazis.  Done sugar coating things.  These are the lunatic rejects who couldn’t get hired at a legitimate law enforcement agency (not that those are much better).,110,2025-04-18 21:35:20,Chi-Guy86
news,1k2eu59,mnvcnqg,Can we start figuring out who these agents are? They deserve to have their names be public.,23,2025-04-19 03:13:19,ratbaby86
news,1k2eu59,mntp6km,Is one allowed to defend themselves if any entity attempts to arrest them without due cause or a warrant?,45,2025-04-18 21:07:13,KaputtEqu1pment
news,1jt20he,mlqvdum,Gretzky scored 894 in 1487 games.  Ovi scored 895 in his 1487th game.,2840,2025-04-06 19:22:47,Zendani
news,1jt20he,mlqxdty,"Gretzky is one of two athletes that I never thought we'd see someone break their records (Jerry Rice being the other). This is pretty wild.

Gretzky's assists record though...no one will ever touch that.

EDIT: Guys, I know there are single record holders that are near impossible to beat. I was talking two players that hold multiple records unlikely to be broken. Two completely dominate players in their respective sport.",803,2025-04-06 19:33:50,GoodOlSpence
news,1jt20he,mlqviaa,"I'm only a casual hockey viewer, but was Gretzky's all-time goals record comparable to Kareem's all-time points record or a lot more difficult?",175,2025-04-06 19:23:28,mudturnspadlocks
news,1jt20he,mlqv70s,Wayne Gretzky is a MAGA clown,1405,2025-04-06 19:21:45,one_pound_of_flesh
news,1jt20he,mlrth0l,My favorite bumper sticker of all time was something I saw in Los Angeles late 80’s/early 90’s that said “JESUS SAVES……Gretzky gets the rebound and scores!!”,18,2025-04-06 22:31:29,ryansports
news,1jt20he,mlqwbm0,"The Great Once up there chilling with Kash Patel.

Every single person in this current administration is doing anything but actual work during a stock market crash",140,2025-04-06 19:27:55,Skidmarkthe3rd
news,1jt20he,mlqx7nj,"As some extra context for people who don't follow hockey, Ovi was robbed of 155 games due to NHL lockouts in 2004 and 2013 as well as the shortened covid season. Were it not for that he'd have broken it likely several seasons ago. He also broke his leg this season and missed 5 weeks in recovery. And despite all that, he still scored 42 goals to pass the Great One for the all time lead. Had he not missed time this year, there's a good chance he'd have the lead for most goals on the season too. A truly remarkable player and remarkable moment for the sport.",64,2025-04-06 19:32:52,TangibleTurian
news,1jt20he,mlrjwge,who cares. f the ruzzan comrade,6,2025-04-06 21:34:56,SGman1972
news,1jt20he,mlsnn9a,"Good, gretzky is a scumbag anyway",11,2025-04-07 01:40:20,actin_spicious
news,1jt20he,mlqxbs2,"There honestly isn't a player more deserving of this record.  Ovi never chased the cup, he played his entire career with the Caps and in 2018, the cup came to him. One of the best champions of the game today. Congratulations Ovi, you earned this record and I'm sure it will stand for many years.",39,2025-04-06 19:33:31,Crazy-Canuck463
news,1jpr1so,ml1ar63,"What we were sold : Computer whiz-kids will optimize government!

What we think we got : Computer hackers will gut government.

What we actually probably got : Computer script kiddies are taking your data.",3226,2025-04-02 15:16:57,supercyberlurker
news,1jpr1so,ml1hc5u,"> Stanley ran a series of websites and forums starting as far back as 2006, when he was 15, registration data preserved by the internet intelligence firm DomainTools shows. Several of those sites distributed pirated ebooks, bootleg software and video game cheats, according to copies maintained by the Internet Archive, a nonprofit whose 'Wayback Machine' preserves old websites....

> In the hours after Reuters contacted Stanley, several of his old websites vanished from the Internet Archive. Mark Graham, director of the Wayback Machine, declined to answer specific questions about the disappearance of Stanley’s websites but said people who own the rights to sites can request to have their content withheld from the archive.

He immediately got some of his websites removed from the Wayback Machine to try and cover it up. So sad.",393,2025-04-02 15:49:51,RunDNA
news,1jpr1so,ml1didh,"We once hired a college intern and on his first day he was bragging about hacking and was playing around with a keylogger on his own laptop. We walked him out on the spot, called the school and said his internship was canceled. You have to be able to trust employees you're giving access to sensitive data (or even could potentially have access, like an intern). No amount of talent or skills can override a lack of trust.",542,2025-04-02 15:30:50,che-che-chester
news,1jpr1so,ml1bnmq,"As an infosec pro, I can say that's pretty common. The difference here is that normally there's 20 years of personal and professional development happening between screwing around as a teenager and having significant responsibility in an organization.",427,2025-04-02 15:21:33,caleeky
news,1jpr1so,ml1b9f3,"Throughout history, philosophers, scientist, and theologians have often pondered who is the biggest bitch. They can now say, without any doubt, that Elon musk is the biggest, most gigantic bitch. Huge bitch. If there was a mount bitchmore, elons head would be there over and over again. Truly a humongous cunt, I mean bitch. Musk’s bitchiness is beyond measure. He is such a bitch, even his kids hate him. Such a cunty bitch. 

Fuck that guy. ",244,2025-04-02 15:19:32,PoopTransplant
news,1jpr1so,ml1hwmt,My parents are convinced the doge folks are the cream of the crop. Super smart guys that can do no wrong. I guess short of them losing Medicare and social security checks what will it take to convince them otherwise. Unfortunately I think something drastic needs to happen for people to actually wake up.,55,2025-04-02 15:52:39,MrMichaelJames
news,1jpr1so,ml1at3z,when you use personality B around group A,16,2025-04-02 15:17:14,lastdarknight
news,1jpr1so,ml28dw3,I just finished taking a graduate-level IT risk assessment course. Honestly I don't know why I bothered if this is how we're gonna run the government. Like literally every single thing in the course is the opposite of what I read on the news.,15,2025-04-02 18:00:01,creamiest_jalapeno
news,1jpr1so,ml1bl1c,As a sys admin what I see when I read this title is “DOGE employee at DOJ just read article about how to unlock O365 products without a license”,62,2025-04-02 15:21:12,One_Anything_2279
news,1jpr1so,ml1c3u8,Funny how just that alone would keep them from getting a top secret clearance.   Guess all that is just a suggestion now,33,2025-04-02 15:23:50,tevolosteve
news,1k4i0uz,moa48kk,">Patrick Crusius was automatically be sentenced to life in prison without parole in the massacre near the U.S.-Mexico border. The change of plea comes after local prosecutors took the death penalty off the table.

>El Paso County District Attorney James Montoya declined to pursue the death penalty, saying that decision was driven by a majority of victims’ relatives who want the case to be over.

I can see the sentiment of just wanting to not think about it anymore. The murderer is 26 now and will likely spend decades in [a Texas prison](https://www.texastribune.org/2022/08/24/texas-prisons-air-conditioning/).",1222,2025-04-21 16:45:43,AudibleNod
news,1k4i0uz,moa5uz0,"> About 100 people from victims’ families were seated in the gallery behind a few rows reserved for media, prosecutors and Crusius’ defense team. They will be given the time to give victim impact statements starting Monday afternoon. Dozens made emotional statements during a similar hearing in federal court in 2023 that lasted for three days.

> The people who were killed at Walmart ranged in age from a 15-year-old high school athlete to elderly grandparents. They included immigrants, a retired city bus driver, a teacher, tradesmen including a former iron worker, and several Mexican nationals who had crossed the U.S. border on routine shopping trips.

Those people leave behind a legacy of loved ones who will keep their memories alive. 100 loved ones to share their stories. This man leaves no legacy but hatred, and will be remembered as a bigoted monster. May he rot in prison and fade into obscurity.",203,2025-04-21 16:53:39,Peach__Pixie
news,1k4i0uz,moa51vw,"So death for the UHC CEO murderer, but this dude gets to live?  Cool.  Cool.",2224,2025-04-21 16:49:43,Pdxduckman
news,1k4i0uz,moa59m2,"Wait, hold on. This guy kills 23 people in a racist attack and isn't considered a terrorist, but a guy killing a corrupt CEO is a terrorist?",1091,2025-04-21 16:50:46,CaffeineChaotic
news,1k4i0uz,moa5yfl,"> The online rant speaks of a “Hispanic invasion of Texas.”

>“They are the instigators, not me,” it says. “I am simply defending my country from cultural and ethnic replacement brought on by an invasion.”


Asshole never studied U.S. history, clearly. It’s the other way around.",282,2025-04-21 16:54:07,ladyoffate13
news,1k4i0uz,moadhp0,"23 people. Killed. In a grocery store.  

Make it make sense. 2 is horrible but 23????",50,2025-04-21 17:30:11,FranksWateeBowl
news,1k4i0uz,moaiwao,"It's important to note that you cannot appeal a conviction in which you plead guilty to with much chance of success. 

Most appeals that are successful aren't about innocence, but procedural mistakes by the prosecution and law enforcement officers in the case. 

As high profile as this is, I imagine that the last thing anyone wants is for someone to have made one tiny mistake in an otherwise open and shut case and this guy go free because of it. There is still the fact that the judge can alter sentencing, and order modifiers such as without parole, or non concurrent sentences, meaning a separate life sentence for each victim, to be stacked on top of each other. 

I'm not a huge fan of the death penalty, but that's not the only way to make sure this man never walks away free.",18,2025-04-21 17:55:53,ETxsubboy
news,1k4i0uz,moakl7d,"I was just thinking about this the other day. Some madman guns down Hispanics at Walmart enraged at Mexicans under Trump's stoking of hatred, for said group. Mad man kills a mother and father leaving a baby homeless. Uncle of the baby is a MAGA lover, finds out Trump is coming, first thought is not overwhelming grief for his lost sister and orphaned niece, no he thinks! Bingo! If I grab the baby like a prop and head back to hospital where my sister and brother in law just died, maybe I can get a picture with Trump! https://www.theguardian.com/us-news/2019/aug/09/trump-el-paso-melania-orphan-baby-thumbs-up
And he got his picture. I always think of this when people get shocked that the maga won't turn on him.",26,2025-04-21 18:04:04,exitpursuedbybear
news,1k4i0uz,moe7ccz,So let me get this straight. Killing 23 Mexicans and injuring 21 more only gets you life in prison. Killing a single white CEO gets you an instant death penalty. Is that about right?,14,2025-04-22 07:21:33,Neobullseye1
news,1k4i0uz,moac8pr,"Five and a half frikkin years to get here? He posted his manifesto on one of the chan sites.


 OFC the families just want to move on now. IT'S BEEN OVER FIVE YEARS.",16,2025-04-21 17:24:16,SsooooOriginal
news,1joy1r1,mkvm5hu,Lawyers doing what they can with lawsuits in system thats already being undermined. But its up to general public to call representatives and join protests to show how unpopular these cuts are,1252,2025-04-01 16:24:02,apple_kicks
news,1joy1r1,mkwfv0m,"STATE OF COLORADO; STATE OF RHODE ISLAND; STATE OF CALIFORNIA; STATE OF
MINNESOTA; STATE OF WASHINGTON; STATE
OF ARIZONA; STATE OF CONNECTICUT;
STATE OF DELAWARE; DISTRICT OF
COLUMBIA; STATE OF HAWAI‘I; STATE OF
ILLINOIS; OFFICE OF THE GOVERNOR ex rel.
Andy Beshear, in his official capacity as Governor of the COMMONWEALTH OF KENTUCKY;STATE OF MAINE; STATE OF MARYLAND; COMMONWEALTH OF MASSACHUSETTS; STATE OF MICHIGAN; STATE OF NEVADA;STATE OF NEW JERSEY; STATE OF NEW MEXICO; STATE OF NEW YORK; STATE OF NORTH CAROLINA; STATE OF OREGON; JOSH SHAPIRO, in his official capacity as Governor of the COMMONWEALTH OF PENNSYLVANIA;
and STATE OF WISCONSIN

There’s the list after clicking 3 links so you don’t have to",410,2025-04-01 18:55:20,HulkDeez
news,1joy1r1,mkw7mui,"For the sake of the American people, let's hope they win.

Contact your Congressional reps.  Tell them you are unhappy that your, your friend's and your family's health are being put in jeopardy",164,2025-04-01 18:13:02,rhino910
news,1joy1r1,mkwly7m,"SUE HIM? How about impeach him?

Edit and this time remove his ass.",96,2025-04-01 19:26:49,Q-ArtsMedia
news,1joy1r1,mkvn0ll,Are any of those states republican states?,102,2025-04-01 16:28:30,LazyNeighborhood7287
news,1joy1r1,mkxahky,April 5th. Fid a local protest in your area.,13,2025-04-01 21:33:06,MrJohnqpublic
news,1joy1r1,mkxqy2j,"States needs electoral reform.

The end

It's a mediocre system full of loop holes and corruption at every level and Trump has truly exposed it.",9,2025-04-01 23:07:13,Demetre19864
news,1joy1r1,mkxzilg,"Louisiana had millions cut in grants treating mental health and substance abuse. My mental health care was being paid for by one of these grants. It was a real god send as I care for and support my 84 year old elderly father as well as myself and things are very tight around here. But now I'm just screwed. And there is seemly no where to turn and no one in the entire state that cares. I hate it here. I should add, I didn't vote for the moron in office and I've never voted or supported the GOP in any way, shape or form.",7,2025-04-01 23:57:55,HandfulOfMassiveD
news,1joy1r1,mkwqhiz,"I do not have any faith that our judiciary will check or balance anything the Trump admin does. There will be some judges that stand up, but they’ll just be removed, silenced, ignored, or overruled by the wildly corrupt Supreme Court.",13,2025-04-01 19:50:19,JohnnyGFX
news,1joy1r1,mkxsy85,I'll bet Indiana isn't one of them. Our AG is busy mocking gay people for April fool's day.,8,2025-04-01 23:18:51,Sour_baboo
news,1k35ilh,mnzjjl4,"This reminds me of the diabetic dad that died with his 18month old toddler that curled up next to him and died. 

The neighbor heard stuff, but never alerted anyone.",4932,2025-04-19 20:54:06,yankykiwi
news,1k35ilh,mnzq4g7,Stories like this make me wish I had some sort of wellness check in set up to protect my child and dogs in case something happened to me and my partner.,4241,2025-04-19 21:31:28,Jai84
news,1k35ilh,mo0j4wq,Am I stupid i feel like im having a stroke trying to read the title,662,2025-04-20 00:22:04,SugarRushLux
news,1k35ilh,mo0jvam,"""neighbors told the cops they heard the 4 year old screaming for days"" and yet no one called the police for a wellness check. The cops only came after family found them dead. That's NYC for you, especially deep Brooklyn and the Bronx. 🙄",726,2025-04-20 00:26:38,epsteindintkllhimslf
news,1k35ilh,mnzghn7,Not suspicious? How does a mother and 8 year old child dying at the same time be deemed not suspicious?,1065,2025-04-19 20:37:18,FireFairy323
news,1k35ilh,mo1jcmw,"I remember hearing a neighbors kid screaming one night. He was sobbing and yelling ""Momma, wake up!!""  

I think he was 4 or 5. 

Well I called police and told them what I was hearing. 

Ended up the mom had od'd and she was gone.",27,2025-04-20 04:25:44,Successful_Guess3246
news,1k35ilh,mo03zqa,Thank god someone found her I can’t think of a worse city to try to get help from others by screaming.,182,2025-04-19 22:51:54,Y0___0Y
news,1k35ilh,mo2kw25,"I text with my son every morning and usually in the evenings. We call it ""proof of life.""",39,2025-04-20 10:43:23,hanksmom96
news,1k35ilh,mo0gstp,Give that girl all the therapy.,78,2025-04-20 00:07:34,Ar_Ciel
news,1k35ilh,mo0qmha,Talk about life long trauma...,31,2025-04-20 01:08:39,stinkyelbows
news,1jwlq0f,mmjercs,Time to dye those potatoes 🥔.,1665,2025-04-11 10:16:14,kgl1967
news,1jwlq0f,mmjljcp,This just gave me a flashback to 2020 when covid would be over by Easter lmao I forgot about that,415,2025-04-11 11:15:10,Affablesea9917
news,1jwlq0f,mmjacds,"Wait, I thought fuckface said egg prices went down, even though I grocery shop and see egg prices every day? Fuckin liars.",1327,2025-04-11 09:32:13,JonnyChimpo420
news,1jwlq0f,mmjlh08,"Dang, so we're still not to ""day one""?

Color me surprised!",63,2025-04-11 11:14:39,jimtow28
news,1jwlq0f,mmjcvic,Honestly this is what you get for electing a fucking moron. You wanted cheap egg prices - you should have elected the decent human instead of the fascist.,2551,2025-04-11 09:57:55,vagabending
news,1jwlq0f,mmjuw82,"Biden crime family strikes again 

No wait ... I mean 

Paying more for eggs is the patriotic thing to do 

/s",42,2025-04-11 12:22:16,Ja_Oui_Si_Yes
news,1jwlq0f,mmjbpe0,"I mean eggs went down $5 per 3 dozen for me, but they were probably the highest in cali.  $23.99 -> $18.99 for 36 eggs....",156,2025-04-11 09:46:17,theRealtechnofuzz
news,1jwlq0f,mmjc7o8,"The prices are not going to come back down, not as low as they were anyway. Profits are going to be higher than ever this year.",136,2025-04-11 09:51:22,will_write_for_tacos
news,1jwlq0f,mmk5p3n,"So all those signs in my area that say ""He is risen"" is really just talking about egg prices?",26,2025-04-11 13:28:15,bad_syntax
news,1jwlq0f,mmkcmnt,"We are going to paint rocks & potatoes this year. 

Honestly whenever my children want to paint something, I tell them to go find a rock anyways and they go wild for it.",26,2025-04-11 14:05:08,AKiloOfButtFace
news,1k37uzx,mnzyjdp,To the surprise of absolutely no one,1785,2025-04-19 22:20:06,KingHardrath17
news,1k37uzx,mnzyp52,"Of course the russians are breaking their deal. They break every deal they sign. It is a known quantity.

Too bad we have a russian asset in the white house now. Things are only going to get worse. Set your watch by it.",612,2025-04-19 22:21:03,johnrraymond
news,1k37uzx,mnzyyzs,Of course. Putin never intended to honor the truce. The only purpose of it was propaganda to state that Ukraine was breaking it.,198,2025-04-19 22:22:41,schu4KSU
news,1k37uzx,mnzzoc0,Tomorrow Trump will complain that Ukraine didn‘t accept Putin‘s offer and announce this is the reason the US can‘t do anything anymore to end the war.,146,2025-04-19 22:26:52,Petit_Nicolas1964
news,1k37uzx,mo0097v,A ceasefire with Russia just means that you aren’t allowed to fire back.,59,2025-04-19 22:30:16,PioliMaldini
news,1k37uzx,mo02a8l,I still don't understand why there's so many Americans and bots claiming Zelensky is the reason the war is continuing when it could all end tomorrow if the Russians just fuck off back to their own country considering THEY are the ones invading!!!,66,2025-04-19 22:41:56,Khaos25
news,1k37uzx,mo005do,I'm starting to think this Putin guy isn't all that honorable.,33,2025-04-19 22:29:39,MisterProfGuy
news,1k37uzx,mo00wyu,"Well it's an Easter truce, so no bullets must travel East. Had it been a Wester truce, Russia would not fire.

/s",13,2025-04-19 22:34:06,imaketrollfaces
news,1k37uzx,mnzzn54,There will be fires and death around Ukraine and orange head will be on TV Monday saying how great Putin was to implement the truce.,6,2025-04-19 22:26:40,TigerUSA20
news,1k37uzx,mo01028,Sounds about right. If Putin was honorable or had a sense of fairness then the invasion never would have happened.,4,2025-04-19 22:34:35,mudturnspadlocks
news,1jwz8tj,mmmfogc,">Khalil, who has a green card, is a lawful permanent resident. In ordering Khalil's deportation, Rubio relied on a rarely used federal statute from the 1950s that played a major role in shaping American immigration during the Cold War. The McCarran-Walter Act, or the Immigration Nationality Act of 1952, gives the secretary of state authority to decide that a noncitizen's presence in the United States threatens the country's foreign policy goals.

Just what are America's foreign policy goals?",11458,2025-04-11 20:18:51,AudibleNod
news,1jwz8tj,mmmg1ln,ICE is moving people to states with friendly judges for kangaroo like courts,1638,2025-04-11 20:20:41,apple_kicks
