comment_id,content_id,platform,content,created_at,score,author,source_name
mlbkjfn,1jqwzaa,reddit,"Damn, they broke tenure. Even if they had a good reason, without going through due process, this will ruffle a lot of feathers.

And, if everything's on the up and up, why wasn't there due process?",2025-04-04 04:09:55,45,the_gouged_eye,news
mla9qgd,1jqwzaa,reddit,This is a weird story to publish. If he was fired and has his house and another property searched by law enforcement but they also refused to comment. The Trump administration is looking for any negative news story it can put out about immigrants but this is the type of immigrant the US would want. DHS hasn't commented yet and the Wangs seem like they're ready to move on without mentioning what the investigation was possibly about. I associate their lawyer advised them to hush up for a specific reason. We will have to wait & see.,2025-04-03 23:08:32,150,NewToHTX,news
mlbm47k,1jqwzaa,reddit,"His lawyer’s last name is Covert?

This such a strange story.",2025-04-04 04:22:20,14,beauty_and_delicious,news
mlaimfx,1jqwzaa,reddit,There’s rumors he was looking at electronic voting systems.,2025-04-04 00:01:11,46,baconcheeseburgarian,news
mldbupd,1jqwzaa,reddit,"> Attorney Jason Covert

r/NominativeDeterminism?",2025-04-04 13:20:18,5,TheSultan1,news
mle9gm9,1jqwzaa,reddit,This is a good and early lesson for those who are top of their field in anything which can be used for war. Be prepared to have your own issues. Total conspiracy but I am assuming more professors will face this issue.,2025-04-04 16:13:55,3,YolandasLastAlmond,news
mlak8ks,1jqwzaa,reddit,I’m assuming this is some SCP type coverup,2025-04-04 00:11:13,4,imaginary_num6er,news
mlc73gk,1jqwzaa,reddit,My bet is he's a spy and they'll trade him for one of ours.,2025-04-04 07:29:14,-9,PadishahSenator,news
mooswb4,1k67egq,reddit,"It's wild how little the media seems to talk about the fact that a law that allows people to be deported as ""security risks"" for saying things the government doesn't like is about as clear cut of an example of abridging the freedom of speech as you can get.  It seems like the only time an outlet brings up the blatant 1A violation is if they're quoting someone else.  You'd think a free press would be more concerned with these violations.


If our courts weren't so hopelessly corrupted by authoritarian right wingers this sort of shit would be shot down immediately and repeatedly.",2025-04-23 22:23:44,99,Squire_II,news
mop2d6y,1k67egq,reddit,"Hopefully being located in Vermont will give him a stronger chance at bail! Others who've had their hearings (Khalil and Öztürk) have been denied - no surprise, considering the system in Louisiana is corrupt as hell.",2025-04-23 23:16:15,28,gdmaria,news
mn4dbd8,1jz82xx,reddit,Man they're gonna make and example out if him,2025-04-14 20:21:58,179,eawilweawil,news
mn4ile4,1jz82xx,reddit,What are they doing about the man who set fire to Governor Shapiro's residence?,2025-04-14 20:48:44,118,TableAvailable,news
mn5f90u,1jz82xx,reddit,Imagine being 40 years old and getting busted for this stupid shit.  What a fool.,2025-04-14 23:51:40,14,Worldly-Horse5006,news
mn4dtk8,1jz82xx,reddit,"Well, he committed a crime, him being charged is exactly what we should expect. I'd be more inclined to call what Trump is doing to the country 'domestic terrorism' - than what this guy did though.",2025-04-14 20:24:31,44,supercyberlurker,news
mn4finy,1jz82xx,reddit,[deleted],2025-04-14 20:33:07,21,N/A,news
mn4sn9d,1jz82xx,reddit,We’re in an era of increasing political hostility and acts of violence. And it’s only going to get scarier,2025-04-14 21:41:59,6,amanam0ngb0ts,news
mn5uiyu,1jz82xx,reddit,[removed],2025-04-15 01:22:37,3,N/A,news
mn4dxnf,1jz82xx,reddit,Sounds like self-defense with Tesla's safety track record,2025-04-14 20:25:05,1,Alaska_Question,news
mne0v0b,1jz82xx,reddit,"Wait what?!?!?!? New Mexico doesn't allow EV sales last I heard.


I see....... so there was a thing 1 year ago. Tesla started selling on Tribal lands..... New Mexico hadn't allowed this previously",2025-04-16 11:08:32,1,Porkyrogue,news
mn546d8,1jz82xx,reddit,I'm sure it won't be long before they send him to the death camp at CECOT.,2025-04-14 22:47:51,0,SweetDove,news
mn5zwau,1jz82xx,reddit,"Vandalism and property destruction don’t even hurt Musk or Tesla since insurance covers the damage. You want to hurt Musk? Continue to shame Tesla owners and to sink Tesla sales, including the pre-owned market, thereby plunging the stock value. Tesla is already losing international market share. Bring that home.",2025-04-15 01:55:23,0,eremite00,news
mn4j4m1,1jz82xx,reddit,Not the hero we want but...,2025-04-14 20:51:25,-10,lowendslinger,news
mn4zd09,1jz82xx,reddit,"With how things are, and now it's wondered, before reading the article I wondered if the Tesla Dealership and GOP headquarters were the same building.  

The fucking White House is a fucking Tesler showroom, so who the fuck knows anymore.",2025-04-14 22:19:49,-4,Who_Dafqu_Said_That,news
mn506n8,1jz82xx,reddit,"He shouldn't plead guilty. He may be surprised at how many ""friends"" he has.",2025-04-14 22:24:31,-6,Ok_Cook_6665,news
mn4pkz5,1jz82xx,reddit,So some innocent patsy they pulled in off the street,2025-04-14 21:25:23,-8,DylanRahl,news
mn515rr,1jz82xx,reddit,The “justice” department has forsaken credibility in all matters.,2025-04-14 22:30:09,-7,sevotlaga,news
mn66bhz,1jz82xx,reddit,No one is saying anything about the GOP HQ being at the Tesla dealership.,2025-04-15 02:35:33,0,meowsaysdexter,news
mn4j7xp,1jz82xx,reddit,"What do you mean ""arson?""  When did the Orange Dumpsterfire's administration stop calling this ""terrorism?""",2025-04-14 20:51:53,-14,Idiot_Esq,news
mn4triw,1jz82xx,reddit,"Does Pam already have him convicted on heresy. Did somebody hear tell that his friend thinks he solid it. 

So it's all done then. Have him ready to Fly to El Salvadore. Now

Hopefully /s",2025-04-14 21:48:06,-7,merrittj3,news
mna5y5n,1jz82xx,reddit,40 years old and burning shit like a 15 year old lol.,2025-04-15 19:06:28,0,jdubius,news
mn63doc,1jz82xx,reddit,The next dem potus must pardon this guy. He’s a real patriot unlike the fake ones on 1/6.,2025-04-15 02:16:59,-2,individualine,news
mm5a67v,1juv5vt,reddit,Literally no international students will come to the US anymore. I wonder if anyone thought about the economic impact of that move. Let alone the brain drain.,2025-04-09 02:26:35,363,hdiggyh,news
mm5dy4n,1juv5vt,reddit,This is the rhetoric they're going to use. Only a small number of visas were revoked. Only a small number of legal immigrants were sent to super prisons thousands of miles away. Give them an inch and they'll take a mile. This is unacceptable.,2025-04-09 02:49:28,134,grayjelly212,news
mm5ebjg,1juv5vt,reddit,Just a lil bit of fascism,2025-04-09 02:51:52,71,June_Fatality,news
mm5w9hw,1juv5vt,reddit,"Sure, ""small"" number with no actual figures even though they know.",2025-04-09 05:03:58,24,macross1984,news
mm7gnnk,1juv5vt,reddit,"This just happened at uw-madison too, even some teacher visas revoked.",2025-04-09 13:18:24,7,piasenigma,news
mmrz2fu,1juv5vt,reddit,If the number is greater than zero it’s too many.,2025-04-12 18:53:37,3,Kidatrickedya,news
mm5taos,1juv5vt,reddit,Lots of people not realizing this is over general immigration issues and not the protests according to the article itself.,2025-04-09 04:39:39,-72,spinosaurs70,news
mk6nqbj,1jlurun,reddit,Meanwhile more drugs continue to go over into Canada a week than any month the other way.,2025-03-28 13:55:09,170,Hicalibre,news
mk743g3,1jlurun,reddit,I think we're gonna need a street name for eggs soon. Any ideas?,2025-03-28 15:18:06,35,MadRaymer,news
mk7m3d9,1jlurun,reddit,"I still don't understand egg smuggling. Like sure they cost a lot more than they did pre covid, but they're still really cheap by volume/weight. Just seems high risk low reward.",2025-03-28 16:45:57,26,Dr_thri11,news
mk7arir,1jlurun,reddit,Is there a subreddit for oddly uplifting news?,2025-03-28 15:50:30,6,econhistoryrules,news
mkd2unm,1jlurun,reddit,Egg smuggling…straight to El Salvador jail.,2025-03-29 14:50:27,2,Fit-Significance-436,news
mk7uy3h,1jlurun,reddit,"This headline is objectively funny. At first glance, I was going to guess it was from The Onion",2025-03-28 17:27:48,2,onegonethusband,news
mk990g9,1jlurun,reddit,Lmao going well over in America then,2025-03-28 21:37:15,1,Jamie00003,news
mk6qk5e,1jlurun,reddit,"Anyone can be Han Solo if you think about it.


Edit: I guess people don't understand smuggling?",2025-03-28 14:10:04,-3,jimjimmyjimjimjim,news
mk38x0a,1jlg74i,reddit,Those tariffs are really helping to bring back jobs apparently...,2025-03-27 22:53:15,455,iamjoesredditposts,news
mk3cklz,1jlg74i,reddit,When only rich people can afford to buy cars there will be a lot more layoffs and less buyouts. That's what Trump's tariffs will do.,2025-03-27 23:11:43,61,wish1977,news
mk5wewf,1jlg74i,reddit,"Stellantis was already in trouble before this.

Private equity running a company into the ground.  Then craters when market conditions turn foul",2025-03-28 10:53:05,22,Drak_is_Right,news
mk3c0on,1jlg74i,reddit,Just a reminder that Sean O'Brien helped elect Trump.,2025-03-27 23:08:51,100,brickyardjimmy,news
mk3ehd3,1jlg74i,reddit,[removed],2025-03-27 23:21:41,38,N/A,news
mk5ndbx,1jlg74i,reddit,"America, the new Cuba with most everyone driving ""vintage"" cars for the foreseeable future.",2025-03-28 09:25:29,13,tomorrow509,news
mk3dzsx,1jlg74i,reddit,But MAGA folks keep telling me Stellantis is going to open more plants thanks to Trump. Now I'm confused. /s,2025-03-27 23:19:06,21,BunPuncherExtreme,news
mk4ghhy,1jlg74i,reddit,Grab your ankles union boys.  You get what you voted for.,2025-03-28 02:56:16,29,outerproduct,news
mk6cbn7,1jlg74i,reddit,"the automaker had a challenging 2024, dealing with issues ranging from lower sales to high inventories

Wow. Peak journalism.",2025-03-28 12:49:14,6,coconutpete52,news
mk4upx4,1jlg74i,reddit,"Wait, I thought the UAW was going after Tesla to unionize.",2025-03-28 04:35:11,3,timotheusthegreat,news
mk6mjyw,1jlg74i,reddit,"Don't worry folks

The new 2027 Dodge Durango will save the company

The President said credit is owed to his ~~tariff policies on autos~~  ,  ~~paused tariff policies~~ ,  ~~re-instated tariff policies~~  , ~~delayed tariff policies~~ ,  tariff policy announcements",2025-03-28 13:48:49,2,RJ5R,news
mk62lpx,1jlg74i,reddit,Going to be a rocky few years for the industry.,2025-03-28 11:43:30,2,kmurp1300,news
mk6n0ca,1jlg74i,reddit,They don’t have the guts to blame Trump.,2025-03-28 13:51:16,1,Relevant-Doctor187,news
mkcsht3,1jlg74i,reddit,You will own nothing and be happy. Stick your thumb out and hail a robo taxi.,2025-03-29 13:49:49,1,tgrv123,news
mk46hej,1jlg74i,reddit,All the car production has been shifting to Mexico.,2025-03-28 01:56:50,-6,KaleLate4894,news
mk3qha4,1jlg74i,reddit,Buy out and bust the union. When the manufacturing job comes back they can pay non-union workers pennies on the dollar.,2025-03-28 00:26:14,-31,Murauder,news
ml9md3f,1jqq61k,reddit,A true Kakistocracy at work. This administration has been nothing short of a shit volcano since day one. Their main goal literally appears to be just doing widespread evil.,2025-04-03 20:58:42,90,ScoutsterReturns,news
ml9nsp8,1jqq61k,reddit,"Also relied on hunches, horoscopes, inklings, urges, and auras

Nothing is a bigger or more pressing threat to the U.S. than trump and his rape gang administration",2025-04-03 21:06:02,62,KlingonLullabye,news
ml9g0cc,1jqq61k,reddit,"I have an anime tattoo with a katana on it. I criticized the US government and its people's education level on my social media posts.

It is best for me to not visit US and I should wear this privilege like a badge of honour.",2025-04-03 20:27:38,99,okiioppai,news
ml9rwkz,1jqq61k,reddit,"Thanks, Obama. Weird how fascist tactics right out of a fearful rightwing conspiracy theory about Democrats is suddenly a real thing run by Republicans and it's fine. This is worse than their fantasyland version of Jade Helm.",2025-04-03 21:27:38,20,threehundredthousand,news
ml9q7e1,1jqq61k,reddit,Just mindlessly following orders like a good evil lapdog,2025-04-03 21:18:32,6,yunabladez,news
ml9zb5l,1jqq61k,reddit,When stupid evil people do evil shit stupidly it's still evil,2025-04-03 22:08:15,6,DiceMadeOfCheese,news
mlabzt6,1jqq61k,reddit,"Ah yes, the gold standard for evidence.",2025-04-03 23:21:37,3,Iridefatbikes,news
mlcj8ae,1jqq61k,reddit,I mean the tariffs are based off of chatGPT so…,2025-04-04 09:40:58,3,xUKLADx,news
mlary1a,1jqq61k,reddit,"Fits the pattern Republicans use. During the War on terror, having a casio wrist watch was enough to be deemed a terrorist. So not surprised at all",2025-04-04 00:59:09,4,hypoch0ndriacs,news
mlgs24w,1jqq61k,reddit,It's amazing that they're denying them due process and skipping deportation to imprisonment in a third country.  This administration is quickly stacking up charge after charge that will have to be adjudicated at the Mar-a-Lago trials.,2025-04-05 00:22:45,2,edingerc,news
mle5egj,1jqq61k,reddit,"When Trump and others are finally arrested, ""I was just following orders"" won't cut it.",2025-04-04 15:53:27,1,korkythecat333,news
mlnekx2,1jqq61k,reddit,D U E  P R O C E S S ! ! !... or it's corruption.,2025-04-06 04:12:43,1,catbaloney,news
mlapt41,1jqq61k,reddit,Look not a fan of Trump and co. but he was elected last November and everyone knew this was going happen.  People delete your shit off the internet if you are in the sights of these people. Don't make it easy for them.,2025-04-04 00:45:45,-4,Accurate_Zombie_121,news
mosd45t,1k6sctb,reddit,">Non-alcoholic beer has, however, been seeing a huge increase in sales in Germany as those of alcoholic beverages fall.

People are just switching to non alcoholic drinks.",2025-04-24 13:43:07,167,Ahstruck,news
mosv20s,1k6sctb,reddit,"According to my bank account, yep. I used to buy about $200 in Weihensptephaner, Hofbrau, Spaten and Fruh every month. Now it's down to less than $100.",2025-04-24 15:12:10,46,Rambos_Magnum_Dong,news
motjytz,1k6sctb,reddit,"US brewer here: sales are down domestically too. Everyone across the board has pretty much been struggling since Covid to regain their footing, particularly with on-premise sales (draft accounts). Things just aren’t the same anymore, and demand is way down

Younger generations just aren’t drinking like previous generations also and, if they are drinking,  trends have shown beverages like Twisted Tea, seltzers, and session (or ‘mini’) beers that are sub 5% abv have been popular.",2025-04-24 17:09:51,26,brewgiehowser,news
motyfym,1k6sctb,reddit,2024 and 2025 already feels like im drunk without having any beer.,2025-04-24 18:17:03,36,weissbieremulsion,news
moszxsb,1k6sctb,reddit,"Weed is legal in Germany, so that would track.",2025-04-24 15:35:29,58,Drewy99,news
motlf62,1k6sctb,reddit,It’s because I quit drinking. Damn I miss German beer,2025-04-24 17:16:39,5,EarlKuza,news
mosts7v,1k6sctb,reddit,Dab drinking Canadian here doing my part.  It’s the best beer for the low price here.,2025-04-24 15:06:04,14,AnyoneButDoug,news
mot2ab9,1k6sctb,reddit,"Personally I enjoy a good German pilsner or dunkel.  Craft breweries in the US only want to make IPAs.  I don't like IPAs, they hide any taste they might have behind way too much hops.",2025-04-24 15:46:32,35,gizmozed,news
mowhlme,1k6sctb,reddit,It is a sign that the economy is bad.,2025-04-25 02:20:43,4,SimilarElderberry956,news
movjm49,1k6sctb,reddit,"Have you seen the beer prices??

In Canada beer is 15 dollars for a pint at a bar and a case of beer costs 55 dollars. Fuck that",2025-04-24 23:08:52,2,hmmmtrudeau,news
motuguu,1k6sctb,reddit,more Maibocks for me i guess! I wonder if this trend coincides with the abstitence prevalence among Zoomers that we see here in the US?,2025-04-24 17:58:13,3,wip30ut,news
mospoih,1k6sctb,reddit,"Beer quality abroad has surged. 

I used to buy German beers because the purity laws gave me some confidence I wasn't just drinking a pint of preservatives sure to give me a mega hangover, but there's so many good local micro to medium sized brewers now, it makes more sense to support local businesses.",2025-04-24 14:46:18,3,ResultsPlease,news
mosqrxj,1k6sctb,reddit,Less domestic alcohol consumption is a win in my book.,2025-04-24 14:51:38,5,fixminer,news
moxbuc1,1k6sctb,reddit,"Good, fuck alcohol. At least the non-alcoholic ones are rising so there's something. Hopefully people poison themselves less and less. Lets see tho if it's just a wave or not.",2025-04-25 05:55:14,2,Anthraxious,news
mosmfz7,1k6sctb,reddit,"Deleted because replied wrong, was meant for a commentator, not OP

Edit: thank you, kind redditor, for the award.",2025-04-24 14:30:21,3,Alexreddit103,news
mosiro6,1k6sctb,reddit,"If I want to get drunk, I drink cheap beer. German beer has always been overrated.

Either way, in my case, most of the time, if I want to get drunk and I'm with friends and family, I just drink good wine. I'm from Portugal, and Portugal has some high-quality wine at low prices. But I'm not picky, I’ll drink any good wine from any southern European country.",2025-04-24 14:12:14,-35,GuNNzA69,news
movq3vw,1k6sctb,reddit,Make it more refreshing.,2025-04-24 23:44:53,0,WolfWomb,news
mossz2v,1k6sctb,reddit,I wonder if it's more competition from Japanese beers? Like I've noticed the past few years that Asahi beers are now being served alot more then they used to and offerings in supermarkets.,2025-04-24 15:02:07,-6,Thegreatbrainrobbery,news
motoni9,1k6sctb,reddit,sorry but i love my japanese pißbier. give me sapporo or give me death.,2025-04-24 17:31:36,-4,whycarbon,news
mot129p,1k6sctb,reddit,German beer is to bitter...,2025-04-24 15:40:48,-20,VeraxLee,news
mndorj1,1k0fzto,reddit,"Man cannot be happy about this ""promotion"", Xi's so fed up dealing with one mans bullshit that he found a poor soul to take the weight of his shoulders.

That's a man who knows life is going to be shit with a lot of being woken up in the middle of the night for the next dumpster fire.

Edit: Should've read the article first, my bad ""veteran trade negotiator Vice Commerce Minister Wang Shouwen."" was not dealing with this shit.",2025-04-16 09:14:02,58,Tzazon,news
mnhdmra,1k0fzto,reddit,In the thumbnail pic he looks like a kid. I thought China was trolling Trump by apointing a literal child in a suit to deal with him on the same level. ,2025-04-16 21:46:00,9,MrWhitewalls206,news
mnhcfto,1k0fzto,reddit,He looks *thrilled* about his new job,2025-04-16 21:39:30,1,cravingnoodles,news
mnlts6f,1k1eznd,reddit,"Misleading headline, the man had sexually assaulted her. This makes it sound like the stabbing was unprovoked.

Try ""Sexual Predator dies after being stabbed by victim"" 

If he'd kept his hands to himself, he'd still be alive.",2025-04-17 16:06:15,1212,AnonAqueous,news
mnmtc1l,1k1eznd,reddit,Why was she sentenced to drug treatment (in addition to community service)? I feel like something is missing from this story - why did they include the drug treatment part?,2025-04-17 18:58:16,13,cranberryjuiceicepop,news
mnlxky1,1k1eznd,reddit,People not reading the article and only the headline. He sexually assaulted her.,2025-04-17 16:24:44,176,Clear_Ad577,news
mnn7jjg,1k1eznd,reddit,Jesus Christ redditors are psychotic.,2025-04-17 20:09:22,21,HindsightIs20_80,news
mnm1u1o,1k1eznd,reddit,The story says he grabbed her butt and reddit thinks that warrants death? ,2025-04-17 16:45:28,101,Scrivenerian,news
mnm6jma,1k1eznd,reddit,"Holy fuck reddiots are unhinged. He was a pos for grabbing her ass in passing. No you shouldn't be allowed to stab someone to death over that. Idk how you can justify murder over such a thing, and not expect such overreaction to whatever group you hold dear/identify with.",2025-04-17 17:07:59,59,badbeernfear,news
mnmxldt,1k1eznd,reddit,Funny enough today in German news someone got 3 years of prison because he beat someone up.,2025-04-17 19:19:46,8,Ryakuya,news
mnmop51,1k1eznd,reddit,"Now this is an actual instance where if the gender roles were reversed, would they still get probation? I seriously doubt it.

A woman grabbing a man’s ass, walking away, then getting stabbed to death by the man. People would have an aneurism.",2025-04-17 18:35:10,12,SQL617,news
mnn2a8l,1k1eznd,reddit,"People saying this doesn't warrant death are missing the biggest point. 

He FAFO!!! That's on him.",2025-04-17 19:43:19,3,Rosegold-Lavendar,news
mnyolrn,1k1eznd,reddit,Proof that people will be outraged by headlines,2025-04-19 18:04:12,1,Unreal4goodG8,news
mok1tv2,1k1eznd,reddit,Ominous name for the train,2025-04-23 04:27:27,1,nalon121,news
mnne7tf,1k1eznd,reddit,"Bet the perp won't do that again, and others take the hint.",2025-04-17 20:42:05,-2,Nada_Chance,news
mnm49ff,1k1eznd,reddit,This is going to be a tough one for MAGA. High melanin count immigrant gets killed by a woman after sexually harassing her. Sexual predator immigrant bad or women are liars?,2025-04-17 16:57:04,-54,blahreport,news
mnm7cwp,1k1eznd,reddit,"I wonder if she was white, the privilege is showing in this case.",2025-04-17 17:11:52,-29,KidAntrim79,news
mnnmh2a,1k1eznd,reddit,"Good. That seems like a fair way to handle it.

Thank God our courts are generally pretty sane about this stuff.",2025-04-17 21:23:27,-9,Rhellic,news
mnlozij,1k1eznd,reddit,[removed],2025-04-17 15:43:06,-177,N/A,news
mlfjcae,1jrl3r9,reddit,"Meta has quietly ended a major contract with Telus International, leading to the firing of up to 2,000 content moderators in Barcelona. The team team handled moderation across Catalan, French, Dutch, Hebrew, Portuguese, and Spanish. The move comes as Meta reduces moderation globally.

Honestly, this kind of worries me. Feels like we need more moderation these days, not less.

What do you make of this?",2025-04-04 20:06:19,80,erg99,news
mlftz5c,1jrl3r9,reddit,They need to ban social media before these tech oligarchs take over their governments too,2025-04-04 21:01:05,46,MxOffcrRtrd,news
mlfy6lu,1jrl3r9,reddit,Meta has content moderation? I’ve received and reported dozens of violent death threats and 1000s of slurs and had nary a response in a decade. Guess they’re busy censoring the wOkE.,2025-04-04 21:24:01,15,Crystal_Pesci,news
mlfu9b2,1jrl3r9,reddit,"Honestly, it's probably a blessing in disguise for those people. These people have to look at some truly dark shit. Shit that you will spend a lifetime in therapy trying to deal with. We're talking like graphic kiddie porn, people being beheaded or worse, people being violently raped, mass shootings, and some of the most vile, hate-filled, comments you've ever seen. Things that will scar you for life. 

I'm sure they're just going to move more of this to some third world country like the Philippines where they'll just churn through people and won't have to offer any kind of mental health benefits. Once they exhaust the supply of people in one country they'll just move to another low wage country.

I do hope, however, that this means there will be a temporary surge in content that violate EU laws and results in Facebook getting slapped with some truly massive fines.",2025-04-04 21:02:35,9,FreddyForshadowing,news
mlgks8j,1jrl3r9,reddit,"So are they going to stop or cut down on content moderation, or are they now going to use AI to do the job?",2025-04-04 23:37:07,3,NyriasNeo,news
mlgc3oo,1jrl3r9,reddit,Meta is just make themselves a target in the EU. The EU is already looking at fining Twitter/Musk $1 billion for not moderating their content.,2025-04-04 22:44:34,7,GayGeekInLeather,news
mll7qhk,1jrl3r9,reddit,"Leave.

These.

Platforms.

They’re toxic",2025-04-05 19:49:23,3,Dracogame,news
mlfv3wp,1jrl3r9,reddit,Can't blame them. META would be insane not reduce it's EU footprint ASAP to avoid EU retaliation on US companies doing business in the EU.,2025-04-04 21:07:11,2,N/A,news
mlikno2,1jrl3r9,reddit,Its not like they were doing shit to begin with. There are fake profiles of me I've reported for 15 years and they don't do anything about it. Just a scummy company.,2025-04-05 09:21:05,2,GreatBayTemple,news
mlnk8el,1jrl3r9,reddit,a fkn blight on humanity.,2025-04-06 04:58:39,1,_N0_C0mment,news
mlo19iv,1jrl3r9,reddit,He better be careful because the EU doesn't mess around when it comes to certain kinds of content on social media sites.  As in billion dollar fines.,2025-04-06 07:37:56,1,Slamdunkdink,news
mmfyu1f,1jw5s8k,reddit,When will people learn… penguins can’t fly,2025-04-10 19:43:54,255,rjc9186,news
mmfyr3p,1jw5s8k,reddit,These tariff retaliations are getting out of hand.,2025-04-10 19:43:29,305,itsbritain,news
mmgcmd0,1jw5s8k,reddit,"Forgot to account for the penguin.  Such a rookie mistake.  


> The aviation authority said the pilot conducted a ""risk assessment"" but omitted to include the transport of the penguin on board which ""was not in accordance with the Civil Aviation Regulations (CAR) 2011"".

I’m glad all, including the penguin, were ok.  


> While the helicopter sustained substantial damage, both the pilot and passengers were uninjured and the penguin was unharmed.",2025-04-10 20:50:08,43,cinderparty,news
mmfwo52,1jw5s8k,reddit,Just smile and wave boys 👋 👋 👋 🐧 🐧 🐧 ,2025-04-10 19:32:54,85,SounderFC_Fanatic,news
mmfyylg,1jw5s8k,reddit,"Activist penguins protesting tariffs will not be allowed in airports, despite being dressed for the occasion.",2025-04-10 19:44:32,71,AcanthisittaNo6653,news
mmggwzm,1jw5s8k,reddit,It has begun... I didn't expect the penguins to strike first though.,2025-04-10 21:11:33,11,Lamontyy,news
mmg3qeq,1jw5s8k,reddit,"Secure your small, flightless birds people.  It’s not like they know any better!",2025-04-10 20:07:12,7,dreadpiratewombat,news
