subreddit,post_id,comment_id,comment_content,comment_score,comment_created_at,comment_author
gaming,1k4omli,mobluo0,"**THE LIST:**

• **[Cult of the Lamb](https://youtu.be/xsPtUNB1z-Q?si=47jqC2cGrBvYaArr)** - $90M+

• **[Astroneer](https://youtu.be/a0Jyzf0QSB4?si=0LrPvBEpGO7YcrFi)** - $80M+

• **[Stronghold](https://youtu.be/ruV_3DowJWs?si=s1JWc40yxnPNob-a)** - $50M+

• **[Serious Sam](https://youtu.be/RWj7V67b5LQ?si=znsOQs4tGo5twIZA)** - $45M+

• **[Enter the Gungeon](https://youtu.be/Gg15MFGINWY?si=Y1gtaClXi-c6Rs2e)** - $40M+

• **[Shadow Warrior](https://youtu.be/x5hcdHYrTuw?si=wxAyih6-rmree5nK)** - $35M+

• **[Hotline Miami](https://youtu.be/N-Jyzl9PZ6A?si=yb63WVvImC2ijQV6)** - $30M+

• **[The Talos Principle](https://youtu.be/4MiNNlcQCzw?si=TSpjJr4GRu1WlH6A)** - $20M+

• **[REIGNS](https://youtu.be/XxmJwdZCbg0?si=DNYH9a4_6vHglHaY)** - $20M+

• **[GORN](https://youtu.be/FgR_D0F26Hg?si=UqbePr4MKqLNnc7L)** - $20M+",1401,2025-04-21 21:07:57,BenHDR
gaming,1k4omli,mobo06d,"According to Devolver, its key strategic focus going forward includes:

>The decision to “right-size” three subsidiaries and giving them “a tighter focus, reducing affected team sizes by approximately 50%”.


Oh goody",622,2025-04-21 21:19:00,ADifferentMachine
gaming,1k4omli,mobq7q6,"Talos is criminally low, damn. One of the best and most beautiful puzzle games I've ever played

Also I'm sad about hotline miami. I'm such a lover of that game that I was convinced it was one of their most popular",131,2025-04-21 21:30:31,DesignatedDiverr
gaming,1k4omli,mobnhf2,Lets go Gungeon!,138,2025-04-21 21:16:18,AnubisIncGaming
gaming,1k4omli,mobogel,I'm surprised Gorn made that much money considering it's a VR game,70,2025-04-21 21:21:20,emorcen
gaming,1k4omli,mobmd2k,They have a solid portfolio of indies. We need more publishers like Devolver.,172,2025-04-21 21:10:33,TheeFURNAS
gaming,1k4omli,mobr3jz,">According to Devolver, its key strategic focus going forward includes:

>- Releasing more paid DLC, following successful DLC releases for Cult of the Lamb and Astroneer last year.

>- More definitive editions expected in future years.

>- A number of sequels being worked on “across popular IPs, both first and third party”.
    
>- A reduced average investment on third-party games, “focused on smaller development budgets with high success potential and scope for future paid DLC”.

>- The decision to “right-size” three subsidiaries and giving them “a tighter focus, reducing affected team sizes by approximately 50%”.

>- Investment into first-party development to make time and cost more efficient.

>- Working with Nintendo to develop Switch 2 games, because the original Switch is its “most successful console for unit sales”.

Probably the most interesting tidbit from the article.",62,2025-04-21 21:35:08,CrimsonFuckr69
gaming,1k4omli,moboaj9,It's wild seeing stronghold so high on this list given how old the game is,45,2025-04-21 21:20:30,superkow
gaming,1k4omli,moboszm,I miss hotline miami and its soundtracks,40,2025-04-21 21:23:09,nylon-smile
gaming,1k4omli,mobo062,I still play Serious Sam Double D,13,2025-04-21 21:19:00,neverendingchalupas
gaming,1jzroki,mn8achm,[deleted],455,2025-04-15 13:25:55,N/A
gaming,1jzroki,mn8b8gm,"Feel like this might be the final content update, but they'll still likely have future patches for any bugs or issues that might come up.",862,2025-04-15 13:31:03,pipboy_warrior
gaming,1jzroki,mn8h0vc,"I wish I had that motivation to replay games. Like many do. 

I sunk 250 hours in it, I know all the major outcomes.  The game is such a incredible experience, deep down knowing where things are going makes me not be willing to start again. 

I know people that spend so many hours replaying games and the thing that makes me really envious... they ENJOY every second of it. How? 

You fuckers, I envy you so soooo much!!!",542,2025-04-15 14:03:02,guilhermefdias
gaming,1jzroki,mn8b26j,"I feel like I've seen updates called ""the final patch"" for ages on Baldurs Gate 3.",322,2025-04-15 13:30:02,SusieShark
gaming,1jzroki,mn8ffwg,"Tldr question: is it downloadable like, right now? Or comes to live later on tonight?",65,2025-04-15 13:54:29,Zsoell2
gaming,1jzroki,mn8xqfo,Did Astarian have a Sleep Token poster in the background of his room? Lol.,17,2025-04-15 15:28:03,Schenckster
gaming,1jzroki,mn8f4gp,"Kingdom Come Deliverance 2 hardcore mode and BG3 Patch 8, boy i don't know which one to replay first.",75,2025-04-15 13:52:46,Independent_Tooth_23
gaming,1jzroki,mn9fzjz,"Now I can buy the game, because I probably only have the energy to commit to one playthrough",25,2025-04-15 16:58:39,composero
gaming,1jzroki,mn9vvi0,Why they hate Gale. I love him.,10,2025-04-15 18:15:55,Lower-Astronomer-240
gaming,1jzroki,mn99wja,Did they fix Jaheira?  She’s had this ally bug forever and they’ve never fixed it.   It stopped my main play through in its tracks and I’ve been waiting for a fix to play again.  I’ll probably suck it up after this patch but I really want to use her.,9,2025-04-15 16:28:37,zardos66
gaming,1jps8yn,ml1l4m7,Combine that with the fact that nintendo first party games never really drop in price as much as other platforms games and it's a big ouch.,2342,2025-04-02 16:08:48,GravtheGeek
gaming,1jps8yn,ml1nybo,I didn't see enough new big games to justify getting the console. So for now it's a pass.,625,2025-04-02 16:23:04,picknicksje85
gaming,1jps8yn,ml1kl4v,"What is the kick in the nuts for me is the upcharge for physical games, I never in a thousand years would of thought Nintendo would put the final nail in the physical media coffin",782,2025-04-02 16:06:03,TrickOut
gaming,1jps8yn,ml1oetj,"As a Canadian, I'm already spending $90 on the original Switch games.

I'm scared for what we're gonna pay if you guys are paying $80-90.",194,2025-04-02 16:25:21,reddfawks
gaming,1jps8yn,ml3mjjs,"As a Canadian, there is zero part of me that wishes to spend $130 on a new game. I'm going to continue to be happy with my existing Switch and not bother with the next generation. It's just not financially feasible for me to continue this hobby with Nintendo's new pricing.",36,2025-04-02 22:04:00,OneFinalEffort
gaming,1jps8yn,ml1lyp5,"Switch 2 games, I'm pretty sure GTA 6 will do the same AND the rest will follow.",211,2025-04-02 16:13:02,kanon951
gaming,1jps8yn,ml1l4es,"you're not alone, but i'm betting you'll be in the minority. this is the future, sadly.",180,2025-04-02 16:08:46,pedant69420
gaming,1jps8yn,ml1obtn,"As a patient gamer , Nintendo is not viable for me. Way too much money for a single game.",132,2025-04-02 16:24:55,N/A
gaming,1jps8yn,ml2dm2f,$80-$90?! Nahhhh miss me with that,40,2025-04-02 18:25:22,jellybizkits
gaming,1jps8yn,ml2dfbn,You don't wanna spend like a fifth of the price of the console every time you wanna play a new game? And what's worse is that you absolutely know every AAA Nintendo release will never go down in price,37,2025-04-02 18:24:26,LordsOfFrenziedFlame
gaming,1jz4mma,mn3go4n,"\*Titanfall 2 campaign

For who ever is wondering. A must play for all shooter fans!",848,2025-04-14 17:39:09,LaserGadgets
gaming,1jz4mma,mn3h0sx,"10 years later, no game name in the title.",1764,2025-04-14 17:40:49,happy-cig
gaming,1jz4mma,mn3opgt,Istg there should be a rule for including the damn name of the game on posts like this where it's just a screenshot or any post talking about a specific game.,187,2025-04-14 18:18:02,Virezeroth
gaming,1jz4mma,mn3god0,"WHAT. FUCKING. GAME?

EDIT: IT'S TITANFALL 2",109,2025-04-14 17:39:11,Quetiapine400mg
gaming,1jz4mma,mn3gfo6,which game? Tilt and fall?,32,2025-04-14 17:38:00,Iztkhon
gaming,1jz4mma,mn3nsr5,Still one of the greatest single player campaigns ever.,35,2025-04-14 18:13:31,mouldy_underwear
gaming,1jz4mma,mn42rl3,"10 years later, no Titanfall sequel. ;-;",6,2025-04-14 19:29:18,ElderberryStench
gaming,1jz4mma,mn46tcg,Can we play this without playing first game?,6,2025-04-14 19:50:01,insangibi
gaming,1jz4mma,mn3mpph,"Titanfall 2


Please play for the campeign alone. It often goes on sale for half the price of a big mac.",8,2025-04-14 18:08:09,doublethink_1984
gaming,1jz4mma,mn5qh5f,"Don't be,I punch MRVNs out after getting their loot all the time.",3,2025-04-15 00:58:10,nerankori
gaming,1jq0oxk,ml3iquh,Glad to hear Good Old Games has a Good Old Game section lol,716,2025-04-02 21:44:17,horizon_games
gaming,1jq0oxk,ml3qvlf,"To be honest, I only recently discovered that GOG did anything BESIDES save older titles.",248,2025-04-02 22:27:21,Marauder_Pilot
gaming,1jq0oxk,ml5omrz,"They also include unofficial patches that modders in the past created for games, like vampire the masquerade and kotor 2 with the restoration patch. If you buy the same games on steam or other online stores you have to find and manually install the patches.",23,2025-04-03 06:03:26,Dantalion67
gaming,1jq0oxk,ml4ffo5,"Seeing Mad Max on this scares me. I think of classics as 1990s games, not the year that I graduated.",31,2025-04-03 00:46:04,NTFRMERTH
gaming,1jq0oxk,ml3lkvk,"FUN FACT: GOG is the name, it doesn't stand for anything anymore.",64,2025-04-02 21:58:51,N/A
gaming,1jq0oxk,ml4pl42,HOMM3 FTW!,12,2025-04-03 01:45:45,Beno169
gaming,1jq0oxk,ml8u31j,"I've recently begun moving my entire games library from steam to GoG after finding out their policies on owning the game vs. the license to play a game. They don't ever take away your games, and if someone were to pass away and had a 3,000$ game collection, they can just pass it on to their kid or friend etc., where steam cancels that person's account and licenses.",5,2025-04-03 18:39:30,The_Ocular_Prophet
gaming,1jq0oxk,ml518ut,It has a great search filter too. Filter the year range from when you were 10-15 years old and sort by popularity for maximum nostalgia.,4,2025-04-03 02:58:35,Winterplatypus
gaming,1jq0oxk,ml3ji85,"Pretty impressive selection. Some classic RE, Dino Crisis, Worms. Heck, even a Leisure Suit Larry",9,2025-04-02 21:48:12,toilet_for_shrek
gaming,1jq0oxk,ml3npqu,I do enjoy GOG but find that in the newer stuff they have on there is a lot of shovelware with no reviews and bullshots.,14,2025-04-02 22:10:14,Background_Thought65
gaming,1jyxygw,mn1xcs6,"Don't worry it won't be 145%, when the switch 2 is actually ready to ship the tariff will have changed another 80 times.",1674,2025-04-14 12:48:42,ThatDandyFox
gaming,1jyxygw,mn1z4pa,"According to other news sources without paywall, significant portions of Switch 2 will be produced in Vietnam and Cambodia.  
[https://www.polygon.com/nintendo-switch-2/556379/us-console-supply-stockpile-vietnam-tariffs](https://www.polygon.com/nintendo-switch-2/556379/us-console-supply-stockpile-vietnam-tariffs)",216,2025-04-14 12:59:52,Wizard_of_War
gaming,1jyxygw,mn2087x,True ... but have you tried waiting 45 minutes? The number will change.,138,2025-04-14 13:06:41,LittleShrub
gaming,1jyxygw,mn2274r,Pointless to even speculate at this point. We’re gonna snip-snap 10 more times before this thing launches.,46,2025-04-14 13:18:48,Cactuszach
gaming,1jyxygw,mn2cs7y,I think Nintendo is intending to send China made switches to every other market. US is supposedly getting the ones made in other countries.,37,2025-04-14 14:18:40,sciencesold
gaming,1jyxygw,mn2duym,"All of this chaos is just going to result in higher prices no matter what. At the end of the day who even knows what tariffs are/aren't in place? Companies will just boost prices 50% and blame ""the economy"" at the end of the day and laugh all the way to the bank.",6,2025-04-14 14:24:24,Eswercaj
gaming,1jyxygw,mn50fds,"For the love of Christ, units made in China aren't sent out to the US. Vietnam is the supplier for American Switch 2 units, it literally says so Nintendo's own website. Chinese units are for Europe and Japan.",5,2025-04-14 22:25:53,BigGrizzwald
gaming,1jyxygw,mn1xu1f,This is just nonsense to wind people up.  Nintendo moved most of its manufacturing to Vietnam in 2019 to avoid tariffs in the past.  They have already confirmed the tariffs on China won't have an impact on prices.,150,2025-04-14 12:51:45,Benjammin454
gaming,1jyxygw,mn42l1j,"Reddit is all over the place, surprise. Was just reading a thread earlier with links on how none of the Switch 2 parts are actually affected by tariffs.",4,2025-04-14 19:28:22,Slugdge
gaming,1jyxygw,mn1xrg9,[deleted],29,2025-04-14 12:51:18,N/A
gaming,1jtupif,mlxgfd6,">Bowser also mentioned that Switch 2 games will be priced higher due to offering a ""unique"" experience.

So basically ""because we want money""",1611,2025-04-07 21:12:12,ViftieStuff
gaming,1jtupif,mlx34f4,"Tldr: buzzwords about market conditions. Basically ""because we can""",1101,2025-04-07 20:03:07,danvsmondays
gaming,1jtupif,mlx8bof,And I defend my choice not to buy it!,169,2025-04-07 20:29:51,bdu-komrad
gaming,1jtupif,mlx9xdf,“Please Understand!”,61,2025-04-07 20:37:59,TokyoGNSD2
gaming,1jtupif,mlx4e8u,[removed],192,2025-04-07 20:09:47,N/A
gaming,1jtupif,mlxr6s5,"Oh I can't wait to read this bullshit.  Honestly I hope their response is just Fuck you, we're Nintendo. I'd respect it more.",18,2025-04-07 22:11:40,rbarrett96
gaming,1jtupif,mlx44qi,The price for the console and the Switch 2 and Mario Kart World bundle are fine as $450 is around the average price of a new console at launch. But the games being $80-90 is ridiculous.,1222,2025-04-07 20:08:25,MR_MEME_42
gaming,1jtupif,mlxibvm,"At this rate, GTAVI will be $120 CAD before tax",16,2025-04-07 21:22:30,kroqus
gaming,1jtupif,mlxcufc,"$450 for switch 2 is fine

$500 for switch 2 + mario kart bundle is fine

$80-$90 for a game is not fine",245,2025-04-07 20:53:06,symbolic503
gaming,1jtupif,mlx4cqa,"The thing is, the “correct” price is what people are willing to pay. We’ll see who is right or wrong when it comes out. But something tells me the consumer is not as steadfast as we claim on Reddit.",101,2025-04-07 20:09:34,JerbearCuddles
gaming,1jj0b16,mjjoyt5,Would love to see more than your arm and cloak.,79,2025-03-24 21:08:41,jenkag
gaming,1jj0b16,mjjg718,How much was that omg,11,2025-03-24 20:27:15,N/A
gaming,1jj0b16,mjji89g,"Ohhhhhh, Eldin Ring.",3,2025-03-24 20:36:49,Darkray117
gaming,1jj0b16,mjjtzy9,Always leave em wanting more!,3,2025-03-24 21:35:17,JDHannan
gaming,1jj0b16,mjm2jts,...let me solo her,3,2025-03-25 06:03:05,Scavenger53
gaming,1jj0b16,mjjdg6v,"That looks amazing, were are more shots?",8,2025-03-24 20:14:25,timojenbin
gaming,1jj0b16,mjllr1r,This is great. If you go to a con I pray to god someone dressed (at least partially) as LMSH,2,2025-03-25 03:38:46,rubyspicer
gaming,1jj0b16,mjjcc0d,Looks sick,3,2025-03-24 20:09:12,Sleisk
gaming,1jj0b16,mjjdf7x,I thought pic is from the game,3,2025-03-24 20:14:17,myfatbic
gaming,1jj0b16,mjjhs1w,That's amazing.,1,2025-03-24 20:34:40,JiminyJilickers-79
gaming,1jmk5an,mkc9zuo,"I've heard it's one of those ""man i wish i could erase this from my memory to experience it again"" kind of games and best played without any spoilers. Haven't played myself yet, but hope you enjoy it!",490,2025-03-29 11:34:33,smellyourdick
gaming,1jmk5an,mkcjde2,What should I do to make the game click? I tried it a few years ago(played for an hour or so I think) but gave up after getting bored. I see so many good reviews and almost all of them say not to google anything about the game so I'm in a dilemma lol,119,2025-03-29 12:48:53,Aelnir
gaming,1jmk5an,mkcag6q,"One of my favourite games. Had a blast playing it and figuring out how the puzzles all come together. 

The Newtonian physics used in the game was a bit tricky to master, but also made space flight feel more real.",189,2025-03-29 11:38:36,jangovin
gaming,1jmk5an,mkcbobk,Do NOT look up any spoilers. I adore this game.,224,2025-03-29 11:49:14,Jimmm90
gaming,1jmk5an,mkcb3u4,Till this day this game is number 1 of all games for me. Unreachable masterpiece.,318,2025-03-29 11:44:22,noowainy
gaming,1jmk5an,mkcfjsz,Bro is about to experience peak,168,2025-03-29 12:20:35,Altheix11
gaming,1jmk5an,mkcz4ju,"It can be tough to get used to the ship controls for some, but it's one of the best games I have ever played.",80,2025-03-29 14:29:18,ButterscotchExactly
gaming,1jmk5an,mkc9xf7,"I tried getting into this a couple times, but couldn't",145,2025-03-29 11:33:56,ivan4ik
gaming,1jmk5an,mkc9yxq,"I'm not a big puzzle gamer, I do enjoy them though. Outer wilds was one of my all time favorite experiences. You are thrown into a world and need to answer so many of the questions you'll have. Bit by bit it starts coming together and you figure things out and it's so rewarding.
The world isn't particularly large, and you're in a time loop situation. I highly recommend not looking any guides or anything up though, as in my opinion the true strength of the game is the mystery being untangled as you work through the game",87,2025-03-29 11:34:19,JellyfishSwimming853
gaming,1jmk5an,mkcj1p5,Does anyone know a good YouTube play through with commentary? I'm about 20 hours in and don't want to finish it,25,2025-03-29 12:46:34,GregoryPokemon
gaming,1jscnlf,mlle5m5,I played Z in 98 or so!! I loved it!,197,2025-04-05 20:25:30,SkidzLIVE
gaming,1jscnlf,mlleg1y,Always got time for shoutouts to the Bitmap Brothers,97,2025-04-05 20:27:09,DappyDreams
gaming,1jscnlf,mllezo6,That was an underrated game. Fun addictive gameplay and good humor.,54,2025-04-05 20:30:08,cleversocialhuman
gaming,1jscnlf,mllekqy,"Oh my ! That's cool. 
I played this so many years ago",21,2025-04-05 20:27:51,RyanBLKST
gaming,1jscnlf,mllgu9w,"The first game I remember where the barks were context-sensitive. Command your grunts to attack a heavy tank? ""Are you SERIOUS?!""

Also! Vehicles were driven by actual units; You could snipe those out and replace them with your own troops. I may be misremembering, but the vehicle actually changed behaviour slightly depending on which troops you had drive it (like basic grunts sometimes took dumb routes, snipers had better aim, and so).

Also, it was *hard as balls*. Never finished it, I think I got stuck in one of the jungle maps.",20,2025-04-05 20:40:26,The_Corvair
gaming,1jscnlf,mlm0pf2,"Now, that's a name I haven't heard in a long time... A long time.",10,2025-04-05 22:38:24,KidMoxie
gaming,1jscnlf,mllf6b0,Wasn't there gonna be a sequel at some point in the last 15yrs? I swear I read about it somewhere. Loved the original tho. ,11,2025-04-05 20:31:10,Fit_Victory6650
gaming,1jscnlf,mllxpjy,Z Is thirty?? Oh…,5,2025-04-05 22:19:52,TheonlyDuffmani
gaming,1jscnlf,mllycy5,Atomfall is the most British fallout game I’ve ever played. It’s like a polite little mystery with some hooligans you gotta make your way past to solve. All while doing favors for people you’ve just met because you’re too polite to say no.,6,2025-04-05 22:23:52,southpaw85
gaming,1jscnlf,mllhepc,"Yeah, never got far, but it was pretty great. Had it in a games collection.",4,2025-04-05 20:43:34,Arborerivus
gaming,1jrdq0r,mldtedl,"Just checked, in Belgium the price 470 euros for the basic edition and 510 euros for the mario kart world bundle.  
Though we won't know for certain until it launches.",686,2025-04-04 14:53:55,nrseven
gaming,1jrdq0r,mle5u1d,"450€ already sounded like a lot, but it ended up being 110-200€ more in reality. Definitely have to skip the launch...",391,2025-04-04 15:55:34,Ramperdos
gaming,1jrdq0r,mlfcxwk,"Here in NZ the Mario Kart World bundle is $870 and just the console is $800. 
That’s more than a current PS5 slim bundle with astrobot here.
I don’t think this will sell at all.",267,2025-04-04 19:33:21,EvilDemonMiloTheCat
gaming,1jrdq0r,mle02e3,That is Bergsala  (Nintendo distributor for Nordics) for you,157,2025-04-04 15:27:04,Tempires
gaming,1jrdq0r,mletxew,"Is there anythign up in finland that the price is like upto 140€ above the rest of the EU?

I could preorder in germany right now, with legally binding price of 469€/509€ respectivly",25,2025-04-04 17:56:01,Urdar
gaming,1jrdq0r,mlf5n9o,"That should roughly be the price for the entire nordics then.

A fucking shame we have to deal with Bergsala though... Hate em.",18,2025-04-04 18:55:18,Jindujun
gaming,1jrdq0r,mlexhg9,"Can't you just buy it in other EU countries then? Buy it in the Netherlands, shipping probably only add 10-15 euro, making it 485 instead of 558.",16,2025-04-04 18:13:44,Smoofiee
gaming,1jrdq0r,mlf5ytk,It's $630 cdn for the base bundle and $699 cdn for digital game bundle. Yeah fucking right. Totally unreasonable price to me.,71,2025-04-04 18:56:57,immortality20
gaming,1jrdq0r,mlf7xq5,My interest in buying this console went from *not really  interested* to *no fucking chance*,56,2025-04-04 19:07:05,LTKerr
gaming,1jrdq0r,mlfdy23,£395.99 and £429.99 in the UK.,29,2025-04-04 19:38:40,T_raltixx
gaming,1k5ajnf,moghhe7,"Horse Armor: ""You couldn't live with your other DLC's failure, and where did that lead you? Back to me.""",2457,2025-04-22 16:44:51,downtownpanda
gaming,1k5ajnf,mogdpua,I like that you can buy the upgrade separately. So buy the base game and buy the upgrade later if you want that content. There is no pressure to buy the deluxe edition outright if you are using Steam.,588,2025-04-22 16:26:28,coryeyey
gaming,1k5ajnf,mogjt35,So theirs a quest to actually get the deluxe version stuff? I gotta say I slightly like that better than just it being auto added into your inventory or having to get it from a special chest,106,2025-04-22 16:55:57,Ekillaa22
gaming,1k5ajnf,mogdxem,"Left side: Game with everything made for original Oblivion


Right side: Digital deluxe, all the stuff listed in that one box labeled that, including new horse armor and stuff

People are over thinking things and being dumb about this.

Edit: I suck at formatting",1049,2025-04-22 16:27:29,CavalierIndolence
gaming,1k5ajnf,mogs42i,Well crap. I feel dumb now. I legit thought the DLCs were only in the deluxe. I guess that’s kinda on me.,24,2025-04-22 17:35:25,dillybar1992
gaming,1k5ajnf,moiao2j,"I made a joke on another thread about buying the Deluxe for the horse armor and within seconds got several abusive gibberish DMs and comments saying what a dumbass I was for paying more for horse armor.

[ThatsTheJoke.gif](https://media.giphy.com/media/v1.Y2lkPTc5MGI3NjExMG5sbDF4bmFwM3ZzbmU1c2xqazUxa25obHpzbGExOW8zZXY0cmxmbiZlcD12MV9naWZzX3NlYXJjaCZjdD1n/xT9IgHCTfp8CRshfQk/giphy.gif)",21,2025-04-22 22:07:11,nionvox
gaming,1k5ajnf,moge4mw,I’m literally seeing brand new accounts pop up to spread misinformation that’s it’s not a “full product”. It’s nuts,362,2025-04-22 16:28:28,C1138BP
gaming,1k5ajnf,moggg2b,"Clearly the people who didn't watch the reveal. He clearly states in the reveal, it's all included in the base game. No need to read something and get misinformation.",104,2025-04-22 16:39:48,Gen3ralEZKILL
gaming,1k5ajnf,mohk34h,"Thanks for sharing this, I was sure that the DLC was Deluxe only. Seriously why the hell did they format the banner like that, with the legacy DLC info in a separate square?
Again, thank you for the info. Have a nice day...",10,2025-04-22 19:52:51,dropdan
gaming,1k5ajnf,mogg2ms,horse armor not being paid dlc was a missed opportunity tbh,43,2025-04-22 16:37:57,Scheibenpflaster
gaming,1k1mhck,mnn8ub7,"Amazing patch notes, not gonna lie. This dev has exceeded everyone’s expectations with this game and its post launch support.",965,2025-04-17 20:15:49,provoking-steep-dipl
gaming,1k1mhck,mnnc5rv,"Good improvements, the game felt clunky/underbaked when I tried it last year. Might give it another chance.",267,2025-04-17 20:32:05,WarlikeLoveReddit
gaming,1k1mhck,mnnebvb,Should I try this now if I never played the first?,114,2025-04-17 20:42:38,Nicki-ryan
gaming,1k1mhck,mnnekol,"Anyone know if the Friend Pass is available on Game Pass? I have Game Pass, but my friend doesn't. I've been looking for information on this but can't find any.",62,2025-04-17 20:43:50,Keypop24
gaming,1k1mhck,mnnffq3,I loved the game at launch. I'm very happy to see more updates.,35,2025-04-17 20:48:00,Skippie_Granola
gaming,1k1mhck,mnnd91q,How's performance? Any improvements? I remember major stuttering with 1.6,44,2025-04-17 20:37:26,svill
gaming,1k1mhck,mnp86en,Every Souls game needs seamless co-op.,11,2025-04-18 03:08:39,CrustedTesticle
gaming,1k1mhck,mnok0ug,"I can’t believe how much they’ve worked on this post-launch. I beat it a few times around launch to unlock the new classes but didn’t go back. 

Gonna have to clear some time for this new update.",4,2025-04-18 00:33:52,FastRedPonyCar
gaming,1k1mhck,mnnkrkn,[deleted],35,2025-04-17 21:14:44,N/A
gaming,1k1mhck,mnnhx3a,"Damn, this is how you do an update and get people back.",9,2025-04-17 21:00:10,KileyCW
gaming,1jotgzb,mkua6bd,This is one of the lesser talked about part's of Far Cry 5 that I think was so freaking cool. Looks pretty damn good OP!,252,2025-04-01 11:47:10,mrolfson
gaming,1jotgzb,mkuadxu,"For anyone interested, Far Cry 5 map editor on console has a limit on how many NPCs and driveable vehicles you can place, so to get around this obstacle I placed sticks in the distant to try and create the illusion of more people and destroyed cars for busier traffic!  Here's a wee reverse timelapse showing how I put everything together, cheers! [https://youtu.be/0vAVn5NLPRg](https://youtu.be/0vAVn5NLPRg)",133,2025-04-01 11:48:46,mojoswoptops2020
gaming,1jotgzb,mkujknp,"What you mean ""tried""? You killed it. Take pride in your accomplishments brother.",30,2025-04-01 12:52:34,runwithjames
gaming,1jotgzb,mkug4w6,"This is true gaming community content !

Fuck yeah brother !!!",15,2025-04-01 12:29:48,EvilxBunny
gaming,1jotgzb,mkuncip,GTA:Vice City Reboot,24,2025-04-01 13:16:06,MorkSkogen666
gaming,1jotgzb,mkupd5j,omg how did you get gta 6 gameplay,11,2025-04-01 13:28:24,Axeloy
gaming,1jotgzb,mkvue0o,"I honestly thought ""oh its that trailer from Dead Island 2"" before i read the title",4,2025-04-01 17:06:22,LiquidRaekan
