subreddit,post_id,comment_id,comment_content,comment_score,comment_created_at,comment_author
music,1jzw9ax,mn9pr58,"Here's a ""narcocorrido"" used in the TV series Breaking Bad if you are curious what they are like (English subtitles): [https://www.youtube.com/watch?v=\_Stn0dsEayA](https://www.youtube.com/watch?v=_Stn0dsEayA)",14,2025-04-15 17:45:36,cbessette
music,1jzw9ax,mnajlpb,He was running late for an after show or something because there’s no ban or law prohibiting those songs 🤷‍♀️,6,2025-04-15 20:14:50,tirabichi
music,1jzw9ax,mncf92l,"Drill next? Then? 

Added context.",-4,2025-04-16 02:35:01,SoliPsik
music,1jzw9ax,mnaohu4,"Banning art is never a good idea, even if it glorifies criminal organizations.

Some of the most lauded media to come out of the US is centered around such organizations (e.g. The Sopranos, The Godfather, etc.) and music is no exception. The audience's reaction is unfortunate but laws like these are stupid.",-15,2025-04-15 20:38:56,Physical-Ride
music,1ju4ffl,mlzd3q7,"Such a beautiful song. I remember once taking a long train ride, had this playing on headphones. Sat back, relaxed and became one with the rhythms of the train and the smoothness of the song. The experience was so good, had to put it on repeat a few times! Love it!

Live version(s) nice, too.",9,2025-04-08 04:11:08,LexiiConn
music,1ju4ffl,mlzdmh7,"I always liked this song! 👍 Christopher is the musical pride of San Antonio, TX (I lived there for a few years).

His music very often gets the dismissive label of “yacht rock” (a label I’m not crazy about - while this song does involve a boat, not all so-called “yacht rock” songs do). He was just very good at writing quieter songs. Even his more up-tempo songs like “Ride Like The Wind” were good.",7,2025-04-08 04:15:13,theweightofdreams8
music,1ju4ffl,mlznbdd,"Great song. And he’s a much better guitar player than people realize. Check out his interview with, and then the song/guitar solo analysis by, Rick Beato.",7,2025-04-08 05:38:39,WorryNo181
music,1ju4ffl,mm49t2s,🛥🪨,2,2025-04-08 22:55:32,9_of_wands
music,1ju4ffl,mm0cbl6,Love Kyle Gass. Where’s Jack Black?,1,2025-04-08 09:58:13,vigilantesd
music,1jszvsg,mlr63xt,It's still relevant.,4,2025-04-06 20:19:56,EmployOk5086
music,1jlvchu,mk6n3bg,"I have this part that plays in my head, it's from some classical music piece that I don't know. I don't even know how I would go about finding it.",21,2025-03-28 13:51:43,PeaTearGriphon
music,1jlvchu,mk6zwgx,Jesus christ. Don't even get me started. I've been plagued by a song for over 20 years. It played on the 'Alternative' station on the Satellite radio in 2001 at my job. I think about it often and have exhausted every avenue I can think of. Now it's only a memory of a memory of what I thought the chorus was. And I feel like it was a great song.,15,2025-03-28 14:57:24,jcallahan79
music,1jlvchu,mk6p5ke,"I was big into Led Zeppelin when I was in high school but also did a lot of drugs in high school. 10 years later the bridge of Ramble On would randomly pop into my head but I couldn’t remember what it was from or place it. I would sing it to people to see if they recognized it, I learned how to play it on bass and I feel like it was a full year before it finally came to me one day where that bit of music came from.",10,2025-03-28 14:02:43,PinkYoshimi
music,1jlvchu,mk6oilq,"I used to have a land surveying job that involved long periods of standing and waiting, and during that time I would imagine a mariachi version of Nights in White Satin (Noches en Satin Blanco) that I really want someone to play for me someday cuz it's awesome. 

[The piano music cue here](https://youtu.be/hQnplZSS4OY?si=MQ_UIBo4wOmSED7y&t=73) pops into my head regularly - it's almost a very chill 70s version of ""my way"" but not quite.",9,2025-03-28 13:59:18,sightlab
music,1jlvchu,mk6ok8h,"In 1970 we were driving to Mexico. We had AM in the old VW bus and when passing through Louisiana we heard a song on the radio that made my father laugh his ass off. I was 12 and missed some of the subtle humor, but remembered the hook from the chorus. Never heard it again but the chorus haunted me.

Then, at my 25th high school reunion the girl I sat next to in Home Room for four years was the DJ. We got reacquainted and I agreed to check out her oldies show in the local radio station. 

The first time I listened she played the song! It was [Mississippi by John Phillips](https://youtu.be/kS_sLUVuKTs?si=PkBZcfGKzPDV9lt1). I laughed my ass off.",6,2025-03-28 13:59:32,ElvisAndretti
music,1jlvchu,mk6ye8n,"It took ten years, but it turns out it was Freedy Johnson’s _Bad Ruputation_. The line about Harold Square was stuck in my head for a decade before I found it.",6,2025-03-28 14:49:59,KayBeeToys
music,1jlvchu,mk6vzpn,For about 20 years I did. I just knew there was a song on the radio that said 'niagara falls' (I'm from there) in it and I couldn't figure out what it was. It was an inside joke between my cousin and I since we were kids. Literally for 20 years. Then one day he randomly called me up from the side of the highway because he  finally heard it on the radio. That song was Claire by the Rheostatics.,7,2025-03-28 14:37:55,NixonsTapeRecorder
music,1jlvchu,mk6qgy7,"In the early 90s, a friend made me a mix that included some European techno that was unlike anything I had heard before. I played it often, even dubbed it onto other tapes. But I probably haven't listened to it since 1999 and all tapes with it likely got ruined and thrown out in a basement flood years ago. 

Luckily, I have gone on to listen to a lot of music that sounds enough like it to be satisfied. But some days a section of it pops in my head and I wonder what it was.",5,2025-03-28 14:09:37,elevenghosts
music,1jlvchu,mk6pqu5,"As most millennials, I had a burned cd from an older cousin who got it from an uncle. In this cd there were some great songs, from deftones to some electronic songs. There’s this one song that starts kinda like an edm song and the lyrics are from a distorted modulated voice that at some point says “I want to leave the planet earth” but I have no way of searching for this particular part. I can hear it in my head but nothing sounds quite like it…",3,2025-03-28 14:05:50,zeronerdsidecar
music,1jlvchu,mk6z2q0,I once accidentally landed on a Mexican music radio station halfway into some beautiful and mournful sounding song about Michoacan. The woman singing had a lovely deep voice and all I could gather was that it felt sadly homesick.  I've tried to find it but only ever found links to Mariachi bands.,4,2025-03-28 14:53:20,HowCanBeLoungeLizard
music,1jl7uif,mk1kz1z,"Don Henley - Heart of the Matter.  The Chorus breaks me every time I hear it.....

""I'm learning to live without you now

But I miss you sometimes

The more I know, the less I understand

All the things I thought I knew, I'm learning again

I've been trying to get down to the Heart of the Matter

But my will gets weak

And my thoughts seem to scatter

But I think it's about forgiveness

Forgiveness

Even if, even if... you don't love me anymore""",42,2025-03-27 17:16:40,thewhitedeath
music,1jl7uif,mk1d8l3,Heard Mad World again last week and it obliterated my insides.,32,2025-03-27 16:40:25,Independent-Score-22
music,1jl7uif,mk1bzi8,The older you get the harder Pink Floyd's Time hits.,75,2025-03-27 16:34:23,spiked_macaroon
music,1jl7uif,mk1hx45,"""Can't believe how strange it is to be anything at all""

In the Aeroplane Over the Sea - Neutral Milk Hotel",23,2025-03-27 17:02:25,GamerX102
music,1jl7uif,mk1me1e,"Eleanor Rigby
Waits at the window, wearing the face
That she keeps in a jar by the door
Who is it for?
All the lonely people
Where do they all come from?
All the lonely people
Where do they all belong?",24,2025-03-27 17:23:13,BobbiBoobboo
music,1jl7uif,mk1wcwj,"There's a hole in daddy's arm, where all the money goes.

Sam Stone by John Prine",14,2025-03-27 18:09:46,looloose
music,1jl7uif,mk1iwrx,"Grey would be the color, if I had a heart. - NIN

I know someday you'll have a beautiful life, I know you'll be the sun in somebody else's sky, but why can't it be mine. - Pearl Jam",13,2025-03-27 17:07:06,hvacigar
music,1jl7uif,mk20n2j,"""Wish I didn't know now what I didn't know then.""",11,2025-03-27 18:30:26,southern_boy
music,1jl7uif,mk1ctga,“A guy she said she knew well and sometimes hated”-Operator by Jim Croce.,11,2025-03-27 16:38:24,RegrettableWaffle
music,1jl7uif,mk1hl5w,"Sam Stone - John Prine

Luka - Suzanne Vega",9,2025-03-27 17:00:51,Final-Performance597
music,1jki29l,mjvecai,This is a tribute my cousin Amber made about my dad Larry Tamblyn. He will be missed,27,2025-03-26 17:59:04,dropamusic
music,1jki29l,mjwshdt,May the Force be with him.,3,2025-03-26 21:59:22,Pairdice
music,1jki29l,mjw5b6f,What a legend. Sorry for your loss.,5,2025-03-26 20:10:25,justuntlsundown
music,1jsv6yv,mlpgzlk,Listening to this album was a game changer for me and my musical tastes. Chino's whole trip hop project Team Sleep has some bangers too. Cheers for reminding me of this band.,6,2025-04-06 14:53:02,plainasplaid
music,1jsv6yv,mlpbo5k,Loved this album,4,2025-04-06 14:23:31,SaltLakeSparky354
music,1jsv6yv,mlpm7fs,"When Girls Telephone Boys perfectly sums up how I feel about the same tedium.  This album goes hard.  One of my favs…

Edit:  I don’t seek out wild and crazy, but that shit loves to find me…😓",4,2025-04-06 15:21:26,ClydeFrogsDrugDealer
music,1jqor41,ml8hqio,i love weird shit like this.,9,2025-04-03 17:38:55,BulgingForearmVeins
music,1jqor41,ml8xzfz,"Wonder who he has doing opera vocals now, since Laure wasn't working with him anymore.",4,2025-04-03 18:58:45,R_V_Z
music,1jqor41,ml92hru,"New igorr hype!!?


I wonder if the video is actually si generated or they specifically chose that uncanny vibe the si videos have. Hard to tell. ",5,2025-04-03 19:21:31,_OVERHATE_
music,1jqor41,ml8mydu,"I think one of my favorite Igorrr videos was one where they put a toy piano out with a chicken, put chicken feed all over the keyboard, then the chicken pecked out a little tune and Igorrr played along with what they played and made a piece of music out of it.

edit:  [https://www.youtube.com/watch?v=WFxDOV6IwHk](https://www.youtube.com/watch?v=WFxDOV6IwHk)",8,2025-04-03 18:04:00,cbessette
music,1jqor41,ml8r6if,"For me, their stuff is right on the edge of the dada fold and I fuckin love it.",3,2025-04-03 18:24:54,0-Give-a-fucks
music,1jqor41,ml8kpbc,Fantastic!!,2,2025-04-03 17:53:11,rabbitwithhorns
music,1jqor41,ml8l2tn,Yaaay! New Igorrr!!!,2,2025-04-03 17:54:58,scooter76
music,1jqor41,ml9s0zu,Well that was a fucking trip. Into my playlist you go.,2,2025-04-03 21:28:18,Vizth
music,1jj08ya,mjjuov5,My new goal in life is to see this live and time it so that the edible kicks right at the start of this song.,5,2025-03-24 21:38:54,TheCitizen616
music,1jj08ya,mjngmg5,So this is what the Polyphonic Spree has been doing lately?,2,2025-03-25 13:33:10,tech_equip
music,1jj08ya,mjq1n2c,I didn't know how much I needed this right now. Thanks!,1,2025-03-25 21:00:42,baldriansen
music,1k29ld2,mnsdq48,"[We Die Young](https://tidal.com/track/33723796?u)
 was revelatory. Much more so for me than Smells Like Teen Spirit.",2,2025-04-18 17:03:02,DoomferretOG
music,1k29ld2,mnswr7h,So much more powerful and put together than the music of today. They are legendary .,1,2025-04-18 18:37:31,mysterygal98
music,1k29ld2,mnu6urc,*Metal,0,2025-04-18 22:48:39,yousyveshughs
music,1k0u54y,mngyst3,Cold Fact is an amazing album.,7,2025-04-16 20:29:38,JohnnyDrek
music,1k0u54y,mnjcif4,"Sad fact, the guy who made the documentary struggled with depression and took his own life at 36 yrs old.",2,2025-04-17 05:16:10,GovernmentBig2749
music,1k0u54y,mngx505,"I saw him play before he passed away at a show in Columbus, Ohio at The Wexner Center",1,2025-04-16 20:21:27,AngelicWildman
music,1k0u54y,mnhz3mw,I love this movie. It’s a real life rockstar fairytale. So cool!,1,2025-04-16 23:46:25,Pretend-Principle630
music,1k0u54y,mnk91lm,"I was sat in a bar last night (UK) and one of his songs was playing and I thought how cool that was. He was lost, and then found, and now after his death his music is part of the lexicon.",1,2025-04-17 10:39:33,elom44
music,1joedjd,mkr6x00,💃,4,2025-03-31 21:27:06,haunted_haus25
music,1joedjd,mkrkbjc,grooooves for miles,3,2025-03-31 22:41:27,Heliocentrist
music,1joedjd,mkrwtjj,"War is the shit. I remember working with an old jazz/funk/soul cat who really put me onto them. He’d tell me back then, it was almost unheard of to see black people, white people, AND Hispanic people on the same stage! He had this theory that Charles Miller was murdered by the government for trying to bring people of all races together, and honestly the more time goes by, the more I could see it.",3,2025-03-31 23:53:06,JamBandDad
music,1joedjd,mlkqb6r,The studio version of this is absolute perfection. Every student of recording arts should study it,2,2025-04-05 18:10:37,jchapstick
music,1joedjd,mkt7l92,Wow.. What a jam!,2,2025-04-01 05:11:14,cycogod
music,1jm40ar,mk8u2gb,That School House Rock album had no business going as hard as it did.,3,2025-03-28 20:20:26,nayrlladnar
music,1jm40ar,mk91g89,"So what I learned from that song many years ago was that, as the second child, I ruined a magic family.",2,2025-03-28 20:57:30,Varanjar
music,1k3nhid,mo3n844,Grunge?,10,2025-04-20 15:08:19,grooveunite
music,1k3nhid,mo4p7pj,“Grunge” haha,3,2025-04-20 18:29:38,yousyveshughs
music,1k3nhid,mo6jc7t,Pixies are Alternative Rock with some punk influence and a dash of surfer rock for good measure. Def not grunge.,1,2025-04-21 00:51:28,AngelicChaos13
music,1jqozse,ml98hwu,Brutal!,3,2025-04-03 19:51:18,Evelyn-Bankhead
music,1jqozse,ml9bgbc,"The riffs are gut-wrenching, unbelievably powerful, super dense and heavier than a falling crane smashing into concrete and glass. The drumming is insanely good as well.",3,2025-04-03 20:05:30,Empty_Original_1387
music,1jqozse,ml9w5k1,Fuck yeah!,1,2025-04-03 21:50:36,FiniteJester
music,1jqozse,ml9zrd2,Fuck yes,1,2025-04-03 22:10:48,Large-Competition442
music,1k32mtd,mnys82c,This video left a lasting impression on my 15 year old self  when it was in heavy rotation on MTV. I still love it.,9,2025-04-19 18:23:07,EucatastrophicMess
music,1k32mtd,mnz0wse,One of the best tracks of the 1990s. This basically was our theme song 1998-2001ish,8,2025-04-19 19:10:39,zestylemon10
music,1k32mtd,mnzugcm,"This video, believe it or not, is still in regular rotation on MTV Classic! 😄 In fact, in 2023 and most of 2024 it was usually shown multiple times a day. Someone in programming there must be a big fan of it!",8,2025-04-19 21:56:33,theweightofdreams8
music,1k32mtd,mo0hhem,Your Woman is a classic 🙌 The sample used in this song is also very popular and idk why it reminds me of the Darth Vader theme,7,2025-04-20 00:11:45,jsp378
music,1k32mtd,mnz9mhq,Ever hear the origina (https://en.m.wikipedia.org/wiki/My\_Woman\_(1932\_song)) ? The 90s one is basically a cover.,5,2025-04-19 19:59:25,Chopper3
music,1k32mtd,mo03d6o,Chooon!,3,2025-04-19 22:48:17,DogFun2635
music,1k2z8b3,mnyihhh,"Soup, soup, a tasty soup, soup, a spicy CARROT AND CORIANDER (chili chowder)",26,2025-04-19 17:33:02,Pyrichoria
music,1k2z8b3,mny2b6a,"Easy there fuzzy little man peach, you ever drink Bailey’s from a shoe?",32,2025-04-19 16:07:55,Jokertrm
music,1k2z8b3,mnych8x,Anybody who thinks otherwise ain't got the funk.,29,2025-04-19 17:01:47,cyclejones
music,1k2z8b3,mny8ct8,"https://youtu.be/_6FjSVl0eKw?si=B4YFDZq3NMUqERrq


The album version of Isolation slaps.",10,2025-04-19 16:40:08,hankeypoo
music,1k2z8b3,mnypgx2,The music from the show was one of my favorite parts. Not even just the songs but the atmospheric music too.,9,2025-04-19 18:08:41,Dracoslade
music,1k2z8b3,mnz53y1,Games. Love Games? ,10,2025-04-19 19:34:16,dub-fresh
music,1k2z8b3,mnydnsr,"Eels up inside ya, finding an entrance where they can",21,2025-04-19 17:08:03,Poison_the_Phil
music,1k2z8b3,mnzbvxo,"Electro Boy goes incredibly hard to this day, as does every Crimp, an artform that is due a comeback",9,2025-04-19 20:12:01,vrilro
music,1k2z8b3,mo06qqm,[Bouncy bouncy! Ooh such a good time!](https://youtu.be/CNgL0E2BFEM),9,2025-04-19 23:08:08,lingh0e
music,1k2z8b3,mnza2xe,"Chapatti Chapatti Chapatti basmati 
Chapatti Chapatti Chapatti basmati",9,2025-04-19 20:01:58,Iucidium
music,1k2jrsw,mnve4ko,A cover version so good even Bob Dylan preferred it to his original! 👍 One of Jimi’s best songs! 🎸,3,2025-04-19 03:24:00,theweightofdreams8
music,1k2jrsw,mnuogvt,Groovy 😎,2,2025-04-19 00:35:35,Bynairee
music,1k2jrsw,mnw1t2z,This is absolutely my favorite song by Jimi! I was lucky enough to see him in person but I can't remember if he did the song I was too stoned!,1,2025-04-19 06:49:33,Actual-Bag-3937
music,1k0i8za,mnejpie,r/orphancrushingmachine,4,2025-04-16 13:13:11,CensoryDeprivation
music,1jxs38z,mmt73c0,Already listened to it 3 or 4 times. Totally agree with the old friend opinion. Feels good to hear him like this.,4,2025-04-12 23:08:10,rassler35
music,1jxs38z,mmtbswr,"Justin started with an infamously bleak album detailing a heartbreak, and he is ending Bon Iver with his most joyous and uplifting album. Kind of bittersweet that this is the end of the project, but this feels like the right way to do it.",4,2025-04-12 23:37:06,munchyslacks
music,1jxs38z,mmtl75l,"I’ve only had time to listen twice all the way through, but I think it’ll find a place on regular rotation. 

I’ve been on board since Emma, and I think it’s maybe just because I’m roughly the same age as him, but he has this knack for releasing albums that hit me right where I am in my life at that point. I still think *22, a Million* is his most striking album, and I love the widescreen, pastoral vibe of his s/t, but this one just feels cozy in the way that I need right now. On the first few listens, there aren’t any real show stoppers on the level Holocene or 33 “God” (or 666 upsidedowncross, or 8(circle) or pretty much any other song on that album or even a “Hey, Ma” or “Faith”), but it’s got a fantastic vibe.

In a way, it feels like Vampire Weekend’s Only God Was Above Us from last year. It’s deeply entrenched in his past albums, while being something completely new.

Really dig it. I’m *very* interested to see what he does with these songs live!",4,2025-04-13 00:37:36,punbasedname
music,1jxs38z,mmsvr28,"Award season almost made me cry. The moment the horns come in to break the surface tension is like the heavens opening up, or my tearducts",8,2025-04-12 21:57:51,dannydamsco
music,1jxs38z,mmtn1gl,"My personal AOTY so far. Brilliantly written, brilliantly arranged, brilliantly mixed.",3,2025-04-13 00:50:06,drawtoomanycircles
music,1jxs38z,mmtgqew,"God, it's beautiful :'",2,2025-04-13 00:08:26,Barli792
music,1jxs38z,mmuh6f7,I love everything about this record. I’ve have From on repeat so many times. I love that Mk.gee and Dijon got brought in.,2,2025-04-13 04:21:30,baccus83
music,1jxs38z,mmujcx6,Perfect breakdown . You should do music reviews,1,2025-04-13 04:38:44,connorshawsmusic
music,1jxs38z,mmvk6bh,Great album all together.   I feel it would have hit harder had he not released half of the album early.,1,2025-04-13 10:47:14,KimaJean
music,1jxs38z,monfhoi,I love this album so much. It’s that classic Bon Iver sound and feel but it fills me with hope.,1,2025-04-23 18:18:16,Naydawwwg
music,1jlpzhr,mk7d0ce,Afterlife? Maybe someone brought them back to life after all.,20,2025-03-28 16:01:22,thespaceageisnow
music,1jlpzhr,mk7y0l5,"I saw these guys right before covid. They came to Washington with Lindsay Sterling. It was an amazing show. My inner emo teenager was giddy, and I 100% cried multiple times.

Lindsay isn't really my style, but DAMN thar girl can play. It was really impressive.",14,2025-03-28 17:42:22,ladykiller1020
music,1jlpzhr,mk8fkh1,feat. Dante from the Devil May Cry™ series,6,2025-03-28 19:08:14,Estilix
music,1jlpzhr,mk68uji,"TL;DR This should scratch the “Evanescence itch” for “Evanescence heads.”  Also, idk the “proper use of quotes.”

Non “Evanescence head” here. They’re great, but when I’m in the mood for hi gain guitars, I want something harder. Just me. 

I did listen to Metallica enough to have my favorite albums and my least fav era. Personally, Hardwired to Self Destruct is new Metallica that sounds enough like the eras I loved. It scratches the “Metallica itch.” This sounds to me, like it would do the same if I were an Evanescence fanboy. Plus there’s a lyrical thematic congruence to their big hit Back to Life but with a new perspective. 

Off topic: her voice is top tier and I would love to hear it in other genres.",5,2025-03-28 12:27:04,N/A
music,1jvx62d,mme65em,"First Blur, Supergrass, Oasis now Pulp... Britpop is back baby 😎🇬🇧🎸",10,2025-04-10 14:26:39,Bulbasaurus__Rex
music,1jvx62d,mmdqatd,"Man… this new song is really quite something. 

The nostalgic video aside, the vibe of the music takes me right back to the mid-90’s like nothing else I’ve really heard in the past quarter century. 

If the rest of the album is on the same level as this first single, I think Pulp may have pulled off something really special :)",6,2025-04-10 12:59:27,MouthwashProphet
music,1jvx62d,mmdwzvg,"I *was* going to say it sounds like Different Class and how I love their earlier stuff more as I am a gatekeeper music snob who had PulpIntro on cassette (brilliant album!) *and* saw Pulp live half a dozen times while they were still good (did), but on second listen... I just can't. That is simply superb.",5,2025-04-10 13:38:41,simagus
music,1jvx62d,mmdppbn,A reference to the Widnes concert?,1,2025-04-10 12:55:53,Shot-Ad5867
music,1jvx62d,mmhacer,And here i was believing all these years that a new Pulp album would be fiction....,1,2025-04-10 23:56:03,Marcysdad
music,1jvx62d,mmdptp2,Not one of their best. I am not optimistic about the quality of the album.,-7,2025-04-10 12:56:36,DogesOfLove
music,1jspuf9,mloao5n,I just watched this for the first time last week.  I did not realize that was Paula Cole at first.  I really enjoyed Don't Give Up with Cole.  Check it out if you haven't.  I think I watched it on Amazon Prime no extra fees.,3,2025-04-06 09:19:18,LegitJesus
music,1jspuf9,mloc6lp,"If you really like Peter Gabriel’s world music influences you should checkout the catalog of his RealWorld record label, sooooo many great artists/albums over the years.",4,2025-04-06 09:35:50,AudereEstLamela
music,1jspuf9,mloeg9i,"Pretty sure the whole concert is on youtube, well worth the watch. What I get from this is how much fun they are having on stage, there's a real feelgood vibe about the whole thing",3,2025-04-06 10:00:15,Crittsy
music,1jspuf9,mlocky5,Such a beautiful song 🎶,2,2025-04-06 09:40:08,Sharona676
music,1jspuf9,mloexr0,I love it 😍,2,2025-04-06 10:05:24,Jane_Austen11
music,1jspuf9,mlpbh7g,It’s world music,2,2025-04-06 14:22:25,Chocolat-Pralin
music,1jspuf9,mlq3ydl,"I sold a fair number of home theater systems because of that album. Same with the film Twister.

  
Those two was a license to print money. Fucking 'Blood of Eden' should have gotten an awards from McIntosh, Infinity, and Sony.",2,2025-04-06 16:57:54,idgarad
music,1jrsxot,mlhip5h,It is a really good take...the IMAX really makes it pop...,8,2025-04-05 03:22:43,Jennysnumber_8675309
music,1jrsxot,mlhe73c,"YeH it has its moments. Resd the book, i did last year and while reading  listen to the albums as they are created. The bit where they place Bonhams drums in the hall of the castle for that big sound...",3,2025-04-05 02:49:45,hillathome
music,1jrsxot,mlho0u1,I’m still waiting for the movie version of “Hammer of the Gods.”,4,2025-04-05 04:03:54,Vitiligogoinggone
music,1jrsxot,mlhstq2,"Thank you was our wedding walk song,  I put in the rain song too .",2,2025-04-05 04:43:39,No_Season_354
music,1jrsxot,mlhof5x,"Yes! It is a great film! 🥇 I saw it in IMAX and in a regular theater (IMAX was better, obviously - but both viewings were excellent)! This will be an instant buy for me when it comes out on BluRay (apparently, it will go to streaming services first).",2,2025-04-05 04:07:08,theweightofdreams8
music,1jrsxot,mlhjzai,Saw it in February. Will buy on DVD and play in an endless loop…,1,2025-04-05 03:32:28,UFO-Band-Fanatic
music,1jrsxot,mlkqlgt,Did it have any footage of Jimmy's 14 year old child groupie he toted with him on tour? Any mudsharks perhaps? I was a big zep fan but it's interesting how we can all choose to ignore the gross shit they did.,1,2025-04-05 18:12:11,MF-86
music,1jrsxot,mlhpf7g,Just plundered it from the high seas.,-2,2025-04-05 04:15:18,Kummakivi
music,1jrsxot,mlhnbvj,does it teach how to steal music and rob other artists?,-31,2025-04-05 03:58:26,graywailer
music,1jo68go,mkpfn4a,That is a mighty fine track indeed. Right up there with [Piss up a Rope](https://www.youtube.com/watch?v=CLPQznD11xU)!,5,2025-03-31 16:11:42,simagus
music,1jo68go,mkq5lwo,Great song with very weird lyrics! Favourite song on the album is Powder Blue,3,2025-03-31 18:20:14,Forsaken-Link-5859
music,1jo68go,mkrs1ex,I think I spent the dog food money…,1,2025-03-31 23:25:19,yousyveshughs
music,1k4d8vo,mo987el,"While I don't personally consider her a one hit wonder, a lot of people do. My favourite Carly Rae Jepsen song is Run Away With Me",41,2025-04-21 13:48:02,CryptoIsAPonziScheme
music,1k4d8vo,mo99qu5,I hate that Alien Ant Farm will forever be tied to “Smooth Criminal” because “Movies” is their best song. I’ll even take “Wish” and “These Days” over the cover.,38,2025-04-21 13:56:41,VinTheHater
music,1k4d8vo,mo9a3ko,"DEVO has such an incredible catalog, it's hard to believe that ""Whip It"" is their most well-known song",49,2025-04-21 13:58:40,bngbngcpsnrbbrs
