subreddit,post_id,comment_id,comment_content,comment_score,comment_created_at,comment_author
news,1jpdgj9,mkylh11,So proud of my state today!,5026,2025-04-02 02:15:23,Junimo116
news,1jpdgj9,mkyn2a1,"And the margin wasn't even close either.

FL two deep red districts, while staying red, also swung 20 points toward the Dem.  People are not happy, period.",14503,2025-04-02 02:25:33,zakuivcustom
news,1jpdgj9,mkym7r1,Good. Elon's money can't buy everything. ,2394,2025-04-02 02:20:06,Various_Occasions
news,1jpdgj9,mkynz0n,"Hello from Wisconsin. Nearly $100M was poured into this race. It was fucking miserable for all of us. We should all be embarrassed that we have let this happen to our democracy.

Fuck oligarchs, fuck big money in politics.",4718,2025-04-02 02:31:23,gradi3nt
news,1jpdgj9,mkyn38w,Fuck off Elon. We hate you.,8648,2025-04-02 02:25:43,SinCollector
news,1jpdgj9,mkymmil,The thought of Elon coping and seething at this brings me great joy,1619,2025-04-02 02:22:43,cheesymac84
news,1jpdgj9,mkylfq0,"It just feels nice to read a positive headline for once. 

Congratulations to Susan, fuck you Elon.",18769,2025-04-02 02:15:10,suicideskinnies
news,1jpdgj9,mkylnk0,Well now trump is going to go extra nuclear tomorrow with whatever the plan was instead of firing elon for doing a piss poor job.,1470,2025-04-02 02:16:33,slayer370
news,1jpdgj9,mkylik7,And Elon spent millions on this race lmao,3310,2025-04-02 02:15:40,VeryPerry1120
news,1jpdgj9,mkynf7s,"Imagine being one of the richest people in human history and you still fail to use your unimaginable wealth to blatantly manipulate votes in a state election.

It's hard for me to think of anyone who has ever existed that is a bigger loser than Elon Musk.",633,2025-04-02 02:27:51,erabeus
news,1jjom7u,mjougo4,"Every single action the trump admin takes is beneficial to Russia, they are acting no differently than how an agent for the Russian government would be acting in this position.",17966,2025-03-25 17:31:20,notmyworkaccount5
news,1jjom7u,mjotry4,"> Witkoff arrived in Moscow shortly after noon local time on March 13, according to data from the flight tracking website FlightRadar24, and Russian state media broadcast video of his motorcade leaving Vnukovo International Airport shortly after.

> During the group discussion on Signal, Goldberg reported, **Ratcliffe named an active CIA intelligence officer** in the chat at 5:24 p.m. eastern time, which was just after midnight in Russia. Witkoff’s flight did not leave Moscow until around 2 a.m. local time, and Sergei Markov, a former Putin advisor who is still close to the Russian president, said in a Telegram post that **Witkoff and Putin were meeting in the Kremlin until 1:30 a.m.**


Seriously, what more is needed to charge these guys with whatever your equivalent of treason is?

At this point, I’m pretty sure the ‘VP’ in the chat was not the couch molester, it was Vladimir Putin (only half /s).",20648,2025-03-25 17:28:07,evissimus
news,1jjom7u,mjp2o6i,"This is like Watergate level, it's gotten people jailed and killed Hillary's entire political career for 1/10th of what happened.",2793,2025-03-25 18:10:45,Techn028
news,1jjom7u,mjp1f9w,"Why was a government official in Russia, meeting with Putin until 1:30 AM local time? Forget the entire Signal issue (for a moment, then don't forget it please) and try to answer that question without suggesting that this administration is completely in the pocket of Russia? You cannot do it. 

Somewhere, somehow, there has to be a truly patriotic Republican in Congress that will say something. Right?",3906,2025-03-25 18:04:39,greebytime
news,1jjom7u,mjoubty,Republican voters decided en mass that they were pro Russia. Here we are.,3246,2025-03-25 17:30:42,Junkstar
news,1jjom7u,mjottle,Wonderful.  I wonder how much more fucked up this story will get….,708,2025-03-25 17:28:20,cinderparty
news,1jjom7u,mjphogq,"Approx. a decade ago, a presidential candidacy imploded using a coordinated, performative, non-stop attack by right wing news outlets on Hillary’s emails; packaged and distributed so successfully by the Trump republicans that they still refer to it, literally, today. Left to center/apolitical outlets dropped the ball.

Democrats: You couldn’t ask for a more perfect opportunity. Hell, the playbook has already been written.

Your move. America (and the rest of the world) is watching.",604,2025-03-25 19:24:15,Tonya_Stark
news,1jjom7u,mjoxsmu,It's quite literally like they are working directly with Russia to provide state secrets.,360,2025-03-25 17:47:18,gentleman_bronco
news,1jjom7u,mjowdoi,"This just keeps getting better and better. I know Hanlon's Razor almost certainly applies here, but this is all so perfectly damaging to the administration that I can't help but wonder is some low-ranking aid didn't send that text to the journalist as a form of whistle blowing.",1167,2025-03-25 17:40:32,MalcolmLinair
news,1jjom7u,mjp78sp,"THIS is why they want to destroy the press and journalists.   If it wasn't for journalists, all of this would have gone unnoticed.",222,2025-03-25 18:33:06,maxplanar
news,1k2d6qa,mnt5qki,The courts should block the payments from the administration to the countries taking these people and they won't take them anymore.,17590,2025-04-18 19:24:27,New_Housing785
news,1k2d6qa,mnt62q1,"I want to know how this would be enforced

Because currently I am not seeing an active and useful enforcement vehicle of any kind in play

He’s not gonna be impeached bc republicans dont care

He’s still got massive approval among republican voters 

Ice agents aren’t exactly gonna go for civil disobedience

And anyone charged with a crime can be pardoned by trump and he also cannot be charged with a crime apparently

So what is the barrier here other than like decorum?",4535,2025-04-18 19:26:16,Pundamonium97
news,1k2d6qa,mntkspa,"There's literally videos of people breaking into homes without a warrant. This is WAYYYYYY past a court ruling. Without ENFORCEMENT, our institutions are USELESS.",121,2025-04-18 20:44:06,DimitriTech
news,1k2d6qa,mnt5rsp,"And who gonna stop them from ignoring this judge? 

Fascists only play by their own rules.",1517,2025-04-18 19:24:38,litnu12
news,1k2d6qa,mntfxo4,"Yeah, because that's stopped them so far.",102,2025-04-18 20:18:40,BrightMarvel10
news,1k2d6qa,mnt9r2m,"**It isn't a deportation; it is an extrajudicial rendition to a 3rd party dictatorship for indefinite incarceration in cruel and unusual conditions without any recourse nor due process for the accused (All at the behest of the Executive Branch and continually paid for by the U.S. taxpayer).**

Calling it a ""deportation"" is like calling attempted murder, a friendly tussle.

Supporting deportations and thinking the deportations are justified, doesn't require you to agree with turning a deportation order into life imprisonment in a dictatorship, paid for with your tax dollars.

>""Defendants argue that the United States may send a deportable alien to a country not of their origin, not where an immigration judge has ordered, where they may be immediately tortured and killed, without providing that person any opportunity to tell the deporting authorities that they face grave danger or death because of such a deportation,"" Judge Murphy wrote.

\---

These aren't a deportation in any traditional sense of the word and we should not call nor acknowledge them using ""deportation.""

It wasn't removal from the country. It was U.S. law enforcement physically handing over two hundred plus people in custody (often with a questionable basis) over to El Salvador's law enforcement to throw them in a dictator's prison camp without trial, due process, or any legal recourse, all paid for by the U.S. taxpayer.

That is what we call an extraordinary rendition, or state-sponsored kidnapping, paid for by the U.S. taxpayer.

Calling it a deportation buries the lead and plays into the alt-right/this administrations' narrative. Likewise it makes it harder to explain the problem here, as it phrases the complaint as against people being sent back to their country of origin.

To be clear we aren't deporting people from the country; we are using U.S. taxpayer dollars to pay a dictator to imprison and disappear hundreds (so far) of foreign nationals from 3rd party countries at the behest of the U.S. executive branch.

(Not that there are no problems with the deportations/process in general, but that is much harder to communicate.)",569,2025-04-18 19:46:01,Primsun
news,1k2d6qa,mnt68m5,Uh huh. Now fucking enforce it.,268,2025-04-18 19:27:08,morituri230
news,1k2d6qa,mntmduc,"OK, but what then?

Don't get me wrong, this needs to stop, but the Trump regime seems to ignore court orders with impunity.",31,2025-04-18 20:52:26,KnucklesMcGee
news,1k2d6qa,mnth2ew,"""All nine sitting justices of the Supreme Court of the United States, the Assistant Solicitor General of the United States, Congress, common sense, basic decency, and this Court all disagree [with the Trump admin].""    

U.S. District Judge Brian Murphy when issuing an injunction barring the administration from deporting non citizens to a country that is not their origin.   

That bit about common sense and basic decency is so true.",68,2025-04-18 20:24:32,JK_NC
news,1k2d6qa,mntkbr4,"The fifth amendment says no person shall be deprived of life, liberty, or property without due process of law.

Not citizen. PERSON.",102,2025-04-18 20:41:38,FlowRiderBob
news,1jpfwg4,mkz3iy0,"I highly recommend his 2020 book called I’m your Huckleberry, I just finished it last month. Since he couldn’t read the audiobook, he had three different people read it for him, including Will Forte from SNL. He really lived a great life. Rest in peace.",3258,2025-04-02 04:25:31,Webgardener
news,1jpfwg4,mkz2tu2,I am glad we got to see him star Top Gun 2. He was a fighter and held on for a long time despite a very aggressive and terrible disease. I hope he is now at peace.,4733,2025-04-02 04:19:49,sortinousn
news,1jpfwg4,mkz2nwi,"I wondered for months before the movie came out how Iceman would be portrayed in Top Gun 2, since Val’s illness took his voice away. 

It was a pleasant surprise how they did it, and did right by him to honor his character. 

One of my favorites from the 90s growing up. His guest spot on Entourage was a hilarious surprise. 

He will be missed dearly.",3533,2025-04-02 04:18:28,ElementalWeapon
news,1jpfwg4,mkz1hgs,Damn. He had so many legendary roles in his career. And great comedic chops as well.,3993,2025-04-02 04:08:57,putsch80
news,1jpfwg4,mkz32x7,RIP. I'm glad he isn't suffering anymore. he'd been battling cancer for so long,3470,2025-04-02 04:21:52,UsuallyTheException
news,1jpfwg4,mkz23qn,"Fair winds and following seas, Iceman.",3040,2025-04-02 04:13:57,2HDFloppyDisk
news,1jpfwg4,mkz24bq,I'm your huckleberry. RIP,2146,2025-04-02 04:14:04,pusspakmcquack
news,1jpfwg4,mkz2hxs,Batman Forever is the one they picked for the headline?,7990,2025-04-02 04:17:08,IvanStarokapustin
news,1jpfwg4,mkz4i85,He was great in Kiss Kiss Bang Bang,201,2025-04-02 04:33:40,insertbrackets
news,1jpfwg4,mkz3mfa,Willow. It’s a favorite. What a legend.,1494,2025-04-02 04:26:20,HMV0913
news,1jwyvvi,mmmplrf,"“The Attorney General's television appearance was similar to her first two public statements
in that she never mentioned that Mr. Mangione was **not indicted** nor that he has the presumption of innocence. 

She emphasized, for the third time, that her decision to seek the death penalty was based on the President's directive, specifically that the administration will seek the death sentence ""whenever possible."" She then invoked her personal experience, saying that she was a capital prosecutor, who tried death penalty cases and that ""If there was ever a death case, this is one."" **The Attorney General stated during her television appearance that a reason she ordered the death sentence was because the alleged victim was a CEO. Counsel is aware of no provision in the death penalty statute or in the Department of Justice's death penalty protocol that allows for consideration of the social, economic or professional status of an alleged homicide victim in determining whether to seek the death penalty.”**

I encourage everyone to read the motion, it makes some strong points.",14704,2025-04-11 21:10:12,redlamps67
news,1jwyvvi,mmmaw6a,I'd publicly ask for a pardon while I was at it. Just to get it on record.,6513,2025-04-11 19:54:54,AudibleNod
news,1jwyvvi,mmmcqo6,"Why does he need a cop breathing down his neck in every shot lmao. They just get closer and closer every time I see him it's getting a bit intimate. By the time Luigi actually receives his sentence, half the precinct is going to be on his lap.",12859,2025-04-11 20:04:02,Fine-Will
news,1jwyvvi,mmmestk,This trial is gonna be a whole media spectacle. I wonder what the reaction from the oligarchs will be if the jury refuses to convict him.,3258,2025-04-11 20:14:24,WheelyWheelyTired
news,1jwyvvi,mmmi87d,But Pammy doesn’t care about the husband and father they “accidentally sent” to a brutal prison in El Salvador and refuses to get him removed.,941,2025-04-11 20:31:48,Lindaspike
news,1jwyvvi,mmmfigs,I'm still wondering how hard jury selection will be for this. It's going to be difficult considering how many people have strong opinions about the healthcare industry.,1674,2025-04-11 20:18:00,Peach__Pixie
news,1jwyvvi,mmmohba,">Counsel is aware of **no** provision in the death
penalty statute or in the Department of Justice’s death penalty protocol that allows for
**consideration of the social, economic or professional status of an alleged homicide victim in determining whether to seek the death penalty.**

>Rather than relying on these reasons, **the Attorney General cited the professional status of
the victim as a CEO**, the fact that the previous administration had not sought the death penalty in
four years and that her decision to order it here was due to the **president’s policy to “Make America Safe Again.” **Also, if the death penalty was being ordered pursuant to policy instead of publicity, the** Attorney General would not have put her directive in the form of a press release followed by an Instagram post that effectively launched a new government social media account.**

Some excellent points by his attorneys.",290,2025-04-11 21:04:09,CompoteAgile2655
news,1jwyvvi,mmmfydg,When are they going to go after the people that killed the Boeing Whistleblowers?,686,2025-04-11 20:20:14,SamuelYosemite
news,1jwyvvi,mmmf8j6,Absolutely crazy that from the start he’s been treated as guilty. What happened to due process?,1235,2025-04-11 20:16:36,RedRhodes13012
news,1jwyvvi,mmmoem3,"Didn't Trump already pardon him when he said, ""if it's good for the country, it's not illegal""?",395,2025-04-11 21:03:45,mandymarleyandme
news,1k485d6,mo83kqf,"I'm glad he made it out of the hospital, anyway. He died in his own bed.",6310,2025-04-21 08:16:16,TreasureTheSemicolon
news,1k485d6,mo82mfa,Must have been holding out for one last Easter,15610,2025-04-21 08:06:10,BlackPresident
news,1k485d6,mo833au,"Gone the day after Easter. Idk, is there anything more... Catholic? May he rest in eternal peace far from the trials and tribulations of Earth.",5326,2025-04-21 08:11:05,azulur
news,1k485d6,mo82gt9,"Hope he went peacefully, and I hope the transition to the next pope goes smooth as well.",2124,2025-04-21 08:04:33,aimless_meteor
news,1k485d6,mo852k9,At least he lived past Easter and lived long enough to make that impact standing.,295,2025-04-21 08:32:14,mauvebliss
news,1k485d6,mo85n4k,"> Francis appointed nearly 80% of the cardinal electors who will choose the next pope, increasing the possibility that his successor will continue his progressive policies, despite the strong pushback from traditionalists.


This will provide some hope.",9205,2025-04-21 08:38:17,NotTobyFromHR
news,1k485d6,mo83fti,"Damn, the guy clung to life for that Easter appearance, probably because he knew that it would mean a lot to a lot of people and then he just let go. 

Rest in Peace, Francis. You were actually a good Pope. 

I hope we can find someone similar, especially in these insane times.",9299,2025-04-21 08:14:47,OnlyRoke
news,1k485d6,mo88z7v,"I was a closeted teenager in Catholic school when he was elected, and as he preached compassion over the years I felt like I could tangibly sense the people around me change their viewpoints on queerness. So many of my family members, including my godfather, changed their minds without knowing at the time that I was queer. I think it made me feel a lot more secure in my self when I did decide to start coming out a few years ago.

I'm not Catholic anymore, but I think it would have taken me a lot longer to get on my own path if not for him. I'll always appreciate him for that. I hope he knows that he helped a little lesbian feel a bit more loved.

Edit - OH MY GOD thank you guys for the awards!!!!!!",10490,2025-04-21 09:13:23,VodkaAunt
news,1k485d6,mo82jw2,"I hope the next pope is as kind and generous as this one was, we need it right now.",4608,2025-04-21 08:05:27,ThetaOneOne
news,1k485d6,mo8474c,"I met pope Francis at a charity do once. He was surprisingly down to earth, and very funny",801,2025-04-21 08:22:53,Saltire_Blue
news,1jl63ad,mk0ze5p,"""Out here, nobody knows where I am, and I’m believed to be away on a trip. Here are brewing economically and politically dark times, so I’m happy to be able to get away from everything."" 

-Einstein hiding in Northern Germany in 1922, eleven years before he renounced his German citizenship following Hitlers rise to chancellor.",6369,2025-03-27 15:33:57,Bantis_darys
news,1jl63ad,mk37u3p,"I use his video to teach my G10 students about fascism (I teach history at an American school in Taipei, Taiwan). The Trump Administration has ticked just about every single box he listed. 

Here's the video if you haven't seen it: https://youtu.be/CpCKkWMbmXU?si=NaQGVkXHwpxsENZE",191,2025-03-27 22:47:49,Sharealboykev
news,1jl63ad,mk0vovx,"A poignant quote from the article:  ""Social media posts spread on Wednesday, noting the alarm sounded by a scholar of fascism leaving the country over its political climate. Nikole Hannah-Jones, the journalist and creator of the 1619 Project,[wrote](https://bsky.app/profile/nhannahjones.bsky.social/post/3llakwvszts2c) on the social media platform Bluesky: “When scholars of authoritarianism and fascism leave US universities because of the deteriorating political situation here, we should really worry.”",7534,2025-03-27 15:15:45,forrestfaun
news,1jl63ad,mk0y312,"The vast majority of U.S. residents cannot leave. They either lack the resources or no one would be willing to take them on due to factors such as age, education, and others reasons. Protected is our freedom to travel, and essentially to leave has been our right. However, with a passport costing $250 and roughly 60% of Americans being a single paycheck away from homelessness, the majority have no freedom to travel or leave.  Trickle-down only worked for billionaires. The middle class has been significantly eroded over the past few decades. We are now stuck with our makings.",2208,2025-03-27 15:27:31,ididstop
news,1jl63ad,mk0vb6e,He'll be back when he has to do his fieldwork.,899,2025-03-27 15:13:53,The_Wookalar
news,1jl63ad,mk14yce,If only there had been a literal decade of warnings for people to pay attention to…,531,2025-03-27 16:00:40,bbqsox
news,1jl63ad,mk24087,"Professor here at a large American university that has been named as one of the 60 targets of the administration for whatever bullshit they don't like. Most of us cannot leave. Many of us are staying and fighting in whatever ways we can. They may come for all of us who are politically outspoken eventually. While Stanley is doing what is best for him, I am proud of my colleagues staying and resisting right now. Still, I am really, really scared -- especially for our international students and colleagues.",166,2025-03-27 18:46:55,slow_hockey
news,1jl63ad,mk0uf6n,"""Those who do not learn from history are doomed to repeat it""

This is simply an example of the inverse being true.",1112,2025-03-27 15:09:29,kevtino
news,1jl63ad,mk15qip,We're hostages tied to a chair while children with loaded guns are running around.  I hate it here,196,2025-03-27 16:04:26,Dzotshen
news,1jl63ad,mk0worr,[deleted],387,2025-03-27 15:20:41,N/A
news,1jjsoal,mjpt2n0,">But according to a Pentagon “OPSEC special bulletin” seen by NPR reporters and sent on 18 March, Russian hacking groups may exploit the vulnerability in Signal to spy on encrypted organizations, potentially targeting “persons of interest”.

I guess Pete Hegseth didn’t get the memo.",5605,2025-03-25 20:19:19,Modz_B_Trippin
news,1jjsoal,mjpowk6,"There is no justification for using Signal for official communications other than evading record collection laws, something Republicans used to consider literally the most important thing in the world.",11251,2025-03-25 19:59:32,Hrekires
news,1jjsoal,mjprom4,"So why is no one chanting ""lock him up"".",2571,2025-03-25 20:12:44,Farcespam
news,1jjsoal,mjppj8m,"And again it’s worth noting not a single person in that chat said anything like “why are we discussing this here? Is this normal? This seems weird to me”

No, they all went with it. This tells me that this scenario isn’t unusual for them. They do this shit all the time, which is HIGHLY DISTURBING (and illegal) and should concern EVERYONE.",1594,2025-03-25 20:02:32,JerryDipotosBurner
news,1jjsoal,mjps32c,"Staffers used it in his first administration, in violation of the records law, and no one was prosecuted.",450,2025-03-25 20:14:38,Ryan3740
news,1jjsoal,mjq6l5l,Where. Are. The. Consequences.,185,2025-03-25 21:25:28,Leaislala
news,1jjsoal,mjqd2lu,"And the Atlantic needs to sue Heg-twerp for slander. His statements about the journalist were off the rails.

“You’re talking about a deceitful and highly discredited so-called journalist who’s made a profession of peddling hoaxes,” Hegseth told reporters Monday. “This is a guy who peddles in garbage.”",74,2025-03-25 21:58:24,cudmore
news,1jjsoal,mjpyuu8,"As an IT Systems Engineer, it seems unfathomable that their devices are not managed and hardened by a Mobile Device Management platform. All my company phones are managed and users cannot install apps which are not approved.",289,2025-03-25 20:47:10,CaliJack19
news,1jjsoal,mjpsxi1,"Well of course they did. And of course they did it anyway. And of course, every conservative alive is bending over backwards to convince themselves this is a nothing burger of a story.",92,2025-03-25 20:18:39,gentleman_bronco
news,1jjsoal,mjprj1n,"The people Trump has appointed are sycophants and not versed in statecraft.

They completely lack governance experience. 

Remember this when you or ones you love are impacted. Remember this when it's time to vote them out and hold them accountable.",244,2025-03-25 20:11:59,N/A
news,1jwn062,mmjlhvy,"This is the statement she was fired for: ""I do not presume to understand current politics, but what I do know is the concerns of the US administration discussed by Vice-President Vance on Friday are not reflective of Pituffik Space Base.""""",12487,2025-04-11 11:14:51,Perma_frosting
news,1jwn062,mmjjfdx,Slapped arse VP basically says that having an opinion that differs from the party line is misconduct. Welcome to the 'land of the free'.,11696,2025-04-11 10:57:57,Curious-Depth1619
news,1jwn062,mmjo808,Integrity will not be tolerated.,2289,2025-04-11 11:35:44,Ulysses1978ii
news,1jwn062,mmjk9to,They know she wouldn't obey the order if they ask them to take over the island.,3502,2025-04-11 11:04:56,HarbingerDe
news,1jwn062,mmjjmuu,Is this the same JD Vance who likes to lecture Europe on freedom of speech?,17844,2025-04-11 10:59:41,HotelPuzzleheaded654
news,1jwn062,mmjmhrl,"It’s funny that they say it is because she was undermining the chain of command by insulting Vance, when Vance isn’t in her chain of command.",2260,2025-04-11 11:22:34,Gabyfest234
news,1jwn062,mmjluuv,"I’m not sure how one would Undermine Vance more than Vance.

Motherfucker dragged a whole camera crew to show off how he doesn’t know how to order donuts and then released that video.

Guy stands next to his Indian wife talking about how immigrants are destroying the nation.

The whole Admin’s a clown show, but JD’s the smaller, even stupider clown that can’t get out of the car without falling head first into an open sewer.",1022,2025-04-11 11:17:39,aradraugfea
news,1jwn062,mmjkryx,There has never been a worse administration in the history of our country.,3689,2025-04-11 11:09:06,Reviews-From-Me
news,1jwn062,mmjoydp,"Oh for fuck's sake.

Hello Americans. I am from Turkey. Everything that has been happening so far feels so familiar it is painful. It is almost like you lot just elected Erdoğan. The only difference is that your idiots are pretty much speedrunning this bullshit instead of spreading it over 20 or so years.

Almost like they are sharing notes. Fucking hell...",158,2025-04-11 11:41:03,lordkhuzdul
news,1jwn062,mmjmigz,The VP isn't even in the military chain of command lmao,575,2025-04-11 11:22:42,Lionsledbypod
news,1jz55kn,mn3kan9,"Trump also told him that he needs to build more prisons because we will be sending our ""home-grown"" next.",2491,2025-04-14 17:56:23,blogoman
news,1jz55kn,mn3jpof,[deleted],8658,2025-04-14 17:53:37,N/A
news,1jz55kn,mn3l301,[removed],2450,2025-04-14 18:00:09,N/A
