subreddit,post_id,comment_id,comment_content,comment_score,comment_created_at,comment_author
music,1jith30,mjhsbpt,"Hell no, they were just the right amount of weird.

Their first LP and the one they did with Todd Rundgren- Remote Control- are both in my top 20 of all time.

I'm also a big Todd fan who is sometimes considered ""too weird"" by people.",10,2025-03-24 15:39:34,beardsley64
music,1jith30,mji1osz,Still remember them on SCTV on The Fishin’ Musician!,8,2025-03-24 16:25:59,JimmyTheJimJimson
music,1jith30,mji9ez8,Upvoting everyone here - at the time I felt like I was almost the only one in the world who loved them - glad to know I'm not alone!  :-),7,2025-03-24 17:03:26,KarynOmusic
music,1jith30,mji61t1,Vinnie Gang,6,2025-03-24 16:47:20,oldwhitelincoln
music,1jith30,mjhs9gg,"I saw them in 83 opening fo Bowie, great show. Excellent performance.",4,2025-03-24 15:39:15,themango65
music,1jith30,mji9vmr,"I was supposed to be in the video for She’s a Beauty.  My folks took me and some friends to an amusement park one day (I think great adventure in Jersey, but might have been Dorney Park).  There was a camera crew, we signed waivers and rode roller coasters over and over and over again.  We were all told we’d be in the video. 

Stayed up late to watch the premier and while there is an amusement park vibe, they went a way different direction.   40 years later, I’m still kind of bummed.  ",4,2025-03-24 17:05:45,RichChocolateDevil
music,1jxssq0,mmt14fi,"Night ripper, all day and feed the animals are great to listen to as full albums. Each song leads into the next. It’s really one 50 minute song.",10,2025-04-12 22:30:26,dr_xenon
music,1jxssq0,mmtot3i,Dude used host parties on the stage when he performed.,5,2025-04-13 01:01:52,catheterhero
music,1jxssq0,mmt05r4,Party soundtrack,2,2025-04-12 22:24:29,gnr8abeat
music,1jxssq0,mmtksel,I listen to this record all the time,1,2025-04-13 00:34:50,emerican
music,1jxssq0,mmufvcf,Bounce That always seems to come on randomly when shuffling my library. Makes me miss Girl Talk album releases when I’d learn a bunch of new amazing songs I haven’t heard.,1,2025-04-13 04:11:37,soopah256
music,1jst0yi,mlqek6j,"Imagine watching MTV (or Much Music) at night in the mid 2000s, high as a kite, and then this video pops up.",17,2025-04-06 17:53:07,ZombieJesus1987
music,1jst0yi,mlpt5ap,I'd be so pissed if my sister made a song like that about me. Then greyjoy or not.,33,2025-04-06 15:59:15,ggallardo02
music,1jst0yi,mlrd1ke,I mean he did get out there so I guess the song worked. Theon Greyjoy all day.,7,2025-04-06 20:56:42,Bubbasage
music,1jst0yi,mloy82a,[removed],12,2025-04-06 12:58:30,N/A
music,1jst0yi,mlsym2f,I think that's the puppet that killed John Wick's dog and stole his car.,4,2025-04-07 02:53:42,RunningSpanx
music,1jst0yi,mlqmgob,Forgot about this song,2,2025-04-06 18:34:50,marquis_fm
music,1jst0yi,mlsi5go,"Strange.  Is she coming out with a new album or something? I heard this on the radio a few times starting a month ago after a couple decades from last time,  and it's popped up on my YT suggestions almost every day since",2,2025-04-07 01:04:00,MoreThanWYSIWYG
music,1jst0yi,mls8gwe,If my sibling wrote this song about me i would probably just quit it lol,1,2025-04-07 00:02:22,Lazerpop
music,1k4n4hi,mobkzmh,I'm an asshole - Dennis Leary,22,2025-04-21 21:03:35,Bubbaxx1
music,1k4n4hi,mobaoi1,This Year - The Mountain Goats,17,2025-04-21 20:12:57,Jacefacekilla
music,1k4n4hi,mobfbhm,Two-Headed Boy by Neutral Milk Hotel,16,2025-04-21 20:35:44,Gullible-Title54
music,1k4n4hi,mobha2r,"I just sat and listened to “End Of The Line” by Traveling Wilbury’s in my car even though I was already home.  Out of the hundreds of times I’ve heard it, this time it brought a tear to my eye.  The lyrics were ringing extra true this morning.",15,2025-04-21 20:45:19,sykokiller11
music,1k4n4hi,mobetgk,The Clash - Lost In The Supermarket,23,2025-04-21 20:33:18,HipsterPicard
music,1k4n4hi,mobukfv,My Shits Fucked Up-Warron Zevon,11,2025-04-21 21:53:32,silent_earth5
music,1k4n4hi,mobfckq,[Man Made of Meat - Viagra Boys](https://youtu.be/UD4jRK5j2Ow?si=jo7-H3h15J0fGMOc),10,2025-04-21 20:35:53,KidGrundle
music,1k4n4hi,mobq2cu,NOFX - Idiots are taking over,10,2025-04-21 21:29:45,Im_Borat
music,1k4n4hi,mobez4f,Longview by Green Day,9,2025-04-21 20:34:04,TrentonTallywacker
music,1k4n4hi,mobn28c,High Hopes. It’s always High Hopes.,8,2025-04-21 21:14:08,Rlyoldman
music,1k328fj,mnypgwo,Michael Penn - This and That,56,2025-04-19 18:08:41,caranchorgl
music,1k328fj,mnyu19b,Crimson and Clover by Tommy James,36,2025-04-19 18:32:53,bebopbrain
music,1k328fj,mnyuvoc,Ass & Tittes - Three 6 Mafia,74,2025-04-19 18:37:28,Mayonnaise_Poptart
music,1k328fj,mnyobch,“Ebony and Ivory”,29,2025-04-19 18:02:41,Gilshem
music,1k328fj,mnyrkju,"Pink Floyd - Us and Them

Huey Lewis and his News - Heart and Soul

Village People - Ups and Downs (not the *best* song on Cruisin, but still came to mind)

and then for some silly ones,

seconding Weird Al - White and Nerdy

Ninja Sex Party - Thunder and Lightning",31,2025-04-19 18:19:39,starwalker327
music,1k328fj,mnyownj,Silver and Cold - AFI,27,2025-04-19 18:05:45,shredthecat
music,1k328fj,mnywgrk,Mastodon- Blood and Thunder,24,2025-04-19 18:46:01,f00dtime
music,1k328fj,mnyxcql,Incense and Peppermints. The Strawberry Alarm Clock,22,2025-04-19 18:50:53,MrRichardSuc
music,1k328fj,mnyyb6y,"High and Dry - Radiohead

Crosseyed and Painless - Talking Heads

Black and Huge - GWAR

Me and Your Momma - Childish Gambino

Fire and Rain - James Taylor

Titties and Beer - Frank Zappa",21,2025-04-19 18:56:10,8805
music,1k328fj,mnyqk1i,White & Nerdy - Weird Al,17,2025-04-19 18:14:18,bangoperator
music,1k1ejtb,mnldnrf,"If anyone ever tries to claim that modern pop is more mindless than the “good old days”, send them this song.",17,2025-04-17 14:48:24,digitalmediaworld
music,1k1ejtb,mnm6ewi,I literally just watched them live (Peter Noonan and Hermans Hermits) at Epcot a few weeks ago.   They were performing during the Flower and Garden festival. ,4,2025-04-17 17:07:21,OneOfALifetime
music,1k1ejtb,mnm3ixh,Lol my mom still sings this on occasion. Never seen anyone else perform it but her till now.,3,2025-04-17 16:53:34,numbernumber99
music,1k1ejtb,mnmaon4,When I was a kid I remember walking around my neighborhood with a few friends singing this loudly while banging metal trash can lids like cymbals.,2,2025-04-17 17:27:37,Mr_Torque
music,1k1ejtb,mnop5y3,I'm not sure the lyrics are entirely historically accurate.,2,2025-04-18 01:05:28,Eroe777
music,1k1ejtb,mnp58ni,"I’ve had this song stuck in my head for two days… hadn’t heard it in 25+ years, now this… what is going on???",2,2025-04-18 02:48:19,ColonelCraptastic
music,1jwio01,mmj9b2z,"The Freshman by the Vervepipe. The single is a bit faster tempo than album cut, and it works.",19,2025-04-11 09:21:16,So-Called_Lunatic
music,1jwio01,mmiowgj,"The album version of *Lucky Star* feels unnecessarily long.  I’m not a Madonna fan, but I like the radio version.",16,2025-04-11 05:49:20,WasabiCrush
music,1jwio01,mmj3hrb,i - Kendrick Lamar,11,2025-04-11 08:18:29,Dakotaraptor123
music,1jwio01,mmj2qtd,"The shorter (i assume) radio version of Love Shack is incredible. The longer version is good, but doesn't flow and keep momentum up as much.

In the edited version all the backup singers come in and stay perfectly, so I can't praise it enough.",10,2025-04-11 08:10:26,Ingebrigtsen
music,1jwio01,mmj9yyr,"The single version of ""Are You Receiving Me?"" by XTC, better mix and more energy than the version recorded for Go 2.

My favourite anomaly from their catalogue is the single for ""Respectable Street"". They swapped the word ""abortions"" for ""absorption"", along with a couple of other safe-mode lyrics, thinking it would be enough to pass the BBC censors. However, because they mention ""Sony Entertainment Centre"", the BBC banned it anyway (advertising brands like this on the beeb used to be the biggest no no).",11,2025-04-11 09:28:18,Logical_Bat_7244
music,1jwio01,mmiohil,"Yeah, Revolution is a prime example of this. It's single version makes every fit better",17,2025-04-11 05:45:30,IAmTheWalrusOfFame
music,1jwio01,mmj8del,"Honkey Tonk Woman(single) and Country Honk(Let it Bleed) is a bit the same thing as the relationship between Revolution 1 and Revolution. I like both, but ""Honkey Tonk Woman"" is among Stones best, while Country Honk is more a really great vibe that fits well on the album",7,2025-04-11 09:11:13,Forsaken-Link-5859
music,1jwio01,mmkgf86,Down With the Sickness by Disturbed cuts the little interlude where he’s talking about his mom. Honestly probably a good cut. It’s a little jarring,8,2025-04-11 14:24:19,non_clever_username
music,1jwio01,mmiqsqw,"Tipsy by J-Kwon 

Everybody in the club gettin tipsy >> everybody in this bitch gettin tipsy.",22,2025-04-11 06:07:09,PsychedeLuke
music,1jwio01,mmjr3ba,"Slow Ride - Foghat.

Seems like they knew that they wrote a killer song,  but just filled it with a bunch of unnecessary nonsense in the middle to extend it for as long as they could.",8,2025-04-11 11:56:15,thewhitedeath
music,1ju3g9x,mlz1x4u,"That’s the first song he ever wrote. Such a nameless thing.  God speed, Townes",3,2025-04-08 02:52:09,ranchophilmonte
music,1ju3g9x,mlzayy3,The absolute BEST.,2,2025-04-08 03:54:49,shawnshine
music,1jtwvyg,mmzsdq8,Small talk @125 Lennox,1,2025-04-14 01:42:02,bozeek
music,1jtlvt5,mlvezty,"So everyone conveniently forgetting his work in the 80s? One of the biggest pioneers in hip-hop - arguably the most influential person in hip-hop of his era that wasn't an artist. His production was unmistakably him. 

Founder of Def Jam, responsible for Run-DMC, LL Cool J, Beastie Boys, Public Enemy, and COUNTLESS more seminal acts.",262,2025-04-07 14:56:25,FederalSign4281
music,1jtlvt5,mlval6w,"Life doesn't take place on a spectrum with ""spiritual"" on one side and ""capitalist"" on the other. So I'm not sure why you're acting like those attributes are conflicting. It sounds you're getting at the difference between art and commerce, which are indeed two very different things 


All I know is that I found ""The Creative Act: a way of being"" to be full of interesting ideas that I think about regularly when I'm doing creative work. ",112,2025-04-07 14:33:45,Mulsanne
music,1jtlvt5,mlvad38,"I don't think his podcasts having sponsors or his community being paywalled is relevant. 

  
As far as his career as a producer goes, a music producers main role is to clarify and facilitate the vision of the artist. Rubin is undeniably very, very good at this. He sees what direction the artist wants to go in and he helps clear the path.",208,2025-04-07 14:32:34,Avbjj
music,1jtlvt5,mlv75b1,"All I can I say is I am grateful to him for Johnny Cash's late career revival.  Whatever he did with Cash, even if it was just being around, led to some incredible music, and reintroduced the Man in Black to a whole new audience.  I also think he was involved with the ad that Cash took out.

[https://calendar.songfacts.com/march/14/15354](https://calendar.songfacts.com/march/14/15354)",44,2025-04-07 14:15:50,tracklesswastes
music,1jtlvt5,mlvca5d,The thing is so many bands always go back to him for a reason. A reason that none of us will likely ever know unless we're in a band that he produces.,28,2025-04-07 14:42:34,Bmc00
music,1jtlvt5,mlv5obi,"I remember one Linkin Park behind the scenes video with Rick Rubin going ""but are these songs the best they could be?"" and Mike Shinoda responding something like ""you better start being specific with your feedback, RIck"".",75,2025-04-07 14:08:00,patatjepindapedis
music,1jtlvt5,mlvl7bu,"A lot of musicians are extremely skilled but lack the knowledge of knowing what sticks with general public. Rick Rubin is the opposite of that. While not extremely skilled (instrument wise), he has an ear and intuition that few have. If you play him a song that's 20 minutes long, he can pick it apart, trim the fat, and arrange it in a way that general public can easily digest. This is why alot of bands and artists went to him if they wanted their CDs to sell like hot cakes or have the radio play their song repeatedly. 

I wouldn't say he got lucky. I would say he knows his shit. I know making hits is much different now in the streaming era. But when CDs, MTV, and radio were still prevalent, he was your guy.",10,2025-04-07 15:27:50,existential_virus
music,1jtlvt5,mlvso48,Him claiming that he made 99 problems for Jay z and not mentioning that it all was stolen from Ice-T made me loose all respect for him and not belive a single word he says.,10,2025-04-07 16:06:15,husis666
music,1jtlvt5,mlv5ar8,![gif](giphy|dhz1gKi7WKWpW),18,2025-04-07 14:05:56,Mikimao
music,1jtlvt5,mlvjcrx,Dude was at the right place/time and just understands pop music. There’s nothing more to it than that. Good on him for making a living at it but he’s not an oracle.,18,2025-04-07 15:18:17,jesus_chen
music,1jtl7ji,mlv6lpl,"Patrice Rushen, Evelyn “Champagne” King and so many others from that scene have been largely forgotten by the mainstream and they’re definitely due for a rediscovery. 

So many good songs and such a huge influence on the entire decade to come.",8,2025-04-07 14:13:01,___horf
music,1jtl7ji,mlv0e5l,Underrated and under-appreciated.  She's also a helluva producer and jazz musician.,6,2025-04-07 13:38:06,howelltight
music,1jtl7ji,mlvf3tj,Forget Me Nots is probably one of my top 5 bass lines of all time,6,2025-04-07 14:56:56,nitro4450
music,1jtl7ji,mlv03ra,"She is great! Such a talented musician. ""Shout it Out"" and ""Patrice"" are my favourite albums of her, they are maybe slightly jazzier but still very funky.",4,2025-04-07 13:36:21,TheRaisinPJP
music,1jtl7ji,mlvbv1r,I’m going to check them out today. Only heard her hits and I dig them. Love 70s/80s R&B/Funk/soul/ New Jack swing. Thanks for the tip,3,2025-04-07 14:40:25,NotDukeOfDorchester
music,1jtl7ji,mlw7jjd,Remind me is my all time favourite song! The synth solo goes hard with backing vocals,3,2025-04-07 17:22:19,Enrondeau
music,1jtl7ji,mly14qb,"Number One is my jam!

https://open.spotify.com/track/3vSgRQYNEUEjcFOGMiSTw3?si=rzvD9LzfSxq5wdUhXB693g&context=spotify%3Asearch%3Apatrice%2Brushen%2B",3,2025-04-07 23:08:44,jg_ldn
music,1jtl7ji,mlvki4x,Never heard of her until my parter played some years ago. I was instantly hooked.,2,2025-04-07 15:24:14,TheLordMed
music,1jtl7ji,mmzss4r,Great Pianist,1,2025-04-14 01:44:40,bozeek
music,1jk5i0k,mjsplpj,The greatest ending to the most original debut album,2,2025-03-26 07:26:03,Tabula_Rasa00
music,1jjr2rc,mjqzf18,"I saw them a couple of years back when they were on tour with Noel Gallagher. They sounded great and were fucking LOUD. 

Good on em for going back on the road.",5,2025-03-25 23:55:49,dr_coleslaw
music,1jj4yrx,mjkwmqq,"Her beautiful voice… then at 2:30 she ascends to yet another, higher realm entirely

*swoon*",2,2025-03-25 01:02:10,MrsSynchronie
music,1k3skpk,mo4q96j,"This graphic novel will come out on August 26, 2025",2,2025-04-20 18:35:11,Top-Three-USA
music,1k04k7z,mnbkgi8,"Loops of magnetic tape were used to create repetitive, rhythmic musical patterns in this song. ^tape ^loops",4,2025-04-15 23:31:40,AuFingers
music,1k04k7z,mnb8l27,Holy hell at first I read this as Poop Will Eat Itself and I had to do a double take,3,2025-04-15 22:24:35,conker2021
music,1k04k7z,mnc0er0,I still listen to this fairly often. They had a few good songs.,3,2025-04-16 01:04:41,Rocky_Vigoda
music,1k04k7z,mnck149,PWEI is Industrial ...WTF ALT ROCK LMAO! This \[USB\],0,2025-04-16 03:05:26,SoliPsik
music,1jzri0e,mn9x9i8,How long does he wait down there,1,2025-04-15 18:22:53,klsi832
music,1jzri0e,mnbt7pm,Shiiiiiiiiieeeettt,3,2025-04-16 00:22:17,alyosha_pls
music,1jzri0e,mnbwg0s,Omar comin'!,3,2025-04-16 00:41:13,MrPanchole
music,1jzri0e,mnc4p4x,You got to keep the devil way down in the hole.,1,2025-04-16 01:30:38,Mission-Pie-9953
music,1jzri0e,mndhzfd,We used to make things in this country. Now we just put our hand in the next guys pocket.,1,2025-04-16 08:00:03,Ebolatastic
music,1jz7s3y,mn48q8i,This is literally the first time I’ve seen the lead singer have dry hair. Literally every show I’ve ever seen of them. His hair was wet. All night somehow,5,2025-04-14 19:59:15,SPMusicProduction
music,1jz4khx,mn3ip4o,"Around the world, around the world

Around the world, around the world.",75,2025-04-14 17:48:49,DRHORRIBLEHIMSELF
music,1jz4khx,mn3jjgi,I think i know 99% of Green Day songs word for word at this point because they're my favorite band.,27,2025-04-14 17:52:47,Jirachibi1000
music,1jz4khx,mn3nxjc,Now here's a little story I got to tell about 3 bad brothers you know so well.,24,2025-04-14 18:14:10,Squido85
music,1jz4khx,mn3orus,">Let’s build a thread full of timeless bars.

And all I do is kiss you, through the bars of a rhyme.  
Julie, I'd do the stars with you, anytime.

Dire Straits, ""Romeo and Juliet""

'Cause the man from Mars is through with cars  
He's eatin' bars, yeah wall to wall  
Door to door, hall to hall  
He's gonna eat 'em all  
Rap-ture

Blondie, ""Rapture""",21,2025-04-14 18:18:22,deviltrombone
music,1jz4khx,mn3j2uj,"I swear, I recognize your breath

Memories like fingerprints are slowly raising

Me, you wouldn't recall for I'm not my former

It's hard when you're stuck upon the shelf",17,2025-04-14 17:50:37,BlazinTrichomes
music,1jz4khx,mn3pmes,"Fearlessly the idiot faced the crowd, smiling

Merciless the magistrate turned round, frowning 

And who’s the fool who wears the crown?

Go down, in your own way 

And everyday is the right day 

And as you rise above the fear lines in his brow

You look down, hear the sound 

Of the faces in the crowd. 

Fearless, Pink Floyd 1971",13,2025-04-14 18:22:34,lovedontfalter
music,1jz4khx,mn3tbn5,"Watch out where the huskies go don't you eat that yellow snow -Frank Zappa

sage advice",11,2025-04-14 18:41:09,Conquering_Worms
music,1jz4khx,mn3oipg,"Beverly Hils that's where I want TAH BAEEE. 

Gimmie gimmie.",10,2025-04-14 18:17:06,Loukoal117
music,1jz4khx,mn3s2go,The dreams in which I'm dying are the best I've ever had.,19,2025-04-14 18:34:44,Hedwigtoria
music,1jz4khx,mn3lmfz,"Burn down the disco 

Hang the blessed DJ 

Because the music that they constantly play 

It says nothing to me about my life.",9,2025-04-14 18:02:48,EA_Spindoctor
music,1ju28jp,mlyrxpa,"Can't stop playing this on repeat the past few days. Such a gem.

[https://www.rollingstone.com/music/music-features/gordon-lightfoot-dead-obituary-1234716529/](https://www.rollingstone.com/music/music-features/gordon-lightfoot-dead-obituary-1234716529/)

""If I could read your mind love,  
What a tale your thoughts could tell  
Just like a paperback novel,  
The kind the drugstore sells  
When you reach the part where the heartaches come

The hero would be me  
Heroes often fail  
And you won't read that book again  
Because the endings just to hard to take""",2,2025-04-08 01:49:33,ladyindev
music,1ju28jp,mm0krn1,"This is one of my dad’s favourite songs. When I was a kid, I couldn’t stand his voice, but now I really appreciate it.",2,2025-04-08 11:15:00,flowry1
music,1jn435x,mkgvgcc,Fucking nailed it!,3,2025-03-30 04:01:39,emerbott
music,1jjhxom,mjnvn94,One of the best songs to see how loud your stereo goes.,2,2025-03-25 14:52:56,CrimsonFeetofKali
music,1jzggyn,mn7fwwa,This is ♥️,3,2025-04-15 09:33:18,Gullible_Key6660
music,1jzggyn,mn6cpi2,"It’s funny - I loathe and despise “Wham!” …and yet… I am strangely tolerant towards George Michael’s solo career. I don’t love this song, but I don’t hate it either. In fact, I can say I like it a bit - like most of his solo work. Go figure. 🤷‍♂️",4,2025-04-15 03:18:54,theweightofdreams8
music,1jzdp4i,mn63tr1,"It's CSNY, not just Y",5,2025-04-15 02:19:47,That_Kiefer_Man
music,1jzdp4i,mn9ixrl,"Just for context, 11 days after the Kent State shootings, there was a similar protest by about 100 African American student war protestors at Jackson State College in Mississippi.  The police opened fire, with more than 360 shots fired over a 30 second period, and two students were killed and 12 were injured by police gunfire. 

Not to denigrate in any way the Kent State massacre, but nobody remembers the Jackson State massacre and nobody wrote a song about them.",4,2025-04-15 17:12:54,Final-Performance597
music,1jzdp4i,mn5wg8t,I dunno if I would classify this as a folk song.,3,2025-04-15 01:34:16,YesOrNoWhichever
music,1jzdp4i,mn83o9u,this song always gets me.,2,2025-04-15 12:45:48,amputeenager
music,1jx7i7e,mmo9zbo, Memories of watching MuchMusic and Friday night videos!,7,2025-04-12 02:55:20,blackmoose
music,1jx7i7e,mmpj0n4,don't push the blade on the guy in the shades!,2,2025-04-12 09:48:45,Johnny_Segment
music,1jx7i7e,mmoahb5,"Corey Hart's 'Sunglasses at Night' was inspired by a pair of Ray-Ban Wayfarer sunglasses he purchased while recording in England, which led to the iconic line about wearing shades at night. The song's lyrics reflect themes of insight and deception, as the narrator uses sunglasses as a metaphor for seeing through someone's dishonest actions. [Sources: Wikipedia](https://en.wikipedia.org/wiki/Sunglasses_at_Night), [American Songwriter](https://americansongwriter.com/the-meaning-behind-sunglasses-at-night-by-corey-hart-and-how-a-pair-of-wayfarers-inspired-the-track/)

* [Sunglasses at Night - Wikipedia](https://en.wikipedia.org/wiki/Sunglasses_at_Night)
* [The Meaning Behind ""Sunglasses at Night"" by Corey Hart and How ...](https://americansongwriter.com/the-meaning-behind-sunglasses-at-night-by-corey-hart-and-how-a-pair-of-wayfarers-inspired-the-track/)

^(This is a bot made by [Critique AI](https://critique-labs.ai). If you want vetted information like this on all content you browse, [download our extension](https://critiquebrowser.app).)",2,2025-04-12 02:58:45,critiqueextension
music,1jx7i7e,mmq9v8j,Future Man,1,2025-04-12 13:26:48,tenfootspy
music,1jx7i7e,mmomqrg,"The intro is so good. Maybe a little reminiscent of Sweet Dreams, but still super catchy.

https://preview.redd.it/txe3r6wm0cue1.jpeg?width=1920&format=pjpg&auto=webp&s=26dd6b813da24869013faaa170d4c305e57e403e",1,2025-04-12 04:30:33,somesthetic
music,1jts3wy,mlwj9aq,I don’t like Power Rangers as much as I used to. This is normal. ,131,2025-04-07 18:20:39,Bone_Dogg
music,1jts3wy,mlwpqzw,For me this is usually due to repetition so I'd recommend listening to other stuff and then coming back to it,19,2025-04-07 18:53:45,Your_Local_Bisexua
music,1jts3wy,mlwiwzw,I’m 64 and I constantly find music that’s either new or new to me. Exploring new things keeps you healthy!,68,2025-04-07 18:18:51,Mr_Torque
music,1jts3wy,mlwk8jp,"Stop listening to it then!

Put it on a shelf and look for new things to make you feel like that again. 

It’s a weird feeling for sure - to have an album that you swear you could listen to forever and always love it, and one day…you don’t. 

I’ve “shelved” Dark Side, Random Access Memories, Alive 2007, Abbey Road, Magical Mystery Tour, Sgt. Pepper (actually probably all of The Beatles now that I think of it), My Beautiful Dark Twisted Fantasy, and Hyperdrama (just to name a few quick-to-mind albums). I thought they were all great and can recall them note-for-note when they’re on, but I don’t get that same feeling I used to like when I was younger. Sometimes the itch itches and I’ll throw one on and enjoy every moment, but the time has got to be right for me to get that same “feeling”. 

You can’t listen to it again for the first time, which is a crying shame. Let it fade away a bit in to your memories, and drag it back out when you forget it a bit more. 

The good news: you get to go find new songs, albums, and artists in a search for that “new thing”. 

Good luck!",33,2025-04-07 18:25:37,hotdogpartytime
music,1jts3wy,mlwou5h,Gotta be on a nonstop prowl for new music.,11,2025-04-07 18:49:10,IvanLendl87
music,1jts3wy,mlwjmhj,"Long ago when I was a teenager I overlistened to my favourite stuff, and somewhat ruined it. When I really really like a new song or album I keep it to once every few weeks and look for variety.

Try a break, deep dive into something new and save your own classics.",15,2025-04-07 18:22:31,ScottyBoneman
music,1jts3wy,mlwsbui,"We grow, we change, we adapt. This is normal. It may also help to lay off it for a while and soon you may rediscover your love for it. A lot of times music is emotion and what resonates with what you feel at the moment is the kind of music you may find enjoyable. Maybe what you used to like doesn't mesh with your current life experience and interests, this is okay. It could be a good starting point to explore other genres.",5,2025-04-07 19:07:01,Rohml
music,1jts3wy,mlwjsfl,"How has your sleep been?  I only ask because I went thru a period that I lost all enjoyment for music.  I found out later that I had been suffering from sleep apnea for years.  When I finally addressed that issue, my enjoyment of music came back.  Music has always been a big part of my life, so I know how troubling it can be to lose it.  This probably isn't your issue, but I figure it was worth a shot.",12,2025-04-07 18:23:21,mongotongo
music,1jts3wy,mlwmlht,"When I was younger I used to religiously listen to The Beatles and Pink Floyd. As an adult I haven't chosen to listen to either of those bands in years. I listened to them so much that I still feel the burnout when they come on the radio, so I have to change it. Music, like anything else, is best in moderation. Do you really love band X? Well if you want to preserve that love you had better start listening to bands A, B, C, D, E, F, G, etc. ",5,2025-04-07 18:37:49,SystemOctave
music,1jts3wy,mlx1p5y,Pink Floyd is my favorite band of all time. I rarely put on their records. That's ok.,3,2025-04-07 19:55:40,digidave1
