subreddit,post_id,comment_id,comment_content,comment_score,comment_created_at,comment_author
news,1jkmn4b,mjx46r9,"So pretend for a moment that you get rolled up on by a group of masked people in street garb that jump out of a car an accountant would be driving. And you also have a gun...

If you start blasting when they try to kidnap you, how does that ultimately play out?",133,2025-03-26 23:01:23,Bgrngod
news,1jkmn4b,mjx5p8o,"Eventually nobody in their right mind is going to want to study, work or visit here...",128,2025-03-26 23:09:26,Ok_Flan4404
news,1jiob6e,mjgo5yo,[deleted],4375,2025-03-24 11:44:20,N/A
news,1jiob6e,mjgmo3c,"> United said it has contacted Sotomayor ""to address her concerns and apologized for any frustration she may have experienced."" The airline did not provide further details.


> Sotomayor told NBC...the airline’s apology “was not sincere.”


Obviously, because that wasn't a real apology.  ""I'm sorry you felt bad"" is not an acknowledgement of any wrongdoing.  


That said, they have to know they are toast if they are sued over this so maybe not admitting wrongdoing is part of their litigation damage control.  She even went the extra mile ""she shared the documentation with the airline before the trip and that the airline cleared her son's medical equipment with no problem.""  Combine that with the flight attendants providing B.S. medical advice that the son would ""be OK until we're in the air at a high enough altitude.""  This whole incident stinks.",7089,2025-03-24 11:32:20,misogichan
news,1jiob6e,mjgnl2s,"My baseline for United customer service is ""better or worse than beating up a doctor and dragging him off the plane?""",1123,2025-03-24 11:39:46,ConstableGrey
news,1jiob6e,mjgtxa8,This is actually nuts. The whole plane crew working together really trying to kill that kid,1978,2025-03-24 12:27:02,checkerouter
news,1jiob6e,mjglnow,"Ma'am, he'll need that to live.",1299,2025-03-24 11:23:56,alwaysfatigued8787
news,1jiob6e,mjgqbfp,It’s like they have a quota to kill and maim folks,89,2025-03-24 12:00:43,NowIKnowMyAgencyABCs
news,1jiob6e,mjgmw82,Wow. It’s a trach tube not an earring. Thank God the mom stuck to her documentation and did not take away her son’s lifeline until they got to cruising altitude.,868,2025-03-24 11:34:11,RattyRhino
news,1jiob6e,mjgmlns,Sounds like the flight attendants need to attend a little training course.,989,2025-03-24 11:31:46,N/A
news,1jiob6e,mjgpcpi,I’m just thinking about that poor child just trying to survive the flight and the audacity of an airline attendant to suggest he would be ok without oxygen is insane. Hopefully she makes millions in her lawsuit and have plenty of funds to take care of herself and her child.,340,2025-03-24 11:53:27,notthenomma
news,1jiob6e,mjgm1hn,So many of these crazy stories come from United Airlines,569,2025-03-24 11:27:08,HeyGirlBye
news,1jrda3l,mldsuq7,"Perhaps not in an actual competition, but fencing is often coed… I’ve definitely fenced against as many women as I have men. There isn’t some radical sex based advantage in fencing the way you might argue there is in many other supports, so this is totally ridiculous.",9117,2025-04-04 14:51:15,finallytisdone
news,1jrda3l,mldq7wg,"So this is what the distraction is gonna be while the economy collapses, people are pulled off the streets by masked police and flown off without trial, and our allies abandon us? This is the important shit right here, huh?",2944,2025-04-04 14:38:11,culinarydream7224
news,1jrda3l,mldvs31,"> Prior to 1990, separate men’s championships were held, but since then, fencing has been a coed sport with teams having men’s and women’s squads, although some schools field only a women’s team. Fencing is a single-division sport with schools from all three NCAA divisions competing against each other.

Here’s some facts for all the morons talking about the “biological advantage” men have in fencing. It’s been a coed sport at the national competition level for nearly FOURTY YEARS. This is nothing but more conservative performative outrage, and your excuses is what encourage this kind of behavior.",1100,2025-04-04 15:05:41,frenchfreer
news,1jrda3l,mldr0j6,If all fails throw in a bit of trans panic so MAGA has something to be outraged about,647,2025-04-04 14:42:11,N/A
news,1jrda3l,mle0t6e,I’m sure the comments and discourse will be very positive,87,2025-04-04 15:30:48,EL-YEO
news,1jrda3l,mldr8mr,"Journalists suck.

This article should have at a minimum explained USA fencing's policy [outlined here](https://www.usafencing.org/transgender-and-nonbinary-policy). They couldn't be bothered to even look up what the policy was apparently, or provide information around why USA fencing felt that policy was actually ok.

This article comes across as, ""Hey I'm some dude and I want to poke women with my sword."" Not, ""I identify as a woman and I've been on HRT for 12 months and because of that have lost most of my muscle tone."" I'd even think it was great if they explained the counterpoint as well which is that most of the physical advantage of men comes from their height which is something they gain in puberty.

I know this is a challenging topic for a lot of people, but holy fuck mainstream journalism is garbage.

  
edit: This is not an endorsement of alt-media (which is nothing but a sewage plant). It's a plea for journalists to do better.",267,2025-04-04 14:43:18,lunacyfox
news,1jrda3l,mldr3dm,I'm still on the fence about the whole thing.,92,2025-04-04 14:42:35,shinjikun10
news,1jrda3l,mldtikd,Name one professional fencer off the top of your head.,70,2025-04-04 14:54:29,domine18
news,1jrda3l,mle6nru,"Look, I'd like to care about the stock market, having a house, people being disappeared, but this lady didn't get to fence who she wanted!!  This is truly the crisis of our time.",74,2025-04-04 15:59:40,funnysad
news,1jrda3l,mldty91,"All these folks so worried about women's (and girl's) sports don't seem too concerned that the Department of Education is being dismantled and that the DOE oversees compliance for Title IX.  Pre-Title IX --1 in 27 girls participated in sports, now it's is 2 in 5.  If you really do care about ""protecting"" opportunities for girls and women in sports, Title IX would be your focus.  NOTE, the same pols so obsessed with trans women in sports are the same ones who'd eliminate Title IX in a heartbeat. 

[https://www.womenssportsfoundation.org/wp-content/uploads/2022/04/FINAL6\_WSF-Title-IX-Infographic-2022.pdf](https://www.womenssportsfoundation.org/wp-content/uploads/2022/04/FINAL6_WSF-Title-IX-Infographic-2022.pdf)",58,2025-04-04 14:56:36,sanverstv
news,1jyk9mc,mmz2skz,"hearing the story on the news yesterday was wild because each sentence just got weirder than the last 😭

1. killed his parents

2. plots against trump

3. wrote a manifesto discussing plans to take over america

4. loved hitler and wants a new order of neo nazism",11778,2025-04-13 23:00:15,SarahJFroxy
news,1jyk9mc,mmz71bh,They conveniently leave the other half of the headline out. That he wanted to kill Trump to start a race war.,3750,2025-04-13 23:25:55,BrewKazma
news,1jyk9mc,mmz1b9l,">The sheriff's department issued a search warrant and say they found material on the teen's phone related to ""The Order of Nine Angles,"" which is ""a network of individuals holding new-Nazi racially motivated extremist views,"" according to investigators.

Why can't we say ""gang""? If 'a network of individuals' isn't gang or a mob then what is it? Call them an anti-american Nazi gang.",1862,2025-04-13 22:51:32,AudibleNod
news,1jyk9mc,mmz43lx,"It’s crazy how many of these mass shooters fall into white nationalism rabbit holes. 

I watched Frontline’s documentary on Terrorgram, and it’s really scary how effective it is playing out in real time.",822,2025-04-13 23:08:05,irreleventnothing
news,1jyk9mc,mmz4u0r,These headlines keep leaving of the white supremacist part.,694,2025-04-13 23:12:30,WarLawck
news,1jyk9mc,mn0305f,"> And he paid for, at least in part, a drone and explosives to be used as a weapon of mass destruction to commit an attack.

I feel like it's just a matter of time until we start seeing drones being used in terror attacks or assassination plots. We've all seen how effectively they are being used now in combat.",36,2025-04-14 02:53:33,MerryGoWrong
news,1jyk9mc,mmz9vms,"""Wisconsin NEO-NAZI & WHITE SUPREMACIST killed parents, aspired to assassination and instigate a race war.""

- Fixed the title for you",426,2025-04-13 23:43:33,Mayo_Kupo
news,1jyk9mc,mmz3rjb,Interesting that all those who have plotted to kill him so far have been fellow right-wingers.,854,2025-04-13 23:06:03,BubbhaJebus
news,1jyk9mc,mmzp0xi,How many right wingers have tried or plotted to kill Trump? It really does seem like a lot.,21,2025-04-14 01:20:01,electricidiot
news,1jyk9mc,mn1bqq7,"You know, when I read this title on my homepage, I initially expected it to be an *actual* ""Far-left extremist"" that decided Trump needed to go for being a fascist, and their parents were in the way. I did *not* expect it to be part of an insane murder-cult that seem to take being the most murderous fascist possible as their role in life...",19,2025-04-14 09:55:14,Fantasy_masterMC
news,1jz8e2c,mn4gjpk,">A letter sent to Harvard on April 11 outlined a series of conditions Harvard needed to meet to maintain a ""financial relationship"" with the federal government. The demands included leadership reforms, an immediate halt to diversity, equity and inclusion policies, an audit of ""viewpoint diversity"" among students and faculty, and ""meaningful discipline"" for students who violated school policies when a pro-Palestinian tent encampment went up on Harvard Yard. 

For those who wondered what the conditions were.",4897,2025-04-14 20:38:21,Caridor
news,1jz8e2c,mn4olv6,I was really concerned after Columbia that they would all fold. I am happy to see at least some arent for now,1070,2025-04-14 21:20:08,Contemplating_Prison
news,1jz8e2c,mn4falg,It’s about time. I hope more universities soon follow!,1510,2025-04-14 20:31:58,Special_Transition13
news,1jz8e2c,mn4g1br,This is what “fuck you” money looks like. ,670,2025-04-14 20:35:45,jasandliz
news,1jz8e2c,mn4mr3t,"Harvard knows game theory.  If more universities follow suit, there are going to be a whole lot of pissed off parents and employers.  And they won't be pissed off at the universities.",450,2025-04-14 21:10:13,Alwayssunnyinarizona
news,1jz8e2c,mn4nc3k,"Read the letter from the government to Harvard. Insane that the federal government tried to dictate to a private university things like the following: 

+ Harvard must ban specific student clubs and discipline their members

+ Harvard must enforce ""viewpoint diversity"" (that is, make sure that every department hires more Republican faculty and admits more Republican students) 

+ Harvard must ban masks",405,2025-04-14 21:13:20,macnfleas
news,1jz8e2c,mn55z58,This should sound the alarm in any democracy. They are threatening defunding of one of the most prestigious universities if they don't fall in line with the narrative of the administration.,134,2025-04-14 22:58:23,krLMM
news,1jz8e2c,mn4op8k,It's almost like Harvard has a massive endowment and a shitload of Harvard-trained lawyers they can call on.,117,2025-04-14 21:20:38,Solid_Owl
news,1jz8e2c,mn4vdye,Republicans have gone off the deep end. I’ve never been a Republican but past conservative presidents just never would have done any of this shit.,61,2025-04-14 21:57:07,Old_Advertising5430
news,1jz8e2c,mn51rk4,Comply with a bully they'll bully you some more. ,22,2025-04-14 22:33:41,D-inventa
news,1k5gv9k,mohu5kb,"I'm not joking, but I'd completely forgotten about Sarah Palin until I read this headline.",6291,2025-04-22 20:42:04,PikesPique
news,1k5gv9k,moi18mo,Tina Fey made Sarah Palin more famous than Sarah Palin did.,1199,2025-04-22 21:17:38,IvoShandor
news,1k5gv9k,mohuh3g,"""Sarah Palin loses"", a tune now so common it's subtly and ever-so-slowly replacing that quintessential elevator music. Keep it up queen!",475,2025-04-22 20:43:37,Hstrike
news,1k5gv9k,mohtwgd,Dam they're really Nailin Palin,780,2025-04-22 20:40:50,spamshannon
news,1k5gv9k,mohwih2,Can she see this verdict from her front porch?,371,2025-04-22 20:53:39,cdbutts
news,1k5gv9k,mohw41k,I'm surprised she didn't quit half way through the case,255,2025-04-22 20:51:40,MasterOfManyWorlds
news,1k5gv9k,mohy82f,Not upset about this. She is one of the main reasons we are in the mess we are in now. Because she not only was a poor loser but a bad politician who couldn’t take a black man becoming president.,428,2025-04-22 21:02:06,BoosterRead78
news,1k5gv9k,mohvcir,Good. Now she can cry more.,103,2025-04-22 20:47:53,MaximumJim_
news,1k5gv9k,mohvfrb,"First The Masked Singer, and now this. Can't get a break.",43,2025-04-22 20:48:19,johnh1019
news,1k5gv9k,moiisru,"If you've never seen it, do yourself a favor and watch the movie Game Change about her campaign with John McCain. It's a decent movie with some big names but it has more of a TV movie feel IMHO. People on the campaign (and characters in the movie) like Nicole Wallace have said it is accurate. It's amazing how bad of a choice she was for his running mate. She did some wacky shit and really tanked his campaign.",76,2025-04-22 22:52:38,che-che-chester
news,1k1numu,mnnksdu,"Yeah. Yesterday I was posting about them going after US citizens and people were all ""well acshually""... but that was yesterday and today is today.

No American of any origin, race, or gender should consider themselves safe.",6418,2025-04-17 21:14:51,supercyberlurker
news,1k1numu,mnnqwpg,Did we all forget about the Japanese-American concentration camps in the United States?   It happened before.  It can happen again.,1572,2025-04-17 21:46:14,Nomo-Names
news,1k1numu,mnnlpeq,"First they deport the Illegals.  

Then the undesirables.

Then the Protestors.

Then the dissenters.

Then they will come for you.",2042,2025-04-17 21:19:30,TheStripClubHero
news,1k1numu,mnnzeok,"> Based on her inspection of his birth certificate and Social Security card, Riggans said she found no probable cause for the charge. However, the state prosecutor insisted the court lacked jurisdiction over Lopez-Gomez’s release because U.S. Immigration and Customs Enforcement had formally asked the jail to hold him.

He is an American born in Georgia, picked up on spurious charges using a bullshit law, violating his constitutional rights, and ICE simply asked and now they can hold him indefinitely.

That's a pretty clear violation of Article 4 (Privileges and Immunities). This is bullshit.",639,2025-04-17 22:32:53,Qubeye
news,1k1numu,mnnlwkf,"The officials who arrested him deserve no “benefit of the doubt” here. He needs to be released immediately, with an apology and an opportunity to pursue a settlement. ICE needs to be defunded. ",847,2025-04-17 21:20:30,whenitsTimeyoullknow
news,1k1numu,mnno3hm,"On top of this, [Sebastian Gorka, aka the man in charge of creating and executing Trump's domestic terrorism policy, said today that anyone advocating for Abrego Garcia can be charged with aiding and abetting terrorism](https://www.independent.co.uk/news/world/americas/us-politics/sebastian-gorka-kilmar-abrego-garcia-activists-b2735153.html).

Oh, and [there's a good chance Martial Law will be declared on Sunday or Monday](https://www.citizen-times.com/story/news/local/2025/04/16/what-is-the-insurrection-act-of-1807-will-trump-declare-martial-law/83121238007/).

The First Amendment is dead, and speaking out against the regime will get you arrested and disappeared, natural born citizen or no. The United States is now officially a Fascist Dictatorship.",639,2025-04-17 21:31:45,MalcolmLinair
news,1k1numu,mno1bz7,Hey look it’s the thing everyone said he wouldn’t do. Wonder how the Latinos for Trump are feeling right now.,189,2025-04-17 22:44:01,okeleydokelyneighbor
news,1k1numu,mnnoz4m,"People keep using the term ""deported"". I don't mean to sound pedantic but it doesn't really do justice to what's happening. 

A lot of these ""deportations"" are more akin to human trafficking.",290,2025-04-17 21:36:23,AbusivePokemnTrainer
news,1k1numu,mnnu5mq,This is profiling. He was born in the United States. He is only being detained because he doesn't speak English.,152,2025-04-17 22:03:29,Landwhale6969
news,1k1numu,mnnkm5a,"He's just going to deport criminals. Why are you protecting criminals?

Well, actually, anyone who entered illegally is technically a criminal so yes all illegal aliens should be deported. 

That guy was following the legal process and had an open asylum case plus a non-deportation order but this other judge said he's MS-13 so he should be deported. 

OK, sure that person had a Green Card and they were here legally but they said mean things about our ally so they should be deported. 

Interested to see how the cult will spin this one. How are you gonna move the goalpost this time MAGA?",671,2025-04-17 21:13:56,sabrenation81
news,1jt7gb5,mls30p0,The fuck's he gonna do? Find a heroin dealer?,5752,2025-04-06 23:28:46,terrasig314
news,1jt7gb5,mls4pv9,He let 83 die of measles in Samoa. He doesn't care.,2892,2025-04-06 23:39:03,PassiveRoadRage
news,1jt7gb5,mls5myg,"Imagine the parents who have lost their child, when they hear from ol' Ken that perhaps vaccines might be the way to go after all...


EDIT: [Welp! my comment was premature! he actually straight up said it!](https://www.statnews.com/2025/04/06/rfk-jr-measles-statement-west-texas-outbreak/)",871,2025-04-06 23:44:39,PM_ME_YOUR_MESMER
news,1jt7gb5,mls5a37,Killer showing up to the scene of his crime is a real psychopath move,151,2025-04-06 23:42:29,wvualum07
news,1jt7gb5,mls36tr,[removed],568,2025-04-06 23:29:47,N/A
news,1jt7gb5,mls5gpm,Second worst trip a Kennedy made to Texas,270,2025-04-06 23:43:35,PrimevilKneivel
news,1jt7gb5,mls3tt3,"Relax folks, it's just the brainworm doing the lords work. RFK is just a vessel.",284,2025-04-06 23:33:39,faxdontlie
news,1jt7gb5,mls2vs4,When will RFK be put  in jail for his conspiracy theories and lies ?,620,2025-04-06 23:27:56,ComplexWrangler1346
news,1jt7gb5,mls416a,Is it so he can eat the remains?,224,2025-04-06 23:34:54,EngFL92
news,1jt7gb5,mls6xhu,I bet Kennedy has been vaccinated.,73,2025-04-06 23:52:38,FrostyAcanthocephala
news,1jkbt2y,mjtxmpx,"So we already knew every single turd in the committee hearings yesterday straight-up lied, prompting The Atlantic to post the rest of the transcripts.

Please, Senate Intelligence Committee, lay it on them THICK today.",5240,2025-03-26 13:38:41,Procure
news,1jkbt2y,mjtyfep,The Trump admin trying to downplay this is the most pathetic thing they've done in months. 'only the best people'. All Trump supporters are rubes.,2426,2025-03-26 13:43:10,dope_sheet
news,1jkbt2y,mjtzw8z,"Looks like there was one responsible adult in this mess.

>  “We did redact one piece of information because we felt, on our own, that we felt it was best to do. And the CIA asked us, but, you know, at a certain point, the administration is saying that there’s nothing classified or secret or sensitive in these so at a certain point, I just felt, you know, let our readers decide for themselves,” 

-- Jeffrey Goldberg

> “Weather is FAVORABLE. Just CONFIRMED w/CENTCOM we are a GO for mission launch,” Hegseth wrote. 

> This entire story was another hoax written by a Trump-hater who is well-known for his sensationalist spin,” White House press secretary Karoline Leavitt said 

> “You’re talking about a deceitful and highly discredited so-called journalist who’s made a profession of peddling hoaxes time and time again,” Hegseth said. 

> Britt  Hume was quick to point out the glaring flaw in Hegseth’s excuse: It wasn’t a hoax, as the National Security Council confirmed that the messages accidentally sent to Goldberg were legit:",1220,2025-03-26 13:51:18,PepperMill_NA
news,1jkbt2y,mjtxi4r,Not a day goes by that this clown fiesta of an administration fails to blow my mind.,915,2025-03-26 13:37:59,Reiign_
news,1jkbt2y,mju3ihi,"Goldberg is being incredibly patriotic here, he is taking on a great personal risk against a regime that controls the most powerful government in the world. This regime is made up of truly incompetent bad faith actors, we should all remember that moving forward, whatever happens- these people running our country are incredibly dumb. They can be defeated.",1098,2025-03-26 14:10:21,Drop_Disculpa
news,1jkbt2y,mju3etg,"Funny how the GOP used to have fake outrage fits out of things 1,000 times smaller than this.",234,2025-03-26 14:09:48,Sweatytubesock
news,1jkbt2y,mjtzhl2,I don't even get what the point of him sharing all these details in real time with that group chat to begin with? Just send a recap when it's over. It's like he was trying to show off or some shit,368,2025-03-26 13:49:05,idkwhatimbrewin
news,1jkbt2y,mju2rmj,"*""the administration is saying that there’s nothing classified or secret or sensitive in these so at a certain point, I just felt, you know, let our readers decide for themselves""*

Brilliant. Absolutely calling their bluff.",313,2025-03-26 14:06:27,Aranthos-Faroth
news,1jkbt2y,mjty3ec,"I do find it so funny that half of these clowns will wax for hours about how much money we burned in Ukraine or whatever, but these strike packages are big emoji worthy after burning whatever the cost in munitions, fuel and logistics were.",238,2025-03-26 13:41:17,DreamingMerc
news,1jkbt2y,mjtx0mg,Already lots of bots on twitter trying to claim this is all fine. Not sure what else I expected.,119,2025-03-26 13:35:10,Nyeep
news,1jzyhg3,mn9uvyl,"> ""I literally drove my car to Canada for the weekend, and on the way back, I was treated like a criminal,"" said Atallah, who has been a U.S. citizen for 10 years.

> ""I really thought things would change after this administration, when we have Mr. Trump in office, things would change to the better,"" Atallah said.

I never thought the leopards would eat my face.",8287,2025-04-15 18:10:55,Peach__Pixie
news,1jzyhg3,mn9t6bs,"Trump supporter is impacted by Trump's vileness.

[https://youtu.be/8QGy9D\_c1pY?feature=shared&t=22](https://youtu.be/8QGy9D_c1pY?feature=shared&t=22)



>Atallah is planning to leave for Lebanon in a few days, and he is not sure what will happen when he tries to return.



ROFL.  If he got detained driving back from Canada, there is no way the Trump administration is letting him back in the country from Lebanon.",2384,2025-04-15 18:02:21,YesterShill
news,1jzyhg3,mn9sla8,"""I really thought things would change after this administration, when we have Mr. Trump in office, things would change to the better,"" Atallah said. ""Things actually changed to the worse.""

  
Whatta maroon.",6411,2025-04-15 17:59:27,zeydey
news,1jzyhg3,mn9utu6,"Not only is he a moron for supporting Trump, he's also a moron for letting his attorney-client privileged communications be searched through by customs/border agents. I hope anyone who retained this idiot fires him pronto.",1206,2025-04-15 18:10:37,InspectorNoName
news,1jzyhg3,mn9vsxs,"Why do trump voters all think they're so fucking special? It really ought to be studied how they all have this main character syndrome. It won't happen to *me*, I'm awesome! Trump loves *me*!",757,2025-04-15 18:15:34,cydril
news,1jzyhg3,mn9vaki,"It's so hard to have empathy for people who voted for this.

>I thought things would be better with Mr Trump but they are worse.

Fucking dummy would probably vote for him again.",469,2025-04-15 18:12:59,gentleman_bronco
news,1jzyhg3,mnamig7,"Remember when people said ""Well, that's a slippery slope argument, we'll never see authoritarianism in the US.""

Whelp, they were wrong.  Here we are.",45,2025-04-15 20:29:09,epidemica
news,1jzyhg3,mn9ta0w,"Went through all that, then goes off to lebanon, not the brightest bulb in the pack",209,2025-04-15 18:02:51,RickySan65
news,1jzyhg3,mn9x3kc,">""I really thought things would change after this administration, when we have Mr. Trump in office, things would change to the better,"" Atallah said. ""Things actually changed to the worse.""

>NBC10 Boston has reached out to the Department of Homeland Security and Customs and Border Protection, but has not heard back.

>Atallah is planning to leave for Lebanon in a few days, and he is not sure what will happen when he tries to return.

Man who voted for the face eating leopards is surprised that the leopard started eating his face, too. And then he's about to put himself back into this situation by leaving the country again.

  
Fucking idiot. He got what he voted for.",191,2025-04-15 18:22:04,YomiKuzuki
news,1jzyhg3,mn9x277,"Man as a lebanese myself i can’t help but laugh at this idiot, you deserve it",93,2025-04-15 18:21:53,Apart_Emergency_191
news,1jko0ua,mjxsuxm,Didn't he say tariffs aren't a tax?,6908,2025-03-27 01:18:32,waterloograd
news,1jko0ua,mjxreq2,tax revenues from whom exactly?,5161,2025-03-27 01:09:57,Conflixxion
news,1jko0ua,mjxtbw9,"Last year, my parents bought a new car, installed solar panels, upgraded their phones and laptops, and bought a new TV, all because they thought Trump might win and implement tariffs and these things would become more expensive. 

They also voted for Trump.",16579,2025-03-27 01:21:17,poopyheadthrowaway
news,1jko0ua,mjxta03,Boy that’ll put a nice dent in the **$500 billion** in projected tax reduction next year all because he doesn’t want to fund the IRS adequately.,2949,2025-03-27 01:20:59,Amonamission
news,1jko0ua,mjxtgd9,Another scandal to cover up with more bad governance. This regime is really a human fucking centipede of government,395,2025-03-27 01:22:01,Greyboxer
