subreddit,post_id,comment_id,comment_content,comment_score,comment_created_at,comment_author
gaming,1jjrcgi,mjpekf4,Somewhere someone with a 16k resolution eye texture mod for Skyrim is cackling away…,3891,2025-03-25 19:08:53,jyotshak
gaming,1jjrcgi,mjpkm93,"Anyone remember Detroit become human menu screen?
That was peak",2091,2025-03-25 19:38:56,Comfortable-Wrap1867
gaming,1jjrcgi,mjpmb4k,Is the bottom left one real life? I can’t tell,1617,2025-03-25 19:47:12,VenomizedThanos2000
gaming,1jjrcgi,mjq53at,"Bau

*And I cannot stress this enough*

#BAU",939,2025-03-25 21:17:53,MouseRangers
gaming,1jjrcgi,mjpenod,bau bau?,2046,2025-03-25 19:09:19,gotothebeachNOW
gaming,1jjrcgi,mjpjwlk,Golden eye 007,648,2025-03-25 19:35:22,InfiltrationRabbit
gaming,1jjrcgi,mjpjg8o,"*Bau baus in the distance*

**You have alerted the horde**",1480,2025-03-25 19:33:06,Gray_Tower
gaming,1jjrcgi,mjpf3g9,And what about our boy Solid Snake in MGS1??,685,2025-03-25 19:11:28,GGAllinPartridge
gaming,1jjrcgi,mjpi9w6,Mococo's eye is so hyperrealistic it feels like it's staring into my soul,987,2025-03-25 19:27:13,johnsolomon
gaming,1jjrcgi,mjpl1ii,"We have these types of posts everywhere all the time, but when someone shares a video or screen shot with a title like ""best game I've played this year"", it's always gonna be a shot of a beautiful scenery, no exception. Makes me sad every time.",806,2025-03-25 19:41:01,Essetham_Sun
gaming,1k23yaw,mnr0f21,The Toy Story game went hard af,1405,2025-04-18 12:42:53,OsirisAvoidTheLight
gaming,1k23yaw,mnr0w26,"He's the rootinest, tootinest, shootinest, hootinest cowboy around",372,2025-04-18 12:45:53,Vice4Life
gaming,1k23yaw,mnr20lz,The nostalgia is hitting hard right now,352,2025-04-18 12:52:58,theghost440
gaming,1k23yaw,mnr3pqk,Toy Story 3 was fun as fuck.,353,2025-04-18 13:03:25,boi1da1296
gaming,1k23yaw,mnr468t,"Holy shit, I'd totally play RDR modded to be all Toy Story characters.",249,2025-04-18 13:06:13,burndata
gaming,1k23yaw,mnr0sf9,Micah poisoned the water hole!,495,2025-04-18 12:45:15,moosebaloney
gaming,1k23yaw,mnr2twe,That's a good game,237,2025-04-18 12:58:00,CoolHandLuke4Twanky
gaming,1k23yaw,mnr1dnb,*“There’s a Micah in my boot!”*,232,2025-04-18 12:48:59,FlemPlays
gaming,1k23yaw,mnr2k9a,Just wait until the ride into ~~Mexico~~ Sid's backyard,214,2025-04-18 12:56:21,GovernmentSpies
gaming,1k23yaw,mnr0a0x,Ride Like The Wind Bullseye,427,2025-04-18 12:41:58,Exiledfromxanth
gaming,1jvzk0p,mmeap53,"This reminds me of when my mom came to visit me for my 40th birthday.  After putting my son to bed, I started playing Metroid Dread, and she asked if I was going to give up playing video games.  The irony here is that she was literally playing Candy Crush on her phone when she asked this....",2129,2025-04-10 14:49:13,JayZonday
gaming,1jvzk0p,mmeavgi,"Honestly this sounds like it might be one of two things.


1. She thought she could overlook it and the resentment has built up.


Or 


2. She is upset with you about something else and she is saying this to hurt you.


Either way, both super shitty reasons to do this if it doesnt interfere with other aspects of what sounds like a pretty sweet life you've built for yourself.",7863,2025-04-10 14:50:03,cotsy93
gaming,1jvzk0p,mme9sjw,"Sounds like you've \*been married a long time, no? Might be time to do a deeper check-in on your relationship as this sounds, to me, like something that goes way beyond video games.

edit: a word",11505,2025-04-10 14:44:48,erghjunk
gaming,1jvzk0p,mme9vwj,"Anything anyone does to relax could be called “pointless, trivial, lazy, childish, etc.” DO NOT give up doing what you enjoy. I’m the same age as you, and have also gamed my whole life. My wife loves trashy TV (housewives, and other Bravo reality crap). I could tear her down for how dumb I think that is, she could tear me down for my silly games; but we don’t because we live and understand each other.",44596,2025-04-10 14:45:16,balmierfish
gaming,1jvzk0p,mme9q3p,"I'll be honest brother, it's not a game issue. I have a house, kid, dog, wife, etc. too, and my wife is a gamer too. I think she might have said this either on the moment or because of something else on her mind. 

Good luck.",14738,2025-04-10 14:44:28,davejb_dev
gaming,1jvzk0p,mme9ofa,"Don't give up something that you enjoy to make someone else happy. I'm assuming it's not a financial burden or that it's taking time away from quality time with each other, right?

I'd imagine it might be something deeper than just the video games, but it's coming up through them. Talk to her about it, tell her it's a way that you relieve stress and enjoy yourself!",2991,2025-04-10 14:44:14,Warlockdnd
gaming,1jvzk0p,mme9rm8,Does your wife have any hobbies herself? How does she have such a hard time understanding that different people like different things?,1393,2025-04-10 14:44:41,BigJellyfish1906
gaming,1jvzk0p,mmea3sq,"Advice?   There is no advice for this situation.   She's unhappy about something, and she's picking other things to pin it on.  

Stop gaming if you want, but finding out why she's really unhappy, while it almost  certainly won't make you happy, is what you need to do.",701,2025-04-10 14:46:19,lunk
gaming,1jvzk0p,mmeayur,Video games is a scapegoat. Y'all need to talk about what's goin on. ,314,2025-04-10 14:50:30,lolheyaj
gaming,1jvzk0p,mme9qlv,You need marriage counseling ASAP.,1325,2025-04-10 14:44:32,BloodyGumba07
gaming,1jyxcrh,mn1ta46,Its going from Xbox layout to Switch layout that gets me every time. More often than not both use A for select and B for cancel but are swapped so muscle memory goes out the window. Playstation uses different symbols but functionally they are the same as xbox these days so its not that much of an issue because of muscle memory. Can trip up on X occasionally but its rarely an issue.,10286,2025-04-14 12:21:27,Vidya-Man
gaming,1jyxcrh,mn1ujsl,We need a 4th console with an X on the right to maintain balance in the universe.,2618,2025-04-14 12:30:04,somethingmoronic
gaming,1jyxcrh,mn1tzv8,"Telling my son to press A after months of Xbox not realizing he's playing on a PS5 at the moment. ""Mama there's no letters you silly goose""",1124,2025-04-14 12:26:19,icon_2040
gaming,1jyxcrh,mn25xpc,"Oh my god, yes. I hate this. I don't know exactly who I should blame. Nintendo indeed came out with the A and B buttons before the other 2, so I could blame Microsoft for switching those 2 at least.

But yes, I regularly play on Nintendo Switch and Steam (with the Xbox controller) and I have issues every day.",92,2025-04-14 13:41:01,The_Giant_Lizard
gaming,1jyxcrh,mn1tk38,"I think I played on so many different controllers I just translate these in my head. Unless it’s Nintendo, then my mind is fucked",668,2025-04-14 12:23:20,facelesswolf_
gaming,1jyxcrh,mn1srcx,"I find that looking at them confuses me, but when I hold the controller muscle memory kicks in, and I know where all the buttons are.",216,2025-04-14 12:17:50,ATOMate
gaming,1jyxcrh,mn1sl68,Playing with a PS controller on some games on steam will show ABXY prompts....that is killer.,565,2025-04-14 12:16:40,bloodbag
gaming,1jyxcrh,mn4o5wj,"To be fair, Nintendo has been using that layout since the SNES in 1990.

It came first.",75,2025-04-14 21:17:46,Lythieus
gaming,1jyxcrh,mn1vjfv,"The bigger mystery is why Sony swapped O and X function outside of Japan, starting all the way at the original PlayStation.

Seems like a total random thing to do in hindsight.",145,2025-04-14 12:36:45,FieldOfFox
gaming,1jyxcrh,mn1wq1c,"Every time I see a post like this I feel like I'm the only one who has no issue with this lol. I've had them memorized forever. And Nintendo was first, so one could argue the others are wrong.",248,2025-04-14 12:44:35,Revanmann
gaming,1k2xej0,mnxqnb6,"I once had someone come in for the Malenia fight named ""LetMeDootHer"" 

He came in with the big horn. Blew a bubble at her and immediately got ripped apart.

I think about him a lot",18955,2025-04-19 15:06:18,Peezer3
gaming,1k2xej0,mny89wa,My favorite offshoot character is “LetMeSoloMe” where he just spams seppuku to death as soon as he’s summoned,1390,2025-04-19 16:39:42,MangoOfTruth
gaming,1k2xej0,mnxs6aw,"We're lacking an evil version named ""LetMeSoloYOU"" that's dedicated on invading players.

Then we could have an epic moment where the good letmesolos battle the evil one.",2724,2025-04-19 15:14:30,Dark251995
gaming,1k2xej0,mnxjoph,"I can honestly say I’ve never beaten anything 10,000 times. Not even “one” thing.",1767,2025-04-19 14:28:23,KingBoga
gaming,1k2xej0,mnxkwfk,"YOU HELP ME BEAT FINAL BOSS ON MY FIRST PLAYTHROUGH!!! I never forget you my brother or sister!!!

Edit: Wow thanks for the likes, i must add that since that I beat the game like 10 times and started helping players beat bosses and giving items to newcomers... you guys are awsome!",4663,2025-04-19 14:35:04,Oconsuetudo
gaming,1k2xej0,mnxwmcl,"Got invaded by “letmesolome” recently. He approached, bowed, and then stabbed himself in the chest until he died",312,2025-04-19 15:38:07,ToughDragonfruit3118
gaming,1k2xej0,mnxpq61,"That’s at least 10 times a day since launch. That’s fucked. So you’re saying you never play any other game, like ever?",403,2025-04-19 15:01:21,BoozerBean
gaming,1k2xej0,mnym570,"You helped my gf a few weeks ago, securing her bragging rights in the house",55,2025-04-19 17:51:48,DogFaceDyl
gaming,1k2xej0,mnxk6gv,passing of the jar,208,2025-04-19 14:31:05,SquabTheIronChef
gaming,1k2xej0,mo06jxg,"The worst one to summon is Letyousoloher, they just sit back and watch while Malenia tears you a new one.",19,2025-04-19 23:07:02,Kiryukazuma4realtho
gaming,1jpucx4,ml234w8,[deleted],20303,2025-04-02 17:35:35,N/A
gaming,1jpucx4,ml2dszp,People on here thinking those in this sub are the majority are wishful thinking.,3962,2025-04-02 18:26:19,3Dartwork
gaming,1jpucx4,ml25iog,"We crossed that rubicon a loooooonnnnnnggggg time ago. If you want to game in the modern age, you are paying for it. Just wait for gta6 to be a hundo.",3372,2025-04-02 17:46:43,HighlanderM43
gaming,1jpucx4,ml22kcb,"It will stick, I'm surprised it was nintendo out of everyone. EA and Ubisoft must be very happy right now",711,2025-04-02 17:32:55,drbomb
gaming,1jpucx4,ml24rt3,"i bought Nintendo 64 games for 75 bucks on launch thirty years ago, 80 bucks today is significantly cheaper.

But it is still mindboggling to me that we still find it acceptable to pay a monthly subscription for online features.

I also find it mindboggling that the tech demo - which is an advertisement of features - and the manual are now paid as well.",2655,2025-04-02 17:43:15,elementfortyseven
gaming,1jpucx4,ml25jlv,I feel the same way about people paying for streaming services with ads.,360,2025-04-02 17:46:50,aperson_being
gaming,1jpucx4,mlinfxl,why not thooo,30,2025-04-05 09:52:30,Fit_Girlie_20
gaming,1jpucx4,ml27jja,"Nintendo 64 games sold for 60-70 in the 90s. Some like Turok were 80s. I will gladly increase my cost per game if they continue to avoid microtransaction hell. 

But the real issue here is wages have not kept pace with inflation. Do not yell at nintendo this time. Yes corporations are not your friend, but maybe ya'll should have fuckin voted for Bernie.",1000,2025-04-02 17:56:06,T10_Luckdraw
gaming,1jpucx4,ml3sc39,If you've ever tried to tell Pokemon fans that they deserve more than low quality garbage you'd know this is an absolutely lost cause. Nintendo fanboys will die for their favourite company.,200,2025-04-02 22:35:23,Alarming_Addition131
gaming,1jpucx4,ml8xbrv,"People on Reddit don’t want to hear this, but games are one of the few consumer goods that have gotten cheaper over time when you adjust for inflation.

People should reject monetization schemes they don’t like by not paying for them, but they should also consider that these are often implemented because of gamers’ outrage at price hikes that are fairly normal in other industries. For the industry to survive, players are going to have to accept price hikes or accept that games will continue to try to get them to spend after they buy the game. We as gamers can’t have it both ways, and for much of the industry to survive, gamers are going to have to accept price hikes. 

https://www.gamesindustry.biz/are-video-games-really-more-expensive

https://screenrant.com/gta-6-100-price-compared-first-game-inflation-explainer/

https://www.rockpapershotgun.com/baldurs-gate-3-publishing-director-says-almost-all-games-should-cost-more-at-a-base-level-because-they-cost-so-much-to-make",10,2025-04-03 18:55:28,Mr_Suplex
gaming,1k5h08o,moizpud,"*Put on fake mustache* Hello! It's me, John Elder Scrolls, please comment your social security number below and I'll be sure to also get all of you a lovely key",1,2025-04-23 00:28:00,SuperBeavers1
gaming,1k5h08o,mohvgf4,"Imagine being on that mod team shitting yourself thinking you just might get a cease & desist, but you get keys for the remaster instead LOL",21001,2025-04-22 20:48:24,tyezwyldadvntrz
gaming,1k5h08o,mohvtcg,Is Bethesda actually taking a W today? 🥹 is it 2006 again? 🥹,6860,2025-04-22 20:50:10,indabay707
gaming,1k5h08o,mohvhfc,Modders spend a decade remaking a classic out of pure love. Bethesda: gives them the game they helped keep alive. This is the kind of energy the industry needs more of,15963,2025-04-22 20:48:32,SassySasha_xo
gaming,1k5h08o,mohvjfg,Looking forward to playing both of them,1569,2025-04-22 20:48:48,Persies
gaming,1k5h08o,mohv1dc,Both an endorsement and a thank you IMO. A world can live were both exist,1689,2025-04-22 20:46:23,Zetra3
gaming,1k5h08o,moi0di3,Easiest marketing budget spend ever.,410,2025-04-22 21:13:07,pdpi
gaming,1k5h08o,mohuk35,Everyone liked that.,1826,2025-04-22 20:44:02,TRUCKERm
gaming,1k5h08o,mohvzyd,"Nintendo: Shuts down fan remakes in order to release their own remakes shortly after

Bethesda: Releases their own remaster while officially bestowing their blessing on fan remakes while also gifting them copies of the game.",1613,2025-04-22 20:51:05,Cloud_N0ne
gaming,1k5h08o,mohve30,That's very kind tbf,215,2025-04-22 20:48:06,CockroachNo7331
gaming,1jq7r3v,ml577c0,"thats funky kong, put some respect on his name",6043,2025-04-03 03:39:14,Any_Secretary_4925
gaming,1jq7r3v,ml552ud,That’s Funky Kong though,1159,2025-04-03 03:24:26,Golden-Owl
gaming,1jq7r3v,ml54gfh,"I’ve never doubted you for a second, Funky Kong",423,2025-04-03 03:20:13,UndercoverDuck999
gaming,1jq7r3v,ml538ym,Oh wise Funky Kong,437,2025-04-03 03:12:00,KickStreaming
gaming,1jq7r3v,ml6xc5n,The back of his shirt says r/Piracy you just can't see it from this angle.,20,2025-04-03 12:50:29,Hello_Good_Game
gaming,1jq7r3v,ml5bktr,“Nail that man to a cross!” - marketing,38,2025-04-03 04:11:24,Ephemeral_Ghost
gaming,1jq7r3v,ml52tkn,[deleted],73,2025-04-03 03:09:09,N/A
gaming,1jq7r3v,ml53qnv,Based Funky,73,2025-04-03 03:15:18,SomeRandomAccountBro
gaming,1jq7r3v,ml6m3md,Roms are free,16,2025-04-03 11:33:29,Wheelmafia
gaming,1jq7r3v,ml5r6ii,"I don't mind paying for video games at all. But I'm not paying $80 for digital games. I'm not paying $90 for joycons (still no hall effect joysticks btw, as to be expected). I'm not paying for a tutorial. I'm not paying a premium price for an LCD screen in 2025. 

This is a Nintendo thing, not a video games in general thing.",182,2025-04-03 06:28:20,unpopularman4
gaming,1jqiluf,ml75uev,I agree but why does this start at Dark Souls 2 lol,9896,2025-04-03 13:40:33,Aidan-Coyle
gaming,1jqiluf,ml7a2ek,2018 - Déraciné.,1115,2025-04-03 14:03:39,RKC1234
gaming,1jqiluf,ml770tn,"Crazy how the only bad game they ever put out was Bloodborne.

*puts phone on vibrate*

*shove it up my ass*",10732,2025-04-03 13:47:10,BobSagetMurderVictim
gaming,1jqiluf,ml7asp3,"Impressive how many IPs can be created that look and play very, veeeey similarly.
Better than having all the games under the same name, at least if one game flops they can just move on to a new IP.",1572,2025-04-03 14:07:31,truvis
gaming,1jqiluf,ml76717,why is DS3 written 3 times?,183,2025-04-03 13:42:31,horticulturistSquash
gaming,1jqiluf,ml75x2b,Sure lets pretend ds1 and DeS dont even exist..,773,2025-04-03 13:40:57,cpdk220
gaming,1jqiluf,ml77frz,Releasing the same game 12 years in a row. Damn /s,987,2025-04-03 13:49:27,Fritzschmied
gaming,1jqiluf,ml75bvm,"the same game over and over every year, call of duty: 😡

the same game over and over every year, soulslikes: 😍",2745,2025-04-03 13:37:40,KomradJurij-TheFool
gaming,1jqiluf,ml77gof,It helps all the games are basically the same. Sorry sorry I know that’s an unpopular opinion around these parts. I’ll dodge roll my way out of here.,532,2025-04-03 13:49:36,HonkedOffJohn
gaming,1jqiluf,ml7a6c7,"Well yeah, it’s not hard to repackage the same product you’ve been making for the last decade or so. 

Nintendo gets it.",237,2025-04-03 14:04:14,vradic
gaming,1jrdsd4,mldw18j,[removed],7473,2025-04-04 15:06:56,N/A
gaming,1jrdsd4,mldunw7,I'm straight up not having a good time right now.,10039,2025-04-04 15:00:08,MuptonBossman
gaming,1jrdsd4,mldy1o5,This might be a good way to teach some people what tariffs are 😂,8686,2025-04-04 15:17:01,XanIrelia-1
gaming,1jrdsd4,mle821j,Everyone crying about the $450 on Wednesday are gonna wish they could pay $450 😂,2110,2025-04-04 16:06:47,senna98
gaming,1jrdsd4,mldu7kz,"$549 incoming...

Kill me",2932,2025-04-04 14:57:53,ChiefLeef22
gaming,1jrdsd4,mldt9f3,Short-term pain for long-term pain 😌,7442,2025-04-04 14:53:14,ezidro3
gaming,1jrdsd4,mlduo86,We are working at least 40 hours a week and can’t even afford to play video games!,1645,2025-04-04 15:00:11,birdie_Sea
gaming,1jrdsd4,mldz38c,"Those who make Mario Party impossible make Luigi Party inevitable

\- JFK probably",462,2025-04-04 15:22:10,nc863id
gaming,1jrdsd4,mle0zyk,"Trump said he would do universal tariffs on the campaign trail, Kamala said Trump would do universal tariffs on the campaign trail. 

And voters voted for it. He's simply delivering on his promises.

Incredible that 77 million people voted for a man who told them straight to their faces he would do this.",662,2025-04-04 15:31:44,altathing
gaming,1jrdsd4,mldwqqx,"are ya winning, son? I was told there would be so much winning.",1066,2025-04-04 15:10:29,Slugggo
gaming,1jwkxlh,mmj5ucs,"""Ishnu-alah, traveler.""",760,2025-04-11 08:44:01,Cynthimon
gaming,1jwkxlh,mmj5u7t,😭 I miss this so much 😭,1348,2025-04-11 08:43:59,ixDispelxi
gaming,1jwkxlh,mmj4jua,Live to win!,225,2025-04-11 08:29:57,ArcadianGh0st
gaming,1jwkxlh,mmj4u1t,"Raiding Naxx, Ulduar, and ICC with my old guild on Bloodscalp back in the day was unmatched.",134,2025-04-11 08:33:04,mfdoorway
gaming,1jwkxlh,mmja9zi,Vanilla WoW was the last time I played games until 5am.,54,2025-04-11 09:31:30,AusGeno
gaming,1jwkxlh,mmjwcr7,"Once I'm retired, I'm gonna play MMORPGs all day long.",28,2025-04-11 12:31:48,PugTales_
gaming,1jwkxlh,mmk3shc,I miss the times when everything about wow wasnt datamined. And everyone knowing everything about games in general. Playing games doesnt feel like playing anymore. It feels like following instructions on a guide. And rotations. And bis and stat prio. Its either your a sweat or casual. And if you wanna play endgame you gotta be a sweat. Being a sweat in 2020s is its own job. With every step mapped out for you. Follow the guide monkey!,83,2025-04-11 13:17:24,slothson
gaming,1jwkxlh,mmja20x,It’s a perfect night tonight,62,2025-04-11 09:29:12,werran
gaming,1jwkxlh,mmj97nt,As far as I’m concerned 2025 is still in the 2000’s. Get me my 18 year old soda pls.,20,2025-04-11 09:20:14,Crunchbite10
gaming,1jwkxlh,mmj5fb3,Replace the mtn dew with Bawls and you got a good night ahead of you.,104,2025-04-11 08:39:31,TheHighSeasPirate
gaming,1jxov0k,mms76aw,"Bungie has its issues, sure, but Gunplay has never been one of them.",8722,2025-04-12 19:39:00,Lee_III
gaming,1jxov0k,mms46g0,"Extraction Shooters are either under the radar, niche, or Tarkov. I welcome this game to hopefully breed some innovation with competition like what Marvel Rivals did to Overwatch 2.",5705,2025-04-12 19:22:19,Jagraen
gaming,1jxov0k,mms4nel,wat. do we only play games not made by corporations now?,2690,2025-04-12 19:24:57,GnarChronicles
gaming,1jxov0k,mms4s2z,"One is an overused hero shooter, the other is an extraction shooter, of which console players at least, only have two other options. Meanwhile there's more than a dozen Overwatch/Concord clones.",744,2025-04-12 19:25:41,JediDruid93
gaming,1jxov0k,mms2mv0,"Not a fan of the overwatch character class style….would much rather having customizable characters you can swap out classes with but….ill give it a fair shake.

Idk i think the art style looks incredible….just cautiously optimistic it’ll be good",1633,2025-04-12 19:13:41,Badwolfblue32
gaming,1jxov0k,mms4ty7,"Okay, that's a trip in the way back machine.   
They got some big shoes to fill if they want to live up to what Marathon was back before Halo.",123,2025-04-12 19:25:58,timojenbin
gaming,1jxov0k,mms5bzx,This subreddit has the most out of touch gamers.,728,2025-04-12 19:28:46,Civil_Comparison2689
gaming,1jxov0k,mms3ske,i dont like what bungie is today but lets see how this turn before shitting on it,301,2025-04-12 19:20:09,Oleleplop
gaming,1jxov0k,mms3cwu,[deleted],562,2025-04-12 19:17:46,N/A
gaming,1jxov0k,mmsk5v8,What a clown post,174,2025-04-12 20:51:00,Imnotsureanymore8
gaming,1jr5y9n,mlci65m,Maim and murder people? That's actually ok. Nakedness? Straight to jail.,3252,2025-04-04 09:29:42,nottaroboto54
gaming,1jr5y9n,mlc835o,You should've also put the uncensored photo for academic purposes,12746,2025-04-04 07:40:02,VampirMafya
gaming,1jr5y9n,mlc71il,"Seriously? Does she still say the line where she goes ""Are you just here to look at my breasts?""",7236,2025-04-04 07:28:39,Automatic-Dark900
gaming,1jr5y9n,mlc5ro7,Why after 10 years?,6814,2025-04-04 07:15:09,Goldbong
gaming,1jr5y9n,mlc8cdn,And what it's worse is that this 10 years later update broke a lot of mods...,1517,2025-04-04 07:42:50,xdoble7x
gaming,1jr5y9n,mlc7lob,Did they do this to Far Cry 3 Citra too ? Or just FC4 ?,1985,2025-04-04 07:34:42,frinkousCZ
gaming,1jr5y9n,mlcamds,Why not just make a nudity option that defaults to 'No' in the game options?,1408,2025-04-04 08:07:24,Joker-Dan
gaming,1jr5y9n,mldus9e,"For anyone coming here, it wasn't censored on purpose. It was a regional mistake and it's now fixed.

https://x.com/FarCrygame/status/1908157630578917789",346,2025-04-04 15:00:44,DoctorMoguri
gaming,1jr5y9n,mlc76nu,"Ooh no a nipple in my game where i bloodily murder hundreds of people, think of the children!",2701,2025-04-04 07:30:13,alfadasfire
gaming,1jr5y9n,mlc5jfa,What did they censor?,1032,2025-04-04 07:12:43,InstantBruhMoment
gaming,1jtlku6,mlv532i,"Kingdom Come Deliverance 1+2, especially hardcore mode. For the sequel it is coming this month. You literally have to navigate by the stars or by the sun and your map doesn't show your position. You will get lost and find crazy new places on accident. The best way to play it imho.",5821,2025-04-07 14:04:46,JimmyLipps
gaming,1jtlku6,mlv1rs5,Atomfall is more vibes than arrows,3826,2025-04-07 13:46:13,GNRZMC
gaming,1jtlku6,mlv257h,"I've been enjoying Hollow Knight for this reason.

I tried for years to get into it and failed. This time I told myself ""You don't care about completion, you just want to get lost.""

And now I'm loving it.",3691,2025-04-07 13:48:22,PhoenixTineldyer
gaming,1jtlku6,mlv2b9p,Try out Subnautica and The Long Dark. They're both exploration focused games which don't have a map. The Long Dark is especially brutal when it comes to navigation. ,634,2025-04-07 13:49:20,Stolen_Sky
gaming,1jtlku6,mlwsx4j,"Who remembers Castlevania 2 and having to go kneel at a cliff with a certain item to continue progressing? And having really very little to nothing to go on to figure it out?

Thank you Nintendo Power.",78,2025-04-07 19:10:07,flechette
gaming,1jtlku6,mlv242j,"I don't need quest markers, but I always hated it when games were purposefully vague on where to go in general just to pad out playing time.",3274,2025-04-07 13:48:12,Opunaesala
gaming,1jtlku6,mlv569c,"have you tried Outer Wilds? there's a map, but nobody tells you where to go to advance the story - you gotta figure it out as the progression itself is a bit of a mystery to solve.

you won't be spatially lost (pun intended), but you'll have to pay attention to decide what to do next",777,2025-04-07 14:05:15,Lasdary
gaming,1jtlku6,mlv4iio,Childhood me agrees with you. Adult me with responsibilities also agrees but begrudgingly accepts that there's no time for that.,1918,2025-04-07 14:01:35,DaleGribbleShackle
gaming,1jtlku6,mlv30xw,Tunic,718,2025-04-07 13:53:18,AuzaiphZerg
gaming,1jtlku6,mlv4bck,I like games that are in the middle. I like figuring it out but if I am truly lost then have a game mechanic that gives me a hint if I want it. ,120,2025-04-07 14:00:30,mbowk23
gaming,1jrsld3,mlh621x,Bro just wanted to flex,5203,2025-04-05 01:53:49,RetroRecon1985
gaming,1jrsld3,mlh6bob,Someone with this collection doesn't care what they price at. We all know you will still pre-order,2298,2025-04-05 01:55:35,apkJeremyK
gaming,1jrsld3,mlha4ml,Me glancing into my emulation folder,462,2025-04-05 02:21:17,RaptorX7
gaming,1jrsld3,mlikhin,"80 bucks!!! 

Well I’d never.

(Heads downstairs to the 25k video game collection)",33,2025-04-05 09:19:07,dakotanorth8
gaming,1jrsld3,mlh7e0z,"Yeah, because completing that collection would be so much cheaper 😂",172,2025-04-05 02:02:40,TurbulenceMargarita
gaming,1jrsld3,mlh74nn,"If you have that many games, what’s another $450?",177,2025-04-05 02:00:55,ElGuano
gaming,1jrsld3,mlh8b7w,Well start with Deadly Towers on the NES,18,2025-04-05 02:08:57,DBWlofley
