subreddit,post_id,comment_id,comment_content,comment_score,comment_created_at,comment_author
VietNam,1k0hfyt,mnjgv6o,"After exit of the aiport building, on the right side there is bus 152 ( last at 7:30pm) which brings you up to the main station in D1 , near Bui Vien. It cost 5k dong for you and 5k for luggage. A orange shorter bus from Futa company runs too (they wait longer to get a full bus after 7:30pm) with 15k for you and 15k for big luggage.

At a later time get taxi or grab bike. For the bike you have to go more outside.",1,2025-04-17 05:55:46,Hanswurst22brot
VietNam,1k0hfyt,mnq9iqp,"It is already quite hot there in Saigon, and Vietnam summers are about to kick in. Please make your plans accordingly. Going to the north after a few days there should be ideal.",1,2025-04-18 08:52:36,BreakfastContent460
VietNam,1k0hfyt,moe7t11,"Saigon is preparing to celebrate the 50th Anniversary of the End of the Vietnam War at the end of this month. There are many celebration activities from now until April 30th, such as fireworks, a drone show, a cannon salute, and a military parade. This is the biggest event I’ve ever seen. Saigon will be very crowded until the end of the month, so you might want to visit next month instead.",1,2025-04-22 07:26:33,Icy-Run-6487
VietNam,1k0hfyt,mnek286,Do not go,-3,2025-04-16 13:15:16,SimonLLC
VietNam,1jzxs27,mn9nkrc,"more common for girls deffo, but technically it is gender neutral",11,2025-04-15 17:35:05,NoAppearance9091
VietNam,1jzxs27,mn9ooss,Cat's owner name,10,2025-04-15 17:40:29,akaiiiiiiii
VietNam,1jzxs27,mncfwnj,"Maybe consider Sơn? Really boy-name, sound similar, good meaning",2,2025-04-16 02:39:03,WithMyD
VietNam,1jzxs27,mnggyse,"Girl, but that name might mean different things than you think. Be choosy.",2,2025-04-16 19:00:27,Initial_End_7996
VietNam,1jzxs27,mnbk8mh,One of Vietnam’s most famous author is Nguyễn Sen. Don’t worry about it not being a man’s name.,1,2025-04-15 23:30:26,thenoobtanker
VietNam,1jzxs27,mncfmee,"Mostly a girl name. It's the name of a flower, so it's feminine",3,2025-04-16 02:37:18,WithMyD
VietNam,1jzxs27,mncubow,"In a slang term, ""Sen"" is the affectionate name or title your furry friend would give you",2,2025-04-16 04:19:16,shapeshiftdragon
VietNam,1jzxs27,mn9ni9y,"Sen means lotua, and it's a girl's name",0,2025-04-15 17:34:45,fsoft_tech
VietNam,1jzxs27,mna57wg,"I have heard quite a few girls with that name, but never a boy with that name.  Sen = lotus",-3,2025-04-15 19:02:47,DNA1727
VietNam,1jzxs27,mn9o1ef,"Girl's name. It literally means ""Lotus"". But nowadays it has become less common. People often use the name ""Liên"" - Sino word for lotus. I know some people named ""Liên"" are guys, but ""Sen"" are always girls.",-4,2025-04-15 17:37:20,aweirdmugglename
VietNam,1jzegmz,mn5r1o9,"They call it nấm biển ""sea mushroom"" but it is actually cuttlefish skin, a very good drinking dish.",3,2025-04-15 01:01:32,TakkuNguyen
VietNam,1jzegmz,mnc2ld9,thats better than eating baby ducks,1,2025-04-16 01:17:53,SortNo1718
VietNam,1jyt8i0,mn21n4u,"Marble mountain, Monkey mountain, Hai Van pass, ride around the villages outside of the city, do Vietnam war tour",3,2025-04-14 13:15:24,VN_Boy2020
VietNam,1jyt8i0,mn0zhjr,"Bridge is for suckers yes. Just rent a scooter and tool around. Or visit the markets. It’s free. 
Get your teeth cleaned. They are pro here",2,2025-04-14 07:42:27,RLyonstudio
VietNam,1jyt8i0,mn70kn5,I thought Marble mountain was cool.  Early morning beach scene was interesting with tons of locals exercising before starting their day.,1,2025-04-15 06:46:09,Alohagrown
VietNam,1jyt8i0,mnbdngx,"There's a cemetery with the graves of French and Spanish soldiers/mercenaries from an expedition in the 1800s near the port

 https://maps.app.goo.gl/BTBGt8UBhhreB5kZ6

The Cham museum is also a must. It has the best collection in the world of what was a major civilization comparable to the Khmers.

It's not historic but Linh Ứng Pagoda is a place with an amazing view and tranquil vibe where you can see how locals do religion.

There's an eccentric little museum nearby, Bảo Tàng Đồng Đình 

https://maps.app.goo.gl/BnjtDxWfAhPQm3vt7

Most tourists go to the Han market but I really like Chợ Cồn https://maps.app.goo.gl/j8MMc7nimuFDB98K8

Amazing for food.

Random thing: Trấn Ké Xương is bicycle street.

Enjoy!",1,2025-04-15 22:53:23,xedapxedap
VietNam,1jyqsm9,mn0hnzk,"Lưu ý,

Bất kể bạn đang tham gia vào chủ đề thảo luận gì, hãy lịch sự và tôn trọng ý kiến của đối phương. Tranh luận không phải là tấn công cá nhân. Lăng mạ cá nhân, cố tình troll, lời nói mang tính thù ghét, đe dọa sử dụng bạo lực, cũng như vi phạm các quy tắc khác của sub đều có thể dẫn đến ban không báo trước.

Nếu bạn thấy bất kì comment nào vi phạm quy tắc của sub, vui lòng nhấn report.

***

A reminder.

In general, be courteous to others. Debate/discuss/argue the merits of ideas, don't attack people. Personal insults, shill or troll accusations, hate speech, any suggestion or support of harm, violence, or death, and other rule violations can result in a permanent ban.

If you see comments in violation of our rules, please report them.

***

*I am a bot, and this action was performed automatically. Please [contact the moderators of this subreddit](/message/compose/?to=/r/VietNam) if you have any questions or concerns.*",1,2025-04-14 04:47:57,AutoModerator
VietNam,1jyltlw,mn05dl5,"Find the recyclable collectors (""ve chai"") and give it to them",3,2025-04-14 03:10:39,Confused_AF_Help
VietNam,1jyltlw,mmzyr25,Might be better to ask the local FB group.,2,2025-04-14 02:24:10,Lucky_Relationship89
VietNam,1jyltlw,mn078ep,"GO! (formerly Big-C) has a battery dropbox. Second floor to the left of the bookstore.

To buy DJI stuff there's a small shop across from Chuồn Chuồn Kim's restaurant.",2,2025-04-14 03:24:18,HFSWagonnn
VietNam,1jyltlw,mn09uuh,Some malls have battery dropbox. For DJI go to cellphones thats the name of a chain store,2,2025-04-14 03:44:14,Eastern-Unit-6856
VietNam,1jy9fmf,mmwmw9z,"You have mentioned Dalat - I’m headed there in May for many of the reasons you outline: cooler weather, hiking, nature. I’ll spend 10 days there with a mind to extending, after a week in Nha Trang (beach so not what you are after), Da Nang (also a beach city so perhaps not what you want although it seems there is lovely countryside and nature around it too so perhaps don’t write it off as Da Nang and Hoi An are very close). I’m also staying in the Hoi An area for 10 days but away from the city, further out and closer to beaches. 

I was also looking at Buon Ma Thuot in the central highlands - the coffee growing area. It seems quite lush and green.",3,2025-04-13 15:09:28,banoffeetea
VietNam,1jxyi93,mmualxs,"A friend of mine owns xi phô coffee. Not exactly in BMT, but it's some of the best coffee I've tasted. 
He tries to encourage farmers to grow more naturally, so forest style.
DM me if you want more info! 
Also, where's your shop? I'll be in Nha Trang in a few weeks.",3,2025-04-13 03:31:25,Moochingaround
VietNam,1jxyi93,mmurv5d,"Try Aeroco coffee farm, near Ea Tam lake",1,2025-04-13 05:52:47,Positive_Lie6827
VietNam,1jxyi93,mmux2zm,"Can the small shop in NT support a small roasting machine? They are not expensive, they smell great, and you get to test drive lots of freshly roasted blends!",1,2025-04-13 06:43:32,Unfair-Fault2737
VietNam,1jxyi93,mmvp5fu,"Was born and raised in BMT but i havent known much about wholesalers heres since they provide quite small amount for businesses (their own local cafe). however, u could try Pops (pretty decent in types and also in town). https://maps.app.goo.gl/VAbkb9MEHaURMd8W9?g_st=com.google.maps.preview.copy Hope this help",1,2025-04-13 11:33:24,Kryssiego89
VietNam,1jxyi93,mmvwe3m,I know an old man in BMT. He grows and makes coffee. I can give you his information if you interested,1,2025-04-13 12:31:05,VN_Boy2020
VietNam,1jxyi93,mmw0i9y,You should consider roasting your own beans. It’ll open up the doors to more wholesalers and the coffee will be better as well.,1,2025-04-13 13:00:27,ttttoner
VietNam,1jxdhpf,mmr4lso,"I have joined someone's group on Zalo, which is a social group for expats, digital nomads and even locals in Saigon/Vietnam: https://zalo.me/g/vribak483

I'm planning an offline meetup event for that group soon, maybe can find some people who are interested in co-op multiplayer gaming.

You can add me on Discord if you don't use Zalo, username: bladespringsun - ID: 84771594655784960",2,2025-04-12 16:15:15,StinkyFishSauce
VietNam,1jxdhpf,mmphk4k,I play DLS. Love to connect.,1,2025-04-12 09:33:09,SatisfactionNo2666
VietNam,1jxdhpf,mmpni5m,Im interested,1,2025-04-12 10:35:03,VN_Boy2020
VietNam,1jxdhpf,mmqigmj,"I am also looking for online friends and since I live in Vietnam, preferably from this country) I wrote you a private message. And in general I will be glad to everyone.",1,2025-04-12 14:16:35,Yaramirra
VietNam,1jxdhpf,mmr3hu9,I don’t really game anymore but you can catch me on discord live streaming a tv show or something.,1,2025-04-12 16:09:23,Murder_1337
VietNam,1jxdhpf,mmsc72j,Is overwatch a game💀?,1,2025-04-12 20:06:48,Hatexar
VietNam,1jwqy6k,mmkfap8,They are wondering who called the white handyman,61,2025-04-11 14:18:42,JaqDraco
VietNam,1jwqy6k,mmkf9ka,Too hot.,116,2025-04-11 14:18:32,eodusa911
VietNam,1jwqy6k,mmkjpj6,"I see girls from time to time in overalls, but not really dudes",39,2025-04-11 14:40:49,mmiikkii7
VietNam,1jwqy6k,mmkjj8x,Have you seen the weather?,15,2025-04-11 14:39:57,Standard_Homework854
VietNam,1jwqy6k,mmkfi0q,"I mean, the only person I've seen wear them was a random teen girl walking around Hoan Kiem at night. That or the farmers who wear waders as they plant and harvest their rice. 

It may be a little odd but I doubt that's the only reason. Maybe you're just the main character...",36,2025-04-11 14:19:43,OzunuClan
VietNam,1jwqy6k,mmki9c2,Most just wonder how you pee with that? That's one of the reasons why overall fashion isn't very popular.,11,2025-04-11 14:33:32,cocaseven
VietNam,1jwqy6k,mmkkvf6,Its 40'C outside,9,2025-04-11 14:46:36,PhucTiaChop
VietNam,1jwqy6k,mmklje8,áo bà ba is not a thing in North America either,16,2025-04-11 14:49:53,Fun_Trip_Travel
VietNam,1jwqy6k,mmkqlyj,"It’s hot as fuck. Slippers, shorts and shirt.",6,2025-04-11 15:14:54,vietcn
VietNam,1jwqy6k,mml4lhl,Overalls haven’t been in men’s fashion for a long time so it looks odd. It’s mostly a girl fashion trend now,5,2025-04-11 16:23:27,emptybottle2405
VietNam,1jw6r7s,mmhnhvy,"There are few pronunciation differences, and few vocabulary differences. Most notably:

- gia, da: ""z"" like ""zoom"" in the north, ""y"" like ""year"" in the south
- ra: ""z"" like ""zoom"" in the north (inconsistently), ""wr"" like ""wrong"" in the south
- sa: ""s"" like ""sound"" in the north, ""sh"" like ""shy"" in the south

However as a general experience:
- everybody understands the north accent because this is the accent on TV
- you'll never understand a sentence that you've ""learnt at school"", just because the grammar have many variants so they'll never use the sentence that you've learnt. You'll probably get the glimpse of some words. 
- they'll never slow down for you to understand, they'll just speak louder 

So good luck with that ^^",3,2025-04-11 01:16:20,arllt89
VietNam,1jw6r7s,mmg09pf,"Yes, it’s like British Received Pronunciation, you will be fine.",3,2025-04-10 19:50:57,CurrentAd1450
VietNam,1jw6r7s,mmgyzut,[deleted],-3,2025-04-10 22:50:08,N/A
VietNam,1jvoipp,mmby7j6,"Very safe, judging by the loads of solo female travelers I bumped into during my six weeks in Vietnam. Anytime I had the opportunity to chat we would inevitably talk about what we thought of Vietnam and I was always curious to ask about how safe they felt. Answer: very.

The biggest threat to your safety is going to be other foreign tourists. At worst you might get scammed for a few dollars here and there, but nothing of concern on a personal safety level.",9,2025-04-10 03:35:11,richmond_driver
VietNam,1jvoipp,mmc1hvo,"Vietnamese here, born and raised in Hanoi.  
Except scammers and pick-pocketers, which are every where in the world, I can say our country is safe for female solo traveler.

You just need to keep in mind few things:  
\- Do not wear luxurious looking jewelries, even the fake ones;  
\- Mind your belongings and surrounding in the crowd;  
\- Trust you instinct, if you sense being scammed, just say no and walk away, or you can ask for help from the locals walking by;  
\- In case there's no visible price sign, ask the staff;  
\- Don’t jaywalk, pedestrian traffic rules are now more strictly applied, the fine is small but you don't want to be in trouble regardless how tiny it is;  
\- Don't let yourself drift too far into shady neighborhoods of the city late at night.",5,2025-04-10 03:59:31,Honest_Fortune6965
VietNam,1jvoipp,mmbxw30,"I can’t speak for being a female solo traveler, but my gf and I just spent two weeks all across Vietnam and met other solo female travelers. We always felt safe. As a matter of fact we felt safer than where we live in California. That being said, obviously I would say just be aware of your surroundings, don’t wear expensive stuff and get super sloppy drunk. You are going to have an amazing time. It’s my favorite country!

Edit: weeks not days",3,2025-04-10 03:32:53,Tigorl
VietNam,1jvoipp,mmbz3da,"Bodily it's the safest country in the world. Now even small assault incidence if captured on camera will be heavily punished. And there're camera everywhere including those from houses along the road and traffic cameras. In terms of money/possessions threre are still thieves, pocket pickers, scammers so make sure you protect your belongings carefully. Spiritally, you're free to do what you believe.",3,2025-04-10 03:41:33,TallRent8080
VietNam,1jvoipp,mmcfupx,"I travel regularly to Vietnam by myself. You will be perfectly fine. Just be sensible. 


One thing I find is the Vietnamese are very family oriented and don't understand why you are a woman traveling on your own. They can be very judgy and intrusive about it. The last few times I've been I just tell them my husband died a couple of years ago. They immediately back off and express sympathy. I've never been married 😄


Have a fantastic holiday!",3,2025-04-10 06:01:55,crazy_cat_lady_from
VietNam,1jvoipp,mmby6i4,"Vietnam is safe and very solo travel friendly . I’d recommend staying in old town/French quarters in Hanoi. Tons of great food, things to do. 

My personal recommendation would be to do Ha giang loop over Sapa. You can do a 4 day or 3 day organized bike tour where you ride behind an experienced rider. It limits the planning you need to do but more importantly it’s absolutely beautiful and a very fun, unique experience 

Have fun!",2,2025-04-10 03:34:59,peppaurcita
VietNam,1jvoipp,mmc07nm,"I'm in Sapa at the moment after spending a few days in Hanoi! In general it's pretty safe, just need to be wary about things like petty theft and being scammed. I have had a few experiences with men touching/grabbing me to get my attention to try flirt with me, which has been extremely unpleasant, but nothing worse than I've experienced in my own country (Australia). Just make sure you are aware of your surroundings, don't accept drinks from strangers, don't get sloppy drunk etc. 


I'd recommend staying in the Old Quarter in Hanoi, a good amount of tourists are around there including lots of female travellers, and there's heaps to do and see - make sure you get egg coffee and the pho, it's next level tasty. Sapa is absolutely beautiful, recommend doing a trek with some of the local women to their villages and learning about the culture! It's such a gorgeous country, you can't go wrong wherever you go.",2,2025-04-10 03:49:47,NikolajNotNikolaj
VietNam,1jvoipp,mmc1f9e,"Use the Grab App (similar to Uber) for rides and only book through the Grap App. Do not let people approach you to offer rides, look at your phone, or claim they are Grab even if they are wearing a Grab jacket. Download the App before you arrive so you can add your card for payment in advance. The Grab pickup area at the airport will be across the street where the taxis are parked outside arrivals. 

If you want to get some cash to have on hand, there’s also an atm in arrivals. 

If your phone is esim capable, you can preload your esim in advance and it’ll be ready to use upon landing. I recommend gigago- you can choose between Viettel or Vinaphone plans depending on your needs. https://gigago.com/esim/vietnam/",2,2025-04-10 03:58:57,darlingmirandom
VietNam,1jvoipp,mmc471i,"TikTok trends is wild mate. On a serious note, this country’s violent crime rate is far lower than the US, don’t worry (avoid scams and pickpockets)",2,2025-04-10 04:20:48,SteveZeisig
VietNam,1jvoipp,mmc4wdp,I did vietnam solo and felt very safe. Except occasional grab drivers trying to offer rides (which I said no to) i had a memorable trip. I did not do sapa but in Hanoi i would walk back from beer street to my hotel at 12 ish and didn’t feel unsafe. My hotel was in old quarter itself.,2,2025-04-10 04:26:24,rip_oldaccount
VietNam,1jvdmjp,mm9gfag,"Ngọc = Jade
Châu = Pearl
Thu = Autumn",4,2025-04-09 19:12:49,ryanchrisgow
VietNam,1jvdmjp,mmbh1fo,duyen shaniqua,3,2025-04-10 01:47:24,Ada187
VietNam,1jvdmjp,mmc8j2s,"Duyen is rarely used as a middle name; it's more commonly a first name, like in Ky Duyen. Your mom's name Duyen Hai is an actual compound noun with a clear, fixed meaning, and it's a nice name. You don't get that impact from Duyen Anh or Duyen Vy - which is a rare combination, usually people name their child Uyen Vy. You should ask your mom for help if she is well versed in sino vietnamese vocabulary",3,2025-04-10 04:55:42,Eastern-Unit-6856
VietNam,1jvdmjp,mmd84tq,Why are you naming your poor daughter Teddi? I guess a good middle name is important when your first name is a disaster.,3,2025-04-10 10:52:01,glimblade
VietNam,1jvdmjp,mm9pjzc,"We named my daughter’s middle name the last name of my father-in-law. It’s a pretty name and he was overjoyed with us honoring him in that way (he’s an amazing man and I love him). 

I’m American btw, and my wife is Viet Kieu.",2,2025-04-09 19:57:12,Material-Drawer-7419
VietNam,1jvdmjp,mm9uwyz,Duyên Ánh,2,2025-04-09 20:22:56,NoAppearance9091
VietNam,1jvdmjp,mm9hvyv,"Mai = apricot flower 
Sen = lotus
Hoa =flower 
Hong = rose
Lan = orchid",2,2025-04-09 19:20:03,Borntochief
VietNam,1jvdmjp,mm9hwb6,"Duyen An, easy to pronounce for both cultures",2,2025-04-09 19:20:06,Fit_Apricot8790
VietNam,1jvdmjp,mmbpc4t,Duyên Sa or Duyên My sounds better than Duyên Vy tbh. Vy doesn't suit Duyên very well imo,2,2025-04-10 02:35:16,Pcs13
VietNam,1jvdmjp,mm9en3s,Nga is a good Vietnamese name,1,2025-04-09 19:03:57,free_loader_3000
VietNam,1jv1w6a,mm6oju5,We buy those big polystyrene cool boxes and wrap with film. Can’t help with a seller though as we fly from da nang.,1,2025-04-09 09:51:37,cdp181
VietNam,1jv1w6a,mm723pa,"Go to electronics supermarket (Nguyễn Kim,...) to buy used carton box.",1,2025-04-09 11:46:30,unituyen
VietNam,1ju3on4,mlz59b7,"renting motorbikes and driving around Ba Bể national park was a great activity with my 68 year old dad and significantly less stress full than driving Ha Giang.

if you aren't already a photographer, pick up two film cameras and a bunch of film and you can basically go anywhere in the country and have unlimited activities trying to find unique things to photograph.",4,2025-04-08 03:14:25,Mescallan
VietNam,1ju3on4,mlz6oyn,Can you list every city you have visited?,2,2025-04-08 03:24:08,ochaforrest
VietNam,1ju3on4,mlzpb3u,"still many nice places to see.

Nha Trang, Can Tho, Rach Gia, Chau Doc, Sapa",2,2025-04-08 05:57:25,State-Dear
VietNam,1ju3on4,mm0md14,"Check out vietnam coracle, it’s a wealth of local titbits,and insights.",2,2025-04-08 11:27:37,Narrow_Discount_1605
VietNam,1ju3on4,mm0o6on,"Vĩnh Hy, Quy Nhơn, Phý Yên Cao Bằng, Yên Bái. There, you have my top secret destinations",2,2025-04-08 11:41:31,saltmurai
VietNam,1ju3on4,mlzfaed,"I’m visiting next week for 8 days for the first time.

Which places would you recommend based on your previous experiences, I’ll start from Hanoi till Da Nang. So anything between these two or near by.",1,2025-04-08 04:28:33,ImCJS
VietNam,1jrb4jp,mld7t1h,Tamias?,1,2025-04-04 12:55:50,BeniCG
VietNam,1jrb4jp,mldclgd,Sugerglider?,0,2025-04-04 13:24:39,nogarthekiller
VietNam,1jr0v09,mlb5s9v,Bored as fuck,12,2025-04-04 02:26:24,Mindless-Coast-4120
VietNam,1jr0v09,mlbmomd,"""I'm tired of this"" is the most direct translation and could be used in all context of ""chán quá""",3,2025-04-04 04:26:48,Loose_Asparagus5690
VietNam,1jr0v09,mlb97kz,"Depends on the context, it can be ""I'm so bored"" or ""it's so boring"", or ""what a shame""",5,2025-04-04 02:48:46,aister
VietNam,1jr0v09,mlbbjqh,">But the translation is not exact.

Sounds alright to me: (It's) so boring, I'm bored,...

It depends on context",1,2025-04-04 03:04:34,NoAppearance9091
VietNam,1jr0v09,mlbolj5,"A more natural translation might be ""I'm so bored"" or ""This is so dull.""",1,2025-04-04 04:41:50,MrMr0595
VietNam,1jr0v09,mlbt2gn,"I’m so bored

Or I’m so tired of this 

Or I’m so over this 

Depends on the context",1,2025-04-04 05:19:17,Commercial_Ad707
VietNam,1jr0v09,mlbukp2,"It is correct translated.

Be minded, however. Vietnamese doesnt distinguish ''I'm bored'' and ''It's boring''. They could be translated as just ''Chán quá''.",1,2025-04-04 05:32:42,CompetitiveScratch38
VietNam,1jr0v09,mlcdiq7,"It can be used to mean bored, fed up, or exasperated. The word describes discontentment at varying intensities depending on context. “chán đời” literally means tired of life or depressed, but it can also be used to describe a boring party or stale relationship.",1,2025-04-04 08:39:13,emberscythe
VietNam,1jnf7dw,mkje92b,"That, or I just put down some money and run away. I feel bad if I don’t pay lol",8,2025-03-30 16:19:00,laysmiserables
VietNam,1jnf7dw,mkl04q2,"Well, in Vietnam you can also bow your head and give people an appreciative smile on top of saying ""cảm ơn"" or something in the same vein. Just don't make that hand gesture unless you want everyone to think that you're a Buddhist/assuming that they're a Buddhist.",3,2025-03-30 21:15:37,ABurnedTwig
VietNam,1jnf7dw,mkjhvji,"It’s a real toughie; I *refuse* to take a *thing* off Viets, but my dad was there from ‘67–>’69, so I’ve got another layer of shame to it other than financial. 

Usually I will stand firm, but if they insist, I’ll order some beers or a bowl of rice wine and have a round with them, then leave them the rest. When that doesn’t work I go back the next day and pay the proprietor anyways—if they refuse, I tell them to give a bowl or plate to the next person in need who comes along. I am totally indifferent if they just pocket the money.

Most of this is a personal quirk due to intergenerational shame and guilt; you really don’t need to take it that far. Say a heartfelt thank you and try to make them laugh—that’s more than enough.",2,2025-03-30 16:38:04,ButMuhNarrative
VietNam,1jmiy1h,mkc4hmu,"In Sapa rn. Only been here a few days, the bars all LOOK great. Really cool vibes, some playing live music etc, only thing is they’re all empty. Probably because of burning season?",2,2025-03-29 10:41:19,Karma_Circus
VietNam,1jmiy1h,mkcd0q9,Relax bar is a good place to chill ...,2,2025-03-29 12:00:24,Own-Western-6687
VietNam,1jmiy1h,mkcjv2d,"I went there in October. Honestly not much nightlife there. I stayed in MGallery, the bar is great for a sundowner. 

I did went out to have drinks but boring there. Went to bar and a club, not much people there either",2,2025-03-29 12:52:19,cassiopeia18
VietNam,1jm6tkx,mk9k4kg,you are eligible to apply for citizenship if you have documentary proof that your dad was or is a Vietnamese citizen and was born in Vietnam.,12,2025-03-28 22:37:51,Temporary-Aioli5866
VietNam,1jm6tkx,mk9qows,"If you’re able to open a Charles Schwab checking account and have your retirement funds go there, you will easily have access to that with no fees. Charles will refund foreign cash withdrawal fees. 

I was only able to open a Vietnamese bank account because I started working and my employers provided documents.  

When I moved I only got my visa exemption. 

Get your M licenses in the states, to me it was easier to pass than the Vietnamese motorcycle license. You can convert M license in Vietnam.",6,2025-03-28 23:13:56,New_Pizza_Rich
VietNam,1jm6tkx,mkayhxv,"Loosely and this may be outdated—

Assuming you have a Vietnamese last name, get a 5-year visa exemption certificate (VEC, “Viet Kieu” visa). With this you can stay in Vietnam for 6 months at a time and helps with setting up a bank account in Vietnam 

Setup multiple US bank accounts with no ATM fees, including Charles Schwab and maybe Fidelity and Betterment. Have your SSI deposited there and transfer as much as you need to your bank account in Vietnam via Wise, PayPal, etc. 

Folks in the Saigon Viet Kieu group on FB should probably have better guidance for your situation, especially for citizenship",1,2025-03-29 03:41:20,Commercial_Ad707
VietNam,1jm64fj,mk9ufy0,[removed],2,2025-03-28 23:34:50,N/A
