content_id,platform,title,content,created_at,source_id,source_name,category_id,category_name,tags,views,score,comment_count,duration,upvote_ratio,url,author
1jn7fan,reddit,"What's something you want to do as an adult but think it's too goofy or childish, so you dont?",,2025-03-30 07:40:30,AskReddit,AskReddit,news,News,[],0,152,89,,0.96,https://www.reddit.com/r/AskReddit/comments/1jn7fan/whats_something_you_want_to_do_as_an_adult_but/,Pokeking44
1jlxnof,reddit,What you have learned from life so far?,,2025-03-28 15:25:41,AskReddit,AskReddit,news,News,[],0,152,378,,0.93,https://www.reddit.com/r/AskReddit/comments/1jlxnof/what_you_have_learned_from_life_so_far/,Legitimate_Page4654
1k57v0p,reddit,What’s the most embarrassing thing you’ve seen someone do in public?,,2025-04-22 14:35:49,AskReddit,AskReddit,news,News,[],0,148,45,,0.99,https://www.reddit.com/r/AskReddit/comments/1k57v0p/whats_the_most_embarrassing_thing_youve_seen/,triplesnoop
1jp3vh2,reddit,What is the best age to get a child?,,2025-04-01 19:06:00,AskReddit,AskReddit,news,News,[],0,154,506,,0.66,https://www.reddit.com/r/AskReddit/comments/1jp3vh2/what_is_the_best_age_to_get_a_child/,Aggressive-Ad-4448
1jly5x7,reddit,What's the most hurtful thing anyone has ever said to you?,,2025-03-28 15:47:47,AskReddit,AskReddit,news,News,[],0,147,810,,0.93,https://www.reddit.com/r/AskReddit/comments/1jly5x7/whats_the_most_hurtful_thing_anyone_has_ever_said/,Un-PunkMe
1k65dnx,reddit,What’s a sound that instantly triggers a memory for you every single time?,,2025-04-23 17:42:45,AskReddit,AskReddit,news,News,[],0,146,298,,0.94,https://www.reddit.com/r/AskReddit/comments/1k65dnx/whats_a_sound_that_instantly_triggers_a_memory/,utatumfinley
1jx57yo,reddit,"People who ""beat"" depression, what was your lowest moment and how did you get better?",,2025-04-12 00:45:52,AskReddit,AskReddit,news,News,[],0,145,218,,0.9,https://www.reddit.com/r/AskReddit/comments/1jx57yo/people_who_beat_depression_what_was_your_lowest/,AiroKunOmega
1jkxfbz,reddit,What’s one thing you’ve always wanted to do but haven’t had the chance yet?,,2025-03-27 06:12:10,AskReddit,AskReddit,news,News,[],0,147,124,,0.94,https://www.reddit.com/r/AskReddit/comments/1jkxfbz/whats_one_thing_youve_always_wanted_to_do_but/,shakayaglow
1jusp4z,reddit,What’s the worst thing to happen to you since you became an adult?,,2025-04-09 00:14:37,AskReddit,AskReddit,news,News,[],0,146,571,,0.93,https://www.reddit.com/r/AskReddit/comments/1jusp4z/whats_the_worst_thing_to_happen_to_you_since_you/,Inside_Tension_1168
1jmv76c,reddit,"Dark Overlords, what are you to do if your chief architect insists that a tower taller than the tallest mountain is not a feasable idea for your Citadel of Doom?",,2025-03-29 20:17:33,AskReddit,AskReddit,news,News,[],0,150,112,,0.86,https://www.reddit.com/r/AskReddit/comments/1jmv76c/dark_overlords_what_are_you_to_do_if_your_chief/,steel-souffle
1jt2ydi,reddit,What is something you hated as a kid that you still hate now?,,2025-04-06 19:58:04,AskReddit,AskReddit,news,News,[],0,147,808,,0.92,https://www.reddit.com/r/AskReddit/comments/1jt2ydi/what_is_something_you_hated_as_a_kid_that_you/,Last-Inspection-8156
1josngr,reddit,What’s the greatest series of all time?,,2025-04-01 10:51:14,AskReddit,AskReddit,news,News,[],0,144,352,,0.85,https://www.reddit.com/r/AskReddit/comments/1josngr/whats_the_greatest_series_of_all_time/,boyo1996
1jwfabg,reddit,"What’s something everyone pretends to understand, but nobody actually does?",,2025-04-11 02:21:27,AskReddit,AskReddit,news,News,[],0,143,423,,0.88,https://www.reddit.com/r/AskReddit/comments/1jwfabg/whats_something_everyone_pretends_to_understand/,SolarFlarer
1jnb830,reddit,What is the biggest lie that society still believes today?,,2025-03-30 12:20:34,AskReddit,AskReddit,news,News,[],0,141,497,,0.81,https://www.reddit.com/r/AskReddit/comments/1jnb830/what_is_the_biggest_lie_that_society_still/,domino_sp0ts
1k6e3by,reddit,"Ladies, what is the most ridiculous place that a man has hit on you?",,2025-04-23 23:47:45,AskReddit,AskReddit,news,News,[],0,141,546,,0.8,https://www.reddit.com/r/AskReddit/comments/1k6e3by/ladies_what_is_the_most_ridiculous_place_that_a/,jumpinpuddleok
1jov1md,reddit,What do you think about texting while driving being treatied/ punished like driving under influence and should it be?,,2025-04-01 13:02:29,AskReddit,AskReddit,news,News,[],0,139,252,,0.79,https://www.reddit.com/r/AskReddit/comments/1jov1md/what_do_you_think_about_texting_while_driving/,kinks96
1jx1k1w,reddit,what was the hardest dilemma you ever had to suffer through?,,2025-04-11 21:47:11,AskReddit,AskReddit,news,News,[],0,139,164,,0.96,https://www.reddit.com/r/AskReddit/comments/1jx1k1w/what_was_the_hardest_dilemma_you_ever_had_to/,sheerduckinghubris
1jrzz5p,reddit,What is something that you absolutely refuse to do in bed ?,,2025-04-05 09:54:05,AskReddit,AskReddit,news,News,[],0,139,416,,0.83,https://www.reddit.com/r/AskReddit/comments/1jrzz5p/what_is_something_that_you_absolutely_refuse_to/,DizzyDoctor982
1k26u2h,reddit,What’s a rare trait these days that genuinely surprises you when you see someone has it?,,2025-04-18 14:52:43,AskReddit,AskReddit,news,News,[],0,137,179,,0.96,https://www.reddit.com/r/AskReddit/comments/1k26u2h/whats_a_rare_trait_these_days_that_genuinely/,Mountain-Ice1768
1jyl1k3,reddit,What is the best dessert out there?,,2025-04-13 23:27:45,AskReddit,AskReddit,news,News,[],0,136,685,,0.91,https://www.reddit.com/r/AskReddit/comments/1jyl1k3/what_is_the_best_dessert_out_there/,Axe1910
1jy90s6,reddit,What’s a “universal” human experience you’ve never related to?,,2025-04-13 14:33:51,AskReddit,AskReddit,news,News,[],0,136,399,,0.94,https://www.reddit.com/r/AskReddit/comments/1jy90s6/whats_a_universal_human_experience_youve_never/,gewdssssddd
1k73qfo,reddit,What’s an unwritten rule of everyday life that everyone should know — but most people completely ignore?,,2025-04-24 21:19:05,AskReddit,AskReddit,news,News,[],0,185,280,,0.92,https://www.reddit.com/r/AskReddit/comments/1k73qfo/whats_an_unwritten_rule_of_everyday_life_that/,Icy-Goose8752
1jzfvx9,reddit,what do you NOT need to have experienced to know how terrible it is?,,2025-04-15 01:36:34,AskReddit,AskReddit,news,News,[],0,136,322,,0.91,https://www.reddit.com/r/AskReddit/comments/1jzfvx9/what_do_you_not_need_to_have_experienced_to_know/,sheerduckinghubris
1jsamef,reddit,Why do you think you're still alive?,,2025-04-05 18:51:44,AskReddit,AskReddit,news,News,[],0,133,943,,0.81,https://www.reddit.com/r/AskReddit/comments/1jsamef/why_do_you_think_youre_still_alive/,ninoSensei
1jkxkmf,reddit,What’s something you wish more people would appreciate in life?,,2025-03-27 06:22:54,AskReddit,AskReddit,news,News,[],0,135,84,,0.95,https://www.reddit.com/r/AskReddit/comments/1jkxkmf/whats_something_you_wish_more_people_would/,theshakayaeffect
1jtoczw,reddit,What's your phone ringtone?,,2025-04-07 15:42:40,AskReddit,AskReddit,news,News,[],0,133,671,,0.93,https://www.reddit.com/r/AskReddit/comments/1jtoczw/whats_your_phone_ringtone/,N/A
1jmwfdw,reddit,"If we were all forced to wear a warning label, what would yours say?",,2025-03-29 21:14:14,AskReddit,AskReddit,news,News,[],0,132,615,,0.93,https://www.reddit.com/r/AskReddit/comments/1jmwfdw/if_we_were_all_forced_to_wear_a_warning_label/,MagicMark890
1k4uhpw,reddit,What's the most recent TV show that you binge watched?,,2025-04-22 01:33:52,AskReddit,AskReddit,news,News,[],0,128,814,,0.92,https://www.reddit.com/r/AskReddit/comments/1k4uhpw/whats_the_most_recent_tv_show_that_you_binge/,lokiisixteen
1jkx062,reddit,How do you define success in life?,,2025-03-27 05:42:13,AskReddit,AskReddit,news,News,[],0,131,98,,0.93,https://www.reddit.com/r/AskReddit/comments/1jkx062/how_do_you_define_success_in_life/,shakayadreams
1juvb5t,reddit,What is your favorite misheard lyric?,,2025-04-09 02:28:47,AskReddit,AskReddit,news,News,[],0,130,835,,0.92,https://www.reddit.com/r/AskReddit/comments/1juvb5t/what_is_your_favorite_misheard_lyric/,Phillies1993
1julwt4,reddit,What type of criminal generally has the most success rate in making money without getting caught?,,2025-04-08 19:14:28,AskReddit,AskReddit,news,News,[],0,129,343,,0.81,https://www.reddit.com/r/AskReddit/comments/1julwt4/what_type_of_criminal_generally_has_the_most/,N/A
1k6f56k,reddit,What is your kryptonite?,,2025-04-24 00:39:33,AskReddit,AskReddit,news,News,[],0,126,428,,0.9,https://www.reddit.com/r/AskReddit/comments/1k6f56k/what_is_your_kryptonite/,MoneyMunk27
1jkoaq1,reddit,"If babies could talk from birth, what’s the first thing you think they’d say?",,2025-03-26 22:13:54,AskReddit,AskReddit,news,News,[],0,127,589,,0.9,https://www.reddit.com/r/AskReddit/comments/1jkoaq1/if_babies_could_talk_from_birth_whats_the_first/,OlSkulCHUCK
1k6gkg1,reddit,People who no longer party what changed your mind?,,2025-04-24 01:51:05,AskReddit,AskReddit,news,News,[],0,126,709,,0.86,https://www.reddit.com/r/AskReddit/comments/1k6gkg1/people_who_no_longer_party_what_changed_your_mind/,Uknown-Nerd6207
1jquy64,reddit,What’s a tiny habit you have that would 100% get you accused of being a witch in the 1600s?,,2025-04-03 21:34:07,AskReddit,AskReddit,news,News,[],0,125,360,,0.88,https://www.reddit.com/r/AskReddit/comments/1jquy64/whats_a_tiny_habit_you_have_that_would_100_get/,CatnipWytch
1jvx3df,reddit,"Do you have an ultimate childhood crush from elementary school that you still haven't forgotten? If you still remember, what was their first name?",,2025-04-10 12:49:40,AskReddit,AskReddit,news,News,[],0,125,114,,0.95,https://www.reddit.com/r/AskReddit/comments/1jvx3df/do_you_have_an_ultimate_childhood_crush_from/,Hot_Yogurtcloset149
1jmz23w,reddit,"Women of reddit, what do a guys legs do for you when it comes to attraction. Is it the equivalent of the way a male sees women’s arms (not sexual) or not quite the same?",,2025-03-29 23:19:14,AskReddit,AskReddit,news,News,[],0,126,109,,0.74,https://www.reddit.com/r/AskReddit/comments/1jmz23w/women_of_reddit_what_do_a_guys_legs_do_for_you/,xBenny-
1k55k87,reddit,What kind of people you cannot forgive?,,2025-04-22 12:53:45,AskReddit,AskReddit,news,News,[],0,121,572,,0.81,https://www.reddit.com/r/AskReddit/comments/1k55k87/what_kind_of_people_you_cannot_forgive/,Common_Extreme8407
1k61kmf,reddit,What is the simple thing that always makes you happy?,,2025-04-23 15:10:27,AskReddit,AskReddit,news,News,[],0,119,380,,0.96,https://www.reddit.com/r/AskReddit/comments/1k61kmf/what_is_the_simple_thing_that_always_makes_you/,cinnamonskim
1jkb0gl,reddit,What’s the unusual item in your home and why do you keep it?,,2025-03-26 12:51:21,AskReddit,AskReddit,news,News,[],0,119,128,,0.93,https://www.reddit.com/r/AskReddit/comments/1jkb0gl/whats_the_unusual_item_in_your_home_and_why_do/,jadevibess
1joru52,reddit,What advice would you give to someone who is turning 19 yrs old ?,,2025-04-01 09:56:30,AskReddit,AskReddit,news,News,[],0,121,146,,0.86,https://www.reddit.com/r/AskReddit/comments/1joru52/what_advice_would_you_give_to_someone_who_is/,jinwooshadowmonarch6
1jvu5ll,reddit,"To those who speak another language, what are some words that cannot be translated to English?",,2025-04-10 09:56:35,AskReddit,AskReddit,news,News,[],0,115,328,,0.89,https://www.reddit.com/r/AskReddit/comments/1jvu5ll/to_those_who_speak_another_language_what_are_some/,Professional_Act_214
1k3plv4,reddit,"What are you never, ever, EVER gonna do in your life?",,2025-04-20 15:52:41,AskReddit,AskReddit,news,News,[],0,123,669,,0.88,https://www.reddit.com/r/AskReddit/comments/1k3plv4/what_are_you_never_ever_ever_gonna_do_in_your_life/,brainrooted
1jmnxx0,reddit,What's the worst dating experience you 've ever had?,,2025-03-29 14:50:36,AskReddit,AskReddit,news,News,[],0,122,186,,0.88,https://www.reddit.com/r/AskReddit/comments/1jmnxx0/whats_the_worst_dating_experience_you_ve_ever_had/,FancyTreat5472
1jxin5j,reddit,What is the worst part about being poor?,,2025-04-12 14:33:06,AskReddit,AskReddit,news,News,[],0,117,494,,0.89,https://www.reddit.com/r/AskReddit/comments/1jxin5j/what_is_the_worst_part_about_being_poor/,Dazzling-Leader7476
1k2x9sn,reddit,When was a time that you were the most happiest you’ve ever been in life ?,,2025-04-19 14:17:29,AskReddit,AskReddit,news,News,[],0,114,235,,0.96,https://www.reddit.com/r/AskReddit/comments/1k2x9sn/when_was_a_time_that_you_were_the_most_happiest/,Same_Level6591
1jum2xk,reddit,"People in a relationship on Reddit, let's say in the future, they can make an exact robot copy of your partner. Is it cheating on your partner if you have relations with the robot? Why or why not?",,2025-04-08 19:21:34,AskReddit,AskReddit,news,News,[],0,115,84,,0.72,https://www.reddit.com/r/AskReddit/comments/1jum2xk/people_in_a_relationship_on_reddit_lets_say_in/,greencan
1jz5c8z,reddit,"What do you strongly feel won't happen to you, even if people try to tell you otherwise?",,2025-04-14 17:58:09,AskReddit,AskReddit,news,News,[],0,113,259,,0.94,https://www.reddit.com/r/AskReddit/comments/1jz5c8z/what_do_you_strongly_feel_wont_happen_to_you_even/,PrestonRoad90
1jyzt09,reddit,What’s the reason for your most recent breakup?,,2025-04-14 14:10:29,AskReddit,AskReddit,news,News,[],0,115,459,,0.92,https://www.reddit.com/r/AskReddit/comments/1jyzt09/whats_the_reason_for_your_most_recent_breakup/,General-Cycle-7391
1jp2ffk,reddit,Whats the most weight youve lost and how did you do it?,,2025-04-01 18:08:53,AskReddit,AskReddit,news,News,[],0,115,845,,0.84,https://www.reddit.com/r/AskReddit/comments/1jp2ffk/whats_the_most_weight_youve_lost_and_how_did_you/,SoftYetCrunchyTaco
1jwx5ds,reddit,What’s the creepiest encounter you’ve ever had with a stranger?,,2025-04-11 18:37:27,AskReddit,AskReddit,news,News,[],0,117,223,,0.87,https://www.reddit.com/r/AskReddit/comments/1jwx5ds/whats_the_creepiest_encounter_youve_ever_had_with/,Dislexyc1
1jkryb7,reddit,What’s the weirdest thing you’ve Googled recently?,,2025-03-27 01:00:32,AskReddit,AskReddit,news,News,[],0,114,113,,0.93,https://www.reddit.com/r/AskReddit/comments/1jkryb7/whats_the_weirdest_thing_youve_googled_recently/,shakayavibess
1jxucop,reddit,What’s something you silently judge people for?,,2025-04-12 23:29:28,AskReddit,AskReddit,news,News,[],0,111,958,,0.86,https://www.reddit.com/r/AskReddit/comments/1jxucop/whats_something_you_silently_judge_people_for/,schaf_warrior
1jo1am1,reddit,What’s something you believed as a kid that you’re still low-key mad about finding out wasn’t true?,,2025-03-31 11:49:58,AskReddit,AskReddit,news,News,[],0,112,311,,0.88,https://www.reddit.com/r/AskReddit/comments/1jo1am1/whats_something_you_believed_as_a_kid_that_youre/,CrazyErotica_Writer
1jkw3r0,reddit,Which movie has the best soundtrack in your opinion?,,2025-03-27 04:42:50,AskReddit,AskReddit,news,News,[],0,110,263,,0.93,https://www.reddit.com/r/AskReddit/comments/1jkw3r0/which_movie_has_the_best_soundtrack_in_your/,jadevibess
1jz1ztj,reddit,Who is hating their job right now and why?,,2025-04-14 15:41:30,AskReddit,AskReddit,news,News,[],0,114,254,,0.87,https://www.reddit.com/r/AskReddit/comments/1jz1ztj/who_is_hating_their_job_right_now_and_why/,MoneyMunk27
1jp9nf2,reddit,If you were to combine a nickname your friends give you and put your favorite swear word after that on a hat what would your hat read?,,2025-04-01 23:04:39,AskReddit,AskReddit,news,News,[],0,112,26,,0.84,https://www.reddit.com/r/AskReddit/comments/1jp9nf2/if_you_were_to_combine_a_nickname_your_friends/,Pokeking44
1jpvbou,reddit,"If you could bring back ONE celebrity who passed away too soon, purely to see what they’d create next, who would it be and why?",,2025-04-02 18:03:39,AskReddit,AskReddit,news,News,[],0,110,859,,0.86,https://www.reddit.com/r/AskReddit/comments/1jpvbou/if_you_could_bring_back_one_celebrity_who_passed/,SuspiciousWeekend41
1jo3wsc,reddit,"Whats something that's awesome, was awesome and forever will be awesome?",,2025-03-31 14:02:03,AskReddit,AskReddit,news,News,[],0,109,446,,0.9,https://www.reddit.com/r/AskReddit/comments/1jo3wsc/whats_something_thats_awesome_was_awesome_and/,KHCr-
1jkwgnb,reddit,What movie had the most disappointing sequel or prequel?,,2025-03-27 05:05:26,AskReddit,AskReddit,news,News,[],0,108,185,,0.93,https://www.reddit.com/r/AskReddit/comments/1jkwgnb/what_movie_had_the_most_disappointing_sequel_or/,shakyaquest
1k4bhm2,reddit,What’s something Scary you’ve seen but been unable to explain?,,2025-04-21 11:45:22,AskReddit,AskReddit,news,News,[],0,109,8,,0.87,https://www.reddit.com/r/AskReddit/comments/1k4bhm2/whats_something_scary_youve_seen_but_been_unable/,AdLocal2814
1jzfbs4,reddit,Which common phrase or slang annoys you the most?,,2025-04-15 01:08:20,AskReddit,AskReddit,news,News,[],0,107,1282,,0.8,https://www.reddit.com/r/AskReddit/comments/1jzfbs4/which_common_phrase_or_slang_annoys_you_the_most/,chicolegume
1jtfl3k,reddit,How do you wish to die?,,2025-04-07 07:27:39,AskReddit,AskReddit,news,News,[],0,108,521,,0.92,https://www.reddit.com/r/AskReddit/comments/1jtfl3k/how_do_you_wish_to_die/,kamikasi_whatever989
1k30q7o,reddit,"What is one of your favorite comebacks to ""you suck""?",,2025-04-19 16:52:30,AskReddit,AskReddit,news,News,[],0,105,389,,0.91,https://www.reddit.com/r/AskReddit/comments/1k30q7o/what_is_one_of_your_favorite_comebacks_to_you_suck/,Impossible_Panic_822
1ju1jpw,reddit,"If you could go back in time and see one event in history, what one would it be?",,2025-04-08 01:09:00,AskReddit,AskReddit,news,News,[],0,105,471,,0.9,https://www.reddit.com/r/AskReddit/comments/1ju1jpw/if_you_could_go_back_in_time_and_see_one_event_in/,ThinkFish76
1jx7fel,reddit,Why did your first love relationship end?,,2025-04-12 02:46:19,AskReddit,AskReddit,news,News,[],0,108,755,,0.9,https://www.reddit.com/r/AskReddit/comments/1jx7fel/why_did_your_first_love_relationship_end/,hellomishi
1k0mz0h,reddit,What do you want out of life?,,2025-04-16 15:18:09,AskReddit,AskReddit,news,News,[],0,103,332,,0.94,https://www.reddit.com/r/AskReddit/comments/1k0mz0h/what_do_you_want_out_of_life/,cantswimbutfish
1jwq90t,reddit,What's the most unexpected way you realized you were truly in love?,,2025-04-11 13:45:24,AskReddit,AskReddit,news,News,[],0,108,105,,0.96,https://www.reddit.com/r/AskReddit/comments/1jwq90t/whats_the_most_unexpected_way_you_realized_you/,zenitanhwa
1k5gg6k,reddit,Who brings you the most joy?,,2025-04-22 20:20:11,AskReddit,AskReddit,news,News,[],0,101,283,,0.92,https://www.reddit.com/r/AskReddit/comments/1k5gg6k/who_brings_you_the_most_joy/,Gloomy_Courage_748
1k3p4db,reddit,What is the weirdest thing that has ever happened to you?,,2025-04-20 15:30:42,AskReddit,AskReddit,news,News,[],0,102,99,,0.94,https://www.reddit.com/r/AskReddit/comments/1k3p4db/what_is_the_weirdest_thing_that_has_ever_happened/,WowUActuallyReadThis
1k1hrrv,reddit,What made you want to join Reddit?,,2025-04-17 16:57:36,AskReddit,AskReddit,news,News,[],0,105,392,,0.94,https://www.reddit.com/r/AskReddit/comments/1k1hrrv/what_made_you_want_to_join_reddit/,AliceKennyk
1k1g8sb,reddit,What’s a weird little thing from your childhood that you didn’t realize was magical until it was gone?,,2025-04-17 15:55:16,AskReddit,AskReddit,news,News,[],0,104,255,,0.98,https://www.reddit.com/r/AskReddit/comments/1k1g8sb/whats_a_weird_little_thing_from_your_childhood/,SeaworthinessThin286
1jxmbmj,reddit,"who was that one person, who isn’t in your life anymore, that you will never forget?",,2025-04-12 17:17:29,AskReddit,AskReddit,news,News,[],0,104,300,,0.93,https://www.reddit.com/r/AskReddit/comments/1jxmbmj/who_was_that_one_person_who_isnt_in_your_life/,theonlyangelll
1jobct3,reddit,"Have you ever been bullied? if so, what for?",,2025-03-31 19:11:22,AskReddit,AskReddit,news,News,[],0,100,603,,0.92,https://www.reddit.com/r/AskReddit/comments/1jobct3/have_you_ever_been_bullied_if_so_what_for/,Any_Leg_1998
1jngcxc,reddit,What is a hard truth of life that no one likes?,,2025-03-30 16:33:35,AskReddit,AskReddit,news,News,[],0,106,199,,0.85,https://www.reddit.com/r/AskReddit/comments/1jngcxc/what_is_a_hard_truth_of_life_that_no_one_likes/,N/A
1k65yq3,reddit,"What’s something that doesn’t exist, but absolutely should by now?",,2025-04-23 18:05:55,AskReddit,AskReddit,news,News,[],0,105,590,,0.84,https://www.reddit.com/r/AskReddit/comments/1k65yq3/whats_something_that_doesnt_exist_but_absolutely/,opiperfloyd
1k2k6ai,reddit,You’re the only one of your gender left alive on Earth. What would you do?,,2025-04-19 00:44:40,AskReddit,AskReddit,news,News,[],0,104,670,,0.71,https://www.reddit.com/r/AskReddit/comments/1k2k6ai/youre_the_only_one_of_your_gender_left_alive_on/,CaptainRichardSharpe
1jw8l3a,reddit,What popular smell are you not a fan of?,,2025-04-10 20:56:48,AskReddit,AskReddit,news,News,[],0,106,950,,0.91,https://www.reddit.com/r/AskReddit/comments/1jw8l3a/what_popular_smell_are_you_not_a_fan_of/,Vandelay797
1k3hgig,reddit,"What's something you believe everyone should experience at least once in their lifetime, and why?",,2025-04-20 07:45:51,AskReddit,AskReddit,news,News,[],0,102,222,,0.94,https://www.reddit.com/r/AskReddit/comments/1k3hgig/whats_something_you_believe_everyone_should/,Pure_Document6022
1jxona8,reddit,What are your school bullies doing now?,,2025-04-12 19:00:32,AskReddit,AskReddit,news,News,[],0,101,797,,0.83,https://www.reddit.com/r/AskReddit/comments/1jxona8/what_are_your_school_bullies_doing_now/,astronaut_lewis
1jrdinw,reddit,Who truly likes an oatmeal raisin cookie?,,2025-04-04 14:40:34,AskReddit,AskReddit,news,News,[],0,101,192,,0.9,https://www.reddit.com/r/AskReddit/comments/1jrdinw/who_truly_likes_an_oatmeal_raisin_cookie/,Correl_Reefer
1jq4dls,reddit,What is a pickup line that actually worked on/for you?,,2025-04-03 00:23:43,AskReddit,AskReddit,news,News,[],0,97,243,,0.84,https://www.reddit.com/r/AskReddit/comments/1jq4dls/what_is_a_pickup_line_that_actually_worked_onfor/,Critical_Ice1647
1jpi5rc,reddit,What’s the most unethical life hack that actually works?,,2025-04-02 06:32:21,AskReddit,AskReddit,news,News,[],0,103,117,,0.83,https://www.reddit.com/r/AskReddit/comments/1jpi5rc/whats_the_most_unethical_life_hack_that_actually/,Unusual-Candy-642
1jkwblo,reddit,What movie would you recommend for someone who doesn’t watch a lot of films?,,2025-03-27 04:56:38,AskReddit,AskReddit,news,News,[],0,102,86,,0.92,https://www.reddit.com/r/AskReddit/comments/1jkwblo/what_movie_would_you_recommend_for_someone_who/,jadegoddesxx
1jzvsjm,reddit,What song makes you depressed?,,2025-04-15 16:09:39,AskReddit,AskReddit,news,News,[],0,102,312,,0.95,https://www.reddit.com/r/AskReddit/comments/1jzvsjm/what_song_makes_you_depressed/,Decent-Temperature31
1k78eq9,reddit,What is a hit song from your youth that you didn't appreciate until later in life?,,2025-04-25 00:58:25,AskReddit,AskReddit,news,News,[],0,170,474,,0.95,https://www.reddit.com/r/AskReddit/comments/1k78eq9/what_is_a_hit_song_from_your_youth_that_you_didnt/,ShittalkyCaps
1jkauwp,reddit,"What’s a book, movie, or song  that changed the way you see the world?",,2025-03-26 12:43:22,AskReddit,AskReddit,news,News,[],0,98,65,,0.94,https://www.reddit.com/r/AskReddit/comments/1jkauwp/whats_a_book_movie_or_song_that_changed_the_way/,jadegoddesxx
1k5yzjm,reddit,"When you get out of the shower, what is the first body part you dry off first?",,2025-04-23 13:19:54,AskReddit,AskReddit,news,News,[],0,97,428,,0.84,https://www.reddit.com/r/AskReddit/comments/1k5yzjm/when_you_get_out_of_the_shower_what_is_the_first/,plantbasedego
1k5ritq,reddit,Where do you see yourself in ten minutes?,,2025-04-23 05:27:15,AskReddit,AskReddit,news,News,[],0,100,450,,0.91,https://www.reddit.com/r/AskReddit/comments/1k5ritq/where_do_you_see_yourself_in_ten_minutes/,saladking1999
1k4uiqt,reddit,What's the weirdest fetish that you've seen?,,2025-04-22 01:35:22,AskReddit,AskReddit,news,News,[],0,97,418,,0.78,https://www.reddit.com/r/AskReddit/comments/1k4uiqt/whats_the_weirdest_fetish_that_youve_seen/,Vanessa-queenu
1k44jq7,reddit,"Older people of Reddit , what is something that was the norm back then but would be frowned upon today ?",,2025-04-21 03:57:45,AskReddit,AskReddit,news,News,[],0,99,214,,0.9,https://www.reddit.com/r/AskReddit/comments/1k44jq7/older_people_of_reddit_what_is_something_that_was/,gripreaper09
1jwkag9,reddit,"What YouTubers dead channel are you going to support, even tho he/she hasn't posted anything for months or years, and why?",,2025-04-11 07:37:36,AskReddit,AskReddit,news,News,[],0,97,418,,0.72,https://www.reddit.com/r/AskReddit/comments/1jwkag9/what_youtubers_dead_channel_are_you_going_to/,Rndmguy_5683
1k5ewth,reddit,do u take naps? why or why not?,,2025-04-22 19:17:54,AskReddit,AskReddit,news,News,[],0,96,386,,0.9,https://www.reddit.com/r/AskReddit/comments/1k5ewth/do_u_take_naps_why_or_why_not/,mewitoooo
1k4y64v,reddit,What food is highly overrated?,,2025-04-22 04:52:11,AskReddit,AskReddit,news,News,[],0,95,898,,0.79,https://www.reddit.com/r/AskReddit/comments/1k4y64v/what_food_is_highly_overrated/,N/A
1k2x2i8,reddit,What is something that someone does that will immediately turn you off?,,2025-04-19 14:07:51,AskReddit,AskReddit,news,News,[],0,96,344,,0.83,https://www.reddit.com/r/AskReddit/comments/1k2x2i8/what_is_something_that_someone_does_that_will/,IL0veHotChocolate
1jl18qv,reddit,What’s a simple pleasure in life that never gets old?,,2025-03-27 11:00:02,AskReddit,AskReddit,news,News,[],0,95,508,,0.92,https://www.reddit.com/r/AskReddit/comments/1jl18qv/whats_a_simple_pleasure_in_life_that_never_gets/,tayefh
1jmqfqi,reddit,What is the most painful experience you’ve felt thus far?,,2025-03-29 16:43:59,AskReddit,AskReddit,news,News,[],0,93,363,,0.88,https://www.reddit.com/r/AskReddit/comments/1jmqfqi/what_is_the_most_painful_experience_youve_felt/,WANACWaac
