content_id,platform,title,content,created_at,source_id,source_name,category_id,category_name,tags,views,score,comment_count,duration,upvote_ratio,url,author
1jvim8d,reddit,What's an unlikable trait people usually don't realize they have?,,2025-04-09 22:25:38,AskReddit,AskReddit,news,News,[],0,44,172,,0.89,https://www.reddit.com/r/AskReddit/comments/1jvim8d/whats_an_unlikable_trait_people_usually_dont/,emma666poop
1judz1b,reddit,What illegal thing do you do basically daily?,,2025-04-08 13:47:32,AskReddit,AskReddit,news,News,[],0,45,174,,0.76,https://www.reddit.com/r/AskReddit/comments/1judz1b/what_illegal_thing_do_you_do_basically_daily/,PreparationFar4709
1jp241t,reddit,What are you tired of pretending to give a damn about?,,2025-04-01 17:56:44,AskReddit,AskReddit,news,News,[],0,45,221,,0.74,https://www.reddit.com/r/AskReddit/comments/1jp241t/what_are_you_tired_of_pretending_to_give_a_damn/,ShittalkyCaps
1jm23p8,reddit,What helped you finally lose weight?,,2025-03-28 18:34:24,AskReddit,AskReddit,news,News,[],0,45,306,,0.82,https://www.reddit.com/r/AskReddit/comments/1jm23p8/what_helped_you_finally_lose_weight/,Efficient-Ask-968
1jkb9c8,reddit,What’s a little-known website that more people should know about?,,2025-03-26 13:03:15,AskReddit,AskReddit,news,News,[],0,43,31,,0.88,https://www.reddit.com/r/AskReddit/comments/1jkb9c8/whats_a_littleknown_website_that_more_people/,Pale_Salamander9076
1jxbfna,reddit,"Redditors who work at the movies, what movie attracted the worst people?",,2025-04-12 06:59:59,AskReddit,AskReddit,news,News,[],0,47,36,,0.85,https://www.reddit.com/r/AskReddit/comments/1jxbfna/redditors_who_work_at_the_movies_what_movie/,Rude_Wing6350
1jvnoxi,reddit,What’s something happening in the world right now that gives you hope for the future?,,2025-04-10 02:42:21,AskReddit,AskReddit,news,News,[],0,45,110,,0.85,https://www.reddit.com/r/AskReddit/comments/1jvnoxi/whats_something_happening_in_the_world_right_now/,lagueraloca
1jreryo,reddit,"People who didn’t socialize as a kid, how are you as an adult?",,2025-04-04 15:32:46,AskReddit,AskReddit,news,News,[],0,44,173,,0.96,https://www.reddit.com/r/AskReddit/comments/1jreryo/people_who_didnt_socialize_as_a_kid_how_are_you/,beasthunter3000
1jov7aa,reddit,"Teachers, what's the worst thing a student has done in your class?",,2025-04-01 13:10:14,AskReddit,AskReddit,news,News,[],0,47,91,,0.83,https://www.reddit.com/r/AskReddit/comments/1jov7aa/teachers_whats_the_worst_thing_a_student_has_done/,Successful_Pace_1159
1k6uo2g,reddit,When did you become mature?,,2025-04-24 15:11:49,AskReddit,AskReddit,news,News,[],0,45,165,,0.87,https://www.reddit.com/r/AskReddit/comments/1k6uo2g/when_did_you_become_mature/,Late_Election4714
1k40szn,reddit,What was your biggest “surprise” about adulthood?,,2025-04-21 00:35:26,AskReddit,AskReddit,news,News,[],0,42,208,,0.83,https://www.reddit.com/r/AskReddit/comments/1k40szn/what_was_your_biggest_surprise_about_adulthood/,AngleRelative4683
1k2x3f1,reddit,If every countries national animal was to get into a battle royal who would win?,,2025-04-19 14:09:06,AskReddit,AskReddit,news,News,[],0,44,118,,0.77,https://www.reddit.com/r/AskReddit/comments/1k2x3f1/if_every_countries_national_animal_was_to_get/,TheCuriousGamer
1k1uvtn,reddit,What is one song that makes you cry?,,2025-04-18 02:59:39,AskReddit,AskReddit,news,News,[],0,42,230,,0.91,https://www.reddit.com/r/AskReddit/comments/1k1uvtn/what_is_one_song_that_makes_you_cry/,Woody7367
1k0mvub,reddit,What's the most gut-wrenching horror movie moment of all time?,,2025-04-16 15:14:27,AskReddit,AskReddit,news,News,[],0,43,232,,0.78,https://www.reddit.com/r/AskReddit/comments/1k0mvub/whats_the_most_gutwrenching_horror_movie_moment/,torgjorn
1jzl0on,reddit,What a song you will love forever?,,2025-04-15 06:29:09,AskReddit,AskReddit,news,News,[],0,42,216,,0.87,https://www.reddit.com/r/AskReddit/comments/1jzl0on/what_a_song_you_will_love_forever/,Tyler_Durden5836
1jpjevx,reddit,What are signs of a person being overstimulated?,,2025-04-02 08:05:37,AskReddit,AskReddit,news,News,[],0,44,41,,0.81,https://www.reddit.com/r/AskReddit/comments/1jpjevx/what_are_signs_of_a_person_being_overstimulated/,Same_Level6591
1k5oo5q,reddit,What is the most painful feeling?,,2025-04-23 02:42:08,AskReddit,AskReddit,news,News,[],0,41,218,,0.83,https://www.reddit.com/r/AskReddit/comments/1k5oo5q/what_is_the_most_painful_feeling/,melatoningummies3000
1jy71vq,reddit,What is the most brutal reality check you have received?,,2025-04-13 12:58:12,AskReddit,AskReddit,news,News,[],0,41,109,,0.89,https://www.reddit.com/r/AskReddit/comments/1jy71vq/what_is_the_most_brutal_reality_check_you_have/,Excellent-Crow-8771
1jkv4cn,reddit,What is your biggest sexual fantasy?,,2025-03-27 03:44:56,AskReddit,AskReddit,news,News,[],0,40,485,,0.58,https://www.reddit.com/r/AskReddit/comments/1jkv4cn/what_is_your_biggest_sexual_fantasy/,amathrowaway420
1k4k1xb,reddit,What’s the most confusing insult that you’ve ever heard?,,2025-04-21 18:01:11,AskReddit,AskReddit,news,News,[],0,40,118,,0.83,https://www.reddit.com/r/AskReddit/comments/1k4k1xb/whats_the_most_confusing_insult_that_youve_ever/,AlbineHero
1k3lnh6,reddit,What ruined dating for you?,,2025-04-20 12:39:26,AskReddit,AskReddit,news,News,[],0,42,344,,0.8,https://www.reddit.com/r/AskReddit/comments/1k3lnh6/what_ruined_dating_for_you/,Blastronaut_
1jnsfkb,reddit,"Children of divorced parents, what do you wish your parents had done differently?",,2025-03-31 01:52:09,AskReddit,AskReddit,news,News,[],0,42,126,,0.86,https://www.reddit.com/r/AskReddit/comments/1jnsfkb/children_of_divorced_parents_what_do_you_wish/,Frequently_Abroad_00
1jmd3r5,reddit,What movie or TV show do you love so much that you wish you could experience it for the first time all over again?,,2025-03-29 03:08:39,AskReddit,AskReddit,news,News,[],0,37,187,,0.87,https://www.reddit.com/r/AskReddit/comments/1jmd3r5/what_movie_or_tv_show_do_you_love_so_much_that/,GigglesaurusPrime
1jk9lc1,reddit,What's the first movie that made you cry?,,2025-03-26 11:32:56,AskReddit,AskReddit,news,News,[],0,40,416,,0.86,https://www.reddit.com/r/AskReddit/comments/1jk9lc1/whats_the_first_movie_that_made_you_cry/,AltruisticResist4888
1k4jt4n,reddit,What’s something super small you did once that completely changed your life?,,2025-04-21 17:51:52,AskReddit,AskReddit,news,News,[],0,41,47,,0.98,https://www.reddit.com/r/AskReddit/comments/1k4jt4n/whats_something_super_small_you_did_once_that/,opiperfloyd
1jugqbt,reddit,What’s the most adventurous thing that you’ve ever done?,,2025-04-08 15:44:22,AskReddit,AskReddit,news,News,[],0,40,109,,0.92,https://www.reddit.com/r/AskReddit/comments/1jugqbt/whats_the_most_adventurous_thing_that_youve_ever/,daniellablond
1jsdmrk,reddit,"What’s a “social norm” that secretly makes your life harder, but no one really talks about it?",,2025-04-05 21:03:53,AskReddit,AskReddit,news,News,[],0,40,90,,0.91,https://www.reddit.com/r/AskReddit/comments/1jsdmrk/whats_a_social_norm_that_secretly_makes_your_life/,N/A
1joxxmy,reddit,"If a specific species of animal were to rise up and overthrow humanity, what species would you want it to be?",,2025-04-01 15:08:43,AskReddit,AskReddit,news,News,[],0,38,261,,0.8,https://www.reddit.com/r/AskReddit/comments/1joxxmy/if_a_specific_species_of_animal_were_to_rise_up/,LittlePenis11
1jn70j1,reddit,"What's the best response to ""oh, so I guess I'm just the worst person in the world, huh""?",,2025-03-30 07:08:44,AskReddit,AskReddit,news,News,[],0,38,276,,0.7,https://www.reddit.com/r/AskReddit/comments/1jn70j1/whats_the_best_response_to_oh_so_i_guess_im_just/,Justin_Shields
1jkbxbn,reddit,What's worth doing exactly one time only?,,2025-03-26 13:35:50,AskReddit,AskReddit,news,News,[],0,40,171,,0.84,https://www.reddit.com/r/AskReddit/comments/1jkbxbn/whats_worth_doing_exactly_one_time_only/,blankblank
1k5vaap,reddit,What is the best simple gift you can give a parent for their birthday?,,2025-04-23 09:54:53,AskReddit,AskReddit,news,News,[],0,41,24,,0.98,https://www.reddit.com/r/AskReddit/comments/1k5vaap/what_is_the_best_simple_gift_you_can_give_a/,Royal_Trainer_4656
1k5ug40,reddit,What is that one song that helped you when you were down in life ?,,2025-04-23 08:55:31,AskReddit,AskReddit,news,News,[],0,39,86,,0.91,https://www.reddit.com/r/AskReddit/comments/1k5ug40/what_is_that_one_song_that_helped_you_when_you/,Over-Conflict-8003
1k549m0,reddit,What's the biggest trauma of your childhood?,,2025-04-22 11:46:36,AskReddit,AskReddit,news,News,[],0,36,120,,0.87,https://www.reddit.com/r/AskReddit/comments/1k549m0/whats_the_biggest_trauma_of_your_childhood/,daiwo_official
1k53nad,reddit,What gives you an instant rush of nostalgia?,,2025-04-22 11:11:17,AskReddit,AskReddit,news,News,[],0,35,84,,0.82,https://www.reddit.com/r/AskReddit/comments/1k53nad/what_gives_you_an_instant_rush_of_nostalgia/,CrispySprite2001
1k20slj,reddit,What's a non-sexual trait that makes someone absolutely irresistible to you?,,2025-04-18 09:28:23,AskReddit,AskReddit,news,News,[],0,38,130,,0.79,https://www.reddit.com/r/AskReddit/comments/1k20slj/whats_a_nonsexual_trait_that_makes_someone/,Possible-Respect6729
1jv816w,reddit,What’s one thing you bought that felt expensive but was 100% worth it?,,2025-04-09 15:06:27,AskReddit,AskReddit,news,News,[],0,39,195,,0.85,https://www.reddit.com/r/AskReddit/comments/1jv816w/whats_one_thing_you_bought_that_felt_expensive/,Ornery-Trick-3333
1jtnonz,reddit,What was your absolute favorite book growing up?,,2025-04-07 15:14:13,AskReddit,AskReddit,news,News,[],0,41,156,,0.95,https://www.reddit.com/r/AskReddit/comments/1jtnonz/what_was_your_absolute_favorite_book_growing_up/,sheenhai
1jrefkx,reddit,"With this year being the 5th anniversary of COVID-19, how has your life changed?",,2025-04-04 15:18:38,AskReddit,AskReddit,news,News,[],0,35,104,,0.77,https://www.reddit.com/r/AskReddit/comments/1jrefkx/with_this_year_being_the_5th_anniversary_of/,Nessieinternational
1jpgtrt,reddit,how do guys feel about dating a girl that's taller than them?,,2025-04-02 05:01:31,AskReddit,AskReddit,news,News,[],0,40,47,,0.93,https://www.reddit.com/r/AskReddit/comments/1jpgtrt/how_do_guys_feel_about_dating_a_girl_thats_taller/,lila-sunshine
1jnlae7,reddit,If you won a million dollar scratcher what's the first thing you'd do?,,2025-03-30 20:07:40,AskReddit,AskReddit,news,News,[],0,40,396,,0.76,https://www.reddit.com/r/AskReddit/comments/1jnlae7/if_you_won_a_million_dollar_scratcher_whats_the/,Surfin_Bird_3
1k5fah8,reddit,What’s something that would make someone instantly undateable for you if they didn’t have it?,,2025-04-22 19:33:15,AskReddit,AskReddit,news,News,[],0,37,141,,0.84,https://www.reddit.com/r/AskReddit/comments/1k5fah8/whats_something_that_would_make_someone_instantly/,No_Maintenance_5417
1k3vsi3,reddit,What’s an odd fear that you have that u just can’t explain?,,2025-04-20 20:31:26,AskReddit,AskReddit,news,News,[],0,39,231,,0.83,https://www.reddit.com/r/AskReddit/comments/1k3vsi3/whats_an_odd_fear_that_you_have_that_u_just_cant/,bravebridgegirl
1jxrzub,reddit,What instantly makes someone unlikable?,,2025-04-12 21:33:18,AskReddit,AskReddit,news,News,[],0,34,208,,0.73,https://www.reddit.com/r/AskReddit/comments/1jxrzub/what_instantly_makes_someone_unlikable/,eagle0088
1jwxvsp,reddit,"Any crime you commit in the next 24 hours will have no punishment. If someone catches you while committing the crime they will just let you continue. This only for you, what are you doing?",,2025-04-11 19:08:16,AskReddit,AskReddit,news,News,[],0,38,371,,0.62,https://www.reddit.com/r/AskReddit/comments/1jwxvsp/any_crime_you_commit_in_the_next_24_hours_will/,Neither_Drawing_241
1jwuxyz,reddit,[Serious] What is the weirdest thing you own?,,2025-04-11 17:05:17,AskReddit,AskReddit,news,News,[],0,37,240,,0.91,https://www.reddit.com/r/AskReddit/comments/1jwuxyz/serious_what_is_the_weirdest_thing_you_own/,UnusualAxolotl
1jpl9h2,reddit,If you could describe your ex by emoji’s only what would you use?,,2025-04-02 10:24:59,AskReddit,AskReddit,news,News,[],0,36,261,,0.76,https://www.reddit.com/r/AskReddit/comments/1jpl9h2/if_you_could_describe_your_ex_by_emojis_only_what/,Active_One_7256
1k554n5,reddit,Why do you use reddit?,,2025-04-22 12:32:02,AskReddit,AskReddit,news,News,[],0,39,215,,0.78,https://www.reddit.com/r/AskReddit/comments/1k554n5/why_do_you_use_reddit/,inuki1
1k2wzmn,reddit,What's something you find unattractive that others think is attractive?,,2025-04-19 14:04:03,AskReddit,AskReddit,news,News,[],0,40,283,,0.82,https://www.reddit.com/r/AskReddit/comments/1k2wzmn/whats_something_you_find_unattractive_that_others/,BrokiMochi
1jykjxl,reddit,What was the most shocking thing moving out thought you?,,2025-04-13 23:03:20,AskReddit,AskReddit,news,News,[],0,37,41,,0.8,https://www.reddit.com/r/AskReddit/comments/1jykjxl/what_was_the_most_shocking_thing_moving_out/,aiudknoNowuknow
1jxmbri,reddit,What’s the most embarrassing thing you’ve done to impress a crush that totally backfired?,,2025-04-12 17:17:39,AskReddit,AskReddit,news,News,[],0,36,63,,0.85,https://www.reddit.com/r/AskReddit/comments/1jxmbri/whats_the_most_embarrassing_thing_youve_done_to/,Sanchit823
1jua0uo,reddit,What is the song that instantly puts you in a good mood?,,2025-04-08 10:10:09,AskReddit,AskReddit,news,News,[],0,38,142,,0.87,https://www.reddit.com/r/AskReddit/comments/1jua0uo/what_is_the_song_that_instantly_puts_you_in_a/,Educational_Fix_7182
1jst5cy,reddit,What is your all time favourite comedy movie?,,2025-04-06 12:37:09,AskReddit,AskReddit,news,News,[],0,39,137,,0.9,https://www.reddit.com/r/AskReddit/comments/1jst5cy/what_is_your_all_time_favourite_comedy_movie/,Glittering-Okr
1js3fz8,reddit,What was your biggest waste of time in your life?,,2025-04-05 13:27:40,AskReddit,AskReddit,news,News,[],0,34,148,,0.84,https://www.reddit.com/r/AskReddit/comments/1js3fz8/what_was_your_biggest_waste_of_time_in_your_life/,Difficult-Nose-1064
1js29ya,reddit,What's the most beautiful feeling in the world?,,2025-04-05 12:25:09,AskReddit,AskReddit,news,News,[],0,37,126,,0.94,https://www.reddit.com/r/AskReddit/comments/1js29ya/whats_the_most_beautiful_feeling_in_the_world/,Chasing_Brave1993
1jqhg00,reddit,"Redditors, what are the most unbelievable incidents that you have ever witnessed?",,2025-04-03 12:43:55,AskReddit,AskReddit,news,News,[],0,37,77,,0.85,https://www.reddit.com/r/AskReddit/comments/1jqhg00/redditors_what_are_the_most_unbelievable/,d3pressedp1eceofshit
1jkc84i,reddit,"People who start dating after 35 NOT on apps, how did you meet and become a couple?",,2025-03-26 13:50:05,AskReddit,AskReddit,news,News,[],0,38,53,,0.83,https://www.reddit.com/r/AskReddit/comments/1jkc84i/people_who_start_dating_after_35_not_on_apps_how/,thejasonreagan
1k6h1q9,reddit,What is a song that would be so much weirder if the lyrics were taken completely literally?,,2025-04-24 02:15:31,AskReddit,AskReddit,news,News,[],0,37,65,,0.88,https://www.reddit.com/r/AskReddit/comments/1k6h1q9/what_is_a_song_that_would_be_so_much_weirder_if/,Silver012345673
1k3d9dy,reddit,What can you not forget about your ex?,,2025-04-20 03:11:49,AskReddit,AskReddit,news,News,[],0,34,256,,0.75,https://www.reddit.com/r/AskReddit/comments/1k3d9dy/what_can_you_not_forget_about_your_ex/,TouchSad1201
1k1neeu,reddit,What’s something you believe is an instant turn off?,,2025-04-17 20:51:59,AskReddit,AskReddit,news,News,[],0,38,267,,0.85,https://www.reddit.com/r/AskReddit/comments/1k1neeu/whats_something_you_believe_is_an_instant_turn_off/,N/A
1jzaxhr,reddit,"If a set of doctors from any TV show had to treat you for a serious illness, which show are you choosing?",,2025-04-14 21:44:34,AskReddit,AskReddit,news,News,[],0,37,143,,0.85,https://www.reddit.com/r/AskReddit/comments/1jzaxhr/if_a_set_of_doctors_from_any_tv_show_had_to_treat/,Bobrossnumber1fan
1jz7lat,reddit,What would be the weirdest thing to say before you die?,,2025-04-14 19:26:49,AskReddit,AskReddit,news,News,[],0,35,161,,0.88,https://www.reddit.com/r/AskReddit/comments/1jz7lat/what_would_be_the_weirdest_thing_to_say_before/,HealthyDay7190
1jy59ml,reddit,Who's the best manipulator in the history of mankind?,,2025-04-13 11:10:14,AskReddit,AskReddit,news,News,[],0,37,166,,0.77,https://www.reddit.com/r/AskReddit/comments/1jy59ml/whos_the_best_manipulator_in_the_history_of/,aintyourbaegirl
1jwgefk,reddit,What's on your bedside table right now?,,2025-04-11 03:22:41,AskReddit,AskReddit,news,News,[],0,37,297,,0.88,https://www.reddit.com/r/AskReddit/comments/1jwgefk/whats_on_your_bedside_table_right_now/,KleverBanana
1ju04ha,reddit,"Movie Theater Workers, what are the craziest things you've seen at/ left at the theater?",,2025-04-07 23:57:38,AskReddit,AskReddit,news,News,[],0,36,76,,0.71,https://www.reddit.com/r/AskReddit/comments/1ju04ha/movie_theater_workers_what_are_the_craziest/,AwesomeX0875
1jtqqv0,reddit,"If you could erase one painfully embarrassing moment from your personal cringe compilation, which one’s getting deleted?",,2025-04-07 17:19:41,AskReddit,AskReddit,news,News,[],0,32,21,,0.83,https://www.reddit.com/r/AskReddit/comments/1jtqqv0/if_you_could_erase_one_painfully_embarrassing/,Mr_StNorman
1jsojqd,reddit,"Airport security of reddit, what’s the weirdest thing you’ve found in someone’s luggage ?",,2025-04-06 07:20:24,AskReddit,AskReddit,news,News,[],0,36,32,,0.93,https://www.reddit.com/r/AskReddit/comments/1jsojqd/airport_security_of_reddit_whats_the_weirdest/,MaleficentPost4527
1jqxefc,reddit,"Fashion designers of reddit, if an old lady made a dress out a hundred Dalmatian puppies what would the actual response of the fashion community as a whole?",,2025-04-03 23:19:01,AskReddit,AskReddit,news,News,[],0,33,16,,0.87,https://www.reddit.com/r/AskReddit/comments/1jqxefc/fashion_designers_of_reddit_if_an_old_lady_made_a/,AnimeEagleScout
1jlcgqf,reddit,What was the moment you knew you had to quit your job?,,2025-03-27 20:16:50,AskReddit,AskReddit,news,News,[],0,34,68,,0.93,https://www.reddit.com/r/AskReddit/comments/1jlcgqf/what_was_the_moment_you_knew_you_had_to_quit_your/,Special_Positive6771
1jk8z6s,reddit,What instantly makes someone a better partner?,,2025-03-26 10:53:45,AskReddit,AskReddit,news,News,[],0,36,56,,0.9,https://www.reddit.com/r/AskReddit/comments/1jk8z6s/what_instantly_makes_someone_a_better_partner/,PM-your-lovely-tits
1k6sfsb,reddit,"[Serious] What supplements have actually worked for you and made a real, noticeable difference?",,2025-04-24 13:38:31,AskReddit,AskReddit,news,News,[],0,34,193,,0.76,https://www.reddit.com/r/AskReddit/comments/1k6sfsb/serious_what_supplements_have_actually_worked_for/,Thegratefu1one
1k6pkjc,reddit,"What 'normal' thing in everyday life makes you anxious, even though most people aren't affected by it?",,2025-04-24 11:12:47,AskReddit,AskReddit,news,News,[],0,39,141,,0.9,https://www.reddit.com/r/AskReddit/comments/1k6pkjc/what_normal_thing_in_everyday_life_makes_you/,azucarmore21
1k65u6u,reddit,what’s your favorite thing about your significant other?,,2025-04-23 18:01:01,AskReddit,AskReddit,news,News,[],0,34,174,,0.84,https://www.reddit.com/r/AskReddit/comments/1k65u6u/whats_your_favorite_thing_about_your_significant/,ky1iehope
1k5t9a1,reddit,What song makes you feel badass?,,2025-04-23 07:26:51,AskReddit,AskReddit,news,News,[],0,36,159,,0.92,https://www.reddit.com/r/AskReddit/comments/1k5t9a1/what_song_makes_you_feel_badass/,bestfirstdate
1k0u5fn,reddit,How important is music to your life?,,2025-04-16 20:11:11,AskReddit,AskReddit,news,News,[],0,36,76,,0.86,https://www.reddit.com/r/AskReddit/comments/1k0u5fn/how_important_is_music_to_your_life/,kamasushi
1k04sqp,reddit,What advice would you give someone turning 30?,,2025-04-15 22:20:29,AskReddit,AskReddit,news,News,[],0,39,149,,0.91,https://www.reddit.com/r/AskReddit/comments/1k04sqp/what_advice_would_you_give_someone_turning_30/,Georgiaabrookee
1jx4kaq,reddit,What's one thing that makes you feel old?,,2025-04-12 00:11:43,AskReddit,AskReddit,news,News,[],0,33,266,,0.89,https://www.reddit.com/r/AskReddit/comments/1jx4kaq/whats_one_thing_that_makes_you_feel_old/,alexaclaire1013
1jtzosm,reddit,Why aren’t you sleeping right now?,,2025-04-07 23:36:33,AskReddit,AskReddit,news,News,[],0,36,271,,0.74,https://www.reddit.com/r/AskReddit/comments/1jtzosm/why_arent_you_sleeping_right_now/,N/A
1js8i65,reddit,What is your favorite compliment you’ve ever received ?,,2025-04-05 17:19:53,AskReddit,AskReddit,news,News,[],0,37,145,,0.96,https://www.reddit.com/r/AskReddit/comments/1js8i65/what_is_your_favorite_compliment_youve_ever/,yourredlipstickx0
1jrqvqc,reddit,"What's your 'fuck yeah, life is great' song?",,2025-04-05 00:20:32,AskReddit,AskReddit,news,News,[],0,37,135,,0.89,https://www.reddit.com/r/AskReddit/comments/1jrqvqc/whats_your_fuck_yeah_life_is_great_song/,iloveburritosmore
1jq24rl,reddit,Who is your favourite music artist?,,2025-04-02 22:41:36,AskReddit,AskReddit,news,News,[],0,39,274,,0.92,https://www.reddit.com/r/AskReddit/comments/1jq24rl/who_is_your_favourite_music_artist/,LKagero
1jlul2a,reddit,What awesome plans do you have for summer?,,2025-03-28 13:04:06,AskReddit,AskReddit,news,News,[],0,39,54,,0.9,https://www.reddit.com/r/AskReddit/comments/1jlul2a/what_awesome_plans_do_you_have_for_summer/,F0r3st_L0v3
1jl4ofk,reddit,What is the one show that you watch whenever you need an escape?,,2025-03-27 14:05:28,AskReddit,AskReddit,news,News,[],0,31,250,,0.83,https://www.reddit.com/r/AskReddit/comments/1jl4ofk/what_is_the_one_show_that_you_watch_whenever_you/,mischa_996
1jkpckl,reddit,Is being an adult really as hard as people say? How do you feel about being an adult?,,2025-03-26 23:00:18,AskReddit,AskReddit,news,News,[],0,34,173,,0.78,https://www.reddit.com/r/AskReddit/comments/1jkpckl/is_being_an_adult_really_as_hard_as_people_say/,Kinellee
1k5m63s,reddit,Who do you miss the most Right now?,,2025-04-23 00:34:37,AskReddit,AskReddit,news,News,[],0,32,161,,0.86,https://www.reddit.com/r/AskReddit/comments/1k5m63s/who_do_you_miss_the_most_right_now/,lonelyblood_
1k5bolh,reddit,What is the most unusual thing that turns you on?,,2025-04-22 17:10:19,AskReddit,AskReddit,news,News,[],0,37,191,,0.78,https://www.reddit.com/r/AskReddit/comments/1k5bolh/what_is_the_most_unusual_thing_that_turns_you_on/,CaughtinRain
1k4im6s,reddit,Which is your favorite song?,,2025-04-21 17:05:21,AskReddit,AskReddit,news,News,[],0,33,129,,0.88,https://www.reddit.com/r/AskReddit/comments/1k4im6s/which_is_your_favorite_song/,Electronic-Length521
1k06q43,reddit,What’s something that’s harmless but looks suspicious?,,2025-04-15 23:50:37,AskReddit,AskReddit,news,News,[],0,31,90,,0.84,https://www.reddit.com/r/AskReddit/comments/1k06q43/whats_something_thats_harmless_but_looks/,Own-War9484
1jzpls0,reddit,What is a total turn off to you?,,2025-04-15 11:35:49,AskReddit,AskReddit,news,News,[],0,34,230,,0.82,https://www.reddit.com/r/AskReddit/comments/1jzpls0/what_is_a_total_turn_off_to_you/,Gifted-once
1jzhajg,reddit,What is your opinion on going with your partner to doctor’s visits and attending the appointment with them?,,2025-04-15 02:48:27,AskReddit,AskReddit,news,News,[],0,34,100,,0.83,https://www.reddit.com/r/AskReddit/comments/1jzhajg/what_is_your_opinion_on_going_with_your_partner/,Far-Bat2413
1jwlxju,reddit,What’s the most beautiful thing you've ever accidentally destroyed?,,2025-04-11 09:42:10,AskReddit,AskReddit,news,News,[],0,34,91,,0.84,https://www.reddit.com/r/AskReddit/comments/1jwlxju/whats_the_most_beautiful_thing_youve_ever/,ListenJaded6449
1jvat92,reddit,What’s a food you’ve never tried—and never will? Why?,,2025-04-09 17:00:30,AskReddit,AskReddit,news,News,[],0,34,387,,0.96,https://www.reddit.com/r/AskReddit/comments/1jvat92/whats_a_food_youve_never_triedand_never_will_why/,inthe801
1jrcrag,reddit,What’s advice you would give someone in their 20s?,,2025-04-04 14:08:02,AskReddit,AskReddit,news,News,[],0,32,105,,0.88,https://www.reddit.com/r/AskReddit/comments/1jrcrag/whats_advice_you_would_give_someone_in_their_20s/,N/A
1jqyirp,reddit,What’s something you wish people understood better about depression?,,2025-04-04 00:11:17,AskReddit,AskReddit,news,News,[],0,33,148,,0.93,https://www.reddit.com/r/AskReddit/comments/1jqyirp/whats_something_you_wish_people_understood_better/,N/A
1jmehws,reddit,What’s something that would vastly improve your mental health?,,2025-03-29 04:30:44,AskReddit,AskReddit,news,News,[],0,36,240,,0.9,https://www.reddit.com/r/AskReddit/comments/1jmehws/whats_something_that_would_vastly_improve_your/,NickWildeSimp1
1jkfb47,reddit,If You Could Go Back to 18 What Would You Do Differently?,,2025-03-26 16:03:13,AskReddit,AskReddit,news,News,[],0,34,254,,0.86,https://www.reddit.com/r/AskReddit/comments/1jkfb47/if_you_could_go_back_to_18_what_would_you_do/,LegRepresentative649
1k77i2j,reddit,What is one mental health tip that actually worked for you?,,2025-04-25 00:12:34,AskReddit,AskReddit,news,News,[],0,150,362,,0.94,https://www.reddit.com/r/AskReddit/comments/1k77i2j/what_is_one_mental_health_tip_that_actually/,szampans
1k6qizp,reddit,What are you really looking forward to for today?,,2025-04-24 12:06:31,AskReddit,AskReddit,news,News,[],0,38,200,,0.93,https://www.reddit.com/r/AskReddit/comments/1k6qizp/what_are_you_really_looking_forward_to_for_today/,Hydrated_and_Happy
1k4ifn7,reddit,What kind of car seems to always have a bad driver on the roads?,,2025-04-21 16:58:35,AskReddit,AskReddit,news,News,[],0,31,276,,0.78,https://www.reddit.com/r/AskReddit/comments/1k4ifn7/what_kind_of_car_seems_to_always_have_a_bad/,AngleRelative4683
1k3ixli,reddit,What is something strange that is completely normalised?,,2025-04-20 09:37:03,AskReddit,AskReddit,news,News,[],0,35,155,,0.82,https://www.reddit.com/r/AskReddit/comments/1k3ixli/what_is_something_strange_that_is_completely/,Camtheketchupman
