content_id,platform,title,content,created_at,source_id,source_name,category_id,category_name,tags,views,score,comment_count,duration,upvote_ratio,url,author
1jnkl7o,reddit,"People from America, what's something Europeans do that seems weird to you?",,2025-03-30 19:37:35,AskReddit,AskReddit,news,News,[],0,247,1728,,0.75,https://www.reddit.com/r/AskReddit/comments/1jnkl7o/people_from_america_whats_something_europeans_do/,blinkz_221B
1juwdzv,reddit,"People who don't procrastinate, what's your secret?",,2025-04-09 03:27:34,AskReddit,AskReddit,news,News,[],0,247,325,,0.95,https://www.reddit.com/r/AskReddit/comments/1juwdzv/people_who_dont_procrastinate_whats_your_secret/,OverBurntEggs
1jq3ogp,reddit,What was the most physically painful thing you've experienced?,,2025-04-02 23:50:48,AskReddit,AskReddit,news,News,[],0,242,1623,,0.95,https://www.reddit.com/r/AskReddit/comments/1jq3ogp/what_was_the_most_physically_painful_thing_youve/,porygon766
1jygz7h,reddit,What is the most beautiful song you ever heard?,,2025-04-13 20:18:34,AskReddit,AskReddit,news,News,[],0,242,791,,0.97,https://www.reddit.com/r/AskReddit/comments/1jygz7h/what_is_the_most_beautiful_song_you_ever_heard/,crno123
1jy8myr,reddit,"What’s a job you’d never do, no matter how much they paid you?",,2025-04-13 14:16:02,AskReddit,AskReddit,news,News,[],0,240,1049,,0.88,https://www.reddit.com/r/AskReddit/comments/1jy8myr/whats_a_job_youd_never_do_no_matter_how_much_they/,Gombos11
1jx7xt2,reddit,"Math teachers from before cell phones, how do feel now that everyone actually does walk around with a calculator in their pocket?",,2025-04-12 03:16:05,AskReddit,AskReddit,news,News,[],0,243,232,,0.77,https://www.reddit.com/r/AskReddit/comments/1jx7xt2/math_teachers_from_before_cell_phones_how_do_feel/,TheRealMalooficent
1jt8vl7,reddit,"If you were told you had cancer, what would your immediate reaction be?",,2025-04-07 00:38:51,AskReddit,AskReddit,news,News,[],0,239,1188,,0.89,https://www.reddit.com/r/AskReddit/comments/1jt8vl7/if_you_were_told_you_had_cancer_what_would_your/,ittybittykangaroo
1jn98h9,reddit,How often do you do something else than what you were thinking?,,2025-03-30 10:01:26,AskReddit,AskReddit,news,News,[],0,241,71,,0.93,https://www.reddit.com/r/AskReddit/comments/1jn98h9/how_often_do_you_do_something_else_than_what_you/,artful_menace
1jrrk1f,reddit,What is your favorite harmless fib to tell kids?,,2025-04-05 00:55:36,AskReddit,AskReddit,news,News,[],0,238,288,,0.83,https://www.reddit.com/r/AskReddit/comments/1jrrk1f/what_is_your_favorite_harmless_fib_to_tell_kids/,N/A
1jvubxi,reddit,What’s a common phrase that irritates the hell out of you?,,2025-04-10 10:08:23,AskReddit,AskReddit,news,News,[],0,232,1833,,0.89,https://www.reddit.com/r/AskReddit/comments/1jvubxi/whats_a_common_phrase_that_irritates_the_hell_out/,elizabubblehead
1k43vfp,reddit,What's movie scared the crap out of you as a kid?,,2025-04-21 03:19:09,AskReddit,AskReddit,news,News,[],0,234,1183,,0.94,https://www.reddit.com/r/AskReddit/comments/1k43vfp/whats_movie_scared_the_crap_out_of_you_as_a_kid/,SinkFar5694
1jpw3mr,reddit,"When you were little, what did you want to be when you grew up?",,2025-04-02 18:34:11,AskReddit,AskReddit,news,News,[],0,233,1258,,0.94,https://www.reddit.com/r/AskReddit/comments/1jpw3mr/when_you_were_little_what_did_you_want_to_be_when/,chicahot543
1jy1xid,reddit,whats a sign that tells you someone is a good person before you get to know them?,,2025-04-13 07:08:24,AskReddit,AskReddit,news,News,[],0,233,137,,0.9,https://www.reddit.com/r/AskReddit/comments/1jy1xid/whats_a_sign_that_tells_you_someone_is_a_good/,Weak-Ad945
1jx85op,reddit,What do you say after sex?,,2025-04-12 03:29:06,AskReddit,AskReddit,news,News,[],0,226,1406,,0.73,https://www.reddit.com/r/AskReddit/comments/1jx85op/what_do_you_say_after_sex/,MoneyMunk27
1k0k9q2,reddit,Which public figure receives more hate than they deserve?,,2025-04-16 13:20:55,AskReddit,AskReddit,news,News,[],0,225,919,,0.78,https://www.reddit.com/r/AskReddit/comments/1k0k9q2/which_public_figure_receives_more_hate_than_they/,Nade17
1jwu9ff,reddit,If you won the lottery who should you tell first?,,2025-04-11 16:37:03,AskReddit,AskReddit,news,News,[],0,226,908,,0.85,https://www.reddit.com/r/AskReddit/comments/1jwu9ff/if_you_won_the_lottery_who_should_you_tell_first/,KinkyArtemis
1jp8e3y,reddit,What is the funniest insult you’ve ever heard?,,2025-04-01 22:10:07,AskReddit,AskReddit,news,News,[],0,230,488,,0.94,https://www.reddit.com/r/AskReddit/comments/1jp8e3y/what_is_the_funniest_insult_youve_ever_heard/,Mikey463
1jkpl65,reddit,What is the worst experience you’ve had with a doctor?,,2025-03-26 23:10:30,AskReddit,AskReddit,news,News,[],0,228,832,,0.86,https://www.reddit.com/r/AskReddit/comments/1jkpl65/what_is_the_worst_experience_youve_had_with_a/,8583739buttholes
1jz6hrd,reddit,What’s something that instantly brings you to tears?,,2025-04-14 18:43:30,AskReddit,AskReddit,news,News,[],0,224,669,,0.94,https://www.reddit.com/r/AskReddit/comments/1jz6hrd/whats_something_that_instantly_brings_you_to_tears/,Same-Paper-4542
1jsfclj,reddit,What is a technology you saw the rise and fall of in your lifetime?,,2025-04-05 22:24:05,AskReddit,AskReddit,news,News,[],0,225,1177,,0.94,https://www.reddit.com/r/AskReddit/comments/1jsfclj/what_is_a_technology_you_saw_the_rise_and_fall_of/,rindedflorist
1jpbfth,reddit,What's something that sounds nice but is secretly insulting?,,2025-04-02 00:27:08,AskReddit,AskReddit,news,News,[],0,216,327,,0.95,https://www.reddit.com/r/AskReddit/comments/1jpbfth/whats_something_that_sounds_nice_but_is_secretly/,brucedbat
1jnbh64,reddit,"If humans suddenly had the ability to teleport, how would society change in the first 5 years?",,2025-03-30 12:35:57,AskReddit,AskReddit,news,News,[],0,217,811,,0.89,https://www.reddit.com/r/AskReddit/comments/1jnbh64/if_humans_suddenly_had_the_ability_to_teleport/,Brief-Bottle1296
1jlmd3t,reddit,What is your telltale sign that you are definitely getting sick?,,2025-03-28 03:52:38,AskReddit,AskReddit,news,News,[],0,220,1222,,0.93,https://www.reddit.com/r/AskReddit/comments/1jlmd3t/what_is_your_telltale_sign_that_you_are/,whokilledkenney
1jq543s,reddit,How did you come up with your username?,,2025-04-03 00:58:43,AskReddit,AskReddit,news,News,[],0,222,1583,,0.89,https://www.reddit.com/r/AskReddit/comments/1jq543s/how_did_you_come_up_with_your_username/,irkybirky
1k3pfx5,reddit,"What was your ""I don't get paid enough for this shit"" moment?",,2025-04-20 15:45:11,AskReddit,AskReddit,news,News,[],0,215,309,,0.93,https://www.reddit.com/r/AskReddit/comments/1k3pfx5/what_was_your_i_dont_get_paid_enough_for_this/,FreezingWheezer
1k0pnmp,reddit,"You win the lottery, what is the first ridiculous thing you're buying?",,2025-04-16 17:08:35,AskReddit,AskReddit,news,News,[],0,215,855,,0.89,https://www.reddit.com/r/AskReddit/comments/1k0pnmp/you_win_the_lottery_what_is_the_first_ridiculous/,Just_a_Ginger_Fella
1jy4eed,reddit,What is something you found out later in life that you wish you knew much earlier in life?,,2025-04-13 10:09:47,AskReddit,AskReddit,news,News,[],0,215,309,,0.94,https://www.reddit.com/r/AskReddit/comments/1jy4eed/what_is_something_you_found_out_later_in_life/,Mean_Tea3808
1jxp3vv,reddit,What’s something you miss that doesn’t exist anymore?,,2025-04-12 19:20:24,AskReddit,AskReddit,news,News,[],0,216,683,,0.94,https://www.reddit.com/r/AskReddit/comments/1jxp3vv/whats_something_you_miss_that_doesnt_exist_anymore/,Wooden_Lock_1544
1k22tnh,reddit,Which job do you think is the most undervalued in society?,,2025-04-18 11:39:14,AskReddit,AskReddit,news,News,[],0,214,483,,0.91,https://www.reddit.com/r/AskReddit/comments/1k22tnh/which_job_do_you_think_is_the_most_undervalued_in/,Double_Tumbleweed414
1jvy89i,reddit,What’s something you secretly liked about quarantine?,,2025-04-10 13:43:15,AskReddit,AskReddit,news,News,[],0,213,980,,0.93,https://www.reddit.com/r/AskReddit/comments/1jvy89i/whats_something_you_secretly_liked_about/,BreadedDisaster
1jmxgzj,reddit,What’s a name that instantly makes someone seem more attractive?,,2025-03-29 22:03:11,AskReddit,AskReddit,news,News,[],0,210,644,,0.74,https://www.reddit.com/r/AskReddit/comments/1jmxgzj/whats_a_name_that_instantly_makes_someone_seem/,Unique-Necessary-888
1k56cgl,reddit,Which hero was 100% wrong?,,2025-04-22 13:30:03,AskReddit,AskReddit,news,News,[],0,206,627,,0.83,https://www.reddit.com/r/AskReddit/comments/1k56cgl/which_hero_was_100_wrong/,raidenjojo
1juayki,reddit,Whats something you only recently discovered about yourself?,,2025-04-08 11:10:52,AskReddit,AskReddit,news,News,[],0,203,199,,0.95,https://www.reddit.com/r/AskReddit/comments/1juayki/whats_something_you_only_recently_discovered/,DisastrousGuitar609
1jlslnq,reddit,"People who don’t pick up the phone if you call them back immediately after a missed call, why?",,2025-03-28 11:11:15,AskReddit,AskReddit,news,News,[],0,199,145,,0.78,https://www.reddit.com/r/AskReddit/comments/1jlslnq/people_who_dont_pick_up_the_phone_if_you_call/,frapefruit
1jvmv8r,reddit,For those who wake up at 6 am or earlier how you do it ?,,2025-04-10 01:58:55,AskReddit,AskReddit,news,News,[],0,201,1105,,0.91,https://www.reddit.com/r/AskReddit/comments/1jvmv8r/for_those_who_wake_up_at_6_am_or_earlier_how_you/,Brytong420
1jt4qxp,reddit,What do you wish you were doing now instead of being on reddit ?,,2025-04-06 21:16:29,AskReddit,AskReddit,news,News,[],0,199,865,,0.88,https://www.reddit.com/r/AskReddit/comments/1jt4qxp/what_do_you_wish_you_were_doing_now_instead_of/,mimo05best
1k472vx,reddit,what was the reason your last relationship ended?,,2025-04-21 06:43:40,AskReddit,AskReddit,news,News,[],0,202,559,,0.89,https://www.reddit.com/r/AskReddit/comments/1k472vx/what_was_the_reason_your_last_relationship_ended/,Small_Childhood7090
1k2k9de,reddit,Whats something that you think is underhated?,,2025-04-19 00:49:12,AskReddit,AskReddit,news,News,[],0,196,285,,0.9,https://www.reddit.com/r/AskReddit/comments/1k2k9de/whats_something_that_you_think_is_underhated/,EducationalTill2681
1k1eq4p,reddit,"Gym Goers, what did you learn about working out that you didn't know when you started?",,2025-04-17 14:51:48,AskReddit,AskReddit,news,News,[],0,200,270,,0.95,https://www.reddit.com/r/AskReddit/comments/1k1eq4p/gym_goers_what_did_you_learn_about_working_out/,OvertCinnamon
1jn0122,reddit,"If you were to die today, what would you be most disappointed about that you didnt get to see in your lifetime?",,2025-03-30 00:06:24,AskReddit,AskReddit,news,News,[],0,193,880,,0.91,https://www.reddit.com/r/AskReddit/comments/1jn0122/if_you_were_to_die_today_what_would_you_be_most/,MrMonkrat
1k37ax5,reddit,What’s with all the simple personal questions? Are we training AIs to recognize Reddit users?,,2025-04-19 21:51:36,AskReddit,AskReddit,news,News,[],0,191,77,,0.91,https://www.reddit.com/r/AskReddit/comments/1k37ax5/whats_with_all_the_simple_personal_questions_are/,Words4Play
1jn0v5y,reddit,What's the most interesting interaction you've had with a famous person?,,2025-03-30 00:48:55,AskReddit,AskReddit,news,News,[],0,192,731,,0.88,https://www.reddit.com/r/AskReddit/comments/1jn0v5y/whats_the_most_interesting_interaction_youve_had/,ReadWriteArithmetic
1k0zx94,reddit,[Serious] What's been the biggest blow to your mental health recently? How are you doing?,,2025-04-17 00:31:03,AskReddit,AskReddit,news,News,[],0,191,628,,0.89,https://www.reddit.com/r/AskReddit/comments/1k0zx94/serious_whats_been_the_biggest_blow_to_your/,KiwiNervous8740
1jtrp94,reddit,What's a parenting mistake that your parents made which you will never repeat with your kids?,,2025-04-07 17:58:21,AskReddit,AskReddit,news,News,[],0,190,778,,0.94,https://www.reddit.com/r/AskReddit/comments/1jtrp94/whats_a_parenting_mistake_that_your_parents_made/,BlahBlahBlah_3748
1jwm6gr,reddit,What is the weirdest thing your brain has ever done without your permission?,,2025-04-11 09:59:50,AskReddit,AskReddit,news,News,[],0,190,372,,0.91,https://www.reddit.com/r/AskReddit/comments/1jwm6gr/what_is_the_weirdest_thing_your_brain_has_ever/,N/A
1jmkbyj,reddit,What was your first cartoon crush?,,2025-03-29 11:35:09,AskReddit,AskReddit,news,News,[],0,193,848,,0.89,https://www.reddit.com/r/AskReddit/comments/1jmkbyj/what_was_your_first_cartoon_crush/,opa1288
1jujq0i,reddit,What’s something totally normal that creeps you out?,,2025-04-08 17:46:27,AskReddit,AskReddit,news,News,[],0,189,667,,0.96,https://www.reddit.com/r/AskReddit/comments/1jujq0i/whats_something_totally_normal_that_creeps_you_out/,w1se3
1ju556b,reddit,What band is your favorite at the moment?,,2025-04-08 04:23:27,AskReddit,AskReddit,news,News,[],0,190,999,,0.93,https://www.reddit.com/r/AskReddit/comments/1ju556b/what_band_is_your_favorite_at_the_moment/,HandleMaster3248
1k31n3h,reddit,What do you regret doing in life?,,2025-04-19 17:32:08,AskReddit,AskReddit,news,News,[],0,188,644,,0.95,https://www.reddit.com/r/AskReddit/comments/1k31n3h/what_do_you_regret_doing_in_life/,OkSignificance1396
1jw6cxe,reddit,What's the question you found on the sub and it really deeply moved you ?,,2025-04-10 19:24:15,AskReddit,AskReddit,news,News,[],0,184,56,,0.92,https://www.reddit.com/r/AskReddit/comments/1jw6cxe/whats_the_question_you_found_on_the_sub_and_it/,BobbeDev
1jmdh3e,reddit,"What's something you ate once, liked it, but won't be having again and why?",,2025-03-29 03:29:22,AskReddit,AskReddit,news,News,[],0,188,227,,0.95,https://www.reddit.com/r/AskReddit/comments/1jmdh3e/whats_something_you_ate_once_liked_it_but_wont_be/,Pokeking44
1k26u2f,reddit,What is the one quote you live by?,,2025-04-18 14:52:43,AskReddit,AskReddit,news,News,[],0,187,1145,,0.95,https://www.reddit.com/r/AskReddit/comments/1k26u2f/what_is_the_one_quote_you_live_by/,CaterpillarOne3501
1jpq65e,reddit,What is the most underrated pleasure in everyday life that most people tend to overlook?,,2025-04-02 14:37:35,AskReddit,AskReddit,news,News,[],0,187,562,,0.96,https://www.reddit.com/r/AskReddit/comments/1jpq65e/what_is_the_most_underrated_pleasure_in_everyday/,Unlikely_Bid8892
1jrwqz7,reddit,What free things online should everyone take advantage of?,,2025-04-05 05:59:21,AskReddit,AskReddit,news,News,[],0,185,108,,0.94,https://www.reddit.com/r/AskReddit/comments/1jrwqz7/what_free_things_online_should_everyone_take/,Tricky-Kangaroo-6782
1joshhg,reddit,Who was just the best human being in history?,,2025-04-01 10:40:18,AskReddit,AskReddit,news,News,[],0,182,754,,0.77,https://www.reddit.com/r/AskReddit/comments/1joshhg/who_was_just_the_best_human_being_in_history/,castlite
1k0wvkq,reddit,What’s the most embarrassing schoolboy mentality you’ve seen from an adult?,,2025-04-16 22:06:32,AskReddit,AskReddit,news,News,[],0,183,311,,0.81,https://www.reddit.com/r/AskReddit/comments/1k0wvkq/whats_the_most_embarrassing_schoolboy_mentality/,Specialist-Love-2398
1jrnzis,reddit,Do you want to be buried or cremated? And why?,,2025-04-04 22:02:04,AskReddit,AskReddit,news,News,[],0,184,1513,,0.91,https://www.reddit.com/r/AskReddit/comments/1jrnzis/do_you_want_to_be_buried_or_cremated_and_why/,N/A
1jpwj8y,reddit,What is something people find weird/cringe or disgusting but you find attractive?,,2025-04-02 18:51:57,AskReddit,AskReddit,news,News,[],0,177,465,,0.84,https://www.reddit.com/r/AskReddit/comments/1jpwj8y/what_is_something_people_find_weirdcringe_or/,ptwis
1k5ef3o,reddit,What’s something you saw “just once” and think about all the time?,,2025-04-22 18:58:31,AskReddit,AskReddit,news,News,[],0,175,394,,0.94,https://www.reddit.com/r/AskReddit/comments/1k5ef3o/whats_something_you_saw_just_once_and_think_about/,utatumfinley
1k0tw9m,reddit,What’s your favourite word to use instead of a curse word?,,2025-04-16 20:00:58,AskReddit,AskReddit,news,News,[],0,180,1053,,0.91,https://www.reddit.com/r/AskReddit/comments/1k0tw9m/whats_your_favourite_word_to_use_instead_of_a/,Prestigious-Dark5257
1jxupzo,reddit,What’s something you’ve said that immediately made you want to disappear?,,2025-04-12 23:48:59,AskReddit,AskReddit,news,News,[],0,175,96,,0.96,https://www.reddit.com/r/AskReddit/comments/1jxupzo/whats_something_youve_said_that_immediately_made/,VelvetShocked
1julsth,reddit,What keeps you going when life gets tough?,,2025-04-08 19:09:53,AskReddit,AskReddit,news,News,[],0,171,534,,0.94,https://www.reddit.com/r/AskReddit/comments/1julsth/what_keeps_you_going_when_life_gets_tough/,endlessshampoo
1k2mof6,reddit,What's the funniest insult you've used/heard?,,2025-04-19 03:01:46,AskReddit,AskReddit,news,News,[],0,172,385,,0.94,https://www.reddit.com/r/AskReddit/comments/1k2mof6/whats_the_funniest_insult_youve_usedheard/,qwertypwerty2028
1k2ilv9,reddit,What is a food that you hate but people love?,,2025-04-18 23:23:29,AskReddit,AskReddit,news,News,[],0,172,1847,,0.85,https://www.reddit.com/r/AskReddit/comments/1k2ilv9/what_is_a_food_that_you_hate_but_people_love/,willyyy_y
1k1olzg,reddit,What's something completely legal that makes you look insanely suspicious while doing it?,,2025-04-17 21:44:36,AskReddit,AskReddit,news,News,[],0,168,363,,0.87,https://www.reddit.com/r/AskReddit/comments/1k1olzg/whats_something_completely_legal_that_makes_you/,Creative_Salt2450
1jqhbne,reddit,What shocked you the most when doing your taxes for the first time?,,2025-04-03 12:38:19,AskReddit,AskReddit,news,News,[],0,171,252,,0.83,https://www.reddit.com/r/AskReddit/comments/1jqhbne/what_shocked_you_the_most_when_doing_your_taxes/,Adorable_Program_964
1joc4ge,reddit,What advice do you have for someone who’s about to turn 25?,,2025-03-31 19:42:48,AskReddit,AskReddit,news,News,[],0,172,514,,0.85,https://www.reddit.com/r/AskReddit/comments/1joc4ge/what_advice_do_you_have_for_someone_whos_about_to/,aamc531
1k03bz8,reddit,"People who remember life without Phones, how crazy is the world right now?",,2025-04-15 21:16:01,AskReddit,AskReddit,news,News,[],0,167,411,,0.88,https://www.reddit.com/r/AskReddit/comments/1k03bz8/people_who_remember_life_without_phones_how_crazy/,Any-Ask-3384
1ju71cd,reddit,"Redditors who do not give a fuck, how do you do it?",,2025-04-08 06:26:58,AskReddit,AskReddit,news,News,[],0,170,502,,0.93,https://www.reddit.com/r/AskReddit/comments/1ju71cd/redditors_who_do_not_give_a_fuck_how_do_you_do_it/,thekill78
1jy9dqs,reddit,What personalities do you typically stay away from?,,2025-04-13 14:50:13,AskReddit,AskReddit,news,News,[],0,167,655,,0.93,https://www.reddit.com/r/AskReddit/comments/1jy9dqs/what_personalities_do_you_typically_stay_away_from/,Fun_Butterscotch3303
1jtpfj1,reddit,"Those who are getting over a heartbreak, what has helped you the most?",,2025-04-07 16:26:16,AskReddit,AskReddit,news,News,[],0,168,188,,0.96,https://www.reddit.com/r/AskReddit/comments/1jtpfj1/those_who_are_getting_over_a_heartbreak_what_has/,xuanisntverytall
1jx3e6r,reddit,What is something/somethings you pretend to like but actually hate and why you pretend?,,2025-04-11 23:12:39,AskReddit,AskReddit,news,News,[],0,167,88,,0.93,https://www.reddit.com/r/AskReddit/comments/1jx3e6r/what_is_somethingsomethings_you_pretend_to_like/,Pokeking44
1jrz0bw,reddit,How do you track your productivity?,,2025-04-05 08:39:51,AskReddit,AskReddit,news,News,[],0,164,27,,0.95,https://www.reddit.com/r/AskReddit/comments/1jrz0bw/how_do_you_track_your_productivity/,Lost_Measurement_635
1joo8qj,reddit,What tattoo screams “I have absolutely no creativity”?,,2025-04-01 05:33:08,AskReddit,AskReddit,news,News,[],0,166,869,,0.65,https://www.reddit.com/r/AskReddit/comments/1joo8qj/what_tattoo_screams_i_have_absolutely_no/,No-Slip69420
1k6g4jz,reddit,What is the best trick you’ve used to sleep?,,2025-04-24 01:29:14,AskReddit,AskReddit,news,News,[],0,167,452,,0.94,https://www.reddit.com/r/AskReddit/comments/1k6g4jz/what_is_the_best_trick_youve_used_to_sleep/,Totallycoolusername7
1k4be8y,reddit,"When you see yourself in the mirror, what's the first words crossed your mind?",,2025-04-21 11:39:54,AskReddit,AskReddit,news,News,[],0,167,739,,0.92,https://www.reddit.com/r/AskReddit/comments/1k4be8y/when_you_see_yourself_in_the_mirror_whats_the/,adreampoetgirl
1k0hqw9,reddit,What is a dead giveaway someone doesn't find you attractive?,,2025-04-16 11:08:43,AskReddit,AskReddit,news,News,[],0,162,151,,0.89,https://www.reddit.com/r/AskReddit/comments/1k0hqw9/what_is_a_dead_giveaway_someone_doesnt_find_you/,Immediate-Diet-8027
1k2j1lv,reddit,"What’s ugly, but deserves love?",,2025-04-18 23:45:40,AskReddit,AskReddit,news,News,[],0,159,472,,0.91,https://www.reddit.com/r/AskReddit/comments/1k2j1lv/whats_ugly_but_deserves_love/,Zdvj
1k3a9m9,reddit,What is the most embarrassing thing anyone has ever said to you during sex?,,2025-04-20 00:21:27,AskReddit,AskReddit,news,News,[],0,162,372,,0.76,https://www.reddit.com/r/AskReddit/comments/1k3a9m9/what_is_the_most_embarrassing_thing_anyone_has/,Ok_Grand_9696
1k55f08,reddit,What’s that one thing that is destroying you every day?,,2025-04-22 12:46:42,AskReddit,AskReddit,news,News,[],0,159,690,,0.93,https://www.reddit.com/r/AskReddit/comments/1k55f08/whats_that_one_thing_that_is_destroying_you_every/,Frequent-Draft-2477
1k44568,reddit,What do you call your partner other than their name?,,2025-04-21 03:34:22,AskReddit,AskReddit,news,News,[],0,157,531,,0.9,https://www.reddit.com/r/AskReddit/comments/1k44568/what_do_you_call_your_partner_other_than_their/,Lavender_hazee13
1k3eg20,reddit,What’s the best fast food brand in your opinion?,,2025-04-20 04:23:16,AskReddit,AskReddit,news,News,[],0,158,800,,0.75,https://www.reddit.com/r/AskReddit/comments/1k3eg20/whats_the_best_fast_food_brand_in_your_opinion/,Super-Elk3122
1k12cv0,reddit,What is something that you have beef with?,,2025-04-17 02:36:07,AskReddit,AskReddit,news,News,[],0,160,903,,0.94,https://www.reddit.com/r/AskReddit/comments/1k12cv0/what_is_something_that_you_have_beef_with/,Axe1910
1jo8sdg,reddit,What was the one experience that changed your life forever?,,2025-03-31 17:27:36,AskReddit,AskReddit,news,News,[],0,162,323,,0.92,https://www.reddit.com/r/AskReddit/comments/1jo8sdg/what_was_the_one_experience_that_changed_your/,N/A
1jv43wp,reddit,"What's a completely SFW (Safe For Work) thing that still feels weirdly intimate or ""naughty"" to do with/around someone else?",,2025-04-09 12:04:21,AskReddit,AskReddit,news,News,[],0,159,178,,0.82,https://www.reddit.com/r/AskReddit/comments/1jv43wp/whats_a_completely_sfw_safe_for_work_thing_that/,Budget_Pay1852
1ju9fb4,reddit,"Peoples of Reddit, what is something that you do in private that, if you told someone, would be considered weird?",,2025-04-08 09:27:52,AskReddit,AskReddit,news,News,[],0,156,251,,0.86,https://www.reddit.com/r/AskReddit/comments/1ju9fb4/peoples_of_reddit_what_is_something_that_you_do/,AlexThePixel
1jpk099,reddit,"What’s a small, innocent lie you told as a kid that spiraled out of control?",,2025-04-02 08:52:00,AskReddit,AskReddit,news,News,[],0,164,158,,0.92,https://www.reddit.com/r/AskReddit/comments/1jpk099/whats_a_small_innocent_lie_you_told_as_a_kid_that/,SugarSummerbliss
1k77nj4,reddit,What's the most shocking price increase you've seen at the supermarket lately?,,2025-04-25 00:20:05,AskReddit,AskReddit,news,News,[],0,1337,1552,,0.92,https://www.reddit.com/r/AskReddit/comments/1k77nj4/whats_the_most_shocking_price_increase_youve_seen/,Entity417
1k2u1ie,reddit,What made you realize you're not a kid anymore?,,2025-04-19 11:21:59,AskReddit,AskReddit,news,News,[],0,157,392,,0.95,https://www.reddit.com/r/AskReddit/comments/1k2u1ie/what_made_you_realize_youre_not_a_kid_anymore/,tyrion2024
1k1achl,reddit,What’s an insult you’ll never regret?,,2025-04-17 11:23:02,AskReddit,AskReddit,news,News,[],0,161,329,,0.92,https://www.reddit.com/r/AskReddit/comments/1k1achl/whats_an_insult_youll_never_regret/,Charming-Comfort-395
1jtawwv,reddit,You’re 16 again but retain all your current knowledge. What’s your first move?,,2025-04-07 02:30:09,AskReddit,AskReddit,news,News,[],0,158,565,,0.9,https://www.reddit.com/r/AskReddit/comments/1jtawwv/youre_16_again_but_retain_all_your_current/,NoNefariousness8839
1k53cst,reddit,What’s a “poor person’s life hack” that actually works?,,2025-04-22 10:53:34,AskReddit,AskReddit,news,News,[],0,160,190,,0.86,https://www.reddit.com/r/AskReddit/comments/1k53cst/whats_a_poor_persons_life_hack_that_actually_works/,Unique_Bag_4074
1k41369,reddit,What’s something you miss that no longer exists?,,2025-04-21 00:50:10,AskReddit,AskReddit,news,News,[],0,155,711,,0.95,https://www.reddit.com/r/AskReddit/comments/1k41369/whats_something_you_miss_that_no_longer_exists/,tutankhamunas
1jxhj8x,reddit,Are you happy as single and why?,,2025-04-12 13:39:53,AskReddit,AskReddit,news,News,[],0,153,430,,0.89,https://www.reddit.com/r/AskReddit/comments/1jxhj8x/are_you_happy_as_single_and_why/,Jane_Austen11
1k0vmq0,reddit,What is the best stripper name?,,2025-04-16 21:13:08,AskReddit,AskReddit,news,News,[],0,159,725,,0.75,https://www.reddit.com/r/AskReddit/comments/1k0vmq0/what_is_the_best_stripper_name/,Fair_Willingness8413
1jxozll,reddit,What will your final words be?,,2025-04-12 19:15:15,AskReddit,AskReddit,news,News,[],0,151,1022,,0.88,https://www.reddit.com/r/AskReddit/comments/1jxozll/what_will_your_final_words_be/,melatoningummies3000
1jmd6c8,reddit,You wake up tomorrow with Superman's powers. What will you do?,,2025-03-29 03:12:39,AskReddit,AskReddit,news,News,[],0,153,1380,,0.81,https://www.reddit.com/r/AskReddit/comments/1jmd6c8/you_wake_up_tomorrow_with_supermans_powers_what/,PJ-The-Awesome
1jnvjy2,reddit,"Has depression ever completely taken away your sex drive, leaving you basically asexual? And how did you make it get better?",,2025-03-31 04:54:34,AskReddit,AskReddit,news,News,[],0,152,69,,0.87,https://www.reddit.com/r/AskReddit/comments/1jnvjy2/has_depression_ever_completely_taken_away_your/,1993CobraSVT
