content_id,platform,title,content,created_at,source_id,source_name,category_id,category_name,tags,views,score,comment_count,duration,upvote_ratio,url,author
1jmo1aa,reddit,What's the worst insult you can give someone and why?,,2025-03-29 14:55:03,AskReddit,AskReddit,news,News,[],0,95,387,,0.9,https://www.reddit.com/r/AskReddit/comments/1jmo1aa/whats_the_worst_insult_you_can_give_someone_and/,Nervous-Inside-6624
1jlunr2,reddit,how did you know your relationship couldn't last?,,2025-03-28 13:07:52,AskReddit,AskReddit,news,News,[],0,92,202,,0.83,https://www.reddit.com/r/AskReddit/comments/1jlunr2/how_did_you_know_your_relationship_couldnt_last/,Secure_Bar_7519
1jyvigb,reddit,What is ridiculously expensive for what it is?,,2025-04-14 10:24:16,AskReddit,AskReddit,news,News,[],0,95,455,,0.83,https://www.reddit.com/r/AskReddit/comments/1jyvigb/what_is_ridiculously_expensive_for_what_it_is/,those-whoknowsknows
1jtm31f,reddit,What is your best/worst dream?,,2025-04-07 14:06:49,AskReddit,AskReddit,news,News,[],0,95,57,,0.96,https://www.reddit.com/r/AskReddit/comments/1jtm31f/what_is_your_bestworst_dream/,xThankYouFishx
1jvr1tl,reddit,"Reddit, what’s your greatest hack to fall asleep?",,2025-04-10 06:08:59,AskReddit,AskReddit,news,News,[],0,88,343,,0.88,https://www.reddit.com/r/AskReddit/comments/1jvr1tl/reddit_whats_your_greatest_hack_to_fall_asleep/,Next2ya
1jpr7k5,reddit,What does depression/being depressed feel like?,,2025-04-02 15:20:03,AskReddit,AskReddit,news,News,[],0,90,574,,0.84,https://www.reddit.com/r/AskReddit/comments/1jpr7k5/what_does_depressionbeing_depressed_feel_like/,WritingSouthern6126
1josckf,reddit,What’s a food combination you love but everyone else thinks is weird?,,2025-04-01 10:30:47,AskReddit,AskReddit,news,News,[],0,88,168,,0.93,https://www.reddit.com/r/AskReddit/comments/1josckf/whats_a_food_combination_you_love_but_everyone/,InstanceUsed3838
1k3rj1f,reddit,It is 4/20 and Easter. What’s your day look like?,,2025-04-20 17:18:16,AskReddit,AskReddit,news,News,[],0,92,354,,0.76,https://www.reddit.com/r/AskReddit/comments/1k3rj1f/it_is_420_and_easter_whats_your_day_look_like/,drumdude92
1jwzc68,reddit,What’s the first ever grown up movie you remember watching as a kid?,,2025-04-11 20:10:49,AskReddit,AskReddit,news,News,[],0,90,467,,0.96,https://www.reddit.com/r/AskReddit/comments/1jwzc68/whats_the_first_ever_grown_up_movie_you_remember/,Majoodeh
1joryf8,reddit,How do you get out of a lot of stress ?,,2025-04-01 10:03:57,AskReddit,AskReddit,news,News,[],0,91,57,,0.92,https://www.reddit.com/r/AskReddit/comments/1joryf8/how_do_you_get_out_of_a_lot_of_stress/,Ok-Meeting-8672
1jkpsec,reddit,What is something you regret not doing in your youth?,,2025-03-26 23:19:25,AskReddit,AskReddit,news,News,[],0,91,310,,0.92,https://www.reddit.com/r/AskReddit/comments/1jkpsec/what_is_something_you_regret_not_doing_in_your/,FriendlyStruggle7006
1jx3asu,reddit,What was the most obvious lie you believed as a kid?,,2025-04-11 23:08:05,AskReddit,AskReddit,news,News,[],0,88,395,,0.86,https://www.reddit.com/r/AskReddit/comments/1jx3asu/what_was_the_most_obvious_lie_you_believed_as_a/,Due_Pension_6368
1jpt2p1,reddit,What’s the hardest goodbye you’ve ever had to say?,,2025-04-02 16:35:58,AskReddit,AskReddit,news,News,[],0,87,369,,0.96,https://www.reddit.com/r/AskReddit/comments/1jpt2p1/whats_the_hardest_goodbye_youve_ever_had_to_say/,Living_Elderberry_43
1jofvur,reddit,What's some brutally honest advice everyone should hear?,,2025-03-31 22:17:57,AskReddit,AskReddit,news,News,[],0,89,228,,0.91,https://www.reddit.com/r/AskReddit/comments/1jofvur/whats_some_brutally_honest_advice_everyone_should/,JMiracle2019
1k1w71z,reddit,What’s a secret that you’ve hid from everybody?,,2025-04-18 04:13:59,AskReddit,AskReddit,news,News,[],0,85,330,,0.83,https://www.reddit.com/r/AskReddit/comments/1k1w71z/whats_a_secret_that_youve_hid_from_everybody/,HourDifficult2994
1k35be8,reddit,What’s your favorite drink?,,2025-04-19 20:17:56,AskReddit,AskReddit,news,News,[],0,85,527,,0.89,https://www.reddit.com/r/AskReddit/comments/1k35be8/whats_your_favorite_drink/,NorthernVast
1jo4vzj,reddit,what do u do on your bday?,,2025-03-31 14:45:20,AskReddit,AskReddit,news,News,[],0,85,530,,0.84,https://www.reddit.com/r/AskReddit/comments/1jo4vzj/what_do_u_do_on_your_bday/,mewitoooo
1jl90sz,reddit,"What is the most disturbing tech news you’ve seen recently, and why should we all be worried?",,2025-03-27 17:10:03,AskReddit,AskReddit,news,News,[],0,84,131,,0.76,https://www.reddit.com/r/AskReddit/comments/1jl90sz/what_is_the_most_disturbing_tech_news_youve_seen/,Individual-Gas5276
1k6dzf2,reddit,What's your favorite food?,,2025-04-23 23:42:42,AskReddit,AskReddit,news,News,[],0,84,270,,0.95,https://www.reddit.com/r/AskReddit/comments/1k6dzf2/whats_your_favorite_food/,Think_Departure1027
1jy8ona,reddit,What is your biggest regret in life?,,2025-04-13 14:18:13,AskReddit,AskReddit,news,News,[],0,86,297,,0.93,https://www.reddit.com/r/AskReddit/comments/1jy8ona/what_is_your_biggest_regret_in_life/,endlessshampoo
1jt37zt,reddit,Which famous singer is all hype but can’t actually sing?,,2025-04-06 20:09:19,AskReddit,AskReddit,news,News,[],0,84,647,,0.83,https://www.reddit.com/r/AskReddit/comments/1jt37zt/which_famous_singer_is_all_hype_but_cant_actually/,downrightunhappiness
1jpakdb,reddit,"To you, what is life’s greatest everyday honor?",,2025-04-01 23:45:57,AskReddit,AskReddit,news,News,[],0,83,69,,0.93,https://www.reddit.com/r/AskReddit/comments/1jpakdb/to_you_what_is_lifes_greatest_everyday_honor/,BiggieTwiggy1two3
1k38tee,reddit,What’s something you crave for every time?,,2025-04-19 23:06:14,AskReddit,AskReddit,news,News,[],0,81,507,,0.88,https://www.reddit.com/r/AskReddit/comments/1k38tee/whats_something_you_crave_for_every_time/,Remarkable_Tree_1415
1jzmn6a,reddit,What’s the most loving thing someone has ever said to you?,,2025-04-15 08:21:28,AskReddit,AskReddit,news,News,[],0,84,127,,0.91,https://www.reddit.com/r/AskReddit/comments/1jzmn6a/whats_the_most_loving_thing_someone_has_ever_said/,naeraee
1jz279l,reddit,What is something sad but you personally have no empathy or just dont care as much as other people?,,2025-04-14 15:49:53,AskReddit,AskReddit,news,News,[],0,81,256,,0.94,https://www.reddit.com/r/AskReddit/comments/1jz279l/what_is_something_sad_but_you_personally_have_no/,slimfemzi
1jugzbr,reddit,What would you do if you were invisible for 24 hours?,,2025-04-08 15:54:52,AskReddit,AskReddit,news,News,[],0,86,251,,0.89,https://www.reddit.com/r/AskReddit/comments/1jugzbr/what_would_you_do_if_you_were_invisible_for_24/,talthebratx
1jn2efx,reddit,"If you woke up tomorrow as the opposite gender, what’s the first thing you’d do?",,2025-03-30 02:10:36,AskReddit,AskReddit,news,News,[],0,81,816,,0.71,https://www.reddit.com/r/AskReddit/comments/1jn2efx/if_you_woke_up_tomorrow_as_the_opposite_gender/,Unique-Necessary-888
1k4wxjk,reddit,"If there was a doll of you, what phrases would it say when its string was pulled?",,2025-04-22 03:40:26,AskReddit,AskReddit,news,News,[],0,83,339,,0.89,https://www.reddit.com/r/AskReddit/comments/1k4wxjk/if_there_was_a_doll_of_you_what_phrases_would_it/,Pithecanthropus88
1jwr39s,reddit,What lead you to start/stop going to the gym?,,2025-04-11 14:22:35,AskReddit,AskReddit,news,News,[],0,77,390,,0.92,https://www.reddit.com/r/AskReddit/comments/1jwr39s/what_lead_you_to_startstop_going_to_the_gym/,IlIlIllIlIllIlIlIIll
1jlwsul,reddit,what is the worst job you had but paid is very good?,,2025-03-28 14:48:25,AskReddit,AskReddit,news,News,[],0,79,244,,0.85,https://www.reddit.com/r/AskReddit/comments/1jlwsul/what_is_the_worst_job_you_had_but_paid_is_very/,throwbackblue
1k6ak2f,reddit,What's the worst song to lose your virginity to?,,2025-04-23 21:12:08,AskReddit,AskReddit,news,News,[],0,82,530,,0.78,https://www.reddit.com/r/AskReddit/comments/1k6ak2f/whats_the_worst_song_to_lose_your_virginity_to/,Nyarro
1k4w8ln,reddit,What job would you want if you were guaranteed to succeed?,,2025-04-22 03:03:44,AskReddit,AskReddit,news,News,[],0,81,359,,0.91,https://www.reddit.com/r/AskReddit/comments/1k4w8ln/what_job_would_you_want_if_you_were_guaranteed_to/,Ice-wookman
1jv5qt5,reddit,What’s the most taboo fantasy you’ve ever had that you’d be willing to share?,,2025-04-09 13:26:31,AskReddit,AskReddit,news,News,[],0,79,466,,0.68,https://www.reddit.com/r/AskReddit/comments/1jv5qt5/whats_the_most_taboo_fantasy_youve_ever_had_that/,sir_cums_alott
1jswnad,reddit,"Old people of Reddit, how do you feel about new technology?",,2025-04-06 15:26:07,AskReddit,AskReddit,news,News,[],0,79,103,,0.91,https://www.reddit.com/r/AskReddit/comments/1jswnad/old_people_of_reddit_how_do_you_feel_about_new/,Shayaan5612
1jx7ghr,reddit,How quickly would you leave your job if you didn’t need the money?,,2025-04-12 02:48:09,AskReddit,AskReddit,news,News,[],0,78,316,,0.92,https://www.reddit.com/r/AskReddit/comments/1jx7ghr/how_quickly_would_you_leave_your_job_if_you_didnt/,N/A
1jvk282,reddit,What is the most positive change that you’ve ever made in your life?,,2025-04-09 23:33:42,AskReddit,AskReddit,news,News,[],0,82,164,,0.93,https://www.reddit.com/r/AskReddit/comments/1jvk282/what_is_the_most_positive_change_that_youve_ever/,zefjen
1jl7pxi,reddit,"What’s something your parents were right about, but you didn’t realize until you got older?",,2025-03-27 16:16:00,AskReddit,AskReddit,news,News,[],0,77,346,,0.88,https://www.reddit.com/r/AskReddit/comments/1jl7pxi/whats_something_your_parents_were_right_about_but/,Weary-Ad3396
1k73lcj,reddit,"Redditors who’ve quit clubs, jobs or friend-groups that lost their original purpose, what was the tipping point?",,2025-04-24 21:13:06,AskReddit,AskReddit,news,News,[],0,106,173,,0.81,https://www.reddit.com/r/AskReddit/comments/1k73lcj/redditors_whove_quit_clubs_jobs_or_friendgroups/,saltexx
1k06680,reddit,"You are laying on your deathbed and have 5 minutes of life left, what do you say or do?",,2025-04-15 23:24:15,AskReddit,AskReddit,news,News,[],0,79,371,,0.84,https://www.reddit.com/r/AskReddit/comments/1k06680/you_are_laying_on_your_deathbed_and_have_5/,Hot_Account5089
1jx4bn4,reddit,What song would you like to never hear again?,,2025-04-11 23:59:17,AskReddit,AskReddit,news,News,[],0,80,587,,0.88,https://www.reddit.com/r/AskReddit/comments/1jx4bn4/what_song_would_you_like_to_never_hear_again/,Immola0069
1jr1fza,reddit,What non-political topics always start big arguments online?,,2025-04-04 02:39:13,AskReddit,AskReddit,news,News,[],0,78,862,,0.78,https://www.reddit.com/r/AskReddit/comments/1jr1fza/what_nonpolitical_topics_always_start_big/,BobbyDoWhat
1jyl3qw,reddit,Whats the first thing youre doing after coming home?,,2025-04-13 23:30:55,AskReddit,AskReddit,news,News,[],0,77,216,,0.97,https://www.reddit.com/r/AskReddit/comments/1jyl3qw/whats_the_first_thing_youre_doing_after_coming/,Connect_Brother8205
1jm3wtg,reddit,What is the greatest mystery that still hasn’t been solved?,,2025-03-28 19:51:07,AskReddit,AskReddit,news,News,[],0,79,153,,0.94,https://www.reddit.com/r/AskReddit/comments/1jm3wtg/what_is_the_greatest_mystery_that_still_hasnt/,Naive-Shallot-5016
1jl5nto,reddit,"People who married someone because you got pregnant with them, how did that turn out for you ?",,2025-03-27 14:48:50,AskReddit,AskReddit,news,News,[],0,76,117,,0.84,https://www.reddit.com/r/AskReddit/comments/1jl5nto/people_who_married_someone_because_you_got/,ShadowInTheSun_
1k6rblf,reddit,When has your body betrayed you?,,2025-04-24 12:46:45,AskReddit,AskReddit,news,News,[],0,80,258,,0.91,https://www.reddit.com/r/AskReddit/comments/1k6rblf/when_has_your_body_betrayed_you/,Wickham12
1k3z2k6,reddit,"How likely do you think it is that we'll confirm the existence of life on other planets soon, and why?",,2025-04-20 23:08:04,AskReddit,AskReddit,news,News,[],0,78,107,,0.82,https://www.reddit.com/r/AskReddit/comments/1k3z2k6/how_likely_do_you_think_it_is_that_well_confirm/,SofiaReddNY
1jy3zln,reddit,who do you think are the most important people in your life?,,2025-04-13 09:39:32,AskReddit,AskReddit,news,News,[],0,80,52,,0.94,https://www.reddit.com/r/AskReddit/comments/1jy3zln/who_do_you_think_are_the_most_important_people_in/,Sexarr
1jsqmhn,reddit,Which accent gives you the warm tingly feels?,,2025-04-06 09:52:09,AskReddit,AskReddit,news,News,[],0,76,455,,0.87,https://www.reddit.com/r/AskReddit/comments/1jsqmhn/which_accent_gives_you_the_warm_tingly_feels/,TantricFrancescaCare
1jmpq62,reddit,What advice would you give your 15 year old self?,,2025-03-29 16:12:08,AskReddit,AskReddit,news,News,[],0,78,486,,0.86,https://www.reddit.com/r/AskReddit/comments/1jmpq62/what_advice_would_you_give_your_15_year_old_self/,Sad_Cow_577
1k6o8qo,reddit,What do you want to be remembered for?,,2025-04-24 09:47:01,AskReddit,AskReddit,news,News,[],0,79,231,,0.91,https://www.reddit.com/r/AskReddit/comments/1k6o8qo/what_do_you_want_to_be_remembered_for/,chessenthusiasticguy
1jzdgpz,reddit,"When you hear indigo, what color do you think of?",,2025-04-14 23:39:01,AskReddit,AskReddit,news,News,[],0,78,472,,0.79,https://www.reddit.com/r/AskReddit/comments/1jzdgpz/when_you_hear_indigo_what_color_do_you_think_of/,fl0werlilly
1jr308p,reddit,How did you pick your username?,,2025-04-04 04:03:40,AskReddit,AskReddit,news,News,[],0,78,627,,0.77,https://www.reddit.com/r/AskReddit/comments/1jr308p/how_did_you_pick_your_username/,Alternative-Doubt37
1k5vmix,reddit,"What do you do to unplug and decompress from all the political ""stuff""?",,2025-04-23 10:17:15,AskReddit,AskReddit,news,News,[],0,77,322,,0.77,https://www.reddit.com/r/AskReddit/comments/1k5vmix/what_do_you_do_to_unplug_and_decompress_from_all/,Hydrated_and_Happy
1k0b5og,reddit,"People who got really fucked by life, how did you get over it?",,2025-04-16 03:41:39,AskReddit,AskReddit,news,News,[],0,76,217,,0.94,https://www.reddit.com/r/AskReddit/comments/1k0b5og/people_who_got_really_fucked_by_life_how_did_you/,myyamayybe
1jwwydy,reddit,"Do you believe in soulmates, and why or why not?",,2025-04-11 18:29:20,AskReddit,AskReddit,news,News,[],0,75,187,,0.87,https://www.reddit.com/r/AskReddit/comments/1jwwydy/do_you_believe_in_soulmates_and_why_or_why_not/,TazeMyFace5085
1k5sktv,reddit,Who do you think is the greatest singer of all time?,,2025-04-23 06:38:21,AskReddit,AskReddit,news,News,[],0,70,480,,0.79,https://www.reddit.com/r/AskReddit/comments/1k5sktv/who_do_you_think_is_the_greatest_singer_of_all/,Anxious-End8006
1jr0fgh,reddit,What’s one thing civilians don’t understand about military life?,,2025-04-04 01:47:07,AskReddit,AskReddit,news,News,[],0,75,296,,0.71,https://www.reddit.com/r/AskReddit/comments/1jr0fgh/whats_one_thing_civilians_dont_understand_about/,GrimReap_07
1jod4c5,reddit,What's the ONE thing you're an elitist snob about?,,2025-03-31 20:23:02,AskReddit,AskReddit,news,News,[],0,71,740,,0.79,https://www.reddit.com/r/AskReddit/comments/1jod4c5/whats_the_one_thing_youre_an_elitist_snob_about/,OvertOperation
1jkhauo,reddit,What life changing item can you buy for less than hundred dollar?,,2025-03-26 17:24:45,AskReddit,AskReddit,news,News,[],0,73,97,,0.83,https://www.reddit.com/r/AskReddit/comments/1jkhauo/what_life_changing_item_can_you_buy_for_less_than/,theflowaway
1k6zczx,reddit,What's something your sibling did that you're still salty about to this day?,,2025-04-24 18:20:09,AskReddit,AskReddit,news,News,[],0,83,248,,0.96,https://www.reddit.com/r/AskReddit/comments/1k6zczx/whats_something_your_sibling_did_that_youre_still/,im_always_in_agony
1k4xaxz,reddit,What’s the most realistic doomsday scenario?,,2025-04-22 04:01:01,AskReddit,AskReddit,news,News,[],0,72,190,,0.88,https://www.reddit.com/r/AskReddit/comments/1k4xaxz/whats_the_most_realistic_doomsday_scenario/,Creative-Category-60
1jtenfq,reddit,Why are you awake right now?,,2025-04-07 06:19:52,AskReddit,AskReddit,news,News,[],0,70,673,,0.69,https://www.reddit.com/r/AskReddit/comments/1jtenfq/why_are_you_awake_right_now/,FredJenkins1414
1jrsxzf,reddit,What type of burger person are you?,,2025-04-05 02:09:48,AskReddit,AskReddit,news,News,[],0,71,503,,0.89,https://www.reddit.com/r/AskReddit/comments/1jrsxzf/what_type_of_burger_person_are_you/,aaukson
1jludtn,reddit,Which decade had the worst clothes and make-up for women?,,2025-03-28 12:54:30,AskReddit,AskReddit,news,News,[],0,75,193,,0.72,https://www.reddit.com/r/AskReddit/comments/1jludtn/which_decade_had_the_worst_clothes_and_makeup_for/,Banana5scaleX
1jyycvm,reddit,Whats one last sound effect you would choose right before you die?,,2025-04-14 13:04:02,AskReddit,AskReddit,news,News,[],0,72,232,,0.9,https://www.reddit.com/r/AskReddit/comments/1jyycvm/whats_one_last_sound_effect_you_would_choose/,Wise_Egg_6889
1juuj1n,reddit,What is your take on repost bots taking over the front page? Should it be restricted? What can we do to improve things?,,2025-04-09 01:48:21,AskReddit,AskReddit,news,News,[],0,70,16,,0.85,https://www.reddit.com/r/AskReddit/comments/1juuj1n/what_is_your_take_on_repost_bots_taking_over_the/,gloriousPurpose33
1juk2vu,reddit,"redditors who actually took ""divorce them"" advice from reddit, how's it working out now?",,2025-04-08 18:00:23,AskReddit,AskReddit,news,News,[],0,74,35,,0.85,https://www.reddit.com/r/AskReddit/comments/1juk2vu/redditors_who_actually_took_divorce_them_advice/,pro-dicc-sucker
1jrxmm7,reddit,Which country would you never visit and why?,,2025-04-05 06:59:10,AskReddit,AskReddit,news,News,[],0,71,469,,0.89,https://www.reddit.com/r/AskReddit/comments/1jrxmm7/which_country_would_you_never_visit_and_why/,Glad_Diamond_2103
1jsi6c6,reddit,What is something you have but never have used?,,2025-04-06 00:46:57,AskReddit,AskReddit,news,News,[],0,67,392,,0.92,https://www.reddit.com/r/AskReddit/comments/1jsi6c6/what_is_something_you_have_but_never_have_used/,kimmie1111
1k6zfsp,reddit,What are the “little things”that matter in a relationship?,,2025-04-24 18:23:22,AskReddit,AskReddit,news,News,[],0,76,144,,0.92,https://www.reddit.com/r/AskReddit/comments/1k6zfsp/what_are_the_little_thingsthat_matter_in_a/,Toomad316
1k5vu3f,reddit,What's something you’ve healed from that you thought you never would?,,2025-04-23 10:30:55,AskReddit,AskReddit,news,News,[],0,67,129,,0.89,https://www.reddit.com/r/AskReddit/comments/1k5vu3f/whats_something_youve_healed_from_that_you/,sweetsilentmisery
1k2ojn4,reddit,What’s the funniest song lyric you can think of off the top of your head?,,2025-04-19 04:55:03,AskReddit,AskReddit,news,News,[],0,72,419,,0.9,https://www.reddit.com/r/AskReddit/comments/1k2ojn4/whats_the_funniest_song_lyric_you_can_think_of/,AspiringOccultist4
1k173ln,reddit,"People that grew up dirt poor and now aren't dirt poor, how nice is it to open your fridge and see a week's worth of food?",,2025-04-17 07:33:55,AskReddit,AskReddit,news,News,[],0,69,72,,0.85,https://www.reddit.com/r/AskReddit/comments/1k173ln/people_that_grew_up_dirt_poor_and_now_arent_dirt/,Majestic-General7325
1jlqqk8,reddit,"Gamers of reddit, what was the 1st game you ever played?",,2025-03-28 08:59:13,AskReddit,AskReddit,news,News,[],0,70,412,,0.86,https://www.reddit.com/r/AskReddit/comments/1jlqqk8/gamers_of_reddit_what_was_the_1st_game_you_ever/,eRr0rWZ
1jkkdp5,reddit,What invalidates an argument for you?,,2025-03-26 19:30:24,AskReddit,AskReddit,news,News,[],0,69,462,,0.83,https://www.reddit.com/r/AskReddit/comments/1jkkdp5/what_invalidates_an_argument_for_you/,Liamrww
1jyit0r,reddit,What's your best pickup line?,,2025-04-13 21:39:38,AskReddit,AskReddit,news,News,[],0,64,193,,0.88,https://www.reddit.com/r/AskReddit/comments/1jyit0r/whats_your_best_pickup_line/,Substantial-Stock430
1jxxgah,reddit,"If money were not an issue, where in the world would you like to live?",,2025-04-13 02:20:23,AskReddit,AskReddit,news,News,[],0,65,348,,0.92,https://www.reddit.com/r/AskReddit/comments/1jxxgah/if_money_were_not_an_issue_where_in_the_world/,Ok-Data-7672
1jwxn0t,reddit,What are some things you miss in life that will likely never come back?,,2025-04-11 18:58:20,AskReddit,AskReddit,news,News,[],0,65,298,,0.93,https://www.reddit.com/r/AskReddit/comments/1jwxn0t/what_are_some_things_you_miss_in_life_that_will/,backspace_cars
1jrrpaw,reddit,What’s a smell that instantly takes you back to your childhood?,,2025-04-05 01:03:13,AskReddit,AskReddit,news,News,[],0,65,296,,0.97,https://www.reddit.com/r/AskReddit/comments/1jrrpaw/whats_a_smell_that_instantly_takes_you_back_to/,Shadi_TP
1jo4g7y,reddit,Whats something that you realized way too late in life?,,2025-03-31 14:26:05,AskReddit,AskReddit,news,News,[],0,62,212,,0.87,https://www.reddit.com/r/AskReddit/comments/1jo4g7y/whats_something_that_you_realized_way_too_late_in/,rainbowun1cornfarts
1jndckq,reddit,"If aliens asked you to prove humanity isn’t stupid, what’s the worst example you could accidentally show them?",,2025-03-30 14:16:01,AskReddit,AskReddit,news,News,[],0,63,265,,0.81,https://www.reddit.com/r/AskReddit/comments/1jndckq/if_aliens_asked_you_to_prove_humanity_isnt_stupid/,Wide_Magazine1453
1k56dr2,reddit,What lesser known mobile app do you rely on and would recommend?,,2025-04-22 13:31:34,AskReddit,AskReddit,news,News,[],0,64,85,,0.9,https://www.reddit.com/r/AskReddit/comments/1k56dr2/what_lesser_known_mobile_app_do_you_rely_on_and/,toasterstrewdal
1jyl2h6,reddit,Whats the hardest thing to accept as an adult?,,2025-04-13 23:29:11,AskReddit,AskReddit,news,News,[],0,63,177,,0.89,https://www.reddit.com/r/AskReddit/comments/1jyl2h6/whats_the_hardest_thing_to_accept_as_an_adult/,Deep-Salamander2360
1jwee7h,reddit,"What’s something people think is healthy, but actually isn’t?",,2025-04-11 01:34:24,AskReddit,AskReddit,news,News,[],0,67,296,,0.85,https://www.reddit.com/r/AskReddit/comments/1jwee7h/whats_something_people_think_is_healthy_but/,Separate_Function_81
1jm38l9,reddit,What is worst than dead?,,2025-03-28 19:22:21,AskReddit,AskReddit,news,News,[],0,65,590,,0.7,https://www.reddit.com/r/AskReddit/comments/1jm38l9/what_is_worst_than_dead/,AdeptDinner7997
1jkwlbp,reddit,"Have you ever given a sexual favor, what was it and what was the reasoning for it?",,2025-03-27 05:14:11,AskReddit,AskReddit,news,News,[],0,67,268,,0.63,https://www.reddit.com/r/AskReddit/comments/1jkwlbp/have_you_ever_given_a_sexual_favor_what_was_it/,OwlInTheNightSky
1jkpoq3,reddit,What is your near-death experience?,,2025-03-26 23:14:56,AskReddit,AskReddit,news,News,[],0,60,134,,0.88,https://www.reddit.com/r/AskReddit/comments/1jkpoq3/what_is_your_neardeath_experience/,apocalyptic_madness2
1k5iuec,reddit,"If you randomly received 20 million dollars in your bank account, what would you do first?",,2025-04-22 21:59:40,AskReddit,AskReddit,news,News,[],0,59,450,,0.72,https://www.reddit.com/r/AskReddit/comments/1k5iuec/if_you_randomly_received_20_million_dollars_in/,Virtual-Influence961
1k57ta5,reddit,"What is something you find immature, but no one really seems to bat an eye at it?",,2025-04-22 14:33:44,AskReddit,AskReddit,news,News,[],0,61,309,,0.83,https://www.reddit.com/r/AskReddit/comments/1k57ta5/what_is_something_you_find_immature_but_no_one/,Ok_Student1641
1k1zkkv,reddit,What would you like to get off your chest?,,2025-04-18 07:59:27,AskReddit,AskReddit,news,News,[],0,64,306,,0.9,https://www.reddit.com/r/AskReddit/comments/1k1zkkv/what_would_you_like_to_get_off_your_chest/,Audioflynn1
1jp9gtt,reddit,What April fools pranks have you experienced that went too far?,,2025-04-01 22:56:48,AskReddit,AskReddit,news,News,[],0,64,61,,0.88,https://www.reddit.com/r/AskReddit/comments/1jp9gtt/what_april_fools_pranks_have_you_experienced_that/,Roosonly
1k6nfdh,reddit,What’s something you learned way too late in life?,,2025-04-24 08:47:53,AskReddit,AskReddit,news,News,[],0,66,169,,0.9,https://www.reddit.com/r/AskReddit/comments/1k6nfdh/whats_something_you_learned_way_too_late_in_life/,turkishdad3
1k5wktm,reddit,What song have you been listening to on repeat?,,2025-04-23 11:16:41,AskReddit,AskReddit,news,News,[],0,59,203,,0.92,https://www.reddit.com/r/AskReddit/comments/1k5wktm/what_song_have_you_been_listening_to_on_repeat/,completedonut
1k3pdjd,reddit,What age do you feel like on the inside?,,2025-04-20 15:42:14,AskReddit,AskReddit,news,News,[],0,64,253,,0.91,https://www.reddit.com/r/AskReddit/comments/1k3pdjd/what_age_do_you_feel_like_on_the_inside/,No-Cantaloupe2132
1jz4i9z,reddit,What’s the most interesting true crime case that you’ve read/heard of?,,2025-04-14 17:24:09,AskReddit,AskReddit,news,News,[],0,64,73,,0.88,https://www.reddit.com/r/AskReddit/comments/1jz4i9z/whats_the_most_interesting_true_crime_case_that/,hotsexydinosaur
1jyr15a,reddit,What’s the worst/weirdest thing an ex has ever done to you after a breakup?,,2025-04-14 05:02:55,AskReddit,AskReddit,news,News,[],0,60,187,,0.89,https://www.reddit.com/r/AskReddit/comments/1jyr15a/whats_the_worstweirdest_thing_an_ex_has_ever_done/,Independent-Bat9545
1jvz4b9,reddit,What is the worst example of penny pinching you’ve witnessed?,,2025-04-10 14:21:45,AskReddit,AskReddit,news,News,[],0,61,315,,0.85,https://www.reddit.com/r/AskReddit/comments/1jvz4b9/what_is_the_worst_example_of_penny_pinching_youve/,littlemissmoxie
1k3qb9r,reddit,What’s a sign someone was never taught basic respect growing up?,,2025-04-20 16:24:11,AskReddit,AskReddit,news,News,[],0,58,131,,0.76,https://www.reddit.com/r/AskReddit/comments/1k3qb9r/whats_a_sign_someone_was_never_taught_basic/,BlueNovember1234
1jmxb4q,reddit,"Reddit, what’s your favourite quote?",,2025-03-29 21:55:52,AskReddit,AskReddit,news,News,[],0,58,433,,0.83,https://www.reddit.com/r/AskReddit/comments/1jmxb4q/reddit_whats_your_favourite_quote/,TheMetalicAngel
1k759cw,reddit,What's the thing you love the most about yourself ?,,2025-04-24 22:26:21,AskReddit,AskReddit,news,News,[],0,71,249,,0.91,https://www.reddit.com/r/AskReddit/comments/1k759cw/whats_the_thing_you_love_the_most_about_yourself/,sharingp
