Title,Score,ID,URL,Num_comments,Created_utc
We open a bookstore because we hate skibidi toilet ,851,1fy2t86,https://www.reddit.com/gallery/1fy2t86,60,1728289744.0
Vietnamese Community in Australia Celebrates the Lunar New Year 2024,848,1at270t,https://www.reddit.com/gallery/1at270t,482,1708177165.0
Superpowers of Vietnam. #1-The ability to nap anywhere,847,lbcxxy,https://i.redd.it/34g7a5s286f61.png,49,1612318136.0
Why Vietnam decide to make their language like this??,849,d8sv3x,https://i.redd.it/283s27ihplo31.jpg,133,1569356632.0
Sưs,839,xno1fs,https://i.redd.it/bclovxubg0q91.jpg,30,1664114185.0
A post on the occasion of Ha Noi’s Liberation Day,842,q56q1u,https://i.redd.it/nb4ozd9s4ms71.jpg,87,1633867289.0
Being a foreigner doesn't mean you can violate the law without consequence,840,1c14ozg,https://www.reddit.com/gallery/1c14ozg,185,1712805024.0
never really remebered all the pronouns to call my maternal relatives,843,w90mlh,https://i.redd.it/qwohf749f0e91.jpg,85,1658883646.0
Vietnam's cursed images #114,840,19172dp,https://www.reddit.com/gallery/19172dp,67,1704672638.0
Found in my local Vincom,838,my9wug,https://i.redd.it/frrz7o4p2cv61.jpg,31,1619362536.0
Photo taken in Da Lat this evening,837,1fm2f5q,https://i.redd.it/mqt6uzc4u5qd1.jpeg,48,1726923479.0
Drones show in Hanoi,836,1amlq2n,https://v.redd.it/coyltj24ljhc1,42,1707476803.0
"So I was eating lunch, and a fish just walked on by. I was nowhere near water.",833,13dibyf,https://i.redd.it/t77rh2377yya1.jpg,97,1683700083.0
A painting I made of some workers in Saigon,841,j1rm7s,https://i.redd.it/hzexc35zb0q51.jpg,61,1601350603.0
Congratulation Viet Nam National Team!!!!,835,o0tur1,https://i.redd.it/4rr0d7029j571.jpg,36,1623807899.0
"Are people that really dumb that we keep getting ""Why do Vietnamese people don't do X like westerners do?""",832,15f8nfq,https://www.reddit.com/r/VietNam/comments/15f8nfq/are_people_that_really_dumb_that_we_keep_getting/,331,1690885836.0
Vietnam's cursed images #2,829,peup54,https://www.reddit.com/gallery/peup54,93,1630369049.0
How to start a war,831,sg6s7y,https://i.redd.it/rn2wtjz13te81.jpg,154,1643540114.0
Vietnamese students right now,826,o9jpji,https://i.redd.it/axjrth7u70871.jpg,99,1624885005.0
Yup!,823,hsqb25,https://i.redd.it/qjz25px0wcb51.gif,52,1594965012.0
Young boy already set sights on Vietnam,819,1fgcxa2,https://v.redd.it/fstp9colthod1,166,1726283722.0
Vietnamese's cursed images #97,821,13ueu2t,https://www.reddit.com/gallery/13ueu2t,41,1685317491.0
Me after one month of traveling Việt Nam,821,zjt1rm,https://i.redd.it/qqb7714n2h5a1.jpg,144,1670835119.0
"Vietnam strongly prefers to ally with USA over China, in stark contrast to SE Asia neighbors.",816,1c22j7l,https://i.redd.it/kojzyeh1xztc1.jpeg,577,1712904677.0
R.I.P,820,k9otxx,https://i.redd.it/2ucjq0joq4461.jpg,65,1607505867.0
It really is like that!,819,iiprho,https://i.redd.it/ontfc4eqwwj51.jpg,24,1598694064.0
Crocodile bread,816,m6qnn7,https://i.redd.it/g32twwi98in61.jpg,39,1615950263.0
Classic example of the epitome of vietnamese's society,817,15de4jh,https://i.redd.it/fuef3uhlo1fb1.jpg,413,1690697809.0
Why countries adopted the Latin alphabet ,815,1hleysd,https://i.redd.it/qin8g3hp8p8e1.jpeg,143,1735051554.0
"Vietnamese astronaut Phạm Tuân, who became the first Vietnamese and non-Soviet Asian to fly in space, with Soviet cosmonaut Viktor Gorbatko. They both took part in the 1980 Soyuz 37 mission.",811,j109oe,https://www.reddit.com/gallery/j109oe,78,1601245772.0
Winning Photo of Jon Enoch for Smithsonian Photo Contest 2020,820,gd1iss,https://i.redd.it/j2b6dlgw7nw41.jpg,41,1588552247.0
May god be with us i guess,817,fnuccf,https://i.redd.it/k3vmo63jaio41.jpg,48,1585005812.0
"I thought buses are great in Vietnam, then I stuck in this",814,1jifti1,https://www.reddit.com/gallery/1jifti1,243,1742780977.0
"(NSFW) Alleged sexual assault at Vietnamese military school [TW - rape, suicide]",814,1098qxd,https://www.reddit.com/r/VietNam/comments/1098qxd/nsfw_alleged_sexual_assault_at_vietnamese/,297,1673454205.0
"Vietnam, 1st day of every Tet holiday",814,10ibf91,https://i.redd.it/1hux1eonhkda1.jpg,72,1674363273.0
Today would have been Anthony Bourdain’s birthday. Here he is eating street food in Vietnam. ,817,1donk8x,https://i.redd.it/r77rzceust8d1.jpeg,72,1719368347.0
Comically big muscles,812,1b4q5wo,https://i.redd.it/y3sokozqqxlc1.jpeg,61,1709391565.0
"Gotta make you wonder who own pages like Tifosi, BeatVN, Battle Cry,hmn....",806,13t3b6l,https://i.redd.it/mwzo0lnejc2b1.jpg,227,1685181243.0
Alpha Basepilled Vietnamese vs Virgin Dad,813,o65p3w,https://i.redd.it/8yb29r9w2y671.jpg,106,1624423281.0
The bus' stop button was busted so they had to get creative,812,1b9jw90,https://i.redd.it/6bh2t2a3u2nc1.jpeg,27,1709889082.0
Isn't vietnamese such a beautiful language?,810,ume3k0,https://i.redd.it/4qxvohsk2my81.png,65,1652172226.0
:),808,18ql057,https://i.redd.it/fzmpug2qog8c1.jpeg,192,1703519086.0
Gay what?,808,15skj7w,https://i.redd.it/bwim1u82ufib1.png,79,1692176715.0
Makes me so upset ,803,1ex4il1,https://v.redd.it/5l99708odvjd1,459,1724181918.0
Happy Birthday Sir!,807,nfu3rr,https://i.redd.it/83g2hv2gszz61.png,85,1621393072.0
We've reached peak culture,809,e3zoff,https://v.redd.it/e10gtaj1wu141,70,1575133826.0
Delivery guy meant to say he's arrived but instead in the context of conversation hilariously tells me to get out of Vietnam instead (made my day),799,1gffsfg,https://i.redd.it/rubngo6d2uxd1.png,74,1730267773.0
The Four Horseman of Vietnamese not giving a fuck,806,pp2pye,https://i.redd.it/n4mjrdc2ukn71.jpg,29,1631752586.0
This lady is a saint.,809,1chw9kr,https://i.redd.it/emnoqdokjvxc1.jpeg,103,1714595115.0
What absolute nonsense is Saigon airport ,800,1hzqixs,https://www.reddit.com/r/VietNam/comments/1hzqixs/what_absolute_nonsense_is_saigon_airport/,293,1736699624.0
"I saw another white guy post about himself wearing Áo dài, so I thought I’d do the same thing.",800,145ryx0,https://i.redd.it/e07l0lb9r45b1.jpg,67,1686376537.0
Tourists participating in the Open Water Olympics in Hanoi 🙏,800,1f06xml,https://v.redd.it/im3hobrkjmkd1,176,1724510676.0
Noodle is noodle!,797,mnfnld,https://i.redd.it/rzkpc3wv05s61.jpg,48,1617969630.0
My Grandparents in Vietnam (1960s),792,i0ytrj,https://i.redd.it/3ewzp4jdv0e51.jpg,53,1596159921.0
Peak slogan,803,1glitkx,https://i.redd.it/102u7enfvezd1.jpeg,52,1730955511.0
Real,796,16924eg,https://www.reddit.com/gallery/16924eg,75,1693760459.0
Hanoi has been named the 'world's most polluted city' that 25m tourists a year visit anyway,796,1iad7ba,https://www.the-express.com/news/world-news/161653/worlds-most-polluted-city-hanoi-vietnam-tourism,102,1737894161.0
This image caused Barbie to be banned from Vietnam.,792,14tr7ne,https://i.redd.it/31plg9e7knab1.jpg,309,1688783551.0
Is this a normal day in Vietnam military environment?,792,14scthl,https://www.reddit.com/gallery/14scthl,347,1688657879.0
Title,792,nlwhsf,https://i.redd.it/2vez2gkkek171.jpg,25,1622078506.0
Everything is connected!,791,izkgne,https://i.redd.it/xmu8hxz21bp51.jpg,61,1601044265.0
Hanoi is the second most polluted air in the world?!,794,18th2ic,https://i.redd.it/zxzib0nxn69c1.png,237,1703833556.0
Look how much i got,791,1ihaac9,https://i.redd.it/279ex7gw22he1.jpeg,78,1738645899.0
"Chinese, Japanese and Korean expats are the worst",790,197a4aq,https://www.reddit.com/r/VietNam/comments/197a4aq/chinese_japanese_and_korean_expats_are_the_worst/,562,1705329241.0
bucket gang,790,sh09cc,https://i.redd.it/20xcsa7vp0f81.jpg,21,1643632533.0
"Alice in Wonderland in the style of Đông Hồ traditional paintings, by artist Anh Khoa Phung Nguyen",786,lm9oyb,https://i.redd.it/twqbdk66x4i61.jpg,13,1613609902.0
Saw this in r/newzealand and its great to see some people appreciating Vietnam's response (Original post by u/rhododendronz),787,g6qbsj,https://i.redd.it/k2z9cf4vllu41.png,99,1587661115.0
Unpopular I don’t like Vietnam ,786,1guxc7n,https://www.reddit.com/r/VietNam/comments/1guxc7n/unpopular_i_dont_like_vietnam/,1155,1732023554.0
Vietnamese students in Da Nang love cleaning up beaches,787,1bkpeoz,https://www.reddit.com/gallery/1bkpeoz,86,1711076771.0
100 firefighters and army personnels are flying to Turkey from HCMC right now to help with the recent earthquakes,788,10xrdcw,https://i.redd.it/1cnxzns6k6ha1.jpg,46,1675938022.0
Old but gold,791,je50td,https://i.redd.it/vmwc1mxkw2u51.jpg,41,1603125135.0
Peace was never an option.,787,i5m32f,https://v.redd.it/0a6ixgh2rmf51,46,1596834229.0
Don’t visit.,784,1hq6xjd,https://www.reddit.com/gallery/1hq6xjd,92,1735619934.0
This sub is unfairly biased against Vietnam ,784,1cg117d,https://www.reddit.com/r/VietNam/comments/1cg117d/this_sub_is_unfairly_biased_against_vietnam/,295,1714402223.0
"Henry Kissinger, American diplomat and Nobel winner, dead at 100",785,1876ts1,https://www.reuters.com/world/us/henry-kissinger-american-diplomat-nobel-winner-dead-100-2023-11-30/,343,1701309893.0
I took this photo in a little back lane just off Bệnh viện during a down pour,781,dsbafw,https://i.redd.it/7spb4up0wzw31.jpg,36,1573015113.0
Same energy,783,p4t94r,https://i.redd.it/3smw9q2cvih71.jpg,200,1629033485.0
Vincrap,786,18zr092,https://www.reddit.com/gallery/18zr092,282,1704514040.0
The disadvantage of not knowing English.,784,tff2o4,https://i.redd.it/8sfkdkhi9qn81.jpg,90,1647428599.0
Vietnamese girl got her cat feasted by her own father and his friends.,784,1fc4m09,https://i.redd.it/rly6wby8pmnd1.jpeg,681,1725820110.0
Vietnam's cursed images #118,775,1bbpzmj,https://www.reddit.com/gallery/1bbpzmj,38,1710117339.0
Cute moment 😀,782,1gxx1jp,https://i.redd.it/b7vvqnzwsm2e1.jpeg,44,1732359064.0
Kareoke is a cancer on Vietnamese Society.,774,1cq84u3,https://www.reddit.com/r/VietNam/comments/1cq84u3/kareoke_is_a_cancer_on_vietnamese_society/,414,1715521277.0
Vietnam taking care of its citizens,783,lbsmx8,https://i.redd.it/5h1vqhueqaf61.jpg,117,1612372725.0
I took this photo in Saigon and edited it to try and create a more cyberpunk feel,778,homwmy,https://i.redd.it/s7le6glyg0a51.jpg,69,1594378710.0
Foreigners begging in Saigon,774,1exesqk,https://i.redd.it/uy84nqi5mxjd1.jpeg,282,1724208853.0
teacher revising the answers for our final exam ☠️ i didn't notice this when i was doing it lol,769,131e65b,https://i.redd.it/fwfef4vlnkwa1.jpg,79,1682646402.0
Vietnam has the highest real estate prices in the world for a middle-income country.,767,1f33yzp,https://i.redd.it/jvzso5duucld1.jpeg,321,1724829229.0
Let's see how UAE can counter this lineup of Vietnam in the incoming match.,770,o0btaz,https://i.redd.it/x57qrixswe571.png,57,1623755396.0
To my Vietnamese friends,767,lcz7yn,https://i.redd.it/dnj4etx55lf61.png,55,1612498756.0
"TIL that the author of of Doraemon visited Vietnam in January 1996, and set up a fund for Vietnamese children from the 2 bil VND Kim Dong publisher paid to buy Doraemon's license, reportedly because he felt bad for that Japan did to Vietnam during WWII.",773,jbnlfm,https://www.reddit.com/gallery/jbnlfm,36,1602768728.0
A rich Vietnamese family in Nguyen dynasty,771,glgsvo,https://i.redd.it/03t6bo7vacz41.jpg,36,1589727617.0
Our 2nd beach clean up exceeded all of our expectations!,770,1bo1zsh,https://www.reddit.com/gallery/1bo1zsh,52,1711438440.0
These are getting harder...,768,hk7cgr,https://i.redd.it/sum6drmfwi851.jpg,63,1593730139.0
Vung Tau city in Vietnam ... That's scary and breath-taking at the same time,768,1bjt7lf,https://v.redd.it/80v5yqhrzkpc1,52,1710980727.0
i can't unsee it now,767,xiat3m,https://i.redd.it/xp5bd4uj8to91.jpg,53,1663590971.0
Beautiful Asia Architecture,763,l11ty2,https://i.redd.it/72gwsdzr1fc61.png,50,1611117459.0
It can tho,768,dtf4mi,https://i.redd.it/pby25uznngx31.png,64,1573218142.0
The only reason why I use Reddit and not anything else like Facebook,769,159y94y,https://i.redd.it/dnaqxk72d9eb1.jpg,146,1690354929.0
Vietnam's cursed images #98,761,140x12w,https://www.reddit.com/gallery/140x12w,37,1685927000.0
